id,name,latitude,longitude,address,url,status,phone,primary-type,types,rating,rating-count,price-level
ChIJwwCS2XFA0i0RwGKRquRfi2s,Big Garden Corner,-8.656860199999999,115.25365699999999,"Sanur, Jl. Bypass Ngurah Rai, Kesiman, Denpasar Selatan, Kota Denpasar, Bali 80237, Indonesia",https://maps.google.com/?cid=7749393019539907264,OPERATIONAL,+62 812-3810-2983,tourist_attraction,tourist_attraction,4.3,6021,
ChIJ1Ux3oKhB0i0RFa8e5mPxFDY,Warung Dapur Alam,-8.6639689,115.25530420000001,"Jl. Bypass Ngurah Rai No.72, Kesiman, Kec. Denpasar Tim., Kota Denpasar, Bali 80237, Indonesia",https://maps.google.com/?cid=3897004988947148565,OPERATIONAL,+62 361 4720449,restaurant,"restaurant, food",4.7,585,
ChIJbztFdqlB0i0RjoOrKSTTrJg,Babi Guling Chinta,-8.6585795,115.25339810000001,"Jl. Bypass Ngurah Rai No.108, Kesiman, Kec. Denpasar Tim., Kota Denpasar, Bali 80228, Indonesia",https://maps.google.com/?cid=11001400142030668686,OPERATIONAL,+62 881-0370-13725,indonesian_restaurant,"indonesian_restaurant, restaurant, food",4.5,85,
ChIJHc3iAG5A0i0RSo6FD4FW7iQ,ASHOKA CAFE,-8.658131899999999,115.2542129,"87R3+PMW, Kesiman, East Denpasar, Denpasar City, Bali 80237, Indonesia",https://maps.google.com/?cid=2661159542133722698,OPERATIONAL,,cafe,"cafe, food",4.6,37,
ChIJ1TrYnvFB0i0R7PRaqWwejps,GAE ** Genta Auto Executive Bali Trans **,-8.6634481,115.25453549999999,"Jl. Bypass Ngurah Rai No.88, Kesiman Petilan, Kec. Denpasar Tim., Kota Denpasar, Bali 80237, Indonesia",https://maps.google.com/?cid=11208929974618354924,OPERATIONAL,+62 811-380-550,car_rental,car_rental,4.8,13,
ChIJE-IseiFB0i0RFC9BG3nQtAk,221 Nusa Rent cars,-8.6594357,115.2520451,"Gg. Titi Batu No.2A no 2, Kesiman, Kec. Denpasar Tim., Kota Denpasar, Bali 80237, Indonesia",https://maps.google.com/?cid=699413060716146452,OPERATIONAL,+62 818-355-638,car_rental,car_rental,4.8,16,
ChIJV-NWn_dB0i0ROSAWtOHmMJA,Kopi dari Kawan,-8.661129899999999,115.25389149999998,"Jl. Bypass Ngurah Rai, Kesiman Petilan, Kec. Denpasar Tim., Kota Denpasar, Bali 80237, Indonesia",https://maps.google.com/?cid=10390058197407113273,OPERATIONAL,+62 895-0516-7875,coffee_shop,"coffee_shop, cafe, store, food",5,110,
ChIJVXnVdHBB0i0R8DgIXDEqReA,Bali Arena Centre,-8.6612035,115.2509054,"87Q2+G96, Sumerta Kelod, East Denpasar, Denpasar City, Bali 80237, Indonesia",https://maps.google.com/?cid=16160369229374699760,OPERATIONAL,,tourist_attraction,tourist_attraction,5,7,
ChIJ25p4HuVB0i0RetJU6PyrMN0,Ayam guling kayu bakar,-8.6600003,115.2533131,"Jalan By Pass Ngurah Rai No.Padanggalak, Kesiman, Kec. Denpasar Tim., Kota Denpasar, Bali 80237, Indonesia",https://maps.google.com/?cid=15938428183982166650,OPERATIONAL,+62 819-0628-7952,restaurant,"restaurant, food",4.3,153,
ChIJRQ7UzNhB0i0R7Oe9gVrh2R4,Nasi goreng khas jakarta ibu salsa,-8.6579801,115.25608539999999,"Jl. Padang Galak, Kesiman Kertalangu, Kec. Denpasar Tim., Kota Denpasar, Bali 80237, Indonesia",https://maps.google.com/?cid=2223055669924063212,OPERATIONAL,+62 899-0433-878,indonesian_restaurant,"indonesian_restaurant, restaurant, food",4.4,14,
ChIJAWMqiZ1B0i0R6mflG27auDA,Cafe New Asri,-8.662890599999999,115.2549435,"Jl. Bypass Ngurah Rai No.9, Kesiman Petilan, Kec. Denpasar Tim., Kota Denpasar, Bali 80237, Indonesia",https://maps.google.com/?cid=3510796075984578538,OPERATIONAL,,cafe,"cafe, food",4.6,13,
ChIJCR21259B0i0RCUYKnH_hPZw,Kost-Kost Pak wayan Sedap Malam Gg. TITI BATU,-8.6584713,115.25213450000001,"Gg. Titi Batu No.2, Kesiman, Kec. Denpasar Tim., Kota Denpasar, Bali 80237, Indonesia",https://maps.google.com/?cid=11258402581691123209,OPERATIONAL,,private_guest_room,"private_guest_room, lodging",4.5,2,
ChIJ4yHiAQRB0i0RIeVRd8PuDBw,Kost krisna makmur,-8.659729,115.2545542,"Jl. Bypass Ngurah Rai Jl. Padang Galak No.170, Kesiman, Kec. Denpasar Tim., Kota Denpasar, Bali 80237, Indonesia",https://maps.google.com/?cid=2021252856070399265,OPERATIONAL,+62 822-3789-6078,private_guest_room,"private_guest_room, lodging",5,3,
ChIJO3WlLRNB0i0RoDZjIrK6y1I,Cafe Dallang,-8.6625117,115.2547685,"parkiran 1, Gg. Pasiran Jl. Padanggalak Sanur, Kesiman, Kec. Denpasar Tim., Kota Denpasar, Bali 80237, Indonesia",https://maps.google.com/?cid=5966067405626226336,OPERATIONAL,+62 823-4020-3743,cafe,"cafe, food",4.5,8,
ChIJlao3865B0i0RZ9XLLB7hjk8,Acika cafe,-8.6623178,115.2553874,"87Q4+35C, Kesiman, East Denpasar, Denpasar City, Bali 80237, Indonesia",https://maps.google.com/?cid=5732766895406044519,OPERATIONAL,,cafe,"cafe, food",5,1,
ChIJCV-nTCVB0i0RKTiBGIEpETA,baksoku 88 prasmanan,-8.6626903,115.2545648,"Jl. Bypass Ngurah Rai Jl. Padanggalak Sanur No.88AA, Kesiman, Kec. Denpasar Tim., Kota Denpasar, Bali 80237, Indonesia",https://maps.google.com/?cid=3463595222863263785,OPERATIONAL,+62 823-4024-3535,restaurant,"restaurant, food",4.7,13,
ChIJtQz14WdB0i0RkzZDevd-5ZM,Rumah sawah,-8.6618218,115.252824,"87Q3+74G, Jl. Sedap Malam, Kesiman, Kec. Denpasar Tim., Kota Denpasar, Bali 80237, Indonesia",https://maps.google.com/?cid=10657063694615393939,OPERATIONAL,,campground,"campground, park, lodging",5,1,
ChIJR47JK59B0i0Rfrrefa-l7Tg,Kafe Idola,-8.6623124,115.25540260000001,"Unnamed Road, 87Q4+35C, Kesiman Petilan, Kec. Denpasar Tim., Kota Denpasar, Bali 80237, Indonesia",https://maps.google.com/?cid=4102117008753998462,OPERATIONAL,,cafe,"cafe, food",4.5,11,
ChIJHwP1dw9B0i0RQWropiwPl0A,Wisma bulan ( sundari record),-8.6625429,115.2552111,"Kesiman Petilan, 87P4+X3P, Kesiman, Kec. Denpasar Tim., Kota Denpasar, Bali 80237, Indonesia",https://maps.google.com/?cid=4654205424363924033,OPERATIONAL,,motel,"motel, lodging",5,4,
ChIJc828HABB0i0RiqIXw2mBx0s,Kesiman denpasar,-8.6597511,115.25708689999999,"87R4+3RW, Kesiman, East Denpasar, Denpasar City, Bali, Indonesia",https://maps.google.com/?cid=5460475364454670986,OPERATIONAL,,night_club,night_club,,,
