id,name,latitude,longitude,address,url,status,phone,primary-type,types,rating,rating-count,price-level
ChIJMx05WU_V0y0RiZaxTmTz4hc,Wahyu Adhitya,-8.3945189,114.85694280000001,"JV44+5QW, Asahduren, Pekutatan, Jembrana Regency, Bali 82262, Indonesia",https://maps.google.com/?cid=1721205619751491209,OPERATIONAL,,hotel,"hotel, lodging",,,
ChIJ2doKrNbV0y0RIbkCi5KsJeE,Tempong Pojok,-8.395372100000001,114.85686559999999,"Jl. Pekutatan, Asahduren, Kec. Pekutatan, Kabupaten Jembrana, Bali 82262, Indonesia",https://maps.google.com/?cid=16223562978069494049,OPERATIONAL,+62 859-5518-3386,restaurant,"restaurant, food",5,2,
ChIJnXlA4e7V0y0RRqf8DQ3j_bA,Warung Atun,-8.3955937,114.85606310000001,"JV34+QC8, Asahduren, Pekutatan, Jembrana Regency, Bali 82262, Indonesia",https://maps.google.com/?cid=12753599364991854406,OPERATIONAL,+62 819-1707-4741,restaurant,"restaurant, food",5,2,
ChIJf-22MUfV0y0Rc3sZx0cTVjw,Warung Nanix,-8.3951268,114.8564777,"JV34+WHX, Asahduren, Pekutatan, Jembrana Regency, Bali 82262, Indonesia",https://maps.google.com/?cid=4347683689276734323,OPERATIONAL,+62 852-3899-0290,cafe,"cafe, food",5,2,
ChIJa_WPG27V0y0R5jSvbsyzXWI,Pondok Pak Wayan Geder Asahduren,-8.3962872,114.85120049999998,"JV32+JM7, Asahduren, Pekutatan, Jembrana Regency, Bali 82262, Indonesia",https://maps.google.com/?cid=7088019079162705126,OPERATIONAL,,park,park,4,2,
