id,name,latitude,longitude,address,url,status,phone,primary-type,types,rating,rating-count,price-level
ChIJX1XQQgUO0i0RkmMCRvCLXgQ,Danau Yeh Malet,-8.5414575,115.48442589999999,"Unnamed Road, Antiga Kelod, Kec. Manggis, Kabupaten Karangasem, Bali 80871, Indonesia",https://maps.google.com/?cid=314842888045486994,OPERATIONAL,,tourist_attraction,tourist_attraction,4,272,
ChIJR3Ls6w4O0i0Rf3L5NRGvMwU,Warung Wayan Lalapan,-8.5436047,115.48930159999999,"Jl. Raya Padang Bai No.80871, Antiga Kelod, Kec. Manggis, Kabupaten Karangasem, Bali, Indonesia",https://maps.google.com/?cid=374835682456728191,OPERATIONAL,+62 852-3783-8454,indonesian_restaurant,"indonesian_restaurant, restaurant, food",4.3,36,
ChIJBZGpyN4P0i0RPBcV54Onso8,Warung Ayam Geprek Blitar,-8.5446831,115.48884969999997,"Jl. Raya Padang Bai No.80871, Antiga Kelod, Kec. Manggis, Kabupaten Karangasem, Bali, Indonesia",https://maps.google.com/?cid=10354522678237665084,OPERATIONAL,+62 812-3838-9013,restaurant,"restaurant, food",5,2,
ChIJl73uwDkP0i0RVMOv99EOrNk,bali 448,-8.5446743,115.4889448,"Jl. Raya Padang Bai No.80871, Antiga Kelod, Kec. Manggis, Kabupaten Karangasem, Bali, Indonesia",https://maps.google.com/?cid=15684927897191039828,OPERATIONAL,,restaurant,"restaurant, food",,,
ChIJnVFtJs4P0i0RGlQVlLfrUeg,Kopi Panas Tohpati,-8.5457112,115.48793570000001,"FF3Q+P57, Antiga Kelod, Manggis, Karangasem Regency, Bali, Indonesia",https://maps.google.com/?cid=16740420463608812570,CLOSED_TEMPORARILY,,cafe,"cafe, food",,,
ChIJhXEwnq8P0i0RaOvQJA85fLs,Warung pak dono,-8.5449969,115.48859510000001,"Jl. Raya Padang Bai No.80871, Antiga Kelod, Kec. Manggis, Kabupaten Karangasem, Bali, Indonesia",https://maps.google.com/?cid=13509735719409609576,OPERATIONAL,,brunch_restaurant,"brunch_restaurant, restaurant, food",,,
ChIJnxXn_OAP0i0RGWBpUXihJEU,Dijlan,-8.5405835,115.4841957,"FF5M+QM8, Jl. Yeh Malet, Antiga Kelod, Kec. Manggis, Kabupaten Karangasem, Bali 80871, Indonesia",https://maps.google.com/?cid=4982284625912619033,OPERATIONAL,,tourist_attraction,tourist_attraction,,,
ChIJe8CL5wgO0i0Rj2_xFUHBIWs,Wr. Dek Bunga,-8.546422100000001,115.4875323,"Antiga Kelod, Manggis, Karangasem Regency, Bali, Indonesia",https://maps.google.com/?cid=7719663721574920079,OPERATIONAL,,restaurant,"restaurant, food",,,
ChIJxzv-HuQP0i0RWyfYlOONQFc,Merta Sari Home (Wilat),-8.5451414,115.4828307,"FF4J+5R9, Antiga Kelod, Manggis, Karangasem Regency, Bali, Indonesia",https://maps.google.com/?cid=6287181088403498843,OPERATIONAL,,park,park,,,
