id,name,latitude,longitude,address,url,status,phone,primary-type,types,rating,rating-count,price-level
ChIJLy7waVo90i0RBWF4QobnAag,Kamandalu Ubud,-8.49558,115.2758432,"Jl. Raya Andong, Banjar Nagi, Kecamatan Ubud, Kabupaten Gianyar, Bali 80571, Indonesia",https://maps.google.com/?cid=12106211837175423237,OPERATIONAL,+62 361 975825,resort_hotel,"resort_hotel, fitness_center, gym, wedding_venue, sports_complex, hotel, spa, event_venue, lodging, health",4.5,466,
ChIJySXvVVc90i0RAgfraVT_sws,Viceroy Bali,-8.493611399999999,115.2764686,"Br. Nagi, Jl. Lanyahan, Petulu, Kecamatan Ubud, Kabupaten Gianyar, Bali 80571, Indonesia",https://maps.google.com/?cid=843298293267760898,OPERATIONAL,+62 361 971777,resort_hotel,"resort_hotel, wedding_venue, hotel, event_venue, lodging",4.7,813,PRICE_LEVEL_VERY_EXPENSIVE
ChIJA5MVxVQ90i0R5TznTlgYoNA,The Kayon Valley Resort,-8.4979151,115.27557890000001,"Br. Nagi, Petulu, Kecamatan Ubud, Kabupaten Gianyar, Bali 80571, Indonesia",https://maps.google.com/?cid=15033042323722681573,OPERATIONAL,+62 361 9080770,resort_hotel,"resort_hotel, hotel, lodging",4.8,233,
ChIJvUqMSJI90i0RsCuTXnzrwZE,Apéritif Restaurant,-8.493886,115.2776444,"Br. Nagi, Jl. Lanyahan, Petulu, Kecamatan Ubud, Kabupaten Gianyar, Bali 80571, Indonesia",https://maps.google.com/?cid=10502934725399882672,OPERATIONAL,+62 361 9082777,restaurant,"restaurant, food",4.8,466,
ChIJjeBONVg90i0RWa_ICCkUWEU,Manyi Village Ubud,-8.495263699999999,115.28080750000001,"G73J+V8V, Banjar Laplapan, Petulu, Kecamatan Ubud, Kabupaten Gianyar, Bali 80552, Indonesia",https://maps.google.com/?cid=4996765953041149785,OPERATIONAL,+62 361 8987889,hotel,"hotel, lodging",4.4,243,
ChIJjVtDZns90i0RxKETmlOH1O8,Uma Dawa Resort and Spa,-8.4946422,115.27339309999998,"Jl. Raya Andong, Petulu, Kecamatan Ubud, Kabupaten Gianyar, Bali 80571, Indonesia",https://maps.google.com/?cid=17281586463264448964,OPERATIONAL,+62 822-1339-9795,hotel,"hotel, resort_hotel, lodging",4.4,183,
ChIJySXvVVc90i0RdOkVA_NwHEo,CasCades Restaurant,-8.493862499999999,115.2780667,"Jl. Lanyahan, Br. Nagi, Kecamatan Ubud, Kabupaten Gianyar, Bali 80571, Indonesia",https://maps.google.com/?cid=5340267447185697140,OPERATIONAL,+62 361 972111,restaurant,"restaurant, vegetarian_restaurant, indonesian_restaurant, food",4.7,360,
ChIJqd8D3Vo90i0RZyKDHvUf5Vc,Ayani Good House,-8.4965418,115.2732881,"Jalan Raya Andong, Ubud, Petulu, Kecamatan Ubud, Kabupaten Gianyar, Bali 80571, Indonesia",https://maps.google.com/?cid=6333503588605829735,OPERATIONAL,+62 813-3768-6888,private_guest_room,"private_guest_room, lodging",4.3,59,
ChIJMXssA3890i0RjwE76SJAxMQ,Ceylon Villas,-8.498707699999999,115.2804074,"G72J+G57, Pejeng Kawan, Tampaksiring, Gianyar Regency, Bali 80552, Indonesia",https://maps.google.com/?cid=14178528045555188111,OPERATIONAL,,hotel,"hotel, lodging",4.9,81,
ChIJzWn0VQ490i0RKhOk1eLX4dg,Lokasari Retreat,-8.4961634,115.27336729999998,"Jl. Raya Andong, Petulu, Kecamatan Ubud, Kabupaten Gianyar, Bali 80571, Indonesia",https://maps.google.com/?cid=15628009551199212330,OPERATIONAL,+91 70223 04854,resort_hotel,"resort_hotel, hotel, lodging",4.3,54,
ChIJFwnFaVk90i0R6COQJTBqYu4,Buda Cottage Ubud,-8.497795,115.2788221,"Jl. Raya Laplapan, Pejeng Kawan, Kecamatan Ubud, Kabupaten Gianyar, Bali 80552, Indonesia",https://maps.google.com/?cid=17177408683765670888,OPERATIONAL,+62 821-4568-9955,cottage,"cottage, lodging",4.7,101,
ChIJfwZ-1Jc90i0RUwO45XifV3s,Uma Tirtha Ubud By Island Escape Villlas,-8.4926966,115.2805961,"Jalan Raya Pejeng Kawan, Banjar Laplapan, Ubud, G74J+W6H, Pejeng Kawan, Kec. Tampaksiring, Kabupaten Gianyar, Bali 80552, Indonesia",https://maps.google.com/?cid=8887747731237897043,OPERATIONAL,,hotel,"hotel, lodging",4.9,16,
ChIJXQfzHFk90i0Rw9JIRO5rUuo,Amaya Cottage Ubud,-8.497475699999999,115.2806402,"Pejeng Kawan, Tampaksiring, Gianyar Regency, Bali 80552, Indonesia",https://maps.google.com/?cid=16884676624057422531,OPERATIONAL,+62 878-6120-3937,hotel,"hotel, lodging",4.7,68,
ChIJZ6kf01490i0R1nRGrNYnzvk,DLobong Suite,-8.4992257,115.2801625,"Jl. Tirtanadi, Pejeng Kawan, Kec. Tampaksiring, Kabupaten Gianyar, Bali 80552, Indonesia",https://maps.google.com/?cid=18000368563613234390,OPERATIONAL,+62 819-3543-4545,hotel,"hotel, lodging",4.6,43,
ChIJ3ZOHNSI90i0Rez7tbeG4Di4,Tantra House Ubud,-8.4979244,115.2807084,"Banjar Laplapan, Petulu, Kecamatan Ubud, Kabupaten Gianyar, Bali 80552, Indonesia",https://maps.google.com/?cid=3318793253770051195,OPERATIONAL,+62 812-4697-2814,hotel,"hotel, lodging",4,36,
ChIJn1flvMs90i0R2JahuS9cNYg,Ubud Poke Bowl,-8.495914899999999,115.28104999999998,"Banjar Laplapan, Petulu, Kecamatan Ubud, Kabupaten Gianyar, Bali 80571, Indonesia",https://maps.google.com/?cid=9814852322971457240,OPERATIONAL,+62 821-4534-6935,indian_restaurant,"indian_restaurant, restaurant, food",4.7,132,
ChIJY1DWHbs90i0RLTlI77heVEk,Pinstripe Bar,-8.493587200000002,115.2777862,"Br. Nagi, Jl. Lanyahan, Petulu, Kecamatan Ubud, Kabupaten Gianyar, Bali 80571, Indonesia",https://maps.google.com/?cid=5283952411193915693,OPERATIONAL,+62 859-6310-5757,bar,"bar, store",5,75,
ChIJh1S6r3M90i0RbPL5G-ps1K0,The Tejas Warung,-8.4942627,115.28103010000001,"G74J+69X, Jl. Raya Pejeng Kawan, Pejeng Kawan, Kec. Tampaksiring, Kabupaten Gianyar, Bali 80552, Indonesia",https://maps.google.com/?cid=12525756216371704428,OPERATIONAL,+62 812-3618-5676,vegetarian_restaurant,"vegetarian_restaurant, restaurant, food",5,85,
ChIJt5rXQ1k90i0RMnoOUcw_egg,Semanggi Cottage Ubud,-8.4978435,115.2791239,"Jl. Raya Laplapan No.Desa, Laplapan, Kecamatan Ubud, Kabupaten Gianyar, Bali 80571, Indonesia",https://maps.google.com/?cid=610870846227905074,OPERATIONAL,+62 817-4753-020,hostel,"hostel, lodging",4.5,78,
ChIJ5dy1HJo90i0RLPsCObmCs8A,Villa Tamara,-8.498418599999999,115.2792198,"Jl. Raya Laplapan No.17, Petulu, Kecamatan Ubud, Kabupaten Gianyar, Bali 80552, Indonesia",https://maps.google.com/?cid=13885585808150428460,OPERATIONAL,,lodging,lodging,4.7,7,
