id,name,latitude,longitude,address,url,status,phone,primary-type,types,rating,rating-count,price-level
ChIJXXZALlIP0i0R0RJbVvL-HKI,HOME PAK OPEN,-8.5180475,115.48961769999998,"FFJQ+QRQ, Jl. Pura Jati, Antiga, Kec. Manggis, Kabupaten Karangasem, Bali 80871, Indonesia",https://maps.google.com/?cid=11681491850276573905,OPERATIONAL,,private_guest_room,"private_guest_room, lodging",,,
ChIJL43gB5MP0i0RSZOnabnIgTo,WARUNG RAHAYU,-8.5183,115.48919790000001,"FFJQ+MMP, Jl. Andakasa, Antiga, Kec. Manggis, Kabupaten Karangasem, Bali 80871, Indonesia",https://maps.google.com/?cid=4215871424862589769,OPERATIONAL,+62 853-3795-6862,restaurant,"restaurant, food",,,
ChIJ9zFe-U4P0i0R75tMxSpd8A4,home widiarta,-8.516124999999999,115.49037829999997,"Gg. Karang Kodok 3 No.3, Antiga, Kec. Manggis, Kabupaten Karangasem, Bali 80871, Indonesia",https://maps.google.com/?cid=1076462749221690351,OPERATIONAL,+62 818-0562-3710,lodging,lodging,,,
ChIJTcj93zkO0i0RSIZVGE1qnjE,WARUNG MAKAN PANCEN AYU,-8.519625699999999,115.49258970000001,"Warung makan pancen ayu, Jl. Andakasa, Antiga, Kec. Manggis, Kabupaten Karangasem, Bali 80871, Indonesia",https://maps.google.com/?cid=3575412033532036680,OPERATIONAL,+62 812-3755-2301,restaurant,"brunch_restaurant, restaurant, food",4.3,4,
ChIJK9s9ThQP0i0RHXQy2AL27LM,WR BEDEG,-8.5177599,115.48961969999999,"BR Dinas Kelod, Antiga, Kec. Manggis, Kabupaten Karangasem, Bali 80871, Indonesia",https://maps.google.com/?cid=12965007919370368029,CLOSED_TEMPORARILY,+62 822-3690-1570,indonesian_restaurant,"indonesian_restaurant, restaurant, food",,,
ChIJkdiOCdIP0i0RwQ14kMQYpEU,Ryan Home Stay,-8.5165215,115.49088130000001,"Gg. Karang Kodok 3 No.3, Antiga, Kec. Manggis, Kabupaten Karangasem, Bali 80871, Indonesia",https://maps.google.com/?cid=5018163117314018753,OPERATIONAL,,hostel,"hostel, lodging",,,
ChIJBVpk4ckP0i0R2pqJ7EmGYp0,Babi Guling Sentanu,-8.521519099999999,115.48977660000001,"FFHQ+9WR, Jl. Setra, Antiga Kelod, Kec. Manggis, Kabupaten Karangasem, Bali 80871, Indonesia",https://maps.google.com/?cid=11340774463731505882,OPERATIONAL,+62 812-4651-9399,restaurant,"restaurant, food",,,
ChIJH6wj1DAO0i0Rrz7HzcDu5WY,Bagus Surya Residence,-8.518152599999999,115.4907503,"FFJR+P8J, Gg. Karang Celagi, Antiga, Kec. Manggis, Kabupaten Karangasem, Bali 80871, Indonesia",https://maps.google.com/?cid=7414594873388908207,OPERATIONAL,,private_guest_room,"private_guest_room, lodging",5,3,
ChIJ3-v9zzAO0i0RgazE7PEdk08,rumah bayu inmorta,-8.5179133,115.4903483,"FFJR+R4Q, Gg. Karang Celagi, Antiga, Kec. Manggis, Kabupaten Karangasem, Bali 80871, Indonesia",https://maps.google.com/?cid=5733959675469409409,OPERATIONAL,+62 853-3816-7621,night_club,night_club,,,
ChIJzdKrnFkP0i0RVo2vNHYplqU,WR. BIMA,-8.5177444,115.4894872,"FFJQ+WQ5, Jl. Pura Jati, Antiga, Kec. Manggis, Kabupaten Karangasem, Bali 80871, Indonesia",https://maps.google.com/?cid=11931769850431507798,OPERATIONAL,+62 821-4750-0269,restaurant,"restaurant, food",,,
ChIJU9WrNvEP0i0RHPmBXDvNYoY,Bakso Antiga Enak,-8.5183159,115.4894032,"FFJQ+MQC, Jl. Andakasa, Antiga, Kec. Manggis, Kabupaten Karangasem, Bali 80871, Indonesia",https://maps.google.com/?cid=9683527803638774044,CLOSED_TEMPORARILY,,breakfast_restaurant,"breakfast_restaurant, restaurant, food",,,
ChIJCxmfo5sP0i0REny0tjCmVlI,The Food RR08 Jajanan Murmer,-8.5159062,115.4891593,"FFMQ+JMM, Gg. Karang Cemp. 1, Antiga, Kec. Manggis, Kabupaten Karangasem, Bali 80871, Indonesia",https://maps.google.com/?cid=5933112287261129746,OPERATIONAL,+62 838-4697-6263,brunch_restaurant,"brunch_restaurant, restaurant, food",4.2,5,
ChIJrf8oEG0P0i0RZoNrXePE1A8,wedding ary cafe,-8.5151252,115.4899634,"FFMQ+WXW, Antiga, Manggis, Karangasem Regency, Bali 80871, Indonesia",https://maps.google.com/?cid=1140753086435525478,OPERATIONAL,+62 812-3991-0227,cafe,"cafe, food",,,
