id,name,latitude,longitude,address,url,status,phone,primary-type,types,rating,rating-count,price-level
ChIJv6VUfCgF0i0RyU6ZvZDeJPo,Ketu Noja,-8.416058,115.54215499999998,"HGMR+HVC, Bebandem, Karangasem Regency, Bali 80861, Indonesia",https://maps.google.com/?cid=18024776321881165513,CLOSED_TEMPORARILY,,lodging,lodging,,,
ChIJ10c9NoEF0i0RBlZ4YDmism8,warung mangku dirte,-8.4166931,115.5423831,"HGMR+8XC, tihing, seke, Bebandem, Karangasem Regency, Bali, Indonesia",https://maps.google.com/?cid=8048673851379832326,CLOSED_TEMPORARILY,,coffee_shop,"coffee_shop, cafe, food, store",,,
ChIJU0ckL5UF0i0RXWOay0NilRA,Warung meme,-8.421207299999999,115.53884830000001,"Jl. Bangkak, Jungutan, Kec. Bebandem, Kabupaten Karangasem, Bali 80861, Indonesia",https://maps.google.com/?cid=1194969319454958429,OPERATIONAL,+62 812-3749-9462,indonesian_restaurant,"indonesian_restaurant, restaurant, food",,,
ChIJsZAP8ogF0i0R-Jie076Ug40,warung mastre,-8.4187107,115.54257080000001,"HGJV+G28, tihing seke, Kec. Bebandem, Kabupaten Karangasem, Bali, Indonesia",https://maps.google.com/?cid=10197157528612018424,OPERATIONAL,,coffee_shop,"coffee_shop, cafe, food, store",,,
ChIJ0xPnmpYF0i0RpuDNNtfFN58,White Coffee stop,-8.4207622,115.53904709999999,"HGHQ+MJV, Jungutan, Bebandem, Karangasem Regency, Bali 80861, Indonesia",https://maps.google.com/?cid=11472856103877730470,CLOSED_TEMPORARILY,,cafe,"cafe, food",,,
