id,name,latitude,longitude,address,url,status,phone,primary-type,types,rating,rating-count,price-level
ChIJjWzd00sb0i0R5o1WtYzfJQY,Warung Babi Guling Bu Arta,-8.419672499999999,115.3981154,"H9JX+46Q, Jl. Peninjoan, Peninjoan, Kec. Tembuku, Kabupaten Bangli, Bali 80671, Indonesia",https://maps.google.com/?cid=443005933796625894,OPERATIONAL,+62 852-3735-4665,restaurant,"restaurant, food",3.8,4,
ChIJl7_tdPcb0i0RjHoEQAbinUU,Radja Bakso Mercon Peninjoan,-8.4205155,115.39834570000001,"H9HX+Q8X, Jl. Peninjoan, Peninjoan, Kec. Tembuku, Kabupaten Bangli, Bali 80671, Indonesia",https://maps.google.com/?cid=5016414076432317068,OPERATIONAL,,indonesian_restaurant,"indonesian_restaurant, restaurant, food",5,1,
ChIJBdDfBygb0i0RoZUJ1fKBtZA,Pondok bonsai tabun,-8.4205838,115.39454239999998,"Br karang suung kelod, H9HV+QR7, Peninjoan, Kec. Tembuku, Kabupaten Bangli, Bali 80671, Indonesia",https://maps.google.com/?cid=10427383392202495393,OPERATIONAL,,tourist_attraction,tourist_attraction,,,
ChIJIVoaxcYb0i0RW94wXKr4ZN0,Warung Makan Pak Cok,-8.4202515,115.39834549999998,"H9HX+V8X, Peninjoan, Tembuku, Bangli Regency, Bali 80671, Indonesia",https://maps.google.com/?cid=15953149190627974747,OPERATIONAL,+62 831-1750-8848,restaurant,"restaurant, food",4.3,6,
ChIJQR-Qr0kb0i0R6nIY7W7GhCI,Basa Genep/Suna Cekuh Men Murda,-8.4155341,115.3953872,"Jl. Yudistira Karangsuung Kaja, Peninjoan, Kec. Tembuku, Kabupaten Bangli, Bali 80671, Indonesia",https://maps.google.com/?cid=2487331073941861098,OPERATIONAL,,meal_takeaway,"meal_takeaway, restaurant, food",,,
ChIJK1imbqUb0i0R9shATpXI-Fc,UMAH TEBA DAUH,-8.4155236,115.395296,"Jalan Yudistira, Br. Karang Suung Kaja, Peninjoan, Kec. Tembuku, Kabupaten Bangli, Bali 80671, Indonesia",https://maps.google.com/?cid=6339037019112524022,OPERATIONAL,,,lodging,5,1,
ChIJ5550OcEb0i0RivdH0JYr_IQ,Fast Food Restaurant,-8.4195872,115.3981116,"H9JX+569, Jl. Peninjoan, Peninjoan, Kec. Tembuku, Kabupaten Bangli, Bali 80671, Indonesia",https://maps.google.com/?cid=9582582033877038986,OPERATIONAL,,restaurant,"restaurant, food",,,
ChIJKUveLMAb0i0RTSBrxSO-UxY,Warung Pojok,-8.4157034,115.39936469999999,"H9MX+PP9, Jl. Yudistira, Peninjoan, Kec. Tembuku, Kabupaten Bangli, Bali 80671, Indonesia",https://maps.google.com/?cid=1608838552746664013,OPERATIONAL,,restaurant,"restaurant, food",,,
