id,name,latitude,longitude,address,url,status,phone,primary-type,types,rating,rating-count,price-level
ChIJI1IDc8Nx0i0RHm09AuNB9Z0,Indian Food Delhi 6,-8.7137202,115.5015153,"Jln raya pangket, Sakti, Kec. Nusa Penida, Kabupaten Klungkung, Bali 80771, Indonesia",https://maps.google.com/?cid=11382076076499758366,OPERATIONAL,+62 821-2780-2593,indian_restaurant,"indian_restaurant, restaurant, food",4.6,487,
ChIJlXNGxOFx0i0RvLUvqzAVqF0,The Kleep Jungle Resort,-8.7138785,115.5045199,"Sakti, Nusa Penida, Klungkung Regency, Bali 80771, Indonesia",https://maps.google.com/?cid=6748667340389332412,OPERATIONAL,+62 813-3877-6955,hotel,"hotel, lodging",4.7,112,
ChIJU3jGEPZx0i0RD3lb0r5eo5o,Bagia Bungalows,-8.711921199999999,115.5023236,"Jln raya pangket, Sakti, Kec. Nusa Penida, Kabupaten Klungkung, Bali 80711, Indonesia",https://maps.google.com/?cid=11142854076710746383,OPERATIONAL,+62 852-3784-3891,,lodging,4.9,271,
ChIJR9448hBx0i0R9EtXYEnoNvc,NG Sweet Home,-8.7169709,115.50385879999999,"Jalan Raya Pangket Banjar Cemulik, Sakti, Kec. Nusa Penida, Kabupaten Klungkung, Bali 80771, Indonesia",https://maps.google.com/?cid=17813680777957166068,OPERATIONAL,+62 853-3386-1755,hotel,"hotel, cottage, lodging",5,98,
ChIJC72lO4Zx0i0RHRcAtvo4h0I,Warung NG (NG Restaurant),-8.7168043,115.5034662,"Sakti, Nusa Penida, Klungkung Regency, Bali 80771, Indonesia",https://maps.google.com/?cid=4793862977805621021,OPERATIONAL,+62 853-3386-1755,restaurant,"restaurant, food",4.5,545,PRICE_LEVEL_INEXPENSIVE
ChIJqWnk6OFx0i0R_qKEUIoNrXA,Mertha Sari Resto and Bungalow,-8.7180956,115.5038903,"Jalan Raya Pangket, Banjar Bucang, Sakti, Kec. Nusa Penida, Kabupaten Klungkung, Bali 80771, Indonesia",https://maps.google.com/?cid=8119160590926390014,OPERATIONAL,+62 877-7566-6108,restaurant,"restaurant, food",5,78,
ChIJhVoGUF5x0i0R48_APGPO6DY,THE BLISS Resto and Bar,-8.7184075,115.5038143,"Sakti, Nusa Penida, Klungkung Regency, Bali 80771, Indonesia",https://maps.google.com/?cid=3956639198261333987,OPERATIONAL,+62 821-4744-3742,restaurant,"restaurant, food",4.2,19,
ChIJkTfKAwBx0i0R-KU43wVynUE,Bagia Restaurant and Spa,-8.711834399999999,115.50241919999999,"Jln Raya Pangket Br Cubang, 7GQ2+7X7 Kac, Sakti, Kec. Nusa Penida, Kabupaten Klungkung, Bali 80771, Indonesia",https://maps.google.com/?cid=4728060553354323448,OPERATIONAL,,restaurant,"restaurant, food",5,5,
