id,name,latitude,longitude,address,url,status,phone,primary-type,types,rating,rating-count,price-level
ChIJ5Zsy7eN50S0RJxAi_U62YSY,Wisata Purbakala Desa Pangkungparuk,-8.210445,114.8865085,"QVQP+RJC, Pangkungparuk, Seririt, Buleleng Regency, Bali 81153, Indonesia",https://maps.google.com/?cid=2765692096552767527,OPERATIONAL,,park,park,5,2,
ChIJAfa6UQZ50S0Rio_1jpn4yds,PURI GIRI RAHARJA DESA PANGKUNG PARUK,-8.214994299999999,114.8864979,"SINGARAJA, Pangkungparuk, Kec. Seririt, Kabupaten Buleleng, Bali 81153, Indonesia",https://maps.google.com/?cid=15837462903037202314,OPERATIONAL,+62 818-1827-5566,,lodging,5,2,
ChIJH1QXwId50S0RPAM_7vRHV7g,Kadek Budiarta platar,-8.2120152,114.88700440000001,"QVQP+5RR, Jalan, Pangkungparuk, Kec. Seririt, Kabupaten Buleleng, Bali 81153, Indonesia",https://maps.google.com/?cid=13283164743247266620,OPERATIONAL,,private_guest_room,"private_guest_room, lodging",,,
ChIJvWNvU_V50S0RMqi6k21EMuQ,Perumahan Griya pertiwi,-8.2112357,114.8867528,"QVQP+GP2, Jl. Pangkung Paruk, Pangkungparuk, Kec. Seririt, Kabupaten Buleleng, Bali 81153, Indonesia",https://maps.google.com/?cid=16443280426903709746,OPERATIONAL,,private_guest_room,"private_guest_room, lodging",,,
ChIJLyElsqZ50S0RpJCDFp_iIU4,Mie Lalah A2,-8.210788700000002,114.8867586,"QVQP+JPR, Jalan, Pangkungparuk, Kec. Seririt, Kabupaten Buleleng, Bali 81153, Indonesia",https://maps.google.com/?cid=5630030182095229092,OPERATIONAL,,indonesian_restaurant,"indonesian_restaurant, restaurant, food",,,
