id,name,latitude,longitude,address,url,status,phone,primary-type,types,rating,rating-count,price-level
ChIJTbrazrAm0i0RHwF7psPrU1s,Banjar Pinge Desa Baru Kecamatan Marga Tabanan,-8.3955121,115.1790394,"J53H+QJV, Tua, Marga, Tabanan Regency, Bali 82191, Indonesia",https://maps.google.com/?cid=6580862706062655775,OPERATIONAL,,hotel,"hotel, lodging",4.4,26,
ChIJT-8VdbEm0i0RR4o9d-PbEXw,Pacung ASRI,-8.397319,115.18160200000001,"JL. Raya Baturiti, Tabanan, Denpasar, J53J+3JH, Tua, Marga, Tabanan Regency, Bali 82191, Indonesia",https://maps.google.com/?cid=8940168505311726151,OPERATIONAL,+62 368 21793,hotel,"hotel, lodging",5,2,
ChIJy4kGDCgn0i0Rh2atALkYd6g,Warung Bu Diva,-8.3936101,115.1817278,"J54J+HM5, Jl. Raya Marga-Apuan, Apuan, Kec. Baturiti, Kabupaten Tabanan, Bali 82191, Indonesia",https://maps.google.com/?cid=12139198503459841671,OPERATIONAL,+62 852-3786-2812,restaurant,"restaurant, food",4.2,13,
ChIJyY3mhWIn0i0RXpILwAmrJi8,Kebun Bayu Adiguna,-8.3965183,115.1801283,"Baturiti, Jl. Raya Apuan -Baturiti No.28, Tua, Marga, Tabanan Regency, Bali 82191, Indonesia",https://maps.google.com/?cid=3397591027262657118,OPERATIONAL,,park,park,,,
ChIJ88f4iBEn0i0R2ZXZc075hqM,Rumah Van Candra,-8.3969465,115.1824132,"Desa Baru, J53J+5VP, Jl. Raya Marga-Apuan, Tua, Kec. Marga, Kabupaten Tabanan, Bali 82191, Indonesia",https://maps.google.com/?cid=11783379590407886297,CLOSED_TEMPORARILY,,coffee_shop,"coffee_shop, cafe, food, store",5,1,
ChIJkZCJdbEm0i0RD8jX4byVDaQ,Warung Bakso Krama Bali,-8.3973487,115.18175769999999,"J53J+3P6, Jl. Raya Marga-Apuan, Tua, Kec. Marga, Kabupaten Tabanan, Bali 82191, Indonesia",https://maps.google.com/?cid=11821269235392825359,OPERATIONAL,+62 852-3779-3767,indonesian_restaurant,"indonesian_restaurant, restaurant, food",4.4,8,
