id,name,latitude,longitude,address,url,status,phone,primary-type,types,rating,rating-count,price-level
ChIJacOTdcpx0i0RzV71teSraY8,DnR Lumbung Garden,-8.7137724,115.52144030000001,"Klumpu, Nusa Penida, Klungkung Regency, Bali 80771, Indonesia",https://maps.google.com/?cid=10333979818771963597,OPERATIONAL,,,lodging,4.3,18,
ChIJyWIHB55x0i0RI-4VPysEZhw,Warung Monink,-8.716725199999999,115.52348740000001,"Unnamed Road, Klumpu, Kec. Nusa Penida, Kabupaten Klungkung, Bali 80771, Indonesia",https://maps.google.com/?cid=2046327664474975779,OPERATIONAL,+62 812-3765-0099,restaurant,"restaurant, food",4.7,22,
ChIJj9DuSXhx0i0RtcoyyulX8iw,Villa Damai,-8.7179067,115.5232424,"Br, 7GJF+R7Q, Klumpu, Kec. Nusa Penida, Kabupaten Klungkung, Bali 80771, Indonesia",https://maps.google.com/?cid=3238747743664130741,OPERATIONAL,+62 812-3619-992,hotel,"hotel, lodging",,,
ChIJHe6idQBx0i0RJgQRKQdiYlY,Warung Batupamor,-8.7163376,115.52127879999999,"Desa No.Br, Klumpu, Kec. Nusa Penida, Kabupaten Klungkung, Bali 80771, Indonesia",https://maps.google.com/?cid=6224645417872720934,OPERATIONAL,,brunch_restaurant,"brunch_restaurant, restaurant, food",5,1,
ChIJqWLhzcJx0i0RPuI8Bs0-BCs,Me Date,-8.7185356,115.52356150000001,"7GJF+HCM, Klumpu, Nusa Penida, Klungkung Regency, Bali 80771, Indonesia",https://maps.google.com/?cid=3099671493831615038,OPERATIONAL,,private_guest_room,"private_guest_room, lodging",,,
ChIJXesfT_hx0i0R0VmVbdSKjSc,Garuda penida tour,-8.7111321,115.52139129999999,"jl raya metaki, Klumpu, Kec. Nusa Penida, Kabupaten Klungkung, Bali 80771, Indonesia",https://maps.google.com/?cid=2850086784171596241,OPERATIONAL,+62 822-4718-6628,car_rental,car_rental,5,1,
