id,name,latitude,longitude,address,url,status,phone,primary-type,types,rating,rating-count,price-level
ChIJ73owuFLf0y0RaBnVqQ8sa6M,CUP.eL Sunset Coffee,-8.360244699999999,114.5644155,"Banjar Rening, Cupel, Kec. Negara, Kabupaten Jembrana, Bali, Indonesia",https://maps.google.com/?cid=11775554096475740520,OPERATIONAL,+62 821-4664-7173,coffee_shop,"coffee_shop, cafe, store, food",4.7,25,
ChIJZyHtUi5g0S0RO7ArUIui-mY,The Losari Hotel & Villas,-8.3624135,114.56294419999999,"Jl. Sahadewa No.19, Baluk, Kec. Negara, Kabupaten Jembrana, Bali 80361, Indonesia",https://maps.google.com/?cid=7420422055275507771,OPERATIONAL,+62 852-5454-6220,hotel,"hotel, lodging",4.4,5,
ChIJoWFitGVh0S0RzvyLPUvG3mc,Kedai 99,-8.3648052,114.5623495,"JHP6+3WH, Jl. Cemp., Cupel, Kec. Negara, Kabupaten Jembrana, Bali 82218, Indonesia",https://maps.google.com/?cid=7484637657193774286,OPERATIONAL,+62 812-3790-8882,coffee_shop,"coffee_shop, cafe, store, food",4.7,3,
ChIJw_rmZvhh0S0RHCl0eLHV1yA,Nia'S Sweet Home,-8.3630511,114.5646404,"JHP7+QVC, Jl. Sahadewa, Baluk, Kec. Negara, Kabupaten Jembrana, Bali 82218, Indonesia",https://maps.google.com/?cid=2366595087413291292,CLOSED_TEMPORARILY,,cafe,"cafe, food",,,
ChIJyRYrOyZh0S0RRXAgBCcSNg0,Bakso Nikmat,-8.3599135,114.5620476,"JHR6+2RM Rening, Cupel, Kec. Negara, Kabupaten Jembrana, Bali 82218, Indonesia",https://maps.google.com/?cid=951968330017697861,OPERATIONAL,+62 853-3852-5557,indonesian_restaurant,"indonesian_restaurant, restaurant, food",,,
