id,name,latitude,longitude,address,url,status,phone,primary-type,types,rating,rating-count,price-level,review 1,review 2,review 3,review 4,review 5
ChIJS9D0rc2b0S0RXYn8d90sUuQ,Era Liton Ikan Bakar,-8.1657403,115.0140917,"Banjar, Dinas enjungsangiang, Jl. Seririt- Singaraja, Kaliasem, Kec. Buleleng, Kabupaten Buleleng, Bali 81152, Indonesia",https://maps.google.com/?cid=16452261718450276701,CLOSED_TEMPORARILY,+62 878-6300-5087,indonesian_restaurant,"seafood_restaurant, indonesian_restaurant, restaurant, food",4.8,77,,"We went there for lunch, the place was very quiet (only us & 1 other couple). We ordered 1 set menu for 2 persons. It has fish soup, grilled fish, some vegetables & sambal. We also ordered cumi plecing (squid with chilli sauce). All tasted great! The fish was fresh, squid chewy and soft. The portion was generous, and the price was cheap.","Love the food, it's simple, nourishing, and tasty. The one person set meal comes in a generous portion, and it's cheap for only 50k. No tax, no service charge, God bless them!

I'd give 10 stars if possible. The kindhearted owners offered to send us back to our hotel when it's drizzling earlier, but we refused as we didn't want to trouble them.

Don't be discouraged with the place, it's not something modern or luxurious but they try their best to maintain the cleanliness. Also dining with the ocean view is just splendid.
Will be back to try other menu.","A group of us had lunch here yesterday.
Right on the beach with amazing sea views it's a great place.
Parking is onsite and large.
We ordered several items from the menu.
Staff are friendly and helpful.
Food is delicious and extremely fresh.
Prices are local.

Everyone enjoyed the experience.

Would I come back again?
Most Definitely.","Note; they stopped the restaurant on this location and will start soon on an other locaties nearby buda bakery.

Nice small restaurant with seaview. Nice to relax and eat. The quality is fresh, very good and it's clean! They have the knowledge how to handle with food. Sri worked many years in a hotel so she knows what she do. The price is also nice. Just go and you do not regret. They can pick you up and also  bring you back to your plave where you stay. Just sent a message on FB and they will react.",The place is really nice and the staff polite and kind. They welcome us in a very sweet and nice way. The view is unique: you will see Bali see and nothing else in front of view. I would recommend the ikan bakar.. enak banget! Dan udang bakar juga… di tempat ini bisa bayar dengan kartu. Always a plus!
ChIJ_72OuESb0S0RP9BEwKT2i-s,Rotary Club of Bali Lovina,-8.1657713,115.0119905,"Kaliasem, Seririt, Buleleng Regency, Bali 81152, Indonesia",https://maps.google.com/?cid=16972930808136650815,OPERATIONAL,+62 821-4485-7710,hotel,"hotel, lodging",4.4,8,,Good,,,,
ChIJXdKn6Qab0S0RSLQdbb4isGE,Billibo Hotel,-8.1661134,115.01408769999999,"Jl. Singaraja-Gilimanuk, Kaliasem, Kec. Banjar, Kabupaten Buleleng, Bali 81152, Indonesia",https://maps.google.com/?cid=7039164418849879112,OPERATIONAL,,hotel,"hotel, lodging",5,2,,,,,,
ChIJEZU_JUSb0S0RiwZRGrmrEUU,Hotel PARMA,-8.1662004,115.01633710000002,"R2M8+GG8, Jl. Seririt- Singaraja, bunut panggang, Kaliasem, Kec. Banjar, Kabupaten Buleleng, Bali 81152, Indonesia",https://maps.google.com/?cid=4976947874719925899,OPERATIONAL,+62 362 41555,hotel,"hotel, lodging",2.8,8,,"Very old a d rundown, right on the beach front","Old, dirty, stinky and unpleasant smell in the bathroom",,,
ChIJU7oKEO-b0S0RI_W2IhT9jjY,Pondok Sari Laksana,-8.1678705,115.01612410000001,"R2J8+VC5 Dinas Enjung Sanghiang, Kaliasem, Kec. Banjar, Kabupaten Buleleng, Bali 81152, Indonesia",https://maps.google.com/?cid=3931357787664610595,OPERATIONAL,+62 819-1662-9779,guest_house,"guest_house, lodging",5,6,,Good place and really peaceful ..😍😍,Nice place and really peaceful,,,
ChIJVXl9UEmb0S0RUrVzVfm-DH4,Villa Pak Ari,-8.168809,115.017061,"Jl Arjuna Kaliasem (Panti Sosial Tresna Weda Jara Mara Pati, Kaliasem, Kec. Banjar, Kabupaten Buleleng, Bali 81152, Indonesia",https://maps.google.com/?cid=9082844526589228370,OPERATIONAL,+62 896-0308-4053,,lodging,5,2,,,,,,
ChIJ5X84OACb0S0R6QbUR2UQy0g,Lovina Haven Boutique Resort,-8.165839900000002,115.01697440000001,"Jl. Seririt- Singaraja, Banjar, Kec. Buleleng, Kabupaten Buleleng, Bali 81152, Indonesia",https://maps.google.com/?cid=5245304218185893609,OPERATIONAL,,hotel,"hotel, lodging",,,,,,,,
ChIJTxFG1Imb0S0Rq2LAc_5oOsE,SARI GK ART PAINTING,-8.1708774,115.01511450000001,"Buleleng, dinas enjung sangiang, Jl. Yudistira, Kaliasem, Kec. Banjar, Kabupaten Buleleng, Bali 81152, Indonesia",https://maps.google.com/?cid=13923556640042279595,OPERATIONAL,+62 877-6240-4593,art_gallery,art_gallery,5,7,,Thank you for the wonderful painting,"thanks Sari Gk art painting, the place is very calm and nice",nice place,,
ChIJP_XTYwCb0S0R17ksh9CWBUo,Lovina Coral Reef,-8.1652263,115.0116068,"R2M7+MC4, Jl. Seririt- Singaraja, Kaliasem, Kec. Banjar, Kabupaten Buleleng, Bali 81152, Indonesia",https://maps.google.com/?cid=5333835156055439831,OPERATIONAL,,tourist_attraction,tourist_attraction,,,,,,,,
