id,name,latitude,longitude,address,url,status,phone,primary-type,types,rating,rating-count,price-level,review 1,review 2,review 3,review 4,review 5
ChIJzXvpbCtH0i0R11KVdajmcrA,Massari Mezzanine,-8.671384,115.17601479999999,"85HG+FC3 no 8AA, Jl. Taman Sari Madu, Kerobokan Kelod, Kec. Kuta Utara, Kabupaten Badung, Bali 80361, Indonesia",https://maps.google.com/?cid=12714478309221946071,OPERATIONAL,+62 819-9983-5091,extended_stay_hotel,"extended_stay_hotel, hotel, lodging",4.8,12,,"One of the best place to stay in Bali for a long term! The design is modern minimalist, clean, owner is super kind, helpful and responsive, staff are also nice! Im so lucky to get the unit here since the waiting list for this place is quite long 🥹","Best place for staying here quiet peaceful and tidy, clean",,,
ChIJBfjD2UdH0i0R79G06rQ7n_g,Red Brick Home Stay,-8.6711297,115.17680370000001,"Kerobokan Kelod, Kuta Utara, Badung Regency, Bali 80117, Indonesia",https://maps.google.com/?cid=17915103490920993263,OPERATIONAL,+62 812-3960-5354,hotel,"hotel, lodging",4.4,39,,"Cozy place to stay at kerobokan area
There's a restaurant in front of the homestay
Near the main road
Easy access
Internet not so good","2 Storey with balcony, wooden deck.
Bed room on 2nd floor.
Living room, kitchen, bathroom with hot water, storage room are on 1st floor.","Lovely place, clean and well maintained with nice garden",Nice and clean place we love to stay here,Amazing for your money.
