id,name,latitude,longitude,address,url,status,phone,primary-type,types,rating,rating-count,price-level,review 1,review 2,review 3,review 4,review 5
ChIJSyPM_u0b0i0Rkd9lyGX7VTs,Besakih homestay,-8.3954598,115.41996449999999,"Jln raya besakih, Menanga, Kec. Rendang, Kabupaten Karangasem, Bali, Indonesia",https://maps.google.com/?cid=4275599835830542225,OPERATIONAL,+62 859-5516-3655,hotel,"hotel, lodging",4.5,2,,,,,,
ChIJkcHZgEQd0i0RejuXZgwuzKo,Warung SATE BABI,-8.3925859,115.41989259999998,"JC49+XX6, Jl. Gn. Agung Besakih, Menanga, Kec. Rendang, Kabupaten Karangasem, Bali 80863, Indonesia",https://maps.google.com/?cid=12307262512492395386,OPERATIONAL,+62 877-5880-0467,indonesian_restaurant,"indonesian_restaurant, restaurant, food",5,1,,,,,,
ChIJc98NihId0i0RZP2sSCqQgQQ,Warung makan me sasih,-8.3904278,115.41936810000001,"JC59+RPH, Menanga, Rendang, Karangasem Regency, Bali 80863, Indonesia",https://maps.google.com/?cid=324699159429709156,OPERATIONAL,,restaurant,"restaurant, food",,,,,,,,
ChIJGYCPqB0d0i0RyFUfnrMGQN0,Dita's House,-8.391188999999999,115.418007,"JC59+G6, Menanga, Rendang, Karangasem Regency, Bali 80863, Indonesia",https://maps.google.com/?cid=15942750049413322184,OPERATIONAL,,private_guest_room,"private_guest_room, lodging",,,,,,,,
ChIJox2LdGMd0i0RI75SPyABk2c,Chicken Popcron,-8.3936498,115.41997950000001,"Jl. Gn. Batur No.34, Menanga, Kec. Rendang, Kabupaten Karangasem, Bali 80863, Indonesia",https://maps.google.com/?cid=7463310245496012323,OPERATIONAL,,cafe,"cafe, food",,,,,,,,
ChIJXbcqiLAd0i0RNDBtXUlr7eM,Ns komang yudiati S. Kep,-8.3935517,115.4197894,"JC49+HVH, Menanga, Rendang, Karangasem Regency, Bali 80863, Indonesia",https://maps.google.com/?cid=16423901378934288436,OPERATIONAL,,park,park,,,,,,,,
ChIJDfvUzIYb0i0R70jhj7kcxyY,Warung Dong Menawati,-8.397001399999999,115.42003319999999,"JC3C+52V, Jl. Gn. Agung Besakih, Menanga, Kec. Rendang, Kabupaten Karangasem, Bali 80863, Indonesia",https://maps.google.com/?cid=2794233677115115759,OPERATIONAL,,restaurant,"restaurant, food",,,,,,,,
ChIJ0ZtV4t0d0i0RVun-M9rpch8,Kubu Nang Dery,-8.391947199999999,115.41462290000001,"Unnamed Road, Pempatan, Kec. Rendang, Kabupaten Karangasem, Bali 80671, Indonesia",https://maps.google.com/?cid=2266130685905267030,OPERATIONAL,,cafe,"cafe, lodging, food",,,,,,,,
ChIJr15G3IMb0i0RaralfB49_Cg,Pak Putu Kemud Home,-8.394971000000002,115.41376539999999,"JC47+2G6, Pempatan, Rendang, Karangasem Regency, Bali 80671, Indonesia",https://maps.google.com/?cid=2953302656797750890,OPERATIONAL,+62 857-9246-7307,hotel,"hotel, lodging",5,3,,,,,,
