id,name,latitude,longitude,address,url,status,phone,primary-type,types,rating,rating-count,price-level,review 1,review 2,review 3,review 4,review 5
ChIJbz0wrkhH0i0R3C_aBC_ONi8,The Salak Style Hotel,-8.6679446,115.1791698,"Jl. Gunung Salak No.78, Padangsambian Klod, Kec. Denpasar Bar., Kota Denpasar, Bali 80117, Indonesia",https://maps.google.com/?cid=3402133269865181148,OPERATIONAL,+62 811-1113-0078,hotel,"hotel, lodging",4.2,1090,,"My room has a broken shower handle. Whenever I pulled the tap full the pressure of the water made the shower move wildly and soak the entire bathroom. The hot water was really hard to get. The toilet only for basic use.

No breakfast under 9 am, and the restaurant is not even open at 9 am. I missed breakfast 2 days in a row.

Smokers could smoke in the lobby or on the rooftop beyond the third floor, there was an open space with a very good view.","Wide and clean room for the price. I paid 23AUD. It has a window to get some sun and nice desk. Safety box and kettle as well.

It is quite far from touristic area. If your trip is short I dont recommand this. But if u looking for cheap place and have time then all good ✌️

For sensitive dude, I found many stains from the bed and towels as well. And shower is a bit teicky.",Don’t go there. The room smells really really bad like chemicals! The air conditioner doesn’t really cool down. Also it’s not to clean. The Wi-Fi is not good enough to load social media. The stuff is friendly and also trying their best though.,"Very friendly staff! Some had amazing English, which helped as I arrived at 2:30am! The rooms on the pool side overlook rice paddies, and so does the pool. Very good food in the restaurant (really liked the nasi gorang). Room was clean, had AC, WI-FI and TV.",Salak hotel is located in Bali. With affordable prices we can get good facilities. In this hotel there is a beautiful and clean outdor swimming pool. Then in the dining room we are presented with beautiful rice field views. The service is also very friendly and fun
ChIJi0mVOJlH0i0Rya9-MzbEdv4,Lusiana's Kitchen,-8.6711824,115.17699449999999,"Jalan Taman Sari PCV, Gg. 9 No.1, Kerobokan Kelod, Kec. Kuta Utara, Kabupaten Badung, Bali 80117, Indonesia",https://maps.google.com/?cid=18336058669956771785,OPERATIONAL,+62 878-7888-8226,italian_restaurant,"italian_restaurant, pizza_restaurant, brunch_restaurant, coffee_shop, cafe, breakfast_restaurant, meal_takeaway, store, restaurant, food",4.8,412,,"Great lunch! Excellent ingredients, generous portions and authentic flavors. We ate two pastas (finally someone who makes the real carbonara without cream!). Definitely the best pasta in Seminyak and at a cheap price. We also ate crepes... delicious! Excellent service and very kind waitresses.","Really great food here, mushroom soup was super nice a land steaming hot, chicken bites were a good appetiser and the Carbonara was clearly the best I've had with imported ingredients and they know how to make it authentically not just like everywhere else that covers it with cream.

You won't go wrong here.","What a big portion for me 😆😆😆 I couldn't finished it my Carbonara Creamy. Taste delicious. Many people came here when i was here. Recommendations from my friend this place. And he was right, tasted good!! The tiramisu is not my favorite, it tastes too dry. And fresh Watermelon no sugar  tasted fresh. I definitely wanna go back again. To try another meal. The staff are nice. Far from the beach, closer to the Teuku Umar area.",Absolutely amazing food! Really good price for value and huge selection of foods. Went for dinner and breakfast and was a 10/10. Also the coffee was one of the best I had (I got a oat cappuccino).,"One of the best pizzas in town with semolina flour and a perfect baked to perfection. Penne Alfredo was simple and great. Crostini with burrata too much butter separated from the scarce cheese. Great strawberry juice and more than average German beer. Only problem was the polite and smiley service didn’t let us know about all the items missed in the menu. First, we ordered burrata salad, all sold out, then Greek Salad, when they told us again no more salad. But in general, nice place with easy parking and very good meals."
ChIJObnxFl5H0i0RJDgZmZszEpU,Sunrise Suite Seminyak,-8.6715509,115.1782149,"Jl. Taman Sari V No.88, Kerobokan Kelod, Kec. Kuta Utara, Kabupaten Badung, Bali 80361, Indonesia",https://maps.google.com/?cid=10741704804613568548,OPERATIONAL,+62 812-2877-1200,hotel,"hotel, lodging",4.3,213,,"For the first time in our long stay in Bali, we encountered such a bad place to stay!

1. The hotel conditions are veiled and when checking in you may encounter unforeseen conditions - be careful!

2. Managers who advertise on Facebook stop responding altogether and ignore requests!

3. On the second day of our stay, in the evening the water was turned off - there was no water at all!

4. On the third day in the morning the electricity was turned off!

Every day something happened: a power outage, a water outage, noise due to some work, or a flooded toilet!

Even though the Facebook ad says they are animal friendly, they charge money to post them!

BE CAREFUL - this is an unscrupulous hotel, I do not advise anyone to go there!","The room is super hot and while i open the air conditioner stay inside waiting for the room getting colder suddenly black out,’never knee about the electricity here in bali but i think they put some number in it,i think for the management need to take a cause about this stuff because it is not comfortable for me
Luckily im only staying for a day,i will look more places to go and need to see from the google review for this place,there is a lot of bad review
And ya lastly the pool is dirty","I have stayed here for a full month and I have a very mixed feeling about it.
Location is great, it’s quiet here yet not far from centre. Plenty of parking spaces for scooters and cars.
Room are spacious with all that might be needed for longer stay. There is a kitchen but in Asian style - outside. So it’s hot, a lot of bugs and it’s ‘low’; as a person from Europe it was too low for me and I had to bend to cut or prepare anything.
There is no shower in bathroom, only bathtub. And endless mosquitos goes in through the constant open window (what is normal in Bali, you can’t close it).
Staff is friendly… but slacking a bit and not accurate with cleaning, I often had to correct after them.","I recently had the displeasure of staying at the Villa Apartment, and I must say that my experience left much to be desired. While the staff was friendly and accommodating, it became evident that their primary objective was to take advantage of guests and extract as much money as possible.

First and foremost, I was appalled by the management's blatant attempt to withhold my deposit for any flimsy reason they could conjure. It seemed as though they were actively trying to find ways to keep the deposit, disregarding any semblance of fairness or transparency. This behavior left me feeling cheated and distrustful of their motives.

Furthermore, the pricing of the rooms was utterly unreasonable. I was shocked to discover that I was charged a staggering 10 million rupiah for a room that was barely worth half that amount. The quality and amenities provided were far below what would be expected for such an exorbitant price. It was nothing short of a blatant attempt to exploit unsuspecting guests and line their pockets.

To make matters worse, the management's obsession with petty details was both baffling and frustrating. They meticulously counted every single veneer floor, pillow, and spoon in the apartment, as if they were desperately searching for any excuse to charge extra fees. It was a ridiculous and unnecessary ordeal that only served to highlight their unscrupulous business practices.

Lastly, the cleanliness standards at the Villa Apartment were abysmal. Despite claiming to provide cleaning services, their definition of ""cleaning"" was limited to tidying the bed while neglecting everything else. The apartment was left in a filthy state, with dirty dishes, unclean surfaces, and an overall lack of attention to detail. It was evident that they were more interested in making a quick buck than ensuring a comfortable and hygienic stay for their guests.

In conclusion, while the staff at Villa Apartment may appear pleasant on the surface, it becomes clear that their primary focus is to exploit guests and extract as much money as possible. The exorbitant pricing, relentless scrutiny, and subpar cleanliness standards make this establishment one that I cannot recommend. Save yourself the frustration and seek out alternative accommodations that prioritize their guests' satisfaction over their own financial gain.

Additionally, it is worth mentioning that the numerous five-star reviews you may come across for this establishment are highly suspicious. It seems that these glowing reviews are either fabricated by the staff themselves or by random individuals who have no genuine experience staying at the Villa Apartment. It appears that there is a concerted effort to artificially boost the business's reputation, further casting doubt on the integrity of the establishment.

Furthermore, upon researching the owner of the Villa Apartment, it became apparent that they own several other hotels, most of which have similarly negative reviews. This pattern raises serious concerns about the owner's commitment to providing quality accommodations and suggests a consistent lack of attention to customer satisfaction across their properties.

Given these circumstances, I strongly advise potential guests to exercise caution and consider alternative options when seeking accommodation. It is essential to prioritize reliable and trustworthy establishments that prioritize customer service and deliver on their promises, rather than falling victim to deceptive tactics and disappointing experiences.","The room was excellent except the bathroom could use more attention in cleaning, however, we are still able to handle it. We love the place overall as it was way beyond our expectations from the prices we paid especially including breakfast! I would highly recommend anyone to come to this place for an affordable trip to Bali and explore the island. Relaxing within the property for a day or so is good too especially by the pool. When we were there, it was not crowded at all, thus, why I thought it is a good place to relax within the property."
ChIJAcRO4X1H0i0RT7tPDLanlgM,Lacrissa Bali,-8.6704916,115.1764441,"Jl. Taman Sari Asri No.99A, Kerobokan Kelod, Kec. Kuta Utara, Kabupaten Badung, Bali 80117, Indonesia",https://maps.google.com/?cid=258578428952820559,OPERATIONAL,+62 851-5811-7770,hotel,"hotel, lodging",4.8,32,,"Nice place to stay in Bali, clean rooms and easy access. The place is quite unique because its made from a container, but it’s not hot at all beacuse the AC worked very well.","Love the place, unique design and so cozy.. Easy access, very clean, very comfort. For sure will stay here for my next trip to Bali.. Thanks a lot..","Loved staying here. Such a nice place to stay. Good layout, very unique. Good AC. Staff were really nice and great service. Will definitely stay here again!","lovely hotel and very comfortable, quiet neighbourhood.",nice place to stay in Bali and super affordable
ChIJueSjPHtH0i0RUs6tEhtOVEQ,Kubu Manggala Villas Seminyak,-8.6700312,115.17403990000001,"Jalan Mertasari Yasa bali utama No. 13, Pengubengan, Seminyak, Kerobokan Kelod, Kec. Kuta Utara, Kabupaten Badung, Bali 80361, Indonesia",https://maps.google.com/?cid=4923646170807258706,OPERATIONAL,+62 361 9348658,,"cottage, resort_hotel, hotel, lodging",4.5,295,,Excellent Villa... Very good service and staff members were helpful... Loved the stay and we wished we could stay a bit longer.. The rooms and pool were very neat and clean... The villa also has a kitchen with it which makes it very helpful to prepare meals... They also provided us with basic cutlery and a stove for cooking... Enthralling experience staying here and strongly recommend everyone to have a stay here...,We were just surprised. The place had a simple yet so relaxing vibe. It was a cute little villa and the room was so nice and cozy we had booked only for a night but we wished we had booked for more days . The staff was very friendly. Since we arrived late night and there were no good restaurants nearby we had to order food. The staff was so  kind to receive it  and bring it to our villa.,"We rented the largest villa for our extended family. The villa was spacious with a private swimming pool, a comfortable living room, and a dining area. No major complaints during our stay; we enjoyed our time at this villa.

Some notes that the management could use for improvement:

There were many mosquitoes in the room, possibly due to the open toilet, which was quite bothersome.
The bathroom towels were starting to wear out and seemed to have been used excessively. It's time for a replacement.
The breakfast menu was standard and could be improved.","Really Bad Service provided by the Villa. You will not get the service for which you paid for. The staff and the manager/owner is very rude and after 10pm only the security personnel is available, so if you have any issues with anything you have to wait till next morning till the staff arrives. I had the cooling issue with Air conditioning in the provided room, and upon 45min-1hr after complaint in the alternative room provided by the security personnel which has the same issue with poor cooling from air conditioning.",Overall very good rooms and service.. But location is a bit far from the main area.. And main point is no dinner is available..kitchen is there to cook food..ambience is superb..
ChIJ-0lfW0hH0i0RrGzquf-WyGw,Penginapan Mustika Indah,-8.670697500000001,115.17911210000001,"85HH+PJH, Jl. Gunung Salak, Padangsambian Klod, Kec. Denpasar Bar., Kota Denpasar, Bali 80117, Indonesia",https://maps.google.com/?cid=7838681176518323372,OPERATIONAL,,,lodging,4,73,,Cheap accommodation in Kerobokan Area,Good,Good,,
ChIJhwdtdL1H0i0Ro9NdKMc1z38,Nena Cafe (#1 Kebab & Shawarma),-8.6723542,115.1770688,"Jl. Taman Sari No.2a, Kerobokan, Kec. Kuta Utara, Kabupaten Badung, Bali 80361, Indonesia",https://maps.google.com/?cid=9209638892487955363,OPERATIONAL,+62 823-4084-7668,cafe,"cafe, food",4.3,292,,"Very Hommy, food are amazing! I love Nena Kebab & Shawarma. The best in Bali so far although they only served chicken. Hopefully they will serve lamb & beef in the future. The Kebab is big and full filling. Toilet is clean and unique. I love this place very calming and intimate and open till 2AM! Amazing. Easy access and park with car or motorbike. Nena kebab is est. 1934 so it's legit!

The garlic sauce is amazing! Btw you must try their King Kebab. Btw please add chili sauce, it's great in Indonesia has Chilli Sauce. Still asking why they only provide ketchup not Indonesian Chilli Sauce coz it's gonna be amazing. Next time I will bring my own 😆","Black wrap looks mouldy.
Some of the chicken is very dry and hard.
Black particles inside the dry chicken.
Souce is nice.
I wouldn't eat it, if wasn't hungry.
Didn't enjoy it.","I ordered King Kebab
It's big enough, about 35cm long, and 4cm thick
Contain most of the chopped chicken, lettuce, and onion with curry seasoning.

But it's dry for me, I think it needs more salt and sauce in it. They gave me 1 red salsa and white seasoned mayo, it taste ok but too little.

It's worth the prize as the size, could make your belly full.

But for me, it's 7/10
Add more salt and sauce dude!","The food is awesome and I like the place and great for couples.

The price for the food it is cheap and I will recommend to others to try out.",Amazing kebabs and wraps for great prices!  Portion and flavors really justify the affordable price. I order here 3 times a week for lunch and the quality is consistent. White sauce and passion fruit juice are awesome!
ChIJ32KRRklH0i0Rvck3OrDIHzs,OYO Life 90835 Bagus Jaya Residence,-8.6681258,115.18168699999998,"Jl. Tangkuban Perahu Utara Kavling Tegal Bintang No. 1, Tegal Buah, Kerobokan, Padangsambian Klod, Kec. Denpasar Bar., Kota Denpasar, Bali 80361, Indonesia",https://maps.google.com/?cid=4260344431732312509,OPERATIONAL,+62 21 29707601,private_guest_room,"private_guest_room, lodging",4.4,198,,"Plusnya Letak strategis 15 menits to north kuta 15 minutes to denpasar

But, sangat banyak kekurangan : old building, unprofessional staff, no room service, old tv local channel, conventional water heater with LPG burn, lack maintenance , dirty, rats. I stayed here for almost two months and they always slow respon, so it’s enough. Other place have better quality and service with the same or less prices.

Additional Info: Mini market open 7am-9.30pm, complete.
Lokasi nya sepi. Quite location.
Dogs and kittens without owner ask you food. Pity them. :(
2mio per month exclude the electricity cost. They will charge you 2500idr per KWH

I hope you have wonderful holiday in bali :)",It is a very nice hotel two spend some nights. Its i  a quiet area but 20 minutes driving (motorbike) from kuta. It has a nice pool and also it has clean rooms,Great homestay! Nice and big rooms although toilets and kitchen a bit old and not well cared.,Good place to stay with a quiet environment and fresh atmosphere. Nice staffs and affordable price,Best guest house / hotel in between denpasar city and Batubelig ( Seminyak)
ChIJ15OIQmRH0i0RBKM6E2jDHqc,Pleasant Bali,-8.6705144,115.1766746,"Jl. Taman Sari Asri No.101, Kerobokan Kelod, Kec. Kuta Utara, Kabupaten Badung, Bali 80117, Indonesia",https://maps.google.com/?cid=12042277305401910020,OPERATIONAL,+62 812-8081-750,hotel,"hotel, lodging",4.9,62,,"The host was really nice and we felt comfortable. Sadly we didn’t got the room next to the pool even if it was free. The AC in the room was great, because it was not right infront the bed so it wasn’t too cold. The location could be better, but all it total we would recommend staying there. :)",Host is very friendly and helpful,Really cosy and clean rooms. It’s in a nice location and the owner is really friendly and great service here. Will definitely stay here again!,"It’s quite cheap and very strategic, the owner is a friendly out-going person. The hotel was nice, unique and very comfy. Overall excellent!","Nice, simply place to stay, located in the center of city but its not noisy."
ChIJDRAnaGtH0i0Rrcdu61J9bDA,Wasurf Bali - 와서프발리,-8.672159500000001,115.1790006,"Jl. Gunung Salak Gg. Wanasari No.15, Padangsambian Klod, Kec. Denpasar Bar., Kota Denpasar, Bali 80221, Indonesia",https://maps.google.com/?cid=3489301606395987885,OPERATIONAL,+62 811-3806-793,,lodging,5,17,,Good service 🔥🔥🔥🔥🔥,Cool place,,,
ChIJe0gOeklH0i0R4Npq05gfl80,Collection O 91684 Pondok Syariah,-8.6697322,115.1822196,"0361 Gang Perancis, Padangsambian Kelod, Denpasar Barat, Denpasar, Bali, 08361, Padangsambian Klod, Kec. Denpasar Bar., Bali, 80361, Indonesia",https://maps.google.com/?cid=14814344240501021408,OPERATIONAL,+62 21 29707601,hotel,"hotel, lodging",2.4,25,,cheap. not bad.,,,,
ChIJoxsxPUlH0i0RKJJBk7a11dc,Penginapan Tegal Indah,-8.6688262,115.1806459,"85JJ+F76, Jl. Gn. Tangkuban Perahu Gg. Saraswati, Padangsambian Klod, Kec. Denpasar Bar., Kota Denpasar, Bali 80118, Indonesia",https://maps.google.com/?cid=15552536683953099304,OPERATIONAL,+62 813-3845-8464,,lodging,4.1,51,,,,,,
ChIJgXqhH95H0i0RZErHSYXDXHc,Canina Living,-8.6713752,115.1759928,"Jl. Taman Sari Madu No.8, Kerobokan Kelod, Kec. Kuta Utara, Kabupaten Badung, Bali 80117, Indonesia",https://maps.google.com/?cid=8600964365606668900,OPERATIONAL,+62 812-4635-0041,private_guest_room,"private_guest_room, lodging",5,11,,"An awesome place to stay! They are differènt from the other placea around since they are a gated place. I feel more save and secure staying here

They also have a minimalist contempory design, not like other places you ussually find in Bali","Amazing stay in Canina. Brand new place, quiet and clean. No noisy neighbours. A gem in Kerobokan. Convenient location and reasonable price. Thank you for everything",,,
ChIJke99_0ZH0i0RGxvdj14Rmgc,Aftertaste Coffee & Breakfast,-8.6705764,115.17426569999999,"Jl. Merta Ayu No.17, Kerobokan, Kec. Kuta Utara, Kabupaten Badung, Bali 80361, Indonesia",https://maps.google.com/?cid=547769402517166875,OPERATIONAL,,breakfast_restaurant,"breakfast_restaurant, restaurant, food",4.7,334,PRICE_LEVEL_INEXPENSIVE,"This place was an absolute gem!

Very chill and homey place we went to to get DELICIOUS breakfast! The staff was very friendly and helpful in answering questions about the menu. Food came out a bit slow since we ordered a bunch of different meals, and there were possibly only a couple of cooks preparing them, but we didn't have a problem waiting since the place was cozy and everything we ordered came out perfect.

Good value for money through and through. Well done!","Absolutely lovely little cafe that is unpretentious and serves affordable food and drink. Its near where i live and found it randomly on google, glad i did.

I had a keto breakfast with eggs, mushrooms and potatoes. Coffee was also pretty strong. Staff was friendly and very helpful. Go!","Sorry for the 1 star. But I think they deserve it.

I went to this once place few years ago coz my friends brought me there. Today i went there with my bf coz we're just moving in the area and accidentally find this place.

We ordered juice was good and we ordered keto breakfast with fruit salad.

- First it took ages for the food to come where there were only 3 other customers. The fruit salad came literally 40 minutes later and it was the worst fruit salad. They put shared cheedar cheese on the fruit without honey, yogurt or anything. My suggestion is they should put nothing instead.  My bf is a cheese lover but didnt think it was good and he were rather disappointed.

- 2nd, the keto breakfast finnaly came after 1 hour and it was waay too salty. I had to spit out because it was tasted like just salt. When I told them it was to salty in a nice way. They dont even come to my table to ask, apologize or do anything.  Come on its just an egg which cost less than 2k per egg and they cant change it while charging almost 50k for small omlete, tinny bacon which cut into tiny pieces, a bit a mushroom,  few cut of potato and tomato. They literally choose to ignore me and just ask from the chasier desk what and which part salty.  I told them the omlete , the mushroom, the bacon and the potato aswell.  The mushroom partly salty but the egg is imposible to eat. I told them maybe you pour too much salt powder on top? And she said we never pour salt on top (which i can clearly see the salt shining like crystal on top of the fried potato you can see from the foto).

We ended up not eating most of the food tho we were starving and wasted 1.5 hour sitting in their uncomfortable chair.

Then when we paid, They charge me full price which i expected. But they didnt not even apologize or say anything for serving me this terdible food.","An affordable breakfast place that located quite hidden from main street, usually crowded with people when breakfast time. I ordered their sandwich, they taste pretty good but overly salty. Gonna come again to try another menu.","Great place for breakfast. Found my way to this cosy little hut after 5 days in Bali and didn't regret it! Eggs Benedict was eggcellent, Baby greens were yummy. Highly recommend for anyone on the area. 👌"
ChIJ77WIMD1H0i0RAK7Cmdv8F18,Medium Well Apartement,-8.664293899999999,115.17742829999999,"Jl. G. Patas. I No.8, Padangsambian Klod, Kec. Denpasar Bar., Kota Denpasar, Bali 80117, Indonesia",https://maps.google.com/?cid=6852223378175208960,OPERATIONAL,,,lodging,4.6,42,,"Good size rooms, price was ok. Theres a few local warungs around, staff are friendly but no english.",Great location... New building... Monthly rent is available.,Clean and cozy place. Not allow pats,Anyway the place its nice,"Nice ,homie"
ChIJPaKZ1kdH0i0RjedLrlG8u44,UMANEJO Taman Sari,-8.6710084,115.17691669999999,"Jl. Taman Sari No.12, Kerobokan Kelod, Kec. Kuta Utara, Kabupaten Badung, Bali 80117, Indonesia",https://maps.google.com/?cid=10285021233033242509,OPERATIONAL,+62 812-3918-997,private_guest_room,"private_guest_room, lodging",4.7,42,,"Definitely quiet and clean place
If you looking for privacy and green environment this is the place you looking for, highly recommend 😊",Nice rooms and price but little far from beach,"Quite place,nice garden hall,cozy room,fast internet,service needs to be more responsive .will be the.best.",The room is very clean and nice. It also has a small front yard.,"Very nice rooms , all include, wonderful staff, nice shops and restaurants nearby, what else ?"
ChIJNc7OGmtH0i0RtCGtLU_iicA,Villa Khana,-8.6690516,115.1776802,"Jl. Gunung Salak No.8, Padangsambian Klod, Kec. Denpasar Bar., Kota Denpasar, Bali 80117, Indonesia",https://maps.google.com/?cid=13873868956788138420,OPERATIONAL,+62 877-6028-9361,lodging,lodging,4.7,15,,Ready 13 units rooms for daily or monthly lease,,,,
ChIJm1wNklNH0i0RbL3LC3xsMQE,Pondok segu 2,-8.6676174,115.18179549999999,"Jl. Gn. Tangkuban Perahu No.888, Padangsambian Klod, Kec. Denpasar Bar., Kota Denpasar, Bali 80117, Indonesia",https://maps.google.com/?cid=85969147926396268,OPERATIONAL,+62 812-4692-9497,private_guest_room,"private_guest_room, lodging",4.4,61,,The people who live here is so nice,"Homy, very kind and humble landlord.",,,
