id,name,latitude,longitude,address,url,status,phone,primary-type,types,rating,rating-count,price-level,review 1,review 2,review 3,review 4,review 5
ChIJoxw6cqiC0S0RJj95SWe5f1U,Babi Guling De Bolot,-8.196122299999999,114.90602239999998,"Jl. Singaraja-Gilimanuk, Banjar Asem, Kec. Seririt, Kabupaten Buleleng, Bali 81153, Indonesia",https://maps.google.com/?cid=6160846668531580710,OPERATIONAL,+62 877-6248-5868,indonesian_restaurant,"indonesian_restaurant, restaurant, food",4,431,PRICE_LEVEL_INEXPENSIVE,"First experience taste Babi Guling Buleleng!
Damn! Its spicy!!!! Hot! 😅
But its Okay!
I dont know which menu is spicy but All taste become spicy btw!
—
The server is hot 😛
Ah joke!
Maybe the weather is Hot!! 😀😀
—

Ok overall, if you looking for place to rest from long distance driving! This one good option!","if go to Singaraja via Gilimanuk this place maybe an option to take a break and eat

the price is fair the taste is good but the soup a little bit salty

the view of rice fields make this place so good",This warung sells food made of pork. The taste is good and it's worth the money. The price is only IDR 15K for 1 portion of babi guling. The beverage starts from IDR 5K. There's a rice field view that you can enjoy during eating. The location is on the side of the road so you can easily notice it.,"A decent taste of Balinese foods served here; Lawar, Jukut Ares, Sudang Lepet Jukut Undis, Babi Guling. The taste isn't special yet it isn't bad either, and you can have it in a cheap price. The restaurant is spacious; many seats available, but without big table for group. And the parking is large too.","Kinda clean and good view restaurant.
Food is rice with roasted pork. So spicy with me."
ChIJGYqD1syD0S0Rj5UB3UTcGyE,Perumahan Anakan Sari Seririt,-8.199601,114.90373419999997,"Br, RW23+5F5, Umeanyar, Kec. Seririt, Kabupaten Buleleng, Bali 81153, Indonesia",https://maps.google.com/?cid=2385742615946565007,OPERATIONAL,,lodging,lodging,3.9,8,,,,,,
ChIJP3b4jaiC0S0Rg5H4kbUh-gI,Warung Meilan Babi Guling,-8.195471399999999,114.90789889999999,"Banjar Asem, Seririt, Buleleng Regency, Bali 81153, Indonesia",https://maps.google.com/?cid=214520995975303555,OPERATIONAL,+62 852-3788-8442,indonesian_restaurant,"indonesian_restaurant, restaurant, food",4.1,38,,"Very nice food, suitable place for a stop to eat while travelling to the northern part of  Bali.",Goodlah,,,
ChIJr3CWw9N50S0RQjicos6D-g0,IMAM BAKSO,-8.197469,114.90239199999999,"RW32+2X6, Jl. Singaraja-Gilimanuk, Banjar Asem, Kec. Seririt, Kabupaten Buleleng, Bali 81153, Indonesia",https://maps.google.com/?cid=1007262390185375810,OPERATIONAL,+62 812-4653-0753,indonesian_restaurant,"indonesian_restaurant, restaurant, food",5,11,,The price is super affordable,,,,
ChIJY2JqnSWD0S0RyK9pH8j5OIA,WaPuYe (Warung Putu Yehanakan ),-8.1959378,114.9072768,"Jalan Raya Seririt Gilimanuk Banjar Dinas Yehanakan, Banjar Asem, Kec. Seririt, Kabupaten Buleleng, Bali 81153, Indonesia",https://maps.google.com/?cid=9239409273466367944,OPERATIONAL,+62 812-3674-8464,restaurant,"restaurant, food",4.1,24,PRICE_LEVEL_INEXPENSIVE,"Best warung in bali! We are visit maybe 30 warung, but this is the BEST! Thank you Putu.",,,,
ChIJ3fbXW2N50S0Rf2y2qIFIzzk,Warung Rage,-8.1947826,114.90365579999998,"RW43+3FJ, Jl. Singaraja-Gilimanuk, Banjar Asem, Kec. Seririt, Kabupaten Buleleng, Bali 81153, Indonesia",https://maps.google.com/?cid=4165627902059506815,OPERATIONAL,+62 878-6276-2128,restaurant,"restaurant, food",4.4,11,,love it,,,,
ChIJK_zziAh40S0R823qDr36HW4,WARUNG MBOK LUH DENNY,-8.1977121,114.90104609999999,"Banjar Asem, Seririt, Buleleng Regency, Bali, Indonesia",https://maps.google.com/?cid=7934773808402689523,OPERATIONAL,,restaurant,"restaurant, food",,,,,,,,
