id,name,latitude,longitude,address,url,status,phone,primary-type,types,rating,rating-count,price-level,review 1,review 2,review 3,review 4,review 5
ChIJs2RmXN1F0i0RTpaXGEkTKT0,Denpasar Transport,-8.6705661,115.1883972,"Jl. Gunung Talang No.8b, Padangsambian, Kec. Denpasar Bar., Kota Denpasar, Bali 80119, Indonesia",https://maps.google.com/?cid=4407074915024868942,OPERATIONAL,+62 852-3256-5959,car_rental,car_rental,5,59,,"Nice a rentcar
Fast respon
Good car
Good price","Nice service, helpfully for support all activity & holiday in Bali,

I'll recommendation for all my partner",Nice rent car in bali👌👍,Top 👍,Rental vip 👍👍👍👍👍
