id,name,latitude,longitude,address,url,status,phone,primary-type,types,rating,rating-count,price-level,review 1,review 2,review 3,review 4,review 5
ChIJu6BHqr130i0R_1b-qbgPHyk,Pawon Indah,-8.7541003,115.6042178,"nusa penida, jl Raya, Pejukutan, banjar ampel, Kabupaten Klungkung, Bali 80771, Indonesia",https://maps.google.com/?cid=2963104365633492735,OPERATIONAL,+62 878-6550-6563,restaurant,"restaurant, food",5,24,,"I was making a little stop on my trip around the island with a scooter.

Ordered some fried rice for lunch with fried egg on top and it was tasty. The two ladies at the Warung were so friendly and we had a lovely chat about the local culture and traditions and talk a bit about the local weaving at the village.

The two ladies were very informative about their village.","Extremely tasty home cooking. I got the Fried Rice Chicken and Cap Cay which I combined. The result was delicious.

The amount of spice was perfect for me but if don't like spice I suggest you say so when ordering.","Love it😊 great local food, super nice people and kids! Be back❤️","Nice place and The food was very delicious 😊❤️,very recommended for all of you if u wanna try Indonesian food ❤️",Good food
ChIJmQ-UuCl30i0RwV7Dlwxo_2M,Warung Bukit Kelapa,-8.752488,115.60239749999998,"Pejukutan, Nusa Penida, Klungkung Regency, Bali 80771, Indonesia",https://maps.google.com/?cid=7205592332111142593,OPERATIONAL,+62 831-1507-8210,restaurant,"restaurant, food",5,17,,"Very nice place to eat! It is run by a wonderful family dedicated to preparing food, making homemade clothes and they also sell petrol. The service was very kind and the food was delicious!
Terima kasih! 💜","Very cute little warung with basic indonesian food, owned by extremely kind an honest people.
The fried rice was honestly one of the most delicious one I had in a long time! Come here if you would like to have some delicious, affordable home-cooked food whilst helping the local community!","Great food in a tiny, family-run setting. We stopped here on the way back from Atuh Beach for some Nasi Goreng. Full of flavour and freshly made 👌🏽The family is welcoming and kind. Recommended 🥰","Amazing place to stop to have nice local food (coming back from atuh beach it's very close from the main road and easy to find, it's a good road) the food is very good and cheap and the people there are so nice and smiling!! they make beautiful sarongs with a traditional machine, It's an incredible work (3 days to make one) I bought one and I encourage everyone to stop there to eat, rest or do some shopping!! I will definitly come again!! Thanks ladies ♥️","Cheap meal but very tasty, made by nice woman with her daughter which speaks English and is very friendly and polite. Nice place, good food, very pleasant experience for us. :)"
ChIJN3FeNfZ30i0Ro2ycgW1zGmM,Goa Gede Prehistoric Site,-8.755811999999999,115.60127399999999,"6JV2+MG, Pejukutan, Nusa Penida, Klungkung Regency, Bali, Indonesia",https://maps.google.com/?cid=7141147073312484515,OPERATIONAL,,historical_landmark,historical_landmark,4,4,,"It is not a tourist attraction. It's a religious cave temple for local people.

The road is so bad, a local leader offered to take me to the cave for free by scooter. Unbelievable how good people are. They didn't even ask for a donation, I had to ask if I can make one, love it. This is what I call an authentic local experience.","Not a tourist attraction…
Just a cave - road there is very difficult and it’s used for religious purposes I believe",,,
ChIJX0CAPl530i0RMgTuZw0vka4,Warung Batu Jaran,-8.751400799999999,115.59871849999999,"Ampel, Pejukutan, Kec. Nusa Penida, Kabupaten Klungkung, Bali 80771, Indonesia",https://maps.google.com/?cid=12578886968847238194,OPERATIONAL,+62 831-1509-4209,restaurant,"restaurant, food",5,7,,Nice place to have a snack in your way to Atuh Beach ;),good view and good food,,,
ChIJx-5ZfsF30i0R80SgbKz_RM4,The Sandat waroeng,-8.754171800000002,115.60459689999999,"6JW3+8RQ, Pejukutan, Nusa Penida, Klungkung Regency, Bali 80771, Indonesia",https://maps.google.com/?cid=14863285786251379955,OPERATIONAL,,restaurant,"restaurant, food",5,1,,,,,,
ChIJBTV5-_930i0R0aDFdakuDWQ,Food Stalls Drink,-8.752705599999999,115.60248389999998,"dusun Ampel, desa pengukuran, kecamatan Nusa penida, kabupaten Klungkung, propinsi Bali, 6JW2+WX9, Pejukutan, Kec. Nusa Penida, Kabupaten Klungkung, Bali 80771, Indonesia",https://maps.google.com/?cid=7209469883850268881,OPERATIONAL,+62 823-4066-7798,restaurant,"restaurant, food",4,1,,,,,,
ChIJ5x9KWId30i0Re6j2PhahWmM,Warung Nasi Bu Rani,-8.7544435,115.60484170000001,"Unnamed Road, Pejukutan, Kec. Nusa Penida, Kabupaten Klungkung, Bali 80771, Indonesia",https://maps.google.com/?cid=7159211674576529531,OPERATIONAL,+62 823-4125-7128,restaurant,"restaurant, indonesian_restaurant, food",,,,,,,,
