id,name,latitude,longitude,address,url,status,phone,primary-type,types,rating,rating-count,price-level,review 1,review 2,review 3,review 4,review 5
ChIJkbNGD1UR0i0RWeloMNnf07k,Chez Bisma,-8.4781476,115.44783830000002,"Br.Lantangkatik, Telaga Tawang, Kec. Sidemen, Kabupaten Karangasem, Bali 80864, Indonesia",https://maps.google.com/?cid=13390292241015695705,OPERATIONAL,+62 813-5326-9496,private_guest_room,"private_guest_room, lodging",4.9,73,,"the rooms are nice and comfortable, the surroundings are very quiet plus the sounds of nature. friendly service, strategic location if you want to go to other sidemen areas.","I just spent a night here before a trail run (there is some magical scenery within walking distance of Chez Bisma) and was pleasantly surprised at how clean, spacious and quiet the room was (I'm quite picky when it comes to cleanliness). Loved the outdoor shower with view of the surrounding forest and stars at night. The family was very welcoming and made me feel at home. It's a humble spot that's perfect for some peace and quiet in Sidemen's countryside.
Would definitely come back here!","A lovely place to stay and the host family members are delightful. Excellent value.
The rooms are quite new and very clean.
The indoor/outdoor bathrooms are special, particularly the shower.
Breakfast is included and other delicious meals are available","Very nice accommodations!
The owner and his family is very sweet and helpful. You can rent scooter with helmet, he can drive you in the car, he have many good suggestions for what to do in the area. The breakfast is simple and very tasteful, and you can order lunch and dinner, which is nice if you just want to relax in the amazing surroundings.","We only stayed for one night but this is a place you can easily spend a couple. The family is so nice and we had dinner as well which we would really recommend. The room was perfect and from our outside shower we looked directly into the jungle… simply lovely!

Thanks again for having us."
ChIJ73Uw5gkR0i0RkP4311hqExo,Tuak and karaoke,-8.4801486,115.4475003,"GC9W+VQW, Telaga Tawang, Sidemen, Karangasem Regency, Bali 80864, Indonesia",https://maps.google.com/?cid=1878962399344066192,OPERATIONAL,,bar,bar,5,2,,These guys know how to have a good time 🤙,,,,
ChIJxy5_n6oR0i0R3YD0QVWWYsA,Pura TAMAN telaga Tawang Sidemen,-8.4838971,115.44759579999999,"Jalan raya Semarapura Klungkung, GC8X+C2X, Telaga Tawang, Kec. Sidemen, Kabupaten Karangasem, Bali 80864, Indonesia",https://maps.google.com/?cid=13862807895922737373,OPERATIONAL,,park,park,,,,,,,,
ChIJ76LkUwYR0i0RC8-ubLZTdmg,Kubu males,-8.4775,115.44771499999999,"GCFW+7V8, Telaga Tawang, Sidemen, Karangasem Regency, Bali 80864, Indonesia",https://maps.google.com/?cid=7527295870168911627,OPERATIONAL,,park,park,,,,,,,,
ChIJQ3mKJwAR0i0R4Cpk1WqvnkY,Rumah riski,-8.477519599999999,115.44742719999999,"GCCW+XXV, Telaga Tawang, Sidemen, Karangasem Regency, Bali 80864, Indonesia",https://maps.google.com/?cid=5088697502356744928,OPERATIONAL,,private_guest_room,"private_guest_room, lodging",,,,,,,,
ChIJvwY_jhUR0i0RCb6MYItuJwc,Massmull,-8.4772736,115.44728699999997,"GCFW+7V8, Telaga Tawang, Sidemen, Karangasem Regency, Bali 80864, Indonesia",https://maps.google.com/?cid=515502227256557065,OPERATIONAL,,,lodging,,,,,,,,
