id,name,latitude,longitude,address,url,status,phone,primary-type,types,rating,rating-count,price-level,review 1,review 2,review 3,review 4,review 5
ChIJsXwbo0NH0i0RsMSSWCz12E0,RedDoorz Plus @ Mahendradatta Denpasar,-8.6690833,115.188527,"Jl. Buana Raya No.100xx, Padangsambian, Kec. Denpasar Bar., Kota Denpasar, Bali 80119, Indonesia",https://maps.google.com/?cid=5609502906703332528,OPERATIONAL,,hotel,"hotel, lodging",4.1,192,,"It was horrible ! The worst hotel i went to. We didn't stay the all trip. We didn't get a refund as well !!!!
It was not clean, smell like cigarettes.....","This is my second time i stayed here. The first time was awesome, room is nice, comfortable and clean.

Recently i visited this place again, hoping i could find the same hotel i used to stay, but it changed so much. First, they asked me to pay additional 50k a day because i requested room with two beds (they also told us that room with two beds only available in the first floor). So we paid the additional 50k but they still gave us room with only one bed. We tried to complain but the receptionist gave no response, they finally let me move to the two beds room around 8pm.

The second room was a lil bit smelly, the light is also dirty :') the bathroom equipments are rusty (like in the pic). After two days staying in that room, the AC water was leaking caused water puddle everywhere. We finally moved to the other room.

Me and my brother expected to swim there, but we discouraged ourselves because the pool was dirty as hell, the water is green and there were so many trash under the pool floor (u guys are lucky that i lost the pool photos)

The only thing that i like staying here is bcoz there's a lot of street food outside, halal food also.

Am i coming back to this hotel? Definitely no :) +50k additional charged made this stay even more not worth it. Sorry guys, u used to be my favorite but u have disappointed me so much :)

Update: there's actually a photo to show that the pool was green, this hotel is so Lucky i dont have that dirty trash photo of the pool",the location is located in the heart of city. you only need couple of minutes to reach your destination. i chose this hotel because its location. no breakfast is OK. since you can take out your breakfast/lunch/dinner.,"Cozy place, cheap, peacefully and very recommended to stay. The staffs are kind too. You can see the good view in 3rd floor at midday. There's place for eat in front of hotel like meatball and warteg. Located in Mahendradatta, Denpasar city","Very bad room, very bad service, very bad condition in toilet, all very bad. I never go back in there"
ChIJ6c1Wzg9H0i0REYmSFU91N2w,Seblak Gorilla & Baso Aci Bandung,-8.666517299999999,115.1881428,"Jl. Buana Raya No.45A, Padangsambian, Kec. Denpasar Bar., Kota Denpasar, Bali 80119, Indonesia",https://maps.google.com/?cid=7797830262340094225,OPERATIONAL,+62 812-1445-1792,restaurant,"restaurant, food",3.6,249,,Very bad,Lelett,Good.. delicous🤤👍,Good,
ChIJhXB0LktH0i0RZptULwHwWug,Ozora Guest House,-8.6690977,115.18852710000002,"Jl. Buana Raya No.100xx, Padangsambian, Kec. Denpasar Bar., Kota Denpasar, Bali 80119, Indonesia",https://maps.google.com/?cid=16742958452582947686,OPERATIONAL,+62 851-5658-2285,hotel,"hotel, lodging",4.3,279,,"it's a affordable option for backpacker, the room was good.

just the pool is not clean, I want to swimming there's but the water was green, also the toilet / shower really need improvement on the hygienic","The best reddoorz I've tried so far!
I booked deluxe room.
Very spacious. They do room cleaning in the morning, without my request and they did gave the amenities package again eventhough I didn't use the one from yesterday.
The staff are friendly too.
A lot of options of food around this place.
Definitely will stay in this again if go back to Bali.
Thank you.","Nice staffs always friendly... nice and clean bed. I would love to stay there again and recommend it to the visitors who are concern about clean and calm place to stay during your vacation. Another thing, it's not too far to the city.","Rooms are nice and clean. Bathroom ok but the shower head doesnt work perfectly (its ok for me).
This place got small pool, billiard table, and most important, cheap price!",the receptionist guy was so rude when all i did is to ask for a wifi password. just fire the guy.
ChIJTbFFZEpH0i0REL-UzLo8Zi0,Ganesha Home Stay,-8.671560099999999,115.185447,"Gg. Jepun II, Padangsambian Klod, Kec. Denpasar Bar., Kota Denpasar, Bali 80119, Indonesia",https://maps.google.com/?cid=3271368952325127952,OPERATIONAL,+62 818-0477-7555,private_guest_room,"private_guest_room, lodging",4.7,12,,"I'm sorry. I'm not recommended this homestay. My family had a weird nightmare. Suddenly the electricity stopped. Don't have any response from the owner. And the owner allowed us to get our puppies at home. And after a few days I have a complaint from neighbors. And also the balcony is not allowed for the guests. And also motorcycle from my friends are also complaining. Sorry, started we rented this homestay. The owner haven't said anything about rules and regulations. I'm sorry, not recommended",,,,
ChIJ_eppFkxH0i0RhBGY3xyouv4,Valoma Guest House,-8.6664355,115.18324659999999,"85MM+C7H, Gg. Fujiyama, Padangsambian Klod, Kec. Denpasar Bar., Kota Denpasar, Bali 80117, Indonesia",https://maps.google.com/?cid=18355168073265713540,OPERATIONAL,+62 21 29706666,hotel,"hotel, lodging",3.8,139,,"Booked two nights, and when we arrived the place looked closed down. While we waited for a call back from the reception (as there wasn't anyone there) we had a look around... The pool was green, dirt and dust everything, ladders and stuff lying around! Nothing like the pictures. The room looked okay through the window but after looking around we had already decided not to stay. Take a look at the pictures and make your own mind up... I guess lockdown wasn't so kind on this place!","Quiet nice place for stay around Padangsambian. Affordable price but the access to this hotel little bit bad. The facility I think need to be upgrade. Like provide more water for the customer as long as they stay at the hotel, no toothbrush, the towel is not that clean","Thr guesthouse is located at the end of a small road in a quiet area with lots of local people. The next supermarket is about 10min walk away, but there are many warungs in the neighbourhood.
Very friendly owners, who are 24/7 there to help you out. The breakfast was nice, especially the smoothies :)
The room is clean and cozy. They have wifi, but the signal is not that strong in the rooms.","Tucked in the very end of the lane down the road, still it keeps a beautiful tiny secret inside. Though, you will doubt it when you first see it, you can't of course see it from the front of the gate.

Nice staff, nice owner, the breakfast is good, it's worth for money to come here.","Nice housekeeper that available if you need him almost 24 hours, clean bedsheet and towels with shampoo and liquid soap amenities, though I bought another soap bar because their soap and shampoo made my skin and hair dry. Location is away from noises and many local 'warung' along the street. A nice food stall would need 15 minutes walking and you have to google the way. Wifi dead while I stayed for 3 days 2 night, pantry not cleaned properly, bathroom and wastafel need paid attention with cleaning details. Wifi dead was a big problem for me since the signal inside my room is rather poor so I have to open my window that face to the neighbourhood to get some signal and finished my work."
ChIJnR9jnhRB0i0RqF20ziN6vHk,Ayam Betutu Bu Ferdi,-8.668111099999999,115.19089969999999,"Jl. Buana Kubu, Tegal Harum, Kec. Denpasar Bar., Kota Denpasar, Bali 80119, Indonesia",https://maps.google.com/?cid=8772020468421254568,OPERATIONAL,+62 813-3807-0288,restaurant,"restaurant, food",4.5,421,,Well for food lovers.. try it. Worth to try. There some menus to pick. Specially betutu chicken.,"One of good ayam Betutu in Bali. My breakfast experience is pleasant. Delicious chicken and soup, Sate lilit is the champ, big chunk of meat than others I usually have. The spiciness level is perfect. Considerable portion and price. Small place, clean but no ambience. A good option for breakfast in Mahendradatta area.",place is homey. 20k for ayam betutu campur and 5k for teh hangat. taste is great. one of the best betutu in town. price is average n affordable. you could get cheaper price if you take a way (only 15k),"Solution if you need rice box in large amount, affordable price, great taste","Just discovered this place and now it become our go-to for Balinese betutu chicken rice. Incredibly flavour full, big portion and reasonable price. Definitely one of the best local eatery around Denpasar."
ChIJwXFstkpH0i0RiNCXx2Vzr2E,A Loft Apartment Bali,-8.671278899999999,115.1885303,"Jl. Gunung Talang No.9, Padangsambian, Kec. Denpasar Bar., Kota Denpasar, Bali 80119, Indonesia",https://maps.google.com/?cid=7038971623580881032,OPERATIONAL,+62 818-555-289,hotel,"hotel, lodging",4.7,51,,"I enjoyed my 6 week stay with Natalia a lot. It’s an affordable, clean, great apartment, with everything you could need for a long stay. Natalia is really responsive and gets stuff done fast. The girls working in the office are also very hardworking and caring. Nothing bad I could say about the place. If you are thinking about staying here, don’t hesitate.","we are  staying at the house with 2 Bed Room , Very warm and Lovely Owner Natalia ❤️ who are always concerned about our staying here ,and i cant thank her enough bout this ❤️.
teh staff is amazing ,
The place is quiet and very comfy with a clean pool...
theres a 24 hour local shop in front of the apartment which helps us a lot in getting what we need , and lots of laundry just next to the apartment .
Overall i would definitely stay here again if im in bali , and if that is if they still have available 😂, they are always full..
anyway , it's a very very recommended place to stay for holidaycation.","Safe and comfy place! Owners are absolutely special couple, always nice, helpful and friendly. The room is very clean, spacious and airy.",Absolutely gorgeous place. Linked us with a driver to pick us up at the airport and gave us a good reference for a scooter rental. Easy recommendation!!,Great place to stay an extremaly welcoming host.
ChIJh_Cl8WZH0i0RBl0oViTyF1s,RedDoorz @ Jalan Gunung Talang Mahendradatta,-8.6700316,115.1876965,"Jl. Gn. Talang IA No.6A, Padangsambian, Kec. Denpasar Bar., Kota Denpasar, Bali 80119, Indonesia",https://maps.google.com/?cid=6563981219794017542,OPERATIONAL,+62 21 80629666,hotel,"hotel, lodging",4.7,65,,"Overall, this is a great value hotel
💰Price
This is a relatively cheap accommodation compared to similar hotels, considering the location in west Denpasar and close to many food stalls & local minimarkets.
📍Location
It is located in a narrow alley but a car can go inside the alley. Parking lot is not enough for cars. One thing to consider is this hotel is also in a dense neighborhood, so you will hear roosters intensely in the morning and sometimes children crying.
🛌 Room
The room is neat and clean. The blanket is soft. Essential amenities present unless clothes hanger. Toilet is clean and bright, but no place for putting our brush and soap. Main ventilation is on the window next to the door, but it is difficult to receive sunshine.","Comfort stay for a cheap price & should use motorcycle when u stay in here because nothing nearby
But overall it was good","Excellent, perfect, clean, good smell room⭐⭐⭐⭐⭐",Top,
ChIJC6UaojpH0i0RPAPCPYnRuKE,Tata's Pudding,-8.6671205,115.1882852,"x ( depan spbu, Jl. Buana Raya No.47, Padangsambian, Kec. Denpasar Bar., Kota Denpasar, Bali 80118, Indonesia",https://maps.google.com/?cid=11653294423198008124,OPERATIONAL,+62 817-9427-277,cafe,"cafe, food",4.7,333,,"Stunning tasting puddings with equally nice drinks, with service to match.

I stumled across this shop as I had an hour to kill between meetings.

The presentation of the food and shop itself are as impressive as each other.

With only 8 seats in the shop, which could easily accommodate 5 tables of 4 people, it is clearly aimed at the wholesale and takeaway market. I'd still take the time out to pop in and sit down in the shop to experience the quality of their puddings.

The service was so friendly and helpful, too.

I ate the Klopertart Ori Mini which cost Rp 15,000 (£0.75). This was a vanilla tasting custard with a few sultanas and almonds, I think. Stunning taste.

The drink was one of their 3 Silky Drinks. I chose the Korean banana milk. It had a layer of chocolate at the bottom which broke into lumps which seemed strange at first, but tasted nice.","So in love with their product. But unfortunately the Vla's a little bit watery. Price are slighty pricey, the staffs are SUPER FRIENDLY, the have promos every weeks and the rest are very good",Always been our favorite pudding since long time ago! And they always innovative with the new menu. Yummy and highly recommended❤️,Delicious pudding with affordable price. Very recommended!,It’s a very very very delicious treats! And always a brilliant idea to sent as a gift or hampers! The staffs are also fast reaponding if you buy online. Have ordered many many many times as they never fails 👍🏼
ChIJhd2AwAJH0i0RjcIGQDCGIoc,Adhya Apartments,-8.6717024,115.1854193,"Jl. Bikini No.30, Padangsambian Klod, Kec. Denpasar Bar., Kota Denpasar, Bali, Indonesia",https://maps.google.com/?cid=9737492886119170701,OPERATIONAL,+62 811-8840-412,,lodging,4.6,26,,"I recently had the pleasure of staying at Adhya Apartments for four months, and it was an absolute dream. The room itself was comfortable and inviting, providing a perfect haven to relax after exploring the beauty of Bali.  An added bonus was the well-equipped kitchen within the room. This allowed me to prepare meals at my leisure, which was perfect for those nights I wanted to unwind and dine ""in.""

However, the true highlight of my stay was the pool. It was expansive and impeccably clean, offering a refreshing escape on hot days. Whether I was seeking a morning dip to wake up or an evening cool-down, the pool never failed to impress.

Overall, my stay at Adhya Apartments was nothing short of idyllic. I highly recommend it to anyone seeking a comfortable and refreshing home base in Bali, with the convenience of preparing their own meals.","I Really love this place, the owner is adorable, and the staff as well. The place is totally new and super clean, decorated with very good taste. The location is Perfect, for holidays or long term also.
I feel like home ! Actually i will be back in a couple weeks here, and wish to stay more next year !
Thank you so much for everything 🙏🫶","Perfect stay! Everything is new, clean and very nice! The owner is wonderful and the place is so quite. Thank you for everything!","Very nice place, good hospitality .. beds where good everything new ..💯👍🏻","Nice to stay in here, the room nice with private kitchen and has a big pool, only stay for a week, the price affordable 👍"
ChIJp43QWelH0i0ROfuOryk0qbU,Kost Alodia Comfort Living,-8.6691576,115.188806,"Jl. Buana Raya No.98, Padangsambian, Kec. Denpasar Bar., Kota Denpasar, Bali 80119, Indonesia",https://maps.google.com/?cid=13090051145572743993,OPERATIONAL,+62 878-6433-9097,guest_house,"guest_house, lodging",4.8,88,,"I'm currently living here since almost 3 years ago. Even though the wifi connection is not the best one but it's still ok. The owner and their staff are helpful. If there is any broken lamp or leaking, they would immediately take action. I recommend this apartment as this is the most comfortable place I've ever had in Bali.","Nice boarding house, safe and quiet",Nice looking place to stay for long term,Ok,Comfortable place
ChIJk3ROk7JA0i0RMtjXbqSU15E,Betutu Bu Lina Gilimanuk di Denpasar,-8.669789699999999,115.1908424,"Jl. Mahendradatta Selatan No.194, Padangsambian, Kec. Denpasar Bar., Kota Denpasar, Bali 81119, Indonesia",https://maps.google.com/?cid=10509031689447528498,OPERATIONAL,+62 819-9997-3114,restaurant,"restaurant, food",4.3,331,PRICE_LEVEL_MODERATE,"Always have the best Ayam Betutu Bu Lina
Special Kuah with Sate Lilit and Plecing Kangkung
Try this Ayam Betutu and have a great taste never change","Betutu Chicken is a traditional meal from Bali, the taste quite hot, because the seasoning is using fresh chili, Ayam betutu Ibu Lina is one of the best ‘Ayam Betutu’ in Bali from Gilimanuk","The betutu chicken is so tasty. If you love very spicy food, this place is a perfect choice. The price for one portion of whole betutu chicken is Rp. 120,000 and it is served with boiled vegetables, peanuts, sambal pelecing and sambal matah. The price for a quarter portion of betutu chicken is Rp. 40,000 and it is served with the same side dishes as the whole chicken has.","One of halal food at Bali, serves traditional Balinese cuisine, Ayam betutu (chicken with spicy sauce). Fried or boiled, you can choose your favorite.","They offer two kinds of Betutu, basah and goreng which has spicy taste. The menu is different from usual lalapan in east java. However it has same taste with spicy chicken taste from east java or Lodho from Tulungagung. Everything is good but it has average taste in me."
ChIJk8lI0ExH0i0RITvWABVCud4,Ratih Bali Hostel,-8.6651137,115.1882756,"Jl. Buana Raya Jl. Mahendradata Gg. Buana Dwipa No.4A, Padangsambian, Kec. Denpasar Bar., Kota Denpasar, Bali 80119, Indonesia",https://maps.google.com/?cid=16048931405087259425,OPERATIONAL,+62 819-9924-5858,hostel,"hostel, lodging",4.2,67,,"I really enjoyed my stay at the place, particularly the soothing sounds of birds in the morning. Although I couldn't identify the specific bird species, I noticed there were hanging cages on the first floor. The location is convenient, with plenty of nearby food options. The staff was friendly and kind. The old-fashioned house evokes a sense of traditional Balinese architecture, and the small balcony on the third floor offers a lovely view of the surroundings. I especially liked the charming little windows. Waking up to the enchanting melodies of birds in the early morning was truly mesmerizing and a delightful treat for the ears.","very nice hostel and amazing host. Only stayed for one night after my flight to get some rest, but definitely recommend it!","Best hostel in Denpasar hands down! The owner made this place feel like home away from home, very kind and helpful. He helped me plan my travels in Bali and recommended places to visit and stay.
As for the hostel itself, the rooms are clean and the AC works well. The beds are quite big for singles and comfortable. There's free coffee and tea and breakfast is included. It's surprisingly beautiful on the inside, and the two terraces have nice views.
The location is perfect if you want to feel like a local as it's in an area with barely any tourism. This means that everything surrounding the hostel is local, the street food is delicious and cheap and you can walk around without getting hassled by street vendors like in the more popular areas of the city (looking at you, Kuta).
Overall, great hostel to explore Denpasar from away from the crowds and with the nicest management in town. Thank you for a great couple of days.",This hostel is a very nice stay. It the rooms are clean and the toilettes are also ok. The host was very sympathic. We got a great meal at the morning the one night we stayed,"Loved the squacky birds, so funny. Best hostel I had been in Bali, in fact the whole of Indonesia. Owner was an absolute top bloke, didn't speak a lick of English but he knew some sign language. Great view of the local yutes from the rooftop."
ChIJT84yIE1H0i0RXrsvqWsXj0A,Kost Wulandari,-8.6642797,115.18730989999999,"Jl. Buana Raya No.42, Padangsambian Klod, Kec. Denpasar Bar., Kota Denpasar, Bali 80119, Indonesia",https://maps.google.com/?cid=4651962691264428894,OPERATIONAL,+62 857-3862-2912,,"extended_stay_hotel, hotel, lodging",4,61,,,,,,
ChIJZdK707RA0i0R6Iv_S7YaTu0,Gulali Donuts,-8.669148700000001,115.1891244,"Jl. Buana Raya No.88, Padangsambian, Kec. Denpasar Bar., Kota Denpasar, Bali 80119, Indonesia",https://maps.google.com/?cid=17099634205433760744,OPERATIONAL,+62 857-3732-2855,cafe,"cafe, food",4.5,88,PRICE_LEVEL_INEXPENSIVE,"The best n cheapest doughnut in Bali, it so fluffy, moist n addictive doughnut.There are a lot of jam n topping u can combine.","Very affordable donuts, they make by themselves so it is always fresh",Home made donuts _ simple.,Nice..,Ok
ChIJCW1GmpRH0i0RqMpGvehZnsM,FAU House,-8.6660363,115.18521249999999,"85MP+H3P, Padangsambian Klod, Denpasar Barat, Denpasar City, Bali 80119, Indonesia",https://maps.google.com/?cid=14095802739859049128,OPERATIONAL,,private_guest_room,"private_guest_room, lodging",5,1,,,,,,
ChIJqwIfPQNH0i0R6EyEOE12dDc,Bakso Urat Mercon Buana,-8.6685331,115.1882012,"Bakso mercon malang, Jl. Buana Raya No.93, Padangsambian, Kec. Denpasar Bar., Kota Denpasar, Bali 80119, Indonesia",https://maps.google.com/?cid=3995948843417226472,OPERATIONAL,,indonesian_restaurant,"indonesian_restaurant, restaurant, food",4.5,71,,"I recently had the pleasure of dining at Bakso Urat Mercon Buana, and it was a truly fiery and flavorful experience that left a lasting impression. This humble eatery exceeded my expectations in terms of taste, quality, and overall dining experience.

The star of the show at Bakso Urat Mercon Buana is undoubtedly their signature dish, the ""mercon"" meatball. These meatballs pack a punch with their intense spiciness, providing a thrilling culinary adventure for those who enjoy spicy flavors. The combination of tender beef and a fiery kick creates a unique and unforgettable taste that sets this place apart from other bakso establishments.

Apart from the fiery meatballs, the overall flavor profile of the dishes at Bakso Urat Mercon Buana is exceptional. The broth is rich and flavorful, infused with aromatic herbs and spices that tantalize the taste buds. Each bite is a burst of savory goodness, showcasing the mastery and expertise of the kitchen.

The attention to detail in the preparation of the dishes is also worth mentioning. The meatballs are handmade with care, ensuring a consistent texture and quality. The accompanying condiments, such as fried shallots, chili sauce, and lime, complement the meatballs perfectly, enhancing the overall taste experience.

In terms of service, Bakso Urat Mercon Buana excels. The staff members are friendly, attentive, and knowledgeable about the menu. They are always ready to provide recommendations and accommodate any special requests. The prompt and efficient service contributes to a pleasant dining experience, making customers feel welcomed and valued.

Despite being a small and unassuming eatery, the cleanliness and hygiene standards at Bakso Urat Mercon Buana are commendable. The dining area is well-maintained, and the kitchen practices proper sanitation, giving customers peace of mind when enjoying their meal.

In conclusion, Bakso Urat Mercon Buana is a hidden gem for food enthusiasts seeking a fiery and flavorful culinary adventure. From the intense spiciness of the mercon meatballs to the overall quality of the dishes, this eatery stands out as a must-visit for those who appreciate bold flavors and exceptional taste. With friendly service and a commitment to cleanliness, Bakso Urat Mercon Buana delivers a delightful dining experience that is sure to satisfy even the most discerning palates.","in accordance with the money spent ... it tastes delicious and very tasty ... next time try the meatballs, yesterday I ate the meatball mercon ... thank you 😁sam oskab ngalam👍",Muantullll,,
ChIJQ2ZlCi5H0i0RJe7bB--6WHs,Pondok Aditya 2,-8.6707661,115.1835503,"Jl. Tangkuban Perahu 156a,, Perumahan Tegal Indah Permai No. 1B,, Padangsambian Klod,, Denpasar Barat,, Padangsambian Klod, Kec. Denpasar Bar., Kota Denpasar, Bali 80117, Indonesia",https://maps.google.com/?cid=8888059400407477797,OPERATIONAL,+62 812-3830-460,bed_and_breakfast,"bed_and_breakfast, lodging",4.8,14,,,,,,
ChIJ5XD690tH0i0RW3e4Y_QTSx4,Kopi Gunung Mas,-8.6675009,115.1837728,"Jl. Gn. Mas No.38, Tegal buah, Padangsambian Klod, Kec. Denpasar Bar., Kota Denpasar, Bali 80117, Indonesia",https://maps.google.com/?cid=2182860384757118811,OPERATIONAL,+62 817-565-611,coffee_shop,"coffee_shop, cafe, food, store",5,80,PRICE_LEVEL_INEXPENSIVE,"The best place to get the best coffee in Bali. Nice atmospher, warm conversation and story. You must visit here if you are in Bali. Aweeeesoooome...","I am very fortunate to have believed my instinct and entered this shop before leaving Bali. No gimmicks like cruel Luwak coffee or ambiguous Bali coffee, just authentic Sumatran beans, Kintamani beans, and more, along with the truly fascinating coffee roaster. If you're looking for real coffee, not just a tourist spot, this place is perfect.","Here i have an on-off experience, where i can talk with the owner not only about a coffe but about music art automotive game movie and more. A truly wonderful experience that you can get too","If you dare to called urself a coffee lover, then you should experience their coffee. One of the most memorable and the best. Ur tastebuds would be happy.
Great coffee that comes from an artist who  truly knows what their doing.","The best place I have ever visited and enjoyed the best coffee here. A very special coffee shop for you coffee lovers. ❤💛💚
1 Frequency ☆ For Freedom ✌"
