id,name,latitude,longitude,address,url,status,phone,primary-type,types,rating,rating-count,price-level,review 1,review 2,review 3,review 4,review 5
ChIJB_TjryYX0i0R94-YYMt8E44,Uma Shanti Villa,-8.5053051,115.2909213,"Pejeng Kawan, Tampaksiring, Gianyar Regency, Bali 80552, Indonesia",https://maps.google.com/?cid=10237663590884085751,OPERATIONAL,+62 812-4695-6453,resort_hotel,"resort_hotel, hotel, lodging",4.5,82,,Location was very far then what i expected. view is quit nice its a calm place to chill. cleaning staff was not so good and when i gave them this feed back they said it was hard to clean as room was messy. so i would like to add few pic for what i meant. also switch boards were broken which is quit dangerous. Cleaning staff washed to used cups and spoon in bathroom wash basin and left the spoons there also not cleaned properly.,"The location has only one way car access to go to the hotel, very small and narrow for a car. And the road is rocky and slippery when it's raining. But the room and the privateness is very nice.","The best value for money I ever had.
The rooms are clean and new, everything is working and in good condition.
The pool is nice.
Only six rooms so it’s very quiet.
It’s located just 15min ride outside of Ubud and the location has not been a problem at all.
The staff is always present, nice and helpful.
All perfect.",Poorly maintained room and bed bugs on our beds!! Me and my family had many rashes after sleeping on the bed and immediately cancel the rest of our stay there. Room is damp and bathroom not clean. Location is very rural (barely can fit 1 car and the road has no street light at night).,"It’s such a lovely place. Very clean and comfy. The staff is very friendly, the pool is great and the food available there is super tasty. Also it is pretty close to ubud, easy to reach by grab, even though it’s located on a street that’s not paved. Highly recommend, definitely would return"
ChIJC7zDQAAX0i0R3itUTwOXa_A,KONUBI Villa,-8.503041099999999,115.29392789999999,"Ubud, Pejeng, Tampaksiring, Gianyar Regency, Bali 80552, Indonesia",https://maps.google.com/?cid=17324106432082357214,OPERATIONAL,+62 811-3999-202,hotel,"hotel, lodging",5,1,,"One of the most beautiful bamboo house I’ve ever seen 🥹 It’s a quiet place, beautiful house and very comfortable. We stayed 2 nights and it’s a magical experience ! (Popcorn movie night is such a great idea 🍿) They serve a big breakfast, it’s delicious and lot of choices. Highly recommended !",,,,
ChIJgantQ5oX0i0Rf5Mv_vSFUGQ,Jungle,-8.5041192,115.2905966,"F7WR+96, Pejeng, Tampaksiring, Gianyar Regency, Bali, Indonesia",https://maps.google.com/?cid=7228424689212691327,OPERATIONAL,,hostel,"hostel, lodging",,,,,,,,
ChIJ_92XTnkX0i0R5mkGaN4wws4,Holy Tirtha Kingdom,-8.5080451,115.29118270000001,"F7RR+QFM, Banjar Puseh, Pejeng, Kec. Tampaksiring, Kabupaten Gianyar, Bali 80552, Indonesia",https://maps.google.com/?cid=14898524249081145830,OPERATIONAL,,,lodging,5,2,,,,,,
ChIJy2qouNk_0i0RW-S6MK7CQow,Jasmine Villa Ubud,-8.506520100000001,115.2944341,"F7VV+9QV, Jl. Dr. Ir. Soekarno, Pejeng, Kec. Tampaksiring, Kabupaten Gianyar, Bali 80517, Indonesia",https://maps.google.com/?cid=10106854567170466907,CLOSED_TEMPORARILY,+62 812-4654-6378,hotel,"hotel, lodging",5,1,,Place is good..🥰,,,,
ChIJg40-IiEX0i0RNe6dZrn1_Ww,Martabak 21 Pejeng,-8.5034966,115.29277030000002,"F7WV+J42, Pejeng, Tampaksiring, Gianyar Regency, Bali 80552, Indonesia",https://maps.google.com/?cid=7853703501843394101,OPERATIONAL,,restaurant,"restaurant, food",,,,,,,,
