id,name,latitude,longitude,address,url,status,phone,primary-type,types,rating,rating-count,price-level,review 1,review 2,review 3,review 4,review 5
ChIJd2Ouj4tb0i0Rfk8ZPHpA7f8,Ayu's Food From The Heart,-8.819405,115.14573039999999,"Bukit Ungasan, Gg. Jenggala 1, Ungasan, Kec. Kuta Sel., Kabupaten Badung, Bali 80361, Indonesia",https://maps.google.com/?cid=18441466942890528638,OPERATIONAL,+62 821-4449-3687,restaurant,"restaurant, cafe, food",4.8,215,,"You can’t help but feel happy sat in this restaurant. It’s peaceful, calming, the staff are friendly & the food is delicious (so good I’d already eaten it before I remembered take a picture!). We had matcha latte, hash brown potato & chicken focaccia sandwich - all 10/10 😋 will definitely eat here again and again.","Beautiful little place around here. Excellent and friendly service, reasonable prices for awesome food. Been there during the morning hours, not crowded at all and what I like most is this wonderful and relaxed atmosphere. Gonna go there again 🙂

Update: you should also go there for their tasty breakfast bowls. Tasty!","an atmospheric place in Goa style (those who have been to India understand).

Breakfast was amazing.
We took pizza omelette and matcha pancakes.
The only thing I didn’t really like was the cappuccino, it was very bitter and there was no foam.","Cozy quiet place, decorated in a boho style. The food is aesthetically pleasing and also good. The sizes are small to medium. We ordered a blueberries bowl (65K) and a Gado Gado (35K) ♥️","One of my favorite restaurants in Uluwatu. 🥰 Went there for lunch and breakfast multiple times and they never disappoint. Everything tastes amazing and everyone is beyond kind. The atmosphere is very welcoming and cozy, plus the place is tucked away from the busy and loud main street which makes it very enjoyable. The curry is my personal favorite but really anything from the menu is delicious. 🩷"
ChIJJ4WUvStb0i0RaI0vqj1BVxU,The Bali Boarding House,-8.81899,115.1442642,"No, Jl. N.Kahuripan No.22, Ungasan, Kec. Kuta Sel., Kabupaten Badung, Bali 80361, Indonesia",https://maps.google.com/?cid=1537769530874367336,OPERATIONAL,+62 813-5307-5292,hotel,"hotel, travel_agency, lodging, food",4.7,55,,"Thank you so much for a wonderful stay. I always feel immediately at home, and the garden is such a super peaceful space to relax in with different hanging chairs and hammocks etc. I always extend my stay when I'm here as I love it so much. The kitchen is fully equipped with everything you need and love that each room has its own drinking water. It's a super central location too.
Thank you to Desi, the owner, you have helped me when I needed it the most and I will appreciate that forever. Also thanks to Irma and team for their friendliness, cheery smiles, cleaning after me, and doing my laundry super quick.","what a flop this was... I stayed here 5 days. Still regretting it. The location is good you are 15 mins to any beach. So you are in the center. However,
pretty small rooms. no closet, beds are uncomfortable. But i thought that it should not be a big issue cause there is a big garden. But there is constant construction noise. Everyday, including weekend… i heard they will also build some extra bungalows. So more construction is guaranteed.  Plus, the staff, the owner, the manager, they use the common spaces as their office. not much room for you.

The manager (Desi) is very nice and doing her best to compensate for the trouble the construction is bringing. You will also be able to spot the owner who is living in one of the rooms and not so friendly (would never say hi to you for instance

So if you have some space left for yourself from the management and also the construction feel free to enjoy yourself.

Its in the village btw. So its away from the chaos and the main street. But it means a lot of roosters screaming as of 05:00 am :)
For this price you can find much better and comfortable rooms. the bed was a disaster and if you are too people, no way you can sleep in the room.","10/10 stay! The owner desi and her team were the loveliest people, always very helpful with any request you may have. The rooms are comfortable and clean, with ac, fan drinking water, hot shower, fridge. we loved the garden and shared kitchen space, a lovely friendly social atmosphere but very chilled. Full working kitchen to use if you wanted which was great. Would definitely recommend!","Great place to stay, all of the staff and the owner (Desi) are incredibly nice, caring, and helpful. I only booked two nights initially but extended for much longer, and will be returning as well. The location is perfect, close to all of the beaches by scooter, walking distance to tons restaurants in the area, and the yard is great for relaxing. Air conditioning in every room that works perfectly, unlimited clean water, clean rooms with a fridge and sink. Kitchen area is great. Highly recommend.","Good value for money.
Area was quiet and had a nice peaceful garden, with hanging chairs and a slack line.
Great staff!"
ChIJ3ZB4wbZb0i0RcCtf6t7aliQ,My Bali Coffee,-8.8206264,115.14805840000001,"Jl. Raya Uluwatu No.9, Ungasan, Kec. Kuta Sel., Kabupaten Badung, Bali 80361, Indonesia",https://maps.google.com/?cid=2636535282821704560,OPERATIONAL,,cafe,"cafe, food",4.8,251,PRICE_LEVEL_INEXPENSIVE,"We lived in this area of Bali for a year, and very often went to this coffee shop to drink coffee, because it is really delicious. 🤌🏻🔥
The staff is always happy with their smile and friendly attitude. Drinks and food correspond to their price.

We usually take the set breakfasts. They are simple but very affordable and delicious.😍

From the minuses, I would note:
Due to the fact that the coffee shop is located next to the road, it can be noisy. In the morning there are almost always a lot of people, be prepared😅though this is not a minus. Also advised the manager to work on their desserts, very small selection, and their brownies are sometimes dry. Also would like the staff to pay attention to the pancakes, because they are very bland, tasteless, maybe change the recipe😅🤷🏻‍♀️

I can suggest a good recipe for pancakes:

Eggs - 2 pcs.
Milk - 250 ml (1 cup)
Water (boiling water) - 250 ml (1 cup)
Vegetable oil - 3 tbsp. spoons
Flour - 200 g
Sugar - 3 tbsp.
Salt - 0.5 tsp.","Breakfast in this place is amazing! Big portions, tasty, good ingredients for a vgood price. Additionally the waiters and the owner are very friendly and speak English fluently. We went there to eat breakfast on-site and also ordered home delivery with Grab (they packed it so well). Highly recommended place!","Disappointing smoothie bowl, no flavor and was more foam like in texture. Super cheap / cheapest matcha I’ve see. Tasted ok.","fall for the reviews. BIG mistake.
You get what you pay for:
Coffee - so much robusta in the blend (
Fruit bowl with avocado - debatable.
Pancakes - no more available (Apr24), only wraps with filling.
Meal from a kitchen maid with respective realization.
Open kitchen should include great ventilation, however it's not the case here and smells of burning is all around.","Great coffee, super friendly atmosphere and affordable price! Definitely one of the best breakfast place in the Bukit! Dian and her team will make you feel like at home ☺️"
ChIJieHkgO1b0i0RDwv-mB_63rw,Salad Lab Ungasan,-8.8207121,115.1476622,"No.13 A, Banjar Bakung sari Jl. Raya Uluwatu, Ungasan, Kec. Kuta Sel., Kabupaten Badung, Bali 80361, Indonesia",https://maps.google.com/?cid=13609590137577933583,CLOSED_TEMPORARILY,+62 859-3449-2400,restaurant,"restaurant, food",4.4,191,,"This place is awesome! If you’re a salad or bowl-lover this is definitely the spot for you.

There’s an array of fresh ingredients paired with a great selection of dressings. The best part is, they actually mix the salad for you - they aren’t just handing you a bowl of separated ingredients.

Both my partner and I went with the build-your-own and were fully satisfied. We’re definitely going to be coming back here!","love this place!  The best healthy food in Bali!!  100% recommend!My Salad recipes that we eat every day:

1 salad: • mixed lettuce• baby romaine• kale• fried/or crispy chicken• tomato basil tartare• caesar dressing• parmesan

2 salad: • mixed lettuce • basmati rice • fried/or crispy chicken • sundry tomato • pesto dressing • parmesan

3 salad: • mixed lettuce • basmati rice • honey tandoori chicken • caramelised pineapple • olive oil & lime","The biggest salad Ive ever eaten. So good! Fair price, vegan options in sweet and salty (vegan cookies) and you can choose your salad toppings! Love it",Giant salads for fair prices. Amazing choices of ingredients and super healthy. Atmosphere isn’t that nice because it’s next to the busy main road. But it’s okay :) the salad makes it better!,"I've been looking for a super healthy salad option for lunch or dinner on the Bukit and I've finally found it. Salad Lab is amazing. The ordering process is a little time consuming as there are so many options but it's well worth the effort.
The portion size is huge and the price is very affordable. The staff are also super friendly. Highly recommended."
ChIJnTLFzNRE0i0RxerPvztLoOo,Vertical House Bali,-8.816526,115.14537299999999,"Jalan Taman Paradise Banjar Bakung sari, Ungasan, Kec. Kuta Sel., Kabupaten Badung, Bali 80361, Indonesia",https://maps.google.com/?cid=16906595721142069957,OPERATIONAL,+62 812-3756-6371,hotel,"hotel, lodging",4.8,78,,"Such a wonderful place! Thanks to Ivan, the manager, and the calming and nicely designed place, felt so welcomed as if we would be staying at a friends place ☺️. A sweet escape in nature - but also not far from the main road. I can highly recommend this accommodation to everyone 🫶✨!",Picturesque stay in the jungle surrounded by butterflies 🦋❤️ there is no air con so it feels like you’re glamping but there is a fan. Still way too hot and humid for me though. I loved waking up to the sound of the birds and seeing the butterflies outside my window. The location is far away from the city and sometimes the grab drivers get confused at night trying to find it. However the staff is so nice and it’s such a unique experience so go for those reasons. They are so kind and helped me so much. The rooms are clean and the beds are comfy but only if you’re ok with no air con. They might have air con in the future though! There is a mosquito net for the bed because all kinds of interesting creatures come in at night,"We so loved our stay at vertical house!
The rooms are really cozy and authentic, the surrounds are super green and you have a great view of the ocean from the lookout point. The staff were super friendly and helpful. Because it’s so central you can basically reach any beach or go to Uluwatu in under 20 mins by scooter. Looking forward to coming back!","Amazing peaceful hotel. We stayed for 2 days for new year. The rooms are cozy, beds are comfortable, the Wi-Fi is good, the owner is very sweet and helpful. The hotel has a shared clean kitchen, living room, tree house. Nice hotel to stay if you like quite and peaceful places.",We enjoyed our stay at vertical house. The location is peaceful and the rooms are clean. There is an open kitchen incase you would love to prepare your own food.
ChIJCeUuv5Vb0i0RiaqPZjG6LKg,Pad thai at bali,-8.820929399999999,115.14753449999999,"No.13 A, Jl. Raya Uluwatu, Ungasan, Kec. Kuta Sel., Kabupaten Badung, Bali 80361, Indonesia",https://maps.google.com/?cid=12118265418684017289,OPERATIONAL,+62 821-4433-1677,restaurant,"restaurant, food",4.5,457,,"I like how the food is served at this restaurant, it's very unique. The indoor area is cozy and there may not be much parking for cars, so I recommend coming here by motorcycle.","If you’re in the Bukit, Ungasan/Uluwatu area, you have to come here! There are so many restaurants around here that are a hit or miss and this place is most definitely a hit.

Every dish I’ve gotten so far has been so good, but the one I keep coming back for is the beef noodle soup! So much flavor and very tender beef, I can’t get enough of it.

Agnes is such a nice server and always gives us a good laugh.","I love their food!! Definitely recommended.
I think they serve one of the best Thai foods in town.","This place is awesome, i never imagine their red curry and omelette will be this yummy. We also order tomyam, but the taste was just okay, other than tomyam everything was good. I would highly recommend you to try this restaurant if you want to have Thai food in Uluwatu.",Great Place in Uluwatu with authentic Thai food. Really great taste and great service. Definitely advice to come here. Also prices are very good. Definitely come and enjoy.
ChIJ_4fmH19F0i0RBBEz0qrpVpg,Surfers GrillHouse Bali : Best Steakhouse in Balangan,-8.815889199999999,115.1491236,"Jl. Pantai Balangan No.69, Ungasan, Kec. Kuta Sel., Kabupaten Badung, Bali 80361, Indonesia",https://maps.google.com/?cid=10977218061642436868,OPERATIONAL,+62 812-3778-3470,steak_house,"steak_house, barbecue_restaurant, bar, restaurant, food",4.8,120,,"230k for everything you see (except the coke), the steak was very good and not chewy at all, it is hard to find at least a decent steak in Bali so I can definitively recommend this place","AVOID THIS PLACE!!

All those reviews must be a fraud.

Three people ate their „amazing“ red tuna steak - three people got fish poisoning!!!

Furthermore it was the worst fish we‘ve had in 4 weeks of being around Bali.

Every Warung has more ambiente than this place.

Seating is horrible, annoying western chart music and plenty of barking and free-running dogs INSIDE the place.

Menu says „tax and service included“ but when asking the waiter if prices have included service it turns out the owner of the place just keeps it all!

Worst eatery (I just can‘t call it a restaurant) I‘ve seen in many years.

Go there and enjoy some days inside your bathroom afterwards.","The best wagyu stake you can eat in jimbaran. The price is really affordable also, around 200k for a 300grams steak.
I really recommend it.","Request to the owners - please add another side like mashed or baked or boiled potatoes or grilled vegetables.
Otherwise the meat is good.
And adding red wine to the menu might also make sense.
Basically just learn from Chimichurri - they do everything right except your meat is better.

Thanks to management for a quick reply.
I asked and was told that only French fries for the side. Grilled vegetables only as a separate dish. I visited today.","Very tasty BEEF STEAK, best i ever had in Bali for sure. The plate comes with home made fries very jummy also and a very simple salad. Very quiet place. Clean and nice staff. Ohh and the best at all: COLD beer, really cold!"
ChIJcynuTC1b0i0Rz3Cv1QUWA1o,Noka Resto Ungasan,-8.820518,115.14568229999998,"Ungasan, South Kuta, Badung Regency, Bali 80361, Indonesia",https://maps.google.com/?cid=6486052102659338447,OPERATIONAL,+62 823-4176-9731,restaurant,"restaurant, indonesian_restaurant, chinese_restaurant, food",4.5,164,PRICE_LEVEL_INEXPENSIVE,"Quite a mixed bag. first things first: waiting time, even though the place where basically empty had been nearly one hour for a standard dish (Ayam Betutu). Price a bit higher than expected 100k for such a local dish is most probably on the higher end. Service has been friendly and with a lot of apologies. However: staff were communicating way LOUDER compared to the even louder traffic outside.

Food was good. Nothing extraordinary..just good.
All in all an okish place to eat out.

Not a three not a four. Something in between.",Amazing food for good prices. We ordered for new year dinner for take away and then came back for breakfast. Recommend  100%,I'm not a big fan of mustard.. so for my cordon bleu I rate it 7/10 😉,"The place is clean, service good, cappuccino was delicious.
The parmigiana comes without tomato sauce, but the flavor was good.
I have tried also the smoothie but feels like juice (watery), I didn’t enjoy it.","We had a take out dinner which was great. The next morning, we had tasty breakfast with them. Nice atmosphere with good service."
ChIJXVrg471b0i0RjEAcj6PD47E,PIZZA 'N GOOO UNGASAN,-8.8210338,115.1468498,"Jl. Raya Uluwatu No.13A, Ungasan, Kec. Kuta Sel., Kabupaten Badung, Bali 80361, Indonesia",https://maps.google.com/?cid=12818304071674642572,OPERATIONAL,+62 813-3936-2842,meal_takeaway,"pizza_restaurant, meal_delivery, italian_restaurant, meal_takeaway, restaurant, food",4.7,163,,You should go there if you fancy a pizza… different but very good,"Hands down to the best pizza in teglia I had in a very long time. 😍

Simply delicious. Crunchy yet very soft. I can tell the dough is slowly fermented and super easy to digest.

The portion are super generous… one slice starts from only 20k. Great value for money considering the high quality pizza.

Strongly recommended 😋🤤
❤️🍕","UPDATE - Feb22!!! New Menu and definitely the best Pizza in Uluwatu now, no need to drive to Canggu anymore. You need to try the whole Pizza 🍕 or the tray not the pizza piece’s, it’s the best!!!

Great pizza, it’s super tasty, the dough is super crunchy. I like the focaccia, they’re a lot different styles you can choose from and it’s very fresh. It was sooo good I ate more then 4 different pizzas 🍕
Seating area is also available, price is pretty good for the quality you get.
Staff is very friendly!!!","Yes, not a perfect pizza, but normal) the dough is thick and not fried.  in a bite to salad the most it :))","Our friends talk about this place and as Italians, why don’t try it!
The pizza is absolutely AMAZING, a tasty focaccia and tonight we had also a chance to try a new “schiacciata”… so delicious 🤤
HIGHLY RECOMMENDED 🫶🏼"
ChIJV_sguLhb0i0ReoXu2Cxh0mw,Tony's New York Pizza Ungasan,-8.821306,115.14617000000001,"Jl. Raya Uluwatu No.77, Pecatu, Kec. Kuta Sel., Kabupaten Badung, Bali 80361, Indonesia",https://maps.google.com/?cid=7841436746451420538,OPERATIONAL,+62 838-8600-039,pizza_restaurant,"pizza_restaurant, restaurant, food",4.6,71,,Ordered Via grab and holy lord this pizza was good!! I had pepperoni and my partner had The White One and they were both incredible!! We split them and ate them together and it was heaven! Honestly so worth getting this pizza!,Tony’s pizza was whopper. Exactly what we needed after a long day of activities in Bali. We got this delivered to our hotel and they even left us a note. Highly recommend. Great pizza. American style.,"F… Y… Tony)))) it was delish ! !
Nice tiny place, goood ppl there and of course pizza. I tried bbq chicken and ham& leek, gnocchi, chicken wings - it all about sweet garlicky taste. highly recommended. Even after delivery - everything is in order and sooo yum 😊","Heard from view friends About this little pizza place. They said really good!!
Got few slices after Gym!
Yasss super good pizza I can say the best one so far!!!","Drove by this place on our way into uluwatu. I loved my NYPizza when i lived in Brooklyn, New York.
So decided to go for a nice walk about 30 minutes, explored a bit on the way here.
OMG they came really close. Hands down one good pizza. Definitely recommend. Tony who ever you are if it was not for these motorcycles, you for sure brought me back to New York."
ChIJ9TMWjVFF0i0R2aRfKn9IDIQ,Rental motor bike & car (ungasan rental),-8.8139035,115.14878389999998,"Jl. Tundun Penyu Dipal, Ungasan, Kec. Kuta Sel., Kabupaten Badung, Bali 80362, Indonesia",https://maps.google.com/?cid=9515059823735973081,OPERATIONAL,+62 811-3860-900,,car_rental,4.9,45,,"Very good service, I rented Yamaha s-MAX for 3 weeks. No problem with the bike. Guys were ready to pick up the bike in any place in Bukit.","Excellent rental company. The staff is very nice and the motorbike we got was new. Clean helmets too, rare bonus in Bali 😀. They also deliver and collect the motorbike from the hotel for free. Highly recommended .","I had a fantastic experience with the motorcycle rental service. The team was incredibly accommodating and flexible, ensuring that my rental experience was tailored to my needs. Their willingness to adjust and make the process convenient made my exploration so much smoother. Highly recommend this rental service for their excellent service and flexibility!",Great price and communication - very easy to book. Workers very helpful and accommodating. Scooter worked perfectly and delivered on time. Helmets were a bit smelly and could use a thorough clean.,"Great service, they came drop the bike at the hotel, new quality motorbike for a decent price. Would definitely rent from them again."
