id,name,latitude,longitude,address,url,status,phone,primary-type,types,rating,rating-count,price-level,review 1,review 2,review 3,review 4,review 5
ChIJjaxanScP0i0RWlaCQH9KAKk,Nusa Indah Candidasa,-8.504143899999999,115.55337370000001,"Jl. Pura Segara No.8, Sengkidu, Kec. Manggis, Kabupaten Karangasem, Bali 80871, Indonesia",https://maps.google.com/?cid=12177815302813406810,OPERATIONAL,+62 363 41062,hotel,"hotel, lodging",4.6,22,,"Beautiful views of the ocean, very clean boardwalk, clean room, excellent service. Very clean pool that is fresh water. Only gave 4/5 as room does not have a fridge or TV and the bed was quite hard, otherwise can easily can order cold drinks from the restaurant! Beautiful stay, very affordable for a beachfront resort 10/10 recommend!","Ideal restaurant! Really worth a visit! Perfect mix in western and Balinese menu, lunch and dinner menu. Homemade ice cream is excellent. Much cheaper than Candi Beach restaurants. We had bruscetta’s, chicken filet, PERFECT grilled prawns, fried chicken with delicious sweet-sour sauce, homemade icecream with Bailey’s 🤩 … and … a bottle of Two Island Bali wine is only 350.000 idr here!!! Chardonnay, Sauvignon and Pinot Grigio are excellent.","Had a great stay in Nusa Indah. The staff is so lovely and friendly, and its a so wonderful place!! they even helped me to go to a clinic when i was sick and the cook made me a porridge! the whole place is awesome anf if you are lucky and its not fully booked you may have the pool or restaurant for yourself. btw the food is so delicious (would highly recommend ""kare ayam"" - chicken curry - also vegeterian) would definetely come back.","They have a very strange rule. You can't use notebook in their restaurant. We came often to this place, because they have good coffee, friendly staff and nice view. Long time we was alone client in restaurant (between seasons), but they asked us to leave restaurant if we come with laptop. Sad, we like this place, but don't ready to follow this rule.","Thx for the stay. Clean, nice houses, good price, nothing to complain."
ChIJIyF6LHsP0i0Rnk1neS5eKpc,Alam Zempol,-8.501022599999999,115.55246170000001,"Manggis Karangasem, Indonesia 80871, Jl. Mendira, Sengkidu, Kec. Manggis, Kabupaten Karangasem, Bali 80871, Indonesia",https://maps.google.com/?cid=10892622202447285662,OPERATIONAL,+62 813-3703-3531,store,"tourist_attraction, store",4.6,64,,Perhaps the only beautiful store in Candidasa! Lovely natural & healthy skin care / aromatherapy products without all the usual synthetic junk. The prices are very reasonable too. We are especially fond of the solid perfumes and their shampoos and conditioners.,"Sell so many fragrance & natural soap, really enjoyed their smell of natural body soap",Nice shop with different soaps. Nice smell throughout the shop. Prices are reasonable.,Many natural products available,"Great prices, lovely natural products!"
ChIJ72AedgwP0i0RkYp3tckESS4,Nusa Indah Restaurant,-8.5043475,115.55344210000001,"Jl. Pura Segara No.8, Sengkidu, Kec. Manggis, Kabupaten Karangasem, Bali 80871, Indonesia",https://maps.google.com/?cid=3335202263424010897,OPERATIONAL,+62 812-3643-137,restaurant,"restaurant, food",4.8,20,,"I'm not a fan of overly sweet desserts, but I found the gelato here quite enjoyable. I tried the coconut and mango flavors, and each scoop was generously sized. Both the mango and coconut tasted exceptionally fresh, especially since I learned that they make the gelato in-house. You can even feel the coconut fibers in your mouth, which adds to the experience. While I personally think that they could reduce the sugar a bit, I believe most people would love it this way.

Additionally, this restaurant is located within a lovely guest house. It's clean, offers a sea view, plays calming Balinese music, and you can hear the relaxing sounds of the waves right beside you. I definitely plan to come back and try more items from their menu next time.",Great food! The best Balinese dishes i’ve tried actually! They are adorable and the place is wonderful. Great service by the sea and super clean! If you’re staying in Candi Beach Resort don’t hesitate to pay them a visit. The food is way better than in the resort and half the price. 100% recommendable.,"Great place. This is owned/operated by the same people as Lu Putu restaurant.  Both places will pick you up from your hotel and shuttle you to their establishment free of charge.  Had lunch at Lu Putu and asked the driver about snorkeling. He drove us here and let us hang out and use their facilities/ beach access free of charge.  Found out they have hotel rooms too, with bookable spa service. Only had their Gelato, but it was great (which is no surprise, considering how good Lu Putu was). Will likely stay here next time we're in Bali.",Very nice balinese restaurant. Delicious food and nice people. Very good service. It is located directly on the beach between the Basil Restaurant and the Candi Beach resort.,"We had the famous Gelato (ice cream) which was delicious. The prices were a bit over the top for indonesian standards but considering it's part of a hotel it's not too bad after all. The service was friendly but a very very slow paced. I'd recommend it, the food looked good too!"
ChIJRXG44iYP0i0Rk6b09yFFTmI,Mendira House,-8.502741,115.55251799999999,"Jl. Mendira, Sengkidu, Kec. Manggis, Kabupaten Karangasem, Bali, Indonesia",https://maps.google.com/?cid=7083675276096611987,OPERATIONAL,+62 363 4381019,store,"ice_cream_shop, coffee_shop, cafe, grocery_store, food, store",4.7,79,,I love this souvenir shop. It is located on the small village around the hotels and bungalows in Sengkidu. I love the ice cream and the vibes here.,"We have been coming to Bali for years and are always looking forward to the coffee from Mendira House. We even claim that we have not yet drunk a better one in Germany. The team is super nice and the boss is very sympathetic. This time he even made it possible for us to take the coffee with us to Germany. But there is not only delicious coffee at Mendira House, but also very high-quality and tasteful souvenirs, we will find something for ourselves or for friends every time we visit. We are already looking forward to our next holiday in Bali and our daily coffee at Mendira House.","A little gift shop that primarily serves this small road and village. It has EXCELLENT green tea ice cream made from real matcha. Coffee is made using beans from Kintamari - more bitter and robust, not so fruity.",Cosy souvenir shop with a cafe and ice cream. Nice gifts made in Bali.,"I love the details of this cute little shop in Sengkidu, Candidasa area! The interior design is lovely, the items sold are in good quality and neatly displayed, the handmade ice cream is very tasty, and the staff is friendly. It’s a must visit shop to buy some souvenirs or get a cup of coffee/ice cream if you happen to visit Candidasa!"
ChIJdWr5IWQP0i0RnsUaZ_t4zkA,Warung Mina Candidasa,-8.5040832,115.5587674,"Jl. Raya Candidasa, Nyuh Tebel, Kec. Manggis, Kabupaten Karangasem, Bali, Indonesia",https://maps.google.com/?cid=4669802884791715230,OPERATIONAL,+62 813-3804-2048,restaurant,"restaurant, food",4.2,131,,"Great tasting food, well presented and at a good price. This place is underrated and as Warung go in Candidasa certainly the best surroundings and most pleasant place to sit. Pork ribs were beautifully cooked (and nice to see them being grilled on the BBQ at the front of the Warung over coconut husks). My wife had beautiful chicken that was wonderfully tender. Highly recommended.","We ate here several times during our stay at Candidasa. Excellent quality food for an affordable price.
They grill the chicken using dry coconuts instead of charcoal and they add some sort of barbacue sauce that is excellent.

After trying a number of different plates I ended up ordering a Nasi Goreng and a Ayam Gayak (grilled chicken) due to the portion size. I am a hungry person 😅

The only thing I can criticise is that there is no soap to wash your hands.

It is a great place to eat in the area.","Awesome food, cooked to order, sweet service staff. The extra time for your dishes to be BBQed over corn husks make it special. Ate here three times over a week because it’s so good.","Much like everyone else’s and experience, there are not many choices to eat around these parts in terms of warungs as the majority are closed. This was one of the first places that we found to be quite solid on the fact that there is ample seating and it is outdoor which brings in a nice breeze.

The menu is pretty solid with a variety of Indonesian and western dishes so there is a lot to choose from.

As my partner and I were craving chicken we both ended up ordering the Paket Ayam Goreng which is fried chicken leg with rice and some side veggies for 55k. The chicken was fried nicely where the skin was crispy and the meat was tender.

It’s a pretty average experience where you know the food will be good and it is nothing out of the ordinary.

The staff overall was pretty nice and attentive and the kitchen was quite quick with pushing out our food. She even showed us the side veggies that it came with which was very nice of the chef.

The most important thing to note is that it is very clean and the food was cooked well.","Really friendly team that’s works here, you can see they’re a tight nit family that is very hospitable towards visitors and wants to share with them the beautiful Bali culture and cuisine!

Food is amazing! Especially the grilled garumi - we haven’t had it better anywhere else!"
ChIJ6RGTEjIP0i0RiZLjT3T1338,Warung Paon Bali MBC,-8.5033022,115.55125009999999,"FHW2+MGQ, Jl Pantai Mendira, Sengkidu, Kec. Manggis, Kabupaten Karangasem, Bali 80871, Indonesia",https://maps.google.com/?cid=9214353242528649865,OPERATIONAL,+62 859-3349-4880,restaurant,"restaurant, food",4.9,60,,"Delicious rosted chicken from Jessica and her team. Excellent service, great taste of dishes, smile and attention to detail await every guest. Highly recommended 👌",Oasis in this village. Love the place. Cozy and nice services. The chicken so good with signature spicy sambal. Like it 😍,This was such a friendly place to share a traditional Balinese banquet with the family. The food was delicious and interesting. The staff were professional as well as very happy and helpful.,"The restaurant directly across from Candi Resort entrance is cash only so I just needed to walk up for another minute and discovered this Warung which takes credit card for an additional 2% fee.

They provide a welcome drink for new customers which is a nice touch!

Food was good and plentiful and drinks were strong!  Food here is cheaper than resort restaurant food and they have extensive menu options.
Check the menu here to compare prices for yourself!
https://warungpaonbalimbc.my.id/menu-makanan/

Interesting enough Candi Resort  wifi works in the restaurant even though it is 110 meters away! It loads pages slowly but it can definitely get you through a meal

At the end of my meal, I was offered a 15% discount on my next visit so I came back the next day.

I didn't  realize the coupon I was given had a very specific ""Use On"" date instead of a typical EXPIRATION date. This was odd and rendered the discount useless as I wouldn't be in the area on the Use ON date.

Hopefully they rethink this policy especially if the whole intention of the discount is to encourage repeat customers and build up their customer base.",Great food and amazing service by very friendly staff. Recommend it warmly!
ChIJ9YlK8C0P0i0RdrTnI2lw5a0,Villa Mola Mola,-8.5056567,115.5581145,"FHV5+X56, Sengkidu, Manggis, Karangasem Regency, Bali, Indonesia",https://maps.google.com/?cid=12530545135104537718,OPERATIONAL,+62 812-3848-0168,,lodging,5,2,,,,,,
