id,name,latitude,longitude,address,url,status,phone,primary-type,types,rating,rating-count,price-level,review 1,review 2,review 3,review 4,review 5
ChIJi67aBQ0-0i0R1j0qvsw-vA8,d'Sanctum Villa,-8.5742546,115.2626145,"Gg. Tukad Betenan Jl. Lod Tunduh No.3, Lodtunduh, Kecamatan Ubud, Kabupaten Gianyar, Bali 80582, Indonesia",https://maps.google.com/?cid=1133850255275212246,OPERATIONAL,+62 813-8008-1010,hotel,"hotel, lodging",4.8,19,,"My husband and I stayed a week at the villa.  Very satisfying as if living in a dream house, quiet atmosphere, comfortable and very clean.  Every morning served a delicious and well-arranged breakfast, they also provide house keepers to clean the villa everyday. The facilities available are more than five stars.  We are very happy and satisfied to stay there.","Private atmosphere, clean residential, big bathrooms, and you can pet the arowana fish in the pond.",Perfect for holiday with friends or family. Private yet equipped with all the things you need for a holiday.. Friendly and helpful staffs.. very reasonable price too.,Awesome Villa. Very quiet and luxurious at the same time. Not too far from Sanur and also the center of Ubud. Totally love it here!!!,It was immaculate. It definitely exceeded my expectation. Amazing customer service. I would definitely go back.
ChIJTb7stQw-0i0RTthrh0ptKQM,Warung Makan Sari Rejeki,-8.5723021,115.26033369999999,"C7H6+34G, Jl. Raya Mawang, Mawang Kelod, Kecamatan Ubud, Kabupaten Gianyar, Bali 80571, Indonesia",https://maps.google.com/?cid=227833423025920078,OPERATIONAL,+62 813-3728-4958,restaurant,"restaurant, food",4.7,19,PRICE_LEVEL_INEXPENSIVE,"So good ! Good portion and low budget, but vegetables are so fresh. Service is all the more.","Super affordable, small menu but they do everything so well! One of the best meals we had in Bali and the cheapest so far! Pop in here if you want to eat local and eat lots without a big spend :)",Nice small local warung with local food. Not big menu. Good was good en big portions. Didnt like the fact that owning family was talking out loud when we were there.,We had diner tonight at Warung Makan Sari Rejeki. Lovely and tasty local food for a good price.  Nice people working there.,"It was a very good restaurant and lovely staff, it is very cheap and very tasty so I really recommend if you see it just stop by and have a drink or eat something there."
ChIJr-KRXxk_0i0R3AIQ4KB_uUo,Tresna Home Stay,-8.5732768,115.25659549999999,"Jl. Puseh Natih No.2, Singapadu Tengah, Kec. Sukawati, Kabupaten Gianyar, Bali 80582, Indonesia",https://maps.google.com/?cid=5384475158428779228,OPERATIONAL,+62 819-0902-0343,private_guest_room,"private_guest_room, lodging",5,8,,"Best place that I've ever stayed. I loved it and would recommend it to all.
With only four, beautiful, intimate apartments it is the ideal getaway destination.
The gentleman who owns these apartments also owns a nearby restaurant. l loved the well cooked food and ate there often.
Rain or shine, this is a wonderful homestay.","Extremely clean and quiet place to stay, with adorable tenants who will make your stay unforgettable.",,,
ChIJM2ByIG0_0i0RPMxUK-UqGl0,Peaceful ketut house,-8.5726117,115.2580763,"Br. Negari, Singapadu Tengah, Kec. Sukawati, Kabupaten Gianyar, Bali 80582, Indonesia",https://maps.google.com/?cid=6708721758684630076,OPERATIONAL,+62 878-6040-7197,bed_and_breakfast,"bed_and_breakfast, lodging",4.3,6,,"I meannnnn it's AIGHT. The shower and bathroom is not connected to the room, so you have to go outside to use it. Other than that, it's a pretty nice little location. Outside the insanity of Ubud.",Good rooms only the toilet could be a bit better,Very good place comee,,
ChIJM9WbqnM-0i0RZFSzclV2RP4,Pitopang Jaya Masakan Padang Cabang Tebongkang,-8.573941099999999,115.2570333,"Central Singapadu, Sukawati, Gianyar Regency, Bali, Indonesia",https://maps.google.com/?cid=18321899293418673252,OPERATIONAL,,restaurant,"restaurant, food",4.8,4,,,,,,
ChIJPUjyVgs-0i0RL_EKCfV97_4,Warung Makan De Teras,-8.5708702,115.26045979999999,"C7H6+M54, Jl. Raya Mawang, Lodtunduh, Kecamatan Ubud, Kabupaten Gianyar, Bali 80582, Indonesia",https://maps.google.com/?cid=18370039896439714095,OPERATIONAL,+62 813-3852-3439,restaurant,"restaurant, food",4.9,7,,Good enough,,,,
ChIJ36zY3kY-0i0Rw4m8YAS3sVg,Tori Kreasi Art & Home decor,-8.5721476,115.25658729999999,"Jl. Raya Singapadu No.168, Singapadu Tengah, Kec. Sukawati, Kabupaten Gianyar, Bali 80582, Indonesia",https://maps.google.com/?cid=6391090575646165443,OPERATIONAL,+62 812-3987-959,art_gallery,art_gallery,4.9,7,,I will bring your lemari tomorrow,,,,
ChIJJX91X2I_0i0R12af69saje4,Warung Betutu kajol,-8.5706099,115.2607914,"C7H6+Q83, Jl. Raya Mawang, Lodtunduh, Kecamatan Ubud, Kabupaten Gianyar, Bali, Indonesia",https://maps.google.com/?cid=17189424884596303575,OPERATIONAL,+62 812-3929-5042,brunch_restaurant,"brunch_restaurant, restaurant, food",4.8,4,,Good,,,,
