id,name,latitude,longitude,address,url,status,phone,primary-type,types,rating,rating-count,price-level,review 1,review 2,review 3,review 4,review 5
ChIJPSz7pOE40i0Rx8lX8RG1nDM,Draper Startup House for Entrepreneurs Bali,-8.613823199999999,115.16147279999998,"Jl. Raya Tuka, Dalung, Kec. Kuta Utara, Kabupaten Badung, Bali 80361, Indonesia",https://maps.google.com/?cid=3719046480969320903,OPERATIONAL,+62 831-1461-0469,hostel,"hostel, lodging",4.7,184,,"Very comfortable place to work and the most reliable Internet I have seen so far in Bali. The price of the acomodation was very cheap.For me, the location was perfect. Even though it's 15 minutes from Echo Beach by motorbike, the area is quieter, and there are many places to eat around for half the price. There is a gym 5 minutes from the place bro gym which cost 45 k the day pass. The garden views are just amazing. I will come back! 🙌","I stayed at dorm, and the facilities of the dorm is old and some not working. Beds are squeaky. No shower head. No water coming to the toilet tank and cannot flush.","The rooms were spacious and clean, the common areas were welcoming, and the co-working space had reliable high-speed internet and a great community of like-minded professionals. I highly recommend it to anyone looking for a comfortable and productive work environment while exploring Bali.","Amazing hostel, so clean and amazing environment for people working whilst travelling, very chilled environment with great people.

The staff here are amazing, shout out to them. They keep the place really clean and are so friendly, there's such a nice family environment there. Big shout out to Putu, Duey and Agus! Those guys made our stay really special. Those guys deserve top salaries! They work so hard all day long to do everything for the guests. 100% recommend the hostel.","A great clean hostel, with a peaceful set up garden made for inspiration, beautiful workspace upstairs, a nice lil kitchen and a neat spot to create! Staff are very smiley and helpful! It’s an 8 minute ride from the beach, you can actually sleep in there not like the most hostels, and great for entrepreneurs! I definitely recommend it for everyone except party travelers! Will defo be back!"
ChIJQ5iDATc50i0RyNgxvUznBwc,PhiladelphiaBali,-8.6112092,115.1613646,"Jl. Raya Tuka No.1 b, Buduk, Kec. Mengwi, Kabupaten Badung, Bali 80351, Indonesia",https://maps.google.com/?cid=506627799880161480,OPERATIONAL,+62 823-3989-2868,sushi_restaurant,"sushi_restaurant, japanese_restaurant, restaurant, food",4.8,60,,"Delicious!! Best sushi rolls i ever had in Bali! Everything is great about them. Serving, taste, look😌 The firs impression is the packaging i found it hard to believe, that sushi delivery could arrive in such a beautiful and stylish wooden box. The next thing is that underneath the box, there is a bagvof ice, ro keep the dish cool during delivery💟 In Philadelphia rolls the perfect amount of cheese and fish, properly cooked rice. The price is maybe higher than in most other places, but if you like sushi rolls, its worth trying at least once💟","Best Sushi Experience in Bali! 🍣

From the first bite to the last, the taste was unparalleled. The chef's dedication to crafting each piece with precision and using the freshest ingredients truly shines through in every dish. The flavors are a symphony of perfection that left my taste buds dancing with joy. 👌🏼

Not only does this place offer the best taste in town, but the quality of their sushi is unmatched. The fish is incredibly fresh, and the rice is expertly seasoned. Each roll is a work of art, showcasing the chef's passion for creating an authentic sushi experience. But it doesn't stop there – the attention to detail extends to the packaging as well. The presentation is impeccable, and the packaging is not only aesthetically pleasing but also practical. My sushi arrived in perfect condition, a testament to their commitment to delivering the best possible experience to their customers.

In summary, if you're a sushi lover seeking the best taste, highest quality ingredients, and impeccable packaging in Canggu, look no further than Philadelphia Bali. It's a culinary journey that exceeded my expectations. I'll definitely be returning for more soon!","Im a sushi lover and am quite picky about the quality. And I can tell you those are the best sushi I’ve ever eaten! All ingredients are super fresh and tasty, minimum rice - maximum seafood. Love it!
Got addicted, same my whole family and friends who ever tried those - you try them once and you can never order from another sushi place :)","Absolutely delicious sushi! Ordered via WhatsApp and had it delivered to our hotel in Kuta and it was still amazing despite the distance. We ordered the Philadelphia set and Canggu Set as seen in the photos. Enjoyed every bit of it, even the ginger was amazing! Keep up the good work. Will definitely order again when back in Bali.","Best sushi in my life!! Very friendly staff, great boxes and serving. Lots of food - delicious!"
ChIJE8P5ejk50i0R2eWj6v8Id0o,Bali Brothers Guesthouse,-8.6168611,115.1615087,"95M6+6J7, Jl. Dahlia, Dalung, Kec. Kuta Utara, Kabupaten Badung, Bali 80361, Indonesia",https://maps.google.com/?cid=5365767376281527769,OPERATIONAL,+62 857-1518-5670,hotel,"hotel, lodging",4.6,59,,"""Stayed at this Bali guesthouse with a unique outdoor-style toilet, clean and nature-inspired. Exceptional service, standout co-working space. Comfortable accommodations, though some upgrades needed. Brilliant atmosphere, delicious food, prime location. Highly recommend with potential for improvements.""","My time at Bali brothers had been an absolute treat!
An experience Filled with rich conversations with both the staff / guests.
Atmosphere 10/10 xxx
Each night felt like returning home and I look forward to commig back","What a great homey space with amazing hosts and an incredible staff. Communication was great and everyone was so helpful despite our last-minute booking. Also a nice pet-friendly paradise.

Thanks to Dom, Pak Yoga, Chef Bagus and the rest of the staff! Highly recommended!","We had a great time at Bali Brothers place where we stayed for a month. Domenico and Frank, our host with their friendly and cheerful attitude. The communication was super easy and quick and the place looks exactly like it does in the pictures. The food was so delicious from their bar. We liked their homemade pasta, nasi goreng, chicken curry and coffee. I would absolutely recommend staying there!","This location deserves a higher rating. This guest house has a distinct Bali vibe. The apartments are really roomy, spotless, and equipped with everything. If you want to see something in Bali that is off the beaten path, Dominico, Frank, and the staff are very informed and helpful.

Food is both tasty and reasonably priced.
When I return to Bali, this is where I'll be staying.

Can't have asked for a nicer final four days in Bali.

🫶🏽"
ChIJrTL6Rd440i0RXz1i612JThk,Puri Mutia Kost Bali,-8.6157706,115.16762750000001,"Jl. Pandu Gang Pandu Permai 8 No.6, Dalung, Kec. Kuta Utara, Kabupaten Badung, Bali 80361, Indonesia",https://maps.google.com/?cid=1823545935605677407,OPERATIONAL,+62 812-8134-1662,,"private_guest_room, lodging",4,88,,"the room is complete
strategic location. safe and comfortable. There's no loss in staying here. Highly recommen 🥰🥰😍😘👫💋💅👈👉","My friend lives here. Very clean, neat, and cozy. Internet isn't the best but other facilities are good - ac, hot water, communal kitchen, parking space.",Been living for half a year and doing good with the guard Pak Komang and made new friends here. Facilities okay. Just beware of ants and fungi if you leave the room for days.,"Hallo, is there any room available for October 2023 ? Thanks",Clean and it's good also cheap only 1.5jt for a month will all furniture. Best option available in that much meony
ChIJCTpWWnk50i0RJGWCCu_8sXQ,Maisaba,-8.6122178,115.16838489999999,"95Q9+39J, Jl. Cemp., Dalung, Kec. Kuta Utara, Kabupaten Badung, Bali 80351, Indonesia",https://maps.google.com/?cid=8408780082881127716,OPERATIONAL,,private_guest_room,"private_guest_room, lodging",4.9,9,,"Nice quiet and clean
Spacious rooms",,,,
ChIJxciGXqM50i0R2wsr_lfa97c,Kost Perumahan Cempaka Mas Dalung Blok U,-8.611495,115.166474,"Unnamed Road, 95Q8+CH5, Dalung, Kuta Utara, Badung Regency, Bali 80351, Indonesia",https://maps.google.com/?cid=13256304099649588187,OPERATIONAL,,guest_house,"guest_house, lodging",4.6,9,,,,,,
ChIJAT0xXyk50i0R0WTD6aGi4NY,Kost Buk Dewa,-8.6149299,115.1658025,"Jalan Cendana VII, Gg Munduk II, No. CC41, Dalung, Kec. Kuta Utara, Kabupaten Badung, Bali 80361, Indonesia",https://maps.google.com/?cid=15483554335195096273,OPERATIONAL,+62 877-5876-8388,,lodging,4.9,33,,,,,,
ChIJCdAuFBo50i0RPh0YQDMRnLA,SURYA KOST,-8.6145218,115.1674587,"Jl. Cepaka Selem, Dalung, Kec. Kuta Utara, Kabupaten Badung, Bali 80351, Indonesia",https://maps.google.com/?cid=12726065558858505534,OPERATIONAL,+62 813-3816-2591,hotel,"hotel, lodging",4.4,7,,👍🏻,,,,
ChIJn92kyBs50i0RGz--E76rLA4,Kost Asti,-8.6114217,115.1663872,"Unnamed Road, 95Q8+CHJ, Dalung, Kuta Utara, Badung Regency, Bali 80351, Indonesia",https://maps.google.com/?cid=1021380048369631003,OPERATIONAL,+62 878-5009-1171,private_guest_room,"private_guest_room, lodging",5,6,,"Want to order a good place to spend your time in Bali? Then this is a good homestay, it offers an escape from the loud noises of the street, the room is simple but cozy.","Very comfortable, friendly owner",,,
ChIJX28hdZI50i0Rwov5leYPmZ0,Gusto italiano Canggu,-8.6168608,115.1615079,"Jl. Dahlia Jl. Raya Tuka No.235, Canggu, Kec. Kuta Utara, Kabupaten Badung, Bali 80361, Indonesia",https://maps.google.com/?cid=11356125418424470466,OPERATIONAL,+62 857-1518-5670,italian_restaurant,"italian_restaurant, restaurant, food",5,8,,Found this restaurant  off the beaten track on the side street but well worth the effort! must try spaghetti meatball Really friendly staff and great value for money!.,The restaurant is part of a funky guest house. But the food is real Italian and it's served from the heart.,Super pasta ! One of the best pesto I ever try,"Super good, lovely service, nice ambience.",THE pasta is Amazing 🤩 !!!
ChIJbXV4zt850i0RM9_iqifOaQw,Bubur Ayam Barokah,-8.6171036,115.16496930000001,"Jl. Cendana III No.21, Dalung, Kec. Kuta Utara, Kabupaten Badung, Bali 80361, Indonesia",https://maps.google.com/?cid=894472670775795507,OPERATIONAL,+62 813-3773-9966,restaurant,"restaurant, food",4.8,19,,This is the best bubur. It's different from the others. Been eating this one for over a year now 👌,,,,
ChIJ78nvq9o50i0ROGK7AiCiHpY,Perumahan Pesona Dalung,-8.616358100000001,115.16717969999999,"95M8+FV3, Jl. Pandu, Dalung, Kec. Kuta Utara, Kabupaten Badung, Bali 80361, Indonesia",https://maps.google.com/?cid=10817261613358998072,OPERATIONAL,,lodging,lodging,5,6,,,,,,
ChIJQaJUMX850i0RhwwQIclrqNQ,Nasi Mamamia,-8.6147976,115.166554,"Perumahan Griya Tansa Trisna, Gang Cendana VII, blok DD no 37, Dalung, Kec. Kuta Utara, Kabupaten Badung, Bali 80361, Indonesia",https://maps.google.com/?cid=15323616243715411079,OPERATIONAL,+62 877-6442-5233,restaurant,"restaurant, food",4.7,7,,,,,,
ChIJMdof8Z050i0Rz__vm2KFJY0,Salday Fruits (homestore),-8.6111858,115.165447,"Perumahan cempaka court blok u3 no 7, Dalung, Kec. Kuta Utara, Kabupaten Badung, Bali 80351, Indonesia",https://maps.google.com/?cid=10170681992055619535,OPERATIONAL,+62 857-3861-8566,brunch_restaurant,"brunch_restaurant, restaurant, food",5,2,,,,,,
ChIJ0zypdFo50i0ROqHb3KbVE0M,Garden Masaji farmer,-8.611944099999999,115.16731000000001,"95Q8+6WF, Jl. Cemp., Dalung, Kec. Kuta Utara, Kabupaten Badung, Bali 80351, Indonesia",https://maps.google.com/?cid=4833441737745342778,OPERATIONAL,,park,park,,,,,,,,
ChIJD58PSVQ50i0R1BGpTGBi34c,Kost Selip,-8.612245,115.1625035,"95Q7+422, Jl. Raya Tuka, Buduk, Kec. Mengwi, Kabupaten Badung, Bali 80351, Indonesia",https://maps.google.com/?cid=9790652280669278676,OPERATIONAL,+62 818-555-837,private_guest_room,"private_guest_room, lodging",5,2,,,,,,
ChIJEx63qJ450i0RS8lQBs0bMsc,Kos dalung,-8.614724899999999,115.16802989999998,"Jl. Pandu No.6b, banjar kung, Kec. Kuta Utara, Kabupaten Badung, Bali 80361, Indonesia",https://maps.google.com/?cid=14353565529771395403,OPERATIONAL,+62 812-4677-7876,private_guest_room,"private_guest_room, lodging",,,,,,,,
ChIJmVzSIDo50i0RB38ji6dghSQ,LALAPAN AZKA 77,-8.6127384,115.16151179999999,"Jl. Raya Tuka, Dalung, Kec. Kuta Utara, Kabupaten Badung, Bali 80361, Indonesia",https://maps.google.com/?cid=2631615829978087175,OPERATIONAL,+62 878-0346-4013,indonesian_restaurant,"indonesian_restaurant, restaurant, food",5,26,,,,,,
ChIJDXkLHgw50i0Rc6IObtgtH04,Eva's Executive Lodge,-8.6109089,115.16706699999999,"Grand Srikandi Mansion, Jl. Cepaka VI B No.11, Dalung, Kec. Kuta Utara, Kabupaten Badung, Bali 80351, Indonesia",https://maps.google.com/?cid=5629268466819048051,OPERATIONAL,+62 853-3345-6669,,lodging,5,12,,,,,,
ChIJeVbcilU50i0RBNdBMZnX-5I,Sate Babi Pak Botak,-8.611579899999999,115.1613283,"Jl. Raya Tuka No.3, Dalung, Kec. Kuta Utara, Kabupaten Badung, Bali 80361, Indonesia",https://maps.google.com/?cid=10591296001648219908,OPERATIONAL,+62 878-1013-2373,restaurant,"restaurant, food",4.4,9,,,,,,
