id,name,latitude,longitude,address,url,status,phone,primary-type,types,rating,rating-count,price-level,review 1,review 2,review 3,review 4,review 5
ChIJa2xUE3YZ0i0RGAvKDGbNV74,Alam Kawi Ubud Resort & Spa by Island Escape Villas,-8.4569425,115.30454729999998,"Sanding, Tampaksiring, Gianyar Regency, Bali 80552, Indonesia",https://maps.google.com/?cid=13715657028365060888,OPERATIONAL,+62 813-3936-2407,resort_hotel,"resort_hotel, hotel, lodging",4.7,285,,"We had opted for a family room,
It's spacious and clean.
The location is superb very close to nature .
The only problem here is food.
They have very  limited options and their weird rule of closing as early as 9:30.
They didn't consider our request for some fruits and juice at 9:40 that it's late by 10min.we were travelling with kids.
Other than this it's a wonderful place filled with nature.
Tips you can order food through some local app from near by restaurants which is the best .","Me and my girlfriend stayed here 3 weeks ago and forgot to leave a review apologies ! The staff here are really attentive and lovely. Value for money is great here, the rooms are spacious, clean and comfy - ours had a balcony with a lovely view of the rice fields. Breakfast and dinner was very nice and very well priced. This is a relaxing place and about a 25 minute drive into Ubud town (you can ask to rent scooters at reception). Thank you for having us !","My stay at Alam Kawi Ubud Resort & Spa was a mixed experience, with both positives and negatives to consider. I booked a villa and was assigned to the Suredayu villa. While the room itself was decent, I found it lacking in cleanliness, earning it a modest 6 out of 10 rating.
However, I was impressed by the attentiveness and good service provided by the staff throughout my stay. They were always ready to assist and ensure my comfort.

The villa offered a great view, but the open-roofed bathroom design made me anxious about the possibility of reptiles entering, which detracted from my overall enjoyment. Additionally, I was taken aback when the payment went through, and the staff informed me that there would be no refund. This seemed like a red flag, as it raised questions about transparency and customer service.

Regarding breakfast, while it was passable, I found that there were better options available outside the resort. On a positive note, the pool area and facilities were well-maintained and clean, providing a relaxing environment for guests to unwind.

Although the spa area was undergoing upgrades during my stay, I appreciated that the massage therapists were still available to provide in-room treatments. The massage itself was excellent and added to the overall relaxation experience.

In terms of location, the villa is situated conveniently outside of town, offering a peaceful retreat away from the hustle and bustle of Ubud.

In conclusion, while the villa has its merits, including attentive staff and good service, there are areas for improvement, particularly in cleanliness and transparency regarding policies. However, the location and amenities make it a decent choice for those seeking a relaxing getaway in Ubud.","The place is a bit far from the ubud center. We stayed for one night when we were back from kintamani. The room is clean and quite big, the hot water works perfectly. The swimming pool is also pretty great with an amazing view. I love the vibes and the area is pretty quiet.","In bali you will not get a charging port in rooms.
And the lights are very dim.
It becomes very dark at night and has very little light in the room.
I saw some 🦎.
Otherwise I liked the room ambiance, pool and service.
So clean rooms and outside areas.
Location is Lil far from other places but it's quiet if u like village style stay."
ChIJd87jH5kj0i0R35M53Bi1gWA,Utopia Concept Bali,-8.455360899999999,115.2985663,"Desa, Kulu, Kec. Tampaksiring, Kabupaten Gianyar, Bali 80552, Indonesia",https://maps.google.com/?cid=6954038418015359967,OPERATIONAL,,hotel,"hotel, lodging",4.2,5,,,,,,
ChIJYV1weW4Y0i0Rb0oK2solY20,Pondok Pagutan Br.kulu Tampaksiring,-8.457225,115.29805659999998,"G7VX+467, Tampaksiring, Gianyar Regency, Bali 80552, Indonesia",https://maps.google.com/?cid=7882185326000228975,OPERATIONAL,+62 853-3753-3303,,lodging,4.4,9,,"I been here for a long time of my life...it is really bring its own miracles....
You have to try it...",,,,
ChIJp1o8DmwY0i0RfDQ48fujNUg,"Warung Sate Babi ""SALAMA"" Sambel Lalah Manis",-8.4584745,115.3006245,"Jl. Pejeng Kaja - Tampak Siring No.18, Sanding, Kec. Tampaksiring, Kabupaten Gianyar, Bali 80552, Indonesia",https://maps.google.com/?cid=5203245246975587452,CLOSED_TEMPORARILY,+62 818-0369-0186,indonesian_restaurant,"indonesian_restaurant, restaurant, food",4.5,10,,Tap,,,,
ChIJkfwLOwkZ0i0RcO1K0qrtsRk,Warung tipat santok,-8.4545736,115.30080500000001,"Jl. Raya Tampaksiring No.18, Sanding, Kec. Tampaksiring, Kabupaten Gianyar, Bali 80552, Indonesia",https://maps.google.com/?cid=1851522239754333552,OPERATIONAL,+62 822-4728-8300,breakfast_restaurant,"breakfast_restaurant, restaurant, food",,,,,,,,
ChIJCYTHD2wY0i0RIKpW9IPXzE0,warung komang,-8.4577171,115.30120099999999,"G8R2+WF8, Jl. Raya Tampaksiring, Pejeng, Kec. Tampaksiring, Kabupaten Gianyar, Bali 80552, Indonesia",https://maps.google.com/?cid=5606092597909432864,OPERATIONAL,+62 853-3944-2526,restaurant,"restaurant, food",4.6,20,,"Excellent little warung that does superb Soto ayam. You should go here for this alone. Just Rp 5,000.","Good, nice ice cream",,,
ChIJKdxHdxUZ0i0RtwFg0jm9pco,Warung dadong warung,-8.457338,115.30155900000001,"G8V2+3J7, Jalan Raya, Sanding, Kec. Tampaksiring, Kabupaten Gianyar, Bali 80552, Indonesia",https://maps.google.com/?cid=14602285422858994103,OPERATIONAL,,restaurant,"restaurant, food",,,,,,,,
ChIJrSaaVf0Z0i0Rqoqupor7ZfM,Pondok WIJAYA's,-8.457338,115.30155900000001,"G8V2+3J7 St. AFRE Wijaya, Jl. Raya Tampaksiring, Sanding, Kec. Tampaksiring, Kabupaten Gianyar, Bali 80552, Indonesia",https://maps.google.com/?cid=17538700896784779946,OPERATIONAL,,,lodging,,,,,,,,
ChIJb4e9gEgZ0i0RngRRHKt5KDI,Warung cinta,-8.4538657,115.3017796,"Tampaksiring, Gianyar Regency, Bali, Indonesia",https://maps.google.com/?cid=3614272476786263198,OPERATIONAL,+62 877-6122-0847,coffee_shop,"coffee_shop, cafe, food, store",,,,,,,,
ChIJ-WMFOFUZ0i0Rc3OL1MdORlE,Meditation spot,-8.4579691,115.30371400000001,"G8V3+6R8, Sanding, Tampaksiring, Gianyar Regency, Bali 80552, Indonesia",https://maps.google.com/?cid=5856454985613276019,OPERATIONAL,,park,park,,,,,,,,
ChIJq7d5EmwY0i0RZpR524nQ9DE,Warung Bu Desak,-8.4583768,115.30078370000001,"G8R2+J8V, Jalan Raya, Sanding, Kec. Tampaksiring, Kabupaten Gianyar, Bali 80552, Indonesia",https://maps.google.com/?cid=3599731292687144038,OPERATIONAL,+62 831-1953-5369,restaurant,"restaurant, food",4,1,,,,,,
ChIJz-50Mi0Z0i0RGIntKHo70ts,Warung Mie PohTegeh,-8.457338,115.30155900000001,"G8V2+3J7, Jalan Raya, Sanding, Kec. Tampaksiring, Kabupaten Gianyar, Bali 80552, Indonesia",https://maps.google.com/?cid=15839788235274160408,OPERATIONAL,+62 877-6142-2973,restaurant,"restaurant, food",,,,,,,,
ChIJPwBUD2wY0i0RRKF_8wU7RXI,Warung Bu Gria,-8.4579327,115.301145,"Sanding, Tampaksiring, Gianyar Regency, Bali, Indonesia",https://maps.google.com/?cid=8234052390462923076,OPERATIONAL,,restaurant,"restaurant, food",,,,,,,,
ChIJDTQldgAZ0i0RRgEXOdnGgI0,Wardana Guest House,-8.4551246,115.29930229999998,"G7VX+XP3, Tampaksiring, Gianyar Regency, Bali, Indonesia",https://maps.google.com/?cid=10196368192634814790,OPERATIONAL,,hostel,"hostel, lodging",5,1,,"Guest houses in villages often offer a serene escape from urban life. They're typically nestled amidst lush greenery, offering a tranquil atmosphere. The architecture is often rustic, blending harmoniously with the natural surroundings. Guests can wake up to the sounds of chirping birds and the fresh scent of the countryside. Many guest houses also offer outdoor activities like hiking or simply lounging in hammocks, allowing visitors to immerse themselves in the beauty of nature. With $50 per Days and $1000 per Month",,,,
ChIJjYoHUWkY0i0RzyobXtdALIc,Warung Bu De,-8.456761499999999,115.30210599999998,"Sanding, Tampaksiring, Gianyar Regency, Bali, Indonesia",https://maps.google.com/?cid=9740231387836525263,OPERATIONAL,,restaurant,"restaurant, food",,,,,,,,
ChIJs9k7bWwY0i0RkO6oZ8CBMzo,Warung Makan Sunda,-8.4586273,115.3006809,"Sanding, Tampaksiring, Gianyar Regency, Bali, Indonesia",https://maps.google.com/?cid=4193838341384892048,OPERATIONAL,,restaurant,"restaurant, food",,,,,,,,
