id,name,latitude,longitude,address,url,status,phone,primary-type,types,rating,rating-count,price-level,review 1,review 2,review 3,review 4,review 5
ChIJpURA3pg_0i0Rs326YPpHbP4,OYO 2204 Griya Hita,-8.646079,115.26407809999999,"Jl. Pucuk Indah No.2, Kesiman Kertalangu, Kec. Denpasar Tim., Kota Denpasar, Bali 80237, Indonesia",https://maps.google.com/?cid=18333107323808677299,OPERATIONAL,+62 21 29707601,hotel,"hotel, lodging",4.3,27,,One of the most comfortable accommodations in Bali. Super nice for those who need quiet place to work/study; good place to rest and relax too 😌 beautiful garden and spacious backyard. Pak Ketut and Buk Komang are approachable and kind  🥰 🙏🏽,"If you are looking for a longer stay in Bali  than this is a good place to stay. Rooms are complete with bed, wifi, tv kitchen and parkingplace.","Good place to stay, the assistants are there. If you need an assistance, just call the assistant. Rooms are clean, good air circulation. TV+WIFI okay. Near bypass road also.","A cozy place to stay with a serene neighbourhood. The room is quite big (around 4 x 7 meters) and divided into 2 (bed room and pantry). Bed sheet, blanket and towels are provided. Thanks, pak Nyoman, mbak Desi & pak Latief.","Good owner, good sanitation best price full facility"
ChIJ98VTewk_0i0Ro0KE2_dIE6E,Katang-Katang Guest House,-8.6418501,115.2649576,"Gg. Taman No.11, Kesiman Kertalangu, Kec. Denpasar Tim., Kota Denpasar, Bali 80237, Indonesia",https://maps.google.com/?cid=11606700894040900259,OPERATIONAL,+62 812-4692-7768,guest_house,"guest_house, lodging",4.8,40,,"I highly recommend this place. The atmosphere is cozy, quiet, and like living in nature because you can hear a lot of bird sounds. The place is very clean and outside the room is filled with many plants). For those who like to bathe in unity with nature (whose bathroom conditions are open) it is very suitable to come to this inn.

However, for customers who bring vehicles (especially cars) must ask in advance regarding the availability of parking space because it only fits 1 car. The road to this place is also suitable for 2 cars.","This is my first business trip abroad. I spent 15 days staying at Katang-Katang Guest House, which is an excellent and convenient place, giving me the feeling of a traditional Balinese house within a lovely village.

They not only provide accommodation services but are also very supportive and respond promptly to any advice you may need. I felt completely safe and peaceful while living there, making it easy to relax by myself or focus on working during my time there.

I will definitely stay there when I return to Bali in the future. I am 100% satisfied",Such a nice authentic guest house in Denpasar ! The place is clean and the host are welcoming and helpful!,"A wonderful place!
We lived here for almost 2 months, we really liked everything!
Very clean, good Wi-Fi, there is a kitchen, a dining area, a green garden and most importantly, very nice hosts!
If in more detail, then:
We were looking for a long-term place to live and work, and it turned out to be perfect!
The hosts were super kind and helpful, they bought a stove and installed another WiFi router!! Therefore, we had a full kitchen, refrigerator, toaster, microwave.
Always very clean, this is carefully monitored. Even the towels smell delicious!
For us, the location was convenient, equally remote from Denpasar and Ubud, there are shops, restaurants and everything you need nearby (5-10 minutes by bike).
The most memorable thing is that the hosts invited us to the ritual of opening a new room!
I highly recommend it!","Katang-Katang is actually very conveniently located as there's lots of things to do and good food around if you take a ride.

The owner is so helpful and his son Adi is very trustworthy and he's a travel guru who knows Bali very well so don't be afraid to ask him any questions.

Highly recommended."
ChIJ25zKa_Q_0i0RgUWwyU65xaI,LaGriya Guest House,-8.6426997,115.2644961,"Jl. Gemitir No.45, Kesiman Kertalangu, Kec. Denpasar Tim., Kota Denpasar, Bali 80237, Indonesia",https://maps.google.com/?cid=11728984552598685057,OPERATIONAL,+62 857-3723-5235,guest_house,"guest_house, lodging",4.6,48,,"It is a great place to live. It’s not too central that it’s loud but not too far from everything that it is inconvenient. It’s perfectly placed. The owner is fantastic, she is always willing to help and is so respectful that she will send you reminders of public holidays and celebrations that may inconvenience you or be of interest to you.","Very nice and quiet place. The families that live around there are also very friendly and a bunch of nice friendly dogs around , however if you work online the internet was not the best. Also the bathroom had a lot of mold. The place looks like it’s not very well taken care of.","The room was new, clean and very cozy and comfortable. Equipped with tv, desk, wardrobe, AC and hot water. They have a spacious garden where you can find your quiet corner and chill. That was a very big plus.","the guest house is very near and walking distance from biaung beach and a culture village kesiman kertalangu,

you can rent a Good full  Alloy new Montain bike for Rp. 30k for 1 day

the owner is so friendly and Helpfull

i recomended this place for your long stay in bali

is near city centre , near to ubud and easy to go to airport

will stay again in future i visit Bali

cheers 😁","Nice place, quiet place to work and concentrate, clean rooms and the staff are very friendly. In front of the rooms i found fruit trees like soursop, jackfruit etc. They have bicycles for rent. The price is worth it."
ChIJxYcVt_Y_0i0RikJdbRK68L4,Warung Nasi Lawar Macho Rena,-8.6409287,115.2634504,"Gg. Taman No.17-14, Kesiman Kertalangu, Kec. Denpasar Tim., Kota Denpasar, Bali 80237, Indonesia",https://maps.google.com/?cid=13758701449923871370,OPERATIONAL,,indonesian_restaurant,"indonesian_restaurant, restaurant, food",4.8,180,PRICE_LEVEL_INEXPENSIVE,"One tips that i would to share to any of you seeking a great food in Bali, especially Lawar and Babi Guling, the more hidden the place, the better it gets.
This place is hidden from the outside world, but a lot of people come here everyday to enjoy the food. For the food is very tasty compared to other lawar we usually see, and it is affordable in which you can request the price of the food.
The best time to visit is around 11-2, but expect a long que for your order","The rice is good, the seasoning is right, the atmosphere is comfortable, the service is friendly ... .. .",Authentic Balinese food.,Mamiyaaaa,Makknyooss
ChIJm3pflKlB0i0RktVn_vE6O0M,Bakmi Ayun 88 Bali,-8.6465091,115.26700670000001,"Jl. Pucuk Bang Djayanta Residence No.27, Kesiman Kertalangu, Kec. Denpasar Tim., Kota Denpasar, Bali 80237, Indonesia",https://maps.google.com/?cid=4844530635196847506,OPERATIONAL,+62 819-9985-1815,restaurant,"restaurant, food",4.9,306,,"Amazingly good food and very sweet owner who cooks fresh. The tiny restaurant has one table and is neat and very clean.
The prices are very cheap (25k) for a normal and 35k for a large portion of bakmi Babi.",A bakmie (noodle) stall in Bali that are operated by owner that are really coming from Tangerang. Noodle quality are excellent especially the Bakmie Lebar (wide noodles). The seasoning looks light but the taste are absolutely amazing!,Best bakmi!!! The only complain is difficult to park,"The pork bakmi was so good I had another one right after! This place is true to its 5 star rating: delicious fresh noodles, tasty pork, real pork fat soup and a nice and welcoming pak to serve you a cheap & delicious meal. An absolute gem!!","Coming from Jakarta, we missed having a bowl of good Bakmi Bangka, one of the local delicacy back in Jakarta. I am overjoyed to find the authentic taste in this bowl of noodle. Definitely recommend this place ♥️"
ChIJMbdbBoFB0i0RhIkidZHAYRQ,Moto Kopi & Toast Kertalangu,-8.648535599999999,115.2628337,"Jl. Sekar No.2, Kesiman Kertalangu, Kec. Denpasar Tim., Kota Denpasar, Bali 80237, Indonesia",https://maps.google.com/?cid=1468666684467480964,OPERATIONAL,+62 878-4149-5796,cafe,"cafe, food",4.5,6,,"The place open for 24 hrs
Amazing place in the area to get coffee and toast
Great variety of toast with vegetarian options
Free wifi
And smoking tables","The food options are limited and heavy – burgers and friend toast sandwiches. Only one person was working, so the service was slow. They do not accept contactless payment. No hand soap is available. There is an AC room, which is good.",,,
ChIJM3qfeY5B0i0RWPSmlD8J6Ns,WARUNG BABI GULING BU MINGGU,-8.6489528,115.26309940000002,"Jl. Prof. Dr. Ida Bagus Mantra Jl. Sekar Sari No.18b, Kesiman Kertalangu, Kec. Denpasar Tim., Kota Denpasar, Bali 80237, Indonesia",https://maps.google.com/?cid=15845925457584649304,OPERATIONAL,,brunch_restaurant,"brunch_restaurant, restaurant, food",4.7,10,,,,,,
ChIJPQG6JNk_0i0REgfps7tOEK0,ACK Fried Chiken Biaung,-8.6435288,115.26690699999999,"Jl. Gemitir No.77, Kesiman Kertalangu, Kec. Denpasar Tim., Kota Denpasar, Bali 80237, Indonesia",https://maps.google.com/?cid=12470553936273147666,OPERATIONAL,,meal_takeaway,"meal_takeaway, restaurant, food",4.4,31,,lov it,,,,
ChIJpY9qhAlA0i0RFhsehfdxGME,Bakso Lestari Malang,-8.6485302,115.26649359999999,"Jl. Professor Doktor Ida Bagus Mantra, 9728+HHQ, Kesiman Kertalangu, Denpasar Timur, Kesiman Kertalangu, Kec. Denpasar Tim., Kota Denpasar, Bali 80237, Indonesia",https://maps.google.com/?cid=13913996356665350934,OPERATIONAL,,indonesian_restaurant,"indonesian_restaurant, restaurant, food",4.6,262,PRICE_LEVEL_INEXPENSIVE,"Good taste, hot place, without air conditioner","Meatball..
if you wanna try Indonesia Meat Ball Soup than look no other, the have tastiest meatball 100% beef and they got Chicken Meat Ball too.
their soup is tasty and they got crackers too and pretty cheap too.",Good,The best,Ok
ChIJE8_zrcU_0i0R7dErDZvtMLs,Kost,-8.6424351,115.26068769999999,"Jl. Bakung I Gg. Bakung Sari No.A20, Kesiman Kertalangu, Kec. Denpasar Tim., Kota Denpasar, Bali 80237, Indonesia",https://maps.google.com/?cid=13488542134171324909,OPERATIONAL,,,lodging,5,1,,,,,,
ChIJiZdSJFU_0i0Ri0ymqS2ghv8,Kost Green Bakung Sari,-8.642696899999999,115.26061899999999,"Gg. Bakung Sari No.b20, Kesiman Kertalangu, Kec. Denpasar Tim., Kota Denpasar, Bali 80237, Indonesia",https://maps.google.com/?cid=18412580244531072139,OPERATIONAL,,private_guest_room,"private_guest_room, lodging",5,3,,,,,,
ChIJbR8Vz_U_0i0RcmeO_-8QGx4,Saladonk,-8.6444982,115.2649421,"Perum Nuansa Sandat II No.23, Kesiman Kertalangu, Kec. Denpasar Tim., Kota Denpasar, Bali 80237, Indonesia",https://maps.google.com/?cid=2169346268479776626,OPERATIONAL,+62 878-6147-2674,restaurant,"restaurant, food",4.9,21,,"The best fruit salad in town, always fresh n most importantly healthy. You can either mix the fruits with their signature dressing sauce (yummy and healthy bcos the sauce is not too sweet) or add your own yogurt to your likings 😋😋👍🏼",The best fruit salad in town!!!,,,
ChIJ-UpnNH4_0i0RsUkdGYDIwQM,Mimiko cake & desserts,-8.645919,115.26380689999999,"Jl. Pucuk Indah No.2, Kesiman Kertalangu, Kec. Denpasar Tim., Kota Denpasar, Bali 80237, Indonesia",https://maps.google.com/?cid=270717905121659313,OPERATIONAL,+62 877-5430-3101,meal_takeaway,"meal_takeaway, restaurant, food",5,6,,"The cakes are very yummyy!
Cinnamon rolls are massive! I also tried their pudding chocolate with vla, another excellent desserts!
Must try cakes and you will keep ordering!
🍨🍧🍰🧁🎂🍮🥮
Will come back for sure,
Enjoy Bali
Enjoy Indonesia 🇮🇩","My mom ever order there, and the cakes are soo delicious till my mouth wanted to eat more ,but to be honest, I actually hate cakes, but this one is soo good! Very recommended!",Very recommended ✨,,
ChIJhbcYbhg_0i0RzyJ6mzTp-1s,KOS MADE SUMERTA,-8.6449245,115.26267199999998,"Jl. Sekar Wangi III No.30-2, Kesiman Kertalangu, Kec. Denpasar Tim., Kota Denpasar, Bali 80237, Indonesia",https://maps.google.com/?cid=6628147688761860815,OPERATIONAL,,private_guest_room,"private_guest_room, lodging",4.7,3,,,,,,
ChIJoWsU7nQ_0i0Rb4nRkgOK2ao,Chicks Chicken's House,-8.6451353,115.2629451,"Jl. Sekar Wangi II No.19, Kesiman Kertalangu, Kec. Denpasar Tim., Kota Denpasar, Bali 80237, Indonesia",https://maps.google.com/?cid=12311022804346702191,OPERATIONAL,+62 831-1966-0693,meal_takeaway,"meal_takeaway, restaurant, food",5,5,,,,,,
ChIJNzUPOkc_0i0RXau_kuH-gJ0,Dipasha Italian Pizza,-8.6424916,115.26100229999999,"Gg. Bakung Sari No.75, Kesiman Kertalangu, Kec. Denpasar Tim., Kota Denpasar, Bali 80237, Indonesia",https://maps.google.com/?cid=11349351305756781405,OPERATIONAL,+62 813-3880-3446,pizza_restaurant,"pizza_restaurant, restaurant, food",2.5,6,,"itu bukan pizza. itu makanan untuk babi

I ordered a thuna large

they gave me medium

barely any tomato sauce

barely any thuna

pizza was not cooked

I didnt eat it. Worst pizza I ever saw in my life!

very unfriendly service and cook, which blamed me for that culinaric desaster.

overpriced!!!!

not the first bad review for them it seems.","The pizza we ordered was mixed up in the box, look like it falling down.
The pizza crust was not cooked and still rare.
After we look closer there was many hair in the crust of the pizza.
We trow the whole disaster.",Largest pizza a nand size ((((,,
ChIJadybV5FB0i0RGLnqABAzR7Q,Kesambi kesiman massage,-8.6483931,115.2632006,"Jl. Sekar Sari Gg. Remaja No.2, Kesiman Kertalangu, Kec. Denpasar Tim., Kota Denpasar, Bali 80237, Indonesia",https://maps.google.com/?cid=12990407794001361176,OPERATIONAL,+62 831-1993-8076,lodging,lodging,5,1,,,,,,
ChIJIVDw754_0i0RUNNpwQWWNuU,Mie Ayam Berkat,-8.644878499999999,115.26773490000001,"Perumahan Nuansa Sandat Biaung.A2, Jl. Sandat No.Blok 1, Kesiman Kertalangu, Kec. Denpasar Tim., Kota Denpasar, Bali 80237, Indonesia",https://maps.google.com/?cid=16516553634891813712,OPERATIONAL,+62 813-3867-6750,restaurant,"restaurant, food",4.9,8,,,,,,
ChIJJZNHt_NB0i0RCY7FS4DtAdM,KOS ADE EMIL,-8.6480468,115.2623705,"9726+QWQ, Gg. Tempe, Kesiman Kertalangu, Kec. Denpasar Tim., Kota Denpasar, Bali 80237, Indonesia",https://maps.google.com/?cid=15204694952262340105,CLOSED_TEMPORARILY,,bar,bar,,,,,,,,
ChIJjfwDTApA0i0Rw2Ra3pigAjM,Bakso Banyuwangi (Akas),-8.6487908,115.26409629999999,"Kesiman, Jl. Prof. Dr. Ida Bagus Mantra No.88xx, Kesiman Kertalangu, Kec. Denpasar Tim., Kita Denpasar, Bali 80237, Indonesia",https://maps.google.com/?cid=3675676824313685187,OPERATIONAL,+62 877-4720-7737,indonesian_restaurant,"indonesian_restaurant, restaurant, food",4.9,8,,"I only have IDR100,000 to pay for the bakso. He didn't have small money to make change. So he said tidak apa apa bayar besok. Pay nex time. He didn't even know me! So I went around the corner to get some change and decided I would promote his good will and trust! On top if that the bakso is top notch delicious! IDR10,000 for a portion... go try it!",,,,
