id,name,latitude,longitude,address,url,status,phone,primary-type,types,rating,rating-count,price-level,review 1,review 2,review 3,review 4,review 5
ChIJuQO_sgFd0S0RUb3DlSbkLKs,Warung Green Umah,-8.280219299999999,114.5163946,"Banjar Ayarsari Kauh, Nusasari, Kec. Negara, Kabupaten Jembrana, Bali 82252, Indonesia",https://maps.google.com/?cid=12334484333833469265,OPERATIONAL,+62 813-3859-2522,indonesian_restaurant,"indonesian_restaurant, restaurant, food",4.9,40,,"Such a nice place to have dinner! The chef and owner was really nice and fun to talk to. He made us homemade hot and cold chocolate which was really good. As well as the pizza and the pineapple juice.
I can definitely recommend this „secret“ spot!","This warung was so simple, homely and the owners were very friendly. We’ve tried chicken noodle so delicious and the price is very cheap. Should try ice black coffee and cappuccino 👍👍",Really nice and charming owner! The food was really good and came as a huge serving. The prices are really really low. Definitely the best value for money we had in over a month on Bali!,"Small Warung with great local food. Location is cute! Prices are fantastic.
The owner is so lovely and funny, thank you again for serving us! 🙌","Surely a hidden gem.
It has a very cozy atmosphere and the owner is very friendly."
ChIJf51g4L5d0S0RzSP59IDpaTE,Relief pond maker,-8.277471,114.5183241,"PGF9+288, Nusasari, Melaya, Jembrana Regency, Bali, Indonesia",https://maps.google.com/?cid=3560633720488141773,OPERATIONAL,,park,park,,,,,,,,
