id,name,latitude,longitude,address,url,status,phone,primary-type,types,rating,rating-count,price-level,review 1,review 2,review 3,review 4,review 5
ChIJY9t3Qbsi0i0RzKHUNCUDvEU,Puri Landu Ubud Luxury villas,-8.4704578,115.27061339999997,"Jl. Tirta Tawar, Ubud, Kecamatan Ubud, Kabupaten Gianyar, Bali 80571, Indonesia",https://maps.google.com/?cid=5024894742573654476,OPERATIONAL,+62 812-3931-450,hotel,"hotel, resort_hotel, lodging",4.9,61,,"Perfect girls getaway! Host Wayan was very helpful, rooms spacious with beautiful view out to the rice paddys.  Easy to get around via GET app to other places / ubud town.","Super comfy villa. Stayed here for 3 days back in 2021, it was one for my most favourite place to stay in Ubud. Pak Wayan was also great company, his wife cooks very well. The location is lil bit hard to find but its all great place.","The villa in fantastic. The location is perfect, very close to the center by scooter (10-15minutes) but totally into the green field.
Wayan Satu is fantastic, helpful in all the needs in Bali.","Owner Wayan Satu is very accommodating and helpful in all the needs in Bali. He can arrange for car transport & transfer from airport or othe venues, rental of scooters & various breakfast requirement to enjoy your holidays. There are 4 units of villas which are spacious containing a kitchenette,  varendah and absolutely pristine clean. It has a  wonderful swimming pool & deck chairs for you to soak the sun too overlooking the rice fields. Prices are very reasonable for the spaciousness and appreciate the nature, absorb the balinese culture and enjoy the peacefulness. Definitely a must stay in Ubud & a deserves a 5-stars recommendation.
However, do book very early to avoid disappointment as the villas are usually fully book the month ahead.","Mr Wayan's villa was beyond my expectation. It has nice view and room interior, the room was very clean and big too. Everything is just amazing! The paddy view across my room was very beautiful!

Mr Wayan was very helpful during my stay, he helped with lots of things. He lent me a scooter, so I could drive around Ubud conveniently. He even gave me some recommendation about places and favorite restaurants to visit.

Staying here was worth all the money spent, i really recommended it!"
ChIJT0LlEFUj0i0RnHjsm86aR88,Tebasari private house,-8.4697882,115.27607280000001,"Br. Sapat, Tegallalang, Kec. Tegallalang, Kabupaten Gianyar, Bali 80561, Indonesia",https://maps.google.com/?cid=14936076901367445660,OPERATIONAL,+62 852-3717-7481,private_guest_room,"private_guest_room, lodging",,,,,,,,
ChIJQewUU7si0i0Rcp4pUloUTmQ,Puri Hari Resort & Villa,-8.4696392,115.2713001,"Jl. Tirta Tawar, Ubud, Kecamatan Ubud, Kabupaten Gianyar, Bali 80571, Indonesia",https://maps.google.com/?cid=7227736830134296178,OPERATIONAL,+62 361 9081359,hotel,"hotel, lodging",4.2,89,,"Amazing place in the middle of the Ubud countryside. Very cheap considering the place, maybe it's because of the position. We rented a motorbike which worked perfectly, otherwise the resort offers free shuttle to central Ubud. We also had dinner at the restaurant, excellent quality price ratio and also the breakfast was great. Just remember not to be in a rush when you have breakfast because it takes a while, around one hour (at least this is what happened to us with the Indonesian breakfast including 4 or 5 different dishes).",I cannot express how kind and helpful the staff at Puri Hari resort are. Very professional service and very clean room. Located 10 minutes from town center in a quiet peaceful rice field with free shuttle to city centre provided. Definitely will be returning again in the future. 5/5 star,"Incredible boutique hotel.
Amazing service and incredible views to the rice fields. Small swimming pool to refresh you after a quiet reading under the sun. Awesome sunsets.
Absolutely recommendable. Very affordable. Easy to move from ubud to any part of Bali.
Free Shuttle service to ubud downtown","The place is pretty, I'm glad they offer a free shuttle into town, it's not within walking distance. The place and villa was amazingly beautiful, but the rooms could be updated and taken care of a little better. The staff were so nice and made us feel very welcome.","This place is as remote as it can be 😀 but still their shuttle can take you to the city in just 10minutes for free :) the shuttle does leave on certain time slots though. Although the food for breakfast was ok, I don't recommend eating there for dinner 😅 The food for dinner was not so good... The rooms were clean but please fix the restrooms. They stink very badly it affects the whole room. 😥"
ChIJc1JSaLAi0i0RHCSoE8MSZ0M,Villa Namaste,-8.4755744,115.26994210000001,"Jl. Sri Wedari No.973, Ubud, Kecamatan Ubud, Kabupaten Gianyar, Bali 80571, Indonesia",https://maps.google.com/?cid=4856871352200078364,OPERATIONAL,+1 514-928-5978,,lodging,4.6,29,,"Amazing place to stay, the two rooms we had were big enough. The master room had a bath tub too which was like an icing on the cake. Big and clean pool was there to cool down in the hot weather. The owner was sweet enough to come and see us. Staff was friendly and ver helpful. Enjoyed our stay",The host was great and the villa is the best I've ever stayed at. It was furnished really nicely and we'd recommend any couple to try and book this villa very early as it is popular. The pool and garden are overlooking rice paddies. What a great concept,"Wow!! What an incredible villa. We stayed for 4 nights in November 2019 and had an amazing time exploring ubud from this stunning villa. Super clean and 5 star amenities throughout. The stunning pool overlooking rice fields with fireflies at night was perfect. Use of the vespa is recommended as the villa is far enough from ubud to need to scooter most places. Hosts were lovely and staff were super efficient and respected our privacy. All up 11/10 stay, couldn't have been better. Can't wait to come back.","Best villa in ubud, 5 minutes to central ubud on scooter, amazing views. Awesome amazing manger and very clean. Pool over looked ricefields. Room was super nice,, very romantic even the keys to your room were so cool ... cannot find a bad thing to say. Score out of 100.... 100. The best.","Stayed here twice. Loved it! One of the nicest Airbnbs I've every stayed in. Such an amazing view from the private pool. Netflix TVs, coffee machine and international plug sockets in the wall. Peaceful, clean and simply amazing in every regard."
ChIJIRW9PVoj0i0RAaaYM2DV82c,3 Beagles Villa,-8.473815,115.27560199999999,"Jl. Raya Petulu, Gunung, Petulu, Kecamatan Ubud, Kabupaten Gianyar, Bali 80561, Indonesia",https://maps.google.com/?cid=7490565214406485505,OPERATIONAL,,hotel,"hotel, lodging",4.8,24,,"I had wonderful experience at this place.
Everything about this villa is just amazing, location, the host and staff, cleanliness of the spacious room, oh couldn't forget their huge bathub too! 😄

It is near Petulu Heron Bird Colony Watch Point you can watch the thousand herons come in to roost in the trees around this village.

Their rooftop with incredible views of the rice terraces is breathtaking, definitely my favorite spot to chill and feel the breeze. ☺️
I will highly recommend this place for anybody who wants an amazing stay in Ubud.","It was a nice place to stay, especially if you're looking for a place to find serenity.
The villa is located near the Kokokan (White Heron) Bird Watch, it is such a magical view!!

Moreover, I spent my night in there by watch movies and drink beer (you can buy it in place). Their big TV screen was definitely mesmerized me!

ps: They had an adorable dog named Cece! I miss her already 🥺🥺","The villa was great! I had a good time here, the staffs were awesome! There’s a cute little dog who guards the villa so it is more than safe! 😂 and there’s a heron watching spot to see the famous kokokan birds near the villa too!","The villa is great, perfect location. It's surrounded by quiet and peaceful
area, a nice place if you need to run away from
daily busy activities in the city. The host and
staff are very kind and helpful during our
holiday. I will back again !! 😉",The staffs are all friendly and helpful. The villa was decorated so lovely and comfy. Will come back for sure ❤️❤️❤️❤️❤️
ChIJvSOXn7oi0i0R75MmvjX9zk4,Pande House,-8.4747994,115.27038399999999,"G7GC+35J, Jl. Sri Wedari, Ubud, Kecamatan Ubud, Kabupaten Gianyar, Bali 80571, Indonesia",https://maps.google.com/?cid=5678754587426067439,OPERATIONAL,+62 813-3864-5791,private_guest_room,"private_guest_room, lodging",4.9,8,,"Pande House is around 10 mins north of central Ubud, in peaceful Junjungan. A guesthouse of private villas off the main compound run by a gorgeous Balinese family. My lovely room was one of two in a private courtyard garden, with a huge bedroom and an enormous bathroom with a large rain-head shower. It has a separate outdoor kitchen with double burner gas stove, dining area and full sized fridge. It has everything you need, clean, well kept and really comfortable. Fast, reliable internet! Great long-term accommodation for anyone living and working in Ubud (or online).",a nice place in ubud to stay with friend or family. Also the owner of the villa is really friendly,"so convenient, the villa owner also realy kind!",Good house for stay,
ChIJRR9_1KUi0i0R58QvrBsv6oU,Warung Makan Babi Guling,-8.471690599999999,115.27736709999999,"Jl. Raya Tegallalang No.88x, Tegallalang, Kec. Tegallalang, Kabupaten Gianyar, Bali 80561, Indonesia",https://maps.google.com/?cid=9649576947494143207,OPERATIONAL,+62 852-3844-0038,indonesian_restaurant,"indonesian_restaurant, restaurant, food",4.4,39,,"Well..this babi guling was so nice. They open early bird (5am till 8am)..the taste was so pretty nice fo sure you will love it..price are soo soo...the name of the place is Warung Babi Guling Bu Desak Sapat, due to located at Sapat village tegallalang.",This is the best sucling pork around Ubud. They only open from 6am to 10am. The traditional recipe and the authentication is the key value of this place.,Local place! Come early for pork skin 👍🏻👍🏻👍🏻,"For 20+ thousand rupiah, you would get a delicious and crispy suckling pig. And it closes fast at about before midday","Authentic balinese food cycling fig, come earlier here to have crispy skin, the best one of cycling fig"
ChIJSwErhdsj0i0RzJPjlYtHR1c,heliostar,-8.4725517,115.2749373,"Jl. Raya Petulu No.35, Petulu, Kecamatan Ubud, Kabupaten Gianyar, Bali 80561, Indonesia",https://maps.google.com/?cid=6289074069486932940,OPERATIONAL,,coffee_shop,"coffee_shop, cafe, store, food",4.1,13,,One of the most beautiful places I’ve been in Bali. It is smaller than the usual venue but it makes it even more cozy. It has an area upstairs that cannot be seen from the street but that’s has views to the rice fields. Food is amazing. Beautiful!,"Everything was perfect, their coffee and foods are the best, their place so lovely and their staff  are caring to local guest like no other place in Ubud❤️",Beautiful Cafe with lovely servers and yummy food. Sunsets are beautiful from the top floor,,
ChIJZSE_GDoj0i0RQrsgkbdK7d4,Candra House,-8.474325799999999,115.27054759999999,"Banjar Junjungan, Jl. Sri Wedari No.utara, Ubud, Kecamatan Ubud, Kabupaten Gianyar, Bali 80571, Indonesia",https://maps.google.com/?cid=16063577598174739266,OPERATIONAL,,,lodging,5,5,,"Nice place, green, private, clean, easy to get everything, owner is good and very helpful. Recommended 👍",House of my friend,,,
ChIJ_29ye4Uj0i0RCSPl1HWHtis,Pondok Kita B&B Ubud,-8.469912299999999,115.27212709999999,"G7JC+2VJ, Ubud, Gianyar Regency, Bali 80571, Indonesia",https://maps.google.com/?cid=3149853929544950537,OPERATIONAL,,bed_and_breakfast,"bed_and_breakfast, lodging",5,10,,,,,,
