id,name,latitude,longitude,address,url,status,phone,primary-type,types,rating,rating-count,price-level,review 1,review 2,review 3,review 4,review 5
ChIJezmlx9Hs0S0RC6ceZmW6yaM,Labhagga Pacung,-8.112171,115.29176500000001,"JL. Raya Bedugul Desa Pacung, V7QR+4PJ, Sembiran, Kec. Tejakula, Kabupaten Buleleng, Bali 80363, Indonesia",https://maps.google.com/?cid=11802169243168843531,OPERATIONAL,+62 361 7462621,restaurant,"restaurant, food",4.1,14,,Nice view,execellent place for rest,Ok,,
ChIJv2mGfgnt0S0RQ3QjPrzB48Q,Bakso Mie Ayam Adi Laros Banyuwangi,-8.108955700000001,115.29256330000001,"V7RV+C28, Jalan Airsanih, Sembiran, Kec. Tejakula, Kabupaten Buleleng, Bali 81173, Indonesia",https://maps.google.com/?cid=14187396265387717699,OPERATIONAL,+62 822-3612-2351,indonesian_restaurant,"indonesian_restaurant, restaurant, food",4.2,9,,,,,,
ChIJ7VHXVs7s0S0R4MtGteNiY5g,WARUNG KRISNA,-8.1088068,115.2921933,"V7RR+FVG, Jl. Airsanih - Tejakula, Pacung, Kec. Tejakula, Kabupaten Buleleng, Bali 81173, Indonesia",https://maps.google.com/?cid=10980729046597815264,OPERATIONAL,,restaurant,"restaurant, food",,,,,,,,
ChIJPSsHP9eb0S0Rmyl-XjJgNVQ,Pondok Asmara,-8.1105599,115.29283420000002,"Jl. Raya Singaraja, Banjar Kubuanyar, Kec. Tejakula, Kabupaten Buleleng, Bali 81173, Indonesia",https://maps.google.com/?cid=6067861842401569179,OPERATIONAL,,,lodging,,,,,,,,
ChIJTcVhUs7s0S0RJR-Dm0_8Jfk,WARUNG BU RESMI,-8.109018299999999,115.29247269999999,"V7RR+9XX, Jl. Airsanih - Tejakula, Pacung, Kec. Tejakula, Kabupaten Buleleng, Bali 81173, Indonesia",https://maps.google.com/?cid=17953032908424027941,OPERATIONAL,,restaurant,"restaurant, food",,,,,,,,
ChIJR6GPAKnt0S0RhC3WSfVgp4g,Sea View Villa Di BUKTI,-8.1100002,115.2941173,"V7QV+XJX, Jl. Raya Air Sanih, Julah, Kec. Tejakula, Kabupaten Buleleng, Bali 81173, Indonesia",https://maps.google.com/?cid=9846945716890905988,OPERATIONAL,+62 812-3951-470,hotel,"hotel, lodging",,,,,,,,
ChIJh-Fsx8_s0S0RNybb5KtLulI,WARUNG WAYAN SABE,-8.109685899999999,115.2936387,"V7RV+4FC, Jl. Airsanih - Tejakula, Pacung, Kec. Tejakula, Kabupaten Buleleng, Bali 81173, Indonesia",https://maps.google.com/?cid=5961160258429330999,OPERATIONAL,,restaurant,"restaurant, food",,,,,,,,
ChIJ-83m_7rt0S0R-PWHtlneZCY,Warung satya,-8.109924,115.2942487,"V7RV+2MQ, Pacung, Tejakula, Buleleng Regency, Bali 81173, Indonesia",https://maps.google.com/?cid=2766580548008146424,OPERATIONAL,+62 812-4633-050,restaurant,"restaurant, food",4.5,4,,"Good food, good taste",,,,
ChIJQSA_jyvt0S0Ri-dG7egvLWA,Bali 479,-8.1095487,115.2938161,"V7RV+5GP, Jl. Airsanih - Tejakula, Pacung, Kec. Tejakula, Kabupaten Buleleng, Bali 81173, Indonesia",https://maps.google.com/?cid=6930248079052826507,CLOSED_TEMPORARILY,,restaurant,"restaurant, food",,,,,,,,
