id,name,latitude,longitude,address,url,status,phone,primary-type,types,rating,rating-count,price-level,review 1,review 2,review 3,review 4,review 5
ChIJg9h4hZEQ0i0RNMjwTIRaZy4,Finish Point Sobek Telaga Waja,-8.4894658,115.41187119999998,"Banjar Tabu Desa Tangkup, GC66+6P9, Tangkup, Kec. Sidemen, Kabupaten Karangasem, Bali 80716, Indonesia",https://maps.google.com/?cid=3343740772618913844,OPERATIONAL,+62 361 729016,restaurant,"restaurant, food",4.4,107,PRICE_LEVEL_MODERATE,Was the best activity our family has done in Bali. Highly recommend it!!!,"Good experience, good service, safety really come first..",Very exciting game guaranteed to be very good,It's not the best rafting experience but good for beginners,It's my first time rafting and will become a beautiful moments...
ChIJyfKnqyYR0i0R4xy6tPWpDpA,Kolam pancing jukung ume,-8.4882999,115.4077395,"GC65+M3Q, Selat, Klungkung, Klungkung Regency, Bali 80716, Indonesia",https://maps.google.com/?cid=10380421063899749603,OPERATIONAL,+62 813-3822-2191,restaurant,"restaurant, food",3,2,,Good,,,,
ChIJIX5w_JkQ0i0R4YnGYBY9zOI,warung tuak,-8.484916499999999,115.40768690000002,"Unnamed Road,, GC85+23M, Selat, Kec. Klungkung, Kabupaten Klungkung, Bali 80716, Indonesia",https://maps.google.com/?cid=16342504314142886369,OPERATIONAL,+62 816-1591-6896,bar,bar,4.4,5,,,,,,
ChIJj0ZiB5EQ0i0RHkt9-93eCKU,Finish Point Lapama,-8.4879003,115.4111493,"GC66+RFJ, Tangkup, Sidemen, Karangasem Regency, Bali 80716, Indonesia",https://maps.google.com/?cid=11891999861060225822,OPERATIONAL,,restaurant,"restaurant, food",5,5,,"Oh, I loved each and every moment of the rafting! 😃😃😃 Though I am a bad, very bad swimmer, I did enjoy the journey!",👍🏻,,,
ChIJT4tfjMwR0i0RiXWyY2cYtFc,Warung Bu prama,-8.487829999999999,115.40838000000001,"GC65+M3Q, Selat, Klungkung, Klungkung Regency, Bali 80716, Indonesia",https://maps.google.com/?cid=6319703009440986505,OPERATIONAL,,breakfast_restaurant,"breakfast_restaurant, restaurant, food",,,,,,,,
ChIJTSyMA5IR0i0R5ozx2i1L_Rg,WARUNG KENANGAN,-8.4858856,115.4126164,"GC77+J2X, Jl. Gg. Besakih, Tangkup, Kec. Sidemen, Kabupaten Karangasem, Bali 80716, Indonesia",https://maps.google.com/?cid=1800678086336941286,OPERATIONAL,,coffee_shop,"coffee_shop, cafe, food, store",5,1,,,,,,
ChIJE-z1MwAR0i0RAK17MFQwm0s,KAMAR house,-8.4866644,115.4055851,"GC73+HWM, Selat, Klungkung, Klungkung Regency, Bali 80716, Indonesia",https://maps.google.com/?cid=5448001312383544576,OPERATIONAL,,private_guest_room,"private_guest_room, lodging",5,2,,,,,,
ChIJDcmM5yAR0i0Rkxx-DUGKPC4,Bukit tangkup pemandangan terasiring,-8.4881899,115.41355750000001,"Jl. Gg. Besakih No.40, Tangkup, Kec. Sidemen, Kabupaten Karangasem, Bali 80716, Indonesia",https://maps.google.com/?cid=3331689836351200403,CLOSED_TEMPORARILY,,restaurant,"restaurant, food",,,,,,,,
