id,name,latitude,longitude,address,url,status,phone,primary-type,types,rating,rating-count,price-level,review 1,review 2,review 3,review 4,review 5
ChIJQ5dw3Ehz0i0RN6SD5_A4zHU,Sunny cafe penida,-8.6790725,115.4896031,"Jl. Raya Toya Pakeh - Ped, Ped, Kec. Nusa Penida, Kabupaten Klungkung, Bali 80771, Indonesia",https://maps.google.com/?cid=8488222005014012983,OPERATIONAL,+62 813-3851-1857,restaurant,"restaurant, coffee_shop, cafe, store, food",4.5,962,PRICE_LEVEL_MODERATE,"We loved our dinner and breakfast here. My favourite dishes was avo on toast and pitaya smoothie bowl. We didnt like beef quesadillas because of chewy beef, but everything else was tasty.","Unfortunately I was really disappointed by the food. I had the beef quesadillas, the beef was chewy and it just tasted like beef and cheese. No real flavour. My boyfriend had the carbonara which he also didn’t enjoy. Maybe the local Indonesian food would’ve been nicer there? Overall decent atmosphere and friendly staff.","Really cute Restaurant!
Ega was serving us and she was so friendly! Service was perfect and the food very delicious, we had the Monster Burger and the creamy salmon pasta and everything was good!🫶🏻 Would definitely recommend coming here since the Menu has various options to choose from!!⭐️",We went here in the morning for breakfast and got ourselves the tropical bowl and two cappuccinos. They were both amazing! The barista has wizardry skills in making cappuccino! Thank you! :),Intan the server was very friendly and helpful. Food was awesome especially the local food which she recommended. Definitely recommend if you are in Nusa Penida
ChIJ3fuRb59z0i0RJRMABVm-0io,21 BEACH CLUB,-8.675721099999999,115.48916550000001,"Jl. Bias Muntig, Banjar nyuh, Ped, Kec. Nusa Penida, Kabupaten Klungkung, Bali 80771, Indonesia",https://maps.google.com/?cid=3085737984247468837,OPERATIONAL,+62 812-2374-0600,restaurant,"restaurant, swimming_pool, night_club, sports_complex, bar, food",4.7,1427,,"Cash only, rather expensive. I did not understand the concept of this place. It's spacious and offers nice hang out places and a large clean pool. I felt it was a bit overpriced, and the food was rather minimal.","The manager of eleven penida beach club is Australianising!!
Racism..
we ordered for a nachos and mentioned the waiter thrice that we need it vegetarian.
The dish was served and we noticed the unusual taste and came to know it was beef..
Nobody wants to take accountability, after 10mins the waiter walking here and there called the manager, he came with his not so pleasing attitude
I told him’ we mentioned we want it veg many times, we can’t eat beef, we are Hindus and we consider it sacred’
He said a namesake me too, and without any gesture of apology, he moved back to the stage to sing pop to please the Australian tourist. As probably he thinks Indian rupees don’t work in Nusa penida.

Also about the food, the place is over rated as the pizza tasted 1.5/10.
Chocolate milkshake:2.5/10
And the price is high for the standard of food and service they deliver.

The positives are the music (of course aud people pleasing) lol, ambience amazing .
* the nachos wasn’t charged in the bill but without notice/ apology/intimation.
They made us feel like a reward and as though we were struggling to pay for it.","We were staying in the area and found this restaurant with good vibes so decided to give it a go. The staff there are absolutely friendly and fantastic. You'll also be able to watch a bit of sunset with is on the left side if you look out of the restaurant. The vibes here is amazing, with good musics and lighting. It's next to a beach, and also they got a swimming pool inside the club in case if you wanna keep it easier to tidy up.
However when it comes to food, the food are comparatively worse. We ordered a seafood spaghetti, and a beef wrap. (Originally we could like to have the salmon bruschetta but it's sold out)

The pasta was over salted, with cheese on top and tiny fish pieces that is not really fresh. With the beef wrap, it's basically a wrap with bolognese sauce. You can imagine the texture of the wrap is soft and oily with the tomato sauces. Again, this wrap is salty as well.

The vibes, the environment, the staffs here are amazing. Just cannot expect too much from the food they serve :( they probably serve good drinks here maybe","i love this place!!!!!!
qheken and hendra are so cool!!!!!!!!
definitely ill come again!
they have happy hour and good cocktails and service and live band!
i love local biz here!!!@
all staffs came from indonesia!","An absolutely beautiful paradise in Nusa Penida, beach front views, great drinks , amazing pool and lounges, great vibes. It was amazing to watch the sunset here. Music is really good too!!"
ChIJ1beHOJdz0i0RgBMzo5g_N2M,Wyn's Penida Cafe,-8.6791323,115.4898481,"Jl. Raya Toya Pakeh - Ped, Ped, Kec. Nusa Penida, Kabupaten Klungkung, Bali 80771, Indonesia",https://maps.google.com/?cid=7149252858279564160,OPERATIONAL,+62 812-3710-6667,restaurant,"restaurant, food",4.7,1974,,"This Cafe has a large menu with a lot of vegetarian options. For breakfast I chose the banana pancakes. They came with different fruit to what was on the menu which was disappointing as I don't like fresh apple and would have chosen an alternate item if I had known. The pancakes themselves were moist and delicious. The latte was actually a cappuccino and not very tasty. The pineapple juice was watery and didn't taste fresh.

Service was excellent, friendly and prompt. It was an open air building with fans and very comfortable.","I came here twice and didn’t love the food. I had a burrito which I believe had baked beans in instead of the usual kidney bean. As a brit it’s safe to say I was very surprised to realise it was baked beans in my burrito. I also tried the local chicken noodle soup which was nice but didn’t have many noodles. The brownie and ice cream was nice but more of a chocolate cake rather than a brownie. They do have live music however so the atmosphere is nice, it also always seems busy.","Love the atmosphere here! I am here now for my 3rd time, have been here every evening since I came to Nusa Penida.
Staff is super friendly, and funny 😁, and their food tastes amazing 🙏 there is live music every night, you can even sing with them if you like. I can recommend this restaurant to anyone who likes good food and drinks, and wants to spend a lovely evening in Nusa Penida","Highly recommend! Been on the island for 4 nights and ate here breakfast, lunch and dinner. They have amazing options. Try the Big boss for breakfast and Carbonara for dinner you won’t be disappointed!","Lovely food, really tasty. Loved the ambience and the live music is great. Came here twice in a row as it stood out as the best food place in the area. Highly recommend ✨️"
ChIJq-TkWKNz0i0RTkjSstEPLhE,Kelapa Penida - Bar & Restaurant,-8.6778544,115.49085139999998,"Jl. Raya Toya Pakeh - Ped, Ped, Kec. Nusa Penida, Kabupaten Klungkung, Bali 80771, Indonesia",https://maps.google.com/?cid=1237944340896172110,OPERATIONAL,+62 813-5330-8888,restaurant,"restaurant, vegan_restaurant, vegetarian_restaurant, seafood_restaurant, indian_restaurant, bar, indonesian_restaurant, food",4.8,1334,,"Very nice place with lovely food and good service. The people are very friendly. The place is well laid out, very spacious. Also good prices!

I had a fish dish and the sauce was amazing.","A lovely restaurant, I had the mie goreng ayam, which was really nice. A big portion for very cheap too. The ladies in there are really friendly however it was quite quiet so not much of an atmosphere. Don’t let this put you off from coming however, very cheap and good food!","Enjoyed an awesome omelette for breakfast, washed down with an incredibly tasty Mango Dacquari, and a Mango Smoothie which was thich, rich, and the added granola mix which is normally go ugghhh at turned out to be a delicious addition.  One of the cheaper restaurants, especially when it comes to cocktails and happy hour in the evenings.  Will absolutely come back here again in the future :)",Amazing food and great value. Very lovely and attentive staff. Our server Diani was very welcoming and took great care of us. We would definitely recommend Kelapa Penida. We may also be back for breakfast as they have a decent set breakfast offer!,"The food is amazing. Don’t be scared because there are only a view people eating here. Both the western and local food was off high quality (which is not always the case). I had the locally grilled fish, which was of high quality. Go here!!!"
ChIJ2x7gHlFy0i0Rt5GFtvUB_mE,Best Hotel in Nusa Penida: Arsa Santhi Penida,-8.6759081,115.4918412,"Jl. Raya Toya Pakeh - Ped No.99, Ped, Kec. Nusa Penida, Kabupaten Klungkung, Bali 80771, Indonesia",https://maps.google.com/?cid=7061083420604338615,OPERATIONAL,+62 821-6991-1168,hotel,"hotel, lodging",4.4,208,,"The hotel is conveniently located within walking distance from the port. It boasts a clean and well-maintained property with a friendly staff. The amenities include a swimming pool, a great restaurant, and comfortable, clean rooms with cozy beds. We are looking forward to revisiting Arsa Snathi and Nusa Penida, as it is a unique tiny island with a stunning coastal line.","Hotel is close to harbour
Decent hotel, pool is nice
What i disliked is the breakfast and the staff at restaurant.
They have very limited options for breakfast and being vegetarian and when options are even more less, they denied when i asked for more fruits. Even the fruits what they give you is just 2 pieces of watermelon and papaya.
Even milk they dont refill unless you ask for it.
Overall breakfast must be improved.","Very polite, helpful and hospitable staff. Pickup and drop was done on time and smoothly. Free refill of water from the restaurant, which minimizes plastic wastage. Pool is open 24/7, helped some folks in our group practice swimming before snorkeling out in the ocean. It is conveniently located from all the major tourist points, and so close to both the harbours.",I had an excellent stay. The property and rooms were very nice. The staff were very helpful. They provide bikes for rental too. They have 2 swimming pools one for kids and one for adults. It can be accessed any time.,"My recent stay at Arsi Santha Hotel was overall positive. Despite a few minor drawbacks, the property offers good value for the budget-conscious traveler. The low shower pressure was a slight inconvenience, and I was disappointed that they didn't provide port pickup as promised. However, what truly stood out was the exceptional service from the staff, particularly Rendra. His assistance and friendly demeanor made the stay truly enjoyable. Rendra's dedication and helpfulness were amazing, and they significantly enhanced my experience at the hotel. Overall, despite some room for improvement in certain areas, I would recommend Arsi Santha Hotel for its excellent staff and value for money."
ChIJRSaLkWNy0i0RxawSuadSnkI,Maruti Beach Club,-8.675592199999999,115.48948200000001,"Banjar Nyuh Beach, Ped, Kec. Nusa Penida, Kabupaten Klungkung, Bali 80771, Indonesia",https://maps.google.com/?cid=4800365133141552325,OPERATIONAL,+62 813-3877-9080,bar,"bar, lodging, restaurant, food",4.2,533,PRICE_LEVEL_MODERATE,"Likes:
* Nothing at all.

Dislikes :
* Not fresh food , bad quality, poor presentation.
* Poor cooking & bad taste.
* Poor & bad service.
* Cheating & stealing “ The prices in the menu is lower and different than the prices in the final bill 🧾 “
* Very bad low quality Espresso.

Finally : Not recommended ; So low level and bad beach club, they have customers just because it is near the harbour.","Wrongly went there thinking it was 21 Beach Club.

The food was good (we had tuna and octopus satay), and the smoothie I ordered also.

However, having to pay 150K for the long chairs felt a bit too much considering we were having lunch there and consuming drinks. It’s not like we just wanted to lay there and enjoy the pool.

Overall, it was nice to have a swimming pool to stay in but the service was average and the price of the long chairs definitely not justified compared to other places we’ve been to.

I wish we had continued a few more meters and went to 21 Beach Club…","Caution: The restaurant's menu is relatively pricey, considering the absence of gourmet options. Be mindful when dining here; in addition to the displayed prices, there's an extra 16% charge (10% for taxes and 6% for services) that is not explicitly mentioned. It's worth noting that this establishment appears geared towards tourists. While the food is satisfactory, a potential concern is that the rice isn't refrigerated, posing a risk of food intoxication.","Saved me when I had to wait a boat for 3 hours. Nice pool and clean toilets.

You can use normal chairs for free, but small sunbed was 150 000idr even though you bought food. Tuna steak was superdry and food was quite expensive.","The place is nice, but we waited 45 min for a breakfest dish which finally came cold. Benedict egg shouldn't be called that here, because it has notfing in common with a real one."
ChIJvdoc00Vz0i0Re-9DkYz9XTg,Akatara Hotel,-8.6794232,115.48979310000001,"8FCQ+6WM, Jl. Raya Toya Pakeh - Ped, Ped, Kec. Nusa Penida, Kabupaten Klungkung, Bali 80771, Indonesia",https://maps.google.com/?cid=4061681219132452731,OPERATIONAL,+62 366 5582960,hotel,"hotel, lodging",4.6,141,,"Had such a great stay at here I would highly recommend! The staff h elped with any questions we asked and honestly did everything they could to help us out, the room was stunning with a walk out balcony to the pool and the bed was so comfy! They gave us pool towels as well as normal towels every day, made sure the room was tidied when we were out and honestly couldn’t praise them enough! Even drove us to the ferry port and got our tickets sorted so we didn’t have to wait in line to check in, really happy with our stay and will definitely stay again!","I stayed at hotel for 2 nights. Location was excellent for me 68yo travelling solo.
Room is comfortable. Only mirror is vanity mirror. Tea and coffee in room.
Drinking water machine in breakfast room for refills 2 bottles in room each day.
Room was a bit noisy but remember you are opposite a night club. Early morning wake up to call to prayer somewhere but loud enough to wake the dead.
Plenty of restaurants across road. I went to happy eating great cocktails 2 4 1 happy hour 85k great value","We stayed there 2 nights. The service is so kind, the rooms are beautiful and clean. Nice swimming pool. The hotel is close to the nice restaurants.
They offer us laundry service and it was perfect.

We recommend it!!","Room is neat and clean.
Can access to pool from front door of room if your room is at lower floor.
Breakfast is quite good (at least the mie goreng is not overly sweet compared to some of that in Bali)
Definitely worth every penny with the room and great location.
The only downside is near to few bar and restaurants which is not friendly to people who prefer quiet environment… But no big deal to me as I can sleep the moment i lay on bed due to journey from sanur to penida and did west line tour on the day itself 😂😂","A beautiful place, a green oasis with a beautiful garden and pool. You don't have to worry about the busy street. The rooms are very nice and clean, comfortable bed. The staff was wonderful and very helpful, especially Dewik and Ayu helped us a lot with anything we wanted (eg renting a scooter) There are also several restaurants, a pharmacy and a shop near the hotel."
ChIJf5ToLGVz0i0RErHk3nKXWrI,Joglo Penida,-8.6754044,115.49196020000001,"Jl. Raya Toya Pakeh - Ped, Ped, Kec. Nusa Penida, Kabupaten Klungkung, Bali 80771, Indonesia",https://maps.google.com/?cid=12851751006276727058,OPERATIONAL,+62 813-3795-6406,restaurant,"restaurant, food",4.8,477,,"Went to this place for lunch because of good reviews and high rating.
The food here is really not bad. The pizza was tastier than other places we've been to. The pasta was good, but it had a lot of olive oil in it.
We also liked the hot coffee. Overall, not a bad menu with European food.

There were a lot of visitors. You can sit both inside and outside. The interior is ordinary, unremarkable.

But the staff was very disappointing. They took a very long time to bring our food. At one point it even seemed to us that the waiter just forgot about us. Also my husband ordered cold coffee, but the waiter who was taking the order heard ""cold water""🤷🏻‍♀️🤦🏻‍♀️🤦🏻‍♀️ and brought us water. We didn't even think that we would have to pay 17,000 rupees for it, we thought it was such a service for those who sit outside, but we were wrong 🤦🏻‍♀️ the cold coffee my husband was waiting for never arrived. The service though was poor.
I am giving a higher rating only because of the food.","In our 5-day stay in Nusa Penida so far, this resto was the first place where we felt full by one main dish. The burgers were tasty and big. The wedge potatoes and the pinacolada were also very nice.
The service was a bit slow.","Absolutely gem here in Nusa Penida, found this restaurant on the second day and since then, we continued coming here every single day and sometimes more than two times a day.

Really good place for eating either indonesian or western food. The drinks are also really good and the desserts as well.

The staff were always very nice and happy to receive us.

Absolutely recommended if you are around the area.",Their cocktails are absolutely amazing - best Pina Colada I've had for a while anywhere in Bali!  Had the BBQ Chicken Pizza and Chicken Parmigiana... both delicious and well priced.,"This is the best local restaurant for Western food, with a few westernised indonesian options on the menu. All of the tourists seem to come to this place because the price is fair, portions are good, food is amazing. Been here twice and had Indonesian options both times, will be back to try one of the breakfasts."
ChIJU6atus1z0i0RrojOhR_IrK0,Orion BAKERY,-8.673159,115.49459650000001,"Ped, Jalan Raya, Kp. Toyapakeh, Kec. Nusa Penida, Kabupaten Klungkung, Bali 80771, Indonesia",https://maps.google.com/?cid=12514597502270212270,CLOSED_TEMPORARILY,,bakery,"bakery, coffee_shop, cafe, store, food",4.6,184,,Orion Bakery exceeded my expectations in making my sister's birthday unforgettable. The cake was not only a delightful surprise but also earned rave reviews from my sister. Its phenomenal taste and deliciousness truly made the celebration exceptional. Highly recommended for anyone looking to add a touch of magic to their special occasions! 😍🥳💖,"Very nice bakery experience. When ordering cinnamon roll you cannot do anything wrong. Personally I fell in love with well made cappuccino. Very pleased with kind and friendly staff. It was pleasure to meet the owner of the Orion bakery, kind and pretty woman with great attitude towards all her customers, she is trying to pleased everyone who’s visiting her bakery. Fell in love with the cozy vibe of the place. Very highly recommended ;)","Came here as soon as we got off the boat at the port because we needed our morning coffee fix. It was absolutely delicious. The prices are higher than typical local options, but the quality is 🤌 *chefs kiss*

We got a cappuccino and a long black, which tasted great. And the banana jumbo muffin -proper huge serving - it was deliciously caramelised with walnuts on top, super moist too. And the lemon cake was tangy and sweet . Would definitely recommend this as a brekkie stop before exploring Nusa Penida!","High quality and well made coffee, we’ve enjoyed our drinks a lot, such a nice feeling been closed to the beach. Highly recommend 😊","This place is an oasis in the desert, great food quality, happy helpful staff and great vibes with the coolest music. Only place in Indonesia that made the ice freddo cappuccino. We had coco cake, cinnamon roll and capresse sandwich. All great! Once again thank you for he kind
Highly recommended"
ChIJvYl4V7lz0i0Rciy8IYDttls,Organica fresh and tasty food,-8.6744399,115.4925241,"Jl. Raya Toya Pakeh - Ped, Ped, Kec. Nusa Penida, Kabupaten Klungkung, Bali 80771, Indonesia",https://maps.google.com/?cid=6608730637790358642,OPERATIONAL,+62 852-7532-6012,restaurant,"vegan_restaurant, vegetarian_restaurant, meal_takeaway, italian_restaurant, restaurant, food",4.7,570,,"ordered the vegan curry the first time dining here which was pretty good! friends ordered pizza which looked good and tempted me to order that for a return visit

tried my luck to see if they delivered and lived close enough that they did- which i am super grateful for cause of an injury. ordered pizza and the smoothie cup for delivery twice. pizza is great; smoothie cup is a delicious quick fix if you want some fruits and healthy-ish goodness in you. folks there are friendly and nice. definitely recommend!","Very tasty pizza, exceptionally good food in general. friendly staff and very causy. It is a very unique place among the many beach clubs standing out with high-quality food. Cash only, no cards accepted. Great value for money!",Have been there twice in a two night stay in Nusa penida! One of the best place for vegans we could find in the island. Tasty meals and lovely staff. Prices are really good too and location is easy to find.,"I ordered french fries, pizza, mango-pineapple smoothie. Everything was tasty and fresh. The ambiance is also very calm and soothing. The place is very near to the harbor so can be easily reached at. Also, being a vegetarian it was a cherry on the cake to find a lots of vegetarian and vegan options at a reasonable cost.","Absolutely phenomenal food! The flavours, freshness, and quality of ingredients are simply impeccable. We just arrived in Nusa Penida and decided to have lunch here, and it was so delicious! We ordered the Vegan Bowl and the Mie Goreng Pineapple - both dishes were fantastic. Expect nothing but the finest food made with top-notch ingredients here. Fantastic service, highly recommended!"
ChIJBSBES1lB0i0R1Fg5vZiZbcI,Happy Eating Penida,-8.6792243,115.4896423,"Jl. Raya Toya Pakeh - Ped, Ped, Kec. Nusa Penida, Kabupaten Klungkung, Bali 80771, Indonesia",https://maps.google.com/?cid=14010022897108211924,OPERATIONAL,+62 813-3753-8454,restaurant,"restaurant, food",4.6,472,,"Lovely restaurant, I would say best in the area. I came here 3 times, for breakfast and cocktails. They do happy hour until 9 which is later than the surrounding places. The cocktails were also lovely, as well as the food I tried.","I ate here for EVERY meal whilst in Nusa Penida 😁

The food is amazing, definitely one of the best restaurants I have ate in whilst travelling the past 5 months and the prices are really decent!

The Indonesian food is the best, the Nasi Goreng with Chicken Satay is the best 😍 The portion sizes are unreal!

Only improvement would be with the avocado breakfast which would be perfect with an extra egg 🍳

Staff are lovely and welcoming.

Definitely try this restaurant whilst in the area!","Excellent food, service and such a chill atmosphere. Food was so tasty, big portions and a good price. Such a big menu with lots of choice. Cocktails were yummy too and buy one get one free 4-8pm.
We will definitely be back to try some more of the menu!","It is a nice restaurant. With a beautiful wall paintings and interior design. Mostly you can find traditional food but also there are other types of food. Also they make fresh juices which are super tasty, the quality of food is good and the price are reasonable. The staff are nice and friendly and helpful. It is located in the Centro of Penida in the street which you can also find other restaurant.","Traveling around the island, we stopped for lunch at this place. We were starving. We came on the basis of positive reviews. In general, not a bad place. The staff was polite.
The waiter recommended their popular burger. It turned out to be very greasy, we did not like it. Here instead of a bun, you get pasta in breadcrumbs 🙈🌚this is a very strange decision. But the meat in the burger wasn't bad.
The prices are okay."
ChIJ378_ZfJz0i0R9izXVRCNPpo,Arjuna Beach Club,-8.675015799999999,115.48963830000001,"Jl. Bias Muntig, Ped, Kec. Nusa Penida, Kabupaten Klungkung, Bali 80771, Indonesia",https://maps.google.com/?cid=11114476031696121078,OPERATIONAL,+62 819-1157-5857,restaurant,"restaurant, food",4.2,93,,"Great little place. We spent the afternoon just chilling here, dipping in and out of the pool and eating tasty food. We moved to the sunloungers on the beach front for sunset. They were super chilled and not in a rush for us to pay, felt like you could chill here forever!",The place is closed and completely unavailable. It looks like after an apocalypse.,"⚠️Big warning ⚠️ for anyone who is craving egg Benedict - I know I’m in Asia but I would still did not expect the hollandaise to be replaced to some  powder cheese sauce…

It’s a nice place to come and have a drink but to swim in the pool Is a big no for me- not clean at all.","Don’t get fooled by the smoothie bowls that look amazing, when we got here they didn’t have them. We had the avocado smoothie and Benedict eggs. The smoothie was good but the Benedict sauce was some cheesy powdered sauce.. Overall less good and more expensive than local Warungs. Service was quick tho!","Great location facing the beach, good food , very busy place"
