id,name,latitude,longitude,address,url,status,phone,primary-type,types,rating,rating-count,price-level,review 1,review 2,review 3,review 4,review 5
ChIJX5mWtv1F0i0RCZEMLEXTY6U,Kedai goeska,-8.7917954,115.1531691,"Jl. Karang Mas No.89, Jimbaran, Kec. Kuta Sel., Kabupaten Badung, Bali 80361, Indonesia",https://maps.google.com/?cid=11917601332997689609,OPERATIONAL,+62 896-7273-0222,restaurant,"restaurant, cafe, bar, food",4.4,21,,Good food & very affordable!! Cozy place,The fried rice was incredibly good and cheap! Rp 45k for food and beer..,"Clean place, good food, cheap prices and nice staff and owner. Would recommend 100%!",Very very good. Amazing prices for amazing food 😊,Nice place
ChIJCfW0HCRF0i0R96jLBSPIluU,Karangmas Guest House Jimbaran,-8.7931201,115.1501285,"Jl. Karang Mas Sejahtera No.28, Jimbaran, Kec. Kuta Sel., Bali, 80361, Indonesia",https://maps.google.com/?cid=16543630333938739447,OPERATIONAL,+62 21 80629666,guest_house,"guest_house, lodging",,,,,,,,
ChIJAYIX7KdF0i0RRde_CGpsKhU,Hijau Gading Kost,-8.7970167,115.1524988,"Jl. Hijau Gading, Jimbaran, Kec. Kuta Sel., Kabupaten Badung, Bali 80361, Indonesia",https://maps.google.com/?cid=1525150626487457605,OPERATIONAL,+62 812-4682-0622,,lodging,5,4,,,,,,
ChIJIepUFuZE0i0RzVJ0C5OOtP0,Warung Echo,-8.7919941,115.15238500000001,"6552+6X2, Jl. Karang Mas, Jimbaran, Kec. Kuta Sel., Kabupaten Badung, Bali 80361, Indonesia",https://maps.google.com/?cid=18281393549607195341,OPERATIONAL,+62 815-2934-4955,restaurant,"restaurant, food",4.3,153,,"I appreciate the local atmosphere. As someone from Nepal who frequents similar quaint spots back home, being here felt like a piece of home. The authentic Balinese cuisine only added to the delightful experience.",Food is great! We stayed at Royal Tulip and walked out on both nights for dinner. The nasi goreng is really tasty. We like the ikan bakar and ayam bakar too. Eating there would be the best but the flies were annoying,"Great food! We stayed right next to this warung and we ate here 4-5 times. The food was always delicious! When you see locals eating in a restaurant, you know the food is really good.",Good local warung. Open kitchen where possible to see the people preparing the food. Except for the fish all fresh ingredients. Some a bit too specific spiced for me. In places like this I would suggest to go for the classics and not try to experiment too much :-). Friendly and helpful staff. Prices unfortunately not written on the menu,"Stunning place, cozy, delicious food"
ChIJNwY-ooNF0i0Rs3ZMsHVeP54,rimawan kos,-8.7961569,115.15288079999998,"Sejahtera, Jl. Karang Mas gg. karangsari No.55, Jimbaran, Kec. Kuta Sel., Kabupaten Badung, Bali 80361, Indonesia",https://maps.google.com/?cid=11402936641087370931,OPERATIONAL,+62 817-6600-555,bed_and_breakfast,"bed_and_breakfast, lodging",5,3,,,,,,
ChIJlxWPQ1NF0i0ROOvNt862WE0,Blembong Kost 2,-8.7945275,115.14973119999999,"Jl. Jepun Gg. Manikan No.2, Jimbaran, Kec. Kuta Sel., Kabupaten Badung, Bali 80361, Indonesia",https://maps.google.com/?cid=5573405537834232632,OPERATIONAL,+62 838-3203-9311,hostel,"hostel, lodging",4.7,10,,"Thanks for the host, i live in best place in jimbaran area dor a couple of month.

Strong wifi connection, fresh water and suspicious bed area.",Best lost in Jimbsran,,,
ChIJl7N6DhRF0i0R3r9UGTXBlmk,kedai joglo jimbaran,-8.7920027,115.1522892,"Jl. Karang Mas, Jimbaran, Kec. Kuta Sel., Kabupaten Badung, Bali 80361, Indonesia",https://maps.google.com/?cid=7608481054291443678,OPERATIONAL,+62 859-5855-9631,restaurant,"restaurant, food",4.9,8,,"Airbnb review is as follows:
The rooms are quite small with some rooms not having a good air-conditioning. Loamcation and pool is good.
There was some water issue as well during my stay which was later solved by the staff.",Wonderful,Good vibe and service.,,
