id,name,latitude,longitude,address,url,status,phone,primary-type,types,rating,rating-count,price-level,review 1,review 2,review 3,review 4,review 5
ChIJVf4EIjgV0i0RkEluhWNAC6w,Small eatery lord Rama,-8.5754772,115.288383,"C7FQ+R92, Jl. Ir. Sutami, Kemenuh, Kec. Sukawati, Kabupaten Gianyar, Bali 80581, Indonesia",https://maps.google.com/?cid=12397073195451959696,OPERATIONAL,+62 812-3687-9311,restaurant,"restaurant, food",4.2,31,,"Amazing hotel right opposite to the parking lot of Tegenungen waterfalls. This place serves Indian food along with Balinese cuisine.

The hotel is nicely lit and has a small bird park where visitors who ordered food can click photos with exotic birds. The food is great here with a nice presentation.

The restaurant being close to the falls is fairly overpriced since it is a tourist place. I tried luwak kopi the famous Indonesian coffee made from civet cats' poop. It tasted bad but it is famous so I need to try it.

Overall a nice place for Indian and continental food near the waterfalls.","Ordered mango juice, it was nice. Staff very friendly we have requested for one banana for my daughter and they gave us in 5000/- then after paying bill we requested again for one more banana and given 5000/- but this time they gave us free of charge.","The food is overpriced, the quality is lower than average. We couldn't even finish our meal, so greezy it was. For this price you can have a great dinner in a fancy restaurant.
They charged us 21% of taxes!

I don't recommend this place","Great ambiance, very friendly people, verity of food and tasty.",food was average and 21% service charge is insane when it is already over priced
ChIJKT3xn_cV0i0RSoUpypj_OA8,Pork meatballs,-8.5751244,115.2865986,"Jl. Ir. Sutami, Kemenuh, Kec. Sukawati, Kabupaten Gianyar, Bali 80582, Indonesia",https://maps.google.com/?cid=1096907540956546378,OPERATIONAL,+62 813-3715-7513,indonesian_restaurant,"indonesian_restaurant, restaurant, food",4.1,80,PRICE_LEVEL_INEXPENSIVE,"Excellent local bakso restaurant just outside of the water fall place, delicious meat ball and soup. They have moved 50m from original place with a nice sitting area.",Good meat ball and fried rice.,Yummy and not pricey,Nice,
ChIJr5AKslYV0i0RapwUb1lHQR4,Warung Babi Guling Iga Telaga,-8.5755252,115.28760789999998,"Jl. Tegenungan Waterfall, Kemenuh, Kec. Sukawati, Kabupaten Gianyar, Bali 80511, Indonesia",https://maps.google.com/?cid=2180102144065313898,OPERATIONAL,+62 821-4699-1283,indonesian_restaurant,"indonesian_restaurant, restaurant, food",5,1,,,,,,
ChIJ_65qK_gV0i0R58LMRs_wiXc,Danastiti Art Gallery,-8.5740689,115.2865644,"Jl. Raya Kemenuh, Kemenuh, Kec. Sukawati, Kabupaten Gianyar, Bali 80582, Indonesia",https://maps.google.com/?cid=8613680535359505127,OPERATIONAL,+62 813-3775-0808,art_gallery,art_gallery,4.9,23,,Great selection of art works and well packaged for our trip back home to Australia!,Lovely selection of good quality artwork at reasonable prices. Packaged securely and nicely so could take back to UK.,Very beautiful paintings! 😍,Very reasonable price! Painting from feather are available here.,Very good painting with reseanable price.If I give rating 8 from 10 . Visit & prove it.
ChIJ8X96DqMV0i0RAZcOTnZOznY,Warung Makan Kolam Pancing Kemenuh,-8.570103999999999,115.2856209,"Jl. Raya Kemenuh, Kemenuh, Kec. Sukawati, Kabupaten Gianyar, Bali 80582, Indonesia",https://maps.google.com/?cid=8560866211700578049,OPERATIONAL,,restaurant,"restaurant, food",5,4,,,,,,
ChIJoSFFB8AV0i0RrYCrmGGRFp8,"D'Ayodya Restaurant, Pool & Bar",-8.575368899999999,115.2888079,"C7FQ+VG3 Tempat Wisata Air Terjun Tegenungan, Jl. Ir. Sutami, Kemenuh, Kec. Sukawati, Kabupaten Gianyar, Bali 80581, Indonesia",https://maps.google.com/?cid=11463509749877407917,OPERATIONAL,,bar,bar,3.2,14,,"Had lunch here after a blast at the waterfall. Most disappointing food, hygiene issues and atrocious service. Served cold (not chilled beer) and brought 1 beer mug and a glass (meant for juice) after 10 minutes post 2 reminders. Food was cooked as described in the menu,but completely misleading. Pizza bases were not cooked and 2 out of 3 pizzas had to be sent back for additional cooking in the oven. 3rd pizza had cheese slices on top! Vegetable skewers hardly had any vegetables in the skewer and were served with rice!!! Bruschetta was made with regular slices brown bread and served with lettuce! Kids went to their pool and decided not to have a swim as it was thirty. Would NOT advise anyone to visit this place.","Forty to fifty minutes for some lame pork ribs. We were the only costumers.
Bad food and bad hygiene.
Very expensive. Don't trust google maps on this, it was indicated 75k and we paid 200k per person
Don't come here, it's a wate of time and money","Great service and food was amazing, with complimentry snacks. Nice view as well. Must go place if u want taste of authentic Indian street food🤤",Place was wonderful with nice view from the rooftop. They provided a complementary sweet potato chips which was unique and delicious. Customer service and food was nice as well.,2 mie goreng for almost 300k is perfect rip off.
