id,name,latitude,longitude,address,url,status,phone,primary-type,types,rating,rating-count,price-level,review 1,review 2,review 3,review 4,review 5
ChIJceqfUrYj0i0R3AKPH-aEZmM,Warung Umah Bali,-8.4465234,115.25802209999999,"Jl. Keliki Kawan, Kelusa, Kec. Payangan, Kabupaten Gianyar, Bali 80561, Indonesia",https://maps.google.com/?cid=7162558381286163164,OPERATIONAL,+62 813-5385-6359,indonesian_restaurant,"indonesian_restaurant, restaurant, food",5,472,,"This place is a Balinese gem. It is a family run, beautiful spot in an unexpected location. The menu is varied with lots of delicious Bali classics and some more unusual options we haven't seen before. The people are so kind and it is very reasonable. You will not be disappointed if you visit!","It’s a hidden gem, also because you have to enter the tiny trail from the road and you can park there the scooter.
We ate here very very good and spent very little money.
I urge you to eat the black rice pudding dessert, it’s the best one in Bali!!",Hands down one of the best meal we had in Bali. Home cooked Balinese cuisine in a lovely home setting. Staff were very welcoming and I even get to plug some ripe passion fruits in their garden. It's definitely worth the trip from Ubud.,"Beautiful spot and amazing food. I went twice for dinner when I was staying near by. The girls working out front are so kind and attentive. The food was wonderful. And the juice and smoothie are so tasty as well. It’s such a relaxing spot to eat, right in a garden space. It’s clean and the food was very yummy and filling. Couldn’t recommend more.",Hidden gem in a small local area inbetween the ricefields! Owned by a lovely family. The food is one of the best we had in Bali! 10/10
ChIJ_UXgRY0i0i0RKkVeg275pOQ,KELIKI LUXURY LODGE,-8.4516007,115.2603825,"Jalan Suda Mala, Banjar Pacung, Keliki, Kec. Tegallalang, Kabupaten Gianyar, Bali 80561, Indonesia",https://maps.google.com/?cid=16475567589873829162,OPERATIONAL,+62 881-0373-21602,hotel,"hotel, lodging",4.3,53,,"We had booked a private lodge with a private swimming pool.

The place is beautiful.
However, it smelled strongly of mold, and my wife began to exhibit allergic reactions and headaches.
The hotel manager was more focused on making excuses, saying that it was typical for the jungle.
We had just come from another hotel in the jungle without any mold issues.

We ordered room service, fish and chips. But it looked like something from a canteen, without any garnish, and it was not properly fried. 200,000 IDR for a disappointing meal.

We decided to go to the bar to see if a drink could improve our mood and the initial problems. We found out that there was happy hour until 6 pm. The problem was that the bar did not open until 6 pm.

Not a smile from the sparse staff, and with only two other guests, there was a gloomy atmosphere.

Dinner was unfortunately the same canteen quality as before, but with prices as if it were fine dining.

We stayed for one night and checked out the next morning, even though we had paid for two more nights. It was only then that we received an apology, but no discount for the extremely critical conditions.

We do not know how it is during the peak season, but in the off-season, it is far from a 5-star hotel. Only the price is.","Would be a five had the full services been available, or had we known before booking that they wouldn't.

The first thing to really note is that this hotel has some of the best staff in the world. They went above and beyond on a daily basis to not only make our stay extremely comfortable but also that our kids felt welcome and safe. Our two kids loved the staff. They also helped us with transport wherever we wanted to go and nothing was too much trouble.

The food was very nice but the facilities were quite limited while we were there. No lunch, pool bar closed, no tasting menu's etc It was just coming into season, and we weren't aware that the menu would be as limited as it was, and with young kids we were largely reliant on the hotel for dinner every single night and with the limitations it did get a little repetitive. So again, food was good but it would have been nice to know that it wold be limited upon booking.

Room was very nice, pool was excellent and housekeeping were excellent. It's next to rice fields and in the jungle so you have to expect a lot of insects and we had a Gecko in our roof, which we didn't mind at all but I know some people would. So just know that you're booking a hotel in the jungle. The views were absolutely outstanding and all the locals were friendly.

We used the hotel to take private tours and we really enjoyed this. It was informative, useful and really helpful for us. Just need to be aware that traffic is really bad so whole day trips will take a long time, the hotel offer full day trips to different parts of Bali and it will take that.","Although the manager asked us not to write a bad review, we feel compelled to share our experience. We lost several hundreds dollars and one precious day of our honeymoon, and instead endured a day and night with headaches, itchy throats, and noses. Consequently, we chose to leave the Keliki ""luxury"" lodge and booked a 4-star hotel that truly deserved a 5-star rating.

Upon our arrival at Keliki, I immediately sensed mold and identified indicators within two minutes. Due to my physical reaction, we requested another room. The initial response was dismissive: ""This is how it is to stay in the jungle,"" ""All the rooms are the same,"" and ""There’s nothing wrong."" This was despite the fact that our previous hotel, also located in the jungle, did not have these issues. When I showed the manager photos of the mold, she promptly sent staff to change the mosquito net and clean the clogged dehumidifier filter. I appreciate that the manager took our complaint seriously after seeing the photos.

Given that our booking was non-refundable, we decided to give it a chance, looking forward to the delicious food advertised by the hotel. Unfortunately, there was no staff present at the pool bar, so we ordered room service. The pictures we took speak for themselves. Although the manager herself served the food to our lodge, the trays were never collected and remained there the next morning. We had hoped for a better dining experience, but only the prices matched fine dining, not the quality. We were informed that there was no à la carte fine dining, only a three-course dinner or a romantic dinner setup available with one day's notice.

Waking up the next morning with severe headaches, we were offered a breakfast that was comparable to what you might expect at a gas station. We decided to check out early, prioritizing our honeymoon experience over the money lost. It’s important to note that the lodge felt understaffed, the food was incredibly bad, and overall, it felt more like a deserted place than a luxury lodge.","We (Family with two Kids) stayed at the Keliki Lodge for a week in August and it was just fabulous! Fantastic Villa with private pool surrounded just by nature. The staff was always super friendly and helpful. Good a la card breakfast and food in the restaurant. One of our daughters has several food intolerances and they always prepared special meals that suited her. Marie, the manager was very helpful with organizing our excursions. We did great things you can not find in the travel guides and also included fun things for the children. All the drivers/guides from the lodge who were taking us were very friendly and attentive and told us a lot about the people and culture of Bali. It was by far the best experience we had so far and definitely an unforgetable time!","Amazing and quiet place among the rice culture. Lodges are a pure wonder decorated with à lot of care. Waking up with a floating breakfast in your private pool and with a view on the jungle is a unique pleasure. The restaurant proposes high quality food at a fair price. Thanks à lot to Marie Françoise, Made and the overall team for their kind welcome. It was à delightfull experience to stay in this place and discover the numerous amazing place in the region."
ChIJlc6wRPQi0i0RozckkiDH6H4,Villa Benisari Batik,-8.4485865,115.25634119999998,"H724+HG8, Keliki, Tegallalang, Gianyar Regency, Bali 80561, Indonesia",https://maps.google.com/?cid=9144777986080520099,OPERATIONAL,,hotel,"hotel, lodging",4.7,61,,"We stayed in the smaller cottage villa for three nights and it was beautiful. Out of central Ubud so not busy, in a gorgeous location. Hendra provided incredible service - he drove us from the airport very late at night and ensured we had homemade breakfast the next morning. His service has been excellent. We are sad to be leaving!","Rooms - excellent wooden interiors can easily compare with any highend luxury hotel.
Location - a bit interior but i think dats d cost u pay for living widin rice fields.
Service - excellent, we got served by 'HENDRA', very polite and helpful guy even available after midnight over phonecall,
He even arranged bike for us.",I really liked staying at Villa Benisari Batik because it was a really calming and peaceful area/ place . The service was great here to.,"My and my friend had a wonderful stay at Benisari Villa 1 in Ubud. Eka and Kadek made our stay so easy and we had no problems getting around. The villa is 20 minutes away from Ubud town but Kadek was always ready to drive us there and back. The villa is absolutely beautiful witha very large deep free standing bathtub and seperate rain shower. Waking up to the rice fields and having our breakfast delivered every morning to our front porch was amazing. We had massages by the poolside that Eka organised for us and definately order food from the local Warung Umah restaurant, they deliver straight to your villa! Do yourself a favour and stay here!! We will definitely be back!",GREAT VILLA IN BALI!!  such an awesome experience! Amazing backyard and pool!
ChIJI0cwljsj0i0RBGlkJnH6Ips,Le Gastronome,-8.4515906,115.26018339999999,"Jl. Suda Mala, Keliki, Kec. Tegallalang, Kabupaten Gianyar, Bali 80561, Indonesia",https://maps.google.com/?cid=11178772588969355524,OPERATIONAL,+62 881-0373-21602,restaurant,"restaurant, food",4.5,28,,"Delicious French tasting menu in one of the pods for our honeymoon dinner. It felt so romantic and exclusive in such a beautiful setting, and the food was delicious and beautifully presented. They went to a lot of effort for each of the courses, especially as I am vegetarian. You have to book and pay a deposit at least 24 hours before. They had a good selection of wines, and option to choose from their wine cellar. Only negatives were they did run out of bintang for my husband part way through the meal which was a little surprising and the portions are on the small side and would be better if they were a little bigger. When paying 3.5m IDR on dinner for 6 courses you would expect to leave feeling full, which we didn’t. However overall it was lovely and felt such a special occasion.","One of the best restaurant experiences in the area of Ubud. I loved the Christmas design and the chandeliers. The staff is very professional and the dinner we had was exceptional - my red snapper was perfect, paired with delicious rice and grilled corn. Also loved their red velvet latte I came back a few times just for it.","The newborn place in small village in Ubud is name Keliki. It’s Le Gastronome by Keliki Luxury Lodge. When I came into it, it looked luxurious like its name. They used bamboo mostly in the construction of the restaurant. I liked the glass chandeliers that they installed making it more luxurious.

Downstairs, you would find the poll with some red daybeds. That color was very pleasing to the eye. They had an open kitchen that looked very neat, clean and well-arranged. The neat kitchen reflected the good food. It was true, they had very delicious food with homemade ingredients. The bakery, pastry, main courses and desserts were appetizing and very tasty. Coffee? actually, it was okay. I got true hospitality from their staff. They were excellent.","I would give 5 star if I wasn't a very difficult French person and super demanding on quality, taste, service and cheese.

But service was very nice. Crèpes are delicious and buttery, with very nice Marmelade. Well done. Cheese platter was not perfect but a tease, also there's always one cheese that's just not good. But the tartare was fresh. Overall bravo 4.5 tops. Help this place have more people as it deserves a try.",I think it just opened in April. The staffs will be so happy to see you and make you feel greatly appreciated. The foods are delicious with good range of menu plus the place is very pretty and aesthetically pleasing. Atmosphere was great for long talks!
ChIJFxojyFEi0i0R4ldcKZM_B5c,Gusti Koko Homestay,-8.4471238,115.2562006,"Keliki kawan, Kelusa, Payangan, H734+5F4, Keliki, Kec. Tegallalang, Kabupaten Gianyar, Bali 80572, Indonesia",https://maps.google.com/?cid=10882736925850752994,OPERATIONAL,+62 878-6072-1898,private_guest_room,"private_guest_room, hotel, lodging",4.5,33,,"The views are beautiful. There's lots of fresh air, greenery, and birds. You'll hear birds chirping most of the time. If you visit here, don't miss going for a stroll around the village and get the views of the sunrise in the morning truly mesmerizing.
The people here are friendly and jovial. You can interact with them.

Gusti and his family were very hospitable and kind hearted.
If you're planning to come here, it's best to come in your own motorcycle, it’s scenic ride through the valleys.
thoroughly enjoyed my stay and look forward to coming here again.","They are a lovely family who work hard to make everything keep peaceful, nice and harmonious. If you want to stay at their homestay, it’s a great idea, but first make sure you respect their culture and the efforts they do to make all this looks and feels incredible. Only good energies around. Suksuma koko","Hidden Gem
Beautiful quiet location
Unique experience having to leave alongside Balanease family
Delicious beautifully presented traditional Balanease food served in small restaurant located inside of Homwstay
Spacious, clean, well maintained rooms with big windows
30 min scooter ride from Ubud","I lived in the house of Gusti and his family for a happy 4 months and was absolutely delighted. The house is located 20 minutes from Ubud center, which is why it is so calm and cozy there. Around the house there is a large, well-kept garden with fruitful trees, including avocado and papaya💛.
This is really good peaceful place to practice Yoga, working, relaxation from noisy Ubud. I'm in love with this place)
Thank you Gusti and your family for your hospitality🙏🏻","Amazing place with amazing people.
We stayed 1 week in Gusti's place . His entire family was really nice and helpful with us.

Gusti is a very good guide and he and his friend also helped us organize some trips around Bali.

Definitely recommend the place.
Thanks a lot Gusti for everything 👍👍"
ChIJfd1guIwi0i0RfZLoNNS4b6w,EDI HOUSE,-8.4513228,115.26089449999999,"G7X6+F9C, Jl. Bima, Keliki, Kec. Tegallalang, Kabupaten Gianyar, Bali 80561, Indonesia",https://maps.google.com/?cid=12425353118498722429,OPERATIONAL,+62 857-3705-5067,hotel,"hotel, lodging",5,8,,"Beautiful, quiet, discrete & clean space with wonderful balinese architecture homestays and the hosting family is super nice and friendly! The homestays are on the back area in the family compound with a view on the jungle, divided with a bamboo fence for more privacy.",Cosy villa. With a pretty big butiful garden.,,,
ChIJ63s3qUYj0i0ROK6_jGgyH_0,Abimana Ubud,-8.4465314,115.25814789999998,"H735+97J, Jl. Keliki Kawan, Kelusa, Kec. Payangan, Kabupaten Gianyar, Bali 80571, Indonesia",https://maps.google.com/?cid=18239352440493157944,OPERATIONAL,+62 813-3857-3914,hotel,"hotel, lodging",4.6,26,,Great place in a quiet village. And a very lovely family who is running the accommodation as well as the amazing restaurant right next door.,Awesome place to find some peace within the busy town of Ubud. We loved being surrounded by the family and enjoyed every evening the awesome traditional homemade balinese food in the restaurant next to our little bungalow. They also made the birthday to a very special day and organized some cake and an awesome vegetarian dish. We can highly recommend this place if you want to explore the balinese culture away from busy traffic and an overload of tourists. We will definitely come back. Thank you so much for this amazing experience Abimana Ubud 🙏,"Very quiet, bright and beautiful location with the local village vibe, apartments are clean, spacious, friendly people, will come back again! 🙏🏻","For a restaurant this is 5/5, outstanding food and lovely staff.
Pay attention when you book the rooms, one of them has an outside bathroom so you have to get dressed in the night to go to the loo. It’s a bit further than the 15/20 drives described into the town.
Big problem, which isn’t their fault, loud dogs and a rooster that crows randomly from 11pm all night","I choose this Accomodation because of two main reasons: it is outside and away from ubud center and the warung had good recommendings.

The Warung is more a Restaurant with cheap prices in a beautiful garden. You also can have breakfast in the Warung and the food all in all was amazing: Every chosen course was perfekt!!!!
You also can rent a scooter with fair rates: it s the same rate if you rent it at a Station.
The hole family is very nice and kind! I got a very nice breakfast at the last day, before leaving, without asking. They helped me with petrol, when i forgot to refuel it, and everyone is very helpfull and friendly in general. The room includes Lots of space for clothes, has own space for sitting, an extra terrace, and a small kitchen.
I enjoyed my time a lot and Jafar brought me to my next place, also for a fair rate.
It s a short and nice Ride to Tagalalang and it s also easy to go to ubud Center, by scooter. But you have to know, you need a scooter, or car.
Thx for Service and this perfekt Start in my bali Trip!!!!!"
ChIJodMD8e8j0i0RTnqglRJv8sQ,praba house,-8.451417,115.25692149999999,"banjar keliki kawan, Kelusa, Kec. Payangan, Kabupaten Gianyar, Bali 80572, Indonesia",https://maps.google.com/?cid=14191527501408270926,OPERATIONAL,+62 812-3948-3313,guest_house,"guest_house, lodging",5,9,,"If you want an authentic Bali experience, this is your place:

-the property is in a neighborhood with few tourists. You get a slice of local life. Neighbors are extremely kind and helpful.

-Each booking gets its own bungalow in Balinese style, with a kitchen and a yard. There’s a waterfall just steps away, and at night you can hear the water.

-the host family is simply wonderful - very generous with their time. They’ll invite you to eat with them, help you take part in cultural events, etc. If you’re willing to learn, they’d love to teach you about Balinese culture.

Can’t recommend enough.","Nice nature view by a little river, very lovely balinese family and helphful, local place and good ricefield walks.",superb! had pleasant stay!!,Nice to meet you 🥰🥰,Comfortable
ChIJJQ0xV0Y90i0RtQfHf40UaT8,Villa Amrita,-8.451198,115.26030029999998,"Gang Suda Mala, Jalan Raya Keliki, Tel# (062) 821-4755-6200, Kelusa, Tagalalang, Ubud, Gianyar, Gianyar Regency, Bali 80571, Indonesia",https://maps.google.com/?cid=4569205894910773173,OPERATIONAL,+62 361 8989134,lodging,lodging,4.6,39,,"This place is amazing,  Soka our housekeeper was great. She's attentive, pay attention to your needs, and provide great tips.. Our driver Tora was GREAT. The place is clean and has a great daily breakfast and infinity pool.","Best place we stayed in, in all of Bali. Highlight of our trip. Absolutely amazing. Very accommodating staff and owner. Plenty of privacy. Big rooms and great open roof showers. Gorgeous and tranquil views. Can order massage therapists to come to the villa. Have your own personal maid and security.","Nice Villa with great ambient, good for relaxing and away from city crowd, all staffs are nice, friendly and very helpful, thank you Mr. Jon Mattew for your hospitality, it will be great if this villa can afford up to 10-12 guest since we have Big Family 😀",This is one of the best villas in Ubud. The jungle views and infinity pool are breathtaking. And the staff are super helpful and friendly. I stayed here with my teen niece and nephew and they loved every minute too.  They even exclaimed they felt like the Kardashians. I suppose that is a big compliment 😂,one of the best villas I've ever stayed at and the host was lovely and staff working there were helpful and amazing
ChIJP_DOoPMi0i0R6wCaZmfnQQA,Pudja Guest House,-8.4517588,115.2569152,"Jl. Keliki Kawan, Kelusa, Kec. Payangan, Kabupaten Gianyar, Bali 80561, Indonesia",https://maps.google.com/?cid=18550304775209195,OPERATIONAL,+62 819-1629-5861,guest_house,"guest_house, lodging",4.9,38,,"One favorite stay in Bali was at Bayu’s place, the Pudja Guest House. We thoroughly enjoyed the Balinese home experience and Bayu’s 5-star hosting. We got to learn so much about the Balinese culture, experience it ourselves during our stay and also explore so many places nearby. I feel Bayu’s place is perfectly located, being decently away from the busy Ubud downtown, and still close to a lot of different places that you can explore through day trips—Ubud, Mt Batur, Mother Temple, River Rafting & ATV, waterfalls, rice terraces, etc!

Would absolutely come back here on our next visit to Bali! ♥️",Really the best place to stay while in ubud. A true local and authentically balinese house.,"Bayu and his family were amazing hosts. The best service and detail I have ever received as a guest. The home is beautiful with attention to detail, surrounded by a beautiful garden. I love the design with traditional Balinese architecture and modern touches. Very comfortable sitting areas and bed, amazing shower, and simply everything needed for a comfortable stay. Great recommendations for things to do in the area and beyond. The neighborhood is full of friendly people and nearby tasty restaurants. Included excellent breakfast whenever we requested it. Hope to return some day as it's been the highlight of our trip. You can't go wrong booking this place.","A wonderful guest house! Bayu is an amazing host, he is friendly and very knowledgeable.  His parents are also very nice.  Breakfast every morning was delicious.  The space is really peaceful and well designed.  The neighborhood is really nice, close enough to Ubud and tourist destinations, but in a more relaxed atmosphere.","I stayed in this villa for 2 weeks with my wife and son. The atmosphere and description of this villa is exactly the same as the photos on the internet. This villa has very neat and well-maintained plants, the place is clean, the yard is spacious which my son likes because he can play ball, the place is calming. and at night we were lucky to see fireflies around the villa, where my son who felt strange and at the same time attracted to this animal because he saw it for the first time.
This villa has good internet, me and my wife often conducts call meetings and it's going smoothly. My wife loves to work from the kitchen because she can feel the breeze from the trees and hear the sound of the water rushing from the river that is close to the kitchen.
We walked several times in the morning or afternoon around the villa to get snacks at the stalls around the villa or enjoy the air and atmosphere around the villa. And on the way we met some friendly people.
Bli Bayu is very kind and friendly, Bli Bayu will be ready to help whatever we need. as well as his family who are very welcoming and friendly.
I highly recommend this villa, because anyone who has been to this villa will fall in love with everything this villa has. The place, the atmosphere and the facilities in this villa are very nice and Bli Bayu as the host and also his super friendly family."
