id,name,latitude,longitude,address,url,status,phone,primary-type,types,rating,rating-count,price-level,review 1,review 2,review 3,review 4,review 5
ChIJ92m6_hcd0i0R1f0MvBde1NY,PONDOK MAKAN,-8.335471,115.407743,"MC75+R39, Jalan peselatan waringin, Suter, Kec. Kintamani, Kabupaten Bangli, Bali 80652, Indonesia",https://maps.google.com/?cid=15480101275211464149,OPERATIONAL,,brunch_restaurant,"brunch_restaurant, restaurant, food",4.7,3,,,,,,
ChIJH3jxKXwZ0i0RjhFko1R9QFk,PONDOK MAKAN bu jro intensari,-8.3309943,115.4060025,"desa suter, MC94+JC2, Jl. Raya Besakih, Br peselatan, Kec. Kintamani, Kabupaten Bangli, Bali 80863, Indonesia",https://maps.google.com/?cid=6431278070357037454,OPERATIONAL,+62 856-3953-122,restaurant,"restaurant, food",4.8,4,,,,,,
ChIJ88yMemwd0i0RfZSZT5hqRus,bali 384,-8.3312332,115.40655259999998,"MC94+GJ3, Jl. Batur Tengah, Suter, Kec. Kintamani, Kabupaten Bangli, Bali 80652, Indonesia",https://maps.google.com/?cid=16953355049685849213,OPERATIONAL,,restaurant,"restaurant, food",,,,,,,,
ChIJvTWIFwAd0i0R8dssdDvhPFk,"wayan ardiawan Jual Arit,madik,pisau dll",-8.3310479,115.4115285,"MC96+HJJ Dsn Pemuteran, Pempatan, Kec. Rendang, Kabupaten Karangasem, Bali, Indonesia",https://maps.google.com/?cid=6430262013446642673,OPERATIONAL,,private_guest_room,"private_guest_room, lodging",1,1,,,,,,
ChIJSXdava8d0i0RLt5sKUNvNsg,Yan Cay,-8.333644999999999,115.41078669999999,"Pemutran, MC86+G8V, Pempatan, Kec. Rendang, Kabupaten Karangasem, Bali 80863, Indonesia",https://maps.google.com/?cid=14426840790576455214,OPERATIONAL,,,lodging,,,,,,,,
ChIJKSicjkod0i0R1_DsbLvjHFo,Warung kadek boneng,-8.330358,115.41323639999999,"MC97+V75, Pemuteran, Kec. Rendang, Kabupaten Karangasem, Bali, Indonesia",https://maps.google.com/?cid=6493315156887269591,CLOSED_TEMPORARILY,,indonesian_restaurant,"indonesian_restaurant, restaurant, food",,,,,,,,
ChIJl1HGDQAd0i0RxJU8kPsM2T8,Pondok Mku Subrana,-8.330358,115.41323639999999,"MC97+V75 Br. Pemuteran, Pempatan, Kec. Rendang, Kabupaten Karangasem, Bali, Indonesia",https://maps.google.com/?cid=4600722768931886532,OPERATIONAL,,,lodging,,,,,,,,
