id,name,latitude,longitude,address,url,status,phone,primary-type,types,rating,rating-count,price-level,review 1,review 2,review 3,review 4,review 5
ChIJf06C_Js40i0R3ASH8lYfy14,Kampoeng Villa,-8.6487119,115.15818119999999,"Jl. Tengah Jl. Raya Canggu No.20, Banjar Anyar Kelod, Kec. Kuta Utara, Kabupaten Badung, Bali 80361, Indonesia",https://maps.google.com/?cid=6830587718134072540,OPERATIONAL,+62 852-3813-6111,hotel,"hotel, lodging",4.4,148,,"Horrible experience. Definitely not as described or seen on the pictures. Soap and other essentials were missing. Mold was in the bathroom and it smelled very disgusting. Unfortunately, I already booked in upfront for 30 days. Don’t make this mistake again. You can take a look and after that decide whether you want to extend because no one books here.
We got ill from the mold in the bathroom and every small service is directly charged. That’s why I booked during my stay here other apartments where the service was a 1.000 times better.
They don‘t remind you that your electricity goes empty and in the afternoon your whole house (I would not call this here a villa) has no light or AC anymore.
And if they should give you a chance back they always forget in the hope you forget it either.

WIFI isn’t got enough to work. That’s why I had to go always to a bakery nearby.

Overall, it‘s not worth the money staying here. You get much better and real villas nearby with better service and without getting ill.

Update:
As i can see the reviews here on Google are mostly from locals. So don't trust the high star rating. The reviews are not from actual tourists. I highly doubt that they enjoy staying in a place like this longterm and for that ridiculous price.
Unfortunately, i haven't received from AirBNB no other accommodation which why i have to stay here. But for the latest days i had to book another place because it wasn't possible to stay here any longer. I definitely not liked this place or the price compared to other offers.","It smells so bad in the villa. Overall it has a Bad Vibe …. The bedsheets were dirty and there were ants coming out of the shower.
I prayed every Single day to leave this horrible villa asap! We booked Villa Canggu","I've stayed in Soka Villa and it's all just like what I expected. Nice escape from crowded Seminyak. Their villa was spacious and very good value for money. There's private pool, huge living room, stylish kitchen design and perfect bathroom. Bit slow service but still OK. Definitely will back!","Service is great, they help you in anything you want. Villa is great but room and washroom is not up-to mark,
There was no shampoo, no body wash, no conditioners in shower and shower was not working properly,
As most important thing is cleaning of your hand, there is no hand-wash at all
Till the date i check out, they just come to cleanup and  bed sheet change. Towel they give is not so good.",If your looking for a place to rest your head with all the basics then it's nice.  It's a little run down but has the basics.  Nice touch having your own private pool.  Place could do with a good scrub and be mindful that there are stairs and they are steep leading to the bedrooms.
ChIJSTC5K3Y40i0RVG-nigohqME,Echo Beach Club,-8.648868799999999,115.16193840000001,"Jl. Raya Anyar No.24A, Kerobokan, Kec. Kuta Utara, Kabupaten Badung, Bali 80361, Indonesia",https://maps.google.com/?cid=13954439774567100244,OPERATIONAL,+62 818-1846-9722,seafood_restaurant,"seafood_restaurant, restaurant, food",4.3,3136,PRICE_LEVEL_MODERATE,"New location in Kerobokan from the owner of Echo Beach Club. The same concept of Echo Beach Club; fresh grilled seafood, kebabs, steak, and ribs. They have a salad bar just like the old location. I missed going to Echo Beach Club the last few years. I used to go there often. I like the simple fresh grilled fish with some healthy fresh veggies and a selection of sauces and sambals. I had Snapper tonight for 80k including rice or fries and salad bar. For me it's a good value for healthy and tasty food. The manager of the last 10 years, Kevin is still there. The name of the new place is Char.","It's been 2 times I went there. Great place just in front of the beach. You can see the rocks, the waves and the beach while you enjoying your food here. I only tried the grilled fish and the pork chop, delicious, and the salad bar really make you want to try them all. For the price also affordable. They also have various sauce for salad and the dish.","Nice place by the ocean, fresh seafood, tasty and yummy grilled. Big place, clean, toilet is clean, friendly and very helpful staff. Pricy but it is worth. Big parking space. Wonderful ocean view and sunset. good music and nice ambience. Thank you for serving good food. They do Covid19 prevention protocols, so it must be a safe place to dine in.","I'm loathed to tell everyone how truly special this place is but given the sheer number of people who were there this evening it seems like it's certainly being spoken about in some circles. The crowd seemed to be more surfers or artist types. The DJ played some chilled music good vibes amongst the crowd (and there was a huge crowd there to enjoy the sunset). The staff made fresh, delicious share platters to order. And there was plenty of booze options which we gladly enjoyed. All this and it was over-looking a glorious surf beach with epic views. We were lucky enough to see twilight hues of purple and blue before the clear night sky displayed it's beauty.",Super neat beach. The nightlife is great. The food is great. This is definitely a touristy place so if you don’t like lots of people I wouldn’t recommend you making this your primary vacation spot. But if you don’t mind crowds it’s a super fun spot to soak in Bali.
ChIJg9t9rwpH0i0RB2oDfMXnrSQ,Daeng Burger Umalas,-8.6519892,115.15630739999997,"Jl. Bumbak Dauh No.42, Kerobokan, Kec. Kuta Utara, Kabupaten Badung, Bali 80361, Indonesia",https://maps.google.com/?cid=2643023391711521287,OPERATIONAL,+62 821-4489-0322,hamburger_restaurant,"hamburger_restaurant, american_restaurant, restaurant, food",4.6,538,PRICE_LEVEL_MODERATE,"If I had 5 accounts I will give 5 stars five times. Very welcoming place.foods is served hot with good hospitality. Very friendly owners The taste of burgers and fried chicken is the best in it's area. I have become a frequent customer with my family. My favorite is ratansa burger , double cheese burger chicken parmigiana (sorry if I mis type). And I have to try Oklahoma smashed patty yet🤤All the smoothies and shakes also the best .","This burger spot is an absolute gem! The burgers are incredibly tasty, and the portions are so generous, it's a feast for sure. What's even better? They have a fantastic Friday deal – free French fries ! The ambiance is cozy, and the staff is friendly. If you're into hearty burgers and a good deal, this place is a winner! Can't wait to go back for more.",I came here today with my friends. The place is quite spacious and cozy for gathering with your friends. I orders the original and the rantasa one and lucky that we went here on Friday as they gave free fries every Friday! The burgers are big and tasty! They are very generous with the amount of the meat and still the price is ok for Canggu area!,"Such gooooood burger 😭😭😭 the patty was juicy, the bun was nice, the sauce was superrr yum and it’s not making you too full in a really good way! Oh and also the fries is sooo good! Would totally recommend the mushroom deluxe and nashville chicken!","Burgers, yummy 😋 staff, amazing 👏 differently  go to place free Wi Fi as well"
ChIJmxhRyflH0i0RpV9fWtShnJM,Kunti 3 Sushi Bar,-8.6503816,115.1618346,"Jl. Raya Semer No.100B, Kerobokan, Kec. Kuta Utara, Kabupaten Badung, Bali 80361, Indonesia",https://maps.google.com/?cid=10636554353363607461,OPERATIONAL,+62 816-582-849,japanese_restaurant,"japanese_restaurant, restaurant, food",4.5,607,,"Got recommendation from friend who lives in the area, we enjoyed the sashimi plate, the australian beef teriyaki had tasty sauce but can be softer in our opinion

Great choice of Japanese food","All was great) the food (was fresh), service and ambience))
2 sitting area indoor, AC work very well and out door for smoking area.","A friend of a friend actually came here everyday for dinner during her Bali trip, so I came here with friends to check what’s the fuss about. Love every bite of the roll, the sashimi’s fresh, and the unagi (not pictured) is also tasty! Staff and manager (or is she the owner?) are warm & friendly. We’ll totally come back again🙌🏼","I just love the sushi from here.
It’s so fresh, the service is really fast. I wish it was located closer to Canggu, I’ve would had dinner here everyday.","My love from the first bite! We were there so many times, and always satisfied) Price is really good for this amount of super fresh fish, very attentive staff. Owners, manager and waiters always happy to see you. Many Japanese people visiting this restaurant, if you know what I mean 😉 My personal recommendation is : Tobiko set, salmon mayonnaise, salmon miso soup and salmon stake 🙏🏽 If you still have doubts, just try it you won’t regret 🌸"
ChIJT1tEygw50i0RvyN0wdJkwFE,Warung Sundari,-8.6522094,115.16100949999999,"Jl. Tegal Cupek No.34, Kerobokan, Kec. Kuta Utara, Kabupaten Badung, Bali 80361, Indonesia",https://maps.google.com/?cid=5890819168952132543,OPERATIONAL,+62 877-6030-4474,restaurant,"restaurant, food",4.3,140,,"One of local bali warungs I love. Price is reasonable, place is clean, food is yummy. It has a tremendous variety of food. However they don't serve pork here. It has 3 kinds of rice : brown rice, white rice, & yellow rice from turmeric.

Also, the seats are quite comfortable for you to enjoy ""not so rush"" brunch or lunch ☺️","Worst “nasi kuning” ever, please if you cannot even make a basic rice don’t even open a Warung. Extremely overcooked literally mashed, no taste at all (maybe just a little powder, not real bumbu spices). All the rest I tried was quite basic, and expensive (50.000 for some chicken and vegetables). Warung for Bule with prices for Bule. Not recommended if you like real Indonesian cuisine.","I'm sorry that I have to leave a bad review, but FINDING A DEAD CATERPILLAR IN YOUR FOOD is not a very pleasant experience.
I ordered 2 meals from them, but after that, how can I even ate the rest.
I always thought that this place care about the cleanliness of their food, but after today, I don't think I will go back.
If you happen to buy their food on 28th of March 2024 and you order some green veggies, just know your food was mix with caterpillar gut.","Good place for lunch meeting, simple and many of choices food here. Feels like eat at home menus 😚",Really good options of indonesian food. The food is delicious & the place is clean. The price is ok. Thank You.
ChIJkyViZXg50i0R7npjjGc2uKU,DAPOER ASIA,-8.649365399999999,115.16233380000001,"Jl. Raya Semer No.126, Kerobokan, Kec. Kuta Utara, Kabupaten Badung, Bali 80361, Indonesia",https://maps.google.com/?cid=11941354230337731310,OPERATIONAL,+62 812-8477-7887,indonesian_restaurant,"indonesian_restaurant, restaurant, food",4.4,159,,"A true sign satisfaction over food is when perspiration dripping down my head to the tip of the strands of my hair as I devour every bit of what is on my plate. This restaurant did exactly that. The variety on the menu and the pleasing pictures already made me plan another visit.

Nicely designed place and friendly staff and furry host (Bugie).

Love this place!",Never a poorly executed dish of the three times so far. Simply well-executed Indo greatest hits and some fun asides (fried banana with sambal) with fresh ingredients in a simple dining room with good service. No notes just cravings.,This is the best Indonesia restaurant we visit here in Bali. We already comeback 3 time in the past two weeks. Every dish it’s well prepared and the stuff it’s super friendly and efficient. Thanks btw the ice lemon tea it’s amazing!!!,"Nice place, spacious parking space, smoking area outdoor available, cozy interior with big sofa, comfy dine chairs, also aircon. Clean bathroom, clean wastafel area with big mirors.

Friendly staff and very helpful.

They need to improve for the food. We order gado-gado and tahu gejrot. The taste just not like we expected, a bit plain.
Asia is a land with full of spices. It should be reflected on its food.
I hope they can improve the food in the future, I can wait to revisit this cozy place.","a wonderful place to taste a glimpse of indonesia. This place is quite visible from the street with good parking space and with indoor and outdoor seatings.

the staff is helpful and they will warmly welcome you.

the food delicious, i love their iga bakar and their snacks... this place is very nice to have meet with friends, family or even a date.

looks like i might going to be a regular here.."
ChIJJf6_piQ50i0R43tni2GwaPY,Kembali Bumbak,-8.6517612,115.15630870000001,"Jl. Bumbak Dauh No.41-45, Kerobokan, Kec. Kuta Utara, Kabupaten Badung, Bali 80361, Indonesia",https://maps.google.com/?cid=17755635463905311715,OPERATIONAL,+62 811-3940-8400,restaurant,"restaurant, brunch_restaurant, cafe, store, food",4.6,663,PRICE_LEVEL_MODERATE,"This is the one of the most tastiest cafes! It is the first time when we want to come back again and again. We’ve been here 3 times already and everything was just perfect and very tasty!
Waffles with Parmesan are huge! This is portion for two people - you should try them!
Staff is wonderful:)","After 10 minutes walking around finding Coffee Shop,finally I found this Restaurant providing almond milk as an option.Coffee Beans was excellent with milk just right,seen their menu  with lots of options,sadly I just had big lunch but definitely will comeback for food.
Friendly server
Great atmosphere
Excellent Set Up
great for relax and catch up with mate.",Amazing food and such A lovely place 😍 the smoothie bowls were the best ones I’ve tasted-so fresh and yummy. Also the Parmesan waffles with eggs are a must try. We went there many mornings in a row 😍,"Good place, awesome foods , friendly staff, and the owner sooooo prety","Amazing staff and amazing food!! Me and partner have come from Melbourne Australia, and haven’t had a better breakfast in such a long time!!! Very quick to come out with affordable food and drinks. I’ve posted below a video of our food and drinks for reference. Couldn’t recommend more!!"
ChIJRcxlsp040i0RmS15iOvvJjA,Eko Cafe Bali,-8.6517517,115.157122,"Jl. Bumbak Dauh No.89x, Kerobokan, Kec. Kuta Utara, Kabupaten Badung, Bali 80361, Indonesia",https://maps.google.com/?cid=3469724357821541785,OPERATIONAL,+62 812-3770-9989,cafe,"cafe, coffee_shop, store, food",4.5,319,PRICE_LEVEL_MODERATE,I loved this spot for an evening dinner in my neighbourhood. The food was amazing + cinnamon roll for desert was yum! My favourite drink Ginger Ale Squash was there. So so good. I’ll be back again! It’s a must try for healthy options and yummy food!,"How can you make such a watery and tasteless smoothie bowl? I had to add two bananas myself, which apparently they forgot to put in the base at all, in order to somehow improve it. It's not worth the money! If you had done it well, I would have returned to you every day, but with this approach to work, I will not return anymore.
In the first photo, what was brought to me, in the second I redid everything myself. I would like to initially get a good product, and not liquid tasteless water.","Cozy lively place near a road. Tried pull pork egg benedict and it was better than good. Nice choice of fresh juice. Lots of healthy breakfast/ brunch options in a menu like acai bowl, pancakes, omelette, salads.  Got parking and a chess board :)","Great cafe to go any time of the day - breakfast, lunch or dinner. Definitely reccomend!",A nice smoothy bowl and espresso. The place was not busy when I visited. My waitress was great. Very friendly and courteous. Unfortunately the rest of the staff were disinterested and unfriendly. The one who cashed out my bill was borderline rude when I asked about paying with QR. Perhaps it's time to add cashless payments as everywhere else uses it.
ChIJFZdAbpw40i0R_DU0naQ_OMI,The Khayangan Dreams Villas,-8.651800099999999,115.16036249999998,"Jl. Tegal Cupek II, 85X6+74H, Br. Anyar Kelod, Kuta, Kec. Kuta, Umalas Kuta, Bali 80361, Indonesia",https://maps.google.com/?cid=13995005818298447356,OPERATIONAL,+62 361 9002450,hotel,"hotel, lodging",4.1,119,,As long as you are not a total Karen this place is great. The pool at the 2 bedroom villa was awesome. Only complaint was the noise from the traffic but there is nothing they can do about that.,"Dapet free upgrade ke villa ini and it was one of the nicest villa I've ever been to. I got 2 bedrooms villa but since I only reserved for one room, the other room is locked. The villa itself is pretty spacious and have a big pool. Living room and kitchen is big and clean, and you got utensils for cooking and eating. Bedroom is clean and nice, and have a clean bathroom too. The minus is probably that the pool water is a bit dirty. But overall it was a pretty good villa.","Photos do this place justice. Was very dated and not well maintained. Had an overall dirty feel to it. We had breakfast the following morning which was probably the worst breakfast we’d ever had. Wifi doesn’t work very well, if at all sometimes. Bit out of the way if you don’t have a scooter.
We tried to leave a night early due to the above (with over 24 hours notice) and were told we would still be charged.
A lot of other nicer villas to stay at in Bali.","We were supposed to spend the 5 last days of an amazing trip in Bali. What a disappointment when we arrived in this Villa. The pictures were totally different from the one on the website. The wall of the swimming pool was grey and dirty, a lot of things in the bedroom were either broken (the shower...) or dirty (the net...).
Moreover, the WiFi does not work or when it works it is the slowest ever since the 56k Modem.
The people of the villa were very nice (receptionist etc...) but the office manager was the worst I have ever seen. When we complained about the problems, he was very rude and even asked us to come in the police station with him!!! A real joke and a nonsense in a country so nice and beautiful. For this kind of price, the others villas we did in Bali were so much better!! To avoid","Scam!! scam!! scamm!!!! I repeat Scam! Do not book this place. - Too much road noise
- Lights are not working
- Dark rooms
- Old medieval structure
- Not worth the money.
- Manager / Agent all of them are extremely incompetent & rude!
- We even had to involve the police.

Stay away!!"
