id,name,latitude,longitude,address,url,status,phone,primary-type,types,rating,rating-count,price-level,review 1,review 2,review 3,review 4,review 5
ChIJcTCYOHwj0i0R0aEJL-cZHkc,Jungleight Bali,-8.457563300000002,115.2816318,"G7RJ+XMC, Banjar Dukuh, Kenderan, Tegallalang, Gianyar Regency, Bali 80561, Indonesia",https://maps.google.com/?cid=5124561906711503313,OPERATIONAL,,hotel,"hotel, lodging",5,34,,"Staying at The Cone was an incredible experience. We booked a few nights for our honeymoon, and loved it's proximity to activities/tours in Ubud. Not much is in walking distance, but you could basically stay here all day with the fantastic pool, bath, and restaurant on-site. The staff were very responsive to our queries and the daily breakfast was delicious. The amenities in the property are excellent quality, and adds a touch of luxury, and the air conditioning and projector is perfect for nights in. A big thanks to the staff for their brilliant hospitality and quality service.","My wife and I travelled to Bali to celebrate our honeymoon and Jungleight was our first stop! We stayed in The Nest. Our stay was unforgettable thanks to the amazing room, surroundings, but most importantly, the staff. I’ve never experienced better customer service, ever. Incredibly helpful staff that were a joy to be around during our stay. We’ll be back 🙏","This place is a dream! Nestled in the jungle and so beautiful. And amazingly though it is a forest around there wernt any insects or the like. We loved our stay here . There aren't many eating joints nearby so it is wise to carry ones own drinks and snacks
They have a small kitchen which does provide good food to the rooms","My boyfriend and I had an extraordinary experience, staying one night in the Cave villa and another in the Cone villa. We were absolutely thrilled and grateful for the fantastic service, delicious food, and the perfect location near Ubud and rice terraces. I wholeheartedly recommend a stay, and I would gladly make another reservation. The retractable bed in the Cone Villa and the slide in the Cave Villa make the entire stay truly unique. Truly an unforgettable experience!","Unbelievable !!

What an impressive Villa
This is a villa built from whole bamboos, located in the middle of the forest with a very enchanting view of the Ubud rice fields.
I love the Foods, the ambience, the rain seasons

I wanna tell that the food for lunch and dinner is very delicious, the service is spectacular, friendly and extraordinary.

The atmosphere when it rains was very serene and calming. I didn't go anywhere because it was very comfortable to stay in the villa"
ChIJG99PVCkZ0i0RPvcxjVBNHrw,Sans Indian Cuisine Ubud by Wonderspace,-8.4579678,115.28530520000001,"Banjar Pinjul, Kenderan No. 8, Kenderan, Kec. Tegallalang, Kabupaten Gianyar, Bali 80561, Indonesia",https://maps.google.com/?cid=13555356936793356094,OPERATIONAL,+62 812-3733-9353,restaurant,"restaurant, food",4.7,170,,"Hidden gem in Ubud!! Had a great Thai dinner here. The best time to come was during sunset. It had a really great view, surrounded by rice padi fields. Super calming and relaxing atmosphere here. For the food, no doubt it was great, and super authentic. Must order menu was the the raw oyser. Super fresh, creamy, and served with sour-tangy Thai sauce. Super love it!","I'm not a fan of Thai food, but the food here doesn't disappoint, you have to try ""Thai Fresh Oyster”..","Sans Thai Restaurant is a true gem in the heart of the city. The restaurant offers a range of delicious Thai dishes that are bursting with flavor and made with fresh, high-quality ingredients. The atmosphere is cozy and inviting, with friendly staff who are always happy to help. Whether you're looking for a quick lunch or a romantic dinner for two, Sans Thai Restaurant is the perfect choice. With its mouth-watering food and warm hospitality, it's no wonder why this restaurant is a local favorite.","Entering here feels like being in a Thai restaurant .The food is authentic Thai but there are also western menus such as burgers .
I ordered Tomyam, oysters and beef.
I really like the oysters and Tomyam, they taste very fresh. The spices used are also delicious. Me and my partner really love to try thai food in Ubud.",Calming space in the midst of paddy fields. The staff is attentive and nice. Tried a couple of Thai dishes and they taste good! Basil rice was a favourite of mine. The desserts were not overly sweet and quite interesting to try 😊
ChIJwz9wjvUZ0i0R4kDqzS9KfiU,Uma lawas warung,-8.4579907,115.2837936,"Kenderan, Tegallalang, Gianyar Regency, Bali 80552, Indonesia",https://maps.google.com/?cid=2701678395647475938,OPERATIONAL,+62 819-1630-1044,restaurant,"restaurant, food",4.9,425,,"A perfect little restaurant set amongst the rice fields you can watch the fireflies whilst having dinner. Staff were excellent, food delicious and very well priced. I love that they are also donating some of their profits to local schools. Would highly recommend.","Very nice place with good food and amazing service, nice for working also. Relaxing music, great green scenery, big variety of menu for western or local food and drinks. I loved Gado Gado salad, chicken fingers and ginger lemonade, arak piña colada is amazing 😍","A beautiful view and delicious menu.  Wind blow slowly and all your eyes watching the rice field, harmony with nature. Friendly staff and reasonable price","Perfect place for Indonesian and Western food, it is located nearby the rice field, it’s giving you calm and relaxing experience. Staffs are friendly and place is clean.
Very recommended if you stay around Ubud area 😍😍","Surrounded by rice paddies, the location is sooo relaxing. The food is amazing quality, varied with a choice of western or local, well presented and VERY well priced.
Service is super friendly. A credit to the owners."
ChIJjcCmd08j0i0RtglVr2F-8I8,Dukuh Sari Coffee & Eatery,-8.4586992,115.27867370000001,"Br. Penusuan, Tegallalang, Kec. Tegallalang, Kabupaten Gianyar, Bali 80561, Indonesia",https://maps.google.com/?cid=10371928899852765622,OPERATIONAL,+62 877-6174-1684,coffee_shop,"coffee_shop, cafe, store, restaurant, food",4.7,130,,"Really nice place with a nice view and delicious coffees. My favourite was the vanilla coffee. The host explained the whole process very clearly. We enjoyed our time there and we took really nice pictures.

We would have liked to buy more tea and coffee to bring to our friends but we found them rather expensive.","Amazing place, the variety of tea and coffee alone will sell you on the experience, but what really did it for us was the lovely atmosphere and friendly staff. My girlfriend wasn't feeling too well before we arrived, and while we were being given the tour, she collapsed from heat exhaustion. The staff were so quick to help her and we felt so much safer thanks to them. I know how stressful that situation can be for a worker, but they handled it amazingly well. I'm really grateful for everything they did for us, and the food was top notch too, it revitalised both her and I. Our favourite drinks were the mangosteen tea and the ginseng coffee!","Beautiful view, lovely staff and fantastic products. Come and see a happy and well fed Luwak in person!!","Very nice people, they explained everything about Luwaks, Luwak Coffee and about Indonesian agriculture. The Jungle view is also nice. They also offer to taste different coffees and teas for free.","They explained how the coffee is produced and gave us a tasting, the view is nice. Place is visited by locals as well since the prices are not as high as in tourist shops ❤️"
ChIJCV_I0Swj0i0Ri4YcjRXu090,Chang Kitchen,-8.4586525,115.28216719999999,"G7RJ+GVM, Jl. Alam Ubud, Kenderan, Kec. Tegallalang, Kabupaten Gianyar, Bali 80561, Indonesia",https://maps.google.com/?cid=15984381278797203083,OPERATIONAL,+62 821-4581-9634,thai_restaurant,"thai_restaurant, restaurant, food",4.4,35,,"The surroundings were beautiful, quiet place and great ambience. Unfortunately, it took more than 1 hour to get the food. We lose appetite already, giving the fact the place was not crowded at all (there was only 1 customer beside us). We have no idea what took them so long for the food. The taste of the food was so so, or maybe because we lose appetite already?","the atmosphere is actually very nice, it's just that i had to wait for my food to come for 1 hour++ and i was already starved! the tom yum didn't meet my expectations, it seemed to use coconut cream. definitely wont come back again","The food all was amazing, it takes time for food to come so my suggest is don’t come when you hungry. Worthed to try, one of hidden gem for foodies at Ubud for thai food 🥰","People who say this place is authentic must not been in Thailand. Far below Thai standard even in Indonesia itself.
Upset Thai food. Sudah jahu2 ke sana buat makan gak enak. Regret to come. They should start focusing how to cook Thai. From the food the chef shouldn't come from Thailand.
Already unfollow that Jakarta influencer 🥲🥲🥲","Follow the Tik Tok influencer, Kind of criminal Pad Kra Prao with long bean and Italian basil, taste is bland. Green curry is salty no balance. And I feel a lot of MSG
0% knowledge of Thai food, hope they improve soon

The place is humble and quite far
Price is cheap and nett with no tax. So I'm curious if they pay tax?

Alot of influencers mention this place but came up with tourist trap."
ChIJ28wxA5oj0i0RppyOFBNm7Qk,Kunang-Kunang Restaurant,-8.4597403,115.2828573,"Banjar Pinjul, Kenderan, Kec. Tegallalang, Kabupaten Gianyar, Bali 80561, Indonesia",https://maps.google.com/?cid=715340147957079206,OPERATIONAL,+62 813-3836-5491,korean_restaurant,"korean_restaurant, restaurant, food",4.7,45,,"The best experience in Bali was at this restaurant. The staff is so kind and polite. The food without a doubt is best be it presentation, taste or quantity. We had breakfast here and also some other dishes and were just drowned into our experience of good food. A must try. Going to suggest it to all.","Delicious And authentic balinese food 👌also a very nice Location with a great View. The staff is super friendly, Special greetings to ari ✌🏻","Wonderful place with wonderfull service. Everyone
is smiling all the time, making each other happy,nice place, in the middle of rice
fields, very quiet and suitable for
honeymoon.","As soon as a customer walks into the restaurant, their customer experience begins. Try to greet customers enthusiastically as soon as they enter the building. As you walk them to their table, I was approached by  a  lovely waiter with the name Wahyu you can ask them questions like if they've had a good day or if there's any special reason they're dining out. Many customers appreciate this friendliness as you seat them at their table. Small gestures like these show customers that the staff cares about providing a positive dining experience. Thank you  very much Whayu,  you  have made  our wedding anniversary to your working  place,  something special,  Valerio  and Francesca xxoo","One of the best ricefield view restaurant in Ubud. Great foods, great ambience and Friedly staff..

Good space for short working and get a way from hustle and bustle"
ChIJudob7Acj0i0R65MjQQE47kI,Eka Dwi guesthouse,-8.459569199999999,115.2813545,"G7RJ+5GH, Br dukuh, Kenderan, Kec. Tegallalang, Kabupaten Gianyar, Bali 80561, Indonesia",https://maps.google.com/?cid=4822853828999353323,OPERATIONAL,+62 812-3915-3857,private_guest_room,"private_guest_room, lodging",3.9,9,,"If you don't want to face with situation when  you had booked the room for 2 weeks ,and get the message with cancellation for the 3 days before your visir, better find other place.",Awesome place,,,
ChIJdybL8fQj0i0RT7k7GooG0Js,PONDOK UBUD NIA CAHYA,-8.458387199999999,115.2823608,"br.dukuh desa kendran tegallalang bali80561, Kenderan, Kec. Tegallalang, Kabupaten Gianyar, Bali 80561, Indonesia",https://maps.google.com/?cid=11227481061250021711,OPERATIONAL,+62 878-6113-3412,lodging,lodging,4.7,24,,"This private villa has 2big size rooms and facility such as 1 swiming pool,Ac ,fan  except TV, big size bath room with hot and cold water each has bath-tub. This villa complete with each familly kitchen and refrigerator, the location is quiet nature and surrounded with ricefild, the owner is friendly","Good place, good price",,,
ChIJT9_Om_4j0i0R5IJk-is1nXg,Rice fields,-8.4557077,115.27893979999999,"G7VH+PH8, Jl. Raya Tegallalang, Tegallalang, Kec. Tegallalang, Kabupaten Gianyar, Bali 80561, Indonesia",https://maps.google.com/?cid=8691161318895682276,OPERATIONAL,,hiking_area,"hiking_area, park",5,1,,One of the best rice field for Ubud based.,,,,
ChIJScXFO4Mi0i0Rv0cpuG4i6Cc,Warung Makan Ibu Agung,-8.4528792,115.27975020000001,"Jl. Raya Tegallalang, Tegallalang, Kec. Tegallalang, Kabupaten Gianyar, Bali 80561, Indonesia",https://maps.google.com/?cid=2875586221007521727,OPERATIONAL,+62 813-5331-3138,indonesian_restaurant,"indonesian_restaurant, restaurant, food",4.8,64,,We came here for lunch after being at the rice terraces and the food was delicious. The Nasi ayam complete was tasty and fresh. The portion sizes were good and the staff were very proud of what they served telling us about the preparation of the chicken and how it takes 9 hours to cook. Would definitely recommend if in the area.,The BEST Nasi Campur I have ever tasted! - from a Filipina Tourist in Bali,"Really simple local food, affordably! Staff spoke English and was able to offer me a vegetarian options from the campur offerings of the day!

Really yummy. Could have ordered another one!","This is the best local food I have tried, and I live in Bali. There is a reason they are so busy, full of local people, even if the location is not very central. The owner also speaks English.  The food is cooked with skill and care.  It is not by chance you consistently deliver something better than the competitors .  If you want to understand how good Balinese can be,  it is a must visit.",Best Balinese chicken rice with best price also! Recommended!
ChIJKwtiLW8j0i0RUKFuvSlbeX0,Ayam bakar bali tulen tegallalang,-8.453613299999999,115.27962330000001,"G7WH+GRM, Tegallalang, Gianyar Regency, Bali 80561, Indonesia",https://maps.google.com/?cid=9041357961752912208,OPERATIONAL,,indonesian_restaurant,"indonesian_restaurant, restaurant, food",4.1,28,,Very good ayam bakar. They have chicken breast available as well so I got both a leg and a breast. The sambal was also delicious! Would recommend!,We went there because of rice fields photos posted by a review who made mistake.,The best ayam bakar madu you will have in your life!!,"Incredibly tasty, authentic Indonesian BBQ & fried foods. The Ayam Bakar Madu (BBQ Chicken) is a must for non-vegetarians, otherwise any of the vege BBQ options are as much a necessity.",Very good cheap grilled chicken with sauces! Quite random location.
ChIJg2fdGsIj0i0RsV5bAXn6v1o,Leak geprek tegalalang,-8.455022,115.27907259999999,"Banjar tegal, Kec. Tegallalang, Kabupaten Gianyar, Bali 80552, Indonesia",https://maps.google.com/?cid=6539220581586001585,OPERATIONAL,+62 815-4709-421,restaurant,"restaurant, food",4.6,10,,"We discovered this place on our last days In Tegallalang, must visit if you like Ayam geprek! Delicious and super spicy!",Our favourite place!!!! 🍗Yummy ayam ☺️☺️☺️,"Best spicy chicken, no fish flavour.",Delicious fried chicken - the best! Must try,Top geprek in my life
