id,name,latitude,longitude,address,url,status,phone,primary-type,types,rating,rating-count,price-level,review 1,review 2,review 3,review 4,review 5
ChIJiyOMdTc_0i0R6hdNgc-Ocqg,Harsono Boutique Resort Bali,-8.641755999999999,115.2719257,"Jl. Buntu No.444, Batubulan, Kec. Sukawati, Kabupaten Gianyar, Bali 80582, Indonesia",https://maps.google.com/?cid=12137920967595595754,OPERATIONAL,+62 361 4765444,resort_hotel,"resort_hotel, hotel, lodging",4.8,177,,"We had a great week with the family here! Atmosphere is fantastic and the rooms with private pool are a blast. Food in the restaurant in also very good.
The location is a bit off, but that does not matter as you can easily get a taxi to anywhere!
A big thank you also to Mr Angaa for his fantastic hospitality! Service is so excellent at this place! Can only recommend a stay here!","We really enjoyed our stay at Harsono. The river view and rooms are amazing, we stayed at two and three bedrooms villa and my favorite was the two bedroom villa with the kitchen inside. We got sick during our stays and the staffs were very helpful. Breakfast was great, we liked our chicken porridge. Keep in mind that the location is quite remote so it takes some time to get to many famous locations. Overall we had a wonderful experience at Harsono.","My child, father and I love this place. It’s a wonderful place to have vacations. We live in the room Sanur, this room has a cute swimming pool which have the view of river and the beautiful dining place, we enjoy a good swim here after exhausted tour all day. We have dinners in our room within two nights cause there is a lovely kitchen here, the meal is perfect, environment is quiet with some noice of frogs and birds. We chat, rest and enjoy the meal very much. Last but not least, all of the staff here is warm, and reply to every my requests immediately. Thank you for everything that we really have good time here, see you next time.","Stayed in one of the upstairs villas and it was very clean. I felt very safe. The restaurant on site was delicious, although prices were high by Indonesian standards - you'd be better off going to Sanur or something. They offer a laundry service and charge based on the number of items. Bit pricey but convenient. The hotel is not located near any touristy spots - you'll need to take a taxi. Ubud is an hour away and is super touristy. there are some local waterfalls that you can visit. The staff are excellent and kind.","Harsono Resort is an absolute gem! The vibe there is like stepping into a chill paradise – super laid-back and relaxing. Cleanliness? Spotless.
Coziness? Off the charts.
Impeccable cleanliness and cozy interiors made my stay exceptionally comfortable.
The rooms are huge, and the bathrooms are basically spa-level fancy.

And let's talk about that pool with a killer river and resort view – epic! It's like your own private oasis.
The staff? Legends. So welcoming and always on point.The staff's warm welcome and attentive service added a personal touch to my stay, making it truly memorable.
Seriously, if you're in Bali and looking for a getaway with all the good vibes, Harsono is the spot.
5 stars? More like 5 galaxies!"
ChIJ2XkpGghA0i0RI_bG3blIIfw,Kebon Vintage Cars,-8.646857599999999,115.2709051,"Jl. Tegal Harum No.13, Biaung, Kec. Denpasar Tim., Kota Denpasar, Bali, Indonesia",https://maps.google.com/?cid=18167882334916245027,OPERATIONAL,+62 818-0864-1111,museum,"museum, cafe, restaurant, food",4.7,1058,,Oh wow. I visited KEBON as one of my friend who travelled last year insisted me to visit on way to Airport from Bali. We spent a 1 hour time with family and kids and this place is super awesome. What a humongous effort and time invested for more than 50 years to built this car museum with so many beauties still in running condition. This needs a special taste and effort and kudos the owner who’ve built this in rugged style. Seeing vehicles from model T to old Chevvys and other beautiful ladies was awesome. The team who helped me to see through all cars and special mention to @sangayumirah Mirah who briefed me on all cars and the museum layout. Highly recommended for all car enthusiasts if you’re in Bali 🤗,"Over 200 classy cars from Ford T to a modern roadster, most of them are in good condition. Some are even available to rent!
The restaurant was a disappointment. We took tom yam soup, margarita pizza and local chicken plate (opens the menu) and none of them tasted as they are supposed to.
There is a small playground to entertain children for a bit.","Kebon classic cars is a hidden gem of Bali. There are over 200 cars here. Easily spend a couple hours wandering through.
It’s only about 20 minutes from Sanur and well worth a visit.","Perhaps the most surprising element of my recent visit to Bali is this treasure trove of a place. Pristine and expansive collection of cars from across continents, housed in a carefully laid out facility. Had under an hour before by flight - would strongly recommend spending half a day appreciating the art on display. While there are many gems, my most fav is the collection of Chevy Bel airs. Must visit for anyone who loves classic cars.","Wow this place is amazing , it is so much bigger than I realized.
So much nostalgia here with over 200 cars from around the world along with trucks , army vehicles and tuk tuks.
We had a lovely lady show us around who gave us so much information on the complex and the cars.
There is a merchandise shop and a cafe on site too.
Lovers of cars and car history will lose themselves for hours here"
ChIJ6awRQyFB0i0RW5eou0fXQ0M,Pizarro Restaurant,-8.6466117,115.2749789,"Jl. Prof. Dr. Ida Bagus Mantra No.111, Batubulan, Kec. Sukawati, Kabupaten Gianyar, Bali 80237, Indonesia",https://maps.google.com/?cid=4846954327071823707,OPERATIONAL,+62 821-4732-7733,restaurant,"restaurant, food",4.8,328,,"This is a Balinese grill seafood restaurant, owned by a very polite and friendly boss, Mr. Kadek. Assuring to serve fresh seafood as he is also a fisherman himself, the food is great and suits you who like fish, shrimp, calamari seafood stuffs.
They have indoor and outdoor space, the indoor is not air-conditioned but its very open so not feeling hot, the outdoor space might suit for dinner except if you want to do sunbathing sauna while having lunch.
The location has a little distance from downtown, but not too far if you are at Sanur area. So if you are around, come and visit them.",Had a great dinner here! All dishes taste good and the seafood was so fresh. The owner was very friendly and shared the story of the restaurant with us. Must try if you are around.,"Very good restaurant, fresh seafood with local prices, you can even order seafood in advance, lobster, crab, shrimp, etc.","The food was amazing especially the grilled fish I was recommend by one of the staff.i am a sea food lover and all I can say is I was happy,thanks so much for the amazing food and staff","We are very happy that we came to this place. Warung Pizarro is originally preserved beautiful architecture combined with Balinese handmade furniture. We ate there the best freshly caught Ruby fish, squid and a smoothie bowl. All the dishes looked beautiful and were totally delicious. The service was helpful, nice and passionately talked about this place and food and advised what to choose on that day. We highly recommend! You will eat there the best seafood in your life! ❤️🐟"
ChIJjbzYmM5G0i0ROo9FSPkexQA,ASSA Rent Bali,-8.6469918,115.27457209999999,"Jl. Prof. Dr. Ida Bagus Mantra No.999 A, Batubulan, Kec. Sukawati, Kabupaten Gianyar, Bali 80587, Indonesia",https://maps.google.com/?cid=55484626420207418,OPERATIONAL,+62 361 277999,car_rental,car_rental,4.6,65,,We got an unit needed for the company from here.,Very nice,Good,"😊😊😊😊😊
Everyday...",Good
ChIJiUXrjvQ_0i0R7GsdEI6-cnA,Puri Chandra Asri Blok G 37,-8.642784599999999,115.27160660000001,"Puri Chandra Asri Blok G 37, Batubulan, Sukawati, Gianyar Regency, Bali 80582, Indonesia",https://maps.google.com/?cid=8102748196957940716,OPERATIONAL,,lodging,lodging,4.9,11,,,,,,
ChIJG4R33Xo_0i0R0Xq69Pu5r-w,Kost Moja Biaung,-8.6450771,115.27001320000001,"Gg. Suli B No.br, biaung, Kec. Denpasar Tim., Kota Denpasar, Bali 80237, Indonesia",https://maps.google.com/?cid=17055054805669149393,OPERATIONAL,+62 878-6098-7024,hostel,"hostel, lodging",5,4,,,,,,
ChIJjcd4Uc4_0i0RHvq1q4wY87s,Rumah Kos Bernuansa Villa,-8.6453299,115.27497849999999,"973F+VX9, Batubulan, Sukawati, Gianyar Regency, Bali, Indonesia",https://maps.google.com/?cid=13543195496888531486,OPERATIONAL,,hostel,"hostel, lodging",4.5,2,,,,,,
ChIJA3Yzkfc_0i0RoibXwXXAJe8,Pondok Wisata Intan Indah 2,-8.6444136,115.2708603,"Jl., Soka No. 79B, Sanur, Batubulan, Sukawati, Gianyar Regency, Bali 80237, Indonesia",https://maps.google.com/?cid=17232391161198880418,OPERATIONAL,+62 853-3887-1647,hotel,"hotel, lodging",3.7,18,,,,,,
ChIJP9dZbwI_0i0REDqUDN7Dijw,Kos Perum Chandra Asri,-8.6446212,115.27243279999999,"Jl. Perum Puri Chandra Asri No.96 Blok C, Batubulan, Kec. Sukawati, Kabupaten Gianyar, Bali, Indonesia",https://maps.google.com/?cid=4362514547522943504,OPERATIONAL,+62 813-8474-4441,,lodging,4.8,4,,,,,,
ChIJ9WPdwAdA0i0Rn-Vpo6li2Is,Nasi Lawar Kartika,-8.646962799999999,115.27374220000002,"Jl. Prof. Dr. Ida Bagus Mantra No.909X, Batubulan, Kec. Sukawati, Kabupaten Gianyar, Bali, Indonesia",https://maps.google.com/?cid=10076912646972106143,OPERATIONAL,+62 852-3776-8048,indonesian_restaurant,"breakfast_restaurant, indonesian_restaurant, restaurant, food",4.4,34,,,,,,
ChIJP6IQbQdB0i0RJy1wpA_X8c4,Perum graha dewata biaung,-8.6469808,115.2706004,"Gg. Graha Dewata Biaung No.14-88, Kesiman Kertalangu, Kec. Denpasar Tim., Kota Denpasar, Bali 80237, Indonesia",https://maps.google.com/?cid=14911936303383719207,OPERATIONAL,,hotel,"hotel, lodging",4.3,3,,,,,,
ChIJg6Zc5Q0_0i0RgKOXsR9KGnA,Kost Black One,-8.6443844,115.2692816,"Gg. Suli B No.4B, Kesiman Kertalangu, Kec. Denpasar Tim., Kota Denpasar, Bali 80237, Indonesia",https://maps.google.com/?cid=8077850381626352512,OPERATIONAL,+62 859-6421-4020,,lodging,4.5,6,,,,,,
ChIJh2xoOYo_0i0RlAyf6gTbsQs,Warung Una,-8.642860899999999,115.273698,"Jl. Perum Puri Chandra Asri No.15 Blok H1, Batubulan, Kec. Sukawati, Kabupaten Gianyar, Bali 80582, Indonesia",https://maps.google.com/?cid=842695419457637524,OPERATIONAL,+62 813-5326-0052,restaurant,"restaurant, food",4,8,,,,,,
ChIJBcS9NP8_0i0R5xSNCGavmqQ,EL STUDIO,-8.6442215,115.2778221,"Jl. Prof. Dr. Ida Bagus Mantra, Kesiman Kertalangu, Kec. Denpasar Tim., Kota Denpasar, Bali, Indonesia",https://maps.google.com/?cid=11860985421398611175,OPERATIONAL,+62 812-3332-1800,extended_stay_hotel,"extended_stay_hotel, hotel, lodging",4.2,21,,It is a quite place to stay. Enjoy the good sleep and the environment. Recommended place to stay. Enjoy.,Cool place,,,
ChIJ-70CvgdA0i0Rc3ZVd9J3VpI,Wulandari Restaurant,-8.6466919,115.27483040000001,"973F+8WG, Batubulan, Sukawati, Gianyar Regency, Bali, Indonesia",https://maps.google.com/?cid=10544747323363522163,CLOSED_TEMPORARILY,+62 361 467100,restaurant,"restaurant, food",3.9,31,,"Unlike most restaurants in this area, it's back from the main road so you get a nice peaceful atmosphere and can hear each other talk without the smog and noise of the by pass. This is quite a nice restaurant for being so far from any major city. It's pretty big and never crowded. in fact, you can quite possibly eat alone here. I think they make most of their money from events and catering. they have a nice patio and garden tables to choose from. Two things we especially like from the menu; first, the chicken schnitzel is excellent. Comes with potatoes and garlic vegis. Definitely a good choice, but my favoirte is the chicken batutu. in my opinion, it's the best batutu I've eaten in Bali so far. It's spicy, but not crazy hot. it's a large portion, comes with fries and vegis. Wash it down with a bintang and you're good to go.",They have many choices of Indonesian food and some of western food. They have ayam beauty as our favorite one.,Peaceful...so great,The taste is so so,
ChIJqQHvsm0_0i0Ryb3aXrVtlQI,Rujakin Aja,-8.643405099999999,115.27134500000001,"Jl Tegal Sari, Gg. Seruni Br. Biaung Asri No.1, Kesiman Kertalangu, Kec. Denpasar Tim., Kabupaten Gianyar, Bali 80237, Indonesia",https://maps.google.com/?cid=186175585353645513,OPERATIONAL,+62 819-1350-0304,restaurant,"restaurant, food",5,4,,,,,,
ChIJq-ZWsvA_0i0R-fn9im_ZIlU,Umah Wisanggeni,-8.6412248,115.27122489999999,"Jl. Campuhan No.7, Batubulan, Kec. Sukawati, Kabupaten Gianyar, Bali 80237, Indonesia",https://maps.google.com/?cid=6134704715528534521,OPERATIONAL,,,lodging,4.9,37,,"Good place for you to do a lot of things. Everyone can join in this place. Every Wednesday there is Rebo Ijo, an activity about agriculture, especially urban farming. Every Tuesday and Thursday, there are a study about religion and culture. Once a month, in the end of a month, there are a thematic study, everything. In the future there are some programmes.",Lovely place and environment ❤️,It was beautiful WG,Lovely environment,Love Love n Love
ChIJ6YwHkP8_0i0Rhkm3etqWKto,Sua_Sini Bali,-8.6432115,115.27306589999999,"974F+P68, Jl. Lumba-Lumba, Sukawati, Kec. Gianyar, Kabupaten Gianyar, Bali 80582, Indonesia",https://maps.google.com/?cid=15720543314396006790,OPERATIONAL,+62 878-5016-3869,cafe,"cafe, food",4.5,13,,Lovely little warung with delicious traditional Balinese food selection and good coffee.,"Nice place good to hang out , nice service good food good drink",,,
ChIJ6-fuRBk_0i0RQZZ_wQGGqbE,Rasa locale,-8.644154,115.27228219999999,"block c Jl. Perum Puri Chandra Asri No.91, Batubulan, Kec. Sukawati, Kabupaten Gianyar, Bali, Indonesia",https://maps.google.com/?cid=12801910757876799041,OPERATIONAL,+62 811-3857-121,restaurant,"restaurant, food",5,7,,,,,,
ChIJpYCxKaNB0i0RycvMi8YisIA,Foodie & Bestie,-8.6458262,115.27587939999998,"Jl. Tegal Harum, Batubulan, Kec. Sukawati, Kabupaten Gianyar, Bali 80237, Indonesia",https://maps.google.com/?cid=9272949868900174793,OPERATIONAL,+62 811-3922-112,restaurant,"restaurant, food",5,3,,"The gorengan is all so yummy. They have a lot of variety like tempe goreng, tahu isi, lumpia, pisang goreng and my favorite is bakwan goreng or ote-ote. 👍👍👍 and all with price start from rp. 1000 per piece 😁😁😁👍",One of the best gorengan in town!!!,,,
