id,name,latitude,longitude,address,url,status,phone,primary-type,types,rating,rating-count,price-level,review 1,review 2,review 3,review 4,review 5
ChIJp4C5D8xG0i0RzNqu3FCvZWw,Sun Boutique Hotel,-8.7075342,115.1838625,"Jl. Sunset Road No.23, Kuta, Kec. Kuta, Kabupaten Badung, Bali 80361, Indonesia",https://maps.google.com/?cid=7810841890578684620,OPERATIONAL,+62 811-3779-997,hotel,"hotel, lodging",4.1,1554,,The best one to stay. Room is clean and big. The workers are very friendly. I felt so welcomed. And it has a very nice swimming pool.,"The location quite strategic at Sunset Road. The service was great, the room is tidy and quite nice. I hope they could add 1 more thing as amenity : hair comb. And the water also taste strange, so I bought water from Grand Lucky, But other than that, I’m very satisfied for staying 3 nights at Sun Boutique Hotel and will definitely consider to stay here in the future for my next trip.","The good thing about this hotel is that it's next to supermarket!
The Room smell of damp and the shower has no  door hence water splash to the supposed to be dry area..
Swimming pool looks green! I wouldn't dare to swim.
The worst part is thr loud music from near by restaurant or club that last till 1 am or so.

The service is just okay.","Services and places was so good..
Food are just nice. .
Rooms and pool are enough fair.
Meerting room is was so cool and co.fortable
Very recommended.","Worst experience, I was trying  to check in at 9pm. Really tired and they asked me do you want to see the room? And I did, it looks dirty and we did not have towel, water and soup. I should have to ask for it. We booked for a queen bed and they gave us 2 singles bed. Next day the breakfast is low quality, no options available. And the staff are not trained. -3/10"
ChIJ9yXBEclG0i0RigzUjZw-ZD8,Dewi Sri Food Center,-8.7096738,115.18094349999998,"Jl. Raya Kuta No.59, Kuta, Kec. Kuta, Kabupaten Badung, Bali 80361, Indonesia",https://maps.google.com/?cid=4567844764175830154,OPERATIONAL,,restaurant,"seafood_restaurant, restaurant, food",4.3,4398,,"Well you can't see here much more Balinese food .
Here lot  of chinese food and few restaurants not really street food of Bali","Indonesian interpretation on Chinese classics - different but delicious
Roast pork rice, char kuey teow with egg sauce, egg sauce rice, etc","Good for when you’re in a pinch and don’t know where to eat as there are many options available, but I don’t think I would come here again. Everything is a little dirty and the atmosphere is dead albeit there were groups of people eating here. Idk this place makes me sad.",The pineapple juice was really good but not the mango . It was watered down.  Food is really good at BGC .,Good street food of Bali and other Asian regions here. Really enjoyed sitting alfresco and the music and beers were flowing along with the spicy local cuisines. Seafood super fresh and tasty.
ChIJk1LAkENH0i0R44G-gOKqoxM,ARSHIKA Bali Sunset Road,-8.7054688,115.1836139,"Jl Raya Kuta, Kav 1&3 Kuta - Badung Regency, Pemecutan Klod, Kec. Denpasar Bar., Bali, 80119, Indonesia",https://maps.google.com/?cid=1415162597723767267,OPERATIONAL,+62 361 4757777,hotel,"hotel, resort_hotel, lodging",3.9,420,,"So regretful. I arrived at the hotel around 12.00 pm and was about to check in but was told that the room was not yet ready. Sure, I tried to be understanding since it was a peak holiday season. But until this review was written (3.43 pm), my room was still not ready. Additionally, the public bathroom was so bad. No soap, dirty, and looked like it was barely cleane at all. So disappointing, especially with the range of price offered.

Added the pictures as proof I was really here","I stayed in this hotel for 2 days. From its appearance, this hotel seems to be satisfying. On the contrary,  the facilities are not satisfying at all. The lift was not working at all since we came. Then, in the second night, the AC was also not working. You can imagine staying in a room (which has been designed for AC used), but the AC was not working. It was not comfortable and very disturbing. Then, the reseptionist's response was also so flat. Again, how was staying in a hotel for taking a rest, but you could not sleep over the night? So bad. Therefore, I recommend you to think twice for choosing this hotel.
For the hotel management, kindly improve your services and facilities, please.",We've had problems such as the AC not working properly in the room we've been assigned to. We reported it to the staff (they're super nice btw) and they offers us a room with a cold and functioning AC. The service is nice around here.,"When I stayed there, the hotel was in the maintaining process. Anyway, I had satisfying experiences to stay here. They have good concierges, nice pool, and strategic location (it's near the airport)","Lacking of staffs, but the available staffs were helpful. Facilities’ standard were shocking. Elevators are out of service, which apparently is an ongoing issue since the hotel opened. Rooms were lacking items, such as mini fridge, iron, etc.. We booked a room with pool access, however the pool weren’t accessible, due to maintenance, and we were only informed when we checked in. No compensation offered as well. Quite dissatisfied and disappointed."
ChIJPTfgwM5G0i0RccY7_5XsJg8,Bali Nikmat,-8.7071279,115.1813612,"Jl. Raya Kuta No.40, Kuta, Kec. Kuta, Kabupaten Badung, Bali 80361, Indonesia",https://maps.google.com/?cid=1091820088660313713,OPERATIONAL,+62 811-3988-948,chinese_restaurant,"chinese_restaurant, seafood_restaurant, restaurant, food",4.5,3198,PRICE_LEVEL_EXPENSIVE,"5-Star Review for Bali Nikmat Chinese Restaurant
Amazing Family Dinner at Bali Nikmat!

We had a wonderful family dinner at Bali Nikmat Chinese Restaurant last night and couldn't wait to share our experience! The food was absolutely delicious - everything we ordered was fresh, flavorful, and perfectly cooked. It was clear that high-quality ingredients were used, and the portions were generous.

The atmosphere at Bali Nikmat was also fantastic. The restaurant was clean and inviting, and the staff was incredibly friendly and attentive. They were happy to answer our questions about the menu and made sure we had everything we needed for a great dining experience.

We especially enjoyed the fish and beef , it was bursting with flavor and cooked to perfection. The , noodles were also a highlight, and we all loved trying different dishes from the menu.

Overall, Bali Nikmat Chinese Restaurant was an excellent choice for our family dinner. The delicious food, friendly service, and inviting atmosphere made for a truly enjoyable evening. We highly recommend this restaurant to anyone looking for a great Chinese dining experience in Bali.","Bali Nikmat offers a delightful dining experience with its renowned Chinese cuisine, crafted by a skilled Hong Kong chef. During my visit, I enjoyed fried noodles, a mix platter of appetizers, tofu sapo, and steamed fish in soy sauce (Hong Kong style). The mix platter and steamed fish were the highlights, showcasing exceptional flavors and surprising affordability compared to similar restaurants.

The service was quick and friendly, enhancing the overall experience. The atmosphere was reminiscent of an authentic Hong Kong restaurant, with a clean and neat environment. Bali Nikmat stands out for its delicious dishes, excellent service, and inviting ambiance, making it a must-visit for Chinese food lovers.",The food tastes so good. It was very crowded during dinner time. there’s no waiting-list and people jump the queue! so it was a bit chaos during our visit.,"Good indo-chino seafood. Def has the elements of a Chinese restaurant with a bali twist. Classic dishes are pretty close, and the variety is appreciated. Good serving staff who are responsive in both Chinese and English to a reasonable extent","We ordered a few dishes to try, including the signature salted egg crab, Hong Kong steam fish, and a few other dishes.

Foods 4/5 — The crab was a bit dry unfortunately but the other dishes were pretty good.

I’d recommend the Ikan Tim ala Hongkong, Sapo Tahu, and Cumi Goreng Cabe Garam.

Service was great, staff was attentive to our needs.

Plenty of parking in front of restaurant."
ChIJ6Qi2ltBG0i0Rc975re7YX5g,Sun Royal Hotel Bali,-8.7048062,115.18147780000001,"Jl. Sunset Road No.6S, Kuta, Kec. Kuta, Kabupaten Badung, Bali 80361, Indonesia",https://maps.google.com/?cid=10979732936185208435,OPERATIONAL,+62 361 8465828,hotel,"hotel, lodging",4,626,,"Only the locations are nice.
I checked out the hotel 3 hours after check-in, disgusting I could say.

The receptionist clicks a selfie  and makes us wait during the check-in process.

The room isn't well maintain and not clean, saw many hair everywhere, dirty mug, dirty kettle.

Locked in the bathroom twice, they said it's my fault that I don't understand how to open it, it's clear that the handle is broken. Everything is dirty and the whole vibe of the hotel is wrong.

Some young people sitting in front of the room drink alcohol, they smoke at the reception area, everywhere.

It's like a gangster hotel, please avoid this place, especially when you travel with kids, the window setup is very dangerous.

Awful experience for 350K","Comfortable, the Wi-Fi is abit annoying because it's slow and oftentimes disconnect on itself. The pool is clean and bug enough, the shower automatically adjust to warm water, and the air conditioning is cold.
The hotel is located on sunset road so it's easy to go everywhere else nearby.",Great location.  Nice pool.  Polite staff,We were asking the housekeeping staff for clean pillows for three days and they would give us dirty ones (picture added). When we asked then why they said the owner does not want to buy clean pillows or cleaning product to clean them. A bunch of bs. The hotel is dirty overall and run down. And the staff most of the time they spend listening to music in the reception and chit chatting without actual help. When we asked them to give us a fork they said to bring our own kitchenware cause “they don’t have access to the kitchen” And the cherry on top cockroaches near the pool. Not recommended.,Good hospitality and service at a prime location close to the beach and airport.
ChIJhf6gac9G0i0RlaSZXd1K15s,Red Dragon Ramen,-8.7067914,115.1782283,"Jl. Dewi Sri No.47 Unit G, Legian, Kec. Kuta, Kabupaten Badung, Bali 80361, Indonesia",https://maps.google.com/?cid=11229526510490199189,OPERATIONAL,+62 361 9342872,ramen_restaurant,"ramen_restaurant, japanese_restaurant, restaurant, food",4.6,2200,PRICE_LEVEL_MODERATE,"The best ramen, tasty, creamy, rich of flavor, cozy place, great service, comfortable and super warm atmosphere. Portions are worth the price, definitely come back to try another menu. Love it !! ☆☆☆☆☆","My favorit ramen in Bali so far, if you are ramen lovers you should try !!
My favorit soup are kuro premium and spicy tonkostu ramen, the taste of the broth is light, rich and tasty. If you don't eat pork, don't worry ! They have chicken & vegan ramen option.
One must order is gyoza sambal matah !","First time at this spot and it blew our taste buds away!

Tried Tonkotsu Ramen AKA, Chicken Ramen AKA and the Spicy Karaage Chicken – each dish was a flavor explosion! 🤌🏾

The broth was a perfect balance – not too thick, but bursting with richness.

Can't wait to be back for more!","Been here many times.
I recommend Tam Tam extra Spicy Chicken but change the chicken into grill slice chicken instead of their original ground chicken
(no additional fee will be added for changing the chicken type).
Their chicken gyoza and chicken katsu is worth to try.
Sometimes need to queue due to theres not enough sitting space.",Ramen was super tasty the only downside were the thin spicy noodles they had a strange chewy texture. Sambal dumplings were awesome and fresh tasting.
ChIJiflYIMlG0i0RkBPfzPIbEXw,Serela Kuta,-8.709432999999999,115.18098400000001,"Jalan Raya Kuta No. 42 XX, Kuta, Kec. Kuta, Kabupaten Badung, Bali 80361, Indonesia",https://maps.google.com/?cid=8939957464940352400,OPERATIONAL,+62 895-0843-3540,hotel,"hotel, lodging",3.6,756,,"Avoid using this hotel at all costs. Why?

1. The cleaner stole my jacket and some of my other mate's stuff. You'd think that at the very least they cleaned the place up, right? But no. They didn't. Its EXACTLY the same as before you left it.

2. The room is even worser than my school's warehouse. Like, The light's broken, multiple brown stains on the bed and the tv, sunflower seeds inside the closet (which is also on life support), and they didnt even sweep the floor. Avoid using the towel and soap/shampoo at all costs, cause there is NO way they took the time clean/change it.

3. Dont even bother trying to connect to the wifi, they dont have one.

Conclusion? Sleep in the car.",Hotel located at horrible place there is no crowd around hotel inside also look like horrible n so scary inside the hotel at stairs there is no light everywhere is darken bad food with bad smell charger point also not available in lobby restaurant also close for dinning they r not providing lunch or dinner in breakfast they only give 1 black container in that bad smelly breakfast i dont recommend ths hotel to any 1 even they dont even change bed sheet daily we stayed there for 3 days but they never change bed sheet....😑,"This place has it's glory days before but not nowadays. Used to be a great spot for good accomodation in Kuta area. If you're looking for comfortable stay, STOP! Don't even consider this place. The rooms has plenty of molding inside (see attached photos) not healthy, this hotel don't have phone from room to room and/or to front desk (they give you WhatsApp number for person incharge to handle your usual orders), No Wi-Fi available except only at the lobby area, There are no breakfast available, Hot showers only available when the sun is shining (you can't have hot showers in night time), This hotel only provide 1 towel per room (2nd towel provided when asked), There's no amenities kit, No Shampoo...they only provide 1 bottle of liquid bath soap, The elevator can only carry around 2-3 persons and the level 1 button is broken (see attached photos), The fire/smoke detector inside the room I've stayed is hanging by it's cable (accident hazard). There is no extra key cards for all the guest even when we want to deposit money to get extra key card..there's none. Built in AC controller on the wall in my room showing weird indicator number (it shows 67) it's working but not the best, it's buttons are wonky and loose. Lucky they still has good beds and sheets but the pillows sheets are a little suspiciously dirty, Too little number of staff incharge. I think this hotel was impacted by the pandemic and they're trying to stay alive until now but they sacrifice their services and guest's comfort. I've had bad experience with this hotel. Book and stay here at your own risk. May Serela Kuta has long live ahead. Suksme!","I had nothing less than a great stay here. The rooms are very spacey, the bed is comfy and really huge in size, the bathrooms are extraordinary good (mine even had a bathtub). You'll find everything you need close by (Food court, laundry, supermarket). Location-wise it's located neatly, so that you won't drive too long to your desired destination. The staff is super friendly, help you out with destination advice, if needed, and the reception is manned 24/7.

I'll definitely come back here! ❤️","Good people run this place. Staffs are really nice, except the bellboy (or security, I'm not sure) not helpful at all. Not many facility but with price like this, it's worth it. The location is a bit far to walk anywhere but still manageable. Nearby Bali bakery, we love it. Breakfast is so so, they're not good at making soup dishes, taste like salt water."
ChIJ40a3Ts9G0i0RNhRKPPcGAcw,Spazzio Bali Hotel,-8.7078931,115.17841219999998,"Jl. Dewi Sri No.20, Legian, Kec. Kuta, Kabupaten Badung, Bali 80361, Indonesia",https://maps.google.com/?cid=14700038317652186166,OPERATIONAL,+62 361 755780,hotel,"hotel, lodging",4.1,1074,,"Not bad for a quick nap, I hope we can get free mineral water in the room though",I have stayed here twice. It were satiafying,"1. Location: Strategic location in the area of ​​Dewi Sri, which sells many variations of local food.

2. Cleanliness: Clean enough rooms and some areas of the hotel. But it still needs to be improved again.

3. Room: Rooms are quite spacious with some rooms facing the pool area.

4. Facilities & Service: The staff is also quite helpful if guests need help. They also need more parking to accommodate guest vehicles.",Staff was very good. Hotel was far away from beachside. Room space was good. Swimming was very small but was taste was slightly not satisfactory. Overall experience was 4 star out of 5. I had room in the front of swimming pool at ground floor. Moreover the staff was very educated and well behaved.,"Was a good stay here ... polite and friendly staffs. Actually I stayed here on two different nights on two different rooms. The first night the room I got was perfect and the totally amazing.

The room I got on the second day was not so impressive and the AC was not working as expected. The food here is cheap and I like it very much. Especially the Nasi Goreng is worth the money. I really really loved it. There is a shopping mart opposite to this place and many cheap and good eateries around this hotel. It's really recommended for every backpacker and bachelors planning. And yes ofcourse for the family which is planning on a budget trip.

Pool was clean and well maintained !!!"
ChIJgaFA5bNH0i0Rfa_8KGPlXDU,Warung Babi Guling Bu Ning,-8.707966800000001,115.18153989999999,"Jl. Raya Kuta No.22 Blok 1, Kuta, Kec. Kuta, Kabupaten Badung, Bali 80361, Indonesia",https://maps.google.com/?cid=3845200395919732605,OPERATIONAL,+62 811-1818-329,indonesian_restaurant,"indonesian_restaurant, restaurant, food",4.6,1458,PRICE_LEVEL_MODERATE,"taste so so with not so strong balinese spices, good for someone who doesnt really like strong spices, the seat inside is so smelly, maybe because of pork fat splattering, they really need to do some deep cleaning, but the staff is so friendly, fast serve and decent parking spot (4-5 cars)","The meat is tender and tasty, with spicy taste, its grate combination. The Kuah Balung is the best in Bali, tender and tasty",The service is amazing. They are so nice. Food is delicious.,"Come here to try their nasi babi guling
Spiciness to the max and you get ice cream to curr spicy by giving 5 star google review",we’ve had a good meal! Tried the nasi campur but overall it’s quite spicy so be mindful if you can’t handle spicy food!
ChIJEzADv8tG0i0RZxgAObBz0jo,Sushi Kyuden,-8.7091197,115.18504390000001,"Jl. Sunset Road No.99, Kuta, Kec. Kuta, Kabupaten Badung, Bali 80361, Indonesia",https://maps.google.com/?cid=4238577400016803943,OPERATIONAL,+62 361 8496495,japanese_restaurant,"japanese_restaurant, sushi_restaurant, restaurant, food",4.5,5568,PRICE_LEVEL_MODERATE,"One of the best sushi restaurant in town. Food, service, ambience are just perfect!","Tasty quality food, fast service, great portions. Will definitely come back","The staff was really nice and helpful.
Some of my orders need more time to make.
But based on my experience here, i might think there's some sushi that is not really fresh. I can't tell you which one is the menu that is not fresh cause i ordered some.","The place is great. Spacious parking lot and nice staff. However, the chair at the sushi bar is not ergonomic at all. It is too low for the table. The sushi is nice and quite affordable, but I don't really prefer the karaage and the dessert.","Have visited this place multiple times. On every visit i've always experienced good service.
Most times their food are good and worth their price, but once or twice, minor errors happens, like too much or too little seasonings which i'm still fine with.
During busy hours especially weekends tend to be very full.
During peak hours can be a little noisy too since it's fully packed.
Great place for large groups."
