id,name,latitude,longitude,address,url,status,phone,primary-type,types,rating,rating-count,price-level,review 1,review 2,review 3,review 4,review 5
ChIJq6HQF2dB0i0RG4g6CYqaKd0,Bali Wake Park,-8.7238885,115.21460920000001,"Jl. Raya Pelabuhan Benoa No.7X, Pedungan, Denpasar Selatan, Kota Denpasar, Bali 80222, Indonesia",https://maps.google.com/?cid=15936438674078205979,OPERATIONAL,+62 361 8468866,amusement_park,"amusement_park, tourist_attraction, sports_club, restaurant, food",4.4,1912,,"Honestly this place is underrated for what they have to offer.
Great for kids and family day trips.
Pool bar is amazing and the bar has variety of Indonesian food and western.
Definitely a must visit place while in Bali.","Beautiful and (during the week) quiet water sports area. You can water ski, swim and there is a restaurant.","Great place for wakeboarding in bali. Kids love the over water playground. Spent good time here, though a very hot sunny day","Went to Bali wake park today

Totally great experience this is the first time to Bali wake park and the staff were so helpful

The equipment is so up to date

You can see Maintance is done regularly and the water is super clean

Nailed a few jumps today and find that the 1 hour slow session and the 1 hour fast session is a great balance to try new things and then push yourself

Totally do this",This place is excellent! So much fun! And they have a little practice line just incase youre not ready to take on the main line. Especially good if you plan on doing it all day and pay for the all day package. 👍
ChIJf9ehV5pB0i0RNwxjWAJ05kU,Bali Exotic Marine Park,-8.7238697,115.21643569999999,"Jl. Bali Eksotik No.8, Pedungan, Denpasar Selatan, Kota Denpasar, Bali 80222, Indonesia",https://maps.google.com/?cid=5036840786682121271,OPERATIONAL,+62 853-3883-3678,tourist_attraction,"tourist_attraction, zoo",4.6,530,,"What an amazing experience. The Dolphins are looked after so well. They even rescued some from other dolphin places that we not good. They took the dolphins that couldn't be released and have given them a wonderful home. The experience we had was so magical.  We didn't ride the dolphins.  It was all about them, we got to feed them and touch them. The dolphins didn't have to do anything they didn't want to. The dolphins were every friendly and inquisitive. We absolutely love this","This experience was one to tick off the bucket list when my partner and I travelled to Bali. Interacting, feeding and gently petting the smooth skin of these amazing creatures? Say no more.

There’s no wonder why these marine creatures are one of, or if not, the most intelligent species second to humans. Their ability to interpret signals, gestures,  remember patterns and execute an act perfectly without flaw is phenomenal.

We learnt so much about these amazing creatures through the assistance of the instructors based at Bali Exotic Marine Park.

Overall, the experience was amazing and the price was right (cheaper in contrast to Australia), and hence I do recommend you and your family/partner to give it a crack and have the privilege to be in such close proximity to this beautiful marine animal.","Was great experience I really loved it and great amazing team that were adorable and so helpful in all ways and always smiley. They work with happiness and they reflect it on you . Special thanks and lots of kisses and love to everyone who were in my great experience in Bali exotic marine park
Nanda, Apri, Gus Ari and the trainer Rama with the
Dolphin simba ❤️❤️❤️❤️ so much love 🙏🏻❤️",This was my wedding anniversary present. I always wanted to swim with the dolphins. The doplines were very playful. :),"We had an amazing experience and surely recommend everyone to go and pick the discovery package where you can actually get to interact with dolphine and swim with them. Get to touch them, middle in the water dolphins will come to you and jump around you. Very good co-operative staff."
ChIJywgCrOxB0i0Rh5iu4qXxaeM,Ang Restaurant - Fine Chinese Dining,-8.7238545,115.216439,"Jl. Bali Eksotik No.8, Pedungan, Denpasar Selatan, Kota Denpasar, Bali 80222, Indonesia",https://maps.google.com/?cid=16386894413939251335,OPERATIONAL,+62 851-8633-8800,chinese_restaurant,"chinese_restaurant, restaurant, food",4.7,29,,"It was my first time tried fine dining restaurant in here , when i came here, many menus which i'd wanted to ordered at that time not available. The food was not good taste. Also the service very very late.. i think because the staff not enough.. the temperature air is hot too even the ac is on.","Best place for Chinese fine Dining. The unique atmosphere, interesting food and friendly staff make the dinner experience at Ang Restaurant complete","The interior design and the details of the cutleries amazed me when i first entered the restaurant. The dishes are all tasty and totally giving the fine dining experience of chinese food that you expected.

Recommended to visit, and they also have home rescued dolphins on the first floor (you can check out Bali Marine Park package). If you bring a big family / travel group and looking for a tourist attraction as well as good meal afterwards in Bali, go come by. The staffs are friendly and well mannered although some of them must be new occupied since this restaurant just opened in early 2023 I guess? The only thing can be criticized is, the portion of the food that can make me gain some weights (every portion is plenty) hahaha✌🏼

looking forward to taste other menus in the future","Not as good as the looks on instagram and menus

Foods is so tasteless and taking to long to come out

Place is hot and over priced

It's not  A FINE dining...the foods is worse

Thanks for good and nice photos of menus and instagram 🙏🏻

I didn't took photos of all
The foods cos is so bad","today I had lunch at ang restaurant, they have the theme of Chinese food and the food in this restaurant is very complete, there are seafood, dimsum, they also provide halal food (without pork) in one of the dishes, the restaurant is very cool and very clean, the staff  very friendly smile, this place is near sanur and they also have a good view of the GWK statue from far away.  thank you"
ChIJQYtjl19B0i0RUUcOm1u0HpU,Taman Bukit Suwung Hill Park,-8.7224171,115.21901260000001,"76H9+2JJ, Jl. TPA Suwung, Pedungan, Denpasar Selatan, Kota Denpasar, Bali, Indonesia",https://maps.google.com/?cid=10745224066489010001,OPERATIONAL,,park,park,3.7,11,,"Don't go there is you don't want have experience how the garbage collection works at Bali island. There is just another hill to hike made of garbage.
But is could be used as free zoo because you can take care of rats and flies for free.",Unexpected beautiful place in TPA Suwung!,,,
ChIJCfsyx09B0i0RQd70Ug_PPdQ,Cable Cafe,-8.7241614,115.21498120000001,"Jl. pelabuhan benoa no VII, Pedungan, Denpasar Selatan, Kota Denpasar, Bali, Indonesia",https://maps.google.com/?cid=15293607574343310913,OPERATIONAL,,coffee_shop,"coffee_shop, cafe, store, food",5,1,,,,,,
ChIJnT7Q9NdB0i0RigaBb64bElw,Warung biru bu vio,-8.7187061,115.22029140000001,"76JC+C4Q, Sesetan, Denpasar Selatan, Denpasar City, Bali, Indonesia",https://maps.google.com/?cid=6634395637079148170,OPERATIONAL,,coffee_shop,"coffee_shop, cafe, store, food",5,1,,,,,,
ChIJkycbxWdB0i0RHboqod6i3mg,Warung Putri Babi Guling,-8.7216661,115.21470149999999,"76H7+8VP, Jl. Raya Pelabuhan Benoa, Pedungan, Denpasar Selatan, Kota Denpasar, Bali, Indonesia",https://maps.google.com/?cid=7556656301844642333,OPERATIONAL,,restaurant,"restaurant, food",4,4,,,,,,
ChIJwQ5f12dB0i0Rftn9R1v2Keo,Warung Bu Fitri,-8.7220291,115.21464689999999,"Jl. Raya Pelabuhan Benua No.6, Pedungan, Denpasar Sel., Kota Denpasar, Bali, Pedungan, Denpasar Selatan, Kota Denpasar, Bali 80363, Indonesia",https://maps.google.com/?cid=16873288350830549374,OPERATIONAL,+62 853-3717-2830,indonesian_restaurant,"indonesian_restaurant, restaurant, food",4,8,,,,,,
ChIJlzc4F7xB0i0RyWpC9_OBmu4,Warung Bu Indah,-8.7217079,115.21477229999999,"76H7+8W6, Jl. Raya Pelabuhan Benoa, Pedungan, Denpasar Selatan, Kota Denpasar, Bali 80229, Indonesia",https://maps.google.com/?cid=17193197412265650889,OPERATIONAL,+62 821-3488-3730,indonesian_restaurant,"indonesian_restaurant, restaurant, food",4,2,,,,,,
ChIJX5tcuA9B0i0Rt8H5BAerxFE,Sari Santoso,-8.7187567,115.21990169999998,"jl.by pas ngurah rai gg.merpati no.8 pesanggaran, Pedungan, Denpasar Selatan, Kota Denpasar, Bali, Indonesia",https://maps.google.com/?cid=5892022259144049079,OPERATIONAL,+62 815-5881-1913,,lodging,5,2,,,,,,
ChIJq4-ZqElB0i0RD6t_BHSpykE,Mie ayam & bakso solo emen,-8.7199077,115.21910709999999,"Gg. Pantusari No.8, Pedungan, Denpasar Selatan, Kota Denpasar, Bali 80222, Indonesia",https://maps.google.com/?cid=4740787873517644559,OPERATIONAL,+62 852-3880-0566,indonesian_restaurant,"indonesian_restaurant, restaurant, food",,,,,,,,
ChIJyZr3P29B0i0Rieune_L7d3s,Chandara Villa,-8.7192166,115.21998710000001,"76J9+8X9, Pedungan, Denpasar Selatan, Denpasar City, Bali, Indonesia",https://maps.google.com/?cid=8896856607768963977,OPERATIONAL,+62 817-353-434,hotel,"hotel, lodging",4.8,5,,,,,,
ChIJezBHW11B0i0Rp-gJryyLFS4,Warung Rujak Merpati,-8.7191634,115.2190296,"Gg. Merpati No.4b, Pedungan, Denpasar Selatan, Kota Denpasar, Bali 80222, Indonesia",https://maps.google.com/?cid=3320713324287092903,OPERATIONAL,+62 812-3971-0089,breakfast_restaurant,"breakfast_restaurant, restaurant, food",5,1,,,,,,
ChIJz6MGd2BB0i0RpDJ4O0yRVYo,UMAH DPR,-8.721258599999999,115.22275630000001,"Jl. Pulau Serangan No.57, Sesetan, Denpasar Selatan, Kota Denpasar, Bali 80223, Indonesia",https://maps.google.com/?cid=9968033106855735972,OPERATIONAL,,hiking_area,"hiking_area, park",,,,,,,,
ChIJPbiIxmdB0i0Rf7K1oCOD1UA,Warung Putra Penepi Siring,-8.7217149,115.214681,"76H7+8V7, Pedungan, Denpasar Selatan, Denpasar City, Bali, Indonesia",https://maps.google.com/?cid=4671784377510113919,OPERATIONAL,+62 819-1603-8168,restaurant,"restaurant, food",4.7,3,,,,,,
