id,name,latitude,longitude,address,url,status,phone,primary-type,types,rating,rating-count,price-level,review 1,review 2,review 3,review 4,review 5
ChIJlYzu-2cd0i0R-Vr1U0GevS8,Putu suastana,-8.3644385,115.38176659999999,"J9PJ+6PC, Unnamed Road, Yangapi, Kec. Tembuku, Kabupaten Bangli, Bali 80614, Indonesia",https://maps.google.com/?cid=3440079693799578361,OPERATIONAL,+62 852-3852-9220,restaurant,"restaurant, food",5,4,,,,,,
ChIJRYat074d0i0RJAVZd-IOS_w,Warung babi guling meme jero Lais,-8.3640245,115.3817746,"J9PJ+9PR, Yangapi, Tembuku, Bangli Regency, Bali, Indonesia",https://maps.google.com/?cid=18179640686638859556,OPERATIONAL,,breakfast_restaurant,"breakfast_restaurant, restaurant, food",,,,,,,,
ChIJ3Qsns8sd0i0RcnfTjZzOmOg,warung buk tia,-8.359057,115.38200640000001,"Unnamed Road, J9RJ+9RC, Yangapi, Kec. Tembuku, Kabupaten Bangli, Bali 80614, Indonesia",https://maps.google.com/?cid=16760373185048967026,OPERATIONAL,+62 812-3608-6826,restaurant,"restaurant, food",4.5,2,,,,,,
ChIJdSLPHD4d0i0RLAJpZsxHT9c,Warung jro tugu rasning,-8.3644078,115.3817407,"Unnamed Road, J9PJ+6MQ, Yangapi, Kec. Tembuku, Kabupaten Bangli, Bali 80614, Indonesia",https://maps.google.com/?cid=15514698184531706412,CLOSED_TEMPORARILY,,coffee_shop,"coffee_shop, cafe, food, store",,,,,,,,
ChIJJamJgfUd0i0Rr2lil3V9R90,Sidearta club,-8.360493,115.3850245,"J9QP+W29, Yangapi, Tembuku, Bangli Regency, Bali 80614, Indonesia",https://maps.google.com/?cid=15944850949732985263,OPERATIONAL,,night_club,night_club,5,2,,Good👍i’m Happy,,,,
ChIJOZLsRAAd0i0RatRXGoR1U6g,Wr. Men seti,-8.3664876,115.38168189999999,"J9MJ+RM3, Yangapi, Tembuku, Bangli Regency, Bali 80614, Indonesia",https://maps.google.com/?cid=12129167431676974186,OPERATIONAL,,indonesian_restaurant,"indonesian_restaurant, restaurant, food",4,1,,,,,,
ChIJhwr8nuMd0i0RXe-V_2wuYZU,heri padila hotel and spa,-8.3600053,115.38511910000001,"J9QP+X2X, Yangapi, Tembuku, Bangli Regency, Bali 80614, Indonesia",https://maps.google.com/?cid=10763935630071557981,OPERATIONAL,,hotel,"hotel, lodging",5,2,,,,,,
