id,name,latitude,longitude,address,url,status,phone,primary-type,types,rating,rating-count,price-level,review 1,review 2,review 3,review 4,review 5
ChIJeZAbpcsj0i0RCqEEprxwsUA,The Sun of Granary Resort and Villas,-8.459629,115.28303519999999,"Banjar Pinjul, Kenderan, Kec. Tegallalang, Kabupaten Gianyar, Bali 80561, Indonesia",https://maps.google.com/?cid=4661631044846657802,OPERATIONAL,+62 361 9089028,resort_hotel,"resort_hotel, hotel, lodging",4.7,403,,"Absolutely stunning hotel, beautiful location surrounded by rice fields and loads of green open space. The staff were incredible and super friendly and welcoming. Pool area is lovely and they supply fresh towels for you.
Breakfast and dinner was delicious and great choices.

The only downside was the room was extremely damp constantly, mould in bathroom, even with the air con on, the bedding didn’t feel fresh and was damp, wasn’t nice to lie in. After 2/3days I developed a really bad cough from the dampness which turned into a bad infection then pneumonia. Which has ruined my holiday. As I can’t snorkel, scuba dive or do any strenuous activity (yoga, gym). Which I had all booked and payed to do. (Non refundable) And my medical bills are quite a lot.
I had to check out my stay early as I couldn’t stay there any longer as it made me so sick and was getting worse.

Such a shame as it is a very beautiful hotel and the staff are amazing. If you can handle the dampness and moisture then you will be fine. But just needed to let others know. I know the humidity can’t be helped with the location, but better measures could be taken in the rooms to dry them out and keep condensation and damp from getting too bad maybe? Apart from that I loved my stay and the pool access from my room was great. Thank you to all the staff 🙏🏼","The resort is one of the most beautiful ones I have ever visited. The garden with the pool, the pond and small hut is like in paradise. The rooms are really nice and the restaurant serves really good food. Not to forget to mention is the Spa: the massages are just amazingly relaxing! Besides that the very best of the resort is the team! Everyone is so welcoming and charming! Special thanks to Ira for being a super good tour guide.
One thing is for sure: We will come back :)","A really really lovely location with rice terrace all around and far off views of the volcanoes, the restaurant is really yummy and huge variety of foods and it’s open quite late which was awesome plus the room service is perfect! The spa was lovely, the room is spacious and clean and feels pretty new, the bed was *so* comfy - I loved that there was a big desk. I easily stayed here for whole days while I focused on creative work. The pool is so nice and you can have your breakfast there which is really relaxing ☺️
The staff are very sweet and did their best to make my stay enjoyable!
The location is pretty far out of anything walkable so you need to use gojek or grab or have your own scooter/driver.","We absolutely loved this place! We stayed here for two weeks last year and actually miss it! It’s a beautiful resort with everything you need to relax. We had a great, comfortable room with amazing views. It had a balcony, workspace and luxurious bed. The staff are extremely friendly and accommodating. Breakfast was great. Often local entertainment in the restaurant at night. There’s a pool and a small gym that we both liked. It’s nice to stroll around the garden. The resort is pitched between the rice fields with some small restaurants nearby, but you need transportation to get to Ubud (there’s a free hotel shuttle 3x a day). We had an amazing stay and cannot wait to go back!","Amazing location, very friendly staff. Our stay in April 2024 for 4 nights was awesome! there is a shuttle bus from the resort to Ubud town 4 times a day which is a bonus. Breakfast is very good, dinner is okay."
ChIJXYJAdXYY0i0RY5Qt-DFvSkk,Dedary Resort Ubud by iNi Vie Hospitality - Romance In Nature,-8.4580507,115.2853009,"Banjar Pinjul No.8, Kenderan, Kec. Tegallalang, Kabupaten Gianyar, Bali 80571, Indonesia",https://maps.google.com/?cid=5281155773453145187,OPERATIONAL,+62 812-1025-8889,,"hotel, lodging",4.8,701,,The experience was pretty good and the service is also highly appreciated however it would have been better if the rooms were kept quite hygienic since we encountered many insects. The breakfast served was truly awesome! We indeed had a great time at this hotel!,"I stayed in a private pool villa that had a bathtub in the room, and I really enjoyed the spacious property and amazing vibe. My husband and I had a wonderful time during our stay. However, the only downside to this resort is its distance from the main market and poor connectivity. The street lights leading to the hotel also do not work properly, resulting in darker roads at night.","If you’re wanting somewhere very quiet and to get away from everything this place is perfect. We stayed 2 nights here and would definitely return but still keep it a short stay due to there being nothing around the area, so you are limited to staying in the villa (but this wasn’t an issue due to size of the rooms and there being restaurant on sight) The rooms are amazing, we booked the forest view room which was on 2 floors and very spacious. Staff are there for your every need and will try their best to give you the best stay. Food is very nice at the restaurant and the floating breakfast you can order is worth it.","Positive: fantastic room, absolutely loved everything about the room(except for random insects ;))
Negatives: I have travelled fair bit and never seen morning breakfast without cappuccino, I had to pay extra for it as it’s not part of their breakfast menu.
No vegan options for dinner.
You can’t have Indian food at restaurant but they can deliver to your room, doesn’t make sense to me. But if you choose a set menu option for dinner on Wednesday, you can have at the restaurant.
Bit disappointed with the food options to our fantastic stay.","Overall, the resort offers outstanding rooms with impressive amenities. However, the limited vegetarian food options, especially having only one breakfast item, may be a drawback for guests seeking diverse culinary experiences. It would enhance guest satisfaction if the resort expands its vegetarian menu to cater to a broader range of preferences. We asked for floating breakfast which was a good experience."
ChIJz8TEIQwj0i0RN-8MMwBEYi0,Ubud Jungle Swing,-8.4528048,115.28006359999999,"Jl. Raya Tegallalang, Tegallalang, Kecamatan Ubud, Kabupaten Gianyar, Bali 80561, Indonesia",https://maps.google.com/?cid=3270251047071575863,OPERATIONAL,+62 877-7666-6162,amusement_center,"amusement_center, amusement_park",4.7,152,,I recommend this place for couples wishing to have nice photos together . The ticket for the whole package costs 350 k per person and you can buy it before entrance. Staffs are professional photographers. All you need is just to give them your phone and they will get you nice pictures 😉😉,I made it just before they were closing and they still let me take pictures. They take really good ones and guide and suggest different poses etc. They have dress rental options too but cutting it so close to closing time I just rushed to get pictures and didn’t hire dress.,"There was no waiting when i visited the place.
Single swing costs 200000IDR and all swings costs 350000IDR. Costume charges and photography are extra.
But the trick is you can give your phone camera to the photographer to click pictures and he clicks decently..
Safety belt was provided and swings were decent enough for the experience.",Beautiful place the prices are not v high for the services and u can bargain some. The staff was extremely polite and helpful theu took all the pictures in a professional way. Do try their coffee amd taste different tea in the end. A good experience overall. Definitely recommended.,"It's a nice place for taking pictures but that's it.

You feel like you are pushed from photo spot to photo spot, take some quick pictures and move on to the next swing. It's okay and you will get some cool pictures but you can not enjoy the place or the swinging.

You have to pay 350000 IDR entry fee (around 25$/Person) to use all the photospots. It's also possible to rent different dresses but you need to pay extra if you want to use their dresses..

The view of this place is quite nice and the stuff is also friendly. But if you want to enjoy nature, have a nice experience and just explore with some nice swings, you are wrong.

It's not a crowdy place like a lot of the other Bali swings. When we were there, we were the only customer and that was very cool.

You have to sign a paper in case something happens to you but they safe you with a rope on every swing and photospot. I think it's very safe.

You start with some pictures in a round nest, then go on to a big swing (like you imagine the jungle swings) and you can take pictures all the time. You can also give your phone to them so they take pictures for you. It's also possible to let them take pictures with their Nikon camera and you can buy the photos at the end.

We used our own Sony camera and give the phone to the nice stuff. When we wanted them to take pictures with our camera of us together they just said no and told us, they will just do it with phone. I think, that's a bit sad because they just want to make the money with high quality pictures but ok.

It's also a bit like they rush from one swing to the next and want you to take the shots as soon as possible. I understand, that you can not take a lot of time if it's crowdy and other people waiting for the swing but we were the only people there and it was sad, we couldn't take our time.

One good thing is, that they tell you some photoposes and they really take nice phone videos. They know what they do to create the Instagram memories 😅 but that's all it is. A place for Instagram Pictures..

It was okay because we just went there to take some cool shots but you cannot expect more from this place.

But i think the Ubud Jungle Swing is a much better choice if you do not want to be there with 100 of other tourists. And it's also a bit cheaper."
ChIJu0LmUqUj0i0ReatdjVGEQ9o,Sanna Ubud A Pramana Experience,-8.4564641,115.28045440000001,"Jl. Raya Tegallalang, Br. Tengah, Kec. Tegallalang, Kabupaten Gianyar, Bali 80561, Indonesia",https://maps.google.com/?cid=15727559809506847609,OPERATIONAL,+62 361 6206688,hotel,"hotel, resort_hotel, lodging",4.9,102,,"Recently, my wife and I had the most incredible stay at Sanna Ubud Hotel in Bali. From the moment we arrived, we were swept off our feet by the breathtaking views.

The rooms at Sanna Ubud Hotel were nothing short of stunning. The architecture perfectly fused modern comfort with traditional Balinese aesthetics, creating a serene and luxurious ambiance that made it difficult to leave our cozy nest. The views from the room were providing us with a daily dose of paradise right outside our window. 🏞️

For my wife's birthday, the staff at Sanna Ubud Hotel helped me  surprised her with a magical floating breakfast experience and a bathtub filled to the brim with vibrant flowers. 🌸 This added a touch of romance and whimsy to our stay.

The service at the hotel was exceptional. The workers were genuinely kind and welcoming. Their warm hospitality made us feel right at home, and their efforts to ensure our stay was nothing short of perfect did not go unnoticed. 💖

Moreover, the food at Sanna Ubud Hotel was a delightful culinary journey. Each meal was expertly prepared and served with a smile. 🍽️

In conclusion, our experience at Sanna Ubud Hotel was nothing short of magical. We left with memories that will surely last a lifetime. If you're looking for a place where luxury, beauty, and exceptional service converge, Sanna Ubud Hotel is the perfect choice. We can't wait to return to this little slice of paradise! 🌺🌟🌴

Warm regards,","Absolutely incredible! Firstly the staff at Sanna are very welcoming and friendly. They'll always say hello and ask how your day is going and whether you need anything.

The hotel itself is unbelievable. Everything is themed so nicely and we'll set out. The on-site restaurant is amazing and the pool is amazing.

This was my first time in Bali and I can guarantee anytime I come back on the future, I'll be staying at Sanna.","Hands down THE BEST HOTEL IN ASIA. This place is an unforgettable life experience. From the moment you check in you will be transported to another world. I have stayed in 6 star hotels around the world that don't even come close to this place.

The staff are absolutely faultless, extremely welcoming, happy and go out of their way to make you feel special and will make your stay here truly a memorable one.

The rooms are breathtaking, clean and well appointed with nestled in perfectly manicured gardens and a lush tropical rainforest.

The food is another massive highlight. The Vanara restaurant serves up better cuisine than Michelin star restaurants. Every dish I had on my 5 night stay blew my mind in freshness, flavour and execution.

Do yourself a favour and stay here, it's well worth the travel.","If I could give a star classification to this hotel I would give it 10 stars! What a breathtaking location. The spa down the hill made us feel like we were in heaven. I have no words to describe how amazing this hotel is. The staff made us feel very welcome. The view from the room, the restaurant is mesmerizing. Sanna is one of the best hotels we have ever visited. We will definitely come back. Thank you for having us!","Beautiful hotel with some of the best service. All staff are always smiling and very helpful. Rooms and yards are exclusive and gives a feeling of tranquility and peace.

Have all the facilities you need and they are fully staffed even outside the high season.

Can highly recommend the hotel."
ChIJh1rg__8j0i0RYaIMJG4n3yU,Alam Ubud Culture Villas & Residences,-8.456913799999999,115.2819278,"Desa Kendran, Tegallalang Ubud, Kenderan, Tegallalang, Gianyar Regency, Bali 82191, Indonesia",https://maps.google.com/?cid=2728943253214503521,OPERATIONAL,+62 815-1370-3601,hotel,"hotel, lodging",4.3,98,,"If you are after a peaceful holiday, in a beautiful quiet location, in a property with clean large villas, located next to rice paddy's & on the edge of a tropical rainforest with beautiful gardens & beyond excellent friendly service, then this is the property for you! It's not 5 star however, the overall ambiance is! I can not fault Alam Ubud except if you have any physical mobility issues due to the steps. We have returned many times & loved every stay! Thank you Alam Ubud for always making us feel welcome & allowing us to always return home refreshed & relaxed.","Hidden location in Ubud.
The whole villa is really nice, pool is amazing, they also have natural pool bit you need to walk down stairs and it's also have a private river.

Food was not my taste.

PS : bring your snacks, drinks or any kind of food that you like. Cause it's kinda far from crowd center of Ubud","Think again before booking !!

We were travelling with a 2 year old kid and stayed at Bima 5 room for 2 nights .

Worst was on last night at this hotel , we found an animal on the roof of room at around midnight.

We called reception and person said he’s coming. But he didn’t show up.

I went to find person but couldn’t find anyone in the reception , restaurant or the security gate .I called contact available online but they didn’t also respond .

2 person came after 45 minutes . There excuse of coming late was they were doing check-in for other customer .

After they reached , they found gap in the roof . We were shifted to other room but the night turned to horror night .

They have no provision in case of emergency.Nor do they have sufficient staff . They had only 2 people running complete hotel after 10 pm .

If you are travelling with kid then don’t book. They don’t offer free baby food , nor is the hotel baby friendly. There is no safety for the small kids , no kids play area and the swimming pool is 5.5 feet deep.

They have 2 swimming pools but the one near waterfall was not clean.

The food is average with limited choices for vegetarians. Breakfast buffet is 1/5. You have to order breakfast a day in advance .

My wife specifically asked for omelette without cheese but got with cheese .

The cleanliness of room was okay but the rooms are outdated . It’s having 1990’s vibe.","We came to stay in January 18th to 21st. The weather was amazing, staff were truly excellent and couldn’t do any more for you if they tried. Rooms were really specious, clean and stocked with everything you may need during your stay including toothbrush, hairdryer, shower gels, tea/coffe and daily restocked bottles of water.

Couldn’t recommend this place enough, really worth the visit if you’re planning on staying in Ubud!","WOW! Our favourite stay in the whole of Bali 😍 You really have to see this place in the flesh to appreciate its beauty - the photos really don’t do it justice! It is probably the most unique hotel my partner and I have ever stayed at. The hotel is situated in the heart of a tropical jungle, full of plants, flowers and wildlife. Our gorgeous, villa style room was spacious, clean and authentic. The infinity pool is just gorgeous and long enough to swim properly in! The surrounding restaurant toilets and showers are incredibly well kept and to top it off, the staff were absolutely lovely from the moment we arrived to when we left. We loved it so much, we have changed our plan and are staying longer! The hotel is surrounded by stunning rice fields and is only a short moped drive away from amazing bars and restaurants. My only negative comment is that the only alcoholic drink the hotel sells is beer (but that is very subjective!) and the breakfast was average but included in the price so we skipped it the second day.. Other than that, I would highly recommend, great value for money and an unforgettable experience - thank you! 🥰"
ChIJ-5TjzYkj0i0RNeE_qNf9IRE,Intan sari luwak coffee and terace swing,-8.4556512,115.2790671,"Jl. Raya Tegallalang, Tegallalang, Kec. Tegallalang, Kabupaten Gianyar, Bali 80561, Indonesia",https://maps.google.com/?cid=1234546875558781237,OPERATIONAL,,coffee_shop,"coffee_shop, cafe, store, food",4.1,53,,"Great place! We had such a great time and all the people were super friendly and helpful. We got a free coffee tasting and the woman expained us very detailed how it works to grow coffee and produce the coffee powder! She was super lovely and had a smile on her face all the time. She took a lot of time and let us try everything. We really enjoyed our stay! We absolutely recommend this place! It’s so much better than all the insta famous places! It’s much more relaxed and calm and not crowded, we absolute loved it! We will come back! They also have some photo spots with a swing and heard and everything like all the other locations, but you don’t have to wait to take a picture like in all the other super crowded places.","Staff is super friendly, a host meet us at the entrance and stay with us to explain the whole process of making excellent Luwak coffee, free entrance and free tasting, amazing view, you can take photos anywhere with no extra charge, you will pay only for what you order.",Coffee place should try but luwak coffee (No 16) not too special. The test samples of tea and coffee help a lot to make decision what should we drink. Bali coffee should be a easy for almost guest 🤩,An interesting place to visit where friendly native guide explains how Luwak coffee is made using a by product of the civet cat. An opportunity to sample different kinds of coffee & tea and understand their health benefits.,Nice place 2b taste and learn about Luwak & Coffee & tea. Nice view over sawah.
ChIJUxxsfGg90i0RMGD_J6U7454,Dukuh Village Villas & Art,-8.4604997,115.28109739999998,"Banjar Dukuh, Kenderan, Kec. Tegallalang, Kabupaten Gianyar, Bali 80561, Indonesia",https://maps.google.com/?cid=11449060258232623152,OPERATIONAL,+62 812-3658-355,hotel,"hotel, private_guest_room, swimming_pool, lodging, sports_complex",4.6,149,,"The stay at Dukuh Village Villas & Art was perfect. Very friendly family, assist in everything you need. Beautiful quiet location, best view over rice fields, good value for money. Really recommend staying here if you want an authentic experience.","Honest review without based on our experience 😁

STAFF- 10/10 - very accommodating, all request are attended without delay. Easy to contact as they are also staying on the same part of the hotel.

VIEW/ ROOMS- 10/10 - very calm, quite, relaxing and have nice view. Rooms are amazing, clean and complete in all means.

FOOD- 7/10 -we just try the breakfast, they have limited options but trying to provide as you requested if possible. Plates, utensil, mugs are included on the room or as per your request.

PRICE- 10/10 on your experience, every penny is worth it.

LOCATION- 8/10- it is inside the area, might be 15 mins from the main road. Driver can easy track the location of the hotel from GPS.

Over all, WELL RECOMMENDED 💯👍🏻 and surely will come back if we have chance. ⭐️⭐️⭐️

Thank you Nanay and family for the great stay, you all are very kind💋 appreciate your hospitality to us.","absolutely loved our stay here. after a long day of riding it was so nice to just jump in their pool watching the sunset surrounded by ricefields.

the hosts and everyone in the property are really friendly and so polite. we saw some fireflies at night and it was so peaceful.

we got the room right next to the pool. our room is clean including the bed sheet and towels. AC, hot water, tv all works perfectly. room is really spacious too. they also have smart tv so that was a nice surprise.

my favorite thing from this homestay is definitely the surrounding. we woke up to walk around when the sun rises and then we went to the nearby waterfall before going back to the homestay to soak in the pool and have breakfast.

i think they offer day trips packages and classes and also motorbike rentals","Dukuh village villas is a family guesthouse in the middle of the rice fields. Our room was super clean and I loved the details - a traditional Balinese painting, beautiful curtains and batik robes. There is a chilling area with a pool overlooking the paddies, where you can swim, enjoy the fresh air and have some food and drinks. Breakfast was very nice, and the staff absolutely amazing! The place is quiet and perfect for a relaxed holiday with your beloved ones. For sure we are coming back :)","Such a beautiful and quiet property, with the most kind and welcoming hosts! Different breakfast every day was lovely each time. So peaceful at night, we saw many fireflies! Highly recommend checking out the art gallery and inquiring about a half or full day tour. We will definitely be back next time we visit Bali!"
ChIJz4MRdL0Y0i0RMF75-gvYgaE,Ubud Sawah scenery villa and Homestay,-8.4586192,115.2821079,"Jl. Banjar Dukuh, Kenderan, Kec. Tegallalang, Kabupaten Gianyar, Bali 80571, Indonesia",https://maps.google.com/?cid=11637820458068958768,OPERATIONAL,+62 821-4581-9634,private_guest_room,"private_guest_room, lodging",4.2,196,,"I do not recommend this host. I wanted to go and see it before booking a deluxe room. I thought maybe I could rent it for a long time. Normally he would not offer such a condition. So I made a 15-day reservation from agoda and paid for it. He also approved it. When I came the next day with my belongings, he said I could only rent it for 1 month. He said that this room is not valid for the short term. He suggested the bungalow house. I didn't like it either because it wasn't the same situation. Moreover, he increased the price the next day. So he left me in a difficult situation because of his own mistake. To help him, I told him I can keep it for 15 more days if you keep the price the same. So 30 days. But he didn't accept it. However, coincidentally, a couple in the next room checked out that day. I asked them and they said they were only staying for 2 days. I wonder why you didn't tell them you're renting long term? So I cancelled. I didn't want to stay there even for a minute. Honesty must come first. There should be no greed for money.",Amazing to stay in the rice fields! The rooms are clean and very big. The bathroom is amazing with beautiful colourful tiles. There are no insects despite being in nature. The family owners are so so kind and welcoming. The breakfast was also delicious. We wish we could stay there more!,"Was very nice staying at this place. Good cleaning, ac working good and very beautiful outside bathroom. Completely relax and far from the noises from the centre Ubud but still somehow fast to go with Motobike. The owners were very nice and lovely and helped us with all! We thank them very much!
The Thai restaurant have delicious food!!!

Ps.: the only things what we could say is: look for the shower and the water pressure, comes very less and the Wi-Fi signal was not really good, but probably because the property is veeeery big!","If you are looking for quiet place with beatiful scenery this is the place you are looking for.

Place is sorrounded with rice fields with nearby waterfall and very good local food in reasonable price.

Hosts are very kind and also I would recommend Yoga as a tour guide that is very comunicative and knowing all the nice places around ubud 😉","It's situated in a beautiful location among the rice paddies. The room itself is nice, we stayed at the bottom. The shower is a bit in need of some attention, the water came out all over. Otherwise it was fine. Staff though are super friendly and helpful. 🙏"
