id,name,latitude,longitude,address,url,status,phone,primary-type,types,rating,rating-count,price-level,review 1,review 2,review 3,review 4,review 5
ChIJ4Qw-8N0j0i0Ro2XABcrWxz0,Royal JJ Ubud Resort & Spa,-8.471211,115.2744669,"Jl. Raya Petulu, Petulu, Kecamatan Ubud, Kabupaten Gianyar, Bali 80561, Indonesia",https://maps.google.com/?cid=4451762919847257507,OPERATIONAL,,resort_hotel,"resort_hotel, spa, hotel, lodging",3.9,49,,"Worst stay so far in Ubud.

We noticed it was very cheap and beautiful (perfect right?) no, it was so dirty! Sheets with stains, shower not clean, everywhere ants and last but not least:

I thought I saw bed bug eggs. So I immediately asked someone to double check. The staff told me not to worry and that it came from the wood. I took their word for it and went into town to do our thing. Finally, someone told me that it was termites that remove the sawdust from the wood. It was everywhere, in the mattress, furniture and, on the floor. A little wouldn't be a big deal but this looked like a plague.

In addition to everything, there were also cockroaches and mice that we saw, inside and outside the house. That was a sign for us that we did not want to sleep here. They offered us another house but we didn't want it. Luckily the man was kind enough to cancel our booking. We don't think they even realize they have a termite infestation because again, they said it was the wood. Which is correct, but not because the wood ""leaves"".","Unfortunately, my experience at this hotel was a complete nightmare.
From cockroaches invading our privacy by dining on my toothbrush, loud noises from anywhere, to dirty sheets, spider webs as extra decor, and even a repulsive brown drip, which we discovered was sewage from the upstairs bathroom, leaking into ours. The only thing deserving recognition here are the staff members, who bravely endure unacceptable conditions with professionalism. However, it's disheartening to witness such lack of hygiene and care for guest comfort.
A truly regrettable experience.","Really surprised by this place, as wasn’t expecting much as it was so cheap. But really nice place! The rooms were in little wooden huts with balconies. My room was a little noisy from the family below, but when I informed reception they instantly moved me to another room. Staff were also lovely!","Good facilities and spacious bathroom with bathtub. Hot water is enough powerful to fills tub.
Safety box, the kettle, the dryer and fridge. Reasonable price but we'll equipped.
As Location is far away from town center, country side feeling and not so developed good area.
One thing I cannot relax is bangalow buildings are too close each other.
Staffs are very wise and caring, overall good hotel.","If you want to sleep, dont come to this place. There’s light in the room at 6am and everyone makes so much noise. You can hear literally everyone in the area and if you are in the first floor, you’ll hesr every single step and whisper from the second floor. Unpleasant experience. The toilet is dirty."
ChIJs_hJ7Tkj0i0RxqJMxwu0ud8,Ananda JJ Ubud Resort & spa,-8.470200199999999,115.273674,"obyek wisata kokokan, Jl. Raya Petulu, Ubud, Kecamatan Ubud, Kabupaten Gianyar, Bali 80571, Indonesia",https://maps.google.com/?cid=16121114303830729414,OPERATIONAL,,resort_hotel,"resort_hotel, bed_and_breakfast, hotel, lodging",4.1,73,,"The location is amazing. Waking up to such greenery, sipping coffee in the verandah with rice field surrounding you.
However, the bathroom needs improvement. Hot water only runs in the bathtub. Also, another business is building their cottages near this resort. It causes some noise. Those cottages also block the rice field view from the room and swimming pool.",Great place surrounded with rice fields! They can provide filling breakfast with a little amount if you have sort time in Ubud and dont want to waste time eating outside. Only problem is you can hear your neighbours. Spa is next to the room and we woke up with massage noices.,"We cancelled our stay and left in couple of hours after check in. Please note that you will have to carry your luggage over many stairs and pebbles yourself. Wooden stairs into the units are simply held by nails that can come off any minute. We almost fell over thrice over the rocks carrying our luggage. No help was offered. Room had lot of gaps in roof making air-conditioning pointless and has lot of spiders on the bed.

On the contrary after few negotiations they only charged half day stay for 1 hour ""use""of room.  View was nice. Food is pricey but very tasty and fresh as well. Service lady had good smile always when dealing with problems",the rice field view from the balcony was so nice😍😍 the friendly staffs and foods were amazing! would love to come stay again!,"The rooms are not good at all, the rest rooms are smelling because the construction is not good. No isolation, we can hear the neighbours like we were in the same room.
The description of our room said that we have a private hot tub and it was just the bath of the shower in the smelly toilet...
The picture of the booking and the reality are far away.
The stairs of the swimming pool are corroded and loose, also the toilet itself.
I don't recommend to come here at all."
ChIJe5h1Rlsj0i0RRV3XM-U1ckY,Villa JJ and spa ubud,-8.4701833,115.27477610000001,"Jl. Raya Petulu, Ubud, Kecamatan Ubud, Kabupaten Gianyar, Bali, Indonesia",https://maps.google.com/?cid=5076178988533505349,OPERATIONAL,,bed_and_breakfast,"bed_and_breakfast, lodging",4.3,34,,"This hotel offers a great value for money with its spacious rooms featuring high ceilings. Despite signs of aging in the decor, the overall atmosphere is charming. The outdoor shower adds a delightful touch. The staff is welcoming and hospitable. Located amidst rice fields on a quiet street, it’s an ideal spot for a tranquil retreat, though having a bike is essential for getting around. Overall, it’s a solid choice for an extended stay.

In addition, it’s worth noting that we didn’t dine at the hotel during our stay. While my wife sampled the food a couple of times, she didn’t particularly praise it. However, this didn’t detract from our overall positive experience.",Beautiful place for villas and bungalows where you can fill homely to spend your holidays with your family. The atmosphere is quite and peaceful. Surrounded the villas are rice fields and you can enjoy your time and look how the farmer work on their field.,"The location of this place is amazing.  But the rooms are not well maintained — it does not look like the picture anymore.  The bathrooms can use better cleaning, they smell funky and the towels are tattered.

There is a pigsty next door so it smells like poop a lot of the time when you are walking outside.  It’s especially bad if you get one of the rooms that has an outside bathroom.  While the bathroom itself looks nice — you can smell the pigs as you bathe. Yuck!

The internet is super spotty, most of the time, there is none — and when it shows up, it’s super slow.

Honestly, you can find much better places for the price they are asking for.","Beautiful hotel in the middle of rice fields, rooms are spacious, with shower and stone bathtub, perfect for honeymooners, quiet area, perfectly surrounded by paddys fields. Food was good and service always a warm welcome.","The staff here are very friendly and always willing to help. Place is very peaceful and relaxing.
We were speechless when we saw our rooms. Absolutely amazing setting. We will definitely come back."
ChIJQx_gNE8j0i0RNqHlLYwNZXk,The Arcadian,-8.4711115,115.2706314,"Jl. Tirta Tawar, Banjar Junjungan, Ubud, Kecamatan Ubud, Kabupaten Gianyar, Bali 80571, Indonesia",https://maps.google.com/?cid=8747412746953662774,OPERATIONAL,+62 813-3910-0491,,"hotel, lodging",4.9,54,,"One of my favorite places to stay in Bali.
What a gorgeous property with incredible views. Everything was 5 stars from the rooms to the in-house massages. We got breakfast everyday in front of the breathtaking rice fields. Staff is extremely professional and accommodating. I hope to stay here again many more times. Thank you for hosting my mom and I! Unforgettable experience.","Come to The Arcadian for a wonderful Ubud welcome; this place is a true oasis set in the rice paddy fields. Breakfast served at your villa was perfect every time, the staff are so friendly and the massage was incredible. We found it easy to get grab taxis into the centre. The chef also gave us a beautifully prepared takeaway breakfast on our last morning.","My partner and I spent 4 nights at the Arcadian in Feb 2024 and absolutely loved our stay. We had only booked 3 nights and were very lucky to be able to extend for an additional night. The Keep unit is absolutely stunning, one of the most beautiful properties we've ever stayed at! The early morning light overlooking the rice field coupled with a delicious breakfast, will stay in our memories for a long while. Thank you Rini & team for your wonderful hospitality. We hope to return one day.","This place clearly deserves its 5 star rating! It’s stunning from the moment you enter, decorated with great taste and stunning views on the rice fields, even during the harvest season. Huge thanks to the team on site as well, for being so kind and always accommodating with our requests. Breakfast is complimentary and prepared daily with love. Thank you again, we would stay here again without hesitating!","Unparalleled Hospitality at The Arcadian: A Gem Just Outside Ubud's Hustle. ⭐️⭐️⭐️⭐️⭐️

I was eager to review The Arcadian mere minutes after our checkout, and for all the right reasons.

This venue stands out as possibly the best we've ever experienced. Much of its charm is attributed to the staff, whose exceptional service and attentiveness elevate the stay. Their commitment to guests truly sets this place apart.

Our accommodation, 'The Keep', was a testament to thoughtful design, where every detail was meticulously crafted. A highlight of our stay was the delightful floating breakfast, which we wholeheartedly recommend.

Located a convenient 10-minute drive from the bustling center of Ubud, The Arcadian offers the best of both worlds: proximity to town and the tranquility of the surrounding rice fields. We took advantage of the scooter rental service they offer, making our explorations all the more convenient.

We were particularly impressed by the prompt responses from the staff via WhatsApp, often receiving instantaneous replies.

Having been privileged to stay at numerous esteemed venues globally, The Arcadian ranks among the very best.

A heartfelt thank you to the team at The Arcadian for a memorable stay!"
ChIJD_Ijfs0j0i0RDL-9VtAKzvE,Sunshine Villas Ubud,-8.471643900000002,115.27461369999999,"Jl. Raya Petulu No.35, Ubud, Kecamatan Ubud, Kabupaten Gianyar, Bali 80561, Indonesia",https://maps.google.com/?cid=17423875898267778828,OPERATIONAL,+62 831-2534-5443,hotel,"hotel, lodging",4.6,56,,"We spent there 4 nights in the wooden suite. The service was really good. Rooms are beautiful, clean and tidy. The place is kept in a good condition and generally quiet. The food at the villa restaurant was very tasty although a small selwction. We had a cat visitor that was not the villa's pet, just came to say hi! We ordered some massages and they do not have a specific place for it so they did it in our room or by the pool deck. The villa has a great selection of services such as, drivers, scooter rental, lots of tours and massages. Better to double check prices as not everything is all-inclusive in the tours. There was no hair dryer in the bathroom. Despite appearing clean and washed, there were some stains on the towels and the bed sheets. We did like this place a lot and will came back for a relaxed time in Ubud.","Nice accomodation facing to rice field. In moisture area not to hot on day time cause the air flew well. Good choice from my customer.
Lobby are clean, Indonesia breakfast friend noodle are great my customer said. Hope it Will be great experience for my customer 🙏🙏","Amazing stay here. Mainly this review is about the hotel staff, they are gem. Highly recommended.","First:  The name of the hotel is the same as the one that is only a few meters away from Downtown.  So, I will let you guess what is going on here.
Second, Given that this site is remote and in an isolated place, the personnel are constantly trying to book you with the network drivers. They are pretty insistant.  If you manage to get other means of travel... they show their dissatisfaction.  If they discover who you took personal arrangements with, they will call the driver and threaten if they choose to pick you up.
Third,  there menu is pretty limited... and over that, some items ont the menu are only available randomly... limiting even more.
I did not feel confortable in this remote and reclusive place.","Lovely villas with the perfect location: only 10 min away from the city centre and in between rice fields, being away from the noisy and busy Ubud. Plus, the staff is very attentive and careful, the place is always clean and well taken care of and the breakfast is prepared everyday at your request. Definitely recommend!"
ChIJ7xqGoE090i0RMb3QYsa2yNY,Teba Junjungan Cottages,-8.4753948,115.27139690000001,"Ubud, Gianyar Regency, Bali, Indonesia",https://maps.google.com/?cid=15476821082636336433,OPERATIONAL,+62 813-3859-4011,,"bed_and_breakfast, lodging",4.5,78,,"Probably my best accommodation during all my trip in Bali!

The Bungalow was stunning, clean and all in vernish wood . The swimming pool and outdoor area was really cute. I liked to be in a small family space and not a big touristique motel. 🧡
The Balinese family was amazing, always smiling and helping me with scooter, advice of temple and waterfall , always time to speak and sit with me . 🩵
The young people who was serving me the morning and all day long was very nice , very polite. I really appreciate the fact to we have some good conversation. Thanks to Niha for the best pancakes 🥞 of my life 😋 Thanks to the other young man for all the advice he is been giving to me 🙏✨
It was very quiet and I had my best sleep in all my travel. I will definitely come back and enjoy some more time there 🩷

5✨ Really recommended!","Feel free to contact me on Instagram: hello_this_is_lorenzo.
Me and my partner had a great time staying in this accommodation. The rooms are very nice and big. The bed is beautiful! Good water pressure in the shower. The hosts are really nice and willing to help with any necessity you may have. You can also rent a scooter with them, very handy! And breakfast was delicious! Check my pics to see how the room was. Recommended, great value.","We found this gem here in Booking and we were very happy we booked it. The owner was a great host since the beginning and the room was of excellent value. We had a nice breakfast every morning and the swimming pool to refresh after a visiting day in Ubud. They rented us a scooter for a very good price and with it we were in downtown in around 7 minutes. They take care of the property and the guests. I recommend it very much if you want to stay in a quiet place and close enough to Ubud.
I would recommend to the owner to try to keep voices lower as some guests could be still sleeping early in the morning. Sometimes we could people just talking without consideration, but not every morning though.",Great cheap place to stay. Need to hire a scooter as it's a bit north of Ubud center. There are 4 villas/ rooms and a pool. Wik the guy who runs the place couldn't do enough for us and the scooters he rented us were the cheapest and best quality scooters we've ever had in Bali. There are three villas in a row and then one on its own across the way. I recommend getting one of the three that are side by side if you can. The pancakes I got for breakfast here were some of the best pancakes I've ever had. The location is North of Ubud centre near paddy fields which is exactly what we wanted cause Ubud centre is so hectic. Highly recommend this place.,"Everything was perfect. The room and the bath was clean. The shower had hot water. There is a pool which is cleaned daily which is nice. Free breakfast which was delicious and included fresh fruits. The owner is super friendly and helpful. They rent scooters for an affordable price. The location is great if you ride a scooter, it's more quite than in the center of Ubud but you can get there within 10 minutes. There is a waterfall and the Rice fields within the same distance. It's a bit far from the center if you want to walk, but the traffic is far less than in Ubud center so I can recommend renting a scooter. We wanted to get out if the chaotic center and still enjoy the perks of Ubud, that's exactly what we got. The owner also organized a transfer to our next stay which was for a great price and work out fine. All in all a great experience and very recommendable if you get around with a scooter."
ChIJBblP168i0i0RJUAl9uJ_tVo,Villa Merdu Bali,-8.4764167,115.2722672,"Jl. Tirta Tawar No.192, Junjungan, Ubud, Kecamatan Ubud, Kabupaten Gianyar, Bali 80571, Indonesia",https://maps.google.com/?cid=6536271046967115813,OPERATIONAL,+62 822-3681-2300,hotel,"hotel, lodging",4.8,70,,"Found this place a few years ago, just clicking around on Google maps, looking for a place a few minutes away from the chaos of Ubud - but close enough to easily access Ubud ad surrounding places. So happy we found it. Breathtaking villa so beautifully designed and decorated. Great rooms with crazy big baths and showers in outdoor (super private) bathrooms, all nestled around the main pool. If you need more privacy then you can booking the apartment which has its own pool and living space.
Then facilities are all there, and the owner/managers make everything so easy.
Surrounded by some of the bast cafes I've been to. Loads of great coffee places, but also tons of local eateries.
Been back many times, and will continue to do so.
Almost want to keep it a secret...","I had such a wonderful time in Villa Merdu. It was definitely the highlight of my trip to Bali. Finding a good accommodation wasn't as easy as I thought, a lot of them look great on pictures but when you arrive there are usually not kept well and there is a problem with mold or cleanliness. But Villa Merdu was spot on! All the way from the location, cleanliness, amazing stuff and sooooo much space, just wow!
I was able to fully relax, use my time to read, do yoga and meditate since it is so quite, with the most beautiful jungle pool view. The whole villa is really spacious, nicely and what's more important practically furbished with everything you might need during your stay.
I loved the ""moon and stars view"" open bathroom, the huge and comfy bed and the long pool where you can take a proper swim.
I will definitely come back to this space next time I travel to Bali!","The best villa in Ubud, outside of the busy area but still close enough. Beautiful jungle view. The rooms are spacious, clean and beds are super comfy. Always my go-to place when I visit Ubud. Staff and manager are super friendly and helpful. Cannot recommend highly enough.","A beautifully designed house, and a very quiet and scenic part of Ubud. My wife and I really enjoyed our stay here, Out of the several places we stayed in Bali it was by far the most comfortable and beautiful. Next time we're in Bali we'll be sure to come back here again. Loved it!","I had a beautiful experience at the villa. The host is very friendly and made our stay very easy and relaxing. The staff is kind and ready to help. The location is beautiful and peaceful, the perfect place to relax. Not to mention the wifi is great, which is especially useful if you need a place to work."
ChIJ1yXgWq0j0i0RoiKhgl3Dqfk,D'ethnic Ubud Villa,-8.4693846,115.27317400000001,"Jl. Raya Petulu, Ubud, Kecamatan Ubud, Kabupaten Gianyar, Bali 80561, Indonesia",https://maps.google.com/?cid=17990124992899130018,OPERATIONAL,+62 812-3955-2106,hotel,"hotel, lodging",4.9,77,,"Beautiful little rustic villa, spent a few nights here and it was a great spot to get a bike and explore north of Ubud. Beware it's a tiny little road on the corner up to the property so you will likely have to get out of a car and walk up,  but it's not far.","Nice private villa with a pool, the host is friendly. There is a lizzard which keeps pooping on the sink in the bathroom, but I guess it is quite normal in this kind of building. Walls are thin and made of wood, but good for a sleep as there is no traffic so you can hear the pure Bali jungle 😉","Owner and family are so friendly and welcoming! They go beyond for you to make sure your stay is perfect! The villa is nice and private and the air conditioning is good, plunge pool is nice and cold. Gorgeous place to stay, clean and tidy.

Just one thing is the food delivery drivers (grab) have little trouble finding it if they’re not local. However not a problem.","A cosy one room cottage with a kitchen and a great little pool. The bed was very comfortable,  and the AC kept the room deliciously cool even on the hottest day. A perfect getaway for those seeking solitude, and within walking distance of some great restaurants.
Highly recommend.  Look forward to my next visit.","Absolutely beautiful villa. Perfect place for a quiet getaway. The bathtub is nice and deep and the pool was sparkling clean. The owners were so kind and patient even after I was delayed arriving, they waited and greeted me with a huge smile. Looking forward to returning again."
ChIJ2w9JHrAi0i0RX9X4Dfntudk,Junjungan Guest House,-8.4755235,115.27183509999998,"Jl. Tirta Tawar Junjungan, Ubud, Kecamatan Ubud, Kabupaten Gianyar, Bali 80571, Indonesia",https://maps.google.com/?cid=15688832430858884447,OPERATIONAL,+62 813-3726-0490,private_guest_room,"private_guest_room, hotel, lodging",4.2,46,,"Amazing place to stay. Made is such an hospital and outgoing host who goes out of his way to help and guide you.

The accommodation was far better than what I imagined. Very comfy beds and clean rooms. The surroundings are epic. Stayed 4 days and will be returning again next week.  Very close to shops and they have a scooter to rent too.","This small guesthouse is located about 10 mins away from Monkey Forest Area and close to Tegallalang. The room was comfy with a queen-sized bed, TV, aircon, quite spacious bathroom, and a desk. All rooms have balcony/terrace with two chairs and a table. I got the corner room facing the jungle—such a beautiful view! It’s very quiet and peaceful. They only have 5 rooms and even though all rooms were occupied, it wasn’t noisy at all. Their pool is a bit dirty but it’s understandable due to their location. They also sell fresh juice, young coconut, beer, and other beverages to accompany you chilling at the pool. Aircon was nice and cold, water pressure was good and water heater worked fine. The staffs there were always friendly and helpful. The included breakfast was nice and tasty but not very filling. Wifi worked just fine. Overall it was a great stay and I’d love to come back another time.","Room was better than expected, they got 5 rooms in 2 levels, a small pool and all surrounded by forest and a small stream (you can hear the sound but it's not visible). Breakfast was good, service was good. The building itself was located behind some local's houses so you must walk the path, could be difficult if you have some big luggage. They had some bed bug issues but hopefully fixed now. Overall was alright.","Nice place even If I expected to pay for a a/c and not a fan.
It's quiet and during the nite you can fall asleep with frog's music.
You need scooter to move around or if you like you can walk easily to Ubud in half an hour and see the locals around. Clean enough and little bit expansive for dinner but the family there are extremely nice.",Very nice environment into the jungle. The room is confortable with the front view of the pool. The people who manage the property are very friendly and helpful.
