id,name,latitude,longitude,address,url,status,phone,primary-type,types,rating,rating-count,price-level,review 1,review 2,review 3,review 4,review 5
ChIJR4gjiFtA0i0RqWgy0vs5TY4,Plaza Renon,-8.673131,115.24414360000002,"Jl. Raya Puputan No.210, Renon, Kec. Denpasar Tim., Kota Denpasar, Bali 80239, Indonesia",https://maps.google.com/?cid=10253915680318580905,OPERATIONAL,+62 361 4457615,shopping_mall,"shopping_mall, thai_restaurant, movie_theater, coffee_shop, cafe, beauty_salon, event_venue, store, restaurant, food",4.4,11741,,"Convenient and reasonably priced, has Japanese and Korean products in a well organized small supermarket. The Starbucks there is usually not too crowded and comfy enough. Also has a cinema that does not have many movies but still offers some entertainment if you are into Indonesian productions.","Hello friends 😁😁😁 good location.. sanur, 2 floor...many shop's..., have underground parking... for bike and car's...","Cozy place to relish both of lunch or dinner. Their place that in the middle of town put this place as a good option for citizen. With varied menu available, we can choose the suitable to our stomach","A fun place to enjoy some times in the city. There's a supermarket, some food courts, a movie theater, and some cute shops inside. The parking lot is too exposed and the parking fee is somehow more expensive than any other malls in the city.","good for movie night, motorbike parking was outside so if its raining you'll be soaking wet. carpark is limited on basement. nothing much to do here except for movie or eating in my opinion."
ChIJjXkJ9tZB0i0R0WxWuDEa-Ks,Four Star by Trans Hotel,-8.6738003,115.24232780000001,"Jl. Raya Puputan No.200, Renon, Denpasar Selatan, Kota Denpasar, Bali 80226, Indonesia",https://maps.google.com/?cid=12391683175558311121,OPERATIONAL,+62 361 4743500,hotel,"hotel, lodging",4.5,864,,"The hotel actually looks very nice. Lots of marble light, nice furniture and soft. Nice elevators and even 2 elevators.
The room is nice, nice floor color, and wooden parquet not just tile.
But a lot of details and minuses.
1. the big overhead shower head almost didn't work.
2. Although what is the point of the shower head if there is no hot water. We waited 10 minutes and then called to ask, some man came in the night and then hot water appeared. In the morning there was no water again, we did not call again.....
3. The lights around the perimeter of the main did not work at all,. One of the four bulbs was barely blinking.
4. Without a key card air conditioning does not work. We arrived to just a vdski-hot room, with a correspondingly bad odor. The first impression is not a pleasant one.
Air conditioning is bad and slow, turned on at 16° and strong speed at 8pm, but it didn't get cool and comfortable until 3am. Very long time to wait.
In general, the hotel seems good but the price tag is clearly inflated.
By the way the gym is good. I liked it.","When it comes to considering your accommodation options, the Four Star at Trans Hotel is definitely worth mentioning. We had the pleasure of staying at this hotel from 25th March to 1st April, and we must say, our experience was exceptional.

It's important to highlight that this was a business trip involving 51 students and 3 staff members. The fact that the rooms were pre-arranged before our group's arrival greatly contributed to the efficiency of our check-in process. It was incredibly fast and streamlined, allowing all members of our large group to settle in without any delays.

Handling such a sizable group can be quite challenging, but the Four Star at Trans Hotel managed it with exceptional ease. From ensuring that all rooms were prepared and ready for our arrival to providing assistance throughout our stay, the hotel staff demonstrated remarkable professionalism and efficiency in managing group bookings.

This seamless coordination undoubtedly enhanced our overall experience at the hotel. It's a testament to the hotel's commitment to providing excellent service and ensuring the satisfaction of all guests, regardless of group size. We were thoroughly impressed by their ability to cater to our needs and make our business trip a seamless and enjoyable experience.

The hotel's facilities and rooms were also very satisfying. The rooms were spacious and comfortable, equipped with all the necessary amenities to make us feel at ease. Additionally, the hotel's other facilities such as the gym and swimming pool added to the enjoyment of our stay.

Lastly, we must mention the hotel's location. The Four Star is situated in a convenient location with many restaurants and shopping mall nearby.

Overall, we are extremely pleased with our stay at the Four Star at Trans Hotel. Their excellent service, comfortable rooms, and convenient location made our trip perfect. We highly recommend this hotel, and we are confident you'll have a pleasant and memorable stay as well.","Room space & cleanliness good. Food taste good although not many variety. Problem with TV remote & plumbing when check-in, but the staff fixed it immediarely. Parking space also limited, but they provide vallet for free.","Hotel was expensive for what it is. Much better prices in better locations. Rooms smell like smoke. Loud atmosphere at night. Laundry service was 800,000 for one load and they did not tell the prices before the service. Will not be back. Dishonest service.","Good value for money. Rooms are clean but one of girls at Front Desk was not able to communicate in English properly.

Anyway special thank you to Nevi ⭐️⭐️⭐️⭐️⭐️, who was so hospitable and shared with us the travel planning and assist us to reschedule our flight . She was also very helpful and responsive to our needs. Thank you so much Nevi, we were so lucky to have met you!"
ChIJo5hb-UtB0i0R-h64pVyx4RE,Sekopi.Renon,-8.675484500000001,115.24199229999999,"Jl. Tukad Balian No.15, Renon, Denpasar Selatan, Kota Denpasar, Bali 80226, Indonesia",https://maps.google.com/?cid=1288505979880087290,OPERATIONAL,+62 812-3717-1808,coffee_shop,"coffee_shop, cafe, store, food",4.6,660,,Great ambience when the sun sets. Such a comfy place to chitchat with friends!,"A coffee shop located inside the campus area of Akpar Denpasar. I think the atmosphere isn't really good and the indoor area is pretty narrow (can only accommodate about 20 people).

The specialty about this place is it's pet friendly. I met two cute puppies inside. There are rarely pet friendly coffee shop around Denpasar. Compared to Sekopi.Bypass, this one needs more improvement for their facilities, especially for the rest room. There is only one gender mixed rest room which is usually full all the time.","It located deep down behind school building from main street. The parking lot is wide since same area with the school. They are pet friendly and has few cute dogs. My friends said this place will crowded in evening. Thats why i come at noon and choose indoor with air conditioner. The music indoor is same loud as the outdoor. Bit annoying if you have chit chat but okay. Now we talk about the coffee. Their special menu is several ""es kopi susu"" with various flavour syrup and will come with sweet for sure. I decided to get affogato so i can try the espresso and had ice cream with choco granule.","If you’re looking for cozy coffee shop in Denpasar, i reccomend this place that you should visit. The place is cery unique because this coffee shop is nestled inside a scool with the spacious indoor and outdoor seating areas. Also you have to try the charcoal latte, for me that is the best non-coffee drink there.","coffee quality is good, and price is lower than average, it is really good place for students gathering"
ChIJN2NXv4lB0i0RASWbjUeDCOo,Renoma Garden,-8.672113399999999,115.24499510000001,"Jl. Hayam Wuruk No.306, Sumerta Kelod, Kec. Denpasar Tim., Kota Denpasar, Bali 80239, Indonesia",https://maps.google.com/?cid=16863873148030493953,OPERATIONAL,,restaurant,"event_venue, restaurant, food",4.5,421,PRICE_LEVEL_MODERATE,"Wow, a good place to hang out with friends and family. For some occasion there is events behind that let us explore the hidden garden of this area. Good for outdoor party, barbeque, and a wedding outdoor. Very enjoyable, there’s a billiard pool inside near the bar. The beverages is quite cheap but so delicious. A very recommended place if you like to spend 2-3 hours here. No worry about the price, it’s very good bargaining.",The place setting is great for families and children. They do cater for parties or weddings. We had our usual coffee and snack which was ok.,Foods are good and servers are friendly and fast deliver our food. They had live music too,"Actually the place was so nice but dont come at noon, very hot. And the food that I ordered is fine but took a longtime 😁 hope next time will be better","this new place so lovely, either you single or with family, big space, live music, affordable price, pasta and Indonesian food are available."
ChIJITHPtH5B0i0R3uVdd8Z_0xI,BRON Cafe,-8.672741,115.2447032,"Jl. Hayam Wuruk No.136, Sumerta Kelod, Kec. Denpasar Tim., Kota Denpasar, Bali 80239, Indonesia",https://maps.google.com/?cid=1356568403151545822,OPERATIONAL,+62 817-560-162,restaurant,"restaurant, food",4.6,925,PRICE_LEVEL_MODERATE,Nice place. I came here for gathering. The place is very nice.the foods are delicious,"I only ordered an iced latte and Belgian chocolate-rich fudge cake. The latte suited my taste, not too bitter and creamy.
The cake was so moist, chocolatey, and as the name suggested, rich.
I recommend coming here at noon or before the sun sets, as after this hour the mosquitoes are showing up. No insect repellent in sight, either mosquito-repellent plants or that UV light thingy that attracts insects.
I couldn’t finish my cake and latte as so many insects flew on my food (laron, idk the exact name in English).
The atmosphere was amazing tho, so rustic and calm, something unexpected in the middle of Denpasar.
Indoor option is very limited. I don’t even know if there’s any air-conditioned space. Maybe it’s the concept.","Location near center city of denpasar, they have playground for kids. Their Rice bowl very recomended","Snacks are good 👍, price is ok. Their service is very good. A lot of green trees + a pond, it is nice. They also have a little space for kids playground.
The only downside is there are a lot of mosquitoes here.","Love the place, offering a peaceful and serene atmosphere and delectable treats. The interior is tastefully decorated with cozy seating and warm lighting, and the staff are always welcoming and friendly! Whether you're looking to relax with a cup of coffee or catch up with friends, Bron Cafe is the perfect destination for a cozy and enjoyable experience."
ChIJtTLJMK1B0i0RVHA1rOEFb-c,Enigma Garden Bali,-8.6738277,115.2472911,"Jl. Hang Tuah No.8, Sumerta Kelod, Denpasar Selatan, Kota Denpasar, Bali 80239, Indonesia",https://maps.google.com/?cid=16676554411991199828,OPERATIONAL,+62 821-2714-5757,restaurant,"restaurant, food",4.6,528,,overall the service is responsive and the food was tasty. the healthy juices were really good. went back several times for the ribs. they are very tender and quite delicious,"Great relaxing place and the food was fantastic with modest price. Bit hard to find as it's inside the rows of nursery shops along Hang Tuah and the signage was inside and small, too hard to see from the road. But everything just great, lovely.","Love this cafe..
The food, the coffee and its comfy.
A little playground for kids age 4-6.
And a pool table (billiard).
And you can reserve the place for a small event.

Try it.. you will love it.","Nice place to have lunch or dinner. Kids playground and parking available.
Food is good. Kwetiaw goreng ayam, tempe goreng, fried banana all have good tast. Except gado-gado. It is more like a salad rather than the typical Indonesian gado-gado Jakarta style.

Overall nice place to relax and enjoy food and/or coffee.","the ambience of this cafe is amazing. the food is delicious and the price range is average for this kind of cafe in the middle of denpasar.
plenty parking space!!
love the ambience! 🙏🏻🩷"
ChIJ0wjpTwpB0i0R_Z-ZS4Xmfeo,Wiji Indonesia,-8.673537999999999,115.246358,"Jl. Hang Tuah, Renon, Denpasar Selatan, Kota Denpasar, Bali 80227, Indonesia",https://maps.google.com/?cid=16896914837137367037,OPERATIONAL,+62 896-8801-3233,indonesian_restaurant,"indonesian_restaurant, restaurant, food",4.3,288,PRICE_LEVEL_MODERATE,"A suitable place to relax in the middle of the city with family. the location is easy to reach, adequate parking, indoor or outdoor seating, with a children's play area provided. When I got there, I was impressed with the service of the parking attendants, waiters and especially the cleanliness of the restroom area.

There may be problems with the ordering system when I place an order, but the waiter is ready to help take orders manually at any time.

The presentation of the food was good, it's just that the fried rice ordered was quite burnt, according to my colleague it wasn't enjoyable enough, but for the rib soup the portion was filling and delicious.","Amazing Indonesian cafe/restaurant. 👌

Indonesian food is never wrong. They have a pretty wide selection of menu, Indonesian food of course. Almost all of the menu that I tasted, tasted so good. 😍

It's a good place to hangout with your friends, family, or partner. Also a great place for kids because there is a mini playground in the outdoor area.","No negative things to say! The tahu telur was tasty, good size portion, saucey, enough tofu in every bite, and the shrimp chips was a great addition. For dessert I got the es palu butung and that was delicious! The portion size was also perfect. You could really taste the mochi pandan (hard to come by). Wiji nailed it on this dessert and the savory dish. I will definitely be back.","Authentic & delicious local Balinese food

The guide is right to recommend this place to us

But but the aircon is just too weak and making the dining experience too hot & warm to enjoy our food","Visited at afternoon, around 2-3PM. Indoor and outdoor seating available. Good place for who craving an Indonesian dishes.
Nice place with kids playground.

Food:

The Rawon was nice, served with salted egg, rice and Emping but, i preferred rawon served with shrimp crakers.

The Sup Gulai was nice, a bit salty.

The Singkong Goreng was good, soft, but a bit plain in taste.

Tempe mendoan was okay, maybe a bit too thick for me.

The drinks and dessert was excellent.

Parking:

Pretty spacious parking spot, maybe around 5-6 medium SUV can fit."
ChIJNZq2BZtA0i0RQmXoCYXVK9Q,Oranjje Denpasar Hotel,-8.6721109,115.24416139999998,"Jl. Hayam Wuruk No.302, Sumerta Kelod, Kec. Denpasar Tim., Kota Denpasar, Bali 80239, Indonesia",https://maps.google.com/?cid=15288548127412872514,OPERATIONAL,+62 361 238185,hotel,"hotel, lodging",3.7,630,,"No Wi-fi, no hot water! Even if in the room description were included. Only one socket hidden deep under the table far from the bed. Dirty bathtub. Limescale and rust deposits everywhere in the bathroom. Unpleasant smell in the room. The only one positive thing in this room was bad which was clean and comfortable.","I want rate this hotel because it is beyond rating. The cleanliness is missed, spiders and their houses, ants, cockroachs and lisars are literaly everywhere!! The hotel is ranked with 3 stars but it seems not like it has any!! The swimming pool is not clean at all and the breakfast is extremely poor.
Besides there are nasty toilet smell as well as humidity smell, moister are attacking the walls. Finally but not least, the staff is not wearing uniform and working with their dresses!! This not professional at all!!! So after an exhausted trip and journey it is not recommended for any to be there. In our case we left at the same day as soon as the sunrises, even we did not sleep  for the whole night. Very disappointed :(","The ballroom is good, there are 6 or 8 AC inside but just 2 of it work well
Need some renovations
But the services quite good",The staffs are amazingly kind. The hotel facility are ok. Feel like home! I had an event here and they organized really well and on time. Had some matters but they fixed it well. Thank you!,"Good budget hotel. Room included free water, AC, TV, large comfortable bed, bath and shower. Quick wifi but only in lobby and restaurant. Nice pool too!"
ChIJE9Zz3e1B0i0RhoP1iv8n2jY,The Renon Apartement,-8.675817,115.24576469999998,"Jl. Tukad Penet No.19D, Renon, Denpasar Selatan, Kota Denpasar, Bali 80239, Indonesia",https://maps.google.com/?cid=3952515601472521094,OPERATIONAL,,,lodging,4.2,29,,"1.The walls in the apartments are like cardboard. All the shouts, arguments, and conversations of the neighbors are heard as if they are in your own room.
2.In our room, there was an old and very noisy air conditioner.
3.When the microwave broke, we were told that to fix it, we needed to pay 900k.
4.Changing the bed linen costs 120k. The bedding looks unpleasant.
5.The washing machines have been broken for a year; only one is working properly.
6.The owners are completely uncommunicative, remembering tenants only at the time of payment.

This accommodation has left a lot of negative emotions and stress.","1.room was clean and nice view
2.staff was so kind and helpful
3.there’s free laundry room I recommend for long stay
This was my first overseas trip
i had a great time","Pros:
1. Modern and Clean Room
2. Humble and Helpful Staff
3. Lots of natural light
4. Good location

Cons:
1. Unfriendly, rude and dishonest owners - 5 Million Rp deposit was not refunded even though we gave more than a month's notice. They say because the reservation was canceled we lose the deposit.No rental agreement, no invoices, no paperwork whatsoever which is illegal. They dont ask for copies of passports or id's. We will be reporting them to the Balinese authorities.
2. No management. These people should not be running any type of hospitality business as they have zero customer service and management skills.
3. No rules or system in place. Tenants get to do as they like without any consequences. The Japanese lady and daughter in room 101 are absolute maniacs and have no respect for neighbors. Slamming doors and noise from 4:30am - maniac in room 101 and screaming kids at the pool will destroy your peace of mind. Tenants using all three washing machines at the same time again because there are no rules.
4. Broken shower handle in room 106 which was never repaired they can't even replace batteries in the aircon and TV remotes. Washing machines get blocked often due to lack of cleaning.
5. The entrance road is in very poor condition and will be flooded when raining.
6. They charge for changing the linen and car parking.

Don't be fooled by some good reviews on Google the owners are con artists and make rules when it suits them. If I had more time I would sue them for the 5 million Rp and would win as there is no rental contract.

We stayed for 4 months purely because of the ideal location. We became good friends with the staff especially Ketut which we believe could run the building better than the owners. It's safe to say we will never return.","Very good interior and design. Helpful & humble staff, the pool is sooo comfortable. I love the ambience and the place so much. But the kitchen and kettle r a lil bit dirty :( overall, i’ll be back again soon✨","I stay for a week
this was my first airbnb, it was great!"
ChIJeZsbSJNA0i0R-gxJx9q0FXw,Babi Guling Renon,-8.6739479,115.24410689999999,"Jl. Raya Puputan No.212, Renon, Denpasar Selatan, Kota Denpasar, Bali 80239, Indonesia",https://maps.google.com/?cid=8941251486953311482,OPERATIONAL,+62 361 234208,indonesian_restaurant,"breakfast_restaurant, indonesian_restaurant, restaurant, food",4.4,975,PRICE_LEVEL_MODERATE,"One of our family fave babi guling (Bali roasted pork) in Denpasar, Bali. Not only for dine-in, but sometimes we take it on flights to other cities and the taste is still authentic when we arrived at our destination as long as everything is separated.","Bigul Renon taste good, but nothing special. First tome eating bigul served with small meat balls in the soup.  The roasted pig skin was chewy and othe fried stuff chewy as well.","Balinese food that you should try! Their most fav menu here: babi guling & siobak. Not so spicy, clean, and they have a fix price for the menu so dont worry.","Nice place to have dinner along the main road, with few big trees in front. Babi guling is a must try local delicacies in bali here.","Legit traditional babi guling! The heat punch of the babi guling seasoning is very nice, not too hot not to mild! The soup and the meatball also very nice. You can also order sate plecing mak lukluk here. The soto balung also very nice! Love it here👍🏻"
ChIJfeO7jFtA0i0RBHiOEXoHGFo,Sate Plecing Mak Lukluk,-8.673824,115.24379689999998,"Jl. Raya Puputan No.210A, Renon, Denpasar Selatan, Kota Denpasar, Bali 80226, Indonesia",https://maps.google.com/?cid=6491947083716524036,OPERATIONAL,+62 361 234130,indonesian_restaurant,"indonesian_restaurant, restaurant, food",4.5,1346,PRICE_LEVEL_INEXPENSIVE,"Very tasty sate at Sate Plecing. The meat was fresh and tender, very flavourful covered in the tomato sauce. We also tried the babi goreng sambal matah and oh my it was insanely good. That is a must try! Check out our channel for a full review of our experience: Hungry Two Travel.","Delicious satay, great service, cheap local price. Get their satay with sweet sauce, and their satay with spicy chili sauce. Each order is 10 pieces. Try the babi goreng sambal matah as well. Basically fried pork with a spicy garlic onion chili garnish","The food was okay. My order sate sumsum sapi plecing, the pieces are big and sauce was hot for me but then I put on soy sauce and the taste become even better. Sapi soup was good for me light and not too salty. Portion of the rice good. Orange as my drink was also good.
Generous portion at affordable price.
The place is shady but was not clean enough.
The service was good and quick.
Recommended!","We ordered
- Paket B Rp. 49.000 taste 4/5
- Sate Samcan Plecing Rp. 35.000 taste 3.75/5

Above price exclude service charge 5% and vat 10%","Loveee the sate plecing and matah! The meat is soft and tender, the plecing is not too hot and not too sweet either. The matah is great since they're using coconut oil! The service is fast and clean."
ChIJ1086g6JB0i0RVTylv8msKfw,Nelu by STUJA,-8.6735372,115.24648710000001,"Jl. Hang Tuah No.45, Sanur Kaja, Denpasar Selatan, Kota Denpasar, Bali 28462, Indonesia",https://maps.google.com/?cid=18170244154106657877,OPERATIONAL,+62 877-6588-6800,cafe,"cafe, food",4.9,202,,"The newly opened café and pastry shop around Sanur called @nelubystuja. This place has a quite spacious and cozy indoor and outdoor seatinge and aesthetic looks of industrialism with a touch of tropical vibes. They serve various kinds of breakfast and meals, freshly baked pastry and refreshing beverages by 'siblings' @stujacoffee.",been wanting to go here and decided to try the hazelnut latte 🫶🏼🫶🏼🫶🏼 we also tried the chocolate and greentea soft cookies n it was SO GEWD n not too sweet which is my favorite kind of dessert! definitely come back later,"VERY NICE PLACE FOR HANG OUT!!! The food is very good quality, i love the ice coffee oat and the green potion. the fries also flavorful! i got 2 plates of test menu, a crispy chicken, very nice and unique. can't wait for this menu launching soon. I'll definetely come here and order their new menu for real!!🫶🏼🫶🏼🫶🏼🫶🏼🫶🏼🫶🏼","Americano Lemonade : it's refreshing taste of Americano. Beware as it has potent laxative effect.

Salak pie : unique taste and u can taste the snake fruit.

Indoor venue is pretty limited, you may need to sit outdoor (smoking area and Balinese sun might not be friendly)

Park also confusing, they need to put Nelu park area signage so people can make a turn to the park area at the back.","New Stuja is here!!! After tried the Pantai one. This is the second time I came here.
The coffee as always, good. But I might think they use different croissant as I like this type more the Kerobokan’s.
They have a outdoor choice and it’s not really hot either in a midday.
Some menu are different here, like they don’t have my favorit Kopi 28 but still have Americano for the excuse to come.
Cheers!"
ChIJbWnrj1tA0i0R4iz_n5IM43k,Starbucks Plaza Renon,-8.6732678,115.24439500000001,"Jl. Raya Puputan No.210, Panjer, Denpasar Selatan, Kota Denpasar, Bali 80239, Indonesia",https://maps.google.com/?cid=8782877522191658210,OPERATIONAL,+62 361 8421233,coffee_shop,"coffee_shop, cafe, store, food",4.5,1199,PRICE_LEVEL_MODERATE,"i was served by james, such a wonderful service, he got a good vibes and bring smile to everyone!","I often come here, just to sit, relax while drinking  and get some cakes with my family… nice place","I wish the barista more cheerful a little bit. I felt like I owe her a favor by ordering a basic off the menu drink.

Really like the outdoor seating overlooking the greenery, with deep overhang to keep us in the shade. Nice breeze.","The croissant was Ok. Coffee was good.
Surprising to see no chicken options in food. It was either beef or fish.","One of my fave Starbuck in the city. Room and space lay out are simple, outdoor seats utilize the plaza terrace, with the green view of the surroundings."
