id,name,latitude,longitude,address,url,status,phone,primary-type,types,rating,rating-count,price-level,review 1,review 2,review 3,review 4,review 5
ChIJQ32eN05F0i0RaT32Ay5czZk,Rapture Surfcamp Padang Bali,-8.8159215,115.1149759,"Jl. Labuansait Jl. Buana Sari, Pecatu, Kec. Kuta Sel., Kabupaten Badung, Bali 80361, Indonesia",https://maps.google.com/?cid=11082615610733378921,OPERATIONAL,+62 813-3757-8261,,"resort_hotel, hotel, lodging",4.6,238,,"Stayed here for 5 days in May as a solo traveler. The rooms were super clean, comfortable and cool (with AC). The staff were all very helpful and friendly. The pool and social areas are nice and well kept and the food was delicious (especially the banana pancakes for breakfast).
The surf spots varied each day, and as a beginner were suitable to my level. The surf instructors were keen to teach, their English was good and they were easy to get on with. The equipment was of good quality. The lesson did seem a little expensive for Bali prices (40 euros each) but I did feel as if I improved my surfing even in the short amount of time I was there.
The location is excellent - a short walk or scooter to restaurants/ bars and quick drive to the beach.
Special shout out to the Yoga instructor called Noa - her classes were incredible and she really put time and effort into personalizing them for each group.","I’ve stayed here for ten days in march as a solo traveller and had a great time! The service was amazing. I booked the private surf shack, which had its own outdoor bathroom, an AC and a little safe for personal belongings. The staff cleaned the shack everyday, including the outdoor bathroom, which is pretty nice in my opinion.
The kitchen ladies never disappointed me. Food was amazing, they knew what they were doing👌🏼
If something in your room wouldn’t work properly, you could just tell the staff and they took care of the problem as fast as they could.
Surf lessons were a lot of fun also. Just make sure to reapply a lot of sunscreen every break. ( I learned the hard way🥴) The only point of criticism for me is that some of the surf instructors (only a few) couldn’t answer your questions properly, because they couldn’t speak English that well.
All in all I had an amazing time and met
amazing people. Hope I will find my way back one day!","I stayed at Rapture Padang for one month in the dorm, and it was amazing. I came to Bali having never surfed before, and I left with my own board and being able to surf Uluwatu. Everyone at the camp from the interns, staff and instructors provided a really positive experience to the point where I now call them friends. The rooms were always clean and are very well maintained. Furthermore, the location of Padang is perfect! It is near all of the popular cafes and beaches but still tucked away to provide a quite evening for good sleep. I can not recommend a better place to meet amazing people and learn how to surf!","Padang camp was amazing for location/surf/staff. Everyone is super friendly and goes above for your needs. Food is great and the kitchen staff are so lovely. Surf coaches do a great job explaining surf and making you feel comfortable in the water. For more hands on experience/teaching the lessons are definitely worth the extra money. Camp is beautiful and a fun place to hangout. Thanks to Thiago, lil, Fabio, Leo and all the interns for the best stay","Nice camp for a holiday to meet nice people.

Unfortunately from a surfing point of view things could be much better.

Theory is almoust never taught, apart from surfing sessions (around 3 hours per day)
There is not much other activity where you can improve your surfing skills apart the daily session in the ocean.

Surfing board is normally paid apart at price a bit more expensive than the avg in Bali, but sometimes you cannot find the board of your size.

They accept just cash for all the payment, which is a bit ridiculous considering they charge prices way higher than local prices.
They offered a 10% discount in exchange for a 5 star review.

Overall a nice camp with nice people, but could be much better managed in my opinion."
ChIJ3TsE0EpF0i0RAKyafzytqI8,Sushi ulu wasabi,-8.8184832,115.1154344,"Jalan Labuansait, Kuta Selatan, Pecatu, Kuta Selatan, Pecatu, Kec. Kuta Sel., Kabupaten Badung, Bali 80361, Indonesia",https://maps.google.com/?cid=10351714218861571072,OPERATIONAL,+62 815-4740-4330,sushi_restaurant,"sushi_restaurant, cafe, japanese_restaurant, restaurant, food",4.4,348,PRICE_LEVEL_MODERATE,"My favorite Japanese restaurant in the area!  The fish is always fresh, the ingredients are top notch, hygiene is good, the ratio of fish and rice is perfect, the size of the pieces and the size of the portions are also good.  The price is fair and the food is very good.  My husband and I always order the same things: 1 promo, 2 cryminson, 2 beigel, 2 philadelphias (9 rolls for 2 people is plenty of food).  If you want to eat japanese food in Uluwatu/Padang I highly recommend this restaurant and the dishes we ordered!","Great sushi and sashimi!! Fresh and good quality. I came twice in last 2 days 😊 this place is honestly great, definitely try it out. I came after just google searching the closest sushi restaurant and I’m really glad I did. Did not disappoint. Good prices too and lovely staff",Amazing sushi and atmosphere. We were with the four of us and we had very tasteful sushi. The sushi was not ice cold but very nice temperature so you can enjoy the full rich taste of the sushi. Even vegetarian sushi options. Amazing place.,Best place in Bali for sushi 🍣 super affordable and delicious fresh sushi. Have eaten here many many times and it’s always amazing. So many good choices and varieties to choose from too. Don’t miss out on this absolute gem 💎,The best sushi in bukit! Fish is super fresh. It is not iconic restaurant but the taste worth it! Stuff is super friendly 🤍
ChIJ9VX_U0pF0i0RSveOXVKafJk,Rambo Homestay,-8.816328,115.11514899999999,"54M8+F36, Pecatu, South Kuta, Badung Regency, Bali 80361, Indonesia",https://maps.google.com/?cid=11059884463462741834,OPERATIONAL,+62 878-6062-0023,guest_house,"guest_house, lodging",4.2,85,,"Super nice rooms, very clean And quiet location.
The staff were very sweet And met each of our needs.
If you are coming to uluwatu, i would recommend it because it’s definitely worth the price as well.","Very pleasant, large airy rooms. Great for the price","The pictures looked lovely - our room was not. The mattresses was mouldy so was the pillows. There was also old blood, a worm in the shower and pretty dirty.
Maybe do a deep clean every now and again and change the pillow and mattresses.
It was fine for two days but won’t come back and won’t recommend. 😞","Had a great 8 day stay in the thatched double room on the bottom floor. I looked around at some of the other homestays in Uluwatu and this one was the best in the area. Tucked away on a side street away with lots of plants and greenery; away from the main street noise but walking distance to some excellent restaurants and shops. The staff is really friendly. I had my own little porch with a washing line and rack, chairs and table, with some small plants in front so it felt private. The room was basic but came with a lamp, fan, mosquito net, plenty of outlets and space to store my things. There is a small but nice pool refreshing on a hot day. The only drawback is that the bathroom is shared with the upper floor and the water would cut out sometimes so I'd have to wait to take a shower. Also when I was there there was construction happening next door literally 10 meters away from my room so it was noisy starting at about 7am. It didn't bother me too much as I'm an early riser. The rooms on the other side didn't look as inviting but I recommend the bamboo rooms. Excellent value for money.","The price was good, the small pool was nice. We had the impression, that the owners are part of the taxi mafia, because we couldn't find a grab. During the stay they asked us several times for a expensive transport. We did not want one and told them. They knew when our flight was and when we checked out, a taxi appeared in front of the house and all the grabs were afraid to stop."
ChIJjQSEt-pb0i0Rtd6rvIonUSg,Road Trip Eatery,-8.8180672,115.11513550000001,"Jl. Labuansait, Bandung, Kec. Kuta Sel., Kabupaten Badung, Bali 80361, Indonesia",https://maps.google.com/?cid=2905146711455030965,OPERATIONAL,+62 813-3904-4003,restaurant,"restaurant, coffee_shop, cafe, store, food",4.8,132,,"We just happened to be staying across the road from this restaurant and went there for breakfast on our first day. It was so amazing that we went back 4 more times for breakfast, lunch, and dinner! All of the food is amazing; there are endless gluten free and vegan options and everything is healthy while still being SO delicious. The guava cheesecake is a must try!! Also special shoutout to Hanan and Karik for being so welcoming, friendly, and helpful with menu suggestions. We will definitely be back!!","The best food in Uluwatu is at Road Trip Eatery. We came to Uluwatu for a couple weeks and tried many restaurants. Most weren’t great and not many healthy. Once I found Road Trip I was hooked. We went back many times and I’ve eaten breakfast, lunch and dinner there.

There is a full breakfast menu, as well as a coffee bar, lunch menu and dinner menu. Perfect place for a family or if you’re going to meet up with a bunch of your friends. They have music weekly and I was able to see two performers while I was in Uluwatu.

My daughter loved the Mac & Cheese, Breakfast Burrito, Lasagna, Dragon fruit bowl and some of my favorites are the Golden Milk Latte, Vegan Lasagna, French Toast aer Potato Samosa dish. Everything we tried was amazing and writing this review is making me crave their food!!

Looking forward to traveling back to Bali and enjoying more food when I return.","The best smoothie bowl we had traveling 2 months around.. in this place you can really enjoy and feel the fruit and vegetable potential and incredible flavor.
You can feel there’s a lot of research behind, everything was amazing.
Thank you so much for this fantastic experience 🙏🏻","I just had one of the best vegan savory breakfasts in Bali. Fresh, big portion, I could feel it’s made with love and care 😇 And the personnel is very sweet, thank you!","i’m not sure why there isn’t a line out the door for this place but WOW! the food is incredible. so clean, made with intention and love. so delicious and great portions and variety options!!! i will come here again and again and again! service was great. amazing atmosphere and delicious desserts. 🧡"
ChIJheQi4KtF0i0Rwz85dVT94GU,Warung D’Buchu Restaurant,-8.814368199999999,115.11602649999999,"Jl. Buana Sari, Pecatu, Kec. Kuta Sel., Kabupaten Badung, Bali 80361, Indonesia",https://maps.google.com/?cid=7341145931799674819,OPERATIONAL,+62 813-3714-1300,restaurant,"restaurant, food",4.8,141,,I loved this restaurant. We had the grilled calamari and the grilled fish and as drinks the coconuts. The food was amazingly delicious and the staff was very friendly and smily. The prices are acceptable and not that expensive in comparison to other Uluwatu Restaurants. I would recommend this restaurant. One suggestion from my side: they may improve a little bit the quantity of the dishes ( more rice and mire vegetables would be great),"Seriously delicious, as another reviewer wrote! There are four options on the menu: ribs, chicken, fish, squid with rice or french fries. We had the chicken and ribs and it was one of the best meals we had on our holidays. Yogi is supernice. The portions are rather small, but that’s the perfect excuse to keep on ordering! Recommended","This is a peaceful restaurant located in a secluded and quiet place.  This restaurant specializes in grill dishes.  Chicken, Grilled Squid, Grilled Fish, and BBQ Pork Ribs are all delicious and reasonably priced.  All the staff are friendly, the food is delicious, and the three dogs in the restaurant, Shio, Rocket, and Buntung, are nice and pretty.  I visited the Warung D’Buchu twice during my two days stay.  I will definitely come back next time !  Thank you for everything.","I order pork ribs, the meat is so tender and easy to cut. I personally love the matah sambal, it's very different with the other matah that I taste before, it's so fresh and not so spicy (pretty good for me that not really like spicy food). The price is very reasonable, worth the money, and they have dogs around (Shio and Rocket is my favourite).

The only downside is just the serving time, it's not that long but it takes longer time than other pork ribs place, so we're waiting while playing with the dogs hehe. But the service is excellent.","robby and his family are cooking some of the most delicious food i’ve eaten ever. cannot recommend enough. currently in their compound (until they open the new resto at the end of the month), the place is not super easy to find but it’s just behind where the pin shows on google maps. looking forward to another visit!"
ChIJ0RdSyUpF0i0RPVeDf9CR4lA,De Olas bali,-8.8184195,115.11563199999999,"54J8+J7J, Jl. Labuansait, Pecatu, Kec. Kuta Sel., Kabupaten Badung, Bali 80361, Indonesia",https://maps.google.com/?cid=5828381192449382205,OPERATIONAL,,private_guest_room,"private_guest_room, lodging",4.3,56,,"Great location - a true hidden gem in Uluwatu! Amazing staff who were super helpful, great rooms that were cleaned every day. So worth the price! It was under construction during my stay, so soon they’ll have a pool. I truly recommend this great homestay.","The Location of this Homestay is really central. Unfortunately the rest of my experience here was not as perfect: the rooms are big and spacious but mine had a lot of black mold spots on the ceiling and the walls. Plus there was construction work going on all day which did not really produce a welcoming atmosphere. There is no real garden, it’s rather a little lawn with plants through which you walk to your room and that’s it. Overall, with no garden area to hang out and no pool plus rooms that have long seen the better half of their existence this place is way overpriced. There is definitely better value in this price range in the area.","Very nice, clean and quiet. The staff is very nice also. The location is equally great. I recommend !","We had an amazing time at olas homestay!!! I stayed with my girlfriend and 4 other friends and we all enjoy it so much! Putu and the rest of the staff re awsome, always caring about us having the best time. The rooms re huge and very very comfortable, and as soon as you go for your brekky they re already making the room. Te location can't be better, if you Wanna surf at the points of the bukit península is just the perfect spot. Thank you so much for everything, we re defently gonna come back!","Pros:
- The room was big and cozy. Clean and comfortable.
- The bathroom was large and had walls separating the shower from the sink and the toilet. The shower was especially nice with good water pressure.
- There was a safe, a lockable closet, and the bathroom area could be locked up as well.
- Plenty of lighting options inside the room.
- Nice seating areas outside every room.

Cons:
- The AC dripped water. The staff did supply a mop bucket and towel to contain it. They also called a repairman, but he didn’t come before we checked out. Other than the drip, the AC worked great, so it was only a small nuisance.
- Slightly pricey considering it doesn’t include breakfast, have a pool, or a fridge. Also only accepts cash."
ChIJPb1NfoxF0i0R1WvrdQyVhHM,Optima Villas Bali,-8.8135715,115.11881860000001,"Jl. Amerta Sari Pecatu, Pecatu, Kec. Kuta Sel., Kabupaten Badung, Bali 80361, Indonesia",https://maps.google.com/?cid=8323941892038028245,OPERATIONAL,+62 887-3539-851,hotel,"hotel, lodging",4.8,35,,"Fabulous Stay at Optima Villas - Perfect for a Girls' Getaway!

We rented out the 2 villas at Optima Villas for a girlfriend’s get-together, and it was the perfect setup. The landscaped outdoor space and the large pools were impressive, and we loved the airy, beautifully decorated rooms.  Villas are very well maintained inside out and communications with the manager were easy. Thoughtful details like espresso machines with pods and luxurious toiletries made our stay even more enjoyable!

The location is both quiet and picturesque, yet just a 5-10 minute walk from trendy restaurants, cafes, and activity spots. The manager also connected us with a fantastic driver for our excursions further afield and trips to the airport. This was our first visit to Bingin, and hopefully not our last!","The villa has literally the best beds and pillows out of all my travels. So comfortable, quiet, and easy to get around via Gojek. The layout is suitable for a family or two couples. The pool was divine. A great place to just chill.","The pool was so great - water was the perfect temperature, large and deep enough to swim but also sitting areas with jets to just laze in the water and enjoy. Host can set you up with a driver to take you anywhere you want for the whole day or just use Gojek for a quick zip to the main Uluwatu drag where all the hip eating/shopping places are, or the beach or the spa or the temple or the padel court. Fabulous stay, thank you!","Peaceful location yet so close to Bingin. What a luxury to find a villa with a large 10m pool and deep to boot! A swimmable pool for a 2 bedroom is rare, most are mere dipping pools. Lovely garden setting to gather with friends with the sound of cicadas as a background at night. Perfect for a family or two couples. What a gem of a pair of villas. I didn't realize they could be combined to be 4 rooms. I will definitely book again with friends. No scooter noise, no roosters, same great restaurants. #binginfave","Wonderful stay at Optima Villa. Superb location, well equipped 2x large bedrooms and a beautiful pool set in a decked courtyard. Perfect for chilling with friends or for a pool party.  Fully recommend and I will certainly look to return."
ChIJkw1dj0tF0i0R23fv2qYM704,3D Home Stay,-8.8201589,115.1177113,"Jl. Labuansait No.52, Pecatu, Kec. Kuta Sel., Kabupaten Badung, Bali 80361, Indonesia",https://maps.google.com/?cid=5687778765169457115,OPERATIONAL,+62 852-3703-4043,private_guest_room,"private_guest_room, lodging, restaurant, food",4.6,80,,"This place is safe the people who work here take pride an great care of the place. It has plenty of space to keep to your own an feel private. Great central location to get around the Padang, Uluwatu area. Ocean view with a nice pool definitely makes for the experience. Everyone is so nice the feel here excellent very calm quite environment. Nice green grass an beautiful trees around. I stayed here for three weeks an enjoyed every day here. I would highly recommend this place to another person","The price is cheap and the room is so big. It has tv channel, air conditioner, hot water, based on what type of room you choose. The room is clean, and so do the bathroom. They have friendly staffs, the owner is friendly too. They have delicious food too (they do catering if you order for a big parties). In the kitchen, you can cook anything because they have stove and fridge. You can rent scooter here too. They can pick you up or take you to the airport by car (with affordable price). The pool is not too big but it has the best view ever!! Best place to stay around Padang-Padang beach. Wanna come back real soon!","I stayed in 3D for the first time in 2016, then 2017 and now 2022.
Lovely homestay with sweet balinese people.
Positive energy.
Beautiful place with fair prices and very nice people such as Ayan, Kade, Noman.
Swimming pool is amazing, and make sure to help them with buying Uluwatu tshirts and Noman massage 😃","Really enjoyed our stay here. The family are locals and good spirited hindu's who embrace their culture and honor it's practices with daily rituals and offerings around the property. Good breakfast by the pool side and a little chicken joint restaurant at the entrance to the property that opens at 6PM-10PM most nights... The rooms were clean and the air-con was decent. Huge shower/bathroom areas, fantastic family staff who are happy to help you with motor bike rentals, surf boards, etc.","A very relaxed and convenient place to stay in the Bukit area. Located on the main road, but not too close to any busy areas, so you can enjoy the quietness of the space, all the restaurants and beaches are easily accessible by a few minutes drive by scooter. The family running this homestay is very kind and always made sure I felt very comfortable. You can rent a scooter from them and there’s also a warung where you can try a delicious breakfast with the best banana pancakes in the area."
ChIJ7cKlymRF0i0RkVPjFPorEe8,Lala Homestay Bingin,-8.813970399999999,115.11624119999998,"banjar, 54P8+CF9, Jl. Buana Sari, Pecatu, Kec. Kuta Sel., Kabupaten Badung, Bali 80361, Indonesia",https://maps.google.com/?cid=17226598402761118609,OPERATIONAL,+62 813-3701-5302,guest_house,"guest_house, lodging",4.8,17,,"Nice simple room.
Liked: The room is simple but nice. Bed was a bit noisy but comfortable. They cleaned the room and gave us new towels when we were out, without us having to ask. Area and yard were nice, and it was very quiet at night. Staff were very friendly. 10-15 minute walk to Bingin Beach.
Disliked: The neighbors are doing construction next door with heavy machinery and it’s very loud, we arrived on a Saturday and it was a couple hours from finishing for the day so we went out, and luckily they didn’t work on Sunday so it wasn’t a problem, but all during the week they said they work from 8-5, not sure when the work will end. The water pressure was not good, sometimes it was strong enough to shower but I think if anyone else in the hotel used water at the same time there was no pressure, not a huge deal if you can be patient, but a bit of an inconvenience.",Very welcoming and friendly staff. Love them! The room was very clean and the whole homestay is really nice. You also have a kitchen you can use any time and open space for yoga.,"Friendly staff, clean, simple rooms, good location. Probably still need a scooter but the host gave me a very nice one for a reasonable price. Very happy woth my stay!","Super friendly and helpful people running this place. Clean room, beautiful garden, spacious place to do yoga. I will definitely come back.","LOVED this Homestay, super clean and the owner was always quick to respond to my questions! Location is prime too."
ChIJUUd57NZF0i0RHHxDGVBlviY,Sayulita Tacos & Tequila Bar Uluwatu,-8.8181675,115.11523360000001,"Jl. Labuansait No.47, Pecatu, Kec. Kuta Sel., Kabupaten Badung, Bali 80361, Indonesia",https://maps.google.com/?cid=2791780213711928348,OPERATIONAL,+62 811-3988-895,mexican_restaurant,"mexican_restaurant, bar, store, restaurant, food",4.8,129,,"After two months of backpacking around SE Asia, I was seriously wanting some proper Mexican food. Sayulita Tacos exceeded my expectations! I reserved a table online which was super easy, then once I got there, the atmosphere was super fun and festive. The service is so good, so friendly and great at explaining specials. I started with the mango chili margarita which was sweet, spicy, and strong. Next, I got the chips and salsa as an appetizer which had 3 types of salsa. The corn chips were interesting and tasty, and salsas were perfectly spicy and different. Next I got the taco special, with tuna and shrimp tacos on corn tortillas. They were full of flavor, light, and so yummy, it reminded me of the tacos I have back at home, if not better. Very authentic coastal Mexican food!","A hidden gem in Uluwatu. I recommend the chicken quesadilla, shrimp taco, garlic mushroom taco, and the ceviche. Don't forget to order the churros... it's the highlight of the meal. Mba Mawar is an absolute gem as well. Thank you for the great hospitality. Will definitely come back. With friends.","Really cool place if you want to to chill and hangout with friends. They serve good cocktails and light meals. Ceviche was so fresh and tasty. We had churros for dessert and it taste just right, not too sweet, exactly what we want.",We had a lovely meal here!! Beat tacos weve had - the tuna ones were amazing! Hera was a great waitress was very attentive if we had any questions she was more than willing to answer. The manger was also lovely checking in if everything was okay with our food! Definetly reccomend ❤️,"We went to have some dinner on Taco Tuesday. Although prices are not super cheap, they are quite worth it. We tried different ones and they cook it in the same Mexican style that some street tacos in Mexico. The ceviche was unbelievable, but it was a little bit too pricey."
