id,name,latitude,longitude,address,url,status,phone,primary-type,types,rating,rating-count,price-level,review 1,review 2,review 3,review 4,review 5
ChIJhYIzZq1F0i0Rc5tVK_DHejE,Villa Mola,-8.8134505,115.11771840000002,"Jl. Amerta Sari Pecatu, Pecatu, Kec. Kuta Sel., Kabupaten Badung, Bali 80361, Indonesia",https://maps.google.com/?cid=3565381889350278003,OPERATIONAL,+62 821-3877-6508,,lodging,5,40,,"We stayed 6 nights in this beautiful villa. The location is amazing and it’s close to all the beaches, restaurants and spas.","Had such a beautiful stay here and the staff were lovely the couple times we saw them. Highly recommend staying here, such a modern, clean, cool and perfectly located villa in a quiet safe street. Ample parking for our scooters and we loved the spacious grassed backyard & pool. Thanks for having us! We will be back 🙏🏼","It's a great villa for someone that loves the hustle and bustle of Bali but appreciates being tucked away in a quiet street. There are a few cafés that I liked walking to from the villa. The view from my bedroom was lush and so tranquil (they have black out curtains!!!!) the floor to ceiling windows also gave me some great light upstairs to just chill, read, work online.

There are heaps of good restaurants for breakfast and dinner a few minutes away too, but I loved driving my scooter around to the cliffs and beaches nearby. The owners are very sweet, helpful with suggestions too. Made some friends also since there is a spot or two near the main road where solo travelers can just go and hang in the evenings and meet other travelers and locals.

Anyway I loved my stay, I'd stay again.","One of my best holidays ever. Aside the amazing country Bali is, the stay in Villa Mola made it even more fantastic.
The sunset is amazing and staff has been so kind to us. They helped in renting scooters, taxis and organized our way to the airport.
If you are looking for an option in Bali, this one is perfect. Close to restaurants and beaches, the location is top.
Thank you for the unforgettable memories Villa Mola!",Loved staying at Villa Mola! The drive through nature to the villa was beautiful and the location had several great cafes and restaurants to eat at. The beach was near and the villa itself was beautiful! Some days we just spent hanging out in the Villa making food in their stocked kitchen and having beers by the pool. The beds are big and comfy and you'll wake up to a beautiful sunrise glow in the sky. The floor to ceiling windows are beautiful sunset also.
