id,name,latitude,longitude,address,url,status,phone,primary-type,types,rating,rating-count,price-level,review 1,review 2,review 3,review 4,review 5
ChIJ34MueQY70i0RdDOMdK9DbHg,Air terjun yeh nu,-8.5052468,115.12409029999999,"Jl. Subamia Jl. Ambal Ambal No.Br, Wanasari, Kec. Tabanan, Kabupaten Tabanan, Bali 82115, Indonesia",https://maps.google.com/?cid=8677385002889786228,OPERATIONAL,,tourist_attraction,tourist_attraction,4.7,17,,quite empty and nice but not sth. very special (for me at least),"No tourists, calm wet place.",,,
ChIJN5bH1eg70i0R9ZjR19ZQDCc,Air Terjun Goa Riang,-8.5048031,115.12466390000002,"F4WF+3VF, Jl. Ambal Ambal, Riang Gede, Kec. Penebel, Kabupaten Tabanan, Bali 82115, Indonesia",https://maps.google.com/?cid=2813712750873778421,OPERATIONAL,,tourist_attraction,tourist_attraction,,,,,,,,
ChIJ4WmhMkk70i0RkAl4fug1ZxI,Nayma Glenpa villa,-8.5021322,115.1299474,"Jln.Taman Sari, Subamia, dencarik, Kabupaten Tabanan, Bali 82115, Indonesia",https://maps.google.com/?cid=1326087887954381200,OPERATIONAL,,hotel,"hotel, lodging",5,1,,,,,,
ChIJfWcrRcw70i0Rb9hvIwYBTKE,bakedbypatricia,-8.5019111,115.12979019999999,"F4XH+6WM, Jl. Priyukti Wanasari, Subamia, Kec. Tabanan, Kabupaten Tabanan, Bali 82115, Indonesia",https://maps.google.com/?cid=11622665864212371567,OPERATIONAL,+62 858-2909-8400,private_guest_room,"private_guest_room, lodging",5,1,,,,,,
ChIJRz2mCmM70i0Rk_1BgjLAjpg,Pondok Rita,-8.502352,115.1305842,"Unnamed Road, F4XJ+364, Subamia, Kec. Tabanan, Kabupaten Tabanan, Bali 82115, Indonesia",https://maps.google.com/?cid=10992935063624220051,OPERATIONAL,+62 858-5808-7835,cottage,"cottage, lodging",5,1,,,,,,
ChIJA24r08860i0Rp99WRBcCjh0,Pondok deDuel Subak Diwang,-8.501828399999999,115.1293517,"F4XH+7P9, Jl. Priyukti Wanasari, Subamia, Kec. Tabanan, Kabupaten Tabanan, Bali 82115, Indonesia",https://maps.google.com/?cid=2129641972746870695,OPERATIONAL,,,lodging,4.5,6,,Ok,,,,
ChIJG_RWMxs70i0Rb-_lEodweXE,Warung Pojok “Mek Mira”,-8.5027916,115.12900189999999,"F4WH+VJJ, Wanasari, Tabanan, Tabanan Regency, Bali 82115, Indonesia",https://maps.google.com/?cid=8176690323907800943,OPERATIONAL,,restaurant,"restaurant, food",1,1,,,,,,
ChIJawWgLtA60i0RfnpTPc2wkCY,Warung Mek Erma,-8.5021393,115.13008549999998,"Wanasari, Tabanan, Tabanan Regency, Bali, Indonesia",https://maps.google.com/?cid=2778915365631261310,OPERATIONAL,,restaurant,"restaurant, food",,,,,,,,
ChIJ1Tm9itw70i0RYIBiTDTH4ZM,Warung ghoib,-8.4994353,115.12894469999999,"G42H+47J, Wanasari, Tabanan, Tabanan Regency, Bali 82115, Indonesia",https://maps.google.com/?cid=10656017220769054816,CLOSED_TEMPORARILY,,restaurant,"restaurant, food",5,1,,,,,,
