id,name,latitude,longitude,address,url,status,phone,primary-type,types,rating,rating-count,price-level,review 1,review 2,review 3,review 4,review 5
ChIJq6qqqk5D0i0RIRa2CV7IucQ,"La Berceuse Nusa Dua, Bali",-8.8182969,115.21420869999999,"Jl. Desa Sawangan Jl. Nusa Dua, Benoa, Kec. Kuta Sel., Kabupaten Badung, Bali 80361, Indonesia",https://maps.google.com/?cid=14175581608340756001,OPERATIONAL,+62 361 4771325,resort_hotel,"resort_hotel, hotel, lodging",4.6,397,,"One of the best resort and villa with a reasonable prices. Staff is very friendly even the breakfast is amazing. Also, they have varieties of options in food. Rooms are vintage type and beautiful. It is surrounded by greenery which makes more beautiful.","Quick rundown: Excellent service. Staff is top-notch. No complains about food and menu selection. Rooms could use some updating, but nothing major. Wifi is good. Beds are very comfortable. Location is not great but it's not the worst either. Amenities are definitely above average.","A beautiful resort with the most amazing, helpful staff.
We could not have asked for a nicer place to stay.
There is a free shuttle service to the beach daily, pick up and drop off but if that doesn’t suit it’s only a short taxi ride $6AUD away.
Would highly recommend","Amazing stay. It really was an experience to just be back here 2nd year. The staff are very well trained, probably the best I had ! Miss elva remember me when i came back here. Most of the staff here recognize me and upgraded me from deluxe premier to studio suite just for complimentery.  Beautiful spa and grounds. The room was so beautiful we didn’t want to leave the room itself. I would love to go back here. worth the money you pay. They deserve more then 5 star. very loyal staff with good intention. Not like other place , usually they will force guest to write a review 5 star for their rate but turn out disappointing. In this case i really have to rate this stay 6 star, their service and  INTENTION are pure, i feel So welcome here.Will surely visit here again ! Thank you for everything !
Beautiful beautiful beautiful.","Fantastic stay in a 2 bedrooms villa with a private swimming pool for 4 nights, you will have all the privacy to yourself if there is no neighbour staying next to your villa because the upper room can see across the upper room villa. The bathroom is as big as the bedroom area with huge bath tub, rain shower area, WC and double basins area. However, I don't like the smell of the shower gel, shampoo and the conditioner. I am not sure..maybe they are left too long in the stone bottle.

The breakfast is ala-carte menu. You can choose from the menu of 4. I particularly prefer the local Indonesian style - Fried Rice was good. The restaurant/breakfast area is next to the swimming pool. You can choose to have your breakfast in your villa or at the restaurant.

The location is remote and quiet. But you can easily use the app to book for the Blue Bird taxi to come to pick you or ask the help from the hotel front desk. Please don't try to walk back to the villa at night. It is very dark with no street lights. According to the locals, it is dangerous not because of the crime but it is the snake. Along the way from the main road, there is an abandoned resort project on your left, and there is an ongoing resort project on your right."
ChIJDRmSQI090i0RGhxuiaqKElk,Aman Villas at Nusa Dua,-8.8131724,115.21112219999999,"Jl. Desa Sawangan Jl. Nusa Dua, Benoa, Kec. Kuta Sel., Kabupaten Badung, Bali 80363, Indonesia",https://maps.google.com/?cid=6418344884011146266,OPERATIONAL,+62 361 8468585,hotel,"hotel, lodging",4.6,212,,"We stayed in October for 5 nights. Not our first Aman so we had certain expectations.
The villa was not described as all rooms being totally separate with no internal join - we booked 2 bedrooms for us and our 2 young children. We ended up having to all sleep in one room as it didn't seem safe to have the children sleeping in a room with no connection to ours except by going outdoors by the pool. They should have mentioned this at booking as we gave our children's age.
The room lacked any personality and did not at all feel like an Aman.
Very bare, no local decor, could have been any hotel anywhere.
The villa butler was very attentive - no fault there. The chef was good but only showed us the kids menu the day before we left (?!?).
The best member of staff was the uncle looking after the beach area, he was great with our kids and really helpful. The drive to the beach was not far.
The pool was nice in the villa.
In summary, for the price I wasn't impressed.","First aman and definitely not the last, having your own butler and cook is incredible and the villa was the biggest I've ever seen. Great design in every square metre and it made me not wanting to leave the resort. I just wish it remained the whole Amanusa resort not just the villas but still great.","Villa #1 is the best I have ever stayed at. The service from Eka and Ramli is outstanding, anytime of day they are there for you. The chef Komang is outstanding, he can cook anything (I am a great cook and I was very impressed). The villa itself is gigantic, you can’t hear anything, it’s peaceful and spacious, great for a group getaway, or just as a couple like us. We did a cooking class with Suarni and Derni and I learnt so much, they connected so well.","I have never been to a Aman resort before.  Different level of service then anything I remember.  Attention to detail was amazing.  When we got there they had a ginger drink to refresh.  After we finished they explained the features of the room. That all has been done at other resorts, but these guys make you feel like smart for asking the most repetitious question.  Our room had its own pool! Bigger then most hotel shared pools.  Amanusa - I am not worthy!!",Very lovely hotel. Only stopped for a coffee and look through the shops. All of the staff are extremely friendly. The view and pool also look stunning. Shame to hear that Aman will sell the hotel to Rich Carlton in a couple of months.
ChIJeURQLJFd0i0RrUlZoLjAI54,Door-in House,-8.8204425,115.21134379999998,"Jl. Desa Sawangan Gg. Kloncing No.3, Benoa, Kec. Kuta Sel., Kabupaten Badung, Bali 80361, Indonesia",https://maps.google.com/?cid=11395163381374208429,OPERATIONAL,+62 853-3743-4597,,lodging,5,4,,,,,,
ChIJy46-Gyhd0i0Rryee8bf82vs,Wayan Guest House,-8.8178497,115.21107599999999,"56M6+2C6, Benoa, South Kuta, Badung Regency, Bali 80361, Indonesia",https://maps.google.com/?cid=18148095515405723567,OPERATIONAL,,private_guest_room,"private_guest_room, lodging",5,1,,,,,,
ChIJz-c_QE9d0i0RxWxFmowpwsk,Aurora Villa Nusa Dua by The Lavana,-8.819341099999999,115.2101331,"Benoa, South Kuta, Badung Regency, Bali 80361, Indonesia",https://maps.google.com/?cid=14538228230965783749,OPERATIONAL,+62 896-8000-0788,hotel,"hotel, lodging",5,1,,This villa has a beautiful decoration. Clean and spacious room. Pool are good. This is so good if you stay for daily or monthly.  The location also great. Nice villa. If you want to more discount contact their official sales 085745388678,,,,
ChIJ6fxPNgBd0i0Rw1WmgIBUfmU,Mana Villas,-8.8195793,115.20994069999999,"56J5+5X8, Jl. Pura Segara, Benoa, Kec. Kuta Sel., Kabupaten Badung, Bali 80363, Indonesia",https://maps.google.com/?cid=7313375755787195843,OPERATIONAL,,hotel,"hotel, lodging",3,2,,"STAY AWAY, DON'T WASTE YOUR MONEY OR TIME....
Stayed here five years ago, enjoyed the stay, came back expecting the same but was extremely run down, i understand covid had a play in that, but the pictures online we're pre covid shots. We booked for 10 nights,  couldn't do it.... so after 2 nights am MOVING OUT!!
The smell of mould in the bedrooms and showers was so over whelming,  the pots and pans we're disgusting and would not cook in them, the tv in the bedrooms didn't work, tv in lounge was not much better, i could go on and on and just letting you know, when we go on holidays we like to walk into clean, cared for accommodation,  you won't find that here.  VERY VERY DISAPPOINTED.
Will never be back!!",,,,
ChIJE3plUNJd0i0RsKqhxHKUqyE,Rent car and Scooter Nusadua,-8.816560899999999,115.2074087,"56M5+G2R, Jl. Sawangan Residence, Benoa, Kec. Kuta Sel., Kabupaten Badung, Bali 80361, Indonesia",https://maps.google.com/?cid=2426196044915255984,OPERATIONAL,,car_rental,car_rental,5,2,,,,,,
ChIJgbkONdNd0i0RUZgbaKdTCaM,The Lavana Estasia Villa Nusa Dua,-8.8194234,115.2100547,"Jl. Pura Segara, Benoa, Kec. Kuta Sel., Bali, 80363, Indonesia",https://maps.google.com/?cid=11748013081443932241,OPERATIONAL,+62 896-8000-0788,hotel,"hotel, lodging",,,,,,,,
ChIJDVVU98xd0i0RmuQxA56rmXA,Serenity Villa Nusa Dua by The Lavana,-8.8194347,115.21011469999999,"Jl. Pura Segara, Benoa, Kec. Kuta Sel., Kabupaten Badung, Bali 80361, Indonesia",https://maps.google.com/?cid=8113704898831443098,OPERATIONAL,+62 896-8000-0788,hotel,"hotel, lodging",5,5,,"Great location ! Nice and comfortable bed , love it that it is in a complex with security . The staff is very helpful","Perfect place to stay. Clean, comfy 👍","Modern villa, good location , perfect for staycation",Very nice place to stay in Bali,Nice and good spa
ChIJu5ZdQohd0i0Ren3dfIiD6_0,Terrace Garden Restaurant,-8.818951199999999,115.20973599999998,"56J5+CV9 Dancing Villas, Jl. Pura Segara, Benoa, Kec. Kuta Sel., Kabupaten Badung, Bali 80361, Indonesia",https://maps.google.com/?cid=18296862533356453242,OPERATIONAL,,restaurant,"restaurant, food",1,1,,,,,,
ChIJ765g2gJF0i0RKAWRJwH_T-E,Swarnadwipa Villa,-8.8187094,115.209605,"Dancing Garden Villas, Jl. Pura Segara No.10 block E, Benoa, Kec. Kuta Sel., Kabupaten Badung, Bali 80361, Indonesia",https://maps.google.com/?cid=16235475562117793064,OPERATIONAL,+62 813-3729-7909,extended_stay_hotel,"extended_stay_hotel, hotel, lodging",,,,,,,,
ChIJo32ttHpd0i0RkkSEnEvfS9A,Akatara Villa Nusa Dua by The Lavana,-8.8191072,115.20977259999998,"Jl. Desa Sawangan Jl. Nusa Dua No.8, Benoa, Kec. Kuta Sel., Kabupaten Badung, Bali 80361, Indonesia",https://maps.google.com/?cid=15009335698983765138,OPERATIONAL,+62 896-8000-0788,hotel,"hotel, lodging",5,3,,"Bery nice villa , clean and spacious room. Pool also greaf . Villa with full facility. If you want to more discount contact their official sales 085745388678",,,,
ChIJoYiU_hpd0i0R6n5gUWt3p-g,Made home,-8.817776,115.2110546,"Jl. Desa Sawangan Jl. Nusa Dua, Benoa, Kec. Kuta Sel., Kabupaten Badung, Bali 80368, Indonesia",https://maps.google.com/?cid=16764499440720445162,OPERATIONAL,+62 812-3906-4669,guest_house,"guest_house, lodging",,,,,,,,
ChIJtXyD0Bpd0i0R2Jx6Q714WGo,Benedict Villa by The Lavana,-8.8197627,115.21022829999998,"Jl. Pura Segara, Benoa, Kec. Kuta Sel., Kabupaten Badung, Bali 80361, Indonesia",https://maps.google.com/?cid=7663007520247160024,OPERATIONAL,+62 896-8000-0788,hotel,"hotel, lodging",,,,,,,,
ChIJIanK04pd0i0R_LX31CK04eQ,Armada Villa by The Lavana,-8.8191553,115.2098545,"Jl. Pura Segara, Benoa, Kec. Kuta Sel., Kabupaten Badung, Bali 80361, Indonesia",https://maps.google.com/?cid=16492661372102358524,OPERATIONAL,+62 896-8000-0788,hotel,"hotel, lodging",4,1,,,,,,
ChIJG6ijgTtd0i0R0kN6p3mVpao,Nusa Jungle vip,-8.820386599999999,115.212198,"Gg. Bangbang Desa Gg tiying Tutul, Sawangan, Benoa, Kec. Kuta Sel., Kabupaten Badung, Bali 80361, Indonesia",https://maps.google.com/?cid=12296398707338396626,OPERATIONAL,,,lodging,5,1,,,,,,
ChIJnw6-M1Jd0i0RNkatmgTnCOQ,Bang Bang Street Kost,-8.820407399999999,115.2121854,"Jl. Desa Sawangan No.5, Benoa, Kec. Kuta Sel., Kabupaten Badung, Bali 80361, Indonesia",https://maps.google.com/?cid=16431637247422187062,OPERATIONAL,,private_guest_room,"private_guest_room, lodging",,,,,,,,
ChIJ15tZxLRd0i0RLPuUHTVU7ZQ,Calm Woods Villa Near Pandawa Beach,-8.818440599999999,115.20658859999999,"Jl. Sawangan Residence No.80361, Benoa, Kec. Kuta Sel., Bali, 80361, Indonesia",https://maps.google.com/?cid=10731326074200062764,OPERATIONAL,+62 21 29707601,hotel,"hotel, lodging",,,,,,,,
ChIJweCzl_Fd0i0RQUqGaA2B3uA,Serene Haven Villa with Pool Near Nusa Dua Beach,-8.8181602,115.2072752,"Jalan Sawangan Residence No.80361 Benoa Hotel near Transmisi Inewstv Bali 1,9 km, Benoa, Kec. Kuta Sel., Kabupaten Badung, Bali 80361, Indonesia",https://maps.google.com/?cid=16203530403913812545,OPERATIONAL,+62 21 29707601,hotel,"hotel, lodging",,,,,,,,
ChIJA8EgwS9d0i0RgdGdzgMC0VU,Warung Jaba,-8.814643799999999,115.21068779999999,"Unnamed Road, 56P6+47W, Benoa, Kec. Kuta Sel., Kabupaten Badung, Bali 80361, Indonesia",https://maps.google.com/?cid=6183725978731008385,OPERATIONAL,,cafe,"cafe, food",4.7,9,,Wr jaba is most beautiful places and the cervice is excellent 👍,,,,
