id,name,latitude,longitude,address,url,status,phone,primary-type,types,rating,rating-count,price-level,review 1,review 2,review 3,review 4,review 5
ChIJLYchck490i0RpaZqMIrSYyM,AA Juicery & Café,-8.4902011,115.26996849999999,"G759+WX8, Jl. Tirta Tawar, Petulu, Kecamatan Ubud, Kabupaten Gianyar, Bali 80571, Indonesia",https://maps.google.com/?cid=2550113304981448357,OPERATIONAL,+62 361 4792270,indonesian_restaurant,"thai_restaurant, vegan_restaurant, vegetarian_restaurant, indonesian_restaurant, restaurant, food",4.3,241,PRICE_LEVEL_INEXPENSIVE,"I have been getting f my juices delivered from AA Juicery Cafe for 4 years now and they never disappoint! Very fresh , reasonable price and wonderful service. Love this place and definitely recommend you going to eat there or for delivery. Thank you AA Juicery","We had breakfast here and it was so delicious! Let me start by saying that the wait time is a bit longer than you might be used to in Europe or at another restaurant. But the dishes here are made with so much dedication that the wait is well worth it. You are surrounded by nature, the weather is good and the wait will be rewarded.

On the menu, they have several fresh smoothies, smoothie bowls (you can choose your own toppings), as well as toast with eggs (boiled or other kind). I chose fresh fruit plate with mango smoothie, toast with boiled eggs, coffee and banana pancakes. I didn't actually need to order the latter, I already had enough of the other dishes.

I definitely recommend going here!","Great local restaurant. The food was so delicious. We had the egg breakfast served with toast alongside the dragon fruit bowl.
Excellent service. I’d highly recommended!","We were staying nearby so had several breakfasts here. The smoothie bowls are very good (choice of 5 toppings!), a good size and less expensive than several other places in the neighbourhood. The fruit plate is beautiful and tasty, the jamu was a treat and their omelette is good too. Thy make goodBali coffee and it is serve in the most beautiful ceramic tea pots. Just a lovely place with nice people.","You've got so many options for smoothie bowls here in Ubud. AA is the best quality, low-price option I've found yet. 40k for a substantial bowl and you get to choose the toppings. Ingredients seem clean and fresh.

The cafe itself is a great place to work from also. The wifi is solid (30mbs) and there is a nice seating area upstairs. I had it all to myself. The only downside is the area is very loud - lots of construction, chatter, and a bike wash place across the street. I've got headphones in and that seems to do the trick.

Will definitely be back."
ChIJFUBbxE090i0RKHlBZPmNU3I,Pondok mekar villas,-8.4886508,115.26991840000001,"No., Jl. Tirta Tawar No.6, Petulu, Kecamatan Ubud, Kabupaten Gianyar, Bali 80571, Indonesia",https://maps.google.com/?cid=8238084245659154728,OPERATIONAL,+62 819-9971-9213,lodging,lodging,4.6,35,,"The villa and location were great. The place looks like the pics and we had a comfortable stay. The rooms, AC and shower were all great. The area is quiet and has a convenience store as well as a restaurant right in front. The pool was clean and the living area was very comfortable. We only stayed a night but I am sure we will be back. The one and only drawback to the villa are the bedroom doors. Guys seriously need a proper door without the slats. Every single sound from bedroom carried over to the other. Just saying… need some soundproofing there :)  I live in Bali and see as well as stay in many places but this villa is a great stay.","This place is very good, the room facilities are complete, the bed also very comfortable and clean, for design of the swimming pool is aesthetic with green garden, in this place you can order breakfast and enjoy on the restaurant located in front of the villa.","We reserved Villa Orchard n booked this place in quite short notice, but got it with a reasonable price. The moment we arrived at the location, all the hectic traffics below were disappeared from our mind. The staffs really friendly and nice. Our villa is excellent,clean and well prepared. Our villa had 5 stars' hotel equipments and amenities. We fell in love in the first sight. We enjoy our private swimming pool and love the vibe this place gave. Overall this is a outstanding place to stay.","Wr stayed for one night here, wonderful private pool, and kitchen, still i had a feeling that they need a proper clean up in the bathroom.","I absolutely loved staying here! The villa was clean, beautifully decorated, and I felt at home once I arrived! The pool is amazing and a great place to relax, read a book and have a dip when you get too hot! A family or a group of friends would accommodate well here. It was just me and a friend and we loved having so much space to ourselves! The outdoor bath was a great feature as well! Even though there is a concierge, I would recommend you to pre organise with a driver to collect and drop you off as it’s a little far from the town centre and taxis are not easy to come by unless organised!   Keep an eye out for this place as it can be easily missed at night, we used the cafe across the road as a ‘marker’. Would definitely book here again!"
ChIJU4ePvE090i0R019aWat1tjE,Made Becik Waroeng,-8.491547599999999,115.27029710000001,"Jl. Tirta Tawar No.6, Petulu, Kecamatan Ubud, Kabupaten Gianyar, Bali 80571, Indonesia",https://maps.google.com/?cid=3582179932418760659,OPERATIONAL,+62 361 9000576,indonesian_restaurant,"barbecue_restaurant, indonesian_restaurant, restaurant, food",4.6,367,PRICE_LEVEL_INEXPENSIVE,"Fantastic dining experience.

Fantastic value for money. Food was great as seen in the photos. Would definitely return in future!",We had the best dinner here. The food was amazing and the staff were adorable. We even got to pat the dogs. Highly recommend. Beautiful view over the rice fields. Xx,"We stayed nearby and took delivery from here twice.
Food is delicious and super affordable. All wrapped with ecofriendly materials but didn't compromise on the presentation at all.
The owner is very nice with great personality.","So far best restaurant we tried in Bali (after 1 week). Amazing tasty food, please try the natural juice. We had watermelon one, it’s to die for.
The atmosphere is great with simple people.","A highlight of our stay in Ubud! Lovely staff and the most amazing home cooked meals - the pork ribs are a must! I wish we were staying longer just so that I could go back! Great prices, we got so much food for $17k."
ChIJiw6-JwA90i0RZvLdiFjKSCk,Dakshin by UDUPI UBUD (Restaurant),-8.4873273,115.2766334,"Jl. Raya Gentong No.123, Tegallalang, Kec. Tegallalang, Kabupaten Gianyar, Bali 80552, Indonesia",https://maps.google.com/?cid=2974850035480392294,OPERATIONAL,+62 811-2028-294,restaurant,"restaurant, food",4.7,67,,"We stayed in Ubud for four days and went twice to this place. Ordered dosa, chola bhatura, plain dosa and it’s really tasty and liked it. My daughter ordered fish and chips and was thinking if it will be good or not. But I was surprised that’s it looks and taste great.
Masala tea was awesome.
It’s hardly 10 mins from Ubud centre and definitely worth a visit.","Very good south Indian food ... last 3 days in Bali we were craving for Dosa,Idli,Wada.... we got it right here in center of Bali... Kannada,Tamil speaking staff and Manager made it more Homely away from my Bharat.
VANDE MATARAM","Ordering using the application instead of helping quickly instead of waiting 1.5 hours it's not ready yet. It's a pity if the management is like this, it costs 9,000, waiting for the order for 1.5 hours, it's not ready, sorry for the online driver who got the order there......it's really not helpful, if it's not ready, make it  I just want to close the application. I'm sorry for the delivery order as a driver. If it takes a very long time to serve it, I'm a hungry customer and I'm also waiting.",Personal attention by Mr Sridhar and Mr Nandan. No exaggeration- Best Indian food we had in our last 6 days - Quality and quantity. A must visit place if you are in Ubud area.,The best Indian food in Bali. A huge relief from all those pretentious Indian restaurants. A must visit place just for food. It’s a makeshift place as of now. But now it’s going to be just worth for great food
ChIJFzZKI4M90i0R7GUTa3KXNO0,The grill ubud,-8.489801,115.2698771,"Jl. Tirta Tawar, Petulu, Kecamatan Ubud, Kabupaten Gianyar, Bali 80571, Indonesia",https://maps.google.com/?cid=17092453003456374252,OPERATIONAL,+62 819-3558-4337,bar,"bar, restaurant, food",4.6,198,,"We stopped here for lunch.

A very chilled, cool vibe and decor.

We had the ribs (because of course!!) and chicken burger and fries, which were all hot, fresh and absolutely DELICIOUS!

The staff are very friendly, polite and welcoming.

Awesome food, fantastic service and decent prices.","Very chill vibes and delicious food! We stopped by to eat their signature pork ribs (delicious btw! Juicy and fall-off-the-bone meat. Also the sauce is so delicious and tasty!) We also got a side of guacamole because we were craving chips and guac, as well as an açaí bowl. The fruit was so fresh and açaí base was smooth and fresh tasting. Great place for lunch. I also hear that they have live music at night and amazing cocktails. They also have shisha if you’re into hookah. Great place and great service a bit away from the crowded Ubud tourist spots.","I'm so happy to find this lovely little restaurant. Great selection on the menu....the ribs are super delicious. Very cosy atmosphere, friendly staff, good service.
On Wednesday nights, there's a cool blues duo playing there - Mang Frezy and Putu giving up some classic blues tunes.","Last night, me and my family went to this restaurant and I love the food, we had the best grill pork rib in Ubud. The place was nice, and as well as the service from the staff was excellent. I highly recommend to everyone who stay in Ubud,.","Came here today with the family. Wanted to eat a steak, but surprise, surprise: no steak at this “Grill”.

Instead we took the recommended ribs, a pulled pork meat burger and a lentil soup. The soup was the highlight. Nice consistency and good flavors. The burger was ok, but not as nice as it looks on the picture. The ribs were a disappointment ! The meat little and hard ! We had to change one portion and had huge left overs from the 2nd. God thanks there was a cute stray dog which we could feed with the left overs.

Would I come again ? Not for the food. For a drink, maybe. The ambiance is actually pretty chilled."
ChIJEYIXc8w90i0Ry4wiEEcRSeI,D&B Mandala villa,-8.4850397,115.27298799999998,"Jl subak Uma lebah, Petulu, Kecamatan Ubud, Kabupaten Gianyar, Bali 80571, Indonesia",https://maps.google.com/?cid=16305582922782641355,OPERATIONAL,+62 852-3781-8920,indonesian_restaurant,"indonesian_restaurant, restaurant, food",5,26,,"Beautiful accommodation in a quiet area of ubud. The rooms were clean and comfortable, and the pool was lovely and quiet. The restaurant onsite was an added bonus, with lots of options. The staff were incredible, and so friendly. Although the road to get to the accommodation is quite narrow, I never had an issue with Grab drivers coming to get me. Would definitely recommend staying here☺️","Nice vibes, simple staff, secluded, good place if  location suits you. They have good restaurant and nice pool. A motor bike would be handy to go places.
Good WiFi connection.","The staff is all you can ask for: responsive, friendly and resolutive.
The pool area is beautiful and very well maintained, perfect for a swim anytime.
The restaurant is a nice option for dinner and breakfast, a bit more expensive than other options but great considering that the resort is a bit far away from the city.
Another awesome thing was that hey arranged our scooter rental, which was really easy and free of the usual bureocratic stress of renting a vehicle. For three days of scooter we paid 240K IDR, great deal :)",Picture perfect villa with excellent service. Very humble staff and great food. Location of the villa is also good but the entrance is very narrow and makes it difficult for a car to enter with ease. All in all a great experience for us.,"Had an awesome stay here for 4 days in Ubud. People working here are so nice and helpful.

Mr. Kadek is a very helpful owner who assisted our travelling group with any request.

The room was spacious having water filter, tv, ac and refrigerator. With a big balcony.

The restaurant was very good, decently priced. We ordered like every day.

There is one narrow alley which you need to go through to reach the place.  big cars may not enter. Our Toyota Rush went fine, you can ask any queries with Mr. Kadek."
ChIJEfmrthg90i0RQz8Je5-xAIE,EDEN GARDEN BALI,-8.4893229,115.2716023,"G76C+7JH, Jl. Raya Gentong, Petulu, Kecamatan Ubud, Kabupaten Gianyar, Bali, Indonesia",https://maps.google.com/?cid=9295624929414823747,OPERATIONAL,,bed_and_breakfast,"bed_and_breakfast, lodging",4.9,9,,"Amazing place !
The view is amazing, houses are very clean and well maintained, the staff super friendly, we absolutely enjoyed our stay ! We recommend to hire their drivers, the road is quite narrow and bumpy! But it totally worth it !","Amazing! This place is the perfect hideaway in Ubud. The place was really clean, quiet and beautiful. The staff were really helpful - they organised breakfast, taxis and gave us some tips. You need to get the floating breakfast!","Best place to stay close with nature… expect some weird noise during night, it’s just an animal. Had a great time with my wife here. Only problem is the road to the place, it’s very narrow and not properly great for cars",,
ChIJc2Hp2E090i0ROKCI9iSyzBs,Rai Bungalows,-8.4869802,115.2697584,"Jl. Tirta Tawar, Petulu, Kecamatan Ubud, Kabupaten Gianyar, Bali 80571, Indonesia",https://maps.google.com/?cid=2003171806097743928,OPERATIONAL,+62 819-9907-7541,hotel,"hotel, lodging",4.7,42,,"The old towel sitting by the pool has rotted due to the sun. He asked us for 200000 RP because it was torn while drying. He said he would complain to the police if we didn't give it. Even though we said for hours that the towel was very old, they claimed it was new. It was an absolutely disgusting experience. bad landlord. Also the house is very old.","Rai Bungalows is a fantastic place to stay, making the most of the quiet rainforest that is Ubud.
The rooms are wonderful, clean, very well kept and cleaned daily. The outdoor private pool is magnificent accompanied by two day beds, two covered sitting areas, and beautiful landscaping/gardens.
The staff were fantastic, very friendly and helpful for all of our needs.
Being a short scooter out of town made the place very quiet, personal and serene. Staff delivered a scooter to Rai Bungalows for 70k IDR/day and made it effortless to explore.
We had two massages that were hosted in our room which were both facilitated by Rai Bungalows.
Free WiFi and water provided also.",Myself and my boyfriend stayed here for 4 nights and it was exceptional. They kept the place so clean. And the room is so spacious! The bed was so comfy it made it hard to leave in the morning! The staff are so friendly and go out of there way to help you with anything you need. It's very central if you have a scooter! They provided us with one so it was so convenient.  the pool was stunning and made it extra special. Thank you guys for a fantastic stay.,"Great place to stay. Beautiful back yard, and a nice pool. No television or safe in this place however, but you don't need a television in Bali anyway, you aren't here for the tv. Neighbours are usually other tourists, but you usually won't see or hear from them. The place is a little small, but is great for the 3 we currently have staying here. Great food just down the road at ITHAKA and they will even deliver. I highly recommend this place.",Home.  Simply stated. Isn't that what we all look for when we travel? Cozy and close to everything but not IN everything.  So happy I found this space.  Night swims highly recommend! Beautiful lighting and night sky.  Thank you!
ChIJK8ysvVE90i0RECvCvcHbyrY,Puri Tirta,-8.4906116,115.2738966,"G75F+QH2, Petulu, Ubud, Gianyar Regency, Bali 80571, Indonesia",https://maps.google.com/?cid=13171581685357226768,OPERATIONAL,,lodging,lodging,5,22,,"a wonderful place, very calm and comfortable, nowhere did I sleep so sweetly as here",Very good place with very good staff! Thank you for your hospitality 🙏🙂,"Hello, How can I contact you?",Nicely done with Balinese architecture vibe within,Nice room lots of space
ChIJ_c2_agA90i0Ra67C_S2M1y0,DRANIKI UBUD,-8.489654999999999,115.27011119999999,"G76C+33G, Jl. Tirta Tawar, Petulu, Kecamatan Ubud, Kabupaten Gianyar, Bali 80571, Indonesia",https://maps.google.com/?cid=3303262980858359403,OPERATIONAL,,restaurant,"restaurant, food",4.8,94,,"Yummy comfort homey food, light ambience,nice  to bring kids here, as there’s outdoor playground and indoor creativity room. Clean and organized! Definitely, I’ll be back","This is a perfect place for families to hang out with their small children. Food is great , staff is great, playground is fun ! What else can you ask for ☺️",I’ve been here two times and I can highly recommend this place for its close to authentic Belarusian cuisine. Great atmosphere and service. Dine in or takeaway! You’ll be satisfied either way!,"ZRAZY WITH CHICKEN & MUSHROOMS‼️🔥‼️🐉🔥‼️The food is so good, I don’t have anything to show you.  It’s 8 pm and this was my first meal of the day and BOY was it fulfilling in EVERY way🤗🤗🤗 And I’m a Taurus so you how we do.  The Honey Berry mixed juice is THE BISNESS too🤗🤗🤗. Pull up, Pull up.",Great cafe with Belarusian national dishes. Draniki and syrnyki are the best in Ubud and maybe even in Bali. They have a playground for kids as well!
ChIJM27le2U90i0RiaIFm-_RRhE,Noya kitchen ubud,-8.4876632,115.27009629999999,"G76C+W3W, Jl. Tirta Tawar No.6, Petulu, Kecamatan Ubud, Kabupaten Gianyar, Bali 80571, Indonesia",https://maps.google.com/?cid=1244913174042747529,OPERATIONAL,+62 878-5560-7128,restaurant,"restaurant, food",4.9,71,,"I visited Noya with my friends on the first day in Ubud, came here all the three days I was in Ubud. The food is great, Nasi Goreng being the best I had across Bali. So much so, that we got back to Ubud from Seminyak to have the last breakfast before leaving Bali. The staff is really cordial, we had a great time thanks to Astri. Definitely visit the place for a calm vibe and beautiful ambience.","After 20+ days of eating only local food (Nasi Goreng, Mie Goreng, Nasi Campur, Sate Ayam, etc…), I finally broke down and ordered something non-Balinese, Chicken Kabab special (IDR 95K), at Noya. And surprisingly, I was not disappointed! The flavors are very good (as evidenced by the before and after pictures below). Of course, they are not 100% as authentic as in the Middle East, or at various Persian restaurants in my hometown, Los Angeles area (😁). But it is ENAK.
Best thing is the cooling breezes that blow in from the little rice paddy that also provides the wonderful view for this restaurant gem away from the crazy Ubud center.","Tonight I had the pleasure to eat at Noya Kitchen for my last dinner in Ubud and it was a beautiful surprise! First of all: the location is amazing, both the surroundings and the restaurant are beautiful and peaceful, you eat hearing to sound of nature. Second, the service was great, the front of house was always attentive and friendly. Last but not least, the food is great! You have both options between traditional and international food. I had a delicious pumpkin soup and my friend had a traditional Indonesian meal. The portions are generous and the taste is amazing! We shared a tiramisu as a dessert and, as an Italian girl, I couldn't feel the difference between the one I eat in Italy and the one here. Unfortunately we didn't think about taking pictures.
Thank you Noya Kitchen!! See you next time","Best place to eat outside of crowded streets of polluted Ubud center. We had breakfast and lunch for several days and each time we were very pleased with the quality of the dishes. I do recomend the Noya chicken kebab, chicken breast with lemon and the 1st desert on their menu (vanilla and blueberry).","Fast service, gourmet European food, beautiful location, comfortable quite place.

I strongly recommend to visit Noya!

breakdown by dish:
1) Chicken in vine( Saltimbocca alla Romana) 10/10
2) Dutch Goulash 10/10
3) Dessert: Rote Grutze 👍 just a bit expensive on my opinion"
