id,name,latitude,longitude,address,url,status,phone,primary-type,types,rating,rating-count,price-level,review 1,review 2,review 3,review 4,review 5
ChIJY0hnMyoj0i0RfAGZL_k-CSU,"Capella Ubud, Bali",-8.4482091,115.2681117,"Jl. RY Dalem, Keliki, Kec. Tegallalang, Kabupaten Gianyar, Bali 80561, Indonesia",https://maps.google.com/?cid=2668733494160064892,OPERATIONAL,+62 361 2091888,hotel,"hotel, lodging",4.9,1304,,"An extraordinary place. One of the most unique resorts we’ve ever been to. Staff was very friendly and helpful. Food was excellent. The attention to detail was amazing. The sign by the pool says it all: they could’ve put up a simple plastic sign to explain the pool rules but instead, they took the time to create something unusual and interesting. One note: if you have mobility issues, you should discuss with the hotel as there was a fair amount of walking up and down stairs. Our room was one of the most distant, but some rooms were much closer to the main part of the hotel.","One of the most unique and beautiful resort we have stayed. Absolutely fabulous. The attention to details are just amazing (like most of the Capella we have stayed). We have visited Bali many times, so only wanted to find some nice resorts and spend our time there. Capella suits our needs. The tranquil feeling when soaking in your pool and looking out at the forest... you will forget about all your worries. It also has one of the most grand hand hammered copper bathtub I have seen lol. Food and spa was excellent too. If price is not an issue, this is THE place.","We've been fortunate enough to stay in some 'Ultra' resorts and wow this is one of them. It's the most unusual, unique and luxury resort. So well planned with exquisite architecture.
The staff (everyone) were spectacular and magnificently attentive, nothing was too much trouble at all.
Food was off the scale and some of the best we'd had around the world!
What a fantastic hotel chain Capella is and worthy of their accolades.","⚠️This hotel is very expensive and the price is not commensurate with the experience we got. The distance from the airport is almost 2 hour drive.
Leeches, mosquitoes, caterpillars, are very annoying and disgusting. The service didn't look good from the first we arrived, the hotel staff didn't excuse when open the car door and not even knocked on the car door to open the door. My arm was still leaning, so I was shocked because I was about to fall. Even the hotel manager looked very unfriendly, the way he looked at us seemed to think that we were poor people who couldn't afford to pay. Is it because we don't tip them??? If I were poor and you wanted to invite me to stay at this hotel for free, I would immediately refuse without thinking twice. And for the staff who welcomed us in the lobby, I don't know what their names were, I really hated it when one of them stared at my wife's body shape, even looking deliberately at the slightly exposed part of my wife's breasts.","We had a lovely stay at Capella! The design is truly unique and the staff is very nice.
Two things to improve:
1. It would be nice if the driveway staff also spoke a little English. It was very hard to communicate when they refused to let our grab taxi in, there was just no way to get the message across. 2. The quality of the dental kit and the comb was shockingly low (See picture)."
ChIJSdWJG3M90i0RaHjkrFpxKAE,Alam Sari Resort & Spa,-8.4473682,115.26910960000001,"H739+3J5, Jl. Raya Keliki, Keliki, Kec. Tegallalang, Kabupaten Gianyar, Bali 80561, Indonesia",https://maps.google.com/?cid=83441227368003688,OPERATIONAL,+62 361 981420,hotel,"hotel, lodging",4,126,,"This place is obviously a hotel that has had it's struggles staying alive since COVID, as some of the facilities were closed permanently. That aside, the staff was amazing, they were kind and helpful and I felt very taken care of. The breakfast offered is simple but good, just fruit, toast, and eggs. There is a driver on site that is super great for giving recommendations and way more reliable than gojek. Obviously it's a little more than gojek, but if you negotiate beforehand it is, in my opinion, a good deal. It's very quiet and the rooms were clean and the bed comfy. It's not a fancy resort, it's very ""tucked away in the jungle vibes"", and because it's on a hill you have to take many steps to get to the top, but the location is good to go to south Ubud or to the Rice Terrace, lots of waterfalls, and the monkey forest. Overall a great stay.","I stayed there last year, summer of 2022, and I think the best advantage of this hotel is the amazing staff and good price. Otherwise, it wasn't a very good option for a single woman (was a bit scary inside, especially by night with all the noises of insects around, but yeah this is Bali in general :)","Beautiful place and nice staff, the free walk around the terraces and the village was great. Clean rooms, well-kept chlorine-free pool. Organic food from own garden was good but overpriced. Some breakfast options were good, but the fruit salad for example was tiny. All options include huge croissants + lots of coffee/tea in a pot. Free shuttle to Ubud three times a day, free water refills.","A beautiful outlook and excellent staff. We stayed here for three nights with our friends, accompanied by our two kids and their three. (2 -10 year range). The little villas are airy and very 'Bali'.  The food was very nice and reasonably priced with a menu that catered for our range of fussy eaters.  I highly recommend the village tour which took us through the beautiful rice paddy terraces and finished with a visit to the local art school.  Such intricate and detailed art work from a talented artisan. The road is nearby with lots of steps,  but it was a great contrast to the chaos of Kuta and Ubud. We often had the pool virtually to ourselves.  A lovely place to stay.","Stayed at the Alam Sari for three days with by my partner, It was a very enjoyable experience. All the staff were very friendly and accommodating. The room itself was clean and well kept. There is no television, but there is a safety deposit box and a very cool bathroom.
If you get the chance, speak to a man there named Putu. He offers a free tour of the surrounding area through the jungle and rice patties and tells you about all the different plants they harvest. Very interesting if your into that kind of thing :)"
ChIJ-76rFIki0i0RutCG_s9fwOo,Ramaya Ubud View by EPS,-8.447771399999999,115.26480240000001,"Jl. RY Dalem, Kelusa, Kec. Tegallalang, Kabupaten Gianyar, Bali 80561, Indonesia",https://maps.google.com/?cid=16915625547336700090,OPERATIONAL,+62 858-5750-6606,guest_house,"guest_house, lodging",4.6,21,,"Quiet, green and clean place with a cozy living room and a very nice terrace area. Some nice books to shift through as well.

Far from Ubud center if you are walking.",Loved the stay at Ramaya. Cozy room and neatly kept.,Cancelled on us 1 hour before check in.,They treat the animals with respect,Great place and humble owner. Keep up the great works
ChIJr1hh78Uj0i0RInJHmyFncb8,Nano Ari Homestay,-8.448679499999999,115.2643161,"Jl. Kresna, Keliki, Kec. Payangan, Kabupaten Gianyar, Bali 80561, Indonesia",https://maps.google.com/?cid=13794920527649272354,OPERATIONAL,+62 812-3886-9798,guest_house,"guest_house, lodging",4.9,40,,"Very nice and cozy homestay. They are super sweet and helpful. Amazing style, very artistic 👌🏼 highly recommend in Ubud!","Best homestay and very kind hosts. If you’re interested in art, or want a nice place outside the busy-ness of Ubud, this is perfect. Nano and Ani were so helpful, and the room is very comfortable. Really recommend.","Nice house, lovely location. Bike rental next door. Only negative was the neighborhood chickens but they gave us earplugs 😂","I lived here for two weeks and was happy to stay here. Pleasant atmosphere, clean room. The hosts were very friendly and always helped me with my unusual requests. I thank Nano for getting acquainted with the Balinese art of painting and visiting the holy springs. Thanks to Ari for her patient smile, sensitivity and kindness. I will remember you with gratitude 🙏",Booked this place after staying in central ubud which was just constantly bustling. This homestay is tucked away from the madness. The owner and his wife are extremely pleasant people and were very accommodating during my stay. The bed was comfortable and the room was clean. The only down side is that the water wasn’t always hot but it’s not a huge issue. Had initially booked for 2 nights and ended up staying for 5!
ChIJR_vpvJ8j0i0RCnrilNhrBk8,Api Jiwa at Capella Ubud,-8.448286699999999,115.26821059999999,"Banjar Triwangsa, Jl. RY Dalem, Keliki, Kec. Tegallalang, Kabupaten Gianyar, Bali 80561, Indonesia",https://maps.google.com/?cid=5694357356811549194,OPERATIONAL,+62 361 2091888,restaurant,"restaurant, food",4.6,50,,"Api Jiwa delivered an outstanding, unique Bali dinner at the exceptional Capella Hotel! The food was carefully and artistically crafted by the chef standing before our community bar /table - such an intimate dinner beyond any restaurant we've enjoyed in Bali! We received a beautiful education about the food for each of the ten courses, and why the chef chose the ingredients. I will post some pictures that capture the artistry! I highly recommend this experience.
In addition, I brought several allergies to the dinner, and the chef was notified 24 hours in advance and carefully prepared my meal thoughtfully, and it did not suffer in taste or presentation.","Beautiful surrounding and good food.
My friend and I tried Chef Russo’s cooking when he did a guest shift in Singapore last year and we decided to drop by Bali to try his dishes.

Among our favourites were the prawn, steamed egg .(The menu at Api Jiwa could have been updated as we were there last month.)
The wine or cocktail pairing completed the entire meal for us.
Much effort was put into the creation and cooking.
We planned part of this trip to coincide with eating at Api Jiwa.
It was well worth our trip to Bali!
The only downside wqs  the booking.
There was no online booking system. I called 3 times long distance before it was finally done:
Emailing did not work as no one  replied .
This was 16 seater so getting slots confirmed is of utmost importance. Much so if guests are  flying in just for this.","We had an amazing experience at this restaurant with our whole family. The food was excellent, and the service was exceptionally attentive. The ambiance and overall atmosphere made us feel incredibly comfortable and left a lasting impression. We’re grateful to the team for providing us with a fantastic taste of Bali cuisine and hospitality. Thank you!","Great food. Great chef.
Service is S L O W and the wine menu is not up to par. Overall a good experience which could be heightened","The experience and the food is amazing. A 10-course meal, each of which is explained by the chef and his staff. The service was phenomenal the entire time. You will need to make reservations well ahead of time as the spots at the chef's table fill up quickly. For good reason. You will not regret going to dinner and experiencing this"
ChIJLWvdwYsi0i0R3CXrGQ66Tm8,Telaga Homestay and Spa,-8.4491332,115.26434249999998,"H727+9P9, Jl. Kresna, Keliki, Kec. Payangan, Kabupaten Gianyar, Bali 80561, Indonesia",https://maps.google.com/?cid=8020552556120581596,OPERATIONAL,+62 851-0368-7835,guest_house,"guest_house, spa, lodging",4.6,50,,Beautiful homestay. Wake up in a jungle garden surrounded by flowers and tropical plants. Feels remote and calm. Room is basic but opens right up into garden. Host provides cheap rides into Ubud on request,"Update: Treated very badly by the family on my second visit after promoting their business. Will never stay again.

Excellent service, lovely family. Rooms are clean and and their lovely dogs will pay you a visit, sooo cute 🥰🐶🐕","I had a really great time at Telaga Homestay in Keliki village. It's even more beautiful than the pictures.  Tangan, Telaga, Ayun and the rest of the family are really friendly and helpful and it's nice to observe some of the routines of a Balinese family such as creating the offerings. I highly recommend Telega's body massages. I also recommend the painting class I did. Also, there is a nice walk in the rice fields and forest at 5min from the place. The morning concert of roosters is indeed very loud, but I took advantage of waking up early anyway and went to do daily yoga at 7.30am at Om Ham Retreat (10min drive away), where you can also have buffet breakfast for 75k and sound healing at 19.00. I am grateful for the opportunity to stay there with Home Exchange, because otherwise I wouldn't have discovered the North villages of Ubud, an area more authentic, quiet and with more nature than the Ubud center's busy streets and crazy traffic.","Such a beautiful place and so much of care. Good food, good rooms and warm welcoming family. These are the best human beings you can ever come across. A must visit","Awesome Guest house!!
It is a great place to stay in an area, which is not too touristy. Nearby there are still great places to go to and discover. There are many beautiful rice fields around and also stores and warungs to get everything you need.
The room and bathroom is very clean and is decorated nicely- there is a fan and very good wifi-connection. Also the outside area is neat.
The hosting family is just the kindest and very lovely! Always offering to help and having great recommendations of what to do in the area. Telaga is offering great massages for a really good price! Can only recommend! Thank you for everything! Terima kasih banyak! Would love to come back!"
ChIJt3E_Fmwj0i0Rf_IKTKSOtAI,Mads Lange at Capella Ubud,-8.448232899999999,115.26822359999998,"Banjar Triwangsa, Jl. RY Dalem, Keliki, Kec. Tegallalang, Kabupaten Gianyar, Bali 80561, Indonesia",https://maps.google.com/?cid=194937520185340543,OPERATIONAL,+62 361 2091888,indonesian_restaurant,"indonesian_restaurant, restaurant, food",4.5,25,,"What a lovely place to dine!
The food was amazing and when I say amazing I mean the best I have had so far in Bali. I ordered Seafood Mie Goreng for mains and the flavours blew my mind. Flavours were really close to home. Everything was as close to Balinese flavours as I wanted. Hats off to the owner for preserving Balinese culture in a beautiful way.
Talking about service, Eris was really polite and showed us a few nice parts of the Capella after the meal.
Atmosphere was lovely overall. Wish I had time to make a reservation for lunch as well the next day and see the view in the day time.
P.S. Reservation is required but really smooth process.",Treated myself to an early bday dinner at  Capella’s restaurant during my solo trip in Bali last May 23. I have to say all was spectacular and overwhelming. From the. Kindness of the staff to the food and service. The full experience will remain fixed in my memory forever. I mixed and matched fish dishes that night and it was memorable. All so tasty and fresh. Shoutout to this place and the Italian Chef!! 🌟🌟🌟🌟🌟 Also had some time after dinner at their campfire watching black & white movies and drinking ginger tea under a wonderful sky full of stars. This place is something different and every traveller who touches Bali should go and check it out!!,"Perfect spot to relax around Tegalalang Ubud! Great dining ambience, very green view because this al fresco restaurant is surrounded by lucious green garden and coconut trees.

Menu choices are great and warm hospitable service. Their sourdough served with butter, olive oil, and balsamic vinegar, iced tegallalang tea, and their cheesecake dessert is a must try.

Great spot for any occasion, from me-time, date nights to family lunch/dinner.

They are open for public but make sure you give them a call to reserve a table beforehand.

Thank you Chef Nico and the team for great experience today. Definitely will be back 💚","First thing first: this place is amazing as well as very expensive compared to normal Bali prices.

Let's focus on food: we had an extremely pleasant breakfast experience, I choose the Japanese bento style option and my fiancee took Avo on sourdough. Food was excellent, coffee and juices as well. It is an all you can eat breakfast style.

Service: simply excellent, Ayu and Swandi took excellent care of us, even called us by our names every time they came to our table. They also gace us a tour around the beautiful hotel and explained the history.

Choose this place to treat yoursel or a special occasion.","Absolutely spectacular place for dinner! Expensive if you compare it to Bali prices, but you get a highest class service, food and view. If you want to celebrate something, you need to do it here! We ate the best beef rendang and for desert we had salted caramel magnum. It was just perfect. If you visit this place, go here around 6pm and they invite you to the evening ceremony. Later you can chill out at the bonfire and grill some home made marshmallows. Lastri took a really good care of us :)"
ChIJx0iSVYoj0i0RBC07UCSP0Jw,Puri Radent - Homestay & Hotel,-8.449320499999999,115.2671391,"Jl. Setra No.3, Keliki, Kec. Tegallalang, Kabupaten Gianyar, Bali 80561, Indonesia",https://maps.google.com/?cid=11299688851200224516,OPERATIONAL,+62 21 80629666,private_guest_room,"private_guest_room, lodging",4.5,6,,"Great Value for Money, the owner is really friendly and super helpful. Treated like family member, attend local purification ceremony as well. Learnt heaps about Balinese Cultures, Language and Beliefs.",So happy to serve our local community with short stay and long stay at our local hotel in the rainforest,,,
ChIJn_ilksIj0i0R5QIqurhSHWo,Warung Ganesha,-8.4504644,115.26641929999998,"Jl. Setra No.3, Keliki, Kec. Tegallalang, Kabupaten Gianyar, Bali 80561, Indonesia",https://maps.google.com/?cid=7646358695695745765,OPERATIONAL,+62 812-3957-6207,indonesian_restaurant,"indonesian_restaurant, restaurant, food",4.9,19,,"One of the coziest place in Bali! Food tastes amazing, my husband dreams about Murni (owner) Nasi Goreng each day. The owner is super warm person, always smiling, in the good mood, treats customers like real guests. You need to to try, it is a MUST!","Most beautiful warung next to the rice fields, delicious food and the owner is a lovely person. Perfect spot to watch the huge kites people love to play around with here, and enjoy a balinese coffee while doing so.
Best nasi goreng I had so far!","It is my favorite Warung on Bali so far! Beautiful atmosphere with all the rice fields around, delicious food and the mango juice is just the best! The prices are very fair and the family working there is so so lovely- can only recommend! Thank you for everything! Terima kasih banyak!","Beautiful local warung in Keliki. The food was great, the staff so friendly, with rice field and kids played around view❤️🍀","One of the most beautiful warungs I have ever visited. Prefect location, perfectly nice owner. The vegan food we had was amazing. There is a fishing competition pond next to it. Locals compete there on the weekends."
ChIJJ6GAdF0j0i0Rdzm-CrOubE0,Lauh sedana House,-8.451127,115.26540819999998,"Jl. Setra, Keliki, Kec. Payangan, Kabupaten Gianyar, Bali 80561, Indonesia",https://maps.google.com/?cid=5579026122407819639,OPERATIONAL,+62 859-3510-3784,,lodging,5,11,,the place is comfortable. beautiful rice field views. friendly staff. someday it will come back again,Welcome home,,,
ChIJ_-OioyMj0i0Ro5GmuAmUsL8,MIMPI YANG MANIS,-8.4501086,115.26514379999999,"Jl. Setra, Keliki, Kec. Tegallalang, Kabupaten Gianyar, Bali 80561, Indonesia",https://maps.google.com/?cid=13812702826618851747,OPERATIONAL,+62 857-9221-2660,coffee_shop,"coffee_shop, cafe, food, store",5,2,,,,,,
ChIJy33Dt4si0i0R7svs64DOhh0,Warung Makan Bu Salin,-8.4478025,115.26442550000002,"H727+VQF, Jl. RY Dalem, Keliki, Kec. Tegallalang, Kabupaten Gianyar, Bali 80561, Indonesia",https://maps.google.com/?cid=2127614927088438254,OPERATIONAL,+62 857-3897-2040,indonesian_restaurant,"indonesian_restaurant, restaurant, food",4.4,110,,"Heart-warming traditional Balinese pork-themed delicacies that is secluded, quite far from the main road.","Very traditional, its pork, popular among local, stewed porkbelly, great saugage, do not care so much about fried meat, its tough, i always asked white lawar, without raw blood.","If you want to try pork, you may visit this place",Super top for Balinese local food!,"The best Nasi Lawar ever... Local food, great taste, and super cheap!!! Mustahil try!!!"
ChIJxZ44HYwi0i0Rk4rf3EMqPbo,sareanhomestay,-8.4503078,115.26588389999999,"G7X8+V9C, Keliki, Tegallalang, Gianyar Regency, Bali 80561, Indonesia",https://maps.google.com/?cid=13419928935590759059,OPERATIONAL,+62 812-4634-656,lodging,lodging,3,1,,,,,,
ChIJ-Ub7VYIj0i0Rozn0G_SwZfs,Kolam Pancing Desa Keliki,-8.4501125,115.2657974,"G7X8+X83, Keliki, Tegallalang, Gianyar Regency, Bali, Indonesia",https://maps.google.com/?cid=18115079638655187363,OPERATIONAL,,tourist_attraction,tourist_attraction,,,,,,,,
ChIJiao8F80j0i0RtFxmdbpIMhs,Warung Asap at Keliki,-8.4479445,115.26792049999999,"Kelusa, Payangan, Gianyar Regency, Bali 80561, Indonesia",https://maps.google.com/?cid=1959708753530346676,OPERATIONAL,,restaurant,"restaurant, food",5,18,,"Definitely worth a 5-star! The grilled and fried chicken are so delicious, also the noodles and the spice. We arrived at the restaurant late but the owner was kind and spoke fluent English.

The restaurant is not big but with a wild style of decorations, and a very good taste of music, everything looks great. Its amazing food and excellent service make it a truly price worthy eating option.

Will come to visit again.","Wow!

Golden place! Good prices and tasty food. There are not many positions in menu, but each one is worth a try! Attentive staff and extremely pleasant owner . Thank you 💚

By local guide Kirill Vasilev",Delicious meals at this roadside restaurant. I really enjoyed the great service. The mint lime juice was fantastic and something I'd order every time I visited. Thank you 💟,"Simple, but tasty and cheap food. The girl that works here is very friendly.","Simple menu but very delicious local food.

I had a fish and it was really good.
Price value ratio is great"
ChIJsUemwhQj0i0RKx9TO2NSBGQ,Pondok Kliker's,-8.4487136,115.26725519999998,"H728+GW6, Jl. Setra, Keliki, Kec. Tegallalang, Kabupaten Gianyar, Bali 80561, Indonesia",https://maps.google.com/?cid=7206975889850179371,OPERATIONAL,+62 878-6037-2437,campground,"campground, lodging, park",5,10,,"Nice,  good job",Nice place,Top,nice,
ChIJ46zi7L0j0i0RBeX4BPU1El8,Bu Meri Nasi Betutu,-8.4482389,115.2690032,"H729+PJ2, Jl. RY Dalem, Keliki, Kec. Tegallalang, Kabupaten Gianyar, Bali 80561, Indonesia",https://maps.google.com/?cid=6850597309650625797,OPERATIONAL,,restaurant,"restaurant, food",5,1,,,,,,
ChIJO1NETpAj0i0R48JQrGvGtZE,SURYA HOUSE (Homestay),-8.4498571,115.26454779999997,"H727+3R3, Jl. Setra, Keliki, Kec. Tegallalang, Kabupaten Gianyar, Bali 80561, Indonesia",https://maps.google.com/?cid=10499516272038953699,OPERATIONAL,+62 821-4660-5675,hostel,"hostel, lodging",,,,,,,,
ChIJw-2rWHEj0i0R2VPtFhVQGno,Pondok Rany,-8.4487594,115.26770409999999,"Raya Dalem Keliki, Gang Subak Lauh Batu, Keliki, Kec. Payangan, Kabupaten Gianyar, Bali 80561, Indonesia",https://maps.google.com/?cid=8798432873530872793,OPERATIONAL,+62 878-6036-3323,,lodging,,,,,,,,
ChIJ_SSpv94j0i0RaA-Evjf-ufI,"Rare House Taxi, Tour and Activities",-8.4487683,115.2671883,"Jl. Setra, Keliki, Kec. Tegallalang, Kabupaten Gianyar, Bali 80561, Indonesia",https://maps.google.com/?cid=17490290143243013992,OPERATIONAL,+62 813-5379-5040,private_guest_room,"private_guest_room, lodging",,,,,,,,
