id,name,latitude,longitude,address,url,status,phone,primary-type,types,rating,rating-count,price-level,review 1,review 2,review 3,review 4,review 5
ChIJPXbwrFnX0y0Rz0bGgO7cQb4,"The Holy Tree Kitchen, Coffee & Surfshop",-8.4121334,114.7984547,"Jalan pantai yehsumbul Kecamatan mendoyo, Desa, Yeh Sumbul, Kec. Negara, Kabupaten Jembrana, Bali 82262, Indonesia",https://maps.google.com/?cid=13709481657613305551,OPERATIONAL,+62 878-6231-7208,restaurant,"restaurant, sporting_goods_store, food, store",4.5,153,,"We loved this place!!! Amazing location right on the beach overlooking the surf, stunning ride down to get there, very relaxed vibes, delicious healthy food, great coffee, super affordable - all served by the loveliest smiling staff! We went every single day while we were in Medewi, couldn’t get enough of that cacao bowl. Thanks team, we’ll be back!","Great views and affordable food in front of a surfing beach break. There is a pool table, surf shop, skate park, and you can get a Balinese massage upstairs. It is a perfect spot to gather with your fellow travelers or meet new people.","Fresh food with good price but don't expect the food to look exactly like google reviews cause maybe chef using moods instead of standard? I'm also wondering why they keep these rusty dusty lid of ketcup sauce in all tables!? Looking at them make me wish they have better hygiene in the kitchen. And customers need to almost wipe table before sitting cause maybe they take away used plates but didn't wipe table after people leaving.

I hope you guys can improvise and to not spoil the good business by simple things.",This place is heaven on earth. Incredibly delicious food. Cocoa chocolate smoothie is the best for me! I love it here 💚,"My partner and I were in Medewi for 6 days and we had 95% of our meals there. It has such a beautiful vibe, right in front of the ocean and the food is delicious. You can also get amazing massages on the second floor. Our favorite things to eat there were the Red Dragon and the Nasi Goreng! Also, we were able to rent our scooter next door and that was pretty easy and affordable. The staff are very friendly and create a great atmosphere. Thank you so much all of you for our lovely time there!"
ChIJUzniW5fW0y0RK5X7YrnLA3Y,West Break Bali Medewi,-8.4128119,114.8004895,"Jalan Wisata, no 7 Yeh Sumbul, Airsatang, Kec. Mendoyo, Kabupaten Jembrana, Bali 82261, Indonesia",https://maps.google.com/?cid=8503864518495671595,OPERATIONAL,,hotel,"hotel, lodging",4.6,78,,"The place is not bad. Just on the beach. In this area there are no many decent hotels. Rooms are fine, bathtub 🛁 on the first floor is cool however hot water will fill it only a little,then hot water will finish. Territory is nice and tidy and terrace near the beach is awesome, food is good. However huge disadvantage is very bad sound isolation, it's like neighbors are talking in your room ,not next room . I could hear each word started from 6:30 am. And there is a mosque near so be ready also wake up at 4 am from praying sound. I couldn't relax and sleep well. Anything else is not great but suitable. Just now I was checking out and of course I was charged for juice extra for breakfast, but the funniest thing that the woman who works in the kitchen was trying to charge 20 k for orange juice however I paid 15 k yesterday and in menu it's 15 k ,so she said it's fresh so it's 20 k. I was in shock how she was trying to cheat me just in front of my nose. Owner! Pay attention!",On the west coast. A great get away. The accom was first class as was the service.,"This place is pretty average.
Beautiful bathroom but can't even get the bathtub a quarter full before there's no hot water. Surrounded by three mosque so no sleep ins.  Staff are disrespectful.
Mouse in room
Disgusting response from staff.
Why have a bath in a room if you can't full it?
Some people holiday for many reasons, honeymoon for one or maybe as in this case my wife was pregnant and we booked this place so she could get some comfort in a nice hot bath.","We had an awesome time at West Break, it’s beautiful and calm and spacious. Everything is clean and the staff is super nice and happy to help with all kinds of requests. Boy and Eco took us surfing at the point and balian beach and really helped us improve our skills. Can only recommend and hope to be back soon!","Best surf teachers in whole Bali are definitely Boy and Ecco! They have had long years experience in surf coaching and they really go the extra mile to make their students feel safe in the water, help you with video feedbacks to improve, they are super fun and patient in the water, also cheer with us when we make progress!

we stayed for 5 days (wish we had stayed longer..) and on the weekend there was a party with friends and family, not only did we we got invited to the party, the whole gang are so welcoming and invited us to dance, eat and drink with them! we had a blast!

also the hotel is one of the nicest we stayed in! beautiful garden and pool, also the chill lounge is very comfy with a nice couch and I could even do my yoga routines here. and they offer the best massages! The staff is beyond nice and sweet, Boy‘s wife Linda is a great cook and served us fresh seafood and fish! The rooms have very comfy beds, hot showers and everything you need. we loved it!

we can‘t be more grateful for this experience with west break crew and family!! this is where you are not a tourist anymore, you are welcomed into their family and taught how to surf on the waves they grew up with, you sit with them enjoying a good family dinner. and dont you worry about the transfer from/to your next destination, they will take care of everything.

don‘t hesitate to come here and meet this wonderful corner of Bali and these heartwarming people!"
ChIJaafmWZfW0y0RMzuRqUOZvko,Arton Resort & Beach Club,-8.410943399999999,114.79731089999999,"Jl. Pantai Bahari, Yeh Sumbul, Kec. Mendoyo, Kabupaten Jembrana, Bali 82261, Indonesia",https://maps.google.com/?cid=5385910720268417843,OPERATIONAL,,resort_hotel,"resort_hotel, hotel, lodging, restaurant, food",4.2,335,,"the Aircon I did not work in the room they gave us. It was extremely hot and couldn’t sleep. They do not service their aircons. I asked to change rooms and the owner tried to charge us for it. I requested a room with Aircon and two twin beds and we are now sitting in sweat in this room and the owner is refusing to help us even though there is another room available.

Do not recommend. Poor service and CHEAP owner.","Clean comfortable rooms. Good AC. Nice pool.
Good restaurant just up the road and beach surf break right in front. Perfect to lean to surf or as a chilled out  break from the reefs down south.","For the price (we paid about £20 per night) it really is amazing. The room is spacious and clean, the AC works well and the shower has good pressure. The pool is refreshing and clean for the most part (although could do with scooping out the bugs and leaves etc).  The staff are also very friendly and helpful. It’s just a shame there’s no bar/restaurant anymore.","Very clean bed sheet, pillows are amazingly soft. Ac good
The shower has hot shower, but its old.
Staff friendly n helpfull.
Pool very good. Overall is nice stay

There are only 3 pkaces near by to eat.
Sea is just at front, can surf, but to go to main surf need long walk","The room is clean, but the bed is dusty. I'm allergic to it and have a horrible cough sleeping there. Also there's a colony of ants below the sink, a couple of grasshoppers, lizards and many other insects crawling around. Water got two temperatures, they are cold and colder. The scenery is beautiful. You can hear the song of crickets at night. So close with beach but it's very difficult to find food at night. From my opinion, you can call that cottage instead of hotel."
ChIJcxlde5rW0y0R5hZyrOHOnII,Nal's Kitchen,-8.4084679,114.79808409999998,"Jl. Raya Denpasar - Gilimanuk, Yeh Sumbul, Kec. Mendoyo, Kabupaten Jembrana, Bali 82261, Indonesia",https://maps.google.com/?cid=9411624789953615590,OPERATIONAL,+62 878-6120-4231,restaurant,"restaurant, food",4.6,341,PRICE_LEVEL_INEXPENSIVE,"Great spot with a variety of vegetarian options! We went a couple of times during our stay for lunch and dinner. Some of the tempeh dishes are slightly on the bland side, but the food comes in large portions and is great value for money.

We'd recommend the Oreo milkshake and the Nasi Goreng.

Also make sure you come early in the evening as it can get really busy!","A must try. I recommend Nasi Campur. Great price, portion and quality.  Go to the back, there's a nice open space there. I will add as pictures.","Nice place but we waited 1 and a half hour for our food. When we got it, it was not really delicious. I travel since 3 month through Asia - this is the badest food I had! I would not recommend it.
The Staff is very friendly!
The sanitary is really really dirty - you don’t want to go there.

In all - nice surrounding, friendly stuff but you have to wait to long, the food is really bad and the sanitary gross!

I would not recommend it.",The vibes is good and the price is so affordable and also i love the taste,They have all the food you want: western or local. My girlfriend and I ate there two times costing us about $6 for diner and drinks.
ChIJCwg10RDX0y0RcUOhQWnJ2mM,Bamboo Beach Bar & Restaurant,-8.4126832,114.799637,"Yeh Sumbul, Mendoyo, Jembrana Regency, Bali, Indonesia",https://maps.google.com/?cid=7195284808587625329,OPERATIONAL,+62 877-2483-4509,restaurant,"restaurant, food",4.7,105,,"Amazing place for local food! Ibu Niah is very attentive to all my needs- being vegetarian! Sweet staffs, less crowded and lovely place to chill after surf❤️",Excelent and cheap warung! Delicious and   authentic food Super cheap and the owners and staff are super nice and warm! They light fires at the end of the night for big groups and are very welcoming! We used to play cards even when they closed! Amazing place to see the sunset and chill! Nice dessets!,"Bamboo bar was our favorite spot for a beer and a meal in our month that we stayed here! The staff is so friendly and welcoming! We love watching sunset, volleyball games, and listening to the fun music. It’s a fantastic atmosphere to relax and enjoy your afternoons and evenings!",Great family operated Warung on the waterfront with great food and pricing. All seafood was freshly caught the same morning and all bbq perfectly. Recommend the fish.,"Been coming here daily for lunch this week. Nice breeze and chill atmosphere. 15k for nasi goreng or similar. Typical indo food, I wouldn’t say it’s the best food but for the price and ocean front location, it’s hard to beat. The holy tree next door is much busier but I prefer this place. Cheaper and less busy. The cats on site are a bonus."
ChIJK7d9La_X0y0RPsSekbQsCoE,Wakey Wakey Coffee Bar,-8.4092369,114.7973729,"HQRW+8W5, Yeh Sumbul, Mendoyo, Jembrana Regency, Bali, Indonesia",https://maps.google.com/?cid=9298293534708646974,OPERATIONAL,,coffee_shop,"coffee_shop, cafe, food, store",4.9,53,,"A nice quiet place for a coffee break.
The coffee was tasty and strong but not too strong. As a snack they have banana bread. Highly recommended. Not too sweet.
There’s a garden area and a rooftop with a view. And a puppy. What more do you need.","Cozy coffee spot with view
Coffee is very good, I like rooftop view and smoothies here",Super good flat white. Maybe the best in town. Views are amazing from the roof. Store has coold clothes.,"Nice little hideaway with great coffee and banana bread. Good place to work or read.
Coffee is quite strong/dark. I would love to see a fruity light/medium roast option as well.","Great coffee. Nice vibe. Comfy hammock and chairs. If you are in Medewi, you should check it out. + lovely surf shop here as well."
ChIJrzcYtvHX0y0RLzwAh7DRTNo,The nyamo surf and stay,-8.411819699999999,114.7984826,"Jalan pantai No.91, Yeh Sumbul, Kec. Mendoyo, Kabupaten Jembrana, Bali 82261, Indonesia",https://maps.google.com/?cid=15730178154607688751,OPERATIONAL,+62 831-1721-4013,guest_house,"guest_house, hotel, lodging",4.7,14,,"Great place for surfers, front of the surf brake with a nice restaurant in the front.
Kind of basic no ac but great value for what it offers","Very beautiful place to stay, located at a beautiful, peaceful beach. My room was only 50m from the beach with it‘s own little garden. I could see (and hear) the waves when chilling in front of my room.🙂 The owner, Riki, was very helpful and even drove me to the ATM when I needed money. Thank you very much!
There is a nice bar just in front (The Holy Tree) and a very recommendable restaurant in 10min walking distance (Nal‘s Kitchen).","If you are a surfer this is the best spot in town. Probably the best price too. The owner is super kind and responsive. Out your front door is the best cafe in town, right in front of the best short board wave in town.","Very close to beach, they also have surf classes","Amazing place to stay and perfect location! Ricky is really nice and helpful, I won't forget my stay here :)"
ChIJgTvkG-bX0y0RXEPi-2NCAO8,Ayolah Surf House - Medewi Surf Camp,-8.4091729,114.79702130000001,"Jl.pantai bahari yeh sumbul kecamatan Mendoyo, Kabupaten, Yeh Sumbul, Negara, Kabupaten Jembrana, Bali 82261, Indonesia",https://maps.google.com/?cid=17221837972259881820,OPERATIONAL,+62 859-5518-3077,hotel,"hotel, hostel, lodging",4.5,22,,"I am a repeat visitor to Ayolah Surf House, because I love staying with Ali and his family in Medewi. I enjoy the surfing at both the point and the beach break, you can almost always find a decent wave at most times of the day between those two spots!

Ali and his family are so wonderful and make you feel like family while you are there.  I live in Bali with my son and so the family atmosphere at his place makes it so great for me alone with my 7 year old.

Its a perfect location, with beautiful and fun people, in rooms that cozy and comfortable.  There is nothing not to like and the price is affordable.  Please do stay at Ayolah Surf House, you will always want to come back for more!","Amazing place, peaceful and quiet, so close to the beach. Ali runs the place and is a very good host. He will make sure that you have all of what you need and that you are feeling good, plus he is a true surf teacher that will try his best to improve your surf skills.","Really bad experience, took me a year to write a review, because it was so traumatising. Like in other reviews our room was full of rats and the surf lesson we took with ali was horrible. We were both beginners, but he didn‘t care and took us out on huge waves. I got stuck where the waves break and couldn‘t get out anymore. No one checked in on me, they just went out further to take their own waves, I felt like I almost drowned. Ever since I am afraid to go surfing, I really can’t recommend to any person that is not a surf dude who doesn’t care about anyone else. Also ali made homophobic comments in front of my nonbinary partner. In total we felt so uncomfortable that we left immediately. Can’t recommend!","Awesome stay with Ali, his family is very welcoming. Sorted everything out for me, a ride to his place, a scooter and helped with anything. Will definitely be staying there again!",I already stayed there twice and can really reccomend it. Ali and his staff are very nice and with him i improved my surfing a lot. Also did a Surf Trip to Java with him and we had the best time 👍
ChIJERLaVenX0y0RvoVz21rUqiw,Kelapa Surf Villa,-8.4088513,114.79790460000001,"Jl Bahari, Pantai, Yeh Sumbul, Kec. Mendoyo, Kabupaten Jembrana, Bali 82261, Indonesia",https://maps.google.com/?cid=3218618370403567038,OPERATIONAL,+62 831-1502-0556,hotel,"hotel, lodging",5,33,,"My favourite place in Bali. I love the family that run this place, Toni goes above and beyond to take care of us along with his wife Rizka and his cousin Opa. I’ve visited many times and always feel sad to leave. I brought my Grandma with me to meet this wonderful family. The perfect location to access the beach, a restaurant next door and they also have there own mini cafe where they sell Bombolini’s which are similar to donuts and just melt in your mouth. I can’t wait to reunite with this beautiful family","We loved staying here! The rooms where nice, especially the outdoor shower. Everything was super clean and good vibes. The pool area, with shared kitchen is well maintained and a great place to chill after surfing. The staff is very friendly and we felt really welcome! We extended our stay up to 5 nights and we’d definitely stay here again when we’re around. Thank you!","A very cosy place to stay with super kind staff, spacious rooms and a clean garden with a pool! Toni, in charge of this place, makes you feel just like home right at your arrival!","Tony, the host, is a super friendly and helpful guy! He was so welcoming and will do anything to make you feel comfortable. The place is super nice with a fantastic pool area. The surroundings are very quiet and there is a very good and cheap food place (Nals kitchen) as well as a pretty café (wakey wakey) close by. If your lookibg to get away from all the bali trouble, this is the place. Also there is a super good surf spot (medewi point) close by. Very well suited for couples or friends. Tony is also thinking about doing something ""Hostel-style"" so this will be great for solo travellers as well.","Place was really clean, wifi worked really well, the villa had a pool that replicates a bit of Greece with the beautiful white n blue going on! Hot water can be improved but it was a pretty neat and affordable stay for 20 bucks!"
ChIJWXSjuGLX0y0REp2p2nRyoQc,Emir Surfcamp,-8.4124045,114.799741,"Jl. Pantai Medewi, Yeh Sumbul, Kec. Mendoyo, Kabupaten Jembrana, Bali 82261, Indonesia",https://maps.google.com/?cid=549846475726232850,OPERATIONAL,+62 812-3812-6805,hotel,"hotel, lodging",4.3,13,,"We stayed here during Nyepi with an other Family and friends. We really loved this place. The rooms are clean and big, the bed really comfortable. There is a lot of grass for the kids to run around and of course the location straight at the beach is great. The stuff is really friendly and helpful. We can recommend this place 100%.","Nice Welcome, pretty Bungalows with enough space inside. very Close to a fabulous surfspot!
Unfortunately the walls are very thin, therefore you hear the neighbors talk. No reck in the bathroom for anything.","Cool place, new and clean. Excellent bedding, AC and clean bathroom, best value for money. Inexpensive and tasty food n drinks in the own beach cafe, walking distance to Medewi point and own beach break right in front. What else does one need??😍",Clean and spacious rooms. No-frills bungalows.,Best place for surf and relaxing
ChIJjzeXCz7X0y0RDOLY3zQoX4A,Good Vibes Surf&stay,-8.4114053,114.7986649,"Jalan pantai, Yeh Sumbul, Kec. Mendoyo, Kabupaten Jembrana, Bali 82262, Indonesia",https://maps.google.com/?cid=9250156367201231372,OPERATIONAL,+62 877-0105-3171,hotel,"hotel, lodging",4.7,18,,"When you surf, this is your place to be!

Good food, good surf and a nice confy & quiet room very close to the beach.
Will come back for sure!

Thanks for everything.",Really interest place to stay in medewi good position and very close to beach and surf spot also the local people is very humble and nice,Chill & Cheap stay. Relax area. Good vibes village ! ++,"Arrived in Medewi Surf Hostel after a beautiful bike ride from Canggu.
The place is really nice just next to the beach. The rooms are good, free water/coffee/tea and a bathroom. There is a nice chillout space and a hammock to relax, but within 1 min of walking you are on the beach.
Only lovely people around you, my favorite place was the holy tree bar with delicious breakfast with good juices, good lunch and all for a really good price. Everybody welcomes you with a big smile and the ocean is amazing. I had 2 surf lessons from Joel and Riki, both are really good instructors and legends.
A place forever in my mind and def will return. Thank again guys!","Great place if you want to surf everyday. Right on the beach, restaurant is in walking distance or you can drive 5 min for more. No working wifi, mozzies are bad, no a/c. But the surf is spectacular!"
ChIJ28flHqHW0y0RQqdAGXC1cTw,Friend House & stay,-8.4116299,114.79850839999997,"Jln pantai, Yeh Sumbul, Negara, Kabupaten Jembrana, Bali 82261, Indonesia",https://maps.google.com/?cid=4355461807708612418,OPERATIONAL,,guest_house,"guest_house, lodging",4.5,8,,"Staying at this homestay was an absolute delight! The location is fantastic, just a stone's throw away from the beach break, perfect for those who love to surf. There are plenty of dining options nearby, including the cozy Holy Tree café and the Bamboo restaurant, and other choices are just a 10-15 minute bike ride away. The area is incredibly peaceful, with minimal light pollution allowing for breathtaking stargazing ✨ at night. Surrounded by nature, felt a profound sense of tranquility throughout stay. Omar and his family are incredibly friendly and dedicated to ensuring guests have a wonderful experience. They were always attentive to our needs, making sure we had more than enough water and checking in to ensure everything was going smoothly. The room was impeccably clean, with fresh-smelling linens and an exceptionally comfortable bed. Additionally went above and beyond by treating us to delicious coconut treats on several occasions, which added a delightful touch to our stay. Overall experience here was outstanding. Felt welcomed, relaxed, and thoroughly enjoyed time. Furthermore, Omar expertise as a surf coach was evident, as they are highly knowledgeable about the Point Break and offered valuable insights for surf enthusiasts.","Very peaceful location, you can hear the ocean while you sleeping.
Omar is a very very helpful host and the room is matching whith the price. I reccommend it strongly !
Thank you very much Omar 😊","Perfect place during my stay. And it was great experience surfing with Umar, he the most surf coach l need and he really helpfull for my one week surf season. Will be back for sure!",Recommended!!! ⭐⭐⭐,Learn from the best!
ChIJt-X-oZnW0y0RP8qqxrVqm7s,The Anara Surf Camp,-8.4118766,114.7999862,"Yeh Sumbul, Mendoyo, Jembrana Regency, Bali, Indonesia",https://maps.google.com/?cid=13518516035437382207,OPERATIONAL,+62 877-5982-4079,hotel,"hotel, lodging",3.9,68,,The place is nice for its money! Rooms with no ac but with fan. We stayed in a wooden room outside. The bed is nice the sheets are new. The manager is really nice and helpful. Great view from the roof top. The biggest problem is the construction works next to the camp. They started loud works at 7:30 in the morning on Sunday. It was absolutely impossible to continue sleeping since the construction is  right outside the window. Even after our stuff kindly asked workers to be quiet it didn’t help. So if you’re not an early bird I won’t recommend to stay in a wooden room. Maybe it’s better in a main building.,"Our group book 8 rooms
Full Review
4 of our group stay in 2 air-conditioning room on the top. The rooms are fine, but the bed looks old. The bathroom are outside and they have sink to wash our eating utensils. They also provide a bathtub outside.
My friend stay in 1 wooden room. It's pretty cute, the bathroom attached to the room and its outside kinda bathroom. The picture show the room from the outside. The bathroom picture is provided in this page by other people (not in this comment).
Me and the other 9 are staying at 5 rooms on the three stories building, no AC but it's quite cold at night. I provide the picture of my room. We stay during Nyepi day and the rain pouring all day. It leaks in many spot, and there are no staff at the moment so I have to dry my room by myself. But as you see from the picture, the view is really nice, the price is super cheap. For that kinda price hotel, I would give 5 stars if it's not raining. But I feel like 3 star because of the leaking. So in average I give 4 instead.
They give a delicious pancakes with honey, and the restaurant is by the beach. I really having a good time here.
I will suggest the owner maybe to change the bed in the air conditioning room, maybe nicer color, that blue bed just seem not appealing and old. Provide better stove, and probably a table on the non-AC room. Because I put all my stuff on the floor and the floor got wet because of the rain, luckily it haven't reach my stuff. If there is a table, I'll be less worried. Thank you.",had a amazing stay at Anara! the hostess is really friendly and the location is awesome. You walk in 1 min to the beach! bed is comfy and a good mosquito net. Very clean!,"Good place to stay over, the place is quite from crowded road, back to nature area, good view of beach, rice fields and mountains.
Only 2 minutes walk to the beach, near surf spot, at the beach they have warung/cafe you can book food and drinks.
Staff are good, service guess.
They rent surf board, motor bike, arrange for suttle, all you need just ask to staff, they ill helps.","Amazing view from the top, good location. Very minimalistic simple rooms for surfers without AC."
ChIJ95jPWQDX0y0Rl5LUYoWF-Kw,Sumbul view surfcamp,-8.4056657,114.8016757,"HRV2+PMM, Jl. Khayangan, Yeh Sumbul, Kec. Mendoyo, Kabupaten Jembrana, Bali 82261, Indonesia",https://maps.google.com/?cid=12463858776683090583,OPERATIONAL,+62 877-6048-3207,hotel,"hotel, lodging",5,4,,"Very nice room, clean and quiet.",,,,
