id,name,latitude,longitude,address,url,status,phone,primary-type,types,rating,rating-count,price-level,review 1,review 2,review 3,review 4,review 5
ChIJ6cVf9fFE0i0RogyvBWu4WuM,Four Seasons Resort Bali At Jimbaran Bay,-8.7844217,115.15881270000001,"Jimbaran, Bay, Jimbaran, South Kuta, Badung Regency, Bali 80361, Indonesia",https://maps.google.com/?cid=16382609364309970082,OPERATIONAL,+62 361 701010,hotel,"hotel, extended_stay_hotel, resort_hotel, wedding_venue, spa, lodging, event_venue",4.8,2456,PRICE_LEVEL_VERY_EXPENSIVE,"We stayed 5 days on our honeymoon.
We had a villa close to the beach with ocean view. Really comfortable and spacious. Housekeeping was perfect, twice a day at least.
The restaurants are of great quality and service with many options. We also ate on the beach a few steps away from the resort where many seafood restaurants are located. These are cheaper options, quality is generally good or very good. Price for 2 between 200k and 1m depending on what you eat and drink.
The olympic infinity pool is a bliss. The resort offers daily yoga classes for free that are really nice. The gym and spa are also great.
We saw many kids around of all ages. Cannot really comment on kids activities but it also seems to be a great place for families. Overall, I think it is difficult to get it wrong by staying at this beautiful resort!","It is very beautiful, quiet jungle like atmosphere. The rooms are beautiful, clean. It was always so nice just to sit out on the balcony and wash different. Tropical birds flying around. The four season resort is  back off the road. Secluded the only thing that can get down the path is a mopad or walking. Restaurants, little shops, spas within walking distance. Very nice. People are very friendly","We spent 7 days at Four Seasons Residence Villa. The place is huge, pool is so nice and our butler BANA makes the difference with espetacular service. Hotel facilities are amazing and staffs very kind, good quality of food. Kids club have many activities to keep kids from getting bored. But If you want enjoy more the beach is not the best place. Jimbaran beach is not the beautiful one and location is not the best.","Nestled amidst the lush tropical paradise of Bali, the Four Seasons Resorts offer an unparalleled luxury experience that redefines the essence of rejuvenation and indulgence. With two exceptional locations, each one a jewel in its own right, these resorts beckon travelers to embark on a journey of unrivaled opulence and impeccable service.

The Four Seasons Resort Bali at Jimbaran Bay:
Perched atop the cliffs overlooking the majestic Jimbaran Bay, this sanctuary of tranquility envelops guests in a world of understated elegance. From the moment you step into the expansive open-air lobby, adorned with intricate Balinese artistry, you are greeted by a team of dedicated professionals who anticipate your every need with warmth and attention to detail.

The accommodations are a harmonious blend of contemporary elegance and traditional Balinese elements, with each villa boasting a private plunge pool and lush tropical gardens. The resort's culinary offerings are a gastronomic delight, featuring an array of exquisite dining venues, including the renowned Sundara Beach Club, where you can savor exceptional cuisine while basking in the breathtaking sunset vistas.

The Four Seasons Resort Bali at Sayan:
Nestled amidst the verdant rainforest of the Sayan Valley, this resort is a true architectural marvel that seamlessly blends into its natural surroundings. The iconic infinity pool, suspended above the lush greenery, is a sight to behold, offering a serene escape from the world. The villas are masterfully designed, featuring contemporary Balinese decor and private plunge pools with mesmerizing views of the valley.

The resort's commitment to sustainability is evident in its eco-friendly practices, including the use of locally sourced materials and a dedication to preserving the natural environment. The culinary experience here is equally remarkable, with a focus on organic, locally sourced ingredients that celebrate the vibrant flavors of Bali.

Both resorts boast world-class spas that embody the essence of Balinese healing traditions. The skilled therapists at these sanctuaries of relaxation offer a curated selection of treatments, utilizing ancient techniques and natural ingredients to rejuvenate the body, mind, and soul. From the soothing sounds of the chakra ceremony to the indulgent body rituals, each experience is a journey into pure bliss.

What truly sets the Four Seasons Resorts apart is the unwavering commitment of their team to providing personalized, intuitive service that exceeds every expectation. From the friendly smiles that greet you at every turn to the attentive staff who anticipate your needs before you even realize them, the Four Seasons team embodies the spirit of genuine hospitality.

Whether you seek a romantic escape, a family adventure, or a rejuvenating retreat, the Four Seasons Resorts in Bali offer an unparalleled experience that will leave you enchanted and longing to return. Prepare to be captivated by the exceptional service, luxurious amenities, and breathtaking natural beauty that these resorts have to offer – a true embodiment of paradise on Earth.","Yes, of course, this is the service and care for guests from the Four Seasons team, but everything is already quite outdated and not fresh. We were upset by lunch at one of the hotel restaurants; the menu was limited and they even managed to spoil the burger with a dry and unsalted cutlet. The cost of living does not justify its quality at all. For half the money you can stay in much better options."
ChIJZVY6dR1F0i0Rrr0mM0kyMDI,Raffles Bali,-8.786379799999999,115.15788,"Jl. Karang Mas Sejahtera No.1A, Jimbaran, Kec. Kuta Sel., Kabupaten Badung, Bali 80361, Indonesia",https://maps.google.com/?cid=3616445790750686638,OPERATIONAL,+62 361 2015800,resort_hotel,"resort_hotel, hotel, lodging",4.9,876,,"Service was incredible, our butler (Mr Aditya) is helpful and attentive to our needs. The view is breathtaking and majestic, if you have a clear sky during the visit, the ocean looks majestic. The food is a bit pricey compared to a similar resort but the service makes it worth it","I stayed at the Raffles Hotel in Bali for two nights and it was amazing. The hotel has great facilities and views, even better than the luxury I’ve seen at other top hotels. At first, I felt something was missing in the service - it wasn’t as warm as I expected, especially since it was my first day and I didn’t meet any of the hotel’s managers, which was a first for me at a five-star hotel.

But things got better on the second day. The staff really paid attention to what my family liked, especially at breakfast. They remembered our food preferences, which made us feel really cared for. The hotel’s restaurant, Loloan, and the SPA were both excellent and worth trying.

Overall, after a bit of a slow start, the service got much better, and I ended up really enjoying my stay at Raffles Hotel. The personal touches made a big difference.","We had a great time staying at Raffles for 5 nights . The staff are very friendly and very helpful .
Our butler Gaby was very helpful and the other butlers in her absence .
A big thank you to Rina and her team at Rumari Resturant , we were so spoilt at breakfast with local fruits , Rina went out of her way to source my favorite local fruits and packed extra for my ride on checkout day . We also tried local cuisine that she managed to organize as we are vegetarian so were limited to the menu .
Big thank you also to Loloan  Resturant , the staff there were great .
The chef went out of his way and made a beautiful curry that was not part of the menu , despite short notice .
The villa was very cleaned very well , was neat and tidy morning and evening , a big thank you to the service team .
Overall - a great stay and left with our pot filled with so much love 🙏🙏🙏👌👌👌","Beautiful Property and excellent restaurant but several certain items need work. The villas at this luxury hotel are stunning, with Japanese influences and gorgeous bay views. Outdoor lighting though was lacking.

The restaurants are a highlight, serving top-quality food. The pool area is also very pleasant. The BBQ in villas servers endless food :)!

Unfortunately, the hotel's service accommodating its guests through internet or noise disruptions is simply poor. The gym is inadequate, the WiFi connection has dead spot almost everywhere or it’s unusable, and there is construction work happening up until 9pm causing noise to the villas.  At the beach you can’t swim in the sea.

Overall, this hotel has the potential to be fantastic once they iron out the service, noise, and internet issues. If you value beautiful surroundings and great food over everything else, it might work for you. If you need a secluded quiet place currently it might night be the right place. (April 2024) Call to ask.

The pricing over some activities is inconsistent causing some frustration but generally I found that  mostly it didn’t reflect any quality for the asking price.

The secret cave dining experience is really unique and recommended. Overall the F&B and its service provided was consistently excellent.","Everything was amazing! I just did the wellness retreat hosted by Kim Strother at Raffles and this was the best experience ever. Kim prepared a wonderful program in coordination with the hotel who put in place beautiful settings for our activities and ceremonies. The service was the best we have ever had in a hotel, the amenities are great, the place just magical! I highly recommend a stay at Raffles Bali if you are looking for a rejuvenating, private and personalized moment in the island of Bali! I will come back and already plan to be there for Kim’s next retreat at Raffles!"
ChIJEXl_sixF0i0RNm-xk4Fldfg,ASAI Cafe,-8.7850539,115.15659109999999,"Jl. Pura Sekaang, ASAI Village, Jimbaran, Kec. Kuta Sel., Kabupaten Badung, Bali 80361, Indonesia",https://maps.google.com/?cid=17903327500884340534,OPERATIONAL,+62 813-9977-9361,cafe,"cafe, breakfast_restaurant, restaurant, store, food",4.8,607,,"Hidden within the serene village of Jimbaran, Asia Cafe captivates with its charming allure and culinary delights that promise to elevate your breakfast experience. As you step into this tucked-away gem, you'll be enchanted by the inviting interior design that seamlessly blends modern aesthetics with traditional charm, creating a cozy and welcoming atmosphere for guests to unwind and savor the moment.

The coffee menu at Asia Cafe is a true standout, boasting a selection of expertly crafted brews that cater to both coffee aficionados and casual drinkers alike. From rich and velvety lattes to bold and aromatic espressos, each sip is a journey of flavors that will awaken your senses and leave you craving for more. Don't miss the signature blends and specialty drinks that showcase the cafe's dedication to quality and innovation in every cup.

Beyond the exceptional coffee offerings, Asia Cafe also delights with a breakfast menu that is sure to please every palate. Indulge in a hearty selection of dishes that range from classic favorites to creative twists on traditional recipes, promising a culinary experience that is as satisfying as it is memorable.

Whether you're seeking a cozy spot for your morning coffee ritual or a hidden gem to explore in the heart of Jimbaran, Asia Cafe is a must-visit destination that promises a delightful fusion of great coffee, delectable breakfast options, and a charming ambiance that will make every visit a treasured experience.",A hidden gem cafe in Uluwatu. This cafe has a great breakfast menu. You should try their salmon croissant because it’s delicious. The croissant is smells good and the texture is flaky. Their hot cappuccino is good too. This cafe has a nice ambiance and not too crowded.,Love this cafe . The most stylish and beautiful in Jimbaran area. Coffee is great. Food delicious and many not typical dishes. Kids were happy with their breakfast and play area.,I love having green dishes here! Veggies are so fresh and taste good. I’ve tried a bite of Asai sandwich and love it too! The bread they use is so good. Also have kids corner for your kids to have some fun,"Mixed feelings at ASAI Cafe. The place is not comfy, not cozy. It’s a strange atmosphere in there. ASIA does not know what it wants to be. Upscale resto and coffee shop or high end resto. It is as far from Bali feeling as it could be. Maybe I made the mistake of having a burger but an iced tea. But a burger and iced tea at 190k is way too much and it was not even that good. I dislike leaving negative reviews but I am being honest and I say it’s not worth the ride for the atmosphere and the food. There a dozens of better places with a cool vibe in the area. More @zsoltzsemba"
ChIJbzLEqotF0i0RUUp6xXbaycY,ASAI Village,-8.7851007,115.1567262,"Jl. Pura Sekaang, ASAI Village, Jimbaran, Kec. Kuta Sel., Kabupaten Badung, Bali 80361, Indonesia",https://maps.google.com/?cid=14324220293482695249,OPERATIONAL,+62 821-4443-4214,,"resort_hotel, hotel, lodging",4.9,134,,"Absolutely loved our stay at this villa near Jimbaran beach! The location is perfect - just a short walk to the sand. The villa itself was clean and cozy, with a beautiful outdoor space. The staff were super friendly and accommodating. Can't wait to come back!","ASAI Village has a very homely feel, you feel very comfortable in their villas. The staff are extremely friendly and always available to help you, the cleaners, spa and restaurant as well as the team managing the WhatsApp are always professional and easy to deal with. You have everything you need on your doorstep and the furnishings+amenities in the villa are all top notch. The spa was our favourite section of the village, a great sauna and cold plunge and affordable treatments available.","Amazing 2 bedrooms villa ! We enjoyed it so much. Beautiful and comfortable design. Great service. Super clean . Coffee machine, bathrobes, ceramic dinnerware, all appliances. Netflix, Marshall speaker… we love also spa and cafe…will be definitely come back","We had a fantastic stay at ASAI Village! Our villa (Villa A) was spacious and beautifully designed, featuring two identical bedrooms on the second floor and a private pool. The fully equipped kitchen and living area with a TV were perfect for relaxing evenings. The staff was incredibly helpful and polite, and we appreciated being able to contact them via WhatsApp for any assistance. The location in Jimbaran was ideal, as it was close to many different beaches. Having ASAI Cafe and ADAI Spa on-site made our stay even more convenient. Highly recommend for a relaxing getaway in Bali!","I stayed here with my family. We had amazing time and will definitely be back again. Best accommodation in the area. One of the best villa in Bali we’ve ever stayed for such money. Freaking clean, modern and comfortable. Thank you for the great hospitality and service."
ChIJ86j5EotE0i0Rprh5Cq4awxA,Gending Kedis Luxury Villas & Spa Estate,-8.7888501,115.15541590000001,"Jl. Karang Mas No.100X, Jimbaran, Kec. Kuta Sel., Kabupaten Badung, Bali 80361, Indonesia",https://maps.google.com/?cid=1207838459867805862,OPERATIONAL,+62 361 708906,lodging,lodging,4.5,280,,"Lovely place, we had a friendly monkey visiting ones. service was great, views are beautiful. The staff went above and beyond to make our honeymoon a very special experience. I  am more than happy to recommend!","Gendis Kedis Luxury Villas & Spa in Jimbaran, Bali, offers a truly enchanting escape. Just a short walk from Jimbaran Beach's seafood delights, the villa's ambiance is both opulent and homely. The private pool is a refreshing highlight, complemented by the warm hospitality of the staff. An unforgettable, five-star experience.","Oasis away from the hustle and bustle.An absolutely beautiful tranquil setting close enough to everything but secluded enough to provide that quiet restfulness needed after a hectic day shopping and sightseeing.Staff went above and beyond to accommodate us. Honestly can not fault the  team. A special thank you to Gia , Ako, Edo , Katrinka and everyone else whose beautiful smiles greeted us daily with warmth and sincerity. The spa experience was amazing too, very skilled masseuse. Can't wait to return.","Good hotel, rooms is okay, but need some cosmetic repairs. Hotel breakfast is really tasty and restaurant food is too. Sea is dirty. In bad so many wasps, we stepped on them twice, it was painfully =(","This place is incredible!
Staff is super accommodating and friendly at all times.
Villa is spacious, bed is super comfortable and private pool is super nice!
Place is quiet, full of natural suroundings.
Cleaning is done on daily basis.
They even brought cake for my husband (without telling them it's his Birthday). You feel like a part of family here.
Definitely worth staying here :))
And location is the best to explore everything around since its close to everything."
ChIJk-RJE49F0i0RlFQ1DXRO0Uc,The Jimbaran Villa by iNi Vie Hospitality - Romantic Ocean View Villa In Jimbaran,-8.7840948,115.15805359999999,"Mimpi Resort, Jl. Bukit Permai No.88, Jimbaran, Kec. Kuta Sel., Kabupaten Badung, Bali 80361, Indonesia",https://maps.google.com/?cid=5175003707170182292,OPERATIONAL,+62 857-3745-0320,,"hotel, lodging",4.8,312,,"We throughly enjoyed our stay !!! Would recommend to anyone who wants an amazing stay in Bali. Very nice staff, and welcome drink was delicious.  Staff helped us a lot! Housekeeping was very good as well.","Bad experience in this villa,strongly NOT RECOMMEND if you’re coming for a chill and relax trip. There is water disruption on the day we checked in however no prior notice before we arrive and we found it out while halfway using the bathroom. According to the villa worker, they were aware of the water disruption issue since 8am in the morning but the management team did not even care to head us up. We were forced to move out from the villa due to this issue and after liaise with the management team they finally agreed for a full refund BUT they deleted all the messages the next day and claim need further discussion regarding the refund issue. BAD MANAGEMENT, PLEASE DO NOT COME HERE!!!! TRULY DISAPPOINTED","Very nice villa i ever visited, staying here was a fantastic experience and i will never forget it, nara as receptionist is really kind and beautiful, also all staff are very kind. The room is very clean. Thanks","This place literally has everything that you need for vacation. The amenities are all there, you’ll got a private pool and rooftop. The staffs are exquisitely kind and helpful. Definitely recommended!","Great hotel, excellent service, friendly and accommodating staff, good food. Short easy walk to the beach and restaurants. Location a bit isolated but great place to relax and refresh."
ChIJ5SYJ65VF0i0RqEko3E0RPpI,Villa del Cielo Jimbaran,-8.784125,115.1582858,"Jl. Bukit Permai Lot B4 No.8, Jimbaran, South Kuta, Badung Regency, Bali 80361, Indonesia",https://maps.google.com/?cid=10537879204197321128,OPERATIONAL,+62 361 3352076,,lodging,4.4,130,,"Gorgeous boutique style hotel. The breakfast is out of this world as well as the views from the rooftop while you’re eating. Rooms are really authentic and also the balcony is really spacious with view to the pool. Also Gidi (receptionist, room attendant and waiter) was incredible! he’s such a nice person and very helpful with everything. The location is really good, you can walk to the beach (10/15minutes) and it’s a very calm area at night time.","Stay here one night after arrived from Denpasar Airport. The staff is friendly and help us carry the luggage to the room. The room was comfortable and adequate. We enjoy the view on the balcony towards the courtyard pool. Air conditioning was a bit slow even its 16 C. TV network isnt working maybe because our room at the end. Bed is comfy.

Pool was okay size for my kids to swim.
There is a rooftop area for breakfast and cafe with nice view of the sea and airport","Pros:
- plenty of parking
- view from restaurant is great
- food was pretty good
- balcony overlooking the pool and a few trees was quite nice
- somewhat close to various tourist places in Uluwatu

Cons, all related to Room 23:
- the AC was undersized for the room, so it was  warm the entire time. Since the doors don't seal very well, the AC struggled.
- tons of bugs because the doors don't seal. Thankfully, this room also had a family of geckos living there too, so hopefully they can help with the bug problem?
- the shower struggled with getting warm
- toilet paper was mostly gone, no additional roll in the room
- location is far from convenience stores, you need a vehicle to get anywhere
- construction nearby meant early morning noise
- could not stay connected to the wifi

Overall, I wouldn't stay here unless you're struggling to find a place to stay or just looking for a cheap ","the place you don't want to leave from. We had three stays on our month stay in Bali.
it's a hidden gem and by far our favorite place in Bali.
We loved the glass walls in our top floor room with beach and Ocean view, but also the huge bathroom in the pool view room.

the rooftop terrace it's unbelievable, it has one of the best view points of the area, if not the best.
people are great, bed is super comfortable.
all for great value for money, tens of times less money than the resorts nearby.
Everything is great about this location, make sure you don't miss availability here.
highly recommended it!","It's an beautiful small hotel. We had a cosy room with access to the pool. The roof top terrace is outstanding. Everybody is very polite and helpful. The reasons for ""just"" four stars are that the food is good but you can eat much better in Bali, the area around the hotel is not the best and some of the facilities (shower/hairdryer... ) are not in the best condition. But generally I can recommend this place. It's an quite and lovely little place a bit away from restaurants and beaches."
ChIJXTEwie5E0i0Rk9QOdujoelw,Bali Elephants Boutique Villa,-8.788519599999999,115.15835889999998,"Jl. Ritz Carlton Gg. Kencana No.9, Jimbaran, Kec. Kuta Sel., Kabupaten Badung, Bali 80361, Indonesia",https://maps.google.com/?cid=6663894683758810259,OPERATIONAL,+62 812-3880-099,,lodging,3.9,176,,"Soon as i have arrived they try to give me different room and lower price room. When i ask to speak with manager there was no manager and to talk then i took his number to call but staff let him know that i was going to call and he switched he’s phone. After a long trip we had no where to go so we had to take the room but room was dirty, had no windows to open and sharing area was completely dirty. After we spent 10 hours we had to leave and go somewhere else. It was the worst experience in Bali!
I suggest not to use this property don’t waste your time and money. They are so unprofessional.",Really nice villa for relaxation with awesome pool overall I give 10 out of 10 nice behavior of receptionist,"It was a very peaceful place. The room's locking system was a bit weird, but it didnt bother us at all so it was fine. The inn keeper and the people serving us was really nice. We enjoyed our stay there.","Extremely poor condition. Swimming pool, toilet, bed are extremely dirty. Was provided a lock but redundant as the room was accessible through the toilet. Very unsafe as there's no key to lock the door or the toilet. Full of dust and stains in the room. Pictures are totally different.","These stars are for the staff there who were super helpful and tried their best to accommodate our requests. So when we reach the villa, we were a bit taken aback by the not so clean room and not so private pool. The pool too did not look clean. However, the girls at the reception did their best to resolve the issues. They were super sweet and thumbs up to their prompt actions. The bathtub needs to be changed. Basically, the owner needs to maintain the property well and get new fittings for the bathroom. The location was ok for us as we had a two-wheeler."
