id,name,latitude,longitude,address,url,status,phone,primary-type,types,rating,rating-count,price-level,review 1,review 2,review 3,review 4,review 5
ChIJ__8vbMlG0i0Rw5Y1py8xW0I,Diamond Hotel Kuta Bali,-8.7098059,115.18153389999999,"Jl. Raya Kuta No.39, Kuta, Kec. Kuta, Kabupaten Badung, Bali 80361, Indonesia",https://maps.google.com/?cid=4781469510122444483,OPERATIONAL,+62 361 761728,hotel,"hotel, lodging",4.2,444,,Hotel is bit far from city centre and airport. It is a big hotel and good for non vegetarian but VERY BAD for vegetarian since breakfast menu is not including anything vegetarian other than salad. Rooms are very spacious and net. Hotel property is also neat n clean. Pool was not at all clean. We booked pool view room so it was a good view too. Overall stay is good but not good for food since they don’t have kitchen to provide lunch or dinner.,"Small old rooms. Smelly dirty bathroom and dirty towels (floor towel looks more whithe than shower towels). No have soap and cotton buttons, no shower cap. When was booking - on picture  was room with balcony,  but in real  no balcony...
PS The worst breakfast i had on Bali in such hotel's prices ranges...",It's a budget Hotel with good amenities. Bit far from the centre of the city but a quiet place. For vegetarians its a BIG NO since they don't offer options for vegetarians. Also they don't have lunch or dinner ala carte options. Only breakfast is available. We were satisfied with the room since we took pool view room and rooms were very clean,"Hotel somehow a bit away from the beach and bars. But quiet, affordable, great staff and pleasant rooms. All kind of facilities. But you need transport (or take a long walk) for to get away. Sunset food court and sunset road with a lot of restaurants in reach.","First of all it's not a 4 star hotel, it's like a 3 star with stingy amenities and facilities. Poor room cleanliness and standard breakfast menu. The location is okay though, easy access to find foods and shops."
ChIJ95nqas5G0i0RuZ0O3NyQTv0,Ramada by Wyndham Bali Sunset Road Kuta,-8.7040005,115.1816219,"Jl. Sunset Road No.9, Seminyak, Kec. Kuta, Kabupaten Badung, Bali 80361, Indonesia",https://maps.google.com/?cid=18252685618038349241,OPERATIONAL,+62 361 8468500,hotel,"hotel, motel, lodging",4.2,3155,,Very beautiful location of Luxury Hotel Ramada Wyndham in Bali Indonesia. This will feel you a very luxurious and romantic experience. Wather is very nice. Services and facilities are excellent. Free Parking and rental cars available. Wheelchair accessible at parking and entrance gate. Food and drinks are delicious. 🍹🥤🍸🧋🍨🍧😍🤩👌,"The legend hotel, with unique design. Various breakfast, clean room, refill water is good, always available.
Parking lot it's safe. Keep the good jobs guys, 🤘🏻","The room is clean and with this price, the room pretty spacious with 30m² in traveloka information. But sadly i got a connecting room and the their sound proofing is very bad. When i got the room i tried call the receptionist tried to change another room and they said no other room available. I wake up at 4pm because the room beside me was crazy india people who talk loud and arguing about something. And the sound just like they arguing in front of my face.","Good stay. I'm an Indian solo Traveller, booked this property for 6 days. Location is good, not in the market but nearby Krishna Oleh Oleh mall or other market. My room No was 5219. Room & bathroom was neat and clean. All staffs were very friendly & cooperative. Breakfast buffets have many options including veg/non veg, even some Indian dishes also. Have 2 separate awesome swimming pool for kids and adults at roof top 8th floor. Maybe it's old but very nicely maintained beautiful property. Overall nice experience.","Best hotel, best staff very friendly people, loved the food and very happy with the service they provide. Keep it up guys.. I really had a great time here."
ChIJoxkO9dBG0i0RvjOivocGgl8,Swiss-Belhotel Rainforest Kuta,-8.708434,115.18458199999999,"Jl. Sunset Road No.101, Kuta, Kec. Kuta, Kabupaten Badung, Bali 80361, Indonesia",https://maps.google.com/?cid=6882070360664191934,OPERATIONAL,+62 361 8465680,hotel,"hotel, lodging",4.5,4683,,"I recently stayed at this hotel and had a pleasant experience overall. The rooms were spacious and well-equipped with a desk and a comfortable single sofa. However, I found the bathroom to be quite large, although it became extremely slippery when wet, which was a bit concerning.

The service at the hotel was excellent, with the front desk staff and other employees being very friendly and helpful throughout my stay.

One highlight was the breakfast, which was delicious and catered to my taste. Overall, I had a great stay and would recommend this hotel to others.

This hotel quite near with kuta beach","Nice hotel, worth the price!
Cleanliness is the key of a hotel, and they did it.
They also have nice staff 👌🏻
But the only give you bath towel, if you used to use a separate towel for face and hand, you need to ask first.
And they even asked us to review, it means that they care to do improvements. 👍🏻
Please maintain it.","As you can see on the video, the room looks quite old. There's a problem with their water, luckily it's happening on our last hours before checking out, when we call the receptionist, they quickly fixing the water problem, however the water that came out after fixing is totally black (don't now whether it's a sewage water or not). Bathroom door is made from wood so overtime it's getting moldy and the exhaust fan is noisy so you need to close the bathroom door perfectly. Air conditioner isn't too cool, but the room temperature luckily still bearable. When I asked for second keycard they ask deposit of a hundred thousand rupiah (I do the same at other hotel and the other hotel didn't require any money deposit, so it's kinda faze me). Hopefully they do some repairs and update, so there're no more disappointments in the future.","We got free upgrade room from Deluxe to Grand Deluxe when checked in coz our room type was full. It has bathtub and balcony and our kid is super happy. The room is clean, all staffs are nice. The hotel is in good location, just 10 min to Kuta, 18-20 min to Seminyak.

Very nice breakfast with so much variety & delicious food...

Just surprised in the day 2 that they said my 7 years kid got charge Rp 50.000 for breakfast. Yesterday they just let my kid and not tell anything... Little bit dissapointed why didn't inform in the first day, but if this the condition for kids then I accept it. So far it's a quite nice experience stay in this hotel.","Easily the worst experience I've been having in bali.

We were given the room at the end of the corridor and the AC was not working, the floor was oily, the bathroom looked dirty. We called the receptionist and they sent technician. But it seemed that the technician knew that the AC was troublesome and they arranged for a replacement room.

The replacement room was better, the AC was working though it was not cool enough, the floor was not oily, but the bathroom was as dirty as the previous one. Also, the running water was weak and not satisfying.

The breakfast was really far from okay, it was not tasty at all.

We initially booked for two night but we surendered the second night and did early check out because we could not stand and was not having a good feeling with the property.

They seemed to be understaffed as well, we did not received a greeting when we arrive, we barely see security staffs in front of the hotel. When checking out, we ordered a bellman. The bellman was happened to be the receptionist too and helped me to load our lugages to our vehicle.

The leftover feeding utensils from the other guests was seen stacking in front of the room since we checked in and was not cleaned until the next day when their house keeping staffs were making up the rooms. That looked disgusting.

Definitely will not consider to stay here and wont recommend to anyone else either."
ChIJre2KWMhG0i0RgTWOu-9SEiQ,Kuta Central Park Hotel Bali,-8.7103142,115.1793693,"Jl. Patih Jelantik, Kuta, Badung, Kabupaten Badung, Bali 80361, Indonesia",https://maps.google.com/?cid=2599231124543518081,OPERATIONAL,+62 361 769222,hotel,"hotel, lodging",4.2,4178,,"This is a lovely hotel, very serene in the midst of a very busy town.  Rooms are an excellent size & clean. The balcony I had was a very good size as well with the sound of the water features by the pool.  The grounds were lovely with a couple ponds with fish and a couple of turtles.  I only went to the restaurant for a couple of breakfasts which was nice.  They cater for a lot of different tastes and it had a lovely atmosphere in there.  The only downsides were that they sometimes have school trips there and the children are very noisy, running up and down the corridors, knocking on doors and running off.  This only happened on a few of the nights that I was there and it was not really the hotel's fault.","The building and services of this hotel is most similar to a 2 star motel not as a 4 star hotel.
Breakfast quality and quantity was the worst.
It doesn't look like a 4 stars hotel for it's breakfast as they serve minimum variety of foods and most of the time the supplied dishes were empty
Stained sheets and pillows, even though we asked them to change them, they still weren't as clean as they should be..
During our one week stay, two groups of about 300 high school students stayed in the hotel, causing noise early in the morning and until midnight, they would disturb other guests and there were about 6 to 8 students staying in each two or four-bedrooms, and during breakfast, we had to wait until 8:30 for the students to leave the breakfast area, so that the table would be available for other guests, and after that, usually the food containers were empty or half.
I give them one star just because of their staff as they tried their best efforts to service the guest.","An average 3 star hotel. Free breakfast is available in the restaurant. Menu is rather limited. Staff is friendly and courteous but the maintenance of the rooms needs to be upgraded. During my stay, the AC had to be checked by the technician daily to keep it running. Toilet needed better cleaning. A small bottle of water is provided for each guest daily which is highly inadequate.",The room is very clean and well maintained.The staff there is very friendly. The hotel gives the feel of natural vibe. The buffy Breakfast there is very nice .This hotel is very comfortable for the family.,I could live with the roaches in the room if the front desk staff was properly trained to make their guests happy so the  guests would want to come back - the core of a successful hospitality establishment. Very unhelpful and callous front desk personnel. 👎👎👎
ChIJd6U5Mc9G0i0RGPJbWwwMxgc,BloO Hotel,-8.707625499999999,115.17870219999999,"Jl. Dewi Sri No.11 A, Kuta, Kec. Kuta, Kabupaten Badung, Bali 80361, Indonesia",https://maps.google.com/?cid=560148450866098712,OPERATIONAL,,hotel,"hotel, lodging",4.4,1266,,"Room:
The room is quite spacious and they even have a sofa so you can communicate in group or play game together with other friends.

Food:
The food actually is quite delicious and their drink also not bad

Price:
The price is actually not that pricey and the location is in center so it was good enough

The most important thing note:
1. There are a bar just beside the hotel and they have live music till 3 AM, so for those who can’t disturb by sound i really not recommend coming here. The sound is quite big and clearly for me i kinda don’t mind but just to be safe i really not recommend
2. The bathroom floor is so slippery so truly take a note for this especially for elderly. Because when you take a bath you can easily fall down. Safety come first
3. The service is actually not bad but just a small detail is that when we ask for plastic bag they literally don’t have one at all actually this is not important lol but just for note only

Overall i kinda okay to give 4 star but for others who needs more details i decided to give 3 star, the reason because of the live music and the slippery floor that is kinda dangerous.","Affordable hotel in the center of Kuta. The also have family rooms for 4 persons.
The rooms is quite clean, but the we still can hear the noise outside the room.
The location is very strategic where there is lots of street food.","We stayed here for one night in May 2023. The hotel was nice; the room was clean, spacious, and comfortable. The staff was also nice and helpful. The downside of this hotel is its location next to a club. There was loud live music until 3 am on a weekday. We couldn't sleep, and the vibration from the music made it worse. We called the receptionist; he apologized and said the music would stop around 3 am. I had read reviews about the loud music before, but I didn't think it could be that bad.

There was something weird about the water in this hotel as well. It made our skin feel soapy, and the floor was slippery. I thought it might be the hotel's soap, but it wasn't. I tried with my own soap and shampoo; it still made my skin feel soapy. It felt like we couldn't rinse it cleanly.","This place is absolutely   stunning, great staff amazing  service, good food, rooms are nice and the pool/lounger is beautiful  and really clean. If you come to Bali definitely chose this hotel bloo  amazing stunning staff.  The location is really good to all the good shopping places are nearby. The main thing that is absolutely  amazing  that the staff are very nice and friendly.","Value for money. I'm currently staying on my fourth night here. Booked a family room and very impressed with the room. Everything is great, clean, and well maintained. I stay in a spacious room with ample facilities (it has mini fridge & a safe), 2 queen beds, AC works well, bathroom is superb, clean & puffy towels, & wifi is okay. The only downside is the live music noises from surrounding cafe(s)? The music is super loud that makes the glass windows vibrating. I can't sleep until 2-3 AM and it's really stressful. It's a perfect hotel if you are in budget and need to stay near the city center. Great for party goers or family with young adult/teenager. But, not really recommended for family with babies or toddlers, since they might find it hard to sleep. Please do something with the nearby cafe(s)' noises :("
ChIJs8boMs9G0i0Rkn32dTl3GAc,Grand Livio Kuta Hotel,-8.7079281,115.17891039999999,"Jl. Dewi Sri No.17, Kuta, Kec. Kuta, Kabupaten Badung, Bali 80361, Indonesia",https://maps.google.com/?cid=511289646382480786,OPERATIONAL,+62 361 8469700,hotel,"hotel, lodging, restaurant, food",4.4,1525,,"Pros: friendly service, quite delicious buffet food, affordable prices. The family room type is very spacious, equipped with a bath tub, other complementary facilities are quite good. The location is strategic, close to places to eat and shopping for souvenirs.

Con: the building is a bit lacking in maintenance but clean, the swimming pool is very small, the wifi is slow.","A great experience, well behaved staffs and excellent amenities.
Excellent location and well maintained.
Highly recommended for anyone looking for a nice nd comfort stay in Kuta, Bali.","Personal touch. Being a big group we had the choice of menu which has been religiously followed by the manager concerned.  Staff of tge hotel have all been very kind, respectful and very cordial. Cleanliness of the rooms and refilling the room items have been exemplary.","Hotel located near to kuta and legian and easy find food along to dewi sri street, brrakfast variance is good amd everyday is different menu. Staff are very friendly and helpful especially Ms Ratih. Unfortunatelly during first day check in until check out internet connection is not good very very slow and somtime not working. Thank you for IT team who has help added additional thing in the room but its still not fixed sill the same. Will back again to this hotel bit hope for future stay internet connection need to check and make sure it working well. We just need good internet connection.","The room was clean but the beds were so cold and damp. The aircon was very cold and when we made it warmer,  the floor became wet and slippery. Many of us who stayed there became sick with cough and fever the next day.There was a  chair and the legs were shaky. We didn't dare sit on it."
ChIJSWQ_MM5G0i0R4tdodWT0918,"Atanaya Hotel - Kuta, Bali",-8.7035603,115.18059330000001,"Jl. Sunset Road No.88A, Kuta, Kec. Kuta, Kabupaten Badung, Bali 80361, Indonesia",https://maps.google.com/?cid=6915264465154398178,OPERATIONAL,+62 361 8468600,hotel,"hotel, swimming_pool, coffee_shop, cafe, sports_complex, lodging, restaurant, store, food",4.4,3463,,"Good hotel, nice location and service. We stayed there for two nights and our room was okay, but there was too much sound from the road. Buffet breakfast was nice, loved their rooftop swimming pool. Overall it was a good stay.","They have good food for their buffet. The staff are all very friendly and helpful.

The room is quite old, with some of the door knob broken and replaced by a latch lock, the mattress softness between different beds in the same room are different, seems like some are old beds and some are newer. The most unsatisfaction for us is that the safeboxes in our room are unusable. The other small flaws are not a bother to us.

Generally, we had a great stay here.","The hotel is quite good, the rooms and bathrooms are quite clean.
Some rooms have connecting doors so it would be great for quite a big party.
TV channels are not good, it's blurry and very limited.
Service is quite good overall.
Foods are just okay, nothing is special, the breakfast provided is enough to fill your stomach to start your day.",I loved my time at this hotel and would definitely recommend to anyone. The hotel had breakfast services which has amazing delicious foods. The pool was amazing. Hotel staff was very kind and the beds were very comfortable. Location was also nice.,"The rooms was not that great tbh. Sink was leaking, lights were not working properly. But the service was wonderful, the hoteliers were so friendly + they even fix the sink without even asked by me on the first day after i came back to the hotel. The location itself is the star of the show, with many food available around 1-10 minutes from the hotel (LaoTa, Samsam merekak, sate babi bawah pohon, etc). Overall would definetly came back."
ChIJZxcJp85G0i0Rh93sMVkVBek,Taman Air Spa,-8.7072617,115.1829567,"Jl. Sunset Road No.88, Kuta, Kec. Kuta, Kabupaten Badung, Bali 80361, Indonesia",https://maps.google.com/?cid=16790850258554641799,OPERATIONAL,+62 361 8947300,spa,"spa, beauty_salon, park",4.4,861,,Booked through Klook and had a wonderful 90min signature couple massage at 8pm. Therapists were both amazing and very well trained. Great pressure and paid attention to specific requests asked for. Best massage so far for us in Bali and worth catching a grab to for sure. Highly recommended and we have tried many spas in Bali.,My first spa experience and the best till date! I went on a girlies spa reunion date here as soon as we landed in Bali and it was so relaxing and refreshing! The staff are really professional and great at what they do. The place being aesthetically beautiful helps too.,I had a nice spa experience here. The place is large and beautifully designed. It has relaxing and calming ambience. There's separated treatment room for each customer near the water garden. The staff is friendly and skillful. After treatment we will served hot ginger tea. Will surely come back when I go to Bali♥️,"Taman Air Spa in Bali is a true oasis of beauty and relaxation. Nestled amidst lush tropical gardens, this spa offers a serene escape from the hustle and bustle of everyday life. The beauty of the spa lies in its exquisite architecture and tranquil ambiance, creating a sense of peace from the moment you step foot inside. From rejuvenating massages to luxurious spa treatments, every experience at Taman Air Spa is designed to pamper the senses and nourish the soul. It's the perfect sanctuary for anyone seeking a blissful retreat in Bali.","This spa was excellent. The interior is beautifully designed, and the staffs were professional as well as accommodating. Despite being close to a major road noise was not an issue and everything about this place helped create a relaxing ambiance."
ChIJfTU3681G0i0Rv8phTET2J3k,b Hotel Bali & Spa,-8.7035625,115.18413199999999,"Jl. Imam Bonjol No.508, Pemecutan Klod, Kec. Denpasar Bar., Kota Denpasar, Bali 80119, Indonesia",https://maps.google.com/?cid=8730217175880682175,OPERATIONAL,+62 361 8465757,hotel,"hotel, lodging, restaurant, food",4.4,2568,,"We had a great stay at B Hotel Bali & Spa. The staff are most welcoming, we didn't even have to touch our bags from the transport until we got to our room. Check in was pretty much the easiest thing on the planet besides breathing. Room is extremely clean, the shower is to die for, aircon worked superbly and stayed at 16°C the entire time we needed it, the pool is clean, huge and more than enough space for everyone. WiFi is top notch had absolutely no issues there, we utilized the gym most mornings before a beautiful buffet breakfast that is well catered. The location is perfect with the Trans Mall on the same block and many restaurants and markets extremely close by. We enjoyed our stay so much we actually extended our stay. Highly recommended 5stars all round.","Super friendly staff, always willing to help. Rooms are very clean if a little tired, clean towels and bed linen. Nice swimming pool, and reasonable breakfast. Would recommend for a family stay.","Best 5 nights I’ve stayed anywhere in the world as a solo female traveller. Thank you for keeping my room clean, for being kind in greeting me every time I go in or out and for making me feel welcomed. I’ll come here again with my family and friends. I highly recommend this place to anyone","Great Place to stay near the airport. Wifi is Slow, but everything else is amazing. The ambiance, the room cleanliness, the food , and the staff/service is superb","A fantastic 4 Star hotel for under $50 U.S.D. Very comfortable and super clean rooms. Large swimming pool with a bar and the breakfast selection is quite large and fresh. The guest service is truly professional and superb, and very attentive. They also offer SPA services and On-Call Health Clinic & Doctor appointments. The hotel is located on a busy street , but overall very good value for your money. The staff always weIcoming us in and out of the hotel. Special thanks to supervisor Madri, she made sure we were taking care of at breakfast with very attentive service. ll definitely stay here again. Kudos!😊"
ChIJaxzlOHdH0i0RLejss59RwD8,The Aburi Sushi Bali,-8.707817,115.1843414,"Jl. Sunset Road No.108A, Kuta, Kec. Kuta, Kabupaten Badung, Bali 80361, Indonesia",https://maps.google.com/?cid=4593761366278203437,OPERATIONAL,+62 361 4756888,japanese_restaurant,"japanese_restaurant, sushi_restaurant, restaurant, food",4.6,2306,PRICE_LEVEL_MODERATE,"Beautiful looking place! Food was so cheap! It was yum, however the little salmon & avo sushi we got didn’t taste the best. The avocado was not ripe & it was hard & the chicken/crab fried rice we got had lots of chicken grissel/cartilage bits in it which I didn’t find very enjoyable to eat. The clams were delicious & the actual salmon sushi we got off the sushi train was yum! I also loved that it was very packed, so it was enjoyable to eat without a lot of people around you. Considering how well priced it is, I’d come back again & just order different things.","Holaa ma brother and sister. Japanese food review on your way!

This place is very big, large parking space for cars,  beautiful interior for photo hunter's(for IG post 🫣).

They have many varieties of Japanese foods, from sashimi, maki, sushi (Authentic one and Indonesian fusion with the MAYO), Donburi, Ramen, Curry Rice, and many more... Taste wise is great for me, not perfect since only God is perfect hahaha. Salmon is fresh (I didn't take pictures since I am too hungry!) Time from order to get your food around 15 to 20 minutes (8 P.M. and quite crowded). Need to be improved as it takes too long for me compares to other competitor.

Their staff is super friendly, gives you smiles and helpful.

Well it's delightful experience, and would definitely come back for second time to spend with your beloved.

Cheerios
Regards,
Z","One of the more high-end place for sushi and japanese food, and it's worth it.

The food is very good, this place is what makes my like sushi. Even the conveyor sushi is delicious.

Interior is japandi style, it has convivial and calming vibes.
And the bathroom is a LUXURY, it has a FULL BODY MIRROR and is very spacious.","Aburi Sushi is a gem! The ambiance is top-notch, and the service is exceptional. I'm absolutely in love with their tuna creations, and the gyoza were also fantastic. Highly recommend for a delightful sushi feast!","THE WORST curry rice I ever ate, it was overly salty, taste bad and barely edible. The staffs were also not friendly and doesn't seem in good mood because the restaurant was packed with people. The price didn't match with the quality of the foods, yeah that's a thumbs down. The only good thing was the interior was aesthetic and clean. Didn't think gonna come again unless there's change."
