id,name,latitude,longitude,address,url,status,phone,primary-type,types,rating,rating-count,price-level,review 1,review 2,review 3,review 4,review 5
ChIJmzEE5-oY0i0RI4xe2VUYuvs,Pura Gunung Kawi Parking Lot,-8.423579199999999,115.30853169999997,"Tampaksiring, Gianyar Regency, Bali 80552, Indonesia",https://maps.google.com/?cid=18138837206186232867,OPERATIONAL,,tourist_attraction,"tourist_attraction, parking",4.6,201,,"The 10th temple, the other side of the beauty of Mount Kawi. An extraordinary work made by humans hundreds of years ago. Visit for the umpteenth time on August 22, 2023, to see and enjoy a masterpiece in the 10th temple complex. You must visit when visiting the Tampaksiring area, Ubud and its surroundings.","If you are on Bali please do not miss this extraordinary place. Amazing piece of history and a wonderful experience. To note, plenty of steps.",Great art stone wall creation with beautiful landscape,Do not park here with bike and consider other location for your car. They will try to charge 5000 parking fee. Tourist scam.,Historical site from Bali Ancestors during kingdom period
ChIJoxbRMOoY0i0RbdTeMwpxYnw,Pura Bukit Gundul,-8.4243392,115.3119277,"Jl. Gn. Kawi, Tampaksiring, Kec. Tampaksiring, Kabupaten Gianyar, Bali 80552, Indonesia",https://maps.google.com/?cid=8962850497054561389,OPERATIONAL,+62 813-3732-6848,hindu_temple,"hindu_temple, tourist_attraction, place_of_worship",4.7,11,,,,,,
ChIJP4YeKscZ0i0RMUtUT1ijeJw,Waroeng Podjok GK,-8.423610799999999,115.30949520000001,"Jl. Bayu Suta No.73, Tampaksiring, Kec. Tampaksiring, Kabupaten Gianyar, Bali 80552, Indonesia",https://maps.google.com/?cid=11274941266805410609,OPERATIONAL,+62 878-6099-6010,restaurant,"restaurant, food",4.9,107,,Great food! Located near the temple and I thought it was reasonably priced 22k for the Chinese chicken pancakes and 10K for a Diet Coke. She does have a restroom but I recommend you use the one in Temple Park. Wonderful people,Delicious coffee and great service. Mie goreng was one of the best we have had. Cold coconut was also refreshing. The prices are great. The only thing was that we were not able to pay by card.,"Food is cheap and amazing, staff are very nice. Very well located right by the temple as well. Just think of this place as you struggle back up the steps to leave the temple","Highly recommended place, the food is super tasty and delicious,  love the fried rice so much. They have a free wifi , you can ask the password to the owner, they're so nice and friendly.","Best satay i had in Bali, would definetely recommend this place"
ChIJweRwqewY0i0Rv_urjszlH0Y,ACK TAMPAKSIRING,-8.4266876,115.30794829999999,"Jl. Dr. Ir. Soekarno No.103, Tampaksiring, Kec. Tampaksiring, Kabupaten Gianyar, Bali 80552, Indonesia",https://maps.google.com/?cid=5053009973662710719,OPERATIONAL,+62 819-9919-1993,restaurant,"restaurant, food",4.2,87,PRICE_LEVEL_INEXPENSIVE,Decent fried chicken in the middle of no where.,..nice place to hangout..,"Like any other ACK, it's pretty good.",Cheap fried chicken with good taste.,Good service
ChIJ2RMF2uwY0i0RcB3L-dI7iC0,Kafe Kawi,-8.4236615,115.31088989999999,"Objek Pura Gunung Kawi, Jalan Werkudara, No. 1, Tampaksiring, Kec. Tampaksiring, Kabupaten Gianyar, Bali 80552, Indonesia",https://maps.google.com/?cid=3280938105859415408,OPERATIONAL,+62 812-3948-4403,cafe,"cafe, coffee_shop, store, food",4,31,,"Tiny cafe, had an Ice latte here, in the morning very quiet place with only serene sounds of birds and wind. Wonderful place to grab a coffee before or after visiting the temple","Kafe Kawi hands down best views. The food is good. The juices are good and the fried bananas the best. The staff is really nice and the place is just a great location. The kafe has a resident cat, born in the temple and now looked after really well by the kafe staff, Sita is her name and she is really sweet.","Favorite place!! We decided to have lunch before exploring the temple nearby and it was awesome. The sky was clear and we enjoyed our meals with a view on Mt. Agung, the highest mountain on Bali. Prices were not expensive at all.","Incredible view, very good noodles, great coffee and pretty good apple pie. Super friendly staff",We tried a vegetarian nasi campur and it was excellent. The staff is very friendly and the view with mount Agung is beautiful.
ChIJWVWXKu0Y0i0RWTcB9wSFnAs,Warung Makan Ulam Carik,-8.4290176,115.3075931,"H8C5+92W, Jl. Dr. Ir. Soekarno, Tampaksiring, Kec. Tampaksiring, Kabupaten Gianyar, Bali 80552, Indonesia",https://maps.google.com/?cid=836689887154485081,OPERATIONAL,+62 812-3954-000,restaurant,"restaurant, food",4.7,37,,"Although not particularly welcoming, the food was delivered quickly and we enjoyed it. We had the fried noodles and sayur hijau which were both delicious. The restaurant was clean and cool.","Great food, great prices!!
Wife and daughter enjoyed it, terimah kasi.",Great foods made by mom and daughter. When you are traveling to watch volcanos in Bali best place for lunch,The food is good and at good prices. The owners are very honest and polite. Recommend!,Simple warung with local cost friendly food
ChIJV8iMResY0i0RAer-UzOD0vQ,Warung Nasi Keplak Bu Anggreni,-8.4256998,115.308235,"H8F5+P7H, Jl. Dr. Ir. Soekarno, Tampaksiring, Kec. Tampaksiring, Kabupaten Gianyar, Bali 80552, Indonesia",https://maps.google.com/?cid=17641306946839439873,OPERATIONAL,+62 877-6249-6701,indonesian_restaurant,"indonesian_restaurant, restaurant, food",4.5,91,,Traditional Balinese pork with rice and veggies plus soup. All very fresh and tasty. Family run business.,Must try delicious local food and cheap,Delicious Food and super friendly staff. Thank you for having us.,"One of the place to grab Balinese dish in Tampaksiring, taste good cheap price",The cuisine very delicious...this is true Bali even not Halal
ChIJ0Y5NME4Z0i0Rhjnl3GGefOc,The Capung,-8.4271959,115.3063132,"H8F4+4GG, Tampaksiring, Gianyar Regency, Bali 80552, Indonesia",https://maps.google.com/?cid=16680381263028500870,OPERATIONAL,+62 878-6109-7255,restaurant,"restaurant, food",5,2,,,,,,
ChIJYaRcouoY0i0R7Fgy1mBK_28,RUMAH MAKAN NIANG MAKO,-8.4219217,115.3088326,"H8H5+6GP, Jl. Dr. Ir. Soekarno, Tampaksiring, Kec. Tampaksiring, Kabupaten Gianyar, Bali 80552, Indonesia",https://maps.google.com/?cid=8070250837042157804,OPERATIONAL,+62 853-3845-5189,indonesian_restaurant,"indonesian_restaurant, restaurant, food",4.9,14,,Simple normal food if you want to eat something fast and decent,"The chili really goods in here, I like it.",Best ❤❤❤❤,,
ChIJAY67HesY0i0R4_kh6y-lliw,Remy Homestay,-8.4240661,115.30939169999999,"Tampaksiring, Gianyar Regency, Bali 80552, Indonesia",https://maps.google.com/?cid=3212937009402345955,OPERATIONAL,+62 822-3682-8007,hotel,"hotel, lodging",4.8,14,,We spent our last days in Bali staying in Remy's Homestay and we had a wonderful time. The village is beautiful and is so close to Ubud and to everything around to explore! I recommend it to anyone who wants to stay a bit far from the tourists and wants to enjoy the Balinese culture. Remy's family is beautiful and they provide a good service!,"We had a really good time there. The village is a must see. You can go to be blessed by water and see one of the most beautiful temple I've ever seen . All that just by walk.
All around the streets Ogoh Ogoh the demon big statues are amazing to see.

Remy and is family are just careful enough to make your trip authentic and learn about the culture while you LL still have your privacy.

Definitely recommend this place for anyone who wanna enjoy an authentic travel.

If you want a luxury place maybe search for something else. You'll find there all you need good bed, hot water, good toilet even tv in your room, all that in a simple way.",I stay at Remy Homestay often frendly staff good atmosphere and enjoy there hospitality,,
ChIJ7YLic-UZ0i0R6ZXe8-NNW9E,Green Carik,-8.4235165,115.31114529999999,"Jl. Gn. Kawi, Tampaksiring, Kec. Tampaksiring, Kabupaten Gianyar, Bali 80552, Indonesia",https://maps.google.com/?cid=15085737018251974121,OPERATIONAL,+62 812-3883-4569,restaurant,"restaurant, food",4.4,25,,"It’s a great place to have a rest a bit if you are visiting Gunung Kawi Temple. Not for only enjoying the foods and drinks, but you could also take a swing and zip-line (flying fox) adventure, having the best time with the view of the rice-field landscape🤩","We did the Zipline and treetop trekking course here and it was a wonderful experience! Set among rice terraces and jungle, this was the most beautiful place for a Zipline. The equipment was safe and my kids were taken care of so well by the staff. Adults and children loved this Zipline. So much fun and stunning photographs. It was a dramatic way to get down to the Gunung Kawi Temples. Highly recommended!",The view was very nice but im so disappointed about the food .you will get small portion of chicken 😂 so the food was disappointing but the place was very nice tho,Disappointing size of food(micro chicken) and price. Rice is a small cap.. drinks under average.,Nice place with good food and amazing view. I had a chicken with peanut sauce and local ice cream
ChIJ8_UhQOwY0i0RMb2uBRimtQw,Geriya de Kakiang Homestay,-8.427565699999999,115.31182419999999,"Jalan Surya Brata, Geriya, Tampaksiring, Kec. Gianyar, Kabupaten Gianyar, Bali 80552, Indonesia",https://maps.google.com/?cid=915820721344527665,OPERATIONAL,+62 812-3918-820,lodging,lodging,4.5,15,,"Clean rooms and AMAZING breakfast.  I would rate it the best breakfast I was provided during my 2 month stay in Bali.  There is no hot water (which is known and advertised), but the internet did not work once during my stay.",I love the ice coffe from kakiang and the cake.. 😍😍,"Home, yes truly this is my home :D",Cozy stay @ nature environment,Peaceful and genuine
ChIJ32_R5HkZ0i0RpCIl5b03t-c,Warung Makan Sari Merta,-8.4268498,115.3079433,"Tampaksiring, Gianyar Regency, Bali 80552, Indonesia",https://maps.google.com/?cid=16696875432232166052,OPERATIONAL,+62 819-9919-7270,restaurant,"restaurant, food",4.6,16,,"The food was amazing. We tried the nasi and mie goreng + terong and everything was delicious, plus very cheap (50k for all)

Must try!! 100% reccomended

The staff was also very welcoming and friendly, we love when people smile :)",Really good nasi and mie goreng and probably the best Tofu & Tempeh we had in bali. Also try the fried bananas for 2k,Super authentic place with delicious food and a heartwarming host.,,
ChIJk-AhG8YZ0i0R20tZjW6codE,PEGASUS COFFEE & EATERY,-8.4224721,115.30831579999999,"H8H5+288, Jl. Dr. Ir. Soekarno, Tampaksiring, Kec. Tampaksiring, Kabupaten Gianyar, Bali 80552, Indonesia",https://maps.google.com/?cid=15105526623809129435,OPERATIONAL,+62 831-1454-5957,coffee_shop,"coffee_shop, cafe, store, food",5,1,,,,,,
ChIJE8nTMtMZ0i0R9shF6r_jepg,SW AGROTOURISM BALI,-8.4235955,115.3106016,"Banjar temen,jln, H8G6+H69, Tampaksiring, Kec. Tampaksiring, Kabupaten Gianyar, Bali 80552, Indonesia",https://maps.google.com/?cid=10987344654332446966,OPERATIONAL,+62 811-399-460,cafe,"cafe, food",,,,,,,,
ChIJrwDy5-oY0i0RlWN-_9vkdMk,Warung Keruyuk Food And Drink,-8.4233771,115.30897770000001,"H8G5+JHX, Jl. Gn. Kawi, Tampaksiring, Kec. Tampaksiring, Kabupaten Gianyar, Bali 80552, Indonesia",https://maps.google.com/?cid=14516479132457395093,OPERATIONAL,+62 812-3607-779,brunch_restaurant,"brunch_restaurant, breakfast_restaurant, restaurant, food",5,2,,,,,,
ChIJufTTtewY0i0Rr7ngH3W_84o,Warung Makan Lawar Bali Me Darti,-8.427696,115.3077301,"H8C5+W3H, Jl. Dr. Ir. Soekarno, Tampaksiring, Kec. Tampaksiring, Kabupaten Gianyar, Bali 80552, Indonesia",https://maps.google.com/?cid=10012556906341644719,OPERATIONAL,+62 819-9924-8363,indonesian_restaurant,"indonesian_restaurant, restaurant, food",4.9,8,,"Super tasty food and very cheap too. Nice, friendly owner",,,,
ChIJKWLxTMUZ0i0RD16taykGiOQ,Waroeng Bali Gk,-8.423700799999999,115.3089002,"Jl. Bayu Brata, Tampaksiring, Kec. Tampaksiring, Kabupaten Gianyar, Bali 80552, Indonesia",https://maps.google.com/?cid=16467418812450168335,OPERATIONAL,+62 831-1591-5702,indonesian_restaurant,"indonesian_restaurant, restaurant, food",5,16,,"Amazing food, we were so hungry and didn’t know where to go and we found this place by chance while everything was closed due to public holidays in Ubud. The food was great and the service was so kind, they even prepared some fruit we’d brought with us without any extra charge. The little restaurant is very charming and the food is definitely traditional Indonesian food. Totally recommended.",Delicious meal and very kind and friendly service 🙏🏻,Very nice place. Local/cheap prices and the food quality was very good. The owner was very friendly with us and very helpful with recommendations!,"Very nice and clean place, tasty food ! I recommend it !",Very good food and friendly staff :)
ChIJcdMkr-wY0i0RfwCdN09WnPg,Gunung Kawi Waroeng 2,-8.4269409,115.30808489999998,"H8F5+66G, Jl. Dr. Ir. Soekarno, Tampaksiring, Kec. Tampaksiring, Kabupaten Gianyar, Bali 80552, Indonesia",https://maps.google.com/?cid=17914288316008431743,CLOSED_TEMPORARILY,,restaurant,"restaurant, food",,,,,,,,
ChIJcTQaoOwY0i0RBELiB5yr64o,Pondok GTP_GF (Geriya Tampaksiring Game Farm),-8.4264495,115.3089476,"Rurung Alit Banjar Geriya, Tampaksiring, Kec. Tampaksiring, Kabupaten Gianyar, Bali 80552, Indonesia",https://maps.google.com/?cid=10010283283396575748,OPERATIONAL,,,lodging,5,1,,,,,,
