id,name,latitude,longitude,address,url,status,phone,primary-type,types,rating,rating-count,price-level,review 1,review 2,review 3,review 4,review 5
ChIJ_____2Mm0i0RtNQPrt_mIms,Natural Hot Spring Sahabat - Air Panas Piling Kawan,-8.3997944,115.1317036,"Mengesta, Penebel, Tabanan Regency, Bali, Indonesia",https://maps.google.com/?cid=7719986559638820020,OPERATIONAL,+62 812-3866-6165,spa,"tourist_attraction, spa",4.6,87,,"Went there 3 weeks ago.
TICKET : 25K/Person

On the way was nice landscape with beautiful view
Road are a bit rough Al along the village there.

The pool Hot spring was dirty I would say.
At the bottom the pool can feel so many crumble of something hard.
Toilet not clean
The floor also can say that they don't clean it. Be careful slippery.

This place need to be clean!!

It has 3 pool there but only 1 pool that we can use.
1 pool was empty & the other 1 was with old dirty water.

The view was surrounded by rice fields and just nature.
Met the American guy that own the Green house just across of the street of the Hot spring gate.","We arrived around 5pm it took us some time to get there from Ubud, owner was so nice! We asked for two coconuts, they charged us 20k for two and went with us to the pool with knife and long pole to cut it from the coconut tree 😆 which was next to the pool. This is sulphur water and only one pool was available, the other one was empty. Water is about 37-38 degrees. This place has big potential but needs to improve. Ticket is 25k per person. I hope owner can increase standard and clean changing room and toilet, we stayed there for two hours and we had pool just to ourselves. Overall great experience!","Great hot spring and amazing scenery of rice field and nature. Feels like a paradise still untouched and not overdeveloped which is amazing if you're into that kind of thing. Very narrow road so some drivers might not want to risk the drive, definitely worth checking out.","place is very quiet even on week end not so many people. very peaceful place. was camping for 3 nights at this amazing place. dud not expect that place is so beautiful. with amazing view to mountain and rice fields. family is so nice. they host my like family member. hot spring is very nice. from small streams coming hot water. you can sit watch river and be at same time under hit water stream. i go after to Jatiluwih rice terrace and decided to come back and stay few more days.
thank you to hosting me.","Perfect, beauteful place in the middle of Rice fields and flowers.
The water is hot, they also have cold shower and toilet.
We had the place to our self, magic.
In the way there you can also see a really big tree, if you Come from canggu."
ChIJH40F6Bgn0i0Rf-GY8yHcqRk,Kebun Ishaan,-8.399652399999999,115.1312719,"J42J+3HV Kebun BliToet, Mengesta, Kec. Penebel, Kabupaten Tabanan, Bali 82152, Indonesia",https://maps.google.com/?cid=1849251160391213439,OPERATIONAL,,park,park,,,,,,,,
ChIJodKJjkon0i0Rgo2FHdE5qrI,Kebun BliToet,-8.399759399999999,115.13141039999998,"J42J+3HV, Mengesta, Penebel, Tabanan Regency, Bali 82152, Indonesia",https://maps.google.com/?cid=12874166055098224002,OPERATIONAL,,park,park,,,,,,,,
ChIJ2aQ-Zm8m0i0RX2bLcI6U4P8,Alit Arsana BraaapMX Piling Kawan,-8.399616199999999,115.1287587,"J42H+5G2, Mengesta, Penebel, Tabanan Regency, Bali 82152, Indonesia",https://maps.google.com/?cid=18437900213953455711,OPERATIONAL,+62 857-3714-5527,hotel,"hotel, lodging",3,7,,My village,,,,
ChIJX9xKyQwn0i0Rbzidph94Tno,"Pura Beji Siwa, Pedukuhan Maya Tan Maya",-8.4052658,115.13027710000001,"H4VJ+V4R, Jl. Piling, Mengesta, Kec. Penebel, Kabupaten Tabanan, Bali 82152, Indonesia",https://maps.google.com/?cid=8813113598145280111,OPERATIONAL,+62 812-4697-9800,park,park,,,,,,,,
ChIJAZPfhGMm0i0RdYM0OXHfpaQ,Waroeng Makan and Spa DD,-8.400035299999999,115.1362127,"H4XP+XFP, Jln Raya, Mengesta, Kec. Penebel, Kabupaten Tabanan, Bali 82152, Indonesia",https://maps.google.com/?cid=11864134470761481077,OPERATIONAL,+62 857-3718-8099,restaurant,"restaurant, food",,,,,,,,
