id,name,latitude,longitude,address,url,status,phone,primary-type,types,rating,rating-count,price-level,review 1,review 2,review 3,review 4,review 5
ChIJZQ46BfNE0i0RkAnntciy0jo,Opia Bali,-8.7860027,115.1590011,"Jl. Bukit Permai No.2, Jimbaran, Kec. Kuta Sel., Kabupaten Badung, Bali 80361, Indonesia",https://maps.google.com/?cid=4238646774424078736,OPERATIONAL,+62 819-9943-8787,restaurant,"restaurant, wedding_venue, food, event_venue",4.7,577,PRICE_LEVEL_MODERATE,"We celebrated my husband birthday with our parents and friends. Had a wonderful experience here!!! The food is great and the restaurant is so so so beautiful that we took lots of pictures. The service here is also awesome, special thanks to Sherry!!!  Highly recommend Opia.","Opia offers an absolutely breathtaking experience that words struggle to capture. The venue's beauty is simply stunning, and the staff, as beautiful as the surroundings, provide exceptional service. The food, divine in every sense, elevates the entire experience. Truly, Opia must be experienced firsthand; no photo can do it justice.","Positive : staff super good and friendly, really nice atmosphere, interior stunning. We received a really tasty welcome drink. The appetisers, the tuna dish, the fries and the dessert (the deconstruct) were really delicious.

Room for improvement : the chicken wings were really dry. The lettuce dish even though well presented was just half a lettuce with not much else. What was on top of it was good but not enough.","It was a wedding experience of a lifetime. After our wedding with the help of the very helpful staff at Opia I instructed them to do their very best as this was not your ordinary marriage celebration. This indeed was a union that was put together by a supernatural  Christian God that put this incredibly special woman in my life. They accepted the challenge.
This was a surprise dinner. After the wedding I told my wife we were going to a special place we could buy better quality food and I was going to cook for her and our guests. She sort of bought it but thought this is really far out of the way and started to yell at our driver in Bahasa ""where do you think you're going you're going the wrong way!!!"" Driver says "" patience please.....smiling"" so we finally arrived but she says where's the store...I'm staying here I don't want people looking at me in the supermarket.....I started laughing then said sternly ""you're my wife I'm telling you now to get out of the car we are going in"" she looked like a scolded child and said Ok...so we entered the gate and was met by our lovely event manager. She said nothing as I guided her to the gate which allowed us in to a unimaginable candle lit table with a white rose floral arrangement surrounding our two plates, champagne glasses, silverware  and menus. It was stunning. The table was at the end of a long walkway which was surrounded by water and Greece like architecture with very romantic lighting. It was like a fairy tale. My wife was so overwhelmed she didn't think we were in the right room and said OMG I'm getting out of here and she started running out. I started laughing and said "" Honey this is all for you, she said no you're wrong it's not for me....she was stunned for a few moments until it sunk in. Tears ensued and very big smiles appeared....we pulled it off she had no idea..
I never saw her so happy and excited. Opia did an incredible job and are now a part of our wonderful family tradition. God bless my friends and thank you so much. You will see now the pictures that were taken by their incredible photographer. Just amazing.","Had the most wonderful dinner here tonight! They welcome you with a complementary welcome drink and then follow up with a complementary after drink.

The food was great, the atmosphere was even better but the highlight was the waitress who served us. My son who is 2 years old is very restless and the waitress (forgot to ask her for her name!) was so kind to entertain him and keep him happy.

Super kid friendly, and we would love to go back soon! Thank you for such a lovely dinner 😀"
ChIJ3YBq4O5E0i0RlW72n64sswg,"Pat-Mase, Villas at Jimbaran",-8.789584,115.156416,"Jl. Karang Mas Sejahtera 100x, Kawasan Bukit Permai, Jimbaran, Jimbaran, Badung Regency, Bali 80364, Indonesia",https://maps.google.com/?cid=626893901654290069,OPERATIONAL,+62 361 708708,hotel,"hotel, lodging",4.2,137,,"My parents arrived to Bali for the first time, what a terrible experience when they entered the room and couldn’t even flush the toilet.

Lizards and ants everywhere. I get it, we are in the tropics but the swarms are everywhere , including the rooms.

The other room smelled and the linen that covers the beds was full of stains.

The villa looked dated and not maintained. Horrible experience and we checked out after 5 minutes.

The good part is that the staff was nice enough to give us a partial refund.","There are wonderful things about this stay, and some things to know as well. For the right people, this place is amazing. For some, it might not be so.

I booked and stayed here through Airbnb - there are a few different villa owners as far as I understand. On Aibnb it is called ""PRIVATE VILLA COMPLEX"". We stayed at F5 Gangsa Villa.

Important to note: The Gangsa Villa is right next to a semi busy road. The bedrooms sit right along the wall next to the road, and there isn't much soundproofing. Expect to hear the cars and motorbikes on the road throughout the day and a little less at night during your stay. I slept with earplugs and slept great. Not a deal breaker, but always good to know what you are signing up for. I wouldn't call it a quiet and tranquil spot, but it is a fabulous villa.

The Gangsa villa at Pat-Mase Villas is very big and spacious. The master villa is completely separate from the other 2 bedrooms, which is a lower and upper floor. The master has a giant desk that was really great for working. It even has its own separate wifi router as well with great wifi speeds. The bed is very comfortable for Bali in my experience, and comes with a giant mosquito net.

For a couple, or up to 3 couples, this villa is awesome. Or for a family with older kids. I would say this would not be ideal for a family with young kids due to the master being so far away from the other 2 bedrooms. Located on the other side of the property with the pool in between.

All of the bedrooms have nice bathrooms attached. The master has a huge walk in closet area, and a beautiful bathtub area in addition to 2 sinks, a big shower, and toilet. The bathroom and closet do not have air con and the windows are not very easy to open so there isn't much air flow.

The outdoor living space is awesome. Lots of tables and chair space, a fairly comfortable seating area with a giant smart tv! That was really great. Since you can hear the road and the tv is outdoor, it was a little hard to navigate the sound levels - to be loud enough to hear, but not too loud to bother the neighbors.

The kitchen is quite decent with a large gas stove, big fridge, and the essentials. Dewi helped stock it up for me with a rice-cooker, water-heater, pots and pans, knives, and a cutting board, serving bowls, and all the rest. There is no fan or aircon in the kitchen space, but it opens up to the living area outside. As I would cook, I would get quite sweaty due to it not having any airflow haha! But no biggie, this is Bali! Sweaty comes with the territory.

The pool is very large, and is not deep, single depth across. Great for kids! Great for a quick cool-off or to lounge, but there are no chairs to sit by the pool. There is another pool down the steps that is for everyone, right next to the villa as well, with sun chairs. So pools are plenty here! The staff came to clean the pool daily and kept it clean for a daily morning swim.

Location wise, you are a short scooter ride away from Jimbaran beach, tons of local shops and fancy hotels like Raffles and Four Seasons. You will find an awesome seafood spot on the beach called Lia Cafe. Definitely not one to miss for sunset. We had great massages at The Calma Spa - recommended by Dewi. I found a nice western bakery with good coffee, sweets, and gelato right down the road at the Samasta as well. You can find anything you need in this area. Close to the movie theater, malls, and more. Then, you are only a 25-30 min scooter or taxi ride away from all of Uluwatu's best beaches, surfing spots, cafes, and spas down south.

If you are hoping to stay within walking distance or a short ride, I would probably recommend to go further south as it is quite a ride out. A car, scooter, or taxi is really a must for this location.

Fabulous villa, comfortable beds, and the fast internet. The cleaning was sometimes lacking due to the need of more communication about what to clean and when.","Nice place, kinda scary though. Security is not that great giving an uneasy vibe to the place. villas are hard to lock and the windows are bordered up shut, rooms have very bad lighting.

Furniture was not the best nor were the amenities. In saying that - the pools were lovely, staff really tried hard to provide the best service for guests.

Villas location was also not ideal. Depends on what you want from your holidays though, good for larger groups,","I could write a long story about this place but will keep it as brief as possible. In short not a very good place. First the good news - the staff are very friendly and nice and the villas are roomy. After that it's all downhill. We had to move villa twice due to problems (no hot water, aircon issues, creatures making loud noises at night in the rooms). We were advised that the villas are each privately owned and the levels of maintenance (Lack thereof) indicate this. The state of disrepair is not good. Leaking toilets, shower roses that need replacing, holes in floors, gaps in doors when they are closed (if you can close them) etc...

The Wifi for the whole complex kept breaking down and they had to call technicians. There is no Wifi ever in your villa and this is a big mistake. There is only limited wifi outside the villa in an outdoor lounge area, but this works on and off and at best is really slow....

Breakfast is a joke. Worst I have seen for many a year. The food is terrible and cold. The hi-light was an egg or toast. The setting is even worse. It is outdoors with no fans and on the edge of a very busy road. So the noise is overwhelming and too hot to enjoy a meal. What's more is that the capacity of the eating area would not be 10% of the complex capacity so was over loaded at times - we were told on the first morning at 9am to come back another time - they close at 10am!!! They also set up tables into reception for people to eat.

Sad, because the concept of private villas is a good one, but this has serious design faults and needs some money spent to bring it up to standard. I do not understand how this place could have been recommended to us from our travel agent. Sub-par.  The location is also not near anything so you need to take taxis a bit.","Very disappointed with this location. We previously stayed at Alaya Resort and although smaller living quarters, the service was absolutely amazing compared to this. We were right near the lobby, asked for ice about 6 times and yet no one was able to come by. Towels were the same situation. We asked if they could make a reservation at a restaurant for us as we don’t speak the native language and rather than calling, they said it shouldn’t be a problem and just go. I don’t know whether it was true or because they were lazy, but because of our experience so far we are assuming the later. I don’t recommend this location to anyone. We haven’t even spent a night here and we are already looking for other, more reputable places to stay starting ASAP."
ChIJyWghsaNF0i0RfpNU9ofHilg,Villa Prana,-8.7840638,115.1574549,"Komplek Mimpi Resort, Jl. Bukit Permai No.Kav 9, Jimbaran, Kec. Kuta Sel., Kabupaten Badung, Bali 80361, Indonesia",https://maps.google.com/?cid=6380131208890979198,OPERATIONAL,+62 821-2231-5519,,"resort_hotel, hotel, lodging",4.5,128,,"Beautiful view. Nice rooms, but not the cleanest. Nice bathrooms. The area is not very walkable, so you have to take a motorbike or car everywhere. I walked to the beach and it took about 30 minutes. I would not do it after sunset because the roads are so windy and there are no sidewalks. Breakfast seems to be different everyday and is good. There's always coffee and tea available. Friendly, helpful staff. Good value for the area.","Good place to spend with family, friendly staff, squicky clean for the main house, nice view from 4th floor, you can catch sunrise and sunset in this spot. Give free simple breakfast for six people. Very close to jimbaran beach.
The tiny pool on the 3rd floor is dirty and no water, the main pool a lil bit dirty too. The check in was one hour late. The location a bit far from any mini market. You should bring some drinks and food before get to the villa.
But over all, its a nice place to stay.",It's a private villa compound  with a great view of the sea  on 3rd floor.,Nice villa with stunning view of Jimbaran bay from the roof top. The room is clean and the price is affordable. I enjoyed my stay in this villa.,It has nice cozy but small rooms with sea view. Staffs are friendly. It is walking distance from jimbaran beach.
ChIJbVxVfbhF0i0REC9Fqe8wGo0,Del Cielo Rooftop Cafe,-8.784033500000001,115.15825799999999,"Jl. Bukit Permai Lot B4 No.8, Jimbaran, Kec. Kuta Sel., Kabupaten Badung, Bali 80361, Indonesia",https://maps.google.com/?cid=10167492914637516560,OPERATIONAL,+62 821-4471-4799,restaurant,"restaurant, food",4.5,35,,"The view is stunning. But please don't come for food here.
We ordered pizza, seafood pasta and surf&turf. All were terrible: pizza made from a standard frozen one, seafood was the cheapest seafood cocktail (unrecognizable chunks and pieces) and the tuna was small and dry. Only the shrimps and potato free were fine.
The staff weren't rude, but didn't care much.
The space was well decorated, but the music was irrelevant.","It's a nice small rooftop restaurant, with very limitedseatingcapacity. You have to take the elevator to a higher floor - I think it was floor 3.

The waitress was friendly when she took the order. The only challenge we had in this place, they had no stock of fish, shrimps or seafood.

Every time we asked for a dish, they didn't have it. So we ended up ordering a Hawaian pizza 🍍 which was not great.

The base of the pizza was a frozen bread. They heated the base, added the ingredients on top, and served it as a pizza.

The view was great. That's unarguably the best part of the restaurant.","Pros:
- Great rooftop views.
- All the food we tried was delicious.
- Price is reasonable considering the quality of the food & views.
- The staff are friendly.
- Tenderloin steak was tender and cooked to requested level. I assume they actually used good quality meat.
- Western and Indonesian options.

Cons:
- No AC, but this is to be expected for an open air rooftop cafe.
- Road to get there is a little rough for the last bit, but not impassable.
- Food took a while compared to other places we have been to, but was worth the wait!

Price range given includes a main and a drink.","A gem in Jimbaran. Clean, modern, great atmosphere. The view over the bay is spectacular. The food is tasty. The prices are sooooo affordable. We had a Caesar salad and a sirloin steak with pineapple juice and mineral water for less than 10 usd.",This is a memorable place for me as this is where I ask my best friend to be my girlfriend! Thanks to all friendly staffs and manager who set all things up for me even playing our favorite songs. Will come back when I visit Bali.
ChIJd-YbQolF0i0RIipQCICvvsM,RUMARI,-8.783968300000002,115.15287629999997,"Jl. Karang Mas Sejahtera No.1A, Jimbaran, Kec. Kuta Sel., Kabupaten Badung, Bali 80361, Indonesia",https://maps.google.com/?cid=14104904047401118242,OPERATIONAL,+62 361 2015800,restaurant,"restaurant, food",4.6,36,,"This hidden gem offers a culinary adventure that will leave you longing for another taste of Bali. At the heart of this exceptional experience lies a maestro chef Gaetan Biesuz whose passion radiates through each exquisitely crafted dish.
Every plate is a testament to artistry and the vibrant flavors of Bali. Familiar ingredients dance in unexpected combinations, a testament to the chef's talent and innovative spirit.

The service complements the cuisine perfectly – attentive without being overbearing. The staff effortlessly guide you through the menu, offering insights into the cultural inspiration behind each dish.

A Must-Visit for Culinary Experience

This restaurant isn't simply about satisfying hunger; it's about embracing Balinese culinary heritage with every bite. If you're searching for authentic flavors, exceptional service, and a taste of culinary artistry, this is your haven.","Came here by chance with a last minute booking and it turned out to be our best meal in Bali! Absolutely stunning food, local ingredients treated with total respect and a real showcase of Indonesian cuisine and flavours. Service was impeccable and the cocktails were some of the best made I have ever had! Highly recommend if you can.","I went here for Sunday Brunch and dinner. The brunch was quite best deal to me, got a champagne pairings as well. I wish the cheese selection was not local ;p

However everything was so good, food, service, and ambiance were super nice to me.","We had the ""Secret Cave"" dinner at Rumari as guests at the Raffles retreat. Nothing I can possibly say in a few words can do justice to the experience. Everything was just perfect. From the incredibly ""detailed"" delicious food which is truly deserving of a Michelin star, the almost transcendental environment within a natural cave surrounded by the beautiful flora of Bali, to the impeccably attentive yet subtle and very friendly service. A very memorable experience indeed which I cannot recommend enough. Just go!","My last visit was on January 2023, and I got different treatment compare to foreigner. Manager said there was dress code, but why foreigner was ok not to follow the dress code? Food was OK, but for me the service was terrible, please treat all of your guest equally."
ChIJC-jWc0hF0i0R3E8yF0tNcZM,The Writers Bar Bali,-8.7840493,115.1528897,"Jl. Karang Mas Sejahtera No.1A, Jimbaran, Kec. Kuta Sel., Kabupaten Badung, Bali 80361, Indonesia",https://maps.google.com/?cid=10624357980850769884,OPERATIONAL,+62 811-3820-9559,bar,bar,4.8,19,,"The best afternoon on earth, I don't exaggerate.

It's my third time to come and try, and it's indeed the best afternoon I have ever tried.
And another plus point, it's VEGAN!! How cool is this.

Scones were quite a downside for me, but this time it was improved a lot!!

Great! U will regret if you miss this experience before you leave Bali.",Best bar in Bali 👍 pricey of course but it’s worth it . Amazing view. Christophe is welcome 🤗 🙏 Thank you very much guys 🫶,"Nice but they are not allow to taking a pictures or videos. Which is annoying for me, I  preferred looking for another place rather than here... Such a bad service","Delicious tapas, superb service , amazing view👌🏻",Exclusive! Like many Raffles bars around the world this is very special and classic at the heart to Bali. A must visit if you are around this area .
ChIJjQBAWPBE0i0RzmlkSLUMN4U,O'hare Villa (Mimpi Resort),-8.7833031,115.1554753,"Villa O'hare, Jl. Bukit Permai No.Kav 18-19, Jimbaran, Kec. Kuta Sel., Kabupaten Badung, Bali 80361, Indonesia",https://maps.google.com/?cid=9599155103506655694,OPERATIONAL,,resort_hotel,"resort_hotel, hotel, lodging",4.5,60,,"Such a Beautiful place to stay. No noise and it is  Extremely peaceful. The place is a True Haven. You have a wonderful supermarket close by called sidewalk in Jimbaran bay, that caters for a your needs. The view of Jimbaran bay from the top floor is Breathtaking. It is incredibly clean and the Staff are so friendly and helpful. The Whole family loved our time there. We are longing to return.","Located in the hills of Jimbaran Bay, Villa O’hare is well situated in a lush tropical setting. Quiet and secluded with glimpses of the bay it is the perfect place to enjoy a relaxing holiday.

The villa has the added bonus of wonderful and attentive staff that will make you feel right at home. I personally can not fault my experience here. It’s well worth staying here in the peace and quiet and making the effort to go into the busier areas for shopping etc.

There are plenty of great local restaurants to treat yourself.

I will come back and stay again!!!!!","We've loved it! Great staff onsite, super helpful. The villa is very spacious and well-maintained. Great value for money!","This place is a gem👌 I really didnt know what to expect being first time in bali and booking 2 rooms off expidia. So upon arrival. We were greeted by the caretakers (they are super nice and friendly) we communicated over google translate because I dont speak Balinese. We had the whole place to our selves, beautiful big house with a killer view our stay was short...... but I enjoyed my stay so much that I returned on my own and rented the private villa this time and it as well was pretty dope and shared the same background and killer view. Oh and the breakfast was pretty good local food with fresh fruit👌 the picture is the breakfast view.","Friendly caretaker with Pa Ino, breakfast of local food always ready, villa is always clean, amazing view and just 5 star everyrhing"
ChIJVevfzeBF0i0R4BFyo-JibB8,Jimbaran Escape Villa by Island Escape Villas (IEV),-8.789729,115.15547620000001,"Sejahtera 100x, Kawasan, Jl. Karang Mas Jl. Bukit Permai, Jimbaran, Kec. Kuta Sel., Kabupaten Badung, Bali 80364, Jimbaran, Kec. Kuta Sel., Kabupaten Badung, Bali 80361, Indonesia",https://maps.google.com/?cid=2264293438204809696,OPERATIONAL,,hotel,"hotel, lodging",3.6,5,,"I wanna Share the truth experience staying here.  This is located in the villa area and damn! Really difficult to find because the name not mentioned inside Patmase complex, then the villa is really noisy because the wall side of the main road, so pricing doesn’t match the condition of the villa, I heard at inside complex area is rented out for only 700k a night with same facilites?  so please those who are on vacation think more about booking at this villa.",,,,
