id,name,latitude,longitude,address,url,status,phone,primary-type,types,rating,rating-count,price-level,review 1,review 2,review 3,review 4,review 5
ChIJATsParM_0i0RyGDQ19wYDZc,"Waroeng Spesial Sambal ""SS"" Batu Bulan",-8.610483799999999,115.25311349999998,"Jl. Raya Batubulan, Batubulan, Kec. Sukawati, Kabupaten Gianyar, Bali 80237, Indonesia",https://maps.google.com/?cid=10884383211216986312,OPERATIONAL,+62 856-2575-039,indonesian_restaurant,"indonesian_restaurant, restaurant, food",4.1,3426,PRICE_LEVEL_INEXPENSIVE,"good food, taste good, so spicy but I love it, very recommended","This waroeng is a good place to hang with your buddies if you enjoy hot and spicy chili mix with Indonesian style fried chicken. Unfortunately, the meat might not be what you expect, it’s rather tough and dry.

They are rather packed for a dinner, and people come and go while we were eating, so it’s definitely popular. The sambal is their main point though, so it looks like I’m not the target market.","They serve Indonesian food and various sambal or spices

Lunch time is very crowded your order will be take long

Affordable price
Food is tasty, they offer fried or grill
Spacious parking lot","Calling out all spicy lovers to go to this restaurant!!
All food taste good with affordable price. The parking area wasn't that large but quite enough for 20 motorbikes and maybe 2 cars. They have many variants of sambal you can try it one by one. I really love their ""sambal terasi matang"" and ""sambal bajak"". Payment method is available for cash and debit-card👍",Offers halal food known to locals here . Was brought by our local driver and this place did not disappoint. Dishes were cooked on the spot and tasted really really good! Portion are small but prove is reasonable . Rice would be charged as per pax but can be refillable . Great hidden gem!
ChIJIY20lCA_0i0RkS3fOw7XmZk,Batubulan,-8.6142583,115.25708689999999,"97P4+7RW, Batubulan, Sukawati, Gianyar Regency, Bali 80582, Indonesia",https://maps.google.com/?cid=11068114015373700497,OPERATIONAL,,,lodging,4.5,20,,Photograph isn’t allowed . Only 1-2 hand  weaver. A big show room of art and craft items specifically balis style cloths and bed sheets,The driver from kabinawa Bali tours is amazing great customer service and the best tour guide in Bali,🇮🇩,,
ChIJAQAAALc_0i0RB4BD3UWeBU8,Kecak Dance Batubulan,-8.6104375,115.2578125,"Jl. Smki No.25, Batubulan, Kec. Sukawati, Kabupaten Gianyar, Bali 80582, Indonesia",https://maps.google.com/?cid=5694131326781980679,OPERATIONAL,+62 823-4064-3830,performing_arts_theater,"performing_arts_theater, tourist_attraction, event_venue",4.5,251,,"The fire dance in Bali is an enchanting and mesmerizing experience. The skillful dancers, with their dynamic movements and the dramatic play of flames, create a captivating spectacle. It's a vibrant expression of Balinese culture and a must-see for anyone visiting the island..","I watched the Barong Dance in the morning (08.30 - 09.30 WITA/GMT +8), spacious space to watch Barong Dance. They provide ID-EN-CN flyers about the story of Barong Dance.

Different prices for locals and foreigners.","Loved the morning performance. The written synopsis of the play was super helpful, meaning we knew just what the story was about. The Barong in particular was mesmerizing - I couldn't tear my eyes away! Musicians played beautifully too.","Absolutely an interesting performance, The Barong and Keris dance live performance was so amazing to watched while you on the way to ubud tour, wasn't nor complete if we not watching this balinesse culture while you visiting Bali island definitely amazing dance, affordable ticket entrance, it is took time approximetely an hour only.",Really enjoyed the cultural dancing. Highly recommend.
ChIJHSA-m7M_0i0Rd_TZvjIZXQ4,Tari Barong Dan Keris Batubulan,-8.6098775,115.2533225,"Jl. Raya Batubulan No.295X, Batubulan, Kec. Sukawati, Kabupaten Gianyar, Bali 80582, Indonesia",https://maps.google.com/?cid=1035011195106096247,OPERATIONAL,+62 361 298038,tourist_attraction,tourist_attraction,4.5,435,,"This one place you can enjoy traditional bali dance, one of famous is Barong dance. Barong is mythologycal animal from Bali and symbol of righteousness and justice. The show take about 45 minutes and you will have a stories script with some language choice like english, japan, china, france etc.. but all performance will perform in Balinese language, ya sometimes maybe the artist will speak in english but not many, hopefully they can upgrade the show in english and have any screen to show the plot of stories in english text, it's hard to understand the performance because we can't understand the language and sometimes it feel boring. But i'm apriciate with all artist and give a spectacular performance for all guest :)","one of the Balinese dances which contains many interesting stories, including the story about good versus evil... and there are also funny stories... worth watching...",Very nice place with traditional Bali style dance,"Best tasting satay we had in Bali. Not the biggest, but very flavoursome.","On the way right to , we are stopped there.. take a look"
ChIJVcyQKCE_0i0RTsqd0HY-Wxo,KALAMANSI - BALINESE - INDONESIAN RESTAURANT,-8.6150456,115.2536782,"Jl. Raya Batubulan No.99, Batubulan, Kec. Sukawati, Kabupaten Gianyar, Bali 80237, Indonesia",https://maps.google.com/?cid=1899180347893860942,OPERATIONAL,+62 361 8402013,indonesian_restaurant,"indonesian_restaurant, restaurant, food",4.6,355,,"Spacious restaurant, not many visitors.
It was only me and my husband enjoying their meals, coffee, and cake. All of our orders were top notch. Price also fair. Hence, quiet surprise they’re empty of customers. Located next to main road, close to the Bali Bird Park. Worth a try.","Very good food at good prices especially batagor dumplings and amazing lychee and lemon iced tea, pleasant service","Stopped by here for lunch in between the bird park and the butterfly park. Food was quite good, though not super fantastic. Enjoyed the nasi goreng and mie goreng. Ayam panggang was decent but not the best. I thought my iced latte was too watered down. Pumpkin soup was too much pumpkin and not enough cream. Desserts wise, the oreo cheesecake had too much cream and not enough oreo, and the opera was a tad dry though the taste is quite good.

Atmosphere is not bad, quite a big place with lots of space, and it wasn't busy on a late Saturday lunch.","Tasty nasi goreng and mie goreng, pizza was great too and so was beef burger. Fries portion too small. Ayam pangang manis was the least impressive along with pumpkin soup which was too viscous and thick. Juices and iced teas were fresh and cooling. Oreo cheesecake and classic opera were too dense, didn't enjoy them as much. Service was good, they serve complimentary cold water, place was clean and spacious, toilets are indoors and adequate. Overall a nice place to stop by for lunch after visiting Bali Bird Park. Highly recommend.","Loved the food. The menu is very good. We tried nasi goreng seafood, nasi goreng kembing, Gerang Asem Iga, Gulai Nangka, teriyaki salmon and chicken burger. All were so tasty. Wanted to try papaya salad too. Next time may be. Ice milk coffee was good. Nice decent brownie too. Coffee was same as melbourne.
Very affordable price with out the worry about hygiene as I have young kids with me.
Very nice environment.
We saw the bird park and reptile park and this resturant is 7 min from there.
The staff we so welcoming and helpful.
Overall exceeded expectation."
ChIJN9wuHK4_0i0RNL5rU4CvABU,Warung Sate Babi Buk Nyoman,-8.611026599999999,115.2532088,"97Q3+H7P, Batubulan, Sukawati, Gianyar Regency, Bali 80237, Indonesia",https://maps.google.com/?cid=1513402440486731316,OPERATIONAL,+62 821-4748-2725,indonesian_restaurant,"indonesian_restaurant, restaurant, food",4.7,523,PRICE_LEVEL_INEXPENSIVE,"For just 15,000 IDR, I enjoyed a delightful meal of white rice paired with pork satay. It was not only delicious but also offered great value for the money.","We ordered babi sate. The lady said 9k without rice and 15k with rice. When we went to pay, she said everything is 15 K. Such a scammer",Good pork satay. Taste so yummy and juicy. The price is very cheap only 15k for 1 plate full of pork satay with rice. They also sell some pork skin cracker. I eat 5 portion satay and rice with a lot of pork skin cracker and 4 soft drink only 90k rupiah. Very reccomended for people who want come to ubud and monkey forest to visit this place and have a great lunch,"One of the best pork satay I’ve eaten in Bali, if you are heading to Ubud from Sanur or Denpasar you can easily spot this humble sate joint. The satay spices is nice, you can either eat the satay with nasi sela (rice with yam chunks) or with tipat (ketupat or steamed shaped rice).",They serve traditional pork satay ala Bali
ChIJMV-k5LM_0i0REV2lZ5CgFqI,Warung Babi Guling Mika,-8.6116009,115.2532897,"97Q3+983, Jl. Raya Batubulan, Batubulan, Kec. Sukawati, Kabupaten Gianyar, Bali 80237, Indonesia",https://maps.google.com/?cid=11679699225706585361,OPERATIONAL,+62 812-3951-318,indonesian_restaurant,"indonesian_restaurant, japanese_restaurant, restaurant, food",4.4,527,PRICE_LEVEL_MODERATE,It's a family run business which makes the best of the pork. There are many places in Bali which serve this dish but this place has the best. Don't hesitate to try their spicy sambol and fried chicken feet,"I think this is the most authentic Nasi Babi Guling (Roasted Pork with Rice) . Worth the price and the taste really good. You will like it especially if you like food with strong herbs. Served with 'lawar', satay, and pork crackling. They also serve a soup too (i don't really know what's inside but i think it's like some parts of coconut). I recommend this place.","They have different prices for local 1 set cost 35k. For anyone not Balinese eventho indonesian would be charged with 50k for standard portiona and 60k for complete portion, would suggest just order take away 20-25k/portion.","One of the best local original taste babi guling in Bali. The place is located roadside on the way to Ubud. Making it a good stopover during your journey. Parking is plenty just on the side of the road. The first thing you see when you enter the restaurant is the Babi Guling displayed on the counter, brings confidence that such a small stall can finish a pig a day. The meat is juicy and crispy, the soup is tasty, and the urap balances everything. Would recommend the restaurant for sure!","It's a small warung. I am just passing through and saw the warung is so crowded, then I am stopping by. The Nasi Babi Guling is cheap and the taste is ok. Recommended to try."
ChIJVXPG37Y_0i0RN8ZZMEbAY8E,Watuluna Guest House,-8.614025999999999,115.2550493,"Jl. Sapu Jagad No.13, Batubulan, Kec. Sukawati, Kabupaten Gianyar, Bali 80237, Indonesia",https://maps.google.com/?cid=13935193079705880119,OPERATIONAL,+62 813-3901-2822,hotel,"hotel, lodging",4.9,27,,Got an entire loft room for an unbelievable price. The host Bagus is easygoing and has lots of dogs. Dont go if you are scared of small dogs.,"Real-life recommend this place. It has everything you need and it's really chilled. The owner and the staff are the best part, super friendly and will help you out whatever is that you need. They pick you up in the airport and take you to exchange money, buy your things and all the basic arrival needs. Wifi unfortunately isn't good and water pressure also not ideal. Still, would recommend specially if it's your first time in Bali. Oh they also have a scooter to lend you and are happy to give you some driving lessons.","Great place to stay in Batubulan, Gus will take care of you! Easy access to Sanur and Ubud while still living in a fairly traditional Balinese village area where you can experience the real Bali. Rent a bike from Gus and explore the area, the locals are really friendly and there are traditional markets, silver stores, Kecak and Barong dances, and other great activities nearby.","Such a treasure!

The owner was friendly! There's a lot of dogs and I'd love it! 💕

Homey and comfy place! 10000% recommended kalo pusing dengan hiruk pikuk kota.","I stayed 1 month! Super friendly family, the place was great! Not touristic place, quiet, easy to get Ubud! Owner helped me a lot!! Definitely I will stay here again!!! ;)"
ChIJIxuCjVY_0i0Rg_Sw8u7JWhw,Nasi Ayam Kedewatan Sangtu,-8.6142372,115.2535737,"Jl. Raya Batubulan No.16, Batubulan, Kec. Sukawati, Kabupaten Gianyar, Bali 80237, Indonesia",https://maps.google.com/?cid=2043167409077023875,OPERATIONAL,+62 812-3996-815,restaurant,"restaurant, food",4.5,79,,"They made me paid the iced tea 10k instead of 5k and said that it was not the same than the one on the menu.
There are no ice tea at 10k in the menu","Love the food, so delicious.
Their team are very polite and welcoming.","Good food, price and services",Food not bad service the crew welcome,Place that serves good taste in its food.
ChIJu2LiirY_0i0RgF0dHGXZo0w,Maheswari Kost,-8.6128994,115.25690480000002,"97P4+RQR, Jl. Smki, Batubulan, Kec. Sukawati, Kabupaten Gianyar, Bali 80582, Indonesia",https://maps.google.com/?cid=5522496596372970880,OPERATIONAL,+62 812-3651-0400,lodging,lodging,4.3,22,,,,,,
ChIJXbTZkbM_0i0RbqsUD_67wNk,Mie Anglo Pak Dar,-8.6105695,115.25338740000001,"97Q3+Q9C, Jl. Raya Batubulan, Batubulan, Kec. Sukawati, Kabupaten Gianyar, Bali 80237, Indonesia",https://maps.google.com/?cid=15690747801607908206,OPERATIONAL,+62 815-5822-2799,restaurant,"restaurant, food",4.8,94,,"The most delicious Mie Godog or Noodle soup I ever ate. It is cooked in “Anglo” a traditional stove made from clay, and it uses charcoal. The charcoal smoke gives a unique taste to the food. Mie Godog is originated from Java - Yogyakarta area, and it is famous for most delicious Indonesian cuisine. Other than noodle soup, they also sells fried noodle, fried rice, etc. I am so happy that I find this place on my way from Ubud to Kuta. I might say this is the best Mie Godog in Bali with very affordable price, awesome","It was just a try and error kind of thing. If it’s good, finish the food. If it is bad, let’s find another. Surprisingly, it’s good and we ended ordering another plate. For an 18K rupiah tasty noodle, cooked on hot charcoal, and generous portion, this one definitely should not be missed.
Location: exactly across SS Batubulan","So delicious foods, the price is standart, quality and taste is so good, very recommend, always coming back here to eat this delicious food, love it, please keep it up 🙏🏽🤲🏾👌🏽👍🏽🥰",this food is very recommended.... so delicious... must try....,"Delicious noodles and fried rice!
Recommended 👍🏻👍🏻👍🏻👍🏻"
ChIJVXP4fT8_0i0RIEkum5zYYhg,Sate Babi Dek Moglong,-8.609716299999999,115.25333640000001,"Jl. Raya Batubulan No.3, Batubulan, Kec. Sukawati, Kabupaten Gianyar, Bali 80237, Indonesia",https://maps.google.com/?cid=1757204971757914400,OPERATIONAL,+62 831-1911-6850,indonesian_restaurant,"indonesian_restaurant, restaurant, food",4.7,54,,"Definitely the best in Batubulan.
Always crowded. Nice place for snack time.
Tasty satay, cold drinks available.","Although the place is small, this menu for pig satay (Sate Babi) were affordable with authentic seasoning. Recommended place for looking Sate Babi in Bali with authentic original seasoning.",Best sate babi on the area,"One the best pork satay in Batubulan, it's a must to taste....",Delicious and Affordable Price
ChIJu5vWeLY_0i0R3hmNvfX6tTY,Sanggar Gamelan Cendana Batubulan,-8.6121645,115.25753109999998,"Jl. Smki No.24, Batubulan, Kec. Sukawati, Kabupaten Gianyar, Bali 80582, Indonesia",https://maps.google.com/?cid=3942332982186809822,OPERATIONAL,+62 361 298657,cultural_center,cultural_center,4.7,29,,Nice place,,,,
ChIJW8MQsEo_0i0RyJarZaw61HE,Onlyswed. Kitchen & Bar,-8.6176169,115.254523,"Jl. Raya Batubulan No.171, Batubulan, Kec. Sukawati, Kabupaten Gianyar, Bali 80237, Indonesia",https://maps.google.com/?cid=8202245333463045832,OPERATIONAL,+62 881-0377-76398,restaurant,"restaurant, food",3.7,44,,"Good store , humble people , good service good quality !! Thankyou🤗",Good place and great menu✨,Nice place to hang out,,
ChIJkcotq8g_0i0RxQDl04Mjhiw,JFC Batubulan,-8.6132857,115.2536587,"Jl. Raya Batubulan No.19, Batubulan, Kec. Sukawati, Kabupaten Gianyar, Bali 80237, Indonesia",https://maps.google.com/?cid=3208290833650745541,OPERATIONAL,,fast_food_restaurant,"fast_food_restaurant, restaurant, food",3.2,6,,,,,,
ChIJRdNN6XU_0i0RsDFeWma49BQ,Cwie Mie Malang Batubulan,-8.6133715,115.25375489999999,"97P3+MF3, Jl. Raya Batubulan, Batubulan, Kec. Sukawati, Kabupaten Gianyar, Bali 80237, Indonesia",https://maps.google.com/?cid=1510034524818256304,OPERATIONAL,+62 881-0373-37720,restaurant,"restaurant, food",4.9,43,,"When travelling to Bali, it's good to try an authentic Javanese food.

To be frank, I haven't tasted Cwie Mie before, but this place served a nice flavorish Cwie Mie and am sure the taste is not far from Cwie Mie served in Malang as the owner herself is preparing the meal.

The place is reasonably small, but it's clean and comfortable. Car parking may have been a small issue as this place is situated just by the street.

Price wise is very affordable and worth every penny.

Payment can be made by cash and Qris.","Best Cwie Mie I ever had.. The soup so fresh, noodles delicious & combine taste very good.. Make me smile every time I eat.. Regular customer.. And now they have a delivery order, if near Batu Bulan area, minimum order 100K.. Naiissss..
Suwun Mba..","Best noodles i had so far in Bali. If you're vegetarian it's no problem because you can order Cwie Mie Ayam Jamur and explains, that you don't need the chicken. She also understand English :)","Nice place, clean and comfy. Most importantly the noodle is yummy and tasty.",Finally found this incomparable cwie mie in Bali! It was taste as close as original cwie mie from Malang. Their mie was homemade and crafted by the owner as well. Hope this business will grow and succeed.
ChIJf4ZKwMA_0i0R86QHa5gSwGM,Umasari kost,-8.612293,115.25775609999998,"Jl. Smki No.22, Batubulan, Kec. Sukawati, Kabupaten Gianyar, Bali 80582, Indonesia",https://maps.google.com/?cid=7187765451123303667,OPERATIONAL,,private_guest_room,"private_guest_room, lodging",5,3,,,,,,
ChIJ175jqLc_0i0RiC7FbZwve3s,Ruang Antara Studio,-8.614899399999999,115.25716899999998,"Jl. Hyang Sangsi, Batubulan, Kec. Sukawati, Kabupaten Gianyar, Bali 80582, Indonesia",https://maps.google.com/?cid=8897757837703589512,OPERATIONAL,,art_gallery,art_gallery,4.9,15,,Ok,,,,
ChIJia1hc7Y_0i0RHZbeb51-viQ,GFC Bendul (Glory Fried chicken),-8.6119589,115.2584636,"Jl. Smki, Batu Bulan, Gianyar, Kabupaten Gianyar, Bali 80237, Indonesia",https://maps.google.com/?cid=2647692845592253981,OPERATIONAL,+62 877-4335-2358,indonesian_restaurant,"indonesian_restaurant, restaurant, food",4.1,61,,"The chicken was good, rather than KFc or Mcd I would preferably choose this, love how Bali has their own chicken recipe,",nice place...n ayam gepreknya juaraa,"Nothing special, just a normal fast food place to eat your meal, especially chickens.",Chicken cold by the time fries arrived,
ChIJWwDR-LE_0i0R53khcyBTKX8,Sate bu nyoman ala lovina dan gungde,-8.6112257,115.2535061,"Jl. Raya Batubulan No.101, Batubulan, Kec. Sukawati, Kabupaten Gianyar, Bali 80237, Indonesia",https://maps.google.com/?cid=9162946315697617383,OPERATIONAL,,restaurant,"restaurant, food",5,2,,,,,,
