id,name,latitude,longitude,address,url,status,phone,primary-type,types,rating,rating-count,price-level,review 1,review 2,review 3,review 4,review 5
ChIJ34NJRY9H0i0R3yLsqt-e4LU,Tony's New York Pizza,-8.6574682,115.1528676,"Jl. Bumbak No.110B, Kerobokan, Kec. Kuta Utara, Kabupaten Badung, Bali 80361, Indonesia",https://maps.google.com/?cid=13105649599130641119,OPERATIONAL,+62 822-3661-3665,pizza_restaurant,"pizza_restaurant, restaurant, food",4.7,156,,"The pizza is fantastic. As close to proper NYC style as you can get.
The Garlic Knots and Fried Mozzarella are also excellent. The marinara sauce is close to the best I’ve had in Indonesia.
The zeppole desert with hot honey and Nutella are also amazing!
But the buffalo wings…. That’s what keeps us going back. They use Franks Original Sauce just like in Buffalo NY!
Love this place!!!","pizza is bali is never great but this is prob as close as u could get. the sicilian and large cheese slices in the glass were better than than the made to order 12 inch pie but both were good. service was kind and quick. plenty of bike parking but not much for cars. definitely worth a shot if you’re sick of the thin soup margarita pizzas that seem to be the only choice around. inside was a tad uncomfortable as it was almost as hot as outside, so sit near the ceiling fan.","Best pizza in Bali yet. Never ate in, always got delivered, travelled well. Tried most of the flavour buffalo chicken and the chicken jalapeño were the winners. The dipping sauce for the crust was also tasty and drinkable 😂","First time tried this Artisan Pizza with Buffalo Chicken Pie on the menu, they recommend me to try it with Hot Honey and turned out be amazing! Will be back again, and order another slices. I hope they open in Jakarta","I must say it's one of the best Artisan Pizza in town! love the toppings, the sauce and especially the crunchy bread itself! it's a MUST TRY food if you're in Bali! Definitely will be back & try the other menu's😋"
ChIJhbIaWWVH0i0RGsmz6nOcPnM,Abian Biu Mansion,-8.664246,115.15472289999998,"Jl. Umalas 2 No. 106, Banjar Umalas Kauh II, Tunon Kerobokan, Kuta Utara, Kerobokan Kelod, Kec. Kuta Utara, Kabupaten Badung, Bali 80361, Indonesia",https://maps.google.com/?cid=8304246784590596378,OPERATIONAL,+62 361 4735405,hotel,"hotel, lodging",4.3,113,,"Best value stay in this area. Outside of the noisy Kuta, but still very close to everything ( by motorbike, which can be rented easily near by - try to bargain for 30-35k rps/ day ).
Newly renovated, very clean and quiet. Service is impeccable. Good breakfast, they could extend their variety though.
Ary the manager is very friendly and helpful with tips.
Lovely swimming pool :)
We would definitely stay here again.","The most mediocre place we’ve stayed so far in Bali. It looks like an old hotel base. There were some renovation works going on (painting) but we were okay with that as we only needed to use the place for a base to sleep. We chose it because of proximity to places we needed to visit on our last day. The price is generally cheep but for what it is is overpriced! The floor of the room was so dirty that when we walked barefoot our feet got back!!! We told to the reception staff that we wanted or floor cleaned and they said they would wipe it for our return. I could see some traces of a mop when I came back but a simple brush with a finger showed residue of dust....
Not to mention the weird Chinese art and symbols around...

The staff is smiling and polite, but that doesn’t change a thing. This place is waste of time and money! Don’t be fooled by some nice pictures that you see in Airbnb!",The room I book standard double is run down and poorly maintain. The bedsheets seem not change as I felt itchy after 1st night. The water kettle was badly stain cannot be used probably not clean at all. Floor was Dusty and felt oily.,"Recently stayed here for 7 nights. Spacious, clean rooms. Excellent beds. Ice cold air conditioning. Breakfast ( american or indon) My favourite was the nasi goreng. Restaurant under utilised but very good. Very polite and helpful staff, always cheerful. Minor criticism is some minor woodwork maintenance could be done. Would definitely stay again.","There r many other budget accommodation with much better facilities in umalas besides this place. Room is just ok, toilet stinks 24/7. The only good thing is the surrounding area with back view of rice field and friendly staff."
ChIJ7WEviGBH0i0R-zRjwAwxmLg,Sol Lila Bali,-8.6647869,115.155323,"Kerobokan Kelod, Kuta Utara, Badung Regency, Bali 80361, Indonesia",https://maps.google.com/?cid=13301435430275855611,OPERATIONAL,,bed_and_breakfast,"bed_and_breakfast, lodging",4.9,84,,"We staid for a week at Sol Lila Bali with 11 persons, all of us were amazed by the villa. Big pool in the center, with all the rooms around. Each room is very well decorated in a Bali style. All lot of placed to chill. Well maintained garden.
The location is great: close to the beach (15mins by scooter, 30mins by walk) and its beach clubs (Finn's, Atlas, Patato Head) but also shops and clubs like Lafavela (15mins taxi). Yet around the villa the traffic is good.
Very quiet place.

I booked Sol Lila Bali villa through Airbnb but I run into troubles with Airbnb website and they canceled the booking due to issues on their side. But through all the process, the owner of Sol Lila Bali, JO. helped and supported me a lot!
The staff at the villa is also very nice and very helpful.

I recommend this place at 100%, you will have a great time their for sure!

Loic","I was looking for a Villa for my family and friends for my 40th Birthday Celebration and Vow Renewal. I saw a handful that met my criteria, however Sol Lila stood out amongst all the villas I was able to search. As you all know most of the villas in Bali is just one building with rooms and the pool in front. What I wanted was to have the feel of being in Bali and not just another hotel-styled villa. Luckily, I came across Sol Lila in AirBNB. Individual villas with a beautiful pool in the middle (everyone enjoyed it as we can just jump in it anytime of the day!). The Villa’s proximity to the airport, shopping and sightseeing is perfect (Between 30-45 minutes from the airport depending on traffic). Sol Lila has different, vibrant, personalised decors per Villa, the outdoor shower is phenomenal. The Villa is already BEAUTIFUL and once the event started (with all the decors) we felt that we were transferred to another charming place. We also requested for a massage, and their masseuse contact was very good (everybody fell asleep during the therapy). The owner Joe has been very accommodating since day one, he assisted me with the transfers and answered all my questions regarding my event. Once we got to the villa, Titin, the manager has been very hospitable, assisting the suppliers where to put the decors, even offering us a complimentary coconut! She was always available whenever I have questions where to shop, even giving us the proper directions to tell to the Grab Driver. Shout out to Rika and Gudai for the lovely breakfast everyday. The coffee, fruits, eggs & croissant is amazinggggg!!!! To Bimo who has been assisting us in the Villa, thank you! They always have a friendly smile the moment they see us.  Ambiance of the villa is important, but the warmth of the staff makes it more memorable. Hands down to Sol Lila, I highly recommend the place. Well done and more power to each and everyone!",Comfortable stay. Well designed airbnb. I think a lot of your experience depends on who else is there - which isn't to do with the villa itself. My stay was dampened by the other guests being fairly unfriendly but at least the room was nice. The pool was great to dip in and the staff I encountered were friendly. Quite hard to walk anywhere so I got taxis to get around. The outdoor bathroom was cute,"The place is very well kept by friendly staff, great service, cleanliness and location. Light breakfast is served everyday between 8-11am and they even serve you some welcome drinks upon checking in, which is nice. The pool is quite nice as well. You can rent scooters from here for around 60k indr/day. Overall, amazing service and great location for exploring Bali.","Sol Lila is a stunning property to visit. Beautifully thought out, each Villa and room is unique and individual. With collectable antiques and a designer setting. The staff and owners very polite and helpful. Very central to great restaurants, shopping and not far from the beach. I would highly recommend this accommodation."
ChIJd75nO3tH0i0RTTw9P_Wmf7s,Villa Mathis,-8.6617828,115.1522288,"Jl. Bumbak No.81, Kerobokan, Kec. Kuta Utara, Kabupaten Badung, Bali 80361, Indonesia",https://maps.google.com/?cid=13510700979392953421,OPERATIONAL,+62 361 4733311,hotel,"hotel, lodging",4.2,174,,"Overall, it’s pretty run down to be honest.

Pros:
Rooms are very spacious. The property itself is super lush and there’s lots of lovely birds chirping… a rare oasis in Canggu.

Cons:
They sprayed the room with a strong perfume right before we checked in and it took several hours for it to go away. It was hard to breathe. In the morning, it gave space for a moldy musty smell. We also stopped them from spraying the room with Bygone (mosquito chemical) right before we walked into the room. We woke up to termite residue covering our luggage that fell from the roof. The bed was really uncomfortable and had a massive dip. The pillows were also massive and smelled of the perfume spray.","The other Mathis properties (Ubud, Amed) are good and great. This one is just ok. Used to be bigger and better.

The room size is still great, and the location is still what it is, but quality of the place has faded. For 500K a room, would be a decent deal. I paid more and was less than happy.",Very spacious villas with an outdoor and pool area. Beds are very comfortable and air-conditioning works well. It's also very quiet despite the area can be busy (villas are next to the main road in Umalas). Service was good but unfortunately the bar and restaurant are still not open and might be for July,"I had a wonderful experience at Villa Mathis. Every staff member I encountered, from the reception to the cleaning staff were delightful and eager to help! Thank you!
The rooms and villas were very clean, very comfortable and very big.
Due to the quality of the service in Villa Mathis and the fast reactions of the staff, we were able to get our plane in time, as our taxi which was organised from another company hasn't shown up.
I will definitly come back to the properties of the Mathis Collection.","The rooms are nice, clean, there is a very large terrace. . The bathroom is open air, the swimming pool is big,

And it's open for ""swapping house""

The location is very good.  Close to canggu . Close to Seminyak ..so many good restaurant nearby ."
ChIJLfrFVXtH0i0RJQtVBqrnBHA,Villa Moyo Umalas,-8.6593612,115.1530755,"Jl. Bumbak Dauh No.131, Kerobokan, Kec. Kuta Utara, Kabupaten Badung, Bali 80361, Indonesia",https://maps.google.com/?cid=8071831149591464741,OPERATIONAL,+62 838-9383-8889,hotel,"hotel, lodging",4.5,61,,"Me and some friends stayed in Moyo Villa 4 for about a week and we really enjoyed our stay! The rooms have been nice, clean and have been furnished with everything you need. Especially the pool is really nice! Also the service was pretty good! Most of all our housecleaner Erna has been very friendly and helpful! For example If you would like to rent some scooters or if you need a cab to your next destination, you can just ask her. She’s also been very flexible regarding the cleaning times, which has been nice!

Thank you very much! We would always come back! ☺️","This is for Villa Moyo number 2.Villa.Balezia.You can find it on airbnb.
Keep this listing,save it when you need it.

We were on a family trip, with 5 adults and 1 child.it fits perfectly for us,accomodates us all,nicely decorated and with great layout.

The location,well,it's Umalas,has small roads,less lighting at night,so it's best to rent a car or bike rather than walk your way.The villa has quite big entrance that can fit minibus.

For the villa,it's spacious,has a lot of sunlights,we really like it. Our daughter sleeps and actives really well at the villa,that's a big score for us.
Pak Eko helps a lot on our daily needs,thank you also for that. There are some minor issues, but if you look at the overall villa,you will be happy.","Villa Moyo #4 is definitely not worth it at all to be stayed-in. The condition of the villa is really disgusting! For two weeks rent, my husband and i must deal with so many things. Not recommended at all!","Found this villa thru AirBnb and it's very much better compared to our last villa. This one has a huge pool, long enough to do laps, but too deep for us short Asians, meh. Rooms are cozy, got speedy internet, cable TV and fully functioned kitchen.

A bit far from the airport and better to reach it with a bike or a car. Definitely not a public transport kinda place.

But best thing about it, a pullup bar!!","A lot of NOICE! Crazy people from rise fields shout from yearly morning 6:00 🤬also construction sounds, Not Relax Place ✋ (Two months experience )"
ChIJO5OaBkpH0i0RfqhSi0exhiI,"The Basket Bali - Bakery, Japanese Cuisine, Wine",-8.663521,115.15286300000001,"Jl. Bumbak No.164 Gedung 2, Unit 1, Kerobokan Kelod, Kec. Kuta Utara, Kabupaten Badung, Bali 80361, Indonesia",https://maps.google.com/?cid=2487870765007022206,OPERATIONAL,+62 813-3913-2858,bakery,"bakery, brunch_restaurant, sushi_restaurant, coffee_shop, cafe, breakfast_restaurant, japanese_restaurant, bar, store, restaurant, food",4.8,68,,"This place was STELLAR! Of course the service is impeccable because it’s Bali and everyone is so friendly, but the food and quality here is beyond anything we experienced. The coffee was incredible, the pastries unparalleled, and even the sushi was a quality like what we’d get back home in NYC. We even had to take some desserts home because we were too full to eat anything else but needed to try more. It’s with the drive and time. Great decor and so comfy to relax in or bring your laptop and work from a booth. This was a highlight of our Bali trip.","Tasty croissants and coffee with a pleasantly unique flavor for the connoisseurs out there. Nice atmosphere for lunch, a date or just sitting on your laptop. Quite pricey, but worth treating yourself to every once in a while.

The instrumental jazz music capped off the general vibe of the cafe. Very classy.",I love everything in this place. croissant was perfectly chewy and flaky with a bit of sweet taste. ham and cheese croissant was sooo good. mango danish was made with sweet real mango fruit and the custard was balance too. I think all the pastries here is really good. the vibe was very very nice and the owner also very friendly too. service also nice. a bit pricy for me personally but it's worth the price for the experience and quality of ingredients. I will recommend this place and will be back for sure.,"It is absolutely happy to find one of the Best Bakery Shop in Bali. Newly opened, sensuous interior design(even toilet!), cozy environment, most impressive was great taste of Bread. I took set menu it contains coffee & juice(both! And juice was so fresh!!) & bread. Then I choose another bread, ham croissant  was OMG.. so I did take away, which usually I don't. Also the staffs were really kind and courteous.
Only one thing I feel sad was it takes 1hour to go there, however I don't mind distance,definitely I will be back again & again.. No doubt to recommend.","Had dinner at The Basket last night.
Stunning food presentation with an eye for detail and delicious too!
Staff are amazing, I’m a regular for coffee and they always greet me by name-so nice to be made welcome!- Jeremy"
ChIJI7S7hmFH0i0RZNCqhEFUr9I,Bali Townhouse,-8.6601263,115.1531734,"85Q3+W7V, Jl. Bumbak Gg. Pulau 63A, Kerobokan, Kec. Kuta Utara, Kabupaten Badung, Bali 80361, Indonesia",https://maps.google.com/?cid=15181445509264625764,OPERATIONAL,,lodging,lodging,4.9,14,,"Beautiful villa, I've probably stayed in 10 villas in bali, and this honestly was my favourite. Had a real comfortable modern style, the staff went out of their way to communicate with us and sort anything out we requested. Kitchen is fully kitted too. 10/10.","Clean, quiet and cozy",Nice,how to book?,
ChIJV664dGRH0i0RxDExP_M6esw,The Cendana Umalas,-8.6593649,115.15772210000002,"Jl. Tegal Cupek No.129, Kerobokan, Kec. Kuta Utara, Kabupaten Badung, Bali 80361, Indonesia",https://maps.google.com/?cid=14734153947307651524,OPERATIONAL,+62 812-3348-2275,hotel,"hotel, lodging",4.8,26,,"Awful. Always inviting young kids to throw parties in residential areas up until very late at night. It gets severely loud, with people screaming and blasting music surrounding the residential areas adjacent to it.

Zero accountability from the neighbourhood next door to shut them down after 10 PM.",nice place to stay in Canggu👌,Nice place,,
ChIJBYzZznxH0i0RwtDJpIwiEOQ,The Lemon Tree,-8.6572246,115.1528293,"Jl. Bumbak Dauh No.106, Kerobokan, Kec. Kuta Utara, Kabupaten Badung, Bali 80361, Indonesia",https://maps.google.com/?cid=16433673027730395330,OPERATIONAL,,restaurant,"restaurant, food",4.9,71,,"One of my favorite restaurant in bali for breakfast or lunch ! Great menu, fresh products, tasty food and amazing staff ! Also, they have homemade frozen food such as lasagna, gratin, quiche and more for take away. Kids love it","I recently visited this café, and I must say it was a nice experience. The Lemon tree cafe is equipped with air conditioning, comfortable sofas, and chairs. They also have outdoor seating, which is a nice touch.

The freshness of their offerings really  good. I enjoyed the onion quiche; it was not greasy, and the crust was wonderfully thin. Their ham and cheese croissant was also excellent.

The coffee was of high quality and not too acidic, which is a big plus for me.

Taxes were already included in the prices, making it very convenient.

I highly recommend this café for breakfast or lunch.",Such a Nice atmosphere ✨ reallly liked this place and the food and coffee!,"Best place for a quick and delicious lunch in Umalas. The tuna tartare is definitely my favourite, as well as the leek and chicken quiche. Extra bonus points for the potatoes and their secret ingredient sauce 🌟","We been living in bali for 12 years and this places had the best creeps in Bali for sure. Food , drinks and services was excellent highly recommend!!!"
ChIJH1of1HxH0i0RWq1cayjYTjs,Imani Villas,-8.6571166,115.1531276,"Jl. Bumbak Umalas No.109, Kerobokan, Kec. Kuta Utara, Kabupaten Badung, Bali 80361, Indonesia",https://maps.google.com/?cid=4273590764532706650,OPERATIONAL,+62 361 8475056,,"hotel, lodging",4.5,45,,"Very comfort Villa strategically located in the most touristy area in Bali but the access is easy to go. Great place to have a holiday with your group of family, friends or small company outing.","We stayed at Imani Villas for 3 nights in the 3 Bedroom Mahesa Villa. The Villa visually is superb with a central 20+ metre pool with a spa (non heated) and 3 bedrooms with King Beds and outdoor bathrooms. There is a large gathering area to hang out and eat as well.

The staff are super helpful and clean your villa whilst you’re out and can do laundry and organise taxis if required.

The main negatives are the lighting in the rooms, the blinds need replacing to keep the rooms darker in the early morning. Additionally the deck by the pool is old and breaking, it needs replacing but we avoided using it where we could.

The location is a little bit out but best mode of transport is scooter to avoid the busiest roads.",Balinese ambiance villas similar to Ubud as the straw grass roof in villas with private pool open area living room with kitchen,"Great place and staff was excellent. Caring and offering support +++.
Nice rooms and bathroom.
As mentioned in a different comment, villa is of its age (3 Bdrm).
Property management shared a platinium card to go to Finns which can come in handy.","Booked the villa for 5 days and it was awesome. The manager Mr Budi and other staff were all very helpful and friendly. The location of the villa is strategic close to stalls or restaurants to eat and the food was good too. The villa itself is spacious with a pool, living hall, dining place with kitchen. It was clean and well maintained. The breakfast provided was also good. The only setback of the villa is there is water disruption as the pressure goes low but they did fix the problem and helped us with a smiling face 😊Otherwise this villa is definitely a very good place to stay. My husband loved it as well. Thanks to the entire team of imani villa."
