id,name,latitude,longitude,address,url,status,phone,primary-type,types,rating,rating-count,price-level,review 1,review 2,review 3,review 4,review 5
ChIJlRROs0MR0i0RsDXMHPgQACM,WakAsih,-8.5420198,115.3991679,"Jl. Kenyeri No.1, Semarapura Kelod, Kec. Klungkung, Kabupaten Klungkung, Bali 80711, Indonesia",https://maps.google.com/?cid=2522034449148556720,OPERATIONAL,+62 812-3858-715,bed_and_breakfast,"bed_and_breakfast, guest_house, lodging",3.6,95,,"This room good for sleep only or transit. No hot water, no TV, need extra for AC, no amenities. So if you look for budget guest house this room fit on you. They dont have to much car park",Good place to stop for a night or two.  Comfortable rooms.,Good for emergency place for travelers,Pretty cheap as a guest house,👍
ChIJ1y1As1wR0i0R4cP4bvrdwdo,Kos Graha Karsa,-8.546492899999999,115.39733340000001,"F93W+CW4, Jl. Angsoka, Semarapura Kelod, Kec. Klungkung, Kabupaten Klungkung, Bali 80716, Indonesia",https://maps.google.com/?cid=15763124238446805985,OPERATIONAL,+62 856-3864-740,lodging,lodging,4.4,29,,Best place,,,,
ChIJD1ewbN0R0i0RLi54JJm7VqA,Vanbenk Coffee & Eatery,-8.541796500000002,115.39653260000001,"Jl. Matahari No.1, Semarapura Kelod, Kec. Klungkung, Kabupaten Klungkung, Bali 80716, Indonesia",https://maps.google.com/?cid=11553628160481832494,OPERATIONAL,,coffee_shop,"coffee_shop, bakery, cafe, store, restaurant, food",4.7,123,,"This place just awesome to be in this small town, really appreciate the interior, the service, the facilities especially karaoke lounge.

The food is good and delicious too,","Nice place in Klungkung for a coffee, icecream, eatery, meetings etc.","You should be patient when ordering foods, it takes long time, but it worth for tasty foods. You also have a free chance for dancing and karaoke here. There are also outdoor space for less formal vibes.","Very nice food and nice people working, all people were very kind.","Very nice and cosy bar. Staff super friendly and food excellent (but make sure you can handle spicy food😊).
Good vibes. You must visit if you're in the area."
ChIJew_A-aUR0i0R9VCa6ysrC50,KARSA HOMESTAY Penginapan Klungkung,-8.544415299999999,115.3968293,"Jl. Mahoni, Semarapura Kelod, Kec. Klungkung, Kabupaten Klungkung, Bali 80714, Indonesia",https://maps.google.com/?cid=11316185956334850293,OPERATIONAL,+62 856-3864-740,private_guest_room,"private_guest_room, hotel, lodging",4.8,19,,Good home stay clean as well,neat place,goods,,
ChIJASAVUBYR0i0RCK7z2-rwCL4,Warung bebek bu olip,-8.545893099999999,115.39759449999998,"Semarapura Kelod, Klungkung, Klungkung Regency, Bali 80716, Indonesia",https://maps.google.com/?cid=13693459558523186696,OPERATIONAL,+62 813-3957-7479,restaurant,"restaurant, food",4.8,34,,,,,,
ChIJoYoT1EMR0i0R2H47mwY3Mw0,My Pizza,-8.54144,115.3988409,"Jl. Kecubung No.30, Semarapura Kelod, Kec. Klungkung, Kabupaten Klungkung, Bali 80716, Indonesia",https://maps.google.com/?cid=951164447819005656,OPERATIONAL,+62 878-6111-9270,pizza_restaurant,"pizza_restaurant, restaurant, food",4.3,81,,We had two different big pizzas. The size was each big enough for one person. The taste was not original Italian but ok. The price was reasonable. The mango juice for only 8.000 was great.,Great pizza. I love the mushroom and corn pizza. I always change the corn for peppers and it's amazing. This pizza is only 34 thousand rupiah. Great deal. And they have good wifi. The pizza is light and fluffy with lots of cheese and delicious.,"For ppl who like local style pizza, this place is just for you haha. Affordable price and reasonable size 😄",Enak. Recommended yang Chicken BBQ,Good food. Fast.  Nice stuff
ChIJyQwfYyUR0i0Rgs89XXPzDSA,Kost Yoga Klungkung,-8.541959199999999,115.39201449999999,"F95R+6R6, Takmung, Banjarangkan, Klungkung Regency, Bali 80716, Indonesia",https://maps.google.com/?cid=2309769860722052994,OPERATIONAL,+62 857-3835-2568,lodging,lodging,3.8,16,,I has been rent for 3 months.. Best Kost with facility and chip.. Dont forgot the view is beautiful and near from the Klungkung City..,,,,
ChIJR0BpetMR0i0R_l27E_Ij0mc,"warung BABI GULING ""MEK GEDE""",-8.541888499999999,115.399744,"Jl. Kecubung No.15, Semarapura Kelod, Kec. Klungkung, Kabupaten Klungkung, Bali 80761, Indonesia",https://maps.google.com/?cid=7481081453635919358,OPERATIONAL,+62 857-3884-6030,brunch_restaurant,"brunch_restaurant, restaurant, food",5,4,,,,,,
ChIJI7nnM0UR0i0REQ61DQ3EFLc,Warung Bu Imam,-8.5458423,115.39323060000001,"Jl. Raya Batu Tabih, Takmung, Kec. Banjarangkan, Kabupaten Klungkung, Bali 80716, Indonesia",https://maps.google.com/?cid=13192384768818613777,OPERATIONAL,+62 812-4611-800,indonesian_restaurant,"indonesian_restaurant, restaurant, food",4.4,243,,"Muslim warung. They will give you rice and you can choose whatever side dishes you like. They do not sell pork. But still they have a great veriety of meat like chicken and beef. Also they sell fish. Mostly whole fish. They also have a good assortment of vegetables. On my picture you will see the bitter veggies. Their spice level is fairly normal. But I did not like their bitter flavor, I think it does not combine well with the spice.","Nice, clean, comfort, cheap, bigger parking lot. This restaurant give you an ordinary indonesia home serving. So basically this restaurant serves home cooking food. It's good for someone that want to try Indonesia home cooking food, feels like your indonesian",A humble and simple typical traditional warung / stall. Various foods to choose and some sayur to accompany your meal. Halal,"If you like spicy, this is the warung you looking for, nasi kuning, chicken and sambal.. Mantap!!",Many option for indonesian halal food
ChIJD7ikZ8YR0i0Rx25CfqoB7_o,BLESS KOPI,-8.543873,115.3930073,"Jl. Raya Batu Tabih, Takmung, Kec. Banjarangkan, Kabupaten Klungkung, Bali 80716, Indonesia",https://maps.google.com/?cid=18081672860690181831,OPERATIONAL,+62 877-9065-1824,coffee_shop,"coffee_shop, cafe, store, food",5,5,,,,,,
ChIJS85wVnIR0i0RnWy2yh0be7Q,Kedai kopling,-8.546136599999999,115.39315459999999,"Jl. Raya Batu Tabih No, Takmung, Kec. Banjarangkan, Kabupaten Klungkung, Bali 80716, Indonesia",https://maps.google.com/?cid=13005018163731393693,OPERATIONAL,+62 877-5208-9709,coffee_shop,"coffee_shop, cafe, store, food",4.7,10,,"Good place for coffee, the one and only good coffee in klungkung, and private area, strategic for memitra maybe, but thanks god for good coffee in kopling 💋🔥🖤🖤🖤","everything is nice and cozy, definitely will go back for the 3rd time haha",,,
ChIJ3wxv3XoR0i0RoXPd0QYx9ds,TAHU KLUNGKUNG,-8.5448648,115.3990349,"F94X+3J3, Jl. Sakura I, Semarapura Kelod, Kec. Klungkung, Kabupaten Klungkung, Bali 80716, Indonesia",https://maps.google.com/?cid=15849628368960844705,OPERATIONAL,+62 819-9995-5422,restaurant,"restaurant, food",5,3,,,,,,
ChIJn2kAsiAR0i0RrMWQ1k8YsHU,Mini Store Dapur Mama Wah,-8.541335499999999,115.3954356,"Jl. Kecubung No.99, Semarapura Kelod, Kec. Klungkung, Kabupaten Klungkung, Bali 80716, Indonesia",https://maps.google.com/?cid=8480304829519938988,OPERATIONAL,+62 831-1962-2747,brunch_restaurant,"brunch_restaurant, restaurant, food",3.8,4,,,,,,
ChIJz0_QKAAR0i0RIRX4OVURb3o,Sindikat Coffee,-8.5415032,115.39756749999998,"Jl. Kecubung No.45, Semarapura Kelod, Kec. Klungkung, Kabupaten Klungkung, Bali 80761, Indonesia",https://maps.google.com/?cid=8822289252784543009,OPERATIONAL,,coffee_shop,"coffee_shop, cafe, store, food",5,9,,Amazing place to get some coffe in klungkung regency,,,,
ChIJ7Q1HFs0R0i0R0NGsj5Zezwo,WAROENG BURGER,-8.541200500000002,115.39664859999999,"Jl. Ratna, Semarapura Kelod, Kec. Klungkung, Kabupaten Klungkung, Bali 80711, Indonesia",https://maps.google.com/?cid=778945261306958288,OPERATIONAL,,hamburger_restaurant,"hamburger_restaurant, american_restaurant, restaurant, food",4.4,16,,"One of, If Not the best affordable Burger Shop in Bali. 20k (~1,30$) for an incredibly tasty crispy Chicken Burger with Egg. The owner is very friendly and knows what he's doing  Highly recommended, don't miss Out on this one!","Burger was fantastic and the cheesy fries were also good, my friend passed out while eating, still don't know why, but I do know the man there was very helpful and tried his best to help. Overall 9/10",Tasty and good price 👍,,
ChIJ2Y9gtEAR0i0Rja6oFmZYFgo,Warung Mbok Ida Rujak Cingur dan Lalapan,-8.5431133,115.3990542,"F94X+QJ3, Semarapura Kelod, Klungkung, Klungkung Regency, Bali 80716, Indonesia",https://maps.google.com/?cid=726865585356975757,OPERATIONAL,,restaurant,"restaurant, food",4.9,7,,,,,,
ChIJT-PxzEMR0i0RZaPoR-m-n0s,Puri Binatu,-8.542085499999999,115.39916830000001,"F95X+5M7, Jl. Kenyeri, Semarapura Kelod, Kec. Klungkung, Kabupaten Klungkung, Bali 80716, Indonesia",https://maps.google.com/?cid=5449283983284675429,CLOSED_TEMPORARILY,,lodging,lodging,3.8,5,,,,,,
ChIJQ0arzEUR0i0RJt6tMDD5kQk,Rumah Nasi Goreng Mentik Sari,-8.541584499999999,115.3943902,"Jl. Flamboyan, Semarapura Kauh, Kec. Klungkung, Kabupaten Klungkung, Bali 80716, Indonesia",https://maps.google.com/?cid=689606203334843942,OPERATIONAL,+62 821-4644-2240,indonesian_restaurant,"indonesian_restaurant, restaurant, food",4.2,17,,Great local food. They looked after us very well!,Good food,,,
ChIJyVKs4UIR0i0Rg25bgdgYY0k,rumah makan prima rasa vegetarian,-8.5422926,115.3989485,"F95X+3HP, Semarapura Kelod, Klungkung, Klungkung Regency, Bali 80716, Indonesia",https://maps.google.com/?cid=5288097705625349763,OPERATIONAL,,vegetarian_restaurant,"vegetarian_restaurant, restaurant, food",4.9,7,,,,,,
ChIJeWYb90MR0i0RQ93d4wVEHQ0,Depot Dapur Segar,-8.542065899999999,115.39669620000001,"Jl. Matahari, Satra, Kec. Klungkung, Kabupaten Klungkung, Bali 80716, Indonesia",https://maps.google.com/?cid=944986288906165571,OPERATIONAL,+62 822-4783-8678,restaurant,"restaurant, food",4.2,39,,Food is fantastic at very reasonable price.  Will visit again!,Delicious food...,,,
