id,name,latitude,longitude,address,url,status,phone,primary-type,types,rating,rating-count,price-level,review 1,review 2,review 3,review 4,review 5
ChIJ1XuENnA40i0RmGPRXGMS1Ks,Lushy Hostels,-8.647283999999999,115.12701,"Jl. Munduk Tengah Br. Pengembungan No.11B, Pererenan, Kec. Mengwi, Kabupaten Badung, Bali 80351, Indonesia",https://maps.google.com/?cid=12381541493516624792,OPERATIONAL,+62 821-4572-1085,hostel,"hostel, lodging",4.5,237,,"Staying at this hostel was an absolute delight! From the moment I arrived, the staff were incredibly welcoming and helpful, making me feel right at home. The atmosphere was vibrant and friendly, with plenty of opportunities to meet fellow travelers and exchange stories. The facilities were clean and well-maintained, and the communal areas were perfect for relaxing or socializing. Plus, the location couldn't have been better, with easy access to all the main attractions. I highly recommend this hostel to anyone looking for a fantastic and affordable accommodation option!",Highly recommend staying here! Staff are amazing and so friendly. Beds are a good size and you have plenty space and privacy. There’s lots of social events on for meeting people but you can also chill too. My favourite hostel in Bali can’t wait to come back. Live laugh lushy x,"This is such a lovely hostel! Initially booked for 2 days but ended up staying for 2 weeks 🤩

1. The staff is awesome! From the moment you walk in, they remember your name throught your stay.

2. The hostel is social. Plenty of chances to exchange stories. Pub Crawl is super fun. And this is coming from a shy guy 😗

3. Lovely pool.

4. Lovely rooftop area. Small but offers a fantastic view of the beach.

5. Best rooms ever: These are the best dorm beds I’ve ever found. Period! Beds are huge, have separate stairs to climb which is super convenient, and super clean.

6. Clean toilets - 24/7

7. Great prices - There are offers certain days a week. Pizza day is one of my favourite. Also, Pub Crawl is reasonable for the value you get.

8. Scooty prices are fine but they can work on their condition.

9. Best in class Co-Working Space: The area is nice chilled glass space with really high speed stable wifi with an unobstructed view of the pool. Working from here was a dream 😍

Overall this was a dream hostel to stay. Loved my time here. Wish to visit again 😉","A place full of many extroverted guests and staff members. They have different themes every day of the week so you always have something to do. The staff is so nice and welcoming, making you feel at home the moment you step through the door. Would recommend to every social person visiting Canggu","The best hostel I’ve stayed at in Bali so far! Very chill vibe during the day and great events to make for social evenings. Even if you’re not interested in the social scene, the staff make sure the common areas are all quiet by 2300. What made for the best experience with this hostel was by far the staff.. they were very attentive and went above and beyond for everything you needed."
ChIJtTgayDI50i0RYmWmWkh-as8,WOODS PERERENAN,-8.6459764,115.128214,"Jl. Dalem Lingsir No.8, Pererenan, Kec. Mengwi, Kabupaten Badung, Bali 80351, Indonesia",https://maps.google.com/?cid=14945897162606011746,OPERATIONAL,+62 853-3393-5558,restaurant,"restaurant, food",4.6,1180,PRICE_LEVEL_MODERATE,"LOVE LOVE LOVE!! Visited twice during my week in the area. Once for Sunday brunch (such lovely jazz music), another with friends for dinner.

For brunch, I ordered the boneless chicken leg: this is absolutely delectable. I think in the moment I called it the best chicken I've ever eaten. It's seasoned so incredibly well, so juicy and soft - it had me cleaning the plate with the rest of my mash.

For dinner, we ordered a lot. The main thing I want to note is their accommodation with my friend's nut allergy. They were thoughtful of this even in their complimentary dish ❤️ So lovely to have this peace of mind.

Main dishes ordered: Seafood Arborio Risotto, Grilled Fillet Barramundi, Duck Leg Confit (our favourite by far), Chicken a'La Vanille (a lil dry; granted, our server warned us lol)

Sharing: Kahf cheese (loved this)

Dessert: Passion Fruit Pavlova

Drinks: Blue Dream tea, Butterfly Pea Flower tea, The Roots (my personal favourite)","Excellent dining experience. Lovely atmosphere and  very attentive staff. The food is fantastic, especially for the price you pay. Very high quality, delicious and well presented. We both had the grilled Barramundi and passion fruit pavlova, The kitchen were happy to substitute an ingredient so I could avoid coriander which the wait staff were extremely helpful with. Highly recommend.","The food is amazing. They have delicious vegetarian options and also other healthy options. All the food that we ordered are good, but the best is the pumpkin risotto and fried truffle polenta. Hummus is just so so, the blend is too thick and less tasty. But the rest is amazing. Even the coffee is alsi good. Ambiance is nice, staff are friendly and they gave a free fried fish ball for free. Definitely will come back. Want to try the breakfast as well.","We loved this place! The interior is absolutely stunning! Green oasis, so peaceful and quiet. Coffee is very good and we enjoyed eggs Benedict and healthy bowl for breakfast. Everything is so fresh! 😍
Staff is friendly and not boring. They are there when you need them. 🥰
I could eat breakfast here every day. Keep up the great work. 😍","A perfect score of 5 out of 5! ✨ Their brunch and lunch menus are exquisitely prepared, offering a delightful selection whether you prefer a light bite or a hearty meal. The menu is simply delicious."
ChIJlcm3Q0k50i0Rg9ovyUzuO0U,BAKED. Pererenan,-8.6467864,115.12561350000001,"Jl. Pantai Pererenan No.118, Pererenan, Kec. Mengwi, Kabupaten Badung, Bali 80351, Indonesia",https://maps.google.com/?cid=4988843025803238019,OPERATIONAL,+62 812-4657-3336,bakery,"bakery, brunch_restaurant, coffee_shop, cafe, breakfast_restaurant, restaurant, food, store",4.4,574,,"I would recommend to come to Baked only for breakfast! 🍳🥖🥐
The tomatoe toast was delicious🍅, fresh and super tasty. 🤤
Best scramble was creamy and tasty too.
I am giving 4 stars because the matcha 🍵 is the worst which I have ever had, coffee as well not the best!","Ordered the ice palm sugar latte and it’s amazing! If you don’t like your coffee too sweet, trick is not to shake all the palm sugar or just ask for less palm sugar. Went there around 2-3 PM where it’s super quiet. Love their spacious area. Their pastries are also good!","Flavors of BAKED are always consistent and for that I’m super happy. Food could have been served warmer, but the flavors were what I remember them to be and was consistently good. An absolutely reliable and solid hit for everytime I’m back in Bali—I have to recommend the Benny and Jenny. Their sourdough is also pretty spot on.","Come for coffee and breakfast.
Coffee taste just ok, brakfast menu is good.
Parking space for cars is very limited.
Menu is coffee, non coffee, pastries, sourdough bread, and some others.
Seating area is non aircon.","My favorite Baked store is here, Pererenan. Outdoor vibes and a modern interior, catchy! also with very good food and beverage options! You just try the best Scramble, it’s quite famous and it just melts in your mouth along with the savory roe and the perfectly baked sourdough. It is also a good place to hang out to meet your friends just enjoy your brunch or maybe just grab some coffee after your pilates session. Their coffee is good too. Also if you're planning to chill and do your work, the ambience is pretty cool and there's plenty of space. For a coffee and croissant was around 100k, which is a reasonable price for a cafe. The staff were also excellent, attentive, and friendly to everyone. I’m always lucky cause I picked the right hour whenever I wanted Baked so I didn't wait long, some people had to wait outside since Baked is always crowded from breakfast to brunch. Clean and sweet and nice smells toilet also important. I will be back soon! Best of luck Baked Pererenan & Team
Love,
🐰♥️☕️"
ChIJx2GvT6U50i0R63BCiKSluUw,Touché,-8.6453841,115.1269697,"Jl. Pantai Pererenan No.104, Pererenan, Kec. Mengwi, Kabupaten Badung, Bali 80351, Indonesia",https://maps.google.com/?cid=5528632143653269739,OPERATIONAL,+62 823-4185-0363,cafe,"cafe, coffee_shop, restaurant, food, store",4.5,533,,"I like the place, sometimes it is too loud, place is near the road, so it is noise from bikes, also noise from construction near by, and music inside, so it is hard to talk with someone or concentrate.

There is no AC, but they have fans so it helps a little bit.

Service is good, food is tasty.
They bring bottle of water to every table.
Thanks for this small details:)","I use to eat here many times,even place is small and sometimes u really have to wait for table and quiet hot(promise if they have AC definitely I will eat more and come 3times a day)
Stuff are nice and friendly. Before order u get free water refill. Price average but portions are huge. Food is tasty u can feel that ingredients are fresh. I am big fan of falafel bowl,and cauliflower “chicken wings”, also ice coffe “love or lost” so refreshing. You can buy flowers here too. Nice place really)","While the cafe was bustling with activity, I couldn't help but notice the worn furnishings that detracted from the ambiance. Service was slower than expected, which was a bit of a letdown. However, the redeeming factor was the quality of the food and drinks, which were quite satisfying.","Located in pererenan.
If you access by bike from pererenan shortcut, the cafe located not far from there.
The menu has option from sweet to savoury, with price range 60k to 100k.
Motorcycle parking available.
Taste was good and for breakfast, the portion was great.","Big portion and delicious! Expensive tho. Coffee was very small. Nice place to sit in. Nice staff and free wi-fi. I had a smoked salmon salad.

-2 stars because I hate getting charged hidden fees"
ChIJ5fhhx1I50i0RYv-9kVUcpbY,Mostly,-8.6460717,115.1262534,"Jl. Pantai Pererenan No.114, Pererenan, Kec. Mengwi, Kabupaten Badung, Bali 80351, Indonesia",https://maps.google.com/?cid=13160956639903088482,OPERATIONAL,+62 811-3943-334,restaurant,"restaurant, food",4.7,967,,"Absolutely delighted with the exquisiteness and presentation of the main dishes, drinks and desserts. Very friendly and pleasant staff treatment, and the place and atmosphere are so beautiful. Together with Zest Ubud, my 2 favorite restaurants in the whole island! I will return every time I visit Bali.","Don’t let the unassuming entrance fool you.

It is the most beautifully restaurant I have been in Bali and I have been to quite a few impressive ones. The interior design gives the place a very organic and sexy vibe even during the daytime. Great ambiance and quiet that people work and have meeting throughout the day. Well, the airconned room is so nice and much needed on those hot days although the outdoor hanging garden area was looking phenomenal.

The food is good but at this point as long as the food is not bad we keep coming for the ambiance, drinks (full bar), and desserts. Their deserts are so impressive!!!!

The service is friendly and accommodating.","Quickly becoming one of my fave place in pererenan. Everything in the menu is good although they do not have extensive menu. The bbq cauliflower is delicious... the pho , pad thai, duck ramen, and the laksa all arw yummy. Then you definitely ahould not miss dessert. The  dark choclate in glasa is pretty and yummy. The hazelnut mouse also good.... and many other mouthwatering  cakes. The place it self is pretry.espwcially the back / garswn area and the tea room upstaies. Instagrammable.","Absolutely love Mostly Bali Pererenan! From their refreshing drinks to delectable desserts, every visit here is a delight. We have a mission to checklist every dessert they have🤪 The ambiance is charming, and the design truly captures the essence of Bali style. Highly recommend for a fantastic dining experience!","Discovering this Asian bistro was like finding a hidden gem that effortlessly transitions from restaurant to cozy bar to dessert haven. The ambiance is vibrant yet relaxed, making it the perfect spot for any occasion. But what truly stole the show for me personally were the artful desserts on display – each one a masterpiece both in taste and presentation (although yet to make my way through the lemon meringue and chocolate cake!). Whether you're in the mood for a full meal, a casual drink, or a sweet treat, this bistro ticks all the boxes. It's become my go-to spot for indulgence and relaxation all rolled into one delicious package."
ChIJkfDSHYg50i0RBdXQigmMn54,Brunch Club Pererenan,-8.6456651,115.12654870000001,"Jl. Pantai Pererenan No.110, Pererenan, Kec. Mengwi, Kabupaten Badung, Bali 80351, Indonesia",https://maps.google.com/?cid=11430008351901144325,OPERATIONAL,+62 812-3783-0436,cafe,"cafe, brunch_restaurant, restaurant, food",4.8,616,,Yummy food. Good portion. Relatively fast service. Helpful and friendly staff. Clean toilets. Indoor with high ceiling and a tree. My favourite here is fried chicken waffle w/ maple syrup 🧇 better to come here 8am or after 1pm to avoid their busy hours,"Tasty food and big portions are just the beginning here. The atmosphere was cozy and inviting, the service was excellent, and the prices were very reasonable.  I'll definitely be back, and I highly recommend this place to anyone looking for a satisfying meal.","Everything great! Unfortunately they are fixing the road so it is loud when they are using the machines. But apparently is only for a few more days.
Food is very tasty and the place is so beautiful","Beautiful cafe, with lovely staff, and delicious food. The waffle dish was very plain and it was missing some sort of cream on the side. I suggest ordering their porncakes to share since it's very sweet and consider other options as your main breakfast.","I like this places a lot!! They have amazing food, good flavor, good presentation, kind and friendly staff. My favorite waitress is Thesia 🥰 She always remember what I want to order ahead of time was awesome with us. I recommend 💯"
ChIJo3Bvzmo50i0RG6UYcsh_ZmU,Bar Vera Bistro & Wine Bar,-8.6431643,115.12897050000001,"Jl. Pantai Pererenan No.84, Pererenan, Kec. Mengwi, Kabupaten Badung, Bali 80361, Indonesia",https://maps.google.com/?cid=7306667944339612955,OPERATIONAL,+62 813-3768-8300,restaurant,"restaurant, bar, food",4.7,191,,"Had one of the best, if not the best dining experience in Bali. The food was 10/10 and the service was amazing. Special thanks to Farah, who made sure my experience was magical. Food is on the pricier side, but well worth it. Will be coming again!","I’m not exactly sure about Bar Vera. Given how much I was looking forward to dining here, i left with not bad, but lukewarm feelings. We ordered the sweet corn tartlet, beef ragu arancini, pig cheek croquettes, prawn and warm polenta, roasted chicken. All the starters were creative and quite an explosion of flavours in the mouth. However, the main dishes that were supposed to be the highlights paled in comparison due to taste and textures. Really did not enjoy the cocktail i ordered too, it tasted like a bad mojito. Service was good, staff was attentive. Design and ambience of the space were on point (especially Further hotel). Not sure about the fan blowing in my face…but overall, it still deserves 4 stars.","Bar Vera emerges as a shining addition to the culinary scene in Parerenan, Bali. This establishment seamlessly blends Western (Australian-centric) cuisine with an enticing Asian flair, resulting in a menu that offers a delightful fusion of flavors.

The culinary offerings at Bar Vera are nothing short of impressive. From impeccable textures to precisely balanced temperatures and flavors, the dishes showcase a commitment to culinary excellence. The specials, in particular, stand out, presenting intriguing options that are undoubtedly worth exploring.

While the beverage selection is in ok level, I was surprise when they put corpse reviver cocktail on the menu, but turns out, they can’t make the real one but offers the other options to us.

However, it is evident that there is room for improvement in the service department. Staff training, especially in product knowledge, would greatly enhance the overall dining experience. A notable instance was when inquiring about ingredients aged for 12 months, receiving an inaccurate response regarding rice instead of the Comté.

In summary, Bar Vera delivers a delightful gastronomic experience with delicious offerings. While the service may benefit from refinement, the overall ambiance is undoubtedly inviting. A visit to Bar Vera promises a culinary journey that will leave patrons savoring the delightful fusion of flavors in a pleasant setting.","Everything on the menu is worth to try. We had the octopus, striploin, pommes and cabbage. Simple menus but they elevated on whole new level. The dessert banoffle souffle was theatrical and delicious. Definitely going back to try the pumpkin pie, shrimp and other menus. What a gem in pererenan!","Loved the interior! The food was generally good, although the skewers were a tad salty.
But, delicious food nonetheless! I really enjoyed the potato bread :)"
ChIJ8fy5GTg50i0Rs-bdzi_Hn14,"Honey,",-8.6474017,115.1245843,"Jl. Pantai Pererenan No.132, Pererenan, Kec. Mengwi, Kabupaten Badung, Bali 80351, Indonesia",https://maps.google.com/?cid=6818387369010259635,OPERATIONAL,+62 821-4546-4760,restaurant,"restaurant, food",4.4,614,PRICE_LEVEL_MODERATE,"Bright light, good coffee, cozy spot. Had the well loved peach ricotta toast. Was a good breakfast dish—which makes sense given cheese + fruit + honey. The perfect morning sweet breakfast. Coffees were good too! Enjoyed the breakfast there thoroughly. Plugs are also available.","Honey in Pererenan is the bee's knees! 🐝☕️ Not only did the coffee and food quality exceed expectations, but they also sweetened our day with their delicious offerings. Highly recommend stopping by for a buzz-worthy experience! Five stars all the way! Can’t wait to comeback 😁❤️","One of my favourite places to eat in Canggu, I’ve dined here a fair few times and never been disappointed. The venue itself is lovely as are the staff. Food is very reasonable price and delicious. Highly recommend the peach ricotta toast, overnight oats and any smoothie bowl!","One of my favorite cute places around Pererenan! Staff were friendly, and the food and atmosphere are top-notch. Lovely place for work from cafe, for good brunch or just having a nice cup of coffee with friends.
The store's interior is stylish and modern, with a clean, minimalist design that makes it easy to navigate. Honey is quite famous, so be ready if you don’t get a table during busy hours especially Brunch time, although it’s busy but food serving time is fair and the staffs are attentive.
I love the food, smoothie bowl and the coffee, I’ll keep coming back for more Honey goods!
Best of luck for Honey, and Team
Love, 🐰♥️☕️","Quite popular place and had some cozy chill vibes. U can choose areas:outside or AC which is great.
Food is good,but portions not so big,if we compare with other place. But the quality of food is good, service fast and friendly. So I had a good experience here couple of times"
ChIJg9EBrHY40i0ROI6lCgqDPus,The Bali Dream Villa & Resort Echo Beach Canggu,-8.6487377,115.1289247,"Jl. Dalem Lingsir Br. Pengembungan, Pererenan, Echo Beach, Canggu, Pererenan, Kec. Mengwi, Kabupaten Badung, Bali 80361, Indonesia",https://maps.google.com/?cid=16951130126620659256,OPERATIONAL,+62 813-3755-8412,resort_hotel,"resort_hotel, hotel, lodging",4.3,467,,"Had a blast staying with my family at their private pool villa. Upon entering the lobby, we received great service from their security and front office staff. Helpful bellboy patiently waiting for us who brings a lot of bags and the bellboy carried most of it by hand!

The villa room (room number 402) is lovely and clean and the pool is also well maintained. Their AC is working really well. The only downside was their hot water is not working and I guess they have begun construction next door which is very loud in the afternoon.

The area is quiet, perfect for those who wants to get away from the bustling main street of Canggu. But, they have a limited parking space for cars (maximum two or three cars).

Their breakfast buffet option is limited but taste wonderful. Room service menu is (surprisingly) very affordable for Canggu area but have limited option.

Staff is friendly and helpful!

Will book again if I ever stayed in Canggu.","The Bali Dream Villa offers a comfortable stay with standard amenities. While not overly luxurious, the rooms are clean and well-maintained. The staff is generally friendly and helpful, though service can be inconsistent. The hotel's location is convenient for travelers, but the dining options may lack variety. Overall, it provides decent accommodation for a reasonable price.","I do not recommend this resort at all.what is advertised is not what you get.The Ac In my room wasn’t working well enough ,at night I’d get so hot and restless.it was so hot a bottle of water would have bubbles in the morning and the ac was running all night.The shower had no pressure at all and when asked they said all the rooms are the same.One morning I woke
Up and there was no running water.i had to wait half an hour for the water to come back.the lift  broke down at some
Point so you had to use the stairs.
Breakfast menu 4/10.if you have any early activities you will miss out on breakfast.
I had to ring the restaurant multiple days to ask for clean glasses as they forgot when the room was cleaned.No balcony or windows.there is construction nearby that gets really noisy.
It was an unpleasant stay and would not recommend staying here.","Pleasant hotel, but unfortunately not worth the money.

Pros
- The rooms are clean, comfortable, spacious
- Friendly staff
- Very quiet and peaceful. Amazing escape from all the noise in Canggu

Cons
- Wifi not accessible from rooms and mobile data reception was poor, which was really disruptive
- Staff forgot to clean our room
- Bathroom needs maintenance, appliances are old and some don’t work well
- Not worth the money. Having paid 1.4 mill / USD100, I expect the basics like wifi & cleaning to be smooth","Great rooms where we booked a Bedroom Pool villa. Location seems a bit interior where you don't have many shops nearby but have great privacy and silence.

If you want to have a luxury and a private stay without any pubs or shopping stuff around then this is the best place to choose."
ChIJ5-dulOQ50i0RUmUVlD2Sz2A,Red Gunpowder,-8.6463054,115.1277129,"Jl. Munduk Tengah No.6, Pererenan, Kec. Mengwi, Kabupaten Badung, Bali 80351, Indonesia",https://maps.google.com/?cid=6975955140995278162,OPERATIONAL,+62 812-4567-8827,indian_restaurant,"indian_restaurant, restaurant, food",4.7,248,,"BEST INDIAN RESTAURANT IN THE AREA❤️ Me and my partner had the best experience here. I want to say a huge thank you to the chef, chris. He made my day. He’s the most patient, caring and just nice person you can meet. We had some vegan dishes and I wish I could give 10 stars, I’m really impressed by the quality of the ingredients and the way they’ve been cooked and served. Thank you to all the team of red gunpowder, I highly recommend this place. I hope I can come back soon. Chris if you read this review you are the best chef on the planet 🙏🏽",Wow! The atmosphere was amazing and unique. Loved the decor and candlelight. The food was also amazing and some of the best Indian cuisine we have tried. Even the rice was notably excellent. Numerous helpful staff. Prices were also fair.,"If you are looking to pay too much for fancy Indian while barely being able to see your dish...this is it!

The food is good, quality ingredients, octopus was juice but very sweet. Rogan Josh was alright but also very sweet.

Overall portions where small and taste modernized Indian.

Great cocktails though!","Food was fantastic, yes a bit on the expensive side but it’s not a regular Indian restaurant. The atmosphere is very good, the staff is super friendly. We asked about the spiciness of the most spicy dish, and the server suggested that we try it and brought out a sample of the sauce to taste. He really helped us pick our food and the cocktails were amazing.

i dont understand why this place is not as popular as all the ones you see on Insta all the time.

The speakeasy bar next door is great too!","An Indian restaurant that boasts a well-deserved high rating, is an absolute gem for those who appreciate the fusion of delectable flavors and captivating settings.
The restaurant's beautiful setting adds an extra layer of charm to the ambiance. The atmosphere is a delightful blend of elegance and comfort, creating the perfect backdrop for a memorable meal. It's evident that Red Gunpowder understands that dining isn't just about food; it's about creating an immersive experience.
Now, let's talk about the main event – the curries. I don't say this lightly, but the curries are quite possibly some of the best I've had in a while. Whether you're a fan of fiery heat or prefer milder flavors, there's something on the menu to suit every palate.
In addition to the fantastic food, is the service. The staff is exceptionally friendly and remarkably efficient.
In sum, I wholeheartedly recommend Red Gunpowder to anyone seeking a remarkable Indian culinary adventure."
