id,name,latitude,longitude,address,url,status,phone,primary-type,types,rating,rating-count,price-level,review 1,review 2,review 3,review 4,review 5
ChIJe7cwB3Y50i0R6QnXmgTv0RY,The Meat Emporium,-8.6520568,115.1555097,"Jl. Bumbak No.44, Kerobokan, Kec. Kuta Utara, Kabupaten Badung, Bali 80361, Indonesia",https://maps.google.com/?cid=1644358142023633385,OPERATIONAL,+62 881-0381-01787,,"steak_house, store, restaurant, food",4.4,224,,"Do not order food that wasn't cut from an animal: the veggies took so long, it came as dessert and were meh compared to the meat. On the other hand, the meat dishes are sooooo good. What's in the name, right.

Get a table, walk up to the counter to pick your cuts, and see how they grill it outside. 👌

Staff is great for people who just want to get their food and be left alone. We don't need chit chat anyways. 🥩","Nestled among the crackling flames of an open fire, the promise of succulent, sprouted steaks beckons diners to this establishment. The food itself is undeniably delightful, boasting flavors that dance on the palate with each savory bite. However, the experience is tarnished by the persistent chaos that seems to engulf the service.

During our visit, patience was tested as we waited over one hour for our meals to arrive. Disappointingly, no explanation was offered for the delay, leaving us to wonder if perhaps a heads-up about kitchen breaks would have been prudent. After all, such practices are customary elsewhere. The lack of communication was further compounded by the absence of even a complimentary drink to soothe our impatience.

Despite the delicious on-point-grilled meat, the disjointed service leaves much to be desired. While the allure of prepared steaks is undeniable, it's disheartening when it's overshadowed by logistical shortcomings. With some attention to detail and communication improvements, this establishment could truly be gastronomic delight.","3 stars because the sausages are over salted. It kills the taste.
Meat is good, service is good, they cook fast and really well!
But it’s really a low quality when salt is the main taste.",Quality meat with plenty to choose from and served according to your choice. Great place to hangout with friends and family,"This steakhouse is a meat lover's paradise! With an attached butcher shop, the variety of cuts including beef, chicken, lamb, and sausages is impressive. You're given the choice to grill the meat yourself or let the skilled chefs work their magic. It's a unique experience that guarantees a mouthwatering meal every time.

They play the Rugby and Football matches there too."
ChIJ_6PnKA450i0REq6muqmZGpI,Sinamon Bali Umalas,-8.6521475,115.1552872,"Jl. Bumbak Gang P. Belitung No.12, Kerobokan, Kec. Kuta Utara, Kabupaten Badung, Bali 80361, Indonesia",https://maps.google.com/?cid=10527896033191964178,OPERATIONAL,+62 821-4444-2354,restaurant,"meal_delivery, bakery, coffee_shop, cafe, store, restaurant, food, wholesaler",4.8,1808,PRICE_LEVEL_MODERATE,"Great cafe for a sweet cinnamon roll or a good coffee. There is a nice selection of different flavors to choose from.
I couldn’t decide on one so I tried the cream cheese and chocolate. Both rolls were heated up to make them nice and soft, warm and melted the frosting 🤤
The cream cheese one was absolutely delicious, whereas the chocolate one was a slight bit tough on the outside with a soft warm inside.
Surely worth stopping by when in the area.","Popped in to check it out after hearing so many good things and loved it. Great atmosphere, cutely decorated, super friendly staff. AND… the cinnamon bun was the most delicious thing I have had in a long time. Soft, perfectly flavored and the right amount of sweetness. The Americano I had with it was beautiful as well. I will definitely be back!",Amazing service.. coffee and cinnamon rolls were amazing! for sure will be back here and take one of each!! 😍💕,"Had really good experience in this store that we visited twice. Free wifi, cool AC provides a safe haven from Bali's scorching heat, gentle music accompany your coffee. Will be back the next time I'm in the area!","It’s the best cinnamon roll I’ve ever had in my life!!!!
Will be coming back to this place.. like once a week perhaps 😂"
ChIJpVaEU2BH0i0RBilqyofXsDU,Warung Babi Genyol Arta Nadi,-8.650751099999999,115.16200740000001,"Jl. Raya Semer No.47, Kerobokan, Kec. Kuta Utara, Kabupaten Badung, Bali 80361, Indonesia",https://maps.google.com/?cid=3868829058127767814,OPERATIONAL,+62 822-4723-5242,restaurant,"restaurant, fast_food_restaurant, food",4.8,399,,"Their sambal is to die for. Spicy lovers out there need to try it. I bet you’ll come back for more. I ordered via gojek to bring them to Jakarta and there’s nothing changed once I opened it few days later. The flavor and the freshness stay the same. Although I’m not a big fan of their kerupuk kulit, I’ll definitely visit this place often.","Best Balinese food I had! Recommended by locals. Was so good that we ordered extra for takeaway!
Only downside was crazy amount of flies on the tables, but strangely none near the food.","THIS. THIS PLACE AND ITS FOOD IS THE ESSENCE OF BALINESE CULINARY. Best, best best babi genyol, perfectly spiced, perfect portion, masterpiece handcrafted by a very nice and friendly ibu-ibu. Once you come here you'll come back here again. Taste is beyond compare. Their sambal is really good too. Price also affordable. No wonder this place is always busy. Hope they expand to have more space because everybody wants babi genyol arta nadi","MUST TRY when in Canggu. The rice itself is cooked really well, crispy pork is sliced thinly thus very effortless to chew/devour. Chilli is full of flavour, addition of peanuts were a nice touch to balance the spiciness, vegetables played a good supporting roll and dish came together really well.","Great alternative for regular bigul. Cheap and tasty. The place is easily accesible with motorbike/scooter, do not reccomend using a car since they have no parking space."
ChIJoSohAWJH0i0RFZqZof3nj3U,Jay's Villas Umalas,-8.6541714,115.15896319999997,"85W5+8HP, Jl. Tegal Cupek, Kerobokan, Kec. Kuta Utara, Kabupaten Badung, Bali 80361, Indonesia",https://maps.google.com/?cid=8471244500631132693,OPERATIONAL,+62 361 9002464,hotel,"hotel, lodging",4.2,259,,"Picture tells a thousand words. See the photos yourself with descriptions.

We were assigned to villa room no.16
Lotsa mosquitoes & their Wi-Fi connection was down for days.

If no investment being made to further refurbish/upgrade, this villa gonna loose all the guests someday..","Very nice overall. Nice to see a villa look like it's photos for a change. However some security issues, our villa didn't have a room that we could put our things in and lock securely. No safe.

Edit - Reading the bad reviews here I agree that our pool water was not clean, and parts of the outside do still look like it's under construction (it's a shame the main shared pool is empty) but the villa we had (villa 1) was in good condition inside, everything was clean, no stains, and our purpose was to relax inside, so we didn't care so much.","Looking at old comments we booked but seems recent comments state the truth. The property is old but not managed timely due to which swimming pool seems dirty, slow working AC, useless showers, broken tap for battub, spots on curtains, ants on bed. The hotel staff tries to help in ways but seems like coming to a place out of comfort while we pay for vacay comfort. Restaurant, main pool are unoperational but the ambience looks old. While the images on website are pretty new. It’s a trap here.","The room really really needs maintenance. The service was excellent, easy to find the hotel with google maps","Nice place with friendly staff..
The room was clean..
And the location is not too far from the public area.."
ChIJ5T4d-pw40i0R2LniBsWsaEk,Bloomfield Bali,-8.6518123,115.15640499999999,"Jalan Bumbak No. 25, Gg. Pulau Batam Umalas No.6, Kerobokan, Kec. Kuta Utara, Kabupaten Badung, Bali 80361, Indonesia",https://maps.google.com/?cid=5289667724570704344,OPERATIONAL,+62 857-3888-3093,resort_hotel,"resort_hotel, hotel, lodging",4.3,257,,"Very limited amenities, no kettle not tea bags in room.... restaurant and room service not that great.. the only good thing is the pool area..
Overall not recommended","I booked Bloomfields quite last minute and was very happy with my decision. The decor in the rooms and throughout the hotel is stunning, The pool and restaurant area is a perfect oasis for relaxing and it was a dream to be able to practice yoga every morning in their dedicated outdoor yoga area. Yes the location is a little out of the way but if relaxing is what you are looking for this is it!! its only a 15 minute Grab/Go Jek away from Canggu beach and shopping area, plus there are lots of amazing brunch spots within walking distance.","Amazing tranquility away from central Canggu.

The service was amazing, they are extremely attentive.

The decor of the hotel, wow amazing. Great place for pictures as it looks amazing wherever you go! I loved our room too. Spacious and relaxing.

The view of the rice fields from the pool was beautiful. I loved the quality of breakfast.

I would recommend for sure!","place is very remote, breakfast is best avoidable and cheaper to buy at the hotel then online. Most of the ground floor rooms are very noisy and too basic for the price. Pics are photoshopped.","Room door was broken and open all the time, 24/7. They said it can not be fixed. Sink in the bathroom was damaged. Mirror damaged. Aircon was working very bad (either very cold or hot air). Closet doors were creaking as hell. WiFi was very weak in our room. No table at all in the room for working. First days even electricity had a few blackouts, but I guess they solved it later. Looks like the owner was preparing the hotel for the sale, and did not care about it at all. IN the common public area they even had a meeting with potential buyers (it's very unethical to the guests, who came here to relax).

Would love to, but cant give more that 3 stars... If they would keep the hotel in a good condition, it would worth 5 for sure."
ChIJ12Ky3Xc50i0RaQScsi-K7uU,Kopikota Bali,-8.6515612,115.16115219999999,"Jl. Tegal Cupek, Br. Anyar Kelod Jl. Tegal Cupek I, Kerobokan, Kec. Kuta Utara, Kabupaten Badung, Bali 80361, Indonesia",https://maps.google.com/?cid=16568332016607298665,OPERATIONAL,+62 877-7750-8981,cafe,"cafe, coffee_shop, store, food",4.5,343,,"Feeling good to have eaten here. Because it's not a busy area, so it's quiet compared to other restaurants or coffee places. The services are good, the staff are nice. Good price anyway! Recommend if u wanna work here. The food is good, I want to try the coffee next","Always become our breakfast meeting every weekend or any days we like ❤️

Super affordable and the menu are delicious

The ambience is also comfortable.

Highly recommended for breakfast or lunch.","We find the food here salty.

For healthier lifestyle, less salt please. Thank you.

Ambience wise not bad.","Enjoyed breakfast set menu (IDR 60k). Such a proper breakfast including slice of fruit, fresh juice and coffee as well, but commented the hash brown is not up to my expectation.
The cafe is quite spacious and suggested to have more western or calm background music to build the ambience.","One of my go-to cafes for breakfast in Bali. The breakfast set is a great value for money.

Flavoursome food, fresh ingredients, quick service, friendly staff, and lovely atmosphere. They have a collection of books in the corner 😍

Strategic location with plenty of parking."
ChIJLdXnIZ440i0ROSOCWgiLEIY,Umalas Suites,-8.653611999999999,115.16087379999999,"Gg. Wayang 11 No.1, Kerobokan, Kec. Kuta Utara, Kabupaten Badung, Bali 80361, Indonesia",https://maps.google.com/?cid=9660374068704191289,OPERATIONAL,+62 361 739285,,lodging,4.6,71,,"I love that place 🤩 it's so beautiful and pretty 💖 very peaceful place 😻 my kids enjoyed in the swimming pool 😁 and the morning breakfast was amazing 🤩 they have so many varieties and if we're going out little early means they're giving box food. You can take it anywhere.... they're giving a nice packing also. Tastey food and healthy food also they're giving.

Daily they're cleaning the room very neatly 😻😻😻 I loved their service. If we need any help they'll guide you. If possible they'll arrange that also. 😀 We stayed there for 6 nights 💖💖💖 amazing place good price. Don't miss it. People are so good.",Was a nice overnight in Umalas Suite. Very friendly staff. The room is big and clean. What we really like was the breakfast. Very fresh and tasteful. Fully recommend to stay here.,"very dissapointed with services in here, they charge me more then agreement before checkin.","Unfortunately this hotel has not been well maintained. It is very dirty, the sheets and towels are all gray and stained, so are the walls, doors etc. Water and internet do not work well. They do not have enough utensils, plates, bowls for the rooms. Pictures of the window are what they consider “garden view.”   Staff is very nice and does the best they can with what they are working with.","Sadly this place is very poorly maintained, old, it's dump full of mold and dirty. The pictures are misleeding.

The cleaning is terribly done.
All cussions, bed frame and even cubbords smell of sweat.
Bathroom smell very unpleasant of septic. The bathroom air suction brings in others room vapour. Residue of shampoos and tooth paste on a surfices, hair in drains...
Towels are old, grey (once upon a time might have been white) with stains.
Expect dust under the beds and on rugs, pests insect, rust on metal pieces)

The mold is being painted over before new gests arrive.

Hot water was not working often, internet was super slow.
Loud door banging sound on the roof when is windy wakes you up at night. Sounds like roof door are being kept open.

I can't help not to be very honest and list this all down here.
It did not feel nice stay, nor clean, fresh here.
Staff was always polite and nice as Indonesian people are.

I recommend to book elsewhere, you can easily get a newly build modern stylish apartment for this price."
ChIJ-cPwgP5H0i0RALlHRShOycA,The Santai Canggu by LifestyleRetreats,-8.6514878,115.15703649999999,"Jl. Bumbak No.88, Kerobokan, Kec. Kuta Utara, Kabupaten Badung, Bali 80361, Indonesia",https://maps.google.com/?cid=13891720460468992256,OPERATIONAL,+62 857-3733-3536,,"hotel, lodging",4.6,27,,"Had an incredible time with my family at The Santai in Bali, staying in their 3-bedroom villa. What made our stay truly memorable was the staff. Everyone, from the drivers, front desk, to the kitchen and service teams, went out of their way to make us feel welcome. They’re the heartbeat of this place!

We did have a few issues, like the lighting being a bit too dim for our liking at night, the AC struggling during the day with the Bali heat, and some bugs visiting because of the open showers. But, when we mentioned it, Mr. Yonus, the general manager, personally came to see us. He was super approachable and did everything he could to sort things out for us. It’s clear the place runs so smoothly because of his great leadership.

Despite those small bumps, our experience was top-notch. The hospitality here is what you hope to find everywhere you go but rarely do. I’m already excited to come back to The Santai on our next Bali trip. If you’re looking for a spot with comfy vibes, excellent food & service, and a team that goes above and beyond, this is it.

Hope they can fix the AC issue soon! I’d highly recommend this place for a stay!","A beautiful resort villa in a nice location. The rooms were a good size and although the en-suite bathrooms were outdoors, it gave a nice Bali experience to the stay. As per a lot of the other reviews, the lighting was way too dim and it made it hard to enjoy the villa after sunset with low lit lights in the bedrooms and other areas of the villa.
The sliding doors to the bedroom and bathroom were an absolute nightmare to open and close. There are no handles to slide the doors open so I tore off 2 nails trying to get into the bedroom! I wish they had installed handles to make it easier to enter/exit each room.
The staff were very friendly and helpful. Breakfast was great but all day dining was not so great and not recommended.
I highly recommend NOT visiting during Nyepi if you’re visiting for less than 5 days as you lose 2 days not able to explore  the city.
Also I’m not sure if it was just my bad luck in getting this particular masseuse (on the day of Nyepi where it’s was short staffed), but I do not recommend getting a massage. Having had massages in Australia, UK, all over Europe and even in Bandung, for me it was the worst massage I’ve ever had. It felt like she had no idea what she was doing or she was out to torture me by digging into my back, arms and head, pulling out my hair (whilst I think attempting to give me a head massage) and was so rough when massaging my face that I got oil in my eye!
Other than that, our whole family had a lovely time during our stay and appreciate the hospitality of the villa staff.","Amazing service and rooms, the staff went above and beyond. The in house cooking experience was amazing, very very worth it
Highly recommend","Stayed at Santai Umallas, amazing people great hospitality... little prizy but you get lots of facility....",The place is beautiful n service is awesome. Breakfast is awesome too. They really prepare our vacation well and the decor for the birthday is wow. Thanks to the great service
ChIJRV8r1Z440i0RfbffRzKPNZc,The Plumbers Arms,-8.6487642,115.1621344,"Jl. Raya Anyar No.8, Kerobokan, Kec. Kuta Utara, Kabupaten Badung, Bali 80361, Indonesia",https://maps.google.com/?cid=10895772319609763709,OPERATIONAL,+62 851-0044-9132,bar,"bar, liquor_store, store, restaurant, food",4.4,932,PRICE_LEVEL_MODERATE,"We went here for Sunday Roast and had the beef and pork dish. We enjoyed a game of darts with dinner. This pub is very spacious, with lots of different seating options. We have also grab food delivery from this place and the food always comes hot and tasty. Kid-friendly, but go early for Sunday Roast!","Glad knowing this pub is close to our neighbourhood. Can’t fault anything we’ve been here 4 times.
Food and drinks are great, service is friendly 😊
Check out the beer garden 😍","We went there for Sunday Roast.
We had beef and chicken. Both were really great, didn’t disappoint. The veggie was quite a lot, the gravy was great. You can also ask for a replacement for the sides you don’t want. Good value for money because it was a big portion.
Very friendly staffs.
There’s also pool table, darts, etc.
Definitely going back there for Sunday Roast.","Hubby and I came here and was lovely service great food, if your in Bali this place is the place to come check out!!","The MOST amazing roast I’ve ever had.
Staff super friendly & the Bintang is super cold!!
The wine selection in the bottle shop area has the biggest selection of wines that I’ve seen in Bali
Highly recommend"
ChIJ82qQqIA50i0R1eya2qCsG7o,Coffee Moodest,-8.6522084,115.16080769999998,"Jl. Tegal Cupek No.34, Kerobokan, Kec. Kuta Utara, Kabupaten Badung, Bali 80361, Indonesia",https://maps.google.com/?cid=13410502122288114901,OPERATIONAL,+62 877-8844-5509,cafe,"cafe, coffee_shop, store, food",4.4,243,PRICE_LEVEL_MODERATE,"Been here twice during our stay, it was amazing. Large portion size for an affordable price, great value! No A/C but seating semi-outdoor was fine.

The only downside is the construction going on opposite of this place with some noise and dust.","OMG, this is the best breakfast I tried.
Not sure when was the last time my breakfast was so good..

The umami aroma fragrance was far beyond my taste imagination. So refreshing to the start of a new morning. Crispy hash-brown, scramble egg + avocado paste with a pinch of saltiness to perfectness.

Kudos to the chef ! How I wish the chef cook for me everyday.

Food served pretty fast by service oriented staff as well.

Great ambiance & cozy lawn yard.
I’ll be back for more. Keep it up 💪","Nice small place for having breakfast, with a very good price. I tried the boss (Bagel, Omellette & Salmon) which is good although the Salmon Bagel could be better. The coffee also good. And the price is good. Thank You.","I stumbled this place while i was looking for breakfast. Fortunately it was Wednesday and they have this breakfast package for 50K, you get fresh fruits, bread (choose between sourdough, brioche, muffin), egg (choose ur way), juice (that day they served watermelon) and coffee (choose between latte, capuccino, americano, etc). It was good and portion was quite big.","I love this cafe. It has a very humble and relaxing ambience. The staffs are really friendly and helpful.

The coffee is one of the bests in town. The juices always served fresh. The foods taste great. My favorite is seafood avocado salad and chicken cashew salad. I could eat the salad every day. And the price is very affordable!"
ChIJQYbYThU50i0R3QSPIAcp3DQ,Pasta Dealer Bali,-8.6519771,115.1564947,"Jl. Bumbak Dauh No.40, Kerobokan, Kec. Kuta Utara, Kabupaten Badung, Bali 80361, Indonesia",https://maps.google.com/?cid=3808964495436350685,OPERATIONAL,+62 813-3984-8580,italian_restaurant,"italian_restaurant, restaurant, food",4.3,361,,"The place is quite small with only 3-4 tables and a waiting area for takeaway and/or delivery driver

Got the Crema & Truffle Gnocchi and Creamy Cajun Shrimp if I remember correctly. Both of them are very tasty, love both the textures and flavours
They also give us focaccia, which were very great as well

When we visited, they also have a voucher in Grab, it was a 25% discount voucher, making it a very good deal! Will definitely visit again","We ordered lemony chicken and alfredo pasta.

The pasta is filling 😁, we ate around 2pm and we were still full till dinner time.

A small cozy place, lot of options for pasta.",Great pasta (for a reasonable price)! Taste was superb with al dente textures. Friendly service and nice ambience for the size. Will be back for more..,"Their pasta were really good, they freshly mad your pasta when you ordered it, so it is absolutely worth to wait. Even though their pasta dishes choices are plentiful, their beverages on the other hand are limited. But nonetheless you will enjoy your dishes and your time here. Great location as well. But keep in mind that car parking spots are very limited, so scooter are recommended.","A nice small spot serving a variety of delicious pasta dishes cooked al dente, perfect for take away.

Dining in is available but there's limited seating and since it's an open kitchen and semi outdoors, it can get very warm inside.

Can't go wrong with an order of Fettuccine Shrimp Scampi and Penne Alla Vodka!"
