id,name,latitude,longitude,address,url,status,phone,primary-type,types,rating,rating-count,price-level,review 1,review 2,review 3,review 4,review 5
ChIJ_3qRDxw_0i0RtlPi_KMnDzg,Kirani Joglo,-8.603741099999999,115.25789689999999,"Jl. Raya Celuk, Celuk, Kec. Sukawati, Kabupaten Gianyar, Bali 80582, Indonesia",https://maps.google.com/?cid=4039490976050467766,OPERATIONAL,+62 811-380-177,lodging,lodging,4.7,61,,"Perrrrrfect!
Receptionist are friendly and helpful, give us welcome drink. Cleanliness is very well maintained.
Amenities and room facility are great (bath tub, amenities, mini fridge, mini kitchen with stove etc)

Definitely will be my 1st choice of staying in Bali (hope we can visit Bali again 😁)","A hidden gem amongst ubud neighborhoods. Pretty authentic as on Joglo vibes. A very homey place to stay. We held a shooting here with comfortable circumstances, I would love to recommend this place for youngsters 🥰","This villa is perfect. Quick receptionist, very clean and cozy room, excellent service, and a perfect ambience for family vacation. A literal hidden gem, as this villa is located on south of Ubud.

Although it's located outside crowded areas, small restaurants and minimarts are still available so it's still convenient.

Internet TV and wifi are provided, with also hairdryers and perfect bathtubs to spend your time for leisure.

10/10!","A place I call paradise! The best place to stay in the area, I fell in love with Kirani Joglo, the villas and the staff are amazing! Thank you for your kindness and attention to detail, you made us feel so special! We've already booked again and I will visit this place once per year for the upcoming years! Thank you!!! 🙏","Really nice bungalows and the service is great. They waited for me to arrive after midnight and kept some things safe that I forgot behind.

The area is interesting as there is absolutely nothing around not even rice fields so don't have expectations. I stayed as it's close to Denpasar and I needed to be at Immigration which was close enough from there.

The rooms are really nice and very clean. There is a share kitchen too. Pool was nice."
ChIJcTeGNks-0i0R8_IjKrV_7B0,Barong And Kris Dance,-8.6061265,115.2558671,"97V4+G8X, Jl. Pura Puseh, Batubulan, Kec. Sukawati, Kabupaten Gianyar, Bali 80582, Indonesia",https://maps.google.com/?cid=2156238737676432115,OPERATIONAL,,performing_arts_theater,"performing_arts_theater, event_venue",4.3,340,,"The current cost of the ticket to watch this beautiful performance of famous Barong dance is IDR 150,000/person.

It’s a beautiful open stage next to a stunning elaborate Hindu temple of Pura Puseh. It is one of the oldest group that perform in this region.","Loved this!
Had a huge open air auditorium to sit in with a roof for shade. Every seat has a good view with graded seating.
The performers were fantastic! Excellent dancing and speaking voices were loud so we could all hear.
The band were good, keeping pace with each other. The show is on every day at 9.30am (with music) and another show every night around 6pm (no music).
Well worth the 150,000 IDR ticket.
Before the show you can have a photo taken with a lady in costume and purchase this after, I think it was 100,000IDR.
I highly recommend seeing the Barung play, very entertaining.",Interesting live theatre depicting the Balinese epic story of good Vs. evil,"We stopped here as part of a day trip experience. The admission is about IDR 150k to see the performance. You can go check out the temple and there are many locals around to ask questions. The performance was a great experience and lasted for about 1hr. You get a description of the play and an outline of the main characters, their role and what they stand for. They also have an orchestra playing music with the play. Great Balinese cultural (spiritual) experience.","It seems that there are several types of performances that take place at this venue. I watched the morning show. A lot of people mention this being a traditional Balinese experience. I have no way of verifying this as I am not Balinese. There were definitely almost all tourists in the audience. As a tourist who often frequents performing arts shows in other countries, I found this quite unentertaining. It’s true that the costumes and music are great. The storyline was moderately difficult to follow. And about 20 minutes in, it was uncomfortably noticeable how antsy the audience had become. I believe most people, including us, stayed out of respect and not wanting to be rude. If your tour guide recommends this, I think you’re better off asking for an alternative."
ChIJQVCQ-M8_0i0RSWk6x52Ow_c,Twissterdog Gianyar,-8.6024165,115.2616614,"Jl. Raya Celuk No.78, Batubulan, Kec. Sukawati, Kabupaten Gianyar, Bali 80582, Indonesia",https://maps.google.com/?cid=17853270156130281801,OPERATIONAL,,fast_food_restaurant,"fast_food_restaurant, restaurant, food",4.2,153,,Enaaak.  If you are after a something a little different to eat or snack on you must pop in here.  Wow. Twisty potato with almost anything you can imagine.  I had the twisted potato Bolognese and bbq chicken rice bowl.   Both very delicious and crispy.  I will be back,"For first time costumer like myself, this place kinda more like family friendly and absolutely safe food haven for your kids since the food here is basically french fries, noodle (new item) and sausage.
They have mixmatch menu you should try once, which is sweet and spicy maichi!
The fries is still warm and properly cooked, which i like but some of the curly fries are nearly on the burn state, maybe the chef like it that way.
The interior is minimal, they have multiple fans that working okay, the outdoor area is quite spacious but no fan, the toolet is quite... Not so much clean.

For me, solid 4⭐/5 experience","Nice place for couple dinner, they also have kids playground.
But for the food maybe my bad luck, I got hard potatoes. Afterall the price is worth.","Great place for hanging out with friends, cozy place, huge parking lot and great ambience.

As Twissterdog lover, unfortunately their quality of food and drinks still lacking compare to Twissterdog Denpasar

In my opinion, Their fries are overcook, a bit of bitter taste and sometimes its hard. For the drink, our teh tarik taste like water.

I suggest to set a designated smoking area","We sat down with our family and dog. They gave us menus. When we went to order 10 minutes later, they said ""put your dog outside"".  It's not the fact that the dog wasn't allowed inside, we respect that, but more the fact that they watched us get comfortable and ready to order, then said it. Staff definitely need more training!"
ChIJTQ3isUo-0i0RP4DUSQlPPhI,Warung Ulam-Ulam,-8.606202699999999,115.2593138,"97V5+GP8, Batubulan, Sukawati, Gianyar Regency, Bali 80582, Indonesia",https://maps.google.com/?cid=1314575042550726719,OPERATIONAL,+62 361 297768,indonesian_restaurant,"indonesian_restaurant, restaurant, food",4.4,447,PRICE_LEVEL_MODERATE,"A good place to bring your family here for lunch or dinner. It has a vast outdoor settings, gazebo, with a view of a rice field. There's a small playground for kids too. Holding a small scale event like kids birthday party would be perfect.
The food is good. I just expect more for the sambal. Otherwise it's great by considering their reasonably priced  menus. Overall, it's a recommended restaurant for family.","Peaceful Ambience for lunch. My friends had the crispy duck a little bit bony but delicious, I had the grilled chicken which was very flavorful. We sat in a little Hut above a small pond with probably two dozen fish in them. My four-year-old enjoyed looking at the fish and feeding them a little rice. The restaurant overlooks a large rice filled with people collecting the stalks as we ate. The prices are pretty good, and the mixed fruit drinks are fantastic.",We came during lunch time a very hungry stomach for a quick lunch. The food was okay. The view is excellent with well maintained gardens. I wish the music is Balinese traditional instrument (it was saxophone while we were there),"The grilled chicken is suite my taste!

The interior of the restaurant is very cool. You can bring children here cause there is a children plays area.

It's more perfect if you come before harvest season, cause this restaurant is surrounded by padi field.

Price : $$
Taste : ☆☆☆☆
Place : 👍👍👍👍","Good food good ricefield view with the satisfying breeze in outdoor seating, just a little expensive."
ChIJ4bVStLQ_0i0R9ZYr1CFIeSg,Barong Dance Pura Puseh,-8.6060888,115.25590810000001,"97V4+H97, Jl. Pura Puseh, Batubulan, Kec. Sukawati, Kabupaten Gianyar, Bali 80582, Indonesia",https://maps.google.com/?cid=2916441543829853941,OPERATIONAL,,cultural_center,cultural_center,4.5,57,,"We were recommended this experience by our local Bali driver and WOW it was amazing. A rich cultural story with the most beautiful costumes and music. We were provided with written descriptions in English so we were able to understand the story very well. If you want to experience authentic Balinese culture this is worth the stop, but get there early to get the best seats.","Attending the Barong dance at Pura Puseh in Bali was an authentic and insightful experience, allowing me to immerse myself in the Balinese culture. While the ticket prices leaned slightly towards the pricey side compared to other options on the island, it's important to recognize the complexity of the performance involving numerous participants.

One thing that truly stood out was the inclusion of a storyline breakdown in English, which made it immensely accessible and easy to follow. This considerate touch added to the overall enjoyment of the performance.

I highly recommend the Barong dance at Pura Puseh for those seeking a genuine cultural encounter amidst the sea of Instagram-centric activities that have seemingly engulfed Bali. It's a refreshing deviation from the usual tourist traps and serves as a reminder of the rich heritage that often gets overshadowed by the allure of picturesque snapshots.","Excellent exhibition of traditional and authentic Balinese arts and culture.
Highly recommended.","Amazing dance, one of the real Bali culture",Cultural dance it was entertaining
ChIJ2SRRD5M_0i0R6Fe8ubs0G28,GOGO FRIED CHICKEN CELUK,-8.603292999999999,115.25804099999999,"Jl. Raya Celuk, Singapadu, Kec. Sukawati, Kabupaten Gianyar, Bali 80582, Indonesia",https://maps.google.com/?cid=8006050743460845544,OPERATIONAL,,restaurant,"restaurant, food",3.8,129,,"They always forget my fries and tea when I order the paket burger. This time I told the grab driver to make sure that they add it, since they always forget. This time they added the tea and fries (thanks grab) and gave me a chicken nugget in my sandwich instead! Smh wow thanks for the nugget","Love Geprek food, cause I love spicy food... Here u can drink a lot...",The besttt!!!!🤩🤩🤩,,
ChIJi_GaNFk_0i0RMVJop3ZDsLk,Kecak Pura Puseh Batubulan,-8.606164,115.255976,"97V4+H97, Jl. Pura Puseh, Batubulan, Kec. Sukawati, Kabupaten Gianyar, Bali 80582, Indonesia",https://maps.google.com/?cid=13380268669811577393,OPERATIONAL,+62 823-4064-3830,tourist_attraction,tourist_attraction,4.8,12,,Excellent exhibition of classical Balinese dance in the majestic Pure Puseh. Easy access and no issue with ticket availability.,must watch,,,
ChIJRWDsOgA_0i0RRfbOwuJeWN4,Point Coffee,-8.603245099999999,115.25802089999999,"Jl. Celuk Sukawati, Batubulan, Kec. Sukawati, Kabupaten Gianyar, Bali 80582, Indonesia",https://maps.google.com/?cid=16021660002394502725,OPERATIONAL,+62 21 1500280,coffee_shop,"coffee_shop, cafe, store, food",3.6,12,,The coffee is amazing. The taste and the selection. Brown sugar ice latte is my favorite. Honestly Point coffee tastes better than coffees in most of normal restaurants. Loving it!,,,,
ChIJlwmRZCI_0i0R3BB3L6cgXfM,Happy House 2 Celuk,-8.6051875,115.2616363,"97V6+WMC, Batubulan, Sukawati, Gianyar Regency, Bali, Indonesia",https://maps.google.com/?cid=17536208426478538972,OPERATIONAL,+62 896-1003-0811,extended_stay_hotel,"extended_stay_hotel, hotel, lodging",,,,,,,,
ChIJjbYAW5k_0i0Rp8HqIyAAndg,Babi Guling Payangan Bu Sujani,-8.6023658,115.26102759999998,"Jl. Celuk Sukawati No.27, Batubulan, Kec. Sukawati, Kabupaten Gianyar, Bali 80582, Indonesia",https://maps.google.com/?cid=15608632021577548199,OPERATIONAL,+62 859-3533-4302,restaurant,"restaurant, food",4.9,16,,I guess the best babi guling I ever tried. For a reasonable price.,,,,
ChIJTz1xwcQ_0i0RBLUdZ6dmPig,Dodok Studio House,-8.6047323,115.26260569999998,"Jl. Teratai Gg. Jempiring, Celuk, Kec. Sukawati, Kabupaten Gianyar, Bali 80582, Indonesia",https://maps.google.com/?cid=2899868079248749828,OPERATIONAL,+62 813-3804-2888,,lodging,5,3,,,,,,
ChIJg1TllVA_0i0RDEWgFvekMD4,Laklak mek mangku,-8.603981899999999,115.2554658,"Jl. Raya Celuk No.100x, Singapadu, Kec. Sukawati, Kabupaten Gianyar, Bali 80582, Indonesia",https://maps.google.com/?cid=4481263010377123084,OPERATIONAL,+62 853-3989-1399,restaurant,"restaurant, food",5,23,,"Delicious Balinese traditional food, smooth and crunchy come together in my mouth. So satisfied",Great taste,,,
ChIJhSHfwz4_0i0RU5YbBCIH2pc,Mie Seblak Bali,-8.6035231,115.25830219999997,"Jl. Celuk Sukawati No.27, Batubulan, Kec. Sukawati, Kabupaten Gianyar, Bali 80582, Indonesia",https://maps.google.com/?cid=10942066087329240659,OPERATIONAL,+62 857-9810-5964,restaurant,"restaurant, food",4.8,8,,,,,,
ChIJiQW9zkA_0i0R8GI3Kms22jk,Rice field house,-8.6046403,115.2604267,"Jl. Teratai Blk. II No.32, Batubulan, Kec. Sukawati, Kabupaten Gianyar, Bali 80582, Indonesia",https://maps.google.com/?cid=4168704238982488816,OPERATIONAL,,bed_and_breakfast,"bed_and_breakfast, lodging",,,,,,,,
ChIJj_B1UUo-0i0RuQlwtGcGLoU,Rumah Makan Minang Batubulan,-8.603674,115.257458,"97W4+GXP, Jl. Raya Celuk, Batubulan, Kec. Sukawati, Kabupaten Gianyar, Bali 80582, Indonesia",https://maps.google.com/?cid=9596614898451745209,OPERATIONAL,+62 819-1620-0378,indonesian_restaurant,"breakfast_restaurant, indonesian_restaurant, restaurant, food",4.1,117,,The authentic Indonesian warung experience. Good Sumatran style good served at excellent prices. Portions were generous and the people were nice.,"It's one of the best minang restaurant i ever try,all the food is delicious,must try the ""rendang"".The price is quiet expensive but it's worth it.",Best Padang Food restaurant around here,"Gr8 taste, affordable price",Nothing special. Good food taste
ChIJlyjDF0U_0i0RsWBrIPjrQMc,Semesta Bali Villa,-8.6031092,115.2625872,"Jl. Klaci Gg. Mawar, Batubulan, Kec. Sukawati, Kabupaten Gianyar, Bali 80582, Indonesia",https://maps.google.com/?cid=14357735062985466033,OPERATIONAL,+62 877-6018-7201,hotel,"hotel, lodging",5,1,,"Great villa, very quiet location overlooking the rice fields, great shower. I loved it. Would recommend.",,,,
ChIJR3TVqEs-0i0RUEDKMQTvYWQ,Warung Banyuwangi,-8.603885199999999,115.25652649999999,"Jl. Raya Celuk, Batubulan, Kec. Sukawati, Kabupaten Gianyar, Bali 80582, Indonesia",https://maps.google.com/?cid=7233325277827973200,OPERATIONAL,+62 858-8000-8095,indonesian_restaurant,"indonesian_restaurant, restaurant, food",4.3,64,PRICE_LEVEL_INEXPENSIVE,Very delicious local food!!,"Update August 2022:  Still delicious food for an incredible price. And the couple who run the place are so kind. You won’t regret stopping.

Really good Javanese food. Eat here often.",Many choice of javanese food and very delicious with cheap price. Also friendly service.,Delicious Javanese food at a very reasonable price. Very friendly owners.,"Nice taste of food, but not so many choice of dishes."
ChIJ8SCH5J0_0i0RsNoPaaes3Q0,CREPESIGNATURE,-8.603334499999999,115.2581429,"Jl. Celuk Sukawati No.57, Batubulan, Kec. Sukawati, Kabupaten Gianyar, Bali 80582, Indonesia",https://maps.google.com/?cid=999144527368280752,OPERATIONAL,,restaurant,"store, restaurant, food",4.2,5,,,,,,
ChIJiZ3rAW0_0i0RvqAh9yTqaA4,Ayam Potong Batubulan-Indobendul,-8.608760199999999,115.25912459999999,"Gg. Angrek No.3, Batubulan, Kec. Sukawati, Kabupaten Gianyar, Bali 80582, Indonesia",https://maps.google.com/?cid=1038337158594797758,OPERATIONAL,+62 819-9921-3368,farm,"farm, restaurant, food",3.7,3,,,,,,
ChIJ3VgqepQ_0i0Rlv4Oyfb6Gg8,Kos Daniswara,-8.6043861,115.26073869999998,"Perum Nuansa Indah, Jl. Teratai Gg. Sandat Blk. 1 No.23, Celuk, Kec. Sukawati, Kabupaten Gianyar, Bali 80582, Indonesia",https://maps.google.com/?cid=1088458197805498006,OPERATIONAL,+62 813-3746-3591,motel,"motel, lodging",5,1,,,,,,
