id,name,latitude,longitude,address,url,status,phone,primary-type,types,rating,rating-count,price-level,review 1,review 2,review 3,review 4,review 5
ChIJERs6XtxB0i0RUhUH21aV_mk,Jiwan Coffee & Things Bali,-8.6613125,115.2495625,"86QX+FR9, Jl. Sedap Malam No.100x, Kesiman, Kec. Denpasar Tim., Kota Denpasar, Bali 80237, Indonesia",https://maps.google.com/?cid=7637706218341340498,OPERATIONAL,,coffee_shop,"coffee_shop, cafe, food, store",4.8,92,,"I recently visited Jiwan Coffee & Things in Bali, and it turned out to be a delightful spot for a coffee fix and more. The quality of the coffee was decent, delivering a satisfying pick-me-up to kickstart the day.

What truly sets Jiwan Coffee & Things apart is its charming interior design. The second level, though open-air, provides a nice ambiance, but it can get quite hot during the day. However, the real surprise was discovering the secret level 3, offering a serene view of the rice paddy fields. It's a hidden gem that adds a unique touch to the overall experience.

I decided to sample some of the food offerings as well. While the pasta was okay, it was the rice dishes that truly stood out. The flavors were delightful, and the quality of the rice was exceptional. It's always a pleasure to find a place that excels in the basics.

In terms of pricing, Jiwan Coffee & Things offers good value for money, making it a very affordable option for a meal or a coffee break. The affordability combined with the nice ambiance and decent quality of food and coffee make it a must-visit for those looking for a relaxed setting to unwind.

Overall, Jiwan Coffee & Things is a lovely place to enjoy a cup of coffee, savor a meal, and take in the peaceful surroundings. If you find yourself in Bali and in need of a cozy spot to unwind, Jiwan Coffee & Things is definitely worth checking out.","I'm in love with this place. It's like a fun house for adult and kids. A fun meeting for business as well as pleasure. Take your friends, neighbors and love ones. Food is delicious.
I ordered vanilla latte yum
Tahu kecombrang yum
Jiwa brekafast yum",Beautiful view with amazing food at really good prices highly recommend checking it out parking is available,"Google was busy because of this place. First i googled for a route to take me here. Then i was made curious to google what jiwan means (serene life). Then i asked for wifi password which made me open my google search AGAIN. I was here to get some job done on my laptop and i end up spending time googling through stuff unrelated. And now i feel obliged to write something here.
Love this place the minute i stepped in. It
did give me a serene vibe. Strong coffee with long lasting after taste. A hint of dark chocolate, cardamom ending with a sharp bite. Wonder what blend they are using.","Good places, good service, price a little but pricey but worth it"
ChIJ505W2n1B0i0RijgAWfd3TrE,Akasia Indah Kost,-8.659450399999999,115.24542199999999,"Jl. Akasia XVI No.120 C, Kesiman, Kec. Denpasar Tim., Kota Denpasar, Bali 80239, Indonesia",https://maps.google.com/?cid=12776281097130489994,OPERATIONAL,+62 821-4745-6029,,lodging,5,5,,,,,,
ChIJTxrHd5JB0i0RQZZk2thJGmQ,"C21 Apartment, Coffee, and Spa",-8.6602728,115.2497055,"Jl. Sedap Malam No.164, Kesiman, Kec. Denpasar Tim., Kota Denpasar, Bali 80237, Indonesia",https://maps.google.com/?cid=7213158948913059393,OPERATIONAL,+62 361 4721434,spa,"spa, lodging, restaurant, food",4.5,89,,"First of all, we already had a reservation a day before. We set the time and deal but when we come, there is no greating from the staff, she still busy in the telephone. While two boys playing guitar. They don’t even bother we coming. After a while waiting they said THEY FORGOT OUR RESERVATION!  What a joke. We drive long hours to get relax but get NOTHING!
Highly not recommend this place!","Very Friendly staff
Good for massage",such a beautiful place to sit and have a cup of coffee,Good place,Top bgt
ChIJ3UdP6XFB0i0RZjOE4Ixxc3o,"gg.cempaka putih no.7x,I Gusti Putu Gde Raka",-8.6634411,115.24926320000002,"Jl. Sedap Malam Gg. Cemp. Putih No.7x, Kesiman, Kec. Denpasar Tim., Kota Denpasar, Bali 80237, Indonesia",https://maps.google.com/?cid=8823520944825054054,OPERATIONAL,+62 813-3863-8860,lodging,lodging,4.6,7,,Nice,,,,
ChIJT1jWcRI_0i0RrT3qo84V0gU,Suksma Coffee,-8.6593996,115.24198200000001,"Universitas Warmadewa, Sumerta Kelod, Denpasar Selatan, Kota Denpasar, Bali 80239, Indonesia",https://maps.google.com/?cid=419421692556361133,OPERATIONAL,+62 859-2281-2437,coffee_shop,"coffee_shop, cafe, food, store",4.6,123,PRICE_LEVEL_MODERATE,"This coffee shop is actually nice. Good ambiance and price, but the service is very low. I'm talking out time, when you ordered a cup of coffee during the peak hours it's really annoying that you have to wait more than 45 minutes. Kind of wasting time 😣","Suksma Coffee have a beautiful design and its getting better after they do some renovation.
But so sad the coffee is not that good(?)
Come here often, and the taste is not the same, even if i order the same Cafe Latte. The last time i need to readjust the coffee because i can't feeling it 🙂

Bintang 4 buat pelayanannya yang mau nambahin ristreto tanpa additional charge.
But the other time, i order V60 and its quite good.

Yah different hand, different taste ya.",Good drinks and food. Coffee can be better. Cozy place,Good place for meet with friends,"Comfortable and original coffee, directly coffee beans and whole process to your cup of coffee"
ChIJpcJvhBJB0i0R2WoncgzXQBo,Warung Kopi Djoglo,-8.6585542,115.2487996,"Jl. Sedap Malam No.135, Kesiman, Kec. Denpasar Tim., Kota Denpasar, Bali 80237, Indonesia",https://maps.google.com/?cid=1891748291950373593,CLOSED_TEMPORARILY,+62 813-3911-1143,cafe,"cafe, food",4.7,245,PRICE_LEVEL_INEXPENSIVE,"I like their coffee it is really good, coffee quality is better than most of famous coffee shops in Renon and it is much more affordable than others, it has very nice view to a beautiful rice Field and unforgettable sunset, this Café is a very nice place for hanging out with friends or going alone and reading or studying.
They have very friendly staff.","Free wifi. Having your meals with a view. The sunset would be perfect on sunny day. Service was nice. Tax about 11% well, hmm.","Refreshing atmosphere, great for casual dining or meeting, lots of open spaces. Delicious food with affordable price. Recommended!","Hidden place, but nice ambience and good food, price very reasonable. Good to be chill out. All outdoor, fyi","Good place, delicious food and nice staff :)"
ChIJsfTYpWZA0i0RO-TH6loOj5E,Kost Gentong 1,-8.663621899999999,115.2431393,"86PV+H72, Jl. Pakisaji, Kesiman, Kec. Denpasar Tim., Kota Denpasar, Bali 80239, Indonesia",https://maps.google.com/?cid=10488617840817988667,OPERATIONAL,,hotel,"hotel, lodging",4.3,35,,,,,,
ChIJVVbwtWRA0i0RpS5C6uevVjc,Puri Metro,-8.658520099999999,115.24375529999999,"Jl. Akasia XVI No.10, Sumerta Kelod, Kec. Denpasar Tim., Kota Denpasar, Bali 80239, Indonesia",https://maps.google.com/?cid=3987567930685664933,OPERATIONAL,+62 361 9223993,hostel,"hostel, lodging",4.4,48,,Very nice apartement. I like it.,Just okay,,,
ChIJwQGlwNZB0i0RfPmrjCqUzfk,Akasia Warehouse,-8.6616023,115.2450015,"Gg. Mekar Buaji, Sumerta Kelod, Kec. Denpasar Tim., Kota Denpasar, Bali 80238, Indonesia",https://maps.google.com/?cid=18000206196139358588,OPERATIONAL,+62 819-3945-9261,,lodging,4.2,5,,their parking area are good!,,,,
ChIJiaDuwHtA0i0Rx_zp5rXy7BY,Mai Mesaree Villa,-8.6624119,115.24977559999999,"Sedap Malam Streat, No:88, Kesiman, Denpasar, Bali Bali, Sumerta Kelod, East Denpasar, Denpasar City, Bali 80237, Indonesia",https://maps.google.com/?cid=1651962026415226055,OPERATIONAL,+62 361 8460018,hotel,"hotel, lodging",3.7,51,,"I recently stayed here which left me feeling incredibly disappointed and regretful. Despite the photos provided in the listing, the reality of the accommodation was far from what I was expecting.

Firstly, the apartment itself was not well-maintained as the photos had led me to believe.  It was clear that the space had not been properly cleaned or maintained before our arrival.

But what really upset me was the pool. The photos showed a sparkling white-blue oasis, but in reality, the pool wall was in terrible condition. It was covered in grime and dirt, and there were even cracks in the wall

To make matters worse, there was no one at the reception the property could look fancy but turned out creepy as they don't maintenance their property, and they did not address my complaints about the apartment and pool. This made me feel like they were not concerned about providing a quality experience for their guest.

Overall, I am deeply disappointed by my experience at this Airbnb.","The only thing my wife and I did not like about the place is that the bathroom, including the shower and tub, are outside. It does however, have a beautiful pool.","If u don't mind the place is a  it run down, then is a nice place, i did enjoy my stay though",Has so much potential but not enough effort was spent on maintenance,The room was quite and near from mainroad
ChIJsQHnCpNB0i0RX339S7yzbPo,Kost AnaQu,-8.6576802,115.245951,"Jl. Akasia XVI B Gg. III No.10, Sumerta Kelod, Kec. Denpasar Tim., Kota Denpasar, Bali 80237, Indonesia",https://maps.google.com/?cid=18044995428276862303,OPERATIONAL,,lodging,lodging,4.6,10,,,,,,
ChIJOUjK8jVB0i0RWwF6NPCjcFY,Tuberose Bali - Kitchen & Lounge,-8.6606855,115.24976399999998,"Jl. Sedap Malam No.500, Kesiman, Kec. Denpasar Tim., Kota Denpasar, Bali 80237, Indonesia",https://maps.google.com/?cid=6228658536721285467,OPERATIONAL,+62 361 9581009,restaurant,"restaurant, food",5,18,,,,,,
ChIJzzEuVfBB0i0R-rcLlU2IUHk,Kos Gentong 2,-8.6618301,115.24197329999998,"Jl. Pakisaji III No.18, Sumerta Kelod, Kec. Denpasar Tim., Kota Denpasar, Bali 80239, Indonesia",https://maps.google.com/?cid=8741636743520565242,OPERATIONAL,,,lodging,4.1,25,,,,,,
ChIJ2SiG4GBB0i0R9aswezzV5Dw,Ratu Bali Kafe,-8.6589539,115.2490138,"Jl. Sedap Malam No.126, Sanur Kaja, Kec. Denpasar Tim., Kota Denpasar, Bali 80237, Indonesia",https://maps.google.com/?cid=4387866392707247093,OPERATIONAL,+62 859-1069-95513,bar,bar,4.4,15,,,,,,
ChIJodxm9LFB0i0RiDrXJE34HLI,Kost Puri Arjuna 3,-8.6577162,115.24583940000001,"Jl. Akasia XVI B Gg. Ratna XIV A, Sumerta Kelod, Kec. Denpasar Tim., Kota Denpasar, Bali 80239, Indonesia",https://maps.google.com/?cid=12834406048313326216,OPERATIONAL,,private_guest_room,"private_guest_room, lodging",5,6,,,,,,
ChIJEUkJbldB0i0RR3lBsP5dQmM,KOST PURI ARJUNA 2,-8.663630999999999,115.24685160000001,"86PW+GPX, Sumerta Kelod, East Denpasar, Denpasar City, Bali 80239, Indonesia",https://maps.google.com/?cid=7152382506677926215,OPERATIONAL,,hotel,"hotel, lodging",3.7,3,,,,,,
ChIJQ5lloxJB0i0Rj5-13J_qNgY,Telur Gulung Heny,-8.6583212,115.2438801,"Jl. Akasia XVI No.11, Kesiman, Kec. Denpasar Tim., Kota Denpasar, Bali 80239, Indonesia",https://maps.google.com/?cid=447803185293533071,OPERATIONAL,+62 819-3433-6611,restaurant,"restaurant, food",3.3,43,,"Located in the first house on the left when you enter Omaxasia Housing. They only have one table so it recommended for you to order to take away, they sell some street foods like telor gulung, sempol and sausages. Tasted good but taking time to make and highly recommend to order it by any online food delivery.",,,,
ChIJ5du0Z9c_0i0RyB9VDDz4UUY,The Fam Coffee & Eatery,-8.66024,115.24964089999999,"Jl. Sedap Malam, Sumerta Kelod, Kec. Denpasar Tim., Kota Denpasar, Bali 80235, Indonesia",https://maps.google.com/?cid=5067103992557150152,OPERATIONAL,,coffee_shop,"coffee_shop, cafe, food, store",4.8,24,,The best SPA Ladys I been meet she do good job. Strong massage.. And good. Also the place for coffee good there... Farm area but modern place... I want to visit that place a gain,"Quick great coffee.... the internet, an essential for a didigtal nomad, wasn't working... seemed like no one cared.

Great space... Great Potential....

Will go back IF the internet issue is fixed.... with no data on phone, the day i needed a good WiFi - took laptop and left...

I think good needs to add a rating for Internet  & Working Space - currently this would get a 6/10 but could be a 9/10 with functioning internet/power/chargning options.","A noisy place that creates a negative atmosphere for the surroundings. Even late at night, the music is still loud and annoying at any level. They show zero empathy in running the business. Shame on you.","The food(s) and beverage(s) taste delicious! Especially the iced lychee rose tea. Surely, the price is affordable. The place is cozy for some activities (chill, study, any kind of meeting or gathering). Cannot wait for the grand opening!",Over all 9/10
ChIJqacckGRA0i0R60SQ36_Ud90,Kost Kamal,-8.6600848,115.24316719999999,"Jl. Akasia XVI A Gg. Narwastu No.9, Sumerta Kelod, Kec. Denpasar Tim., Kota Denpasar, Bali 80239, Indonesia",https://maps.google.com/?cid=15958457656445781227,OPERATIONAL,+62 813-3776-0354,extended_stay_hotel,"extended_stay_hotel, hotel, lodging",4.6,16,,,,,,
ChIJoUxR02VA0i0Rd_FLyEM30Yk,TUNJUNG PERMAI KOST PUTRI,-8.6629533,115.2455677,"Gg. Buaji Saren No.9C, Kesiman, Kec. Denpasar Tim., Kota Denpasar, Bali 80239, Indonesia",https://maps.google.com/?cid=9930779417591411063,OPERATIONAL,+62 896-6666-9485,extended_stay_hotel,"extended_stay_hotel, hotel, lodging",4.5,32,,"Nice,,,",,,,
