id,name,latitude,longitude,address,url,status,phone,primary-type,types,rating,rating-count,price-level,review 1,review 2,review 3,review 4,review 5
ChIJvd7IPEE90i0Rq3cKoRtFYXw,Luxe Villas Bali,-8.4965619,115.261169,"along the rice field walk, AT Juwuk Manis 700 meters, Jl. Kajeng, Ubud Kaja, Kecamatan Ubud, Kabupaten Gianyar, Bali 80571, Indonesia",https://maps.google.com/?cid=8962520718412249003,OPERATIONAL,+62 813-5334-3803,hotel,"hotel, steak_house, lodging, seafood_restaurant, restaurant, food",4.9,105,,Very nice place to stay in Ubud. Super friendly staff and very nice accomodations. Very close to the major shopping center/art markets in Ubud. Cool motor bike transport to and from the hotel. Amazing food. The dinner menu is expensive but we splurged and ordered it one night and the food was simply amazing. The hotel is surrounded by beautiful rice fields and you will see many locals going about their business. The staff made a beautiful flower arrangement and left it on the floor at our hotel. When we left they presented us with nice little trays as gifts. The staff also remembered us by our first names. I would definitely recommend this place.,"My partner and I stayed at Luxe Villas in July 2023 while traveling to Bali for our anniversary. We were picked up by motorbikes on arrival and driven to the hotel which was surprising but so fun! We felt extremely safe with the staff driving the motorbikes for us to and from the village whenever we requested- we used this service quite often! Upon arrival, our room was decorated with a beautiful floral arrangement for our anniversary, and it seemed they thought of every detail and accommodation- from local snacks and treats in the room, to impeccably clean amenities. The room was spacious and the upper private deck attached to our room was breathtaking. It overlooked the rice fields and we spent every night up there watching the sunset and having drinks. I wish I had pictures to include from the actual room and view, but truly we were too caught up in the beauty and moment to take many photos. We also thought the restaurant was incredible. We dined there twice- once on our first night, and once as a special anniversary dinner where the menu was customized with our names and featured 7 courses specially curated from all parts of Bali. We paired it with the cocktail tasting which was so well-thought out and wonderful- definitely left feeling tipsy though! Our leftovers were brought to our room with sincere care, and the hotel owner came to talk to us halfway through our meal and make sure everything about our stay was perfect- it was! During our stay, the staff also helped us set up activities, including the 4am hike to Mt. Batur, in-room massages (which were FANTASTIC), and local shops, hikes, and sightseeing. On the day we left, we left before breakfast (which was also incredible!) opened, and they even packed us to-go meals for our travels. I cannot say enough about how wonderful our stay at Luxe Villas was. Being from California, it was a long way from home for us, but I sincerely hope we can return again before long. If you're looking for accommodation that goes above and beyond in Ubud, stay at Luxe Villas!","Let me start off by saying you can never go wrong with the steak eggs Benedict for breakfast. My family and I came here in September of 2023 for a birthday celebration, and everything exceeded our expectations. The only surprise (which was my fault for not telling everyone) was that we had to ride scooters from the main road to the resort. We arrived at 1-2am and it was raining, so that was a unique experience. Regardless, our room was ready, our welcome drink was there, and the staff very accommodating. Everyone, including the owner of the resort, will treat you like family and make you feel at home. I plan to return to Bali in the future, and I already know where I will be staying.","This place is LUXURY.

I stayed at Luxe Villa for the first few days after landing in Bali and I was blown away with the design of the hotel (each corner of this oasis was impeccably designed and thought thru with a focus on all the details), the staff were beyond friendly (after just a few days they felt like a family and made Bali feel like home away from home) and the food. The food is beyond good, I had the best breakfast - something that I’ll miss back home in New York!

Back to the people working at Luxe Villa: they’re extremely friendly and communicative. The concierge and the owners (Paul and Grace) will lead you in the right direction and help answer any questions you have about Bali - as well as help you plan activities.

Book your stay at Luxe Villa. I’m already looking forward on when I get the chance to come back.","If I could rate the team's service 6 stars I would!  Everyone recognized me always and with a warm smile, and so responsive over WhatsApp.  Just one example of the incredible service and care: I was out in Ubud shopping at a store that only took cash or local wire payment, but did not have either.  I messaged the property to assist, and they went ahead and took care of the payment without any pause. Will absolutely return again!!"
ChIJH0GOEeM90i0RU9XTmVIp3Sk,Campuhan Ridge Walk Temple House,-8.4944439,115.256136,"G744+59H, Jl. Bangkiang Sidem, Keliki, Kec. Tegallalang, Kabupaten Gianyar, Bali 80571, Indonesia",https://maps.google.com/?cid=3016612760152954195,OPERATIONAL,,hiking_area,"hiking_area, park",5,5,,,,,,
ChIJnzB_IEE90i0RuFsuD2XM_EI,Satori Villas,-8.4979566,115.26177120000001,"Jl. Kajeng, Ubud, Kecamatan Ubud, Kabupaten Gianyar, Bali 80571, Indonesia",https://maps.google.com/?cid=4826957635052788664,OPERATIONAL,+62 361 4792099,hotel,"hotel, lodging",4.7,59,,We rented 4 of the villas for our family and friends following our wedding and I can’t recommend Satori Villas highly enough! Our guests were in love with the location right in the rice fields and everyone who works for Satori couldn’t be nicer!! The breakfast is amazing and the rooms are always so beautiful. I wish we could have stayed longer!! It’s so nice to be close enough to walk down to the Ubud center (or catch a ride on the motor bikes) but so peaceful to come back to and get out of the craziness. Definitely will be coming back!,"Fabulous villas set in the rice fields, with clean and lovely pool. Your own personal staff at your beck and call. Cooked breakfast in your room daily. The stay begins with a fun short scooter ride from the main road in Ubud just 400 metres away. Friendly , helpful and trustworthy staff. Great value. Special thanks to Ketut and the staff in our villa Banana.",amazing stay! staff was attentive and friendly. easy to rent a scooter and make your way around to plenty of restaurants and shops. great pool.,"This place was beyond beautiful. We’re a family of five and found it extremely spacious, well kept and comfortable. The staff was amazing and our stay was just amazing from start to finish. Our only regret was not being able to spend more time. The walk into Ubud was about 10 minutes, with lots of restaurants and market stalls on the way in. The place feels very safe. The pictures don’t really do it justice. Love love love this place ❤️🙏🏻","Just had the most wonderful stay at Satori Villas from the beginning it was a great adventure. The setting and the local community were just lovely we felt like part of it. The staff were so friendly and helpful, and made our holiday special, above and beyond service. Thanks to everyone at Satori who made our stay so memorable ❤️"
