id,name,latitude,longitude,address,url,status,phone,primary-type,types,rating,rating-count,price-level,review 1,review 2,review 3,review 4,review 5
ChIJ-5fgIpRj0S0RKcXr09N8Gl4,Angkringan Ori,-8.3684478,114.6410191,"Jalan Pulau Irian, Rumah pertama di kanan, Gg. IX jalan, Dauhwaru, Jembrana, Jembrana Regency, Bali 82118, Indonesia",https://maps.google.com/?cid=6780869438195090729,CLOSED_TEMPORARILY,+62 856-4697-3386,restaurant,"restaurant, food",5,21,,Best burger in town!,,,,
ChIJb7IngSnZ0y0Rkho7WwA4cu4,Dede Winon,-8.3695864,114.63911569999999,"JJJQ+5J9, Gg. XVI, Dauhwaru, Kec. Jembrana, Kabupaten Jembrana, Bali 82218, Indonesia",https://maps.google.com/?cid=17181857102553619090,OPERATIONAL,,private_guest_room,"private_guest_room, lodging",,,,,,,,
ChIJgwER66DY0y0RYLlRswCQWmY,John Wayan,-8.3680493,114.63944730000001,"JJJQ+QQP, Dauhwaru, Jembrana, Jembrana Regency, Bali 82218, Indonesia",https://maps.google.com/?cid=7375365672455485792,OPERATIONAL,,lodging,lodging,4.1,7,,,,,,
ChIJv7hBv6HY0y0ROZadXNFO_TY,Yahonk Sdc,-8.3689917,114.6414608,"JJJR+CH4, Dauhwaru, Jembrana, Jembrana Regency, Bali 82218, Indonesia",https://maps.google.com/?cid=3962409908264867385,OPERATIONAL,+62 857-3843-5977,hotel,"hotel, lodging",4.2,5,,,,,,
ChIJ5T9OLGfZ0y0RZzOvfaGK7L0,Dedix Home,-8.3702054,114.6435138,"JJHV+WC6, Jl. P. Seram, Dauhwaru, Kec. Jembrana, Kabupaten Jembrana, Bali 82218, Indonesia",https://maps.google.com/?cid=13685465793875096423,OPERATIONAL,,campground,"campground, lodging, park",5,1,,,,,,
ChIJnbsBhYHZ0y0RhMvpWeGvLWY,rumah dewa ganteng,-8.3724218,114.6394577,"Jl. P. Irian, Dauhwaru, Kec. Jembrana, Kabupaten Jembrana, Bali 82218, Indonesia",https://maps.google.com/?cid=7362734348231625604,OPERATIONAL,,private_guest_room,"private_guest_room, lodging",,,,,,,,
ChIJHVNslCfZ0y0ROVyl3L9VKc4,Dewa manu,-8.3721117,114.6422911,"Jl. P. Seram, Lingkungan menege, Dauhwaru, Kec. Jembrana, Kabupaten Jembrana, Bali 82251, Indonesia",https://maps.google.com/?cid=14855499128387230777,OPERATIONAL,,,lodging,5,1,,,,,,
ChIJcVQn2CHZ0y0Rf1GrAUbh7KY,Dapur buk umi,-8.37006,114.64030600000001,"Jl. P. Irian No.99, Dauhwaru, Kec. Jembrana, Kabupaten Jembrana, Bali 82218, Indonesia",https://maps.google.com/?cid=12028236395591717247,OPERATIONAL,+62 819-9973-1157,indonesian_restaurant,"indonesian_restaurant, restaurant, food",,,,,,,,
ChIJz76kH-bZ0y0R7TdYw1XKLw0,MbakBroo Pemedilan,-8.367818399999999,114.6448605,"JJJV+VWH, Sangkaragung, Jembrana, Jembrana Regency, Bali 82218, Indonesia",https://maps.google.com/?cid=950200516096833517,CLOSED_TEMPORARILY,,indonesian_restaurant,"indonesian_restaurant, restaurant, food",,,,,,,,
ChIJKxi-mgvZ0y0RoN9o0hkz2Hg,Tersedia/Warung Gloria,-8.3726497,114.6393659,"Jl. Pulau Irian,No.104,Menega, Dauhwaru, Kec. Negara, Kabupaten Jembrana, Bali 82218, Indonesia",https://maps.google.com/?cid=8707766065518141344,OPERATIONAL,+62 823-3953-2905,restaurant,"restaurant, food",,,,,,,,
ChIJURHm3VjZ0y0Ry7MQ0geHnag,Warung Mamy,-8.3685939,114.63961499999999,"JJJQ+HR9, Jl. P. Irian Gg. XIV, Dauhwaru, Kec. Jembrana, Kabupaten Jembrana, Bali 82218, Indonesia",https://maps.google.com/?cid=12150015837374297035,OPERATIONAL,,restaurant,"restaurant, food",1,1,,,,,,
ChIJUSLcl5bZ0y0R2g3_n2KFXWM,HOUSE OF SuperMARIGOLD,-8.3689698,114.64041909999999,"Jl. P. Irian, Menega, Kec. Jembrana, Kabupaten Jembrana, Bali 82217, Indonesia",https://maps.google.com/?cid=7160025641226538458,OPERATIONAL,+62 813-2717-4936,park,park,,,,,,,,
ChIJFXAJAwDZ0y0RpEgFXYM7Pa4,Pondok cinta pemedilan jembrana,-8.368123299999999,114.64407709999998,"Jl. Pulau Buru No.25, Dauhwaru, Kec. Jembrana, Kabupaten Jembrana, Bali 82218, Indonesia",https://maps.google.com/?cid=12555256771566192804,OPERATIONAL,,motel,"motel, lodging",,,,,,,,
ChIJIbJBWDTZ0y0Rn6maJu_EORo,Rumah TuAgus,-8.368564800000001,114.6458085,"JJJW+H8F, Sangkaragung, Jembrana, Jembrana Regency, Bali 82218, Indonesia",https://maps.google.com/?cid=1889758050082531743,OPERATIONAL,,private_guest_room,"private_guest_room, lodging",,,,,,,,
