id,name,latitude,longitude,address,url,status,phone,primary-type,types,rating,rating-count,price-level,review 1,review 2,review 3,review 4,review 5
ChIJW_2bAH3X0y0ROdwfdQnEtDE,Warung mbok wah,-8.4083161,114.7991562,"HQRX+MMC, Jl. Raya Denpasar - Gilimanuk, Yeh Sumbul, Kec. Mendoyo, Kabupaten Jembrana, Bali 82661, Indonesia",https://maps.google.com/?cid=3581703148565158969,OPERATIONAL,+62 877-6223-9811,indonesian_restaurant,"indonesian_restaurant, restaurant, food",4.6,8,,,,,,
ChIJ98Hz75rX0y0RZliY7RfUBZM,Ajik eka,-8.405607700000001,114.8000043,"HRW2+662, Yeh Sumbul, Mendoyo, Jembrana Regency, Bali 82261, Indonesia",https://maps.google.com/?cid=10594106897694480486,OPERATIONAL,,private_guest_room,"private_guest_room, lodging",5,2,,,,,,
ChIJV3ZPEtzX0y0RrtRNYzDlUL8,Hightide Surfhouse Bali,-8.4113628,114.79937500000001,"Jl. Raya Denpasar - Gilimanuk, Yeh Sumbul, Kec. Mendoyo, Kabupaten Jembrana, Bali, Indonesia",https://maps.google.com/?cid=13785770455368324270,OPERATIONAL,+62 877-8601-6667,lodging,lodging,4.9,10,,"Staying here since 3 months and looking forward to many more. The highlight of this house is definitely the view. Very clean and tidy property, drinking water dispenser, kitchen with basic utensils, everything you need is there and if you ever need something the host (Eddie) will organise it.
Best place to stay in the region for sure.",Waaw ! We spend one beautiful week in the friendly Eddie's place. You will wake up with a view of the see and the ricefield. The bathroom and the kitchen are tropical and magic. We had a very nice time with Edy and Teresa. It's possible to surf just front of the hotel and Eddie can learn you how to surf ! Thank you for your warm vibe ! I'll come back for sure. :),Really enjoyed my stay. Very beautiful views and good service,"Hello travellers!! Got good news for you, this is the spot!  Eddie, owner, is super friendly and the hostel is comfortable and clean. Location is outstanding! Beachfront!!
Totally recommend.","Awesome and quiet place to stay. Eddie and Theresa were outstanding and friendly hosts, I would totally recommend to stop by at this insider tip."
ChIJ7blh6XLX0y0R2dOS3V1iADw,UMAH TEBU,-8.4082147,114.79864629999999,"Masjid Baitul Amilin, Depan, Yeh Sumbul, Kec. Mendoyo, Kabupaten Jembrana, Bali 82262, Indonesia",https://maps.google.com/?cid=4323563797564543961,OPERATIONAL,+62 819-3646-4626,restaurant,"restaurant, food",4.5,11,,Nice place! Super affordable and the service and food was great. They made the noodles vegan friendly for me on request:) love the sugarcane juice too,It was my favourite place here to visit  every week whenever we went to west Bali to buy my favourite drink which is sugarcane juice.,,,
ChIJn08HB4PX0y0Rni31p6-pXL4,Mie Ayam Solo,-8.4116273,114.8030705,"rt 05, Yeh Sumbul, Kec. Mendoyo, Kabupaten Jembrana, Bali, Indonesia",https://maps.google.com/?cid=13717025136965922206,OPERATIONAL,+62 831-1553-4144,restaurant,"restaurant, food",5,1,,,,,,
ChIJb0Qln5nX0y0RgApFtqT41TA,Medewi Beachhouse,-8.411273099999999,114.79874819999999,"Jl. Pantai Medewi, Yeh Sumbul, Negara, Kabupaten Jembrana, Bali 82262, Indonesia",https://maps.google.com/?cid=3518992070176213632,OPERATIONAL,+62 878-6231-7208,private_guest_room,"private_guest_room, lodging",5,5,,"Ssssssstttt - don’t tell anyone about this place!!!

If you love visiting ‘the road less traveled’ go to Medewi & stay at the most authentic surf villa of Medewi!  Just don’t look any further! What to expect; simple but very cute & colorful rooms with attached bathrooms & cold showers. Mosquito nets provided. Basic kitchen, fridge & free drinking water. Hammock and 2 stretchers are there to chill. Masseuse can be booked for a lovely massage in your room. Basically all you need. The owner Dika is the best! Host, surf teacher and guide for the region.",Amazing place! You are right on the beach with the best view. Owners are great are very helpful. Don’t forget to check the Holy tree restaurant as is the best in town.,Great place to chill,,
