id,name,latitude,longitude,address,url,status,phone,primary-type,types,rating,rating-count,price-level,review 1,review 2,review 3,review 4,review 5
ChIJQU9Tww890i0Rzni-W0o0yVg,Pondok Bali Homestay,-8.502954899999999,115.2784518,"Petulu, Ubud, Gianyar Regency, Bali 80552, Indonesia",https://maps.google.com/?cid=6397702239627933902,OPERATIONAL,+62 812-3657-5429,private_guest_room,"private_guest_room, lodging",3.7,18,,"A great family home just outside Ubud with clean, spacious rooms. Family that own it and live there are very welcoming, making it a home from home. It's only a short scooter trip (12k on grab/gojek) to town, but set it much more peaceful surrounds with the jungle just out back. Also, there are at least 10 good dining options within a 5-10 minute walk, including cheap local to upper market places, in the other direction, surrounded by rice paddies so you don't always have to travel into Ubud to have a nice meal out.   They also run great cooking classes from within the home (it's a little complex of houses and temples rather than one house)  and have a shop at the entrance for basic provisions like water, beer etc. Highly recommend for those that want easy access to Ubud without being surrounded by the traffic and hustle and bustle all the time.","The Family is super friendly and helpful.the area is very quite and close to city center( only 7 min by bike or 1$ on taxi) u can find near house some shops , laundry services and warung. There is hot and cold shower, WiFi . in case if u need anything u can always ask Mr Komang and his wife they are ready to help anytime . I wanna thank them for my lovely stay 🙏🏼","This used to be a nice place to stay - but as for now, the pictures are irrelevant. The room is in very bad condition with mold inside all walls.

Luring guests with outdated photos taken much time ago seems unfair regarding the price you pay 110k Rp / night. There are much better places, well maintained and fresh with the same price offer around.

It's a pity I have to write the review this way but you guys should all know what you are paying for and this, in fact, is not what you have been promised in the pictures on booking services, neither on Google.

The owners are very friendly and nice so for that I give one more star that this place actually deserves. A heavy refreshment of the room is needed to make it rentable again.

Anyway, thank you owners for your smiles and kindness during my stay.",De family is really warm en will do anything to help you. The host helped us with our next trip and arranged a pick up + boat trip to our next stay on gili air. It's a real balinese house and the host gave us a tour. Very beautiful and you live amongst the locals! You can hire a scooter here  and in 5 - 10 minutes you are in the centre of ubud. The sanitary is a bit outdated but fine and clean for the price you pay. The room was clean and they kept it clean. Overall a very good experience!,"Place is running down and dirty, full of mold, noisy place , location is also not great. Wi-fi with 4mbps only, bathroom stinks a lot.

I booked 8 nights and only stayed one. You can easily find good places for more 2$/night that nothing compares to this place.
It need a renovation ASAP"
ChIJu98DDl890i0R6cbD5yUEOqQ,Villa Mantra Ubud,-8.5008403,115.28183609999998,"Banjar Sala, Pejeng Kawan, Tampak Siring Gianyar, F7XJ+MP8, Pejeng Kawan, Kecamatan Ubud, Kabupaten Gianyar, Bali 80571, Indonesia",https://maps.google.com/?cid=11833775531718067945,OPERATIONAL,,bed_and_breakfast,"bed_and_breakfast, lodging",4.3,27,,"Remote place, if you need to escape the daily chores I believe this is the right place. Be warned that the road is still dirt road and narrow about a kilometer before arriving the destination. Stock with enough food and snacks.. 😊",Very Good place for family or group vacation...  The pool are nice and the gazebo are comfy...,Everything is great there.,,
ChIJ75ogCmA90i0RW6PBVEJoIv4,Villa Wira 2,-8.5041949,115.28241109999999,"F7WJ+8XF, Unnamed Road, Pejeng Kawan, Kec. Tampaksiring, Kabupaten Gianyar, Bali 80552, Indonesia",https://maps.google.com/?cid=18312313668940964699,OPERATIONAL,,hotel,"hotel, lodging",4.8,16,,Amazing owner. A great soul. Wonderful house with a pool and all amenities.,Best of the best. Really nice place.,,,
ChIJN42GymE90i0R-fUqGNwT5ZE,MAHASA Resort,-8.5067962,115.28512649999999,"No 8. Br Tatiapi Kaja Desa Pejeng Kawan Ubud Area, Pejeng Kawan, Kec. Tampaksiring, Kabupaten Gianyar, Bali 80522, Indonesia",https://maps.google.com/?cid=10512830741185492473,OPERATIONAL,+62 361 9083223,,"bed_and_breakfast, lodging",4.5,37,,"In this place you feel like home in a second! Nor only the people but also the interior feels so warm and welcoming. We loved the place and felt sorry everytime we went out. Perfect place for some morning yoga, reading a book in ine of the chill corners, and take a swim with a beautiful vieuw over de rice paddies. Definately wanna come back one day. Thankyou so much Della and team, you were a great host!","Love this place. It's my fourth time being here. Great rooms, great views, very relaxing atmosphere. Come here to get away from the hustle bustle of the city.",Located over the hill at a traditional Balinese village... serene with spectacular view... surrounded by lush rice field...,"Great place, friendly people, quiet and relaxing.  Great getaway from the city's buzz.",10/10 the most beautyfull place we found in Bali!
ChIJLVA95l890i0RK0QYhMJySBo,Ananditha Villa,-8.5039375,115.2823125,"Pejeng Kawan, Tampaksiring, Gianyar Regency, Bali 80552, Indonesia",https://maps.google.com/?cid=1893889823074698283,OPERATIONAL,+62 812-4665-6360,hotel,"hotel, lodging",4.8,8,,It's a comfy place to stay for the holiday. Not far from the main road and have great view. But there's only 3 rooms and i came with more than 6 people's so it get really stuffy in there. All the things are ready to use except the coffee machine because the previous one didn't throw the coffee out and some mold are growing like crazy in that machine. Overall good experience living there for 3 days.,"Really nice place.
Thanks for great weekend.",💚💚,BEAUTIFUL !!!,
ChIJG2VgjOEX0i0RMzuD8zQBMow,Winter Villa Ubud,-8.5019856,115.2853118,"Ubud, F7XP+643, Pejeng Kawan, Kec. Tampaksiring, Kabupaten Gianyar, Bali 80552, Indonesia",https://maps.google.com/?cid=10102138241080834867,OPERATIONAL,+62 815-5893-6662,hotel,"hotel, lodging",4.6,16,,"Met Dewa putra the owner, A nice man. The villa has 3 bedrooms and a swimming pool",Very good healing place.,"Good place,  good view 😍😍",Nice Villa,
ChIJyYtTyN8X0i0RcDbbqXsRb8U,Ona House,-8.504819,115.28614999999999,"F7WP+3FC Sala, Banjar Laplapan, Pejeng Kawan, Kec. Tampaksiring, Kabupaten Gianyar, Bali 80582, Indonesia",https://maps.google.com/?cid=14226608970715051632,OPERATIONAL,+62 813-3854-2408,hotel,"hotel, lodging",4.5,6,,"Nice,near from Ubud center and rice around house 🙏",very good,,,
ChIJ8y26AzQ90i0R0SDxW6j1L6Q,Riski Guest House Pejeng,-8.5021643,115.2821287,"Kawan, F7XJ+4VJ, banjar sala, Pejeng, Kec. Tampaksiring, Kabupaten Gianyar, Bali 80552, Indonesia",https://maps.google.com/?cid=11830944849571422417,OPERATIONAL,+62 821-4407-8325,hotel,"hotel, lodging",4.6,8,,Very comfortable and good service,,,,
