id,name,latitude,longitude,address,url,status,phone,primary-type,types,rating,rating-count,price-level,review 1,review 2,review 3,review 4,review 5
ChIJl4OJvCY90i0RMdtQzecbivU,"Seoul Coffee n Grill, Sangeh",-8.4955262,115.20985440000001,"Jl. Raya Sangeh, Sangeh, Kec. Abiansemal, Kabupaten Badung, Bali 80352, Indonesia",https://maps.google.com/?cid=17692984768474438449,OPERATIONAL,+62 815-2984-2325,restaurant,"restaurant, food",4.4,152,,Delicious food for a small price. Nice place next to the rice fields,"Friendly place. Coffee was okayish, definitely needs some better dialling in on the grinder. Mango juice a bit too much ice, not enough mango. Little plastic stirrer in the juice was dirty and needs better cleaning. Morning Glory Vegetables was good as was the fruit platter. View is fantastic, so for a quick stop I'd highly recommend it if you keep in mind shortcomings on the coffee and so on. Place seems new so I'm sure it'll get sorted out.","I am writing this review based on my experience on March 25th, 2023, hoping that it is still relevant today.

After swimming at Tirta Arum Swimming Pool, drinking and buying tuak at Tuak Bejidong, I continued to Seoul Sangeh for a meal. I saw that the reviews were quite good, so I ordered a burger here. However, perhaps the burger is not the recommended dish here, as I found it to be quite ordinary compared to others at the same price.

What can be enjoyed at this restaurant, which I think is more like a cafe, is the beautiful view (rice fields) and the spacious area, which could be suitable for events. It also appears to have relatively good lighting at night (assuming the lights are placed there).

Overall, I will come back here to try other dishes, especially the pizza.",Found this gem on the way to Sangeh. Lovely. It's in the middle of rice paddy. Has beautiful view. I can spend hours eating and drinking coffee. Very peaceful at daytime. I can see farmers working. The price is also cheap. Great place to chat with friends or family.,"Was not too bad tho, my second time there. But compare with the 1st time when they're opening I think much more happening and more food options as I remember. Too bad, now they downgraded they're menu. Anyway still the best place for eat and chill if you passed into these area."
ChIJV3MwakYj0i0RTGz_wuBy6Co,Warung Sawah Sawah,-8.494535299999999,115.2098996,"Jl. Raya Sangeh, Sangeh, Kec. Abiansemal, Kabupaten Badung, Bali 80352, Indonesia",https://maps.google.com/?cid=3091847453859605580,OPERATIONAL,+62 878-6236-4720,seafood_restaurant,"seafood_restaurant, restaurant, food",4.2,400,PRICE_LEVEL_MODERATE,"Good quality local food for a very reasonable price. Very authentic fish restaurant in Sangeh area next to a huge rice field.

The fish was crispy and tasty, came with steamed veggie, rice and ice tea for 55k.

I will be back trying out other dishes!","Like this restaurant, unique and cozy.. About taste standard.. But everything ok.. Good rice fields view... Mini playground that's make all complete. Good place to bring our kids..","This is best resto everything is there so great delicious food ,coffee very strong value money pizza soooo delicious i love order here ,really recommended for everyone ,they have also booze ,wine ,beer ,spirite i bought many from.lakmsi Breakfast pizza and bar i can order anytime they open 24 hours  i love it",Nicely located beside a rice field and the first food was nice. So try it.,"Really one of the best places I've eaten in Bali so far, this place deserves more recognition then it gets. This restaurant has got it all. Amazing view over the rice paddies, relaxing atmosphere, unbelievable food and competitive pricing. We ordered the Chicken Sweet and Sour and Chicken w. Balinese sause. 10/10 would recommend."
ChIJ2f_nF0Q90i0RuwaP9KhW680,Ikum sidehouse,-8.496224,115.21465839999999,"Br.mekarsari, Selat, Kec. Abiansemal, Kabupaten Badung, Bali 80115, Indonesia",https://maps.google.com/?cid=14838048680959739579,OPERATIONAL,+62 878-4225-5080,,lodging,5,5,,"I stayed here for a week to work remotely and fully focus. The place is perfectly hoped me to execute my tasks.

Big white board, powerfull AC 👍🙏",Very nice place. Super cinventint working space. Fair price,,,
ChIJk8EHmHo90i0RC1XCUTbda30,Bakso Super Premium - Abangan,-8.4972826,115.20976530000002,"G635+3WJ, Jalan Raya Blahkiuh, Sangeh, Kec. Abiansemal, Kabupaten Badung, Bali 80352, Indonesia",https://maps.google.com/?cid=9037560302618694923,OPERATIONAL,+62 812-3755-0000,indonesian_restaurant,"indonesian_restaurant, restaurant, food",4.5,11,,,,,,
ChIJpxv0JLg90i0RLvK5Xqj0vn8,Rumah Wah Oka,-8.4937451,115.21513609999998,"G648+G32, Jl. Pacung Selat, Selat, Kec. Abiansemal, Kabupaten Badung, Bali 80352, Indonesia",https://maps.google.com/?cid=9205063692372800046,OPERATIONAL,,private_guest_room,"private_guest_room, lodging",5,1,,,,,,
ChIJxUnTobc80i0RZij1PByFnW4,Warung Muslim Jawa Bwi,-8.497579499999999,115.2098524,"Blahkiuh, Abiansemal, Badung Regency, Bali, Indonesia",https://maps.google.com/?cid=7970673271843924070,OPERATIONAL,,restaurant,"restaurant, food",4,1,,,,,,
