id,name,latitude,longitude,address,url,status,phone,primary-type,types,rating,rating-count,price-level,review 1,review 2,review 3,review 4,review 5
ChIJj2OG3RsR0i0RqCF47JL2Xf4,Warung Nasi Babi Guling Pan Edy,-8.483113,115.37880129999998,"Jl. Raya Timuhun, Timuhun, Kec. Banjarangkan, Kabupaten Klungkung, Bali 80752, Indonesia",https://maps.google.com/?cid=18329077169360740776,OPERATIONAL,+62 819-1806-9082,indonesian_restaurant,"indonesian_restaurant, restaurant, food",4.6,147,,"A place with a view (rice fields and Mt Agung) and really delicious food. Today's skin is crisp and crunchy and this elevates the Babi guling entirely. Soup is not salty and appetizing. Portion is good and generous. Really worth it if you are nearby. Came on a Thursday 12pm, I was able to get a seat immediately.
Price: Rp30k","Delicious authentic Babi Guling at local prices with a stunning view. This Warung was recommended by Dira from Aan Secret Waterfall (also highly recommended for an incredible walk and nature experience). The restaurant is spacious, clean and well set up, the staff are very friendly with excellent English. There is a beautiful view over local farmland / rice fields with Mt Agung spectacular in the distance. It's about a 45min drive from Ubud. We ordered their standard Babi Guling meal that comes with a spicy soup, rice and plate of Babi Guling and Balinese vegetable dishes, served like Nasi Campur with small portions of the various dishes on the one plate (rice and soup served separately). We had iced tea and a refreshing Bibtang each. For the 2 of us the total cost was RP 60K (25K per meal plus drinks). Such great value for an excellent meal. Only catch is its quite spicy so if you love your chilli 🌶 you'll love this. I don't tolerate super spicy food and this was on my threshold but totally worth it! Would come again in a heartbeat.","Good Balinese babi guling joint in Gianyar. They are very famous so you most likely will be on a waiting list for walk ins.

The restaurant is open space so you can enjoy good sunny weather, staffs are helpful and parking lot is decent.",Just stopped after hitting up Aan waterfall & the locals were rad & friendly. They have some snacks & cold ones 🍻,Heard we are the first tourism to patronise them. Patronised by locals and we like the food so much.
ChIJczbYEd4Z0i0RzJqDFMQMV_A,Puri Bungbungan Klungkung,-8.476231499999999,115.37609230000001,"Jl. Raya Bungbungan No.12, Bungbungan, Kec. Banjarangkan, Kabupaten Klungkung, Bali 80752, Indonesia",https://maps.google.com/?cid=17318324928373824204,OPERATIONAL,,,lodging,5,2,,,,,,
ChIJUdgM1SER0i0RBDf3HIvit2U,Warung rujak,-8.4797309,115.381711,"Unnamed Road, G9CJ+4M4, Timuhun, Kec. Banjarangkan, Kabupaten Klungkung, Bali 80752, Indonesia",https://maps.google.com/?cid=7329576005683066628,OPERATIONAL,,coffee_shop,"coffee_shop, cafe, store, food",5,2,,,,,,
ChIJWYuDf-AR0i0REb7TKetJuDE,"edi guling,timuhunn",-8.4832217,115.3787817,"Unnamed Road, G98H+PG7, Timuhun, Kec. Banjarangkan, Kabupaten Klungkung, Bali 80752, Indonesia",https://maps.google.com/?cid=3582694777941114385,OPERATIONAL,+62 877-6161-5848,cafe,"cafe, food",5,2,,,,,,
ChIJ2YcuiVUX0i0Rrcnvhj_wayc,Lianita,-8.4777048,115.3746495,"Jl. Raya Bungbungan, Bungbungan, Kec. Banjarangkan, Kabupaten Klungkung, Bali 80752, Indonesia",https://maps.google.com/?cid=2840628145624697261,OPERATIONAL,+62 813-3860-0752,bar,bar,5,2,,,,,,
ChIJm7me4fIR0i0RaocB5lZkhTw,Warung Bu Kadek,-8.4772719,115.3786222,"Bungbungan, Banjarangkan, Klungkung Regency, Bali 80752, Indonesia",https://maps.google.com/?cid=4361002138567018346,OPERATIONAL,,indonesian_restaurant,"indonesian_restaurant, restaurant, food",5,1,,,,,,
ChIJnRKa7FUX0i0Rj-gHDARl1zk,Warung Cahayo,-8.478379,115.37403099999999,"G9CF+JJR, Jl. Raya Bungbungan, Bungbungan, Kec. Banjarangkan, Kabupaten Klungkung, Bali 80752, Indonesia",https://maps.google.com/?cid=4167911048210802831,OPERATIONAL,,restaurant,"restaurant, food",,,,,,,,
ChIJmfpgEx8R0i0RMXkU4AaNtTk,GESRA HOME,-8.4826052,115.3800283,"Jl. Raya Timuhun, Timuhun, Kec. Banjarangkan, Kabupaten Klungkung, Bali 80752, Indonesia",https://maps.google.com/?cid=4158384891615279409,OPERATIONAL,,,lodging,5,3,,,,,,
ChIJzW_IFtUX0i0R4BvU8KwYzBA,Rumah Ajus,-8.47763,115.3747447,"G9CF+WVX, Jl. Raya Bungbungan, Bungbungan, Kec. Banjarangkan, Kabupaten Klungkung, Bali 80752, Indonesia",https://maps.google.com/?cid=1210369530909694944,OPERATIONAL,,private_guest_room,"private_guest_room, lodging",4.5,2,,,,,,
ChIJK-OULyIR0i0R6plk0vS0rhQ,Depot yan botak,-8.479429999999999,115.38189510000001,"Timuhun, Banjarangkan, Klungkung Regency, Bali 80752, Indonesia",https://maps.google.com/?cid=1490327490301041130,OPERATIONAL,+62 831-1481-5553,indonesian_restaurant,"indonesian_restaurant, restaurant, food",5,2,,,,,,
ChIJ34XFVpAX0i0RzAO5e6Zah6c,HOME DEGUS,-8.4775469,115.37455220000001,"G9CF+XRM, Jl. Raya Bungbungan, Bungbungan, Kec. Banjarangkan, Kabupaten Klungkung, Bali 80752, Indonesia",https://maps.google.com/?cid=12071716997276697548,OPERATIONAL,,private_guest_room,"private_guest_room, lodging",,,,,,,,
