id,name,latitude,longitude,address,url,status,phone,primary-type,types,rating,rating-count,price-level,review 1,review 2,review 3,review 4,review 5
ChIJiY-FJzZB0i0R3wgxHFf8GnU,OYO 3902 Pondok 828 Residence,-8.6993118,115.19869650000001,"Jl. Dangin Uma, Pemogan, Denpasar Selatan, Kota Denpasar, Bali 80361, Indonesia",https://maps.google.com/?cid=8438334302897375455,OPERATIONAL,+62 21 29707601,hotel,"hotel, lodging",4.2,342,,"cheap.yes !!!! but not means

ac no freon
toilet dirty
no extra bed sheets
no emergency action when something happen
bathtub moled
far away from standard

300 000/day is too expensive comparing than the facilities.....nothing help for your enjoyable staying.you are just by yourself...no guest services at all.

but i will give five stars for friendliness and courtesy of the staffs..i dont blame them...they are just workers without management.and be aware of electrical payment at the end....600 000 in 5 days.meter running even you are not using electric.disasterrrrrr....shocking....find hotel I do suggest.dissapoint big time.really hard to spend money for the place like this.....mafia","Recomended guest house for backpacker/family.
It located in Denpasar, also in Islamic society (Kp. Kepaon). Many food store in this area. Near fr9m Kuta beach, Mall, and other places.
It has 2 floor & 3 floor building.
For 3rd floor, each rooms have hot water bathroom.
The other rooms have same facility, AC, TV, big cupboard, dressing table, kitchen area (not include stove), bathroom with shower.
The water is bad, smell like have some iron.
The bathroom little bit dirty, sometime have cockroaches in kithcen.
The price IDR150K/night, you can get lower price from online booking.
It also can rent monthly for IDR1.5million/month (not include electricity).
Small parking for car, but enough for motorcycle.
(You may need rent motorcycle to explore Bali).",Reasonable price for homestay. Each room have kitchen! I love it. Nice parking lot and friendly staff,"Good and cheap guest house, and of course friendly staff","Not comfortable. But, what do you expect from the price they offered?"
ChIJhe1B7j5B0i0R8F4f1V_mh6c,Lembayung Sari Homestay,-8.6995837,115.1922276,"Gg. Tiger No.88, Pemogan, Denpasar Selatan, Kota Denpasar, Bali 80221, Indonesia",https://maps.google.com/?cid=12071870625461788400,OPERATIONAL,+62 819-3644-5086,private_guest_room,"private_guest_room, lodging",4.7,56,,"Encouraged by the reviews on Booking, we decided to choose this hotel. Unfortunately, the reality exceeded our expectations in the worst possible way. Everything in the photos published by the hotel is real, but definitely dirtier. Torn and dirty towels, torn bed sheets, mold walls, walking geckos and cockroaches made our stay in this place unpleasant. The lovely bathroom outside is very neglected, with scale and moss everywhere, which, compared to other facilities in Bali, is possible to keep clean. Based on previous comments about the possibility of renting a scooter on site, we ordered it from the hotel staff - we were very disappointed. The scooter arrived with an absolutely empty tank, with damaged helmets without fasteners and they tried to convince us with a smile that such rental rules apply on the island (we used another rental company and nothing like that happened). After contacting the hotel in advance, we obtained information about possibility to transfer from the airport. After arranging all the details, contact with the hotel was lost and after landing we had to quickly look for another transport at the airport. Any comments reported to the hotel's staff remained unanswered only with an apology.
This place is dramatically neglected and the stay there was an unpleasant disappointment.",Nice place to stay while you're in Bali with reasonable price...clean...with swimming pool inside...,"I have scored my rating on my experience here at Lembayung based on price and location.
Middle of Bali. Close to everything. TV, cooker for home cooking and Air con good 👍 Loved it.
One last thing, the hotel has a shop with essentials and great prices too.",Perfect for the price and VERY kind staff!! Recommended. Moto taxi to center costs 50 cent or so,"nice place,
hidden place,
great,"
ChIJKVwGR35B0i0RiVF8aS1fgEY,GOGO PEMOGAN Fried Chicken & Coffee Shop,-8.6956639,115.1972242,"Jl. Raya Pemogan No.107, Pemogan, Denpasar Selatan, Kota Denpasar, Bali 80113, Indonesia",https://maps.google.com/?cid=5080165028321841545,OPERATIONAL,,restaurant,"fast_food_restaurant, restaurant, food",3.4,165,,"I had one package of Ayam Geprek and Ayam Keju,, it was delicious and I can refill the rice and iced tea,, definitely worthed the rupiah","This is a strange thing for F&B business entrepreneurs where there are employees (cashiers) who are impudent and don't have the courtesy to speak like an employer. She didn't show a warm face when we come and Slamming plates in front of 2 people in front of us who were customers. I think they weren't make a mistake but we pissed to have fact that she also do the same to us!

Definitely don't want to come back!","The place is very cozy and their foods are all amazing. I love the fire sauce chicken and Ayam Geprek, I also love how they gave us a free refill for the tea.
Great price, great food. Keep up the good work! 🫶🏼","good food, price is affordable","On my first visit I felt a little bit skeptical about the place. But, it turns out this store has a really great chicken geprek. You can refill the drink as much as you want and the tea tastes good. Also you can take white rice as much as you want! For the chicken geprek with drink is around 25K."
ChIJrXP-_IBB0i0RV7wZCvyYI_8,RAMEN STAR ONE,-8.7026447,115.19737959999999,"Jl. Raya Pemogan No.146a, Pemogan, Denpasar Selatan, Kota Denpasar, Bali 80221, Indonesia",https://maps.google.com/?cid=18384706312125135959,OPERATIONAL,+62 816-4725-252,restaurant,"restaurant, food",4.4,79,,"A hidden gem in Denpasar, been here few times and still coming back for their ramen!! Its so good, so authentic and yummy, especially the Kare Ramen and the Oishi Ramen. The spring roll is also so tasty and fresh. The place is kinda small, but cozy.","From the moment we entered, we were greeted by enthusiastic staff members. We then chose our menu, and our choice eventually fell on the Spicy Chicken Ramen because we love spicy food, hehe. You don't need to add anything because the spiciness and broth are just perfect for spicy food lovers. The price is very affordable, especially for students who may want to enjoy ramen with limited funds. The place is located next to the main road, but inside, it is soundproof. The service is also excellent, and I really like this place. Definitely will come back!","The broth is delicious, I'm not a fan of the noodle type but still ok, their topping is also very generous, usually ramen places will give only half eggs, but they give a whole egg + minced chicken and roast chicken is tasty. Overall recommended to come again","The food is decent for this price. If you find this one is less than perfect, it will continue to be busy because the toppings and portions are already pretty, according to the taste description. It's simple, almost like the Japanese series Indomie. But overall it's worth a try for beginners who want to try ramen, you can start trying it from this place, the price is cheap","I love this ramen, it's delicious, savory, the noodles are medium rare and not mushy, the place is not too big, the staff is friendly, the price is very affordable. I ordered the spicy ramen and the spiciness felt good.

Recommended.. 💯"
ChIJH8ILUS5B0i0RGaY6UO8kUIg,BPK ( Babi Panggang Karo ),-8.6998234,115.19732660000001,"Jl. Raya Pemogan No.108, Pemogan, Denpasar Selatan, Kota Denpasar, Bali 80221, Indonesia",https://maps.google.com/?cid=9822391397556856345,OPERATIONAL,+62 878-6138-8966,indonesian_restaurant,"indonesian_restaurant, restaurant, food",4.5,365,,"Beautiful taste.
Friendly owner
Reasonable price.
Authenthic north sumatran style.
Beautiful!","Delicious Pork barbeque.
Very friendly owner, even they offered us king of fruit (durian) free of charge of course.
Take away 2 pax.
Someday will visit this friendly place again.",This place has delicious karo grill pork with a good kick from the sambal mix with andaliman pepper. Like the soup and not forget to try their teri medan balado. Will be great if they serve the food when is absolutely hot.,"Great food, note, sasak mixed with pig blood.",Recommended to have batak karo grilled pork with their traditional sauce
ChIJiXNeWC5B0i0RCb0s9Ua4qG0,Kost Kubu Sawah,-8.699478899999999,115.1969968,"Gg. Sawah No.2, Pemogan, Denpasar Selatan, Kota Denpasar, Bali 80221, Indonesia",https://maps.google.com/?cid=7901768161122106633,OPERATIONAL,+62 812-3965-7888,extended_stay_hotel,"extended_stay_hotel, hotel, lodging",4.2,98,,One of the best haircuts ever! By Ms Sirna,Did a short visit at one of the apartments. Good  for 2 person short term stay wo frills. Kitchen  n toilet available. No real living room space. Its together with sleeping area. Internet access needs improved alot more,AST,Comfortable place to stay with various meal options nearby,cheap for staying a few days. clean room l.
ChIJpaKSWORB0i0Rf9kxYDe_3sk,Dewi Uma House,-8.7003682,115.1991089,"Gg. Dewi Uma No.18, Pemogan, Denpasar Selatan, Kota Denpasar, Bali 80221, Indonesia",https://maps.google.com/?cid=14546274091011266943,OPERATIONAL,+62 819-9967-0404,hotel,"hotel, lodging",4.4,115,,Clean & comfortable. Staff friendly but resepsionis not 24 hour. Very recommended next time if i visit bali and i will stay in here,Elegant and very comfortable place to stay,Good room,good room and good hotel,good room
ChIJXaFKxHxB0i0Rn2rRNkH-c-E,Renon,-8.6991068,115.1982446,"852X+975, Jl. Dangin Uma, Pemogan, Denpasar Selatan, Kota Denpasar, Bali 80221, Indonesia",https://maps.google.com/?cid=16245607836901534367,OPERATIONAL,,hotel,"hotel, lodging",4.8,6,,,,,,
ChIJtRkZQyxB0i0RtOD-RHGjgo0,Vargas Boarding House,-8.698604099999999,115.1928242,"852V+H44, Pemogan, Denpasar Selatan, Denpasar City, Bali 80221, Indonesia",https://maps.google.com/?cid=10196892213204410548,CLOSED_TEMPORARILY,,,lodging,4.8,17,,Good and recommended 👍,Nice,,,
ChIJKytSbMVB0i0RO-SA6SMFU50,Tu.House,-8.6957978,115.1943481,"Gg. Ratna Indah No.39, Pemogan, Denpasar Selatan, Kota Denpasar, Bali 80221, Indonesia",https://maps.google.com/?cid=11336410338821203003,OPERATIONAL,+62 811-3982-657,lodging,lodging,4.7,48,,"For 1.7jt per month you get a reasonable albeit small room, with cooking corner and bathroom. There is some space outside on a common balcony, but hardly any privacy. The neighborhood is busy and there is a big mosque nearby that will just LOVE to disrupt your sleep at UNGODLY hours.",Good place for live,Good place for stay,4/5 - nice,
ChIJL3A-witB0i0RJWpxZRU0EZs,ELBA KOST,-8.696084599999999,115.19357419999999,"Gg. Ratna Indah I No.2, Pemogan, Denpasar Selatan, Denpasar City, Bali 80113, Indonesia",https://maps.google.com/?cid=11173769416983800357,OPERATIONAL,,private_guest_room,"private_guest_room, lodging",4.3,17,,Good,,,,
ChIJGXCtwy5B0i0RDE8TYZgcWrI,"Warung Rujak Pindang ""WSB"" Kepaon",-8.6979101,115.1968086,"852W+RPM, Gg. Layon, Pemogan, Denpasar Selatan, Kota Denpasar, Bali 80221, Indonesia",https://maps.google.com/?cid=12851615927444393740,OPERATIONAL,+62 361 728138,restaurant,"restaurant, food",4.7,115,,The best....,Nice,Good taste.,,
ChIJhWS1mS1B0i0Rw2LVBM5P6XI,"Pondok Wika 18 (Kos harian, mingguan, bulanan)",-8.7011217,115.19240789999999,"Gg. Salya, Pemogan, Denpasar Selatan, Kota Denpasar, Bali 80113, Indonesia",https://maps.google.com/?cid=8280237136160318147,OPERATIONAL,+62 812-3664-881,hotel,"hotel, lodging",4.7,62,,"It's so bad, lots of cockroaches in their bathrooms, even up to a dozen cockroaches coming out of their bathrooms, just in room no. 1, this bathroom in room no. 1 has been dismantled because of an overflow drain, which has a large hole in the bathroom, causing a lot of dirty cockroaches to come out of the bathroom",All the best,A good place to stay for a while during the holiday,,
ChIJa7H2CkNB0i0RnK5QiOAep8U,INA Kuliner,-8.699498199999999,115.19179050000001,"852R+6P3, Gg. Tiger, Pemogan, Denpasar Selatan, Kota Denpasar, Bali 80221, Indonesia",https://maps.google.com/?cid=14242386296290979484,OPERATIONAL,,restaurant,"restaurant, food",,,,,,,,
ChIJbyTfri1B0i0RSURuLf5XK3Y,Kost Green Panda,-8.700181599999999,115.19232430000001,"Gg. Panda No.9 B, Pemogan, Denpasar Selatan, Kota Denpasar, Bali 80113, Indonesia",https://maps.google.com/?cid=8514996269669565513,OPERATIONAL,+62 896-9241-2614,hotel,"hotel, lodging",4.7,54,,Very nice and comfortable guest house.,Nice and quiet place,Ok,Nice place!,
ChIJl8w43UpB0i0R2df-JyyhjwQ,Villa Casa Ligera,-8.6999851,115.1990902,"Gg. Dewi Uma III, Pemogan, Denpasar Selatan, Kota Denpasar, Bali 80221, Indonesia",https://maps.google.com/?cid=328658508842981337,OPERATIONAL,+62 878-6225-8993,,"guest_house, lodging",4.9,7,,"I had an amazing time staying in Villa Casa Ligera at Bali .It was in middle , so i can easily go to many places . The host was good and the Villa gives homie Vibe . I guess if you are in Bali you should try stay there 😊","Nice private villa,recomended","amazing Villa To stay , had everything , owner is so friendly . I would recomand It To anyone who wants To Come To Bali should try To stay here . Close To so many places , and afford able and cheap , Value for money deal",Love this place so much!!,Good
ChIJX20c-yVB0i0RSh_33pC3yNY,Alit bali rental,-8.6998689,115.1983066,"Gg. Dewi Uma No.3, Pemogan, Denpasar Selatan, Kota Denpasar, Bali 80221, Indonesia",https://maps.google.com/?cid=15476821952302620490,OPERATIONAL,+62 815-5816-7031,car_rental,car_rental,5,11,,,,,,
ChIJRw_XXyxB0i0RioPjmu-Vq7E,Kos Gedong Ayu,-8.6982541,115.19225499999999,"Jl. Glogor Carik Gg. Rangkis No.4, Pemogan, Denpasar Selatan, Kota Denpasar, Bali 80221, Indonesia",https://maps.google.com/?cid=12802491222059090826,OPERATIONAL,+62 813-3718-8550,lodging,lodging,4.3,23,,"Big room and have front and back door, good for air circulation when not using AC.",,,,
ChIJg1_MUixB0i0RWTSGOH1bkWQ,KOST PONDOK GANGGA,-8.699693,115.192499,"852R+4XH, Pemogan, Denpasar Selatan, Denpasar City, Bali 80221, Indonesia",https://maps.google.com/?cid=7246673868793197657,OPERATIONAL,+62 819-1665-2441,,lodging,4.5,14,,,,,,
ChIJY20rC4tB0i0R97QcCHeMK_c,Toko camilan diva,-8.6972775,115.19490029999999,"Jl. Taman Pancing No.19, Pemogan, Denpasar Selatan, Kota Denpasar, Bali 80221, Indonesia",https://maps.google.com/?cid=17810483594231854327,OPERATIONAL,+62 822-5274-4827,restaurant,"restaurant, food",2.5,2,,,,,,
