id,name,latitude,longitude,address,url,status,phone,primary-type,types,rating,rating-count,price-level,review 1,review 2,review 3,review 4,review 5
ChIJ3-V2cM1A0i0RGd-ME8JosXo,Bakwan Surabaya,-8.673341599999999,115.20797979999999,"Jl. Teuku Umar No.54X, Dauh Puri Kauh, Kec. Denpasar Bar., Kota Denpasar, Bali 80113, Indonesia",https://maps.google.com/?cid=8840962726265937689,OPERATIONAL,,indonesian_restaurant,"indonesian_restaurant, restaurant, food",4.4,1252,PRICE_LEVEL_MODERATE,"old style bakso shop, i think it used to have better taste. the fried wonton and meatballs still be my favourite. they have fan but still can't cool the place down.",I recently tried Bakwan Surabaya's meatballs and they were amazing! The flavor was spot on and it had the perfect amounth of spice. I definitely recommend anyone who loves authentic Indonesian food to try this place out. It won't disappoint!,"I have been here 7-8 years ago.. I can not remember the taste. After few days eat ""nasi campur Bali"", I miss to eat bakso and remember about this place - Bakwan Surabaya located in Jl Teuku Umar Denpasar.

We ordered two bakwan campur and one bakwan goreng. Mmmm... I do not like the soup taste - as I am quite sensitive on MSG. The taste of MSG is very strong - so I decide to eat the ingredients (bakso, bakwan, noodle) without its soup 😓
Uh uh

I put 3 star on the review, as I believe they can improve it easily. if they want to.

Positive : And the place is clean.

By the way I will not come back.
Sorry 🙏",All the bakwan campur meatballs option were so good! I like it so much and very recommended,"Still my second favorite local place to eat. It has not changed one bit in the past decade other than offering 3 actual parking spaces in front.
The shrimp bakso in all their variations are fantastic. 3 spoons of chili, one spoon of red sauce and some ketchup manis and you’ve got the perfect lunch."
ChIJ48bqj8JA0i0RcIcaczMt9Ow,Pondok Nyaman 15,-8.6786614,115.21180220000001,"Jl. Nusa Penida No.15, Dauh Puri Klod, Kec. Denpasar Bar., Kota Denpasar, Bali 80114, Indonesia",https://maps.google.com/?cid=17074321786266093424,OPERATIONAL,+62 812-8654-0882,hotel,"hotel, lodging",4.1,133,,"NOT RECOMMENDED. air condition is so bad, I could barely sleep at night. So noisy, whenever my neighbor sneezes, coughs, or makes a call, it’s annoying.

No elevator.
Front desk is not available 24hr.","The pillowcases and blankets in this hotel uses cheap laundry perfume and have a really strong smell. For an allergic people like me, this kind of perfume is a torture to the nose. I have already asked for non-perfumed bedcases and blankets but they still change the bedcases and blankets with the cheap perfume","Great location, easy access to hospital, just 3min walking. Superb clean room. Fabulous interior. Well maintenanced bathroom with hot water. Cant ask for more!",Neat n clean rooms with a three star hotel standard accommodation. Centrally located in Denpasar n walking distance to Sanglah General Hospital. Quite a distance from Kuta Beach n other favourite tourist places.,"Bright room, affordable, comfortable, and super clean! Overall, a perfect stay for me who has relatives staying at the hospital nearby"
ChIJSZJgucJA0i0RZEtmg-ubc-A,Ayam Gepuk Pak Gembus Sanglah,-8.6798325,115.2114021,"Jl. Nusa Penida No.28, Dauh Puri Klod, Kec. Denpasar Bar., Kota Denpasar, Bali 80114, Indonesia",https://maps.google.com/?cid=16173442122641722212,OPERATIONAL,+62 859-5936-5563,restaurant,"fast_food_restaurant, indonesian_restaurant, restaurant, food",4.4,630,PRICE_LEVEL_INEXPENSIVE,"It was the most tasty branch of Ayam Gepuk Pak Gembus in Denpasar. The deep fried chicken was well seasoned, the chili sauce tastes very balance. You also could ask for additional rice and chili for free :) really recommended if you are craving for chicken delight","I like their grilled chicken, great taste! and super spicy sambal too, if you wish to request level 10, like me haha","Level 7 not spicy enough , but overall it’s delicious! And affordable price!","Main menu is chicken.
They serve with sambal, powder , also tahu and tempe.
Ther is kangkung vagetables , cucumber etc.
Soft drinks also available.
Price is fair.",for those who loves spicy food
ChIJSdgkTChB0i0RCXaj9vddgXA,GOGO FRIED CHICKEN Pulau Komodo,-8.6773965,115.2103131,"Jl. Pulau Komodo, Dauh Puri Klod, Kec. Denpasar Bar., Kota Denpasar, Bali 80114, Indonesia",https://maps.google.com/?cid=8106864123819816457,OPERATIONAL,+62 817-7688-9090,restaurant,"restaurant, food",3.4,215,,"First time came here. The place is clean, spacious. It's a shame, but the service is not friendly. Maybe because the workload is too much. Hopefully it can be improved in the future. Other than that when I came, a lot of chicken was not available. Maybe in the future, before the chicken runs out it will be prepared faster.",Well the best 24hours fried chicken ever! The best menu is Geprek Chicken that cost 20k and 5k for the ice tea.. With only 25k I can enjoy free flow rice and I can refill my ice tea as many times as I want. Really affordable and the taste really good (to be compared with the price) CHEAP AND DELICIOUS! Good job!,"It's a crowded place, and there's always a queue every time I come here. Every time I come, there are never any chicken breast pieces available. Maybe it's so crowded that it sells well.","Great meal, great service even sometimes it takes a bit longer to get your orders in rush hour. The best part of this franchise is you can free flow the ice tea and pick up more rice as much as your tummy can handle!!","Good place to dine but those wibus community who order less than 100k is too loud!
The employees should grow a pair and tell them to be quiet, they really ruin my appetite."
ChIJTa4eWsFA0i0RKnKK7rROSZ0,Mie Goreng Makassar PELITA,-8.6754876,115.20744429999999,"Jl. Teuku Umar No.65, Dauh Puri Klod, Kec. Denpasar Bar., Kota Denpasar, Bali 80113, Indonesia",https://maps.google.com/?cid=11333676476257694250,OPERATIONAL,+62 853-3913-3300,indonesian_restaurant,"indonesian_restaurant, restaurant, food",4.5,815,,"Very recommended place to eat that already been here for more than 10 years! They have authentic taste of southern Sulawesi dishes and I can recommend their mie goreng makassar and ayam goreng mentega, both are super delicious with generous portion, therefore you must bring friends to finish together.","Best fried rice I tried in Bali so far. The food are in generous amount and taste superb.  This place has also improved its place, the tables are more sturdy and rigid than my last visit, but unfortunately, the floor was very greasy. Overall, I would still come back if I miss the fried rice","Never disappointed having lunch and dinner here. The autenthic taste and spices, make the dishes is perfect. One of my favorite is Bihun Goreng Hokkian & Ayam Tanpa Tulang Saos Mentega!

Please bring your friend and family here. It's a good place to sharing with them.","Nice family restaurant, tasty food and big portion!!! I like the Nasi Goreng Makassar the most 🧡 will definitely back and try other menu","I can say they have the best Fried Rice in Bali! Generous portion as well. Also, try their Es Pisang Ijo. The spices were authentic. You can share one portion with 2-3 of your friend. Definitely worth the price and still not so many tourist know about this. Go give a try."
ChIJrcGo7kJB0i0Re2NYw0Gvv1g,Charada BBQ Bali,-8.674964500000002,115.20773589999999,"Jl. Teuku Umar No.116, Dauh Puri Klod, Kec. Denpasar Bar., Kota Denpasar, Bali 80114, Indonesia",https://maps.google.com/?cid=6395022692874478459,OPERATIONAL,+62 813-3751-4558,restaurant,"restaurant, food",4.3,842,PRICE_LEVEL_MODERATE,A great place to visit when you're craving Korean BBQ. Sure its not 'all you can eat' but each serving of the meat selection is generous enough that even two serving of meat and a side of rice is enough to make you feel full (and not even close to being as expensive as a typical auce!). They also serve free kimchi and lettuce too which was tasty and were great accompaniments to the meal,"Charada is one of Korean BBQ optional to dine in Denpasar. But, the services is BAD.
The staff wasn't friendly or even smile to the customer.
We have to ask many times because they dont inform us clearly about the menu. Foremost, they don't repeat our order and when they served the food on the table, they just served and put those without explain which one is pork or beef or chicken.
Do they think that we know all the menus ?
Worst!

The beverage menus. A lot of their menus is unavailable. :(  Neither Soju

The food is Good and they have free kimchi ✨✨ just the service is Bad 😡

Price range:
Food : 40k- 60k
Drinks : 5k - 20k 💸💸","Best price for Korean BBQ lovers in Bali.  Good food,  Good choices and price are reasonable. Items are not so many like a big Korean restaurant but you get what you want most.
Service are quick and unlimited kimchi also vegetables
The problem only limited parking place in Jln Teuku umar a bustling area in denpasar .","Delicious korean food with budget. Price not expensive. Taste also good. Refill for kim chi and lettuce as your request. Full table at night and weekend, better make reservation or come earlier to get table. No car parking here. Only motorcycle, if you use car park at side of road.","The restaurant was a bit dim,and the gas pipe was visible and hazardous, the food was good and affordable, I ordered tea with longan fruit and the longan tasted like kimchi, probably it’s kept in a same fridge. Self serve condiments including the lettuce and kimchi. The exhaust is great so you’re leaving without the smell of grease on your shirt. Did I mention that they also sell frozen meats?"
ChIJ8brEp8ZA0i0R-M1UbkkfTz8,Bakso Nuklir,-8.6757685,115.2059523,"Jl. Pulau Misol No.10, Dauh Puri Klod, Kec. Denpasar Bar., Kota Denpasar, Bali 80113, Indonesia",https://maps.google.com/?cid=4561899347793726968,OPERATIONAL,,indonesian_restaurant,"indonesian_restaurant, restaurant, food",4.2,881,PRICE_LEVEL_INEXPENSIVE,"Decided to give it a try after this place showed up in random reels and got mixed feelings. I like the soup besides the tender large meatball, but no to the fritter. The place is packed and hot. They just take away leftovers without cleaning the table, so hygiene is a big problem here. Serving time is longer than average meatball diner. Good thing is the price, 15k for a meal is a bargain.","The staffs are very friendly, informative and helpful. This was our first time to try this Bakso Nuklir. Never expected before that it turned out to be a yummy experience. The broth is clear and delicious. The meatballs are tasty and they have various meatballs. One portion is served with noodles or vermicellies. They are similar to Bakso Boedjangan with their Taichan broth. When we asked for more vermicellies and broth only, they gave it for free! Thank you so much! Recommended place.",Good place to eat yummy Big Bakso/Meatball. Price is quiet cheap (around 10K per bowl). Will be back for sure!🤓 #bebibuncit,"The super sapi broth is tasty enough without any additional sauces. Not to mention the meats. Overall good - the chocolate drink, ice tea and others. We love it!","Great food, good price, cozy place but need AC to make it better."
