id,name,latitude,longitude,address,url,status,phone,primary-type,types,rating,rating-count,price-level,review 1,review 2,review 3,review 4,review 5
ChIJIX1XKc4b0i0Rt6nADQmXV3w,Telabah Lantang Desa Muncan,-8.4328007,115.4479408,"HC8X+V5G, Jl. Pura Dalem, Muncan, Kec. Selat, Kabupaten Karangasem, Bali 80862, Indonesia",https://maps.google.com/?cid=8959796048818121143,OPERATIONAL,,tourist_attraction,tourist_attraction,4.5,37,,"Beautiful views ...and you can do aktivities like ,rice field trekking , cycling ,hiking mt.Agung ..contact us +6285203723242","A nice road with a beautiful view in karangasem. We didn’t stop, we just passed through.",Nature we love it,,
ChIJvWHGaCEb0i0R9465hnVhXx4,Bukit ngoek,-8.4361324,115.45096639999998,"Unnamed Road, HF72+G9W, Muncan, Selat, Karangasem Regency, Bali 80862, Indonesia",https://maps.google.com/?cid=2188575101324726007,OPERATIONAL,,park,park,3,2,,good place,,,,
ChIJmxtIxp0b0i0RJrhgTIqofFY,Kajeng Bufallow,-8.4330789,115.4503065,"HF82+Q47, Muncan, Selat, Karangasem Regency, Bali 80862, Indonesia",https://maps.google.com/?cid=6232041296314284070,OPERATIONAL,,,lodging,5,1,,Top,,,,
ChIJbxjoW6Ib0i0R4XZygGwCEbU,Yeh Lantang,-8.4328452,115.44796729999999,"HC8X+V58, Muncan, Selat, Karangasem Regency, Bali, Indonesia",https://maps.google.com/?cid=13047212260503746273,OPERATIONAL,,tourist_attraction,tourist_attraction,,,,,,,,
ChIJ4erzumIb0i0R_WYN4rCRuek,Tegalan Asri,-8.4333615,115.45034609999999,"Muncan, Selat, Karangasem Regency, Bali, Indonesia",https://maps.google.com/?cid=16841652470421481213,OPERATIONAL,+62 881-0378-25742,park,park,,,,,,,,
