id,name,latitude,longitude,address,url,status,phone,primary-type,types,rating,rating-count,price-level,review 1,review 2,review 3,review 4,review 5
ChIJn6tjjfaJ0S0RRLr3tF8tP1o,House Of Tundra,-8.3059542,115.1777532,"M5VG+GWM, Baturiti, Tabanan Regency, Bali, Indonesia",https://maps.google.com/?cid=6502966276027562564,OPERATIONAL,,restaurant,"restaurant, food",4.6,954,PRICE_LEVEL_MODERATE,"What a great place for a meal. I stopped in for an early breakfast.
Fantastic view out the back inside a very nice minimalistic decorated cafe. The Mee Goreng was well seasoned and delicious. Both my Iced Latte and refreshing Ginger Beer were also perfect.
The staff are also super attentive and friendly. I was immediately greeted and seated with a smile. Drinks and meal were served within minutes.
I can highly recommend the House of Tundra to any one passing by or staying in the area.","Great dinner experience while the mist rolls in; good food makes for a good mood. 😁 The waiters are also helpful and very friendly to customers. Unfortunately, we were the last order because the restaurant closes before 9 pm. We'll definitely be back next time we visit Bedugul.

P.S. Their wonton soup is on another level. It's perfect for warming your body and soul when you’re feeling cold due to the weather.
🥰","pretty good. tahu and wonton soup were very good, eggplant katsu was tasteless. lemongrass tea also solid. impressive setup, decor and architecture for the location; def the nicest place in the area and pops up out of nowhere either before bedugal/lakes or after, depending on the direction. menu looked expansive and prices reasonable. relaxing and good views. plenty of parking. staff well trained and helpful. exceeded expectations; def worth a stop, though the other review(s) that mentioned flies had a point…3 of them joined us for lunch 🤢","every corner of this place is aesthetic, have a nice ambiance, cool air, spacious space, even the food in this place is all delicious for the price including standard

If you want to find a place that has cool air in Bali, you can come here","such a beautiful place!
big portions of tasty food

not so quick, but very nice anyway"
ChIJrwHxRU6J0S0RsmqDwcqEd7g,The Lavana Kayu Manise Villa Bedugul,-8.307826,115.17465849999999,"Jl. Raya Baturiti, Gg. Kayumanis Jl. Baturiti Bedugul No.1, Baturiti, Tabanan Regency, Bali 82161, Indonesia",https://maps.google.com/?cid=13292238831572183730,OPERATIONAL,+62 896-8000-0788,hotel,"hotel, lodging",4.5,69,,"Such an amazing place to stay. I stayed for a night with my partner, and it's super worth it. The ambience, the view, all feels like home. It also have a fascinating night view. The staff were so kind, i got a minor issue about the television but they help us right away.","If you have ever read reviews about poor soundproofing in the rooms, then know that you lived in a fortress. Because here you will be living right on the street. Despite the fact that it is a detached house you will hear absolutely everything that happens around. The evening will start with bikes passing all over the valley, will continue with a dog barking all night and will end with a rooster right under your ear, which runs somewhere in the neighboring village. Plus all the talking around, banging, buzzing, etc. The room itself is clean and nice, but there are nuances: firstly, it is very dark. Despite several lamps, it is still very dark in the evening. Secondly, there is a door between the bedroom and the bathroom, but it is transparent and without curtains! Third, inattention to the little things: inconvenient shampoo, far away from the bathtub, window facing directly into the wall, no air conditioner or fan.
The place is beautiful, stunning view, clean room and lovely bath. But unfortunately it is absolutely impossible to sleep and rest because of everything, absolutely everything is audible!","Wow. What a beautiful place?! Outstanding panorama and a beautiful, luxury room. The employees are very friendly. Me and my friend felt welcomed and comfortable.",We booked the hotel via Booking and we asked several questions prior to the arrival and did not get any answer. The staff did not speak any English at all. In our Booking it was included the breakfast but when we arrived there they said it was not included. Finally we got a basic breakfast. They did not help us with any transportation arrangement. Rooms were not really clean. I would not recommend to stay here.,"The 1 stars is only for kutot who serves the place .. she is very kind and welcoming.
Regarding the rooms :
We found our villa dark and smelly
The mattress has black spots on it (  it could be bed bugs traces or mold but i cant say which for sure)
The room was dusty and there were ants everywhere .. i was literally sleeping with ants ..
The villa is very noisy .. there is a roster  behind the place who doesn't let anyone to sleep .. plus noise from the road
Breakfast was poor
We checked out next morning we couldn't stay more"
ChIJNfjYyguJ0S0R0szpOKChiAo,Warung Pondok Mutiara,-8.3115968,115.1777059,"Baturiti, Tabanan Regency, Bali 82191, Indonesia",https://maps.google.com/?cid=759034246733614290,OPERATIONAL,+62 819-1639-8877,indonesian_restaurant,"indonesian_restaurant, restaurant, food",5,23,,"Amazing food, very cheap and stunning scenery, would definitely come here to eat again!",Food was delicious and service was great. The setting was gorgeous with all the plants.,Delicious food in a beautiful place!,"They are now open in a new location nearby, just a few steps from the previous one.",Nice food.
ChIJhZnSO42J0S0RMAqKKhlQiZs,Warung Makan Betutu Man Selamet,-8.308828199999999,115.17903860000001,"Jl. Baturiti Bedugul, Baturiti, Kec. Baturiti, Kabupaten Tabanan, Bali 82191, Indonesia",https://maps.google.com/?cid=11207577216706284080,OPERATIONAL,+62 813-3823-8978,restaurant,"restaurant, food",4.6,18,,,,,,
ChIJ2fgX8pGJ0S0R5mJvwCTAxXI,Penginapan Kembang,-8.3040497,115.1758888,"M5WG+99J, Jl. Baturiti Bedugul, Baturiti, Kec. Baturiti, Kabupaten Tabanan, Bali 82191, Indonesia",https://maps.google.com/?cid=8270227554815664870,OPERATIONAL,+62 368 21286,bed_and_breakfast,"bed_and_breakfast, lodging",3.6,18,,,,,,
ChIJ0xLmRzmJ0S0RnVGhAVQBF6c,Angkringan Nyonya Kota,-8.3050628,115.17648240000001,"Br. Pekarangan, Jl. Raya Baturiti, Baturiti, Kec. Baturiti, Kabupaten Tabanan, Bali 82191, Indonesia",https://maps.google.com/?cid=12040093589114540445,OPERATIONAL,+62 812-8039-1526,restaurant,"restaurant, food",5,5,,,,,,
ChIJIR0ZUEaJ0S0RqipuJXhDouw,Guna Baturiti Villa,-8.3069449,115.1779972,"M5VH+65H, Jl. Pancasari - Baturiti, Batunya, Kec. Baturiti, Kabupaten Tabanan, Bali 82191, Indonesia",https://maps.google.com/?cid=17051265322481232554,OPERATIONAL,,lodging,lodging,,,,,,,,
ChIJVw7B0_KJ0S0Rt8Dg_DqOtjI,Warung Babi Bali Trimar,-8.3096687,115.17953240000001,"M5RH+4RM, Baturiti, Tabanan Regency, Bali 82191, Indonesia",https://maps.google.com/?cid=3654264531659571383,OPERATIONAL,,indonesian_restaurant,"indonesian_restaurant, restaurant, food",3,1,,,,,,
ChIJ-apaEQCJ0S0RFQtFpSxzdms,Kedai Kopi Beentang,-8.3067919,115.17820449999999,"M5VH+77G, Jl. Raya Bedugul, Batunya, Kec. Baturiti, Kabupaten Tabanan, Bali 82191, Indonesia",https://maps.google.com/?cid=7743503244898667285,OPERATIONAL,,coffee_shop,"coffee_shop, cafe, store, food",5,2,,,,,,
ChIJ4VGvq0aJ0S0RPY4aOK46TDA,Aset Baturiti by heruhost,-8.3048933,115.17685989999998,"M5WG+2JF, Jl. Baturiti Bedugul, Baturiti, Kec. Baturiti, Kabupaten Tabanan, Bali 82191, Indonesia",https://maps.google.com/?cid=3480221131990535741,OPERATIONAL,,private_guest_room,"private_guest_room, lodging",,,,,,,,
ChIJkZXsqNeJ0S0RjnbG3gtbJ7A,Pondok ean gentz,-8.3043591,115.17515949999999,"Jl. Baturiti Bedugul No.66, Baturiti, Kec. Baturiti, Kabupaten Tabanan, Bali 82191, Indonesia",https://maps.google.com/?cid=12693214181307348622,OPERATIONAL,,private_guest_room,"private_guest_room, lodging",4.5,4,,,,,,
ChIJT7ZcEACJ0S0RnocDmTqdcQ8,Yudiantara,-8.3063988,115.17312939999998,"M5VF+C7R, Baturiti, Tabanan Regency, Bali 82161, Indonesia",https://maps.google.com/?cid=1112843457938032542,OPERATIONAL,,park,park,,,,,,,,
