id,name,latitude,longitude,address,url,status,phone,primary-type,types,rating,rating-count,price-level,review 1,review 2,review 3,review 4,review 5
ChIJVYqthY9D0i0Rp_utm-Ish5s,Natura Nusa Dua,-8.799401999999999,115.19986709999999,"Jl. mahoni I no. 2, Beranda Mumbul, Taman Mumbul, Benoa, South Kuta, Badung Regency, Bali 80361, Indonesia",https://maps.google.com/?cid=11206975549520870311,OPERATIONAL,+62 898-4596-969,private_guest_room,"private_guest_room, lodging",4.5,19,,"Found this place through Instagram and the place looks exactly like what they advertised! I stayed for a month here and had the best experience while I'm there. There was housekeeping once a week and they had a great wifi connection. For food, I had to find it through Gofood/ Grabfood since there are not many food vendors near the place.

The place is quite far from the main tourist attraction (Canggu, Kuta, Seminyak, etc.), but if you want to relax and stay in a quiet neighbourhood, this is the place. My favourite beach near this place is Pantai Pura Geger, go there almost every day :)
Overall I had a great experience, if I want to stay in Nusa dua, totally will stay at this place again.",good,"clean,calm and nice play to stay....although its far to reach it...",,
ChIJK0z8O8VD0i0R3tVoBuedLR4,OYO 90860 Tunjung Sari 8,-8.7970475,115.20060400000001,"Jl. Pulasari, Gg. Tunjung Sari, Taman Mumbul, Nusa Dua No.8, Benoa, Kec. Kuta Sel., Kabupaten Badung, Bali 80363, Indonesia",https://maps.google.com/?cid=2174567810660357598,OPERATIONAL,+62 822-3777-6736,hotel,"hotel, extended_stay_hotel, lodging",4.4,35,,The place is quiet and comfortable.  We used 4 rooms and only 1 room had a water heater.  Overall good for rest or stay on holiday,Wrong price! Dont book in Agoda!,Good,,
ChIJjfhL9ppD0i0R3dTWLIr5hqc,"Waroeng Santai,Perumahan Beranda Garden",-8.7998584,115.20034109999999,"Kuta Selatan, Kec. Kuta Sel., Kabupaten Badung, Bali 80361, Indonesia",https://maps.google.com/?cid=12071610223066272989,OPERATIONAL,+62 812-4614-6390,restaurant,"restaurant, food",4.9,117,,"The place was cozy and comfortable, the food was amazing too!! Recommended!!","Nice to see waroeng santai is open again. Wide menu selection, great taste, reasonable price. Suitable for group occasion. The owner is friendly and welcome. Very comfortable.","The ambiance of the restaurant, including the quality, also the quantity of the food is absolutely worth to try.
Came here for the 3rd time already since the opening. Definitely recommend, especially the Gurame Saus Padang.",nice vibes,"Very cozy place 😊friendly staff, good food... Nice  place to relax... Good ambience. Thank you @waroengsantai 😊"
ChIJrwwS4M5d0i0RSKX6Ou4UoGw,Dewi mandala homestay,-8.8053464,115.20180690000001,"Jalan nusa indah, Jl. Raya Kampial Jl. Raya Nusa Dua Selatan, Benoa, South Kuta, Badung Regency, Bali 80361, Indonesia",https://maps.google.com/?cid=7827279165794198856,OPERATIONAL,,guest_house,"guest_house, lodging",4.4,8,,"Kinda love this place, not too loud. The service is also good, and near to many place at Nusa Dua",,,,
ChIJSz1TP85D0i0RyhEXF7Nrf4o,H2O Homestay Bali,-8.7980144,115.20105599999998,"Jalan Gn Gede Pulasari No. 234 ABC, Nusa Dua, Kec. Kuta Sel., Kabupaten Badung, Bali 80361, Indonesia",https://maps.google.com/?cid=9979813716207014346,OPERATIONAL,+62 812-1219-9911,private_guest_room,"private_guest_room, lodging",4.9,18,,"If you are undecided about the area, I recommend Nusa Dua. It's quiet and peaceful, and close to all the main roads and stores. On the beach Nusa beautiful and long promenade, there is a theater, cinema and a lot of cool cafe/restaurants.

But if you have already decided on Nusa Dua, but have not found a place to live — I think you are lucky, because you will not have to move your suitcases from your guesthouse to H2O Homestay🤣. I'll be honest: stumbling upon this house and family was the best accident that happened to us in Bali. H2O is more than ""living in a quiet and peaceful neighborhood with a beautiful view"".
There you will understand what ""hospitality"" is all about and find people to your liking. Be careful: breaking up with H2O is hard and dangerous for your heart 🤭","The staying at H2O Homestay Bali was an experience I don’t want to miss in my life.
The hosts were one of the nicest and kindest persons I have ever met in my life!
They will help you where ever they can and tell you a lot about the Balinese culture.
The accommodation is very clean and spacious, neighbourhood is beautifull and very nice located in a quiet and peaceful place.
I really recommend this place, if you are looking for nice people, comfortable stay and peace.","I was staying here for about 7 weeks and I was really pleased staying at H2O as it is a very nice homestay, modern and with all the facilities needed, clean and comfortable. It is ideally situated for visiting many places in Bali. If you need healing place for your soul and mind, this homestay is the right place too. The owner are very good, friendly and helpful.","Recommended place to stay, if you are looking for a place in peaceful and good surroundings and nearby lively environments,  then this place might be one of the choices. It is close to stunning beaches and tourist spots.

The host is also very friendly and helpful. You may ask the host too for any hidden gems in Bali.

Super recommended!! 😍😍😍","This homestay was an absolute gem! It felt more like staying with welcoming friends than at a typical hotel. The hosts were incredibly warm and helpful, going above and beyond to make my stay comfortable and enjoyable. I highly recommend this homestay to anyone seeking a unique and delightful place to stay."
ChIJuWQb-FpD0i0Rd9CY7cVk0IE,Ayudarma Indekost,-8.80124,115.1978998,"55XX+G52, Benoa, South Kuta, Badung Regency, Bali 80361, Indonesia",https://maps.google.com/?cid=9354087227306070135,OPERATIONAL,,hotel,"hotel, lodging",4.1,9,,,,,,
ChIJPcuDun1D0i0Rs_yVVI3cu6M,Villa mumbul,-8.7979209,115.2031883,"Taman Mumbul, Jl. Gn. Gede Pulasari No.291, Benoa, Kec. Kuta Sel., Kabupaten Badung, Bali 80361, Indonesia",https://maps.google.com/?cid=11798266148394761395,OPERATIONAL,+62 852-3758-5355,hotel,"hotel, swimming_pool, lodging, sports_complex",5,8,,Very nice Place,Okay,,,
ChIJaZ5pBDhD0i0RH2JRnClvP5c,Pondok Gede,-8.8046992,115.19930019999998,"55WX+4PF, Benoa, South Kuta, Badung Regency, Bali 80361, Indonesia",https://maps.google.com/?cid=10898551847766811167,OPERATIONAL,,,lodging,5,3,,,,,,
ChIJdW9GSE5D0i0RVZA8Hw66-3k,Perumahan Kampial Indah,-8.8051801,115.202137,"Perumahan Kampial Indah, Benoa, Kec. Kuta Sel., Kabupaten Badung, Bali 80361, Indonesia",https://maps.google.com/?cid=8789823667560026197,OPERATIONAL,+62 812-9300-5394,,"cafe, indonesian_restaurant, restaurant, food",4.4,67,,Cozy,Good residence,,,
ChIJo1yHU1FD0i0RGQjJTew_4zw,"YUKI KOST - Nusa Dua , Bali",-8.8049813,115.20138999999999,"56W2+2H2 Perumahan Kampial Indah, Benoa, Kec. Kuta Sel., Kabupaten Badung, Bali 80361, Indonesia",https://maps.google.com/?cid=4387420746138847257,OPERATIONAL,,lodging,lodging,4.4,9,,Nice design,Amazing,,,
ChIJj0AZmcBD0i0Rc6UmrpGJKEY,kos teges asri,-8.8017764,115.20391309999998,"Jl. Batu Bulan No.1, Benoa, Kec. Kuta Sel., Kabupaten Badung, Bali 80361, Indonesia",https://maps.google.com/?cid=5055441840508413299,OPERATIONAL,+62 857-3907-6176,lodging,lodging,3.5,4,,,,,,
ChIJUUlrNL5D0i0RiF9zcQv3tQI,PW House,-8.7968102,115.2006933,"Gg. Tunjung Sari No.5, Benoa, Kec. Kuta Sel., Kabupaten Badung, Bali 80363, Indonesia",https://maps.google.com/?cid=195333787380572040,OPERATIONAL,,lodging,lodging,,,,,,,,
ChIJ9fAjHihD0i0R7nqvfdMb1R8,Royal Taman Bali -,-8.8001952,115.2050205,"6624+249, Jl. Taman Bali, Benoa, Kec. Kuta Sel., Kabupaten Badung, Bali 80361, Indonesia",https://maps.google.com/?cid=2293770180375837422,OPERATIONAL,,park,park,,,,,,,,
ChIJL33TzixD0i0R9lVgYLrgDoE,Villa Mahoni,-8.798931699999999,115.2000315,"Beranda Mumbul, Taman Mumbul, Nusa Dua, 6622+C2F, Jl. Mahoni II, Benoa, Kec. Kuta Sel., Kabupaten Badung, Bali 80361, Indonesia",https://maps.google.com/?cid=9299617371652118006,OPERATIONAL,,hotel,"hotel, lodging",4.1,19,,"Nice villa. We stay 3 nights for new year holiday. No traffic jam. Very quiet place. Clean and tidy.
The swimmin pool is small, just for 2 person.
The staff a little bit confusing because his location a little bit too far, when we need something he came 30 minutes later.","quite place, nice to staycation",Very good,Free wifi,Nice please
ChIJayo1Jy5D0i0Rm3i_S3psMAo,Bina mumbul villa,-8.8008422,115.1981855,"55XX+M77, Jl. Melati L, Benoa, Kec. Kuta Sel., Kabupaten Badung, Bali 80361, Indonesia",https://maps.google.com/?cid=734206011774040219,OPERATIONAL,+62 812-3889-192,hotel,"hotel, lodging",5,1,,,,,,
ChIJsdGd0udD0i0Rojsc4Tf2dIQ,Kost Kubu Dimel,-8.8010626,115.2034367,"Jl. Batu Bulan No.1, Benoa, Kec. Kuta Sel., Kabupaten Badung, Bali 80361, Indonesia",https://maps.google.com/?cid=9544524230165281698,OPERATIONAL,+62 819-3601-4410,private_guest_room,"private_guest_room, lodging",5,9,,,,,,
ChIJJ4u-h71D0i0RQr3tMAJFRXg,Ziza Living and Villas by The Lavana,-8.7985373,115.2036329,"Jl. G G Wirja, Benoa, Kec. Kuta Sel., Kabupaten Badung, Bali 80361, Indonesia",https://maps.google.com/?cid=8666408933657525570,OPERATIONAL,+62 896-8000-0788,hotel,"hotel, lodging",5,3,,,,,,
ChIJgyRV_dhD0i0RIS4tN03-W88,KOST ASRI KAMPIAL INDAH 21X,-8.805414899999999,115.2015033,"Perumahan Kampial Indah No.18, Benoa, Kec. Kuta Sel., Kabupaten Badung, Bali 80361, Indonesia",https://maps.google.com/?cid=14941815796323397153,OPERATIONAL,+62 813-3864-6646,,lodging,5,13,,,,,,
ChIJ922bT5lD0i0RnXHj1gGSeD4,Naturanusadua Homestay,-8.7995333,115.19986720000001,"Jl. mahoni I no. 2, Beranda Mumbul, Taman Mumbul, Benoa, Kec. Kuta Sel., Kabupaten Badung, Bali 80361, Indonesia",https://maps.google.com/?cid=4501508364154663325,OPERATIONAL,+62 812-3631-0761,private_guest_room,"private_guest_room, lodging",4.7,19,,I’m staying here for 6 months and I loved it. It’s just sometimes people are so noisy and I can hear clearly their voice from my room in the first floor. The bli was always so helpful!,,,,
ChIJl-qiz4xD0i0RJxNcfw-nFKw,TIPEN SAYANG APRIL,-8.8001949,115.19962930000001,"Perum Kanaka Hill, Jl. Kedaung No.64/65, Benoa, Kec. Kuta Sel., Kabupaten Badung, Bali 80361, Indonesia",https://maps.google.com/?cid=12399719359060906791,OPERATIONAL,,tourist_attraction,tourist_attraction,,,,,,,,
