id,name,latitude,longitude,address,url,status,phone,primary-type,types,rating,rating-count,price-level,review 1,review 2,review 3,review 4,review 5
ChIJ9UoeAkE90i0RFdCTFr7GUeg,Solo Villas & Retreat,-8.4970191,115.26108690000001,"Ubud, Gianyar Regency, Bali 80571, Indonesia",https://maps.google.com/?cid=16740379809637715989,OPERATIONAL,+62 821-4680-0828,hotel,"hotel, lodging",4.7,122,,"I loved the location of the property in the rice fields. The staff were amazing and I thought there was a good selection for breakfast. Room is cleaned everyday as well. Large water cooler in the room which was perfect. Air conditioning, ceiling fan and hot water - what more can you ask for? My favourite part were the scooter rides to the main road when I was leaving in the morning. They also pick you up if you would like. So much fun and I felt safe with their driving.

Only thing I didn’t like was that you could hear the people in the room next to me.","Stayed in Bali in several places, this one was the best. Tidy and well taken care of. The ladies cleaned the room every day, adjusting the time when I was away.
The staff is actually fabulous! Always smiling, welcoming, trying to fulfill every request. Responding in a chat within a few minutes. Couldn’t be better!
Lots of facilities, pool with clear water to swim. Free breakfasts provided from 7:30 to 11am.
Rice fields view (of course!) It’s a perfect place if you want to be close to the nature. A bit secluded from the city center. They offer free bike rides anytime to the main road though, so it wasn’t a big problem.","What a great stay did we have! The people are so friendly and so sweet with our daughter of 2 years old. We had the small room but it was great for us three, Juna's little tent could fit next to our bed. There was a free watertank and fruits in the room. And because no car can come to the hotel because of the small path they come and pick you up and drop you off and the beginning of the mean road. They're really quick. And the location is beautifull between the rice fields. So tranquil. We had a view over de ricefields aswell. It's a great place to stay. Especially with the sweet people who work there. Thank you so much!","Amazing location in the peaceful rice fields, along a gorgeous path full of cute little restaurants and stores. Scooter rides into the middle of Ubud when needed were a massive highlight especially for my 13 year old. The staff were the loveliest. We loved our stay here so so much","I stayed at this location 4 nights in Ubud I can’t say enough about this place if I could give them 10 stars I would.
It is a hidden gem and off the beaten path. If you would like to be on the Main Street with noise and tons of people this is not the place for you.
You can only access it by motorbike but the staff offers 24/7 pick up and drop off from the Main Street. I called at 11pm in the rain and they answered and picked me up within 5 minutes. I apologized for waking the staff and his reply was no problem if you want to go back out tonight give me a call. I was amazed that he would come in the rain no matter what to pick me up at any time.
That is not the only thing. I left my phone in the taxi when I arrived realized it upon check in and they contacted the driver and went and retrieved my phone for me. I was a sitting duck with no phone I cannot thank them enough.
They asked what I would like for breakfast every morning and what time I would like my room cleaned everyday. They would not go in my room unless I responded. I had no worries about anything being taken.
I will return to this place again and again.
If you like taking walks by the rice fields quite relaxation on your stay with no worries this is the place. Peace and meditation but not to far from all the great eating locations and shops stay here.
Thank You so much Solo Villas & Retreat I will be back."
ChIJ5S6gGjc90i0R3dOMbEMM3FI,Warung widi coffee,-8.4937151,115.2562902,"Jl. Bangkiang Sidem, Keliki, Kec. Tegallalang, Kabupaten Gianyar, Bali 80561, Indonesia",https://maps.google.com/?cid=5970660689709945821,OPERATIONAL,+62 813-5322-9411,coffee_shop,"coffee_shop, cafe, food, store",4.9,243,,"Come see June at the Warung Widi Cafe! You will love the good vibes here. The coffee is really nice and balanced. All the beans are local from Bali. The space is super clean and easy to find. You will meet all the friendly dogs! June is super kind and full of love! A really lovely experience. Good vibes only here, suksma!","Great little coffee shop! we had an iced latte and mango juice, both of which were really good. If you’re a real coffee aficionado you will appreciate this little cafe. The owner is very welcoming and friendly and it has a nice atmosphere.","The best coffee I had in my long stay in ubud!
The service is amazing too. The owner is so kind, have lots of knowledge about coffee thing! Fantastic coffee!",The coffee is v good (such an oasis after the hike) and the owner was SO nice. We talked about many things and I met his cute cat :),"We stopped as the smell of fresh coffee roasting was so good. Lovely owner great for a chat, local Balinese beans roasted in house with love. Best coffee, puppy, cat and dog also good for marketing!"
ChIJiy8PyMg90i0Rdd_sHj_F4nU,Juwuk Manis Hotel,-8.495412199999999,115.2626843,"Subak Juwuk Manis Road, G737+R3M, Ubud, Gianyar Regency, Bali 80571, Indonesia",https://maps.google.com/?cid=8494568722066628469,OPERATIONAL,,hotel,"hotel, lodging",4.7,31,,"The location is 20 minutes walking from Ubud central parking, if you don’t mind walking, the view is great! They also have staff who can help bring your luggage with motorbikes and you can also borrow or get the staff to drop you to main road. They are very friendly!","In one word - amazing. You cannot choose better location in Ubud. The surrounding is so beautiful and peaceful. The morning view at rice fields and mountains is unbelievable. The rooms are absolutely clean, very good equipped with very nice terrace. Highly recommend when you want to spent few days in paradise.","Juwuk Manis really deserves more reviews, since it is a beautiful,  comfortable and well managed Hotel.
It lies in the middle of Juwuk Manis rice fields. There lies its unique charm and its only ""disadvantage"" if it ever had one. Since it is a bit secluded it will offer you really peaceful nights (aside from junglelike sounds) and a lovely sensation when you wake up. The rooms are very nice, ours had its own pond, and it was overall quite comfortable and charming. The pool is also very nice when it gets hot and humid, and the place is overall extremely beautiful.
To move around you can either either perform a long walk through the fields and the market, or you may ask the personnel to carry you back and forth to the center of Ubud via motorbike which they will do at any time of the day or night without hesitation -I cannot stress enough how good a service they provided in that sense- or you might rent your own bike and problem solved. In any case, whatever option you choose, this distance factor should not deter you, it is really worth it and you get quite a matchless deal concerning quality/price relationship.
If you also have breakfast included, you can choose everyday one of six combos which come with a drink. If you stay long enough you will get tired of these, but tbh is not something to complain about either.
Do enjoy Juwuk Manis and its unique beauty.","Beautiful and peaceful place in nature. Although the hotel is older, still beautifully maintained, in a quiet area (rice fields). The staff are nice and helpful. Rooms beautifully prepared, clean.",Spent 2 nights here. Blanket and bedsheet got blood stains. They have no hair dryer. Water tastes like taken from fish tank. 1 thing i like was nice staffs.
ChIJ2yDpjDg90i0Rmbj1wZLjWOo,The Rice Joglo,-8.4939742,115.2598583,"Jalan Sok Wayah, Ubud, Gianyar Regency, Bali 80571, Indonesia",https://maps.google.com/?cid=16886497022284511385,OPERATIONAL,+61 450 004 761,guest_house,"guest_house, lodging",4.8,179,,"Skip visiting the sights in Ubud and hide in the colorful village of The Rice Joglo! We stayed here for 2 weeks enjoying every single detail beautifully put together by the charming manager of the estate. In fact, his presence together with his one of a kind sense of humor really made our stay! The suites are amazing and made us not wanting to leave the property. We got the chance to try The Lotus Suite with its romantic garden and The Tree House with a jungle bathroom. Both outstanding! A great breakfast is also included and was enjoyed every morning. Hope to come back again soon…","The Rice Joglo is the best place to relax and renew yourself out of the big city. We lived there with my friends for 1 month and liked it so much! Stuff is very caring and polite. Special big thanks to Sonu, who made our staying unforgettable! Every villa is so different and unique, the atmosphere is like everything was made with love. I am sure you will have amazing time in Rice Joglo. No doubt!!","This place exceeded all our expectations: the room details, the garden, the staff, the position in between the ricefields and the forest. Everything was just a dream. Moreover, we organized our wedding in here. We could not be happier for the choice of the location for our special day. Everything was just beyond perfect!Thank you!","This is my new favourite place in Bali. I stayed for a week, but it only took an hour or so to forget about everything and relax into nature here. It’s a 20 minute walk (or quick scooter ride) from central Ubud, but the path down is a lovely walk through the rice fields, and is dotted with yoga studios, cafes, shops and spas. I travelled solo, and the area felt very safe the whole time.

The property itself is a dream. I ended each night sitting in the outdoor bathtub, underneath the moon, overlooking fireflies light up the rice fields - surreal. And woke to the sound of their rooster, rather than my usual phone alarm. Wayan’s breakfast each morning, which is included, was delicious. A lot of the time I ate lunch and dinner here too, because the food was just so damn good, no matter what I ordered. Special mention to chef Gede, who I even did a cooking class with which was fabulous.

What really made my stay though, was the wonderful Sonu. He made himself available to me with whatever I needed, provided recommendations when I asked, and is a wonderful storyteller. Just such a beautiful soul. I already can’t wait to stay again. If you’re looking to slow down and be in nature, 11/10 would recommend.",We had refreshments in a lovely welcoming atmosphere after a long walk through the rice fields and jungle 'gardens'. It was a welcome heaven before resuming our walk.
ChIJbWbkZbE90i0RfAkB9Dd5H_o,Kidem Ubud Villas,-8.497204199999999,115.2572061,"Jl. Subak Sok Wayah, Ubud, Kecamatan Ubud, Kabupaten Gianyar, Bali 80571, Indonesia",https://maps.google.com/?cid=18023257514983885180,OPERATIONAL,+62 823-3965-2780,,"cottage, lodging",5,74,,"Both Kidem & Wayan are helpful and friendly. They make the check-in process hassle free and quick.
The room is well maintained, clean, and most of the amenities are available including the safe.
Highly recommended if you’re looking for a place to stay away from hustle and bustle.","If you are looking for tranquility, this is the right place. The view of the rice fields right in front of your eyes is like a painting, large rooms with balconies for relaxing. Swimming pool and all the facilities you need are available here. And what impressed me the most was that Mr Kidem and his wife always made sure all guests were comfortable. They generously provided breakfast, lunch and dinner during Nyepi and took me to the next accommodation which was 2 hours away, truly the nicest couple! Fried noodles are my favorite breakfast! thank you for the beautiful place.","We just spent 2 wonderful nights at Kidem… it’s one of the best kept secrets in Ubud, and we have been coming here for a long time. Set in the rice fields, this secluded and private haven is perfect to get away from it all. The location on Sari Organic walk makes it the perfect space to relax. The bungalows are made from washed teak, and the main room is about 30m2, with a huge bathroom area. Half of our bungalow was windows, with huge curtains for privacy.  Plenty of cupboard space too. Has a fridge. Kidem (the owner and his wife) are truly wonderful souls, and are some of the nicest people you will ever meet. Staff are attentive, industrious and will always make sure you are looked after, from extra coffee to preparing a fantastic breakfast - which will prepare you for the day ahead. We were looked after by Kedek, he was amazing and so were the other female staff . A  little swimming pool is all you need for a quick dip too. It’s a couple of KM from the main Ubud Palace, but the path to Kidem is lined with lovely Warungs, with authentic and affordable Balinese cuisine. Pomegranate is a cool little spot for great food and the best view of the rice terraces.  We will be going back to Kidem for sure. It’s a piece of privacy we all need, and the perfect place to ponder your own life - and what’s next.","I could write multiple pages on why this place is amazing. If you are trying to look for a place to stay in Ubud, this is 100% the place you should pick. The owner Kidem, his wife Wayan and the rest of the staff made our first experience in Bali absolutely amazing.

Kidem and a member of his staff waited up for us until 2am when we landed as our flight was delayed, they helped us with our baggage and drove on in scooters through the rice fields past the amazing sounds and beautiful fire flies to our accommodation, we hadn’t eaten in a while and Kidem very kindly made us some banana juice at 2:30am so that we wouldn’t go to bed hungry!

It’s safe to say waking up in our Villa to see the lush green jungle like forest and hearing the running water from the rice fields made us feel like we were in a fictional novel. This, accompanied by the friendly staff always checking in on us and Kidem, his wife Wayan always offering to help with lifts to the main road or the bookings of things to see around Ubud made this stay one our the best holidays we have been on.

To summarize -

10/10 service
10/10 location
Breakfast 10/10
Would we come back ? 100%","Lovely place between rise terraces and jungle, stayed here for two nights and love it very much. The olace has some distance from the main road you need to take a motorbike and have driver skills to go trough narrow small street between rise fields."
ChIJ4XeQTzg90i0RDlHn7oEIbkE,Cahaya Villa Ubud,-8.4973124,115.2577433,"subak sok wayah, Ubud, Kecamatan Ubud, Kabupaten Gianyar, Bali 80571, Indonesia",https://maps.google.com/?cid=4714715214055428366,OPERATIONAL,+62 812-3618-3966,hotel,"hotel, lodging",4.8,59,,"I absolutely loved staying here. A beautiful, peaceful oasis away from the busy centre of town, but close enough to walk when you feel like it. Or, you can just spend your time amongst the rice fields where there are cute cafes and restaurants and yoga shalas dotted along the path. The room was lovely, the bath was heavenly, and the people are so nice and friendly. Such a peaceful and relaxing stay, and amazing value for money!","We had the pleasure of staying in the villa. We love the next things in the place:
- Very friendly and helpful staff (we had some problems during our stay and they helped us)
- Beautiful place (rice terraces, tropical flowers, fruits on the trees, well-groomed lawn)
- Very delicious breakfast (banana pancakes, a mix of fruits and mango juice must have to try)","Super nice location, good breakfast and nice service! The walk (you can also grab a moto taxi) is super nice. I have been 3 times in Ubud and this is for sure on my top 2 list!","We have been so lucky to stay in Cahaya villa's of and on for over a month. So, we have been in almost all the rooms :-) and I can tell you they are all great, with fabolulous views over the ricefields. There are two new rooms with an amazing bathroom wit bathtub with a view of the ricefields, highly recomdended. But what makes the place feel like home is the owners and staff who are extremely friendly and serve the most wonderful fruitplatter for breakfast we have seen in 9 months of travelling.","Amazing location in the middle of rice fields, close to the Ubud center but just far enough so you don't hear all the city noise. The staff is extremely friendly and helpful and the breakfast they serve is very tasty!"
ChIJ05wy3Ec90i0RKqesMVPgaIk,Taman Bintang Villa,-8.4961778,115.26144319999999,"G736+GHG Subak, Juwuk Manis Road, Ubud, Kecamatan Ubud, Kabupaten Gianyar, Bali 80571, Indonesia",https://maps.google.com/?cid=9901410428694341418,OPERATIONAL,+62 813-3888-4423,hotel,"hotel, lodging",4.4,68,,"A lovely quite spot to stay which has a lovely outlook of rice paddy fields, it can only be accessed by motorbike, a car can get you within 500 m of the property, but then need to walk or get the staff to run you up on motorbike.
The staff are super helpful.","7-Feb-2024

Can you imagine a hotel worker telling you in a strange way, “Why did you come to this hotel and going to another hotel?” This is what happened to me! It was a very strange thing. The car couldn't get inside so he came to pick me up but I didn't want to ride with a man. So I politely asked not to ride with him. But he suddenly became angry and asked me to go to another hotel. I told him, “Your behavior is impolite.” So he shouted at me in the street and said, “I am impolite.” It was as if he was trying to attack me, saying, “I don’t care about you.”!!

He was an old man. If the hotel keep him working I’m really concerned about safety!esp for Female solo traveler please be careful!","Amazing location: 5 mins away by scooter to the center. Despite being so close to center, it is very quite and peaceful in the villa, you are surrounded by nature and beautiful animal sounds in the background.

After a tiring day of sightseeing and being surrounded by noisy Ubud traffic, I always looked forward to getting back to the peaceful villa, taking a swim in the pool and relax while drinking tea :)

The rooms are modest. Simple accommodation: comfortable bed, bedside table, drawer, AC, kettle, toilet with sink and shower. I had all I needed. Also, in front of my villa I had a table outdoors and it was a great place to drink my tea while reading or journaling and enjoying the beautiful nature around.

I booked for 3 nights but ended up staying 6 . I think GREAT price for what you get!! I had delicious breakfast included and the owner didn’t charge for scooter rides to the center.

When I needed to go somewhere further than the center, the staff was happy to drive me for additional charge (as they provide free rides to the center) , their prices were still better than Gojek/Grab :)

The highlight of my stay there was the owner and the staff! Such lovely people! The owner was very very kind and helpful, he suggested me many local places I could visit. Thanks to him, I got a more authentic insight of the city which I am greatly thankful for!!!

I am very happy with my stay at Taman Bintang Villa!☺️ I definitely recommend!","Terrible experience.
We booked 4 nights and only stayed one. Got a refund the next day and run away.
We got a room made of wood with lots of cracks in between. All painted in black so you couldn't really tell how dirty it was until seeing the bathtub and then you realise how dirty it actually is. We didn't even use the shower because it was disgusting.
The room was full of bugs, so we walked to buy a bug spray.
In the middle of the night hubby was woken up by a rat on his bedside table.
We can deal with insects but sleeping with rats not cool. On top of that, a couple of days later bed bugs bite appeared all over my body. I am most certain it came from this villa because the place we went after was a 4 star hotel very luxurious. It was our only option for a last minute booking after running away from this villa.
I would absolutely not recommend this place given that there are so many options around.","We have 4 nights stay and this is our experience

The Owner and staff of the villa are very friendly and helpful, the room is clean as well as the bathroom.
they have swimming pool also which is a good feature, a dining area, and a little bungalow near the pool if you wanted to do meditation or just enjoy the ricefield

Is located a bit far from the mainstreet, but they have free scooter shuttle to the mainstreet, for you who like walk a lot this place is also good!

Breakfast is good but is quiet small portion to start a day, but hey the taste is always be a mainthing!

Overall highly recommend for your stay in Ubud!"
ChIJ_9cS4Tg90i0RPyJC8h_6hc8,Dragonfly Cafe & Gelato,-8.499558,115.25844869999999,"Jl. Subak Sok Wayah, Abangan, Kecamatan Ubud, Kabupaten Gianyar, Bali 80571, Indonesia",https://maps.google.com/?cid=14953633152868950591,OPERATIONAL,+62 859-3388-1999,vegetarian_restaurant,"vegetarian_restaurant, vegan_restaurant, ice_cream_shop, cafe, lodging, restaurant, food, store",4.7,148,,"Nice little place for breakfast. It has amazing street appeal which continues once inside. There are several different seating areas offering different vibes all positive and relaxed. The food is good, the coffee good. Overall it’s a  nice little spot to spend a leisurely morning.","I really enjoyed both the passionfruit & mango flavours of the vegan ice cream here. Also the garden is teeming with flowers, plants and bumblebees. Great view and ambience, just make sure you use/bring mosquito repellent.","Very peaceful atmosphere overlooking rice paddies. Friendly and kind staff. but the most average breakfast I have had while in Ubud. Small portions and overpriced for what you get.

We had omelettes and I ordered extra feta (landing up with a piece of feta as big as my fingernail).","Such a great place, the best serene atmosphere, you feel instantly relaxed when you walk in. The food menu is very generous, everything sounds delicious so it’s hard to pick! I went with an iced coconut coffee and a tempeh burger and was very satisfied.
A must visit","I love this place! Had nice and tasty breakfast: veggie pizza, veggie omellete (cooked with coconut oil), rosella cooler, and crushed watermelon. This vegetarian cafe offers selection of nice vegetarian and vegan foods, with smoothie bar & vegan gelato menu

The atmosphere is so serene, surrounded by green rice field at the heart of Ubud, Bali.

Will come back again!"
