id,name,latitude,longitude,address,url,status,phone,primary-type,types,rating,rating-count,price-level,review 1,review 2,review 3,review 4,review 5
ChIJ52wov8ZG0i0RprTuv5Pvegg,Dewi Sri Hotel,-8.7174508,115.17648949999999,"Jalan Legian Kelod, Gang Troppozone, Kuta, Kec. Kuta, Kabupaten Badung, Bali 80361, Indonesia",https://maps.google.com/?cid=611064117321446566,OPERATIONAL,+62 361 752555,hotel,"hotel, lodging",4.2,603,,"I think this is more of a resort/chalet type rather than actual hotel. However their services were in no way lacking! Had so much fun staying here but the only thing to note is that there's also no lacking of mosquitoes in the room- which I'm sure flew in from outside but still😂😂 If I'm not wrong they did have a mosquitoes repellent in the room but I think we may need a few more 😂😂 Other than that, EVERY staff there has been extremely hospitable, friendly and welcoming! While this hotel is tucked away in a corner of Legian street, it's perfectly safe here and there's even security guard to keep it so.

As we walked back at night, we didn't worry as much as I thought we would. It is quite a convenient spot to stay in if you're travelling on your own. And though nightlife is bustling outside, you wouldn't be able to hear all the ruckus from the hotel, which is another bonus point!","This place was perfect for me because I like to travel on a budget without sacrificing comfort and privacy. I had a wonderful 10 days with them. The people who were here, staff and guests alike were chilled, unassuming, respectful and nice. They mostly come with a positive attitude which makes the atmosphere pleasant for everyone. Security guards were stationed at the entrance so I felt safe as a solo traveller.

15-20 mins walk to beachwalk mall where there’s a food court, restaurants, cafes including bubble tea shop, a bakery, cinema, a supermarket (to get yoghurt and cut fruits) etc.  This mall is in front of Kuta beach which isn’t that crowded if you come around 5pm.

Around the hotel, there’s a couple of halal eateries including Nasi Padang and Thai/Chinese food— coming from the hotel, they’re on the right, only a couple of mins after the Bali bomb monument.

There are many small alleyways/roads to explore with small restaurants/bars here.

My room was on the 4th floor corner. It’s really not that bad of a climb so I appreciate the daily exercise. It was quiet except last 2 nights when some loud tourists decided to chat in the middle of the night on the chairs outside their rooms. (Who does this, right?)  Pool’s great. Water temperature was nice. Maybe 15-18m in length for laps. There’s DJ playing some nights so the atmosphere was vibrant and fun. Hairdryer available upon request— I got mine from the reception.

There’s a fridge, the Aircon’s cold enough, bed was comfortable for me. The room and shower were both large and spacious. Good water pressure, toilet comes with bidet pipe.","Staff excellent & friendly.
Just a let down on maintenance from owner of business.  Leaks in bathroom.
Very low power, takes most of night to fully charge phone. We paid for couple room. Instead we got 2 single beds pushed together & no discount.  Not exceptable .","Beautiful older style hotel, tranquil setting, basic rooms but perfect for a cheap holiday. Staff very nice, very clean and tidy. Highly recommend location right next to Bali Memorial and main Kuta strip.","I stayed there 12 nights and my friends also in separate rooms . Second year for my friends to the same hotel spending a lot of money using all the facilities like massage , laundry , food and beverage .
We had discussed with them if they will be ok to leave 3 suitcases so that we go to Lombok island and they had told us yeah ok of course no problem … and in the end some hours before the pick up a lady with glasses in the reception said no it’s not possible and she gave a lot of drama even though it was promised that it would be fine. So they ruined our holidays to Lombok and we didn’t go as it’s not easy to move with this weight and we lost our money from our reservations in Lombok .
They are totally unprofessional in Dewi Sri with very poor communication skills and low customer service . Even by the pool you have to go to the bar to order as despite the fact that in the shift 4 -5 people are working they don’t even pay attention to the guests who need to order .
Unprofessional .
Only Lanang was helpful and smiley at all times ✖️"
ChIJ4S3GzLZG0i0RKiBKQTPVrQY,Rhadana Kuta Bali,-8.7181607,115.18105469999999,"Jl. Raya Kuta No.88, Kuta, Kec. Kuta, Kabupaten Badung, Bali 80361, Indonesia",https://maps.google.com/?cid=481275151313936426,OPERATIONAL,+62 361 755264,hotel,"hotel, lodging",4.5,1743,,"Helpful and friendly staff. Small room but big enough for the 2 of us and easy to cool down. Clean room, no smell whatsoever. Water boiler and refrigerator. TV. Vault. Small bathroom, but big enough for an overweighted European. Nice swimming pool. When your neighbour is not quiet you will hear it. Our reservation didn't include breakfast, so I can't comment on the food. 1.5 km to the beach and about 800 m to Mal Bali Galeria (mall). Restaurants and convenience stores in walking distance. I would stay here again.","We came back  to this place bcs of the amazing service we got 8 years back. The room check out was at 12. We were all packed and taking our luggage out at sharp 12.6 . Immediately the power went out and we had to drag our bags out in a pitch black room. We had to use our phone lights to check whether we left anything behind.As we conveyed our discomfort regarding the matter since it was only a six minute delay the response i got from the reception staff was""madam Welcome to bali here we do it this way"". For a place like bali only depending on tourism such a rude behaviour can never be tolerated. Mind u this is the only place we had such a bad experience.","CHICKEN TORTILLA = RP 10K ALREADY INCLUDE TAX !!!? HOW CHEAP !! Got business class room, Refrigerator on. TV on, great place although not spacy. Location in the middle of Kuta !  and it's calm and quiet. this place offers you more than just transit hotel !!","We were very happy with the choice of this hotel. We had some issues with Agoda not forwarding the booking in time but the hotel staff Mr.Merta was very helpful and even called Agoda to straighten things out.

The room was tidy, and cleaned every day, although small ants could be spotted in few places (but they could've hitchhiked with us from the previous place).

The pool was fortunately shaded from the sun and offered refreshment after the day at the beach. The facilities and design is quite modern but few places could be fixed - pool was missing some tiles and had exposed wire, fortunately no power.

There is about 1.7km walk to the beach, pavement almost all the way. The scooter rental can be found about 800m north as well.

Also recommend the breakfast buffet. Plenty of choice, fried rice, cereals, veggies, soups, toasts and sweets. We had an early flight and the staff brought us the breakfast to the room.

Overall great place for the money.","My reviews are always honest & genuine...by the Rules & Regulations.

Lots of noise in the hotel..day and night.

Hotel needs a very big renovation.

Staff needs to learn and know THAT when a hotel guest is ALREADY SITTING and EATING it is VERY VERY RUDE and DISRESPECTFUL to ask the PAYING HOTEL GUEST to GET UP and SIT ON THE OTHER SIDE OF THE LOBBY where the A.C. is NOT WORKING  !!! (RECEPTION ASKED ME to MOVE TO ANOTHER TABLE at the OTHER SIDE of the LOBBY where the A.C. is NOT WORKING because OF A NEW GROUP ALTHOUGH I was ALREADY SITTING and HAD ALREADY STARTED EATING MY FOOD and THE GROUP WAS ONLY 4 men and 5 women and there were 3 EMPTY TABLES...it was just so RUDE & DISRESPECTFUL)"
ChIJg-mt-bhG0i0R67HfqGuS7NM,Simpang Inn,-8.7157199,115.173728,"Jl. Raya Legian No.133, Kuta, Kec. Kuta, Kabupaten Badung, Bali 80361, Indonesia",https://maps.google.com/?cid=15270741427598897643,OPERATIONAL,+62 361 761306,hotel,"hotel, lodging",4,474,,"Positive stuff: the room sizes are great. Good location for walking to Kuta beach.

Negative: No sound proofing. If your room is on street side, forget about sleeping at night. If you are on third floor, you can barely have shower - water pressure is too low. Bathroom needs some maintenance. I was given only one room key but room had two guests. Will I stay again? - No.","Photos which are no google they uploaded are very very old.. Very poor hotel, staff has no manners to talk, if you are coming with Ur family and kids ... I will say please don't choose this.. very very dirty .. so many insects... Very bad breakfast.
Swimming pool water is so dirty and smells very bad
No hot water Kettle
No soap
No fridge
No shower caps
Towels are so dirty and smelly
There is Nothing.. means nothing
My learning after this is ""Pay little more but choose better..""","The room was big however it was dirty and the furniture need some maintenance, the bathroom was not the best, don’t get a room on the street side the bars are so loud you’ll get no sleep! Wifi didn’t work in the room.
The hotel pool was ok, looks bigger in pictures than in real life, is kids safe on one side but on the other extreme is really deep and there are no warnings","We coming here twice and the location very strategic in Kuta Bali. We loved this place, we met new friends when we're swimming there!","Having shower is a problem due to low water pressure in third floor. Toilets/bathroom need some maintenance. Only one key per room even though rooms can have two or more guests. No sound-proofing, you won't have much sleep if you are on street side."
ChIJLyph_9pG0i0RAvyL0qYwEdI,Troppo Zone Puri Rama Resort,-8.717471399999999,115.17514329999999,"Kuta, Badung Regency, Bali 80361, Indonesia",https://maps.google.com/?cid=15136933315624041474,OPERATIONAL,+62 361 751057,resort_hotel,"resort_hotel, hotel, lodging",3.7,373,,"Keeping in mind..we booked this place for $16 Australian Dollars. It is very tired and the rooms are very old and very dirty. We bought a bottle of bleach as soon as we checked in as the smell of urine was so overwhelming. This place really has potential, but money needs to be spent to bring it up to standard..
All that being said, there are quite a few people staying here so that speaks volumes..
The pool is sufficient and quite pretty..
The gardens are all overgrown and everything is just old and tired and dirty

In this location, this place COULD be amazing...","stayed for one night, hated every second. Had to sleep ontop of the covers and use my own makeshift pillow case because bed was filthy. staff were rude and unfriendly, we felt unsafe, the entire place needed TLC & everything was dirty and dusty. I wouldnt touch the kitchen with a ten foot pole.
Although, It did have a pool table though and it was very cheap.
There was also only 1 plug socket in the whole room and after an hour my plug was majorly overheating to the point that even after being unplugged for quite some time i couldnt touch it with my hands as it was so hot. the wifi also hardly worked","This place is the worst hotel I have ever stayed at! The rooms are absolutely filthy disgusting and are not cleaned. There was piss and pubes all over the toilet seat. Mold, mildew and dust everywhere. Rubbish all over the grounds. We saw our room and I demanded a refund immediately. RUN FOR YOUR LIVES! Don’t believe the 4 and 5 star reviews!!!","“Breakfast included” was toast with jam and a black instant coffee, so don’t expect much. I think the place was ok considering the low price, but still I cannot recommend (maybe if you are on a budget)
We met a guy from the personal that was very sweet and kind with us, Cheeky, great guy","The location is perfect (in the centre of Kuta and near to the airport) but the room is just ok for the price, also worth mentioning, the door handles of the room is just weird. Overall, if you really want to stay near the beach, worth trying. Architecture is Balinese."
ChIJvR0lvrBH0i0RyxmQMkT0kqg,BROTHER CLUB BALI,-8.7167671,115.17425899999998,"Jl. Raya Legian No.36, Kuta, Kec. Kuta, Bali, 80361, Indonesia",https://maps.google.com/?cid=12147039718714907083,OPERATIONAL,+62 812-5263-8399,night_club,night_club,4.4,144,,"I got hot dance sunday night, trully changing genres from arriving till lately midnite. a precious moment me time within my fav progressive then to a breakbeat.

snacks pls improve and lights so bright, but if you wanna a chill place to dance, this enough for.

cheers brothers.","Awesome staff,  great Shisha, dancers that will sit and have a drink with you but not at all pushy. Had a great night. Seemed to be more locals that tourists,  but that is a plus as well.",Sorry gays was I don't like I am fast time come and your surety gays me stop because I all buy bintang big jaat 4.5000  I don't come again,"Good place for chill out and they gv me strong cocktails 😘, very friendly staff, nice sexy dancer and great DJ","You will get scammed or they sure tried, I am sorry but this was worst Bali experience. Vodka they sell by glass is Smirnoff.

Would not recommend
Rubbish place"
ChIJ300U1AVH0i0RJNJVcwQbxqI,Superlative Gallery,-8.7155927,115.17396079999997,"Jl. Raya Legian No.99, Legian, Kec. Kuta, Kabupaten Badung, Bali 80361, Indonesia",https://maps.google.com/?cid=11729091985461858852,OPERATIONAL,,art_gallery,art_gallery,4.9,855,,"Superlative Gallery in Bali is an absolute gem! The architecture is a visual feast, seamlessly blending creativity and design. Walking through the gallery feels like stepping into a magical realm where each art piece tells a unique story. The atmosphere is truly enchanting.

What sets this gallery apart is not just the art but also the people behind it. The staff radiate humility and warmth, making the entire experience even more delightful. It's not just an art destination; it's a place where creativity and genuine connection converge.

Oh, and let's talk about the coffee—they've mastered the art of brewing as well! Don't forget to indulge in a cup while immersing yourself in the gallery's captivating ambiance. Superlative Gallery is a must-visit for art enthusiasts, architecture admirers, and anyone seeking a magical escape in Bali. ✨🎨☕️","As a purveyor of craftsmanship and art. This is a cool art gallery with physical art, merchandise and nft for viewing and even bid on opensea. Neat, cool place with lots of artistic vibe. Free entrance to public. Enjoyed the walk and scanning to see the bid price in search of something you might need.",Interesting contemporary art gallery. It’s great seeing what artist is on display. The current artist works in a variety of mediums having traditional and NFTs. It is paid ticket to enter but is super cheap and worth supporting the gallery.,"I want to tell you a little about the owner of this gallery, he is a talented artist who graduated from Trisakti University visual communication design, who is none other than my youngest brother, hehe, sorry bro, I just intend to introduce beautiful works of art to people about the beauty of high-value works of art.","As a travel reviewer and proud SSS holder, my visit to the Superlative Gallery in Bali was a testament to the seamless fusion of the digital and physical art realms. Having held a Superlative NFT for over a year, stepping into the gallery was like bringing the digital masterpiece to life.

The warm welcome and recognition as an SSS holder added an extra layer of pride to the experience. The gallery, adorned with a curated collection of NFT art, provided a visual feast that transcended the boundaries of the screen.

Superlative Gallery isn't just a space; it's a bridge between the digital and physical art worlds. For NFT enthusiasts and art lovers, it's a pilgrimage site where the tangible and intangible converge in a celebration of creativity.

As a proud holder, my visit to Superlative Gallery was more than just a tour—it was a reaffirmation of the boundless possibilities that arise when technology and artistry intertwine.

#WeLikeTheArt"
ChIJNyjQ67lG0i0Rr-cqlSYGzSI,Transera Kamini Legian Hotel,-8.7175769,115.1759088,"Jl. Raya Legian Jl. Legian Gg. Troppozone, Kuta, Kec. Kuta, Kabupaten Badung, Bali 80361, Indonesia",https://maps.google.com/?cid=2507667330296375215,OPERATIONAL,+62 361 761629,hotel,"hotel, lodging",4.1,395,,"Hotels looks very run down.
Toilet are dirty-looking.
The AC is not working properly.
There are alot of ants in the room.
There are alot of things needed to be upgraded & maintained at the hotel.

Good location though.
Staff are nice & helpful too.",Rooms are decent but AC in the room was too small for the size of room. So you won't get enough cooling and breakfast is average.. the bread was very hard and other rice and noodle items were not good.,"My stay at the hotel provided a mixed experience, garnering an overall 3-star rating. The service deserves a commendable 4 stars for its efficiency and attentiveness, ensuring a comfortable and enjoyable stay. The staff exhibited a high level of professionalism and responsiveness, contributing positively to the overall experience.

One standout feature was the hotel's prime location, earning a solid 5 stars. Situated in the heart of Bali, it provided convenient access to clubs, restaurants, shopping, and various entertainment options. This central positioning undoubtedly enhanced the stay, making exploration and leisure activities easily accessible.

However, the room itself received a more modest 3-star rating. While functional and clean, it lacked some of the finer touches that elevate a stay to a higher level. Room amenities were satisfactory but didn't quite match the expectations set by the excellent service and prime location.

In summary, the hotel offers a well-rounded experience with notable strengths in service and location. While the room may not reach the same heights, the overall stay was satisfactory, making it a reasonable choice for those prioritizing convenience and attentive service in the heart of Bali.",It’s in the central of kl. It’s nice including room service but rooms are smaller than in photos…,"I hit different places in Kuta, this one is very cheap and nice. The rooms are not very new and the service is basic but it's right behind the night main walking road, 2 blocks from the beach. And you have also a balcony or a patio if you are on the ground floor."
ChIJaTte67pG0i0RBmnrumrR8MA,M Boutique Hostel Legian,-8.7158974,115.17408959999999,"Jl. Raya Legian No.8M, Kuta, Kec. Kuta, Kabupaten Badung, Bali 80361, Indonesia",https://maps.google.com/?cid=13902842306025449734,OPERATIONAL,+62 361 4752589,hostel,"hostel, lodging",4.5,168,,"The staff are friendly. The bedroom is good, sleep comfortably, the air conditioner is cool, the bathroom is not very clean. But it's not bad. There are spots to sit, rest, work and eat. The accommodation does not provide food, but you can order food to eat. There is a rooftop terrace. At night, the atmosphere is good. But the daytime is quite hot.","+ Low fare (i got only 90k-99k). Solo backpacker heaven!
+ strategic location. Exact at legian street, without gang entry.
+ clean pod
+ complete personal need at your pod. Electric plug (all country), USB plug, personal lamp, towel, blanket, hanger, multifunction foldable table, curtain to make sure your private
+ has a roof top to relax or just sit along
+ has personal locker. Seems enough for 20"" case.
+ has complete needs at bathroom. Hairdryer (i didnt test it), mirror with magnifying feature
+ has a multifunction room at first floor. To work, read, or something else
+ totally walkable from and to Kuta Beach

- totally wasted wifi access. I use my mobile data all day here.
- no parking space. Specially for car. You know how narrow legian street, yo.
- shared bathroom and toilet. Thats mean, you accepted the risk of it. If you got unlucky, you could get tissue on flush toilet, digest remain on toilet (🤢). But if you lucky enough, it was a fun experience staying at.
PRO TIPS : just do the shower. Restrain yourself for pooping, or check the toilet first.. Please, use toilet seat sanitazer. Too many people sat there.
- stinky. Not from garbage, but from the clothsline or moist socks. As i write before, this is a shared bedroom. So ya thats it. But dont worry, it just at beginning you arrived.","Value for money absolutely, bed is great the blanket feels like home and the airconditioning is the best I had ever! But I am disappointed with the door and the locker beeping, the guests in my room was average age of 50. I am sorry but it should not be allowed as a hostel. It’s not the kind that is nice to meet and get a drink with like you expect in hostels, also weird Indonesian girl in my room who did things at night with perfume and used baby powder on her feet making the whole floor while. That’s why lots of hostels have age and no people from home county rule.","location is near some pubs so you might hear musics until midnight, so don't expect total silence. bedding and blanket was super nice, ac was cold enough. the only problem i got with them is a typical dorm thing: smells from other guests and/or the sands/dirt they are bringing to the room. we are supposed to leave the shoes on the shoe rack outside the room, but the hotel can't really enforce them to adhere 24/7. but other than that it was quite nice, will go back if I just need a bed to rest and nothing else. great value for money!","No wifi connection in the room, elevator isn’t available (someone stock inside for hour), there’s no one at reception even ringing bells, and customer is helping services at the time.

Indonesian girl who speaks English, she talked to me back in Indonesian and didn’t do anything to fix wifi !! So tired."
ChIJlTayucZG0i0ROlWsPu5R5tQ,Matahari Bungalow,-8.7153761,115.1739441,"Jl. Raya Legian No.210, Kuta, Kec. Kuta, Kabupaten Badung, Bali 80361, Indonesia",https://maps.google.com/?cid=15341039264379721018,OPERATIONAL,+62 361 751616,lodging,lodging,4.2,523,,"While it is a bit old, the room was pretty good and the resort is tidy overall. Very good price for the room, although it was a 'book now' to save. As per usual in Bali, the staff were very friendly. A good pool and lovely gardens. Great location on Legian St with easy access to bars, clubs and restaurants (and loads of Tattoo studios). No buffet breakfast. No gymnasium.","Love Matahari Bungalows!!! Great location if you want to be on Legian Street but also tucked back enough that you cant hear the commotion, its HUGE inside, massive green open areas, big pool with swim up bar and helpful security out front, will definitely be back :)","Handy location, friendly staff, great pool and surroundings. Kopi pot warung just over the road is great, with best black forest cake you are likely to find.","If you need somewhere to stay with beautiful, friendly staff, nice sized rooms with chilling air conditioning all at an extremely affordable cost, this place is perfect! Matahari is the only place I book at when I'm in Kuta. The staff personalise your visit and help with anything you need. The pool and swim up bar is perfect if you just want to relax. The food is delicious! Personal favorites are the eggs bene and the Pork Ribs. The location is perfectly situated on the main strip giving you access to restaurants, clubs, bars, salons, shopping, the works. Its only a short drive from the International Airport and I love it here so much. Absolutely would recommend this place to anyone and everyone!","“8/10 value of money”
Staff is great, hotel located Main Street, but also silent , nice pool, upper floor rooms are better, ground floor can be more noisy. some rooms , they do not provide kettle, but you can get hot water from restaurant. I had great 3 weeks there. 10 min by walk to beach and Beachwalk shopping centre. I can visit again and I will recommend my friends. Thank you"
