id,name,latitude,longitude,address,url,status,phone,primary-type,types,rating,rating-count,price-level,review 1,review 2,review 3,review 4,review 5
ChIJP2wGwsZG0i0R3pYaX6PwDUE,HARRIS Hotel & Residences Sunset Road - Bali,-8.7077165,115.1876017,"Jl. Pura Mertasari Jl. Sunset Road, Pemogan, Denpasar Selatan, Kota Denpasar, Bali 80361, Indonesia",https://maps.google.com/?cid=4687667371628467934,OPERATIONAL,+62 361 8947001,hotel,"hotel, lodging, restaurant, food",4.4,4494,,"This particular Harris hotel has recently built a new building to cater larger events with bigger ballrooms and meeting rooms capable to hold around 700 people on each ballroom.

Their room has been well-known to have a colourful vibrant yet simple clean and functional set up with considereable price of a city hotel.

Breakfast and food are always great and flawless on each business visit and vacation.","It was the birthday of the King of my country. Unbelievable, so much food there was. I don't think it's right, in a country where many people have difficulty getting food, to put so much food and snacks on the table.  is MADNESS, yes actually scandalous. And to know that this is at every NL Embassy all over the world... I have no words for it.","We booked not the cheapest room, but when we came we were obliged to pay extra, it is unclear why.
The room itself looks very dull and cheap, especially the entrance part, cheap sink, headset and the front door, behind which you can hear sounds.
It is not clear how to turn off the light on the balcony, and the lack of normal curtains, and as a consequence not complete darkness in the room at night
Very light cheap doors in the bathroom.
But a lot of nice little things, soap, shampoo, a good disposable toothbrush, toothpaste, slippers.
Great soft bed, but only 2 pillows.
And breakfast was very small and meager, 8 dishes, omelet, and some fruit and sweets.
Everything is only Indonesian.","Stayed here for a stop, but had a pleasant stay. Room was so comfortable and spacious. Amenities were great. Staffs were helpful. Lovely place","I stayed here and it wasn’t all the great. They repeated the towels. No new towels
were given in the room. After the first day they don’t give you toilet paper. I had to call every other day to ask for some. The buffet is not that good, but again it’s what you like. It’s $7 USD for buffet breakfast. Everyone is really nice, but problem solving is not something they’re good at."
ChIJyb1Lk0xH0i0RqV7Qi8NYA6M,Naiika Co-living,-8.708129300000001,115.18816950000001,"Jl. Sunset Road, Pemogan, Denpasar Selatan, Kota Denpasar, Bali 80361, Indonesia",https://maps.google.com/?cid=11746329849999941289,OPERATIONAL,+62 813-3723-8223,hotel,"hotel, lodging",4.7,13,,"I found Naiika Co Living just before I was scheduled for spinal cord surgery. The place was located close to Siloam Hospital, where I had my surgery performed.

I was first a little reluctant to ask to stay for just a month or two, fearing that I might want some help recovering from the surgery. Fortunately, the entire staff was really helpful and polite to me while I was there. They were also really kind to my homecare nurses. And the kitchen downstairs is a big help. Anything I wanted could be ordered, and it would be delivered right to my room. The best part, though, is how clean they are! I thoroughly enjoyed my time in Bali as a result.

In the end, I stayed from December until the beginning of February for a span of two months. I hope to be able to stay here once more when I have the opportunity to visit Bali. Suksma 🙏","Rented standard room for a month, only stay for 20 days. Overall, overpriced.

Good value:
+ Love the furniture and color pallete
+ disability friendly
+ good security system (24h security guard and access card for each level)
+ The smart tv has netflix in it (access/account not included)
+ 6 min walk to grand lucky (for groceries)

Bad value:
- 3.5 Mil Rupiah per month for standard room, and it is said that the rental price will increase by 500k in 2024. Extra 200k for room with view. Already include water and wifi. NOT INCLUDING car parking fees, electricity, pillow and blanket. So, bring your own. I spent 200k on electricity for 20 days.
- The only thing separating the bed and shower area is a curtain, so i had to deal with water spills and humidity after using the shower
- The shower head holder is too low. Im 5’4 and had to squad to take shower
- It took 20 mins for the hot water to come after turning on the water heater
- Once a week they will turn on the power house/generator which super loud. At this time, do not hang any clothes on the balcony, otherwise it will smell like smoke","New apartment, good neighborhood, staffs are friendly and helpful",,
ChIJP9lypRlB0i0RfEkuJceU0AA,Meru kost glogor carik Denpasar Bali Bulanan Full Fasilitas,-8.7038674,115.19051180000001,"Gg. Lavender Jl. Glogor Carik, Pemogan, Denpasar Selatan, Kota Denpasar, Bali 80229, Indonesia",https://maps.google.com/?cid=58710378199009660,OPERATIONAL,+62 812-6801-4091,lodging,lodging,4.7,25,,Nice place if you are looking for a room for Monthly rentals. Clean. New building. Free use of Gym. What else can you ask for.? Well a few more add ons but it's actually already good enough.,This place is great..  And it's have lax rules.. You can raise a pet here.. And have couple in a room too,nice,,
ChIJowYAMTNB0i0RdTpo-XwAkv0,Amrita Home Stay Bali,-8.7070952,115.18945399999998,"Jl. Glogor Carik No.81, Pemogan, Denpasar Selatan, Kota Denpasar, Bali 80221, Indonesia",https://maps.google.com/?cid=18271667174955825781,OPERATIONAL,+62 812-4644-061,private_guest_room,"private_guest_room, lodging",4.3,166,,"I stayed for 2 month.
The owner, Ketut, was a very kind person.
The owner and staff cleaned every morning and the apartment was always in good condition.
The kitchen is shared and the water is free. The room has air conditioning, TV, WiFi, refrigerator, large bathroom, hot / cold shower, table and king size bed. I have everything.

It was a really good place to live while feeling Bali. Whenever I return to Bali, I would like to stay here again.","Good place for stay. All staff so good, and everything very clean.","The place was awful, dirty and moldy walls, stench in the room and dirty bathroom. They probably didn't do any maintenance there since a very long time. As for me, I immediately ran away from there and would not recommend this place.","Good place, clean, friendly. Price is above average, and wifi was not working when I came in","Good place, recommend buat Budget minim👌"
ChIJM-IsJsZB0i0RQ3LBtzOIGBg,Kost Mahayana,-8.709329499999999,115.19018799999999,"Pemogan, Denpasar Selatan, Denpasar City, Bali 80221, Indonesia",https://maps.google.com/?cid=1736287412058944067,OPERATIONAL,+62 812-3941-490,private_guest_room,"private_guest_room, lodging",4.5,52,,4/5 - Nice,,,,
ChIJnQDBVctG0i0RF7yn-lOPQWg,Pusfa Harmony,-8.7076918,115.1886363,"Komplek Sunset Garden Blok K No. 8, Jalan Sunset Boulevard, Pemogan, Denpasar, Kota Denpasar, Bali 80221, Indonesia",https://maps.google.com/?cid=7512443244281052183,OPERATIONAL,+62 878-6201-2525,lodging,lodging,4.3,43,,Good Place and Nice Atmosfer,Nice to stay,Good place,Nice place,
ChIJWWxhy5VH0i0R7NXUV-0sBb8,Antara Sunset Road,-8.7055191,115.1882836,"Jalan Imambonjol Gang margapadmayana block c, no 99, Pemogan, Denpasar Selatan, Kota Denpasar, Bali 80221, Indonesia",https://maps.google.com/?cid=13764457234020226540,OPERATIONAL,+62 856-3773-111,hotel,"hotel, lodging",3.6,69,,The worst place I’ve stayed. Super dirty and the room is so moudly. DONT STAY HERE,"This “hotel” has been accepting booking from agoda but once we arrived they told us that they are not with agoda anymore. I have received a confirmation regarding booking and I have coordinated with them prior to arrival.

Location is in a small alley, one lane road. Cars/vans will have a hard time finding location. Avoid booking here if you can. Waste of money and time.","Just this week I witnessed two women from Europe attempt to stay at this place which they had a booking for. Antara and OYO are in partnership / have a contract for bookings. OYO takes bookings and payments on behalf of Antara but the contract ended a couple of months ago, however this is not communicated through to any customers. The owner and staff then demanded full payment again from these women late in the afternoon who were visibly upset and very tired after travelling from Ubud. No compassion was shown and no resolution to the problem was offered by the owner or management and respectfully out of principle, did not want to pay again for something that they already booked and paid for. Antara blamed OYO and said it was not their problem but this was not a last minute booking and OYO would have already received their commission for the booking and provided money and details to Antara. It was clear the owners and management of this place are just trying to scam people. Shame on you and this place does not deserve one star.
It also should be noted, when dealing with tourists, the staff, management and the owner need to have better skills and understanding in English. Either they legitimately lack the necessary skills to communicate or were just acting dumb as they had been caught out.
This place has had a few name changes in the past decade and it is clear as to why. Do yourself a favour and stay away. If you are looking for a nice and cheap place to stay, there are so many other places to go that deserve your business.","For the same price of guesthouse you could get better one.  There were no privacy, very unmaintained guesthouse, dirty towels, dirty toilet, water in pool was dirty too. The wifi was not working well. We stayed for 3 nights here. Breakfast was standart, i found hair in it . Hahaha...... I hope they improve all of this bugs","CHEATING!!!
at check-in: ""i don't accept the price (online booked). you can cancel (pay full price) or stay with 50% extra charge"".
afterwards: sorry, no english"
ChIJYZBwZwFB0i0RpS640aKirRg,!Geslim Cafe,-8.7070185,115.19240119999998,"Gg. Taman, pancingan timur, Denpasar Selatan, Kota Denpasar, Bali 80221, Indonesia",https://maps.google.com/?cid=1778256248068124325,CLOSED_TEMPORARILY,,restaurant,"restaurant, cafe, food",4.6,105,,"The place is new and clean, the food is good, but the menu is not up to date.

I have been there several times and each time they didn’t have the products/dishes, etc. Once I ate gado-gado without rice and paid the same price as a full dish.","They have indonesiam food, western food, coffee, smoothies, breakfast menu, and kids menu.
Mostly prices for food is between 30 - 65k.
For beverage is between 10 - 30k.

Good venue, vibes, and fresh.

Oh ya! They have mushola as well. No worries bout solat time!","We celebrate a birthday party for 50 pax. We pre-ordered and all food was ready right on time. The children's playground was a hit and they even let me bring a small bouncy castle. The cafe provided sound system. Great party, great atmosphere and GREAT SERVICE! Thank you!",The best place to hangout along the riverside. Nice food and drink. The staff are friendly and helpful.,"Great cafe, spacious, clean and airy. A good stop after walking along the grassy river bank. Good food, seating, service and parking."
ChIJ_4gZ6elB0i0RSpa1YWolxM0,Pondok Majapahit,-8.7086662,115.19174459999999,"Jl. Taman Pancing Timur No.99, Pemogan, Denpasar Selatan, Kota Denpasar, Bali 80361, Indonesia",https://maps.google.com/?cid=14827017012046566986,OPERATIONAL,,cottage,"cottage, lodging",4.4,43,,I don't know why but the water is a little salty,Good,Private,,
ChIJWSVNtjNB0i0RHW0Pva4--hc,Santi Bali Rental Mobil,-8.705287799999999,115.1932356,"Jl. Taman Pancing Timur, Pemogan, Denpasar Selatan, Kota Denpasar, Bali 80221, Indonesia",https://maps.google.com/?cid=1727762327267142941,OPERATIONAL,+62 821-4632-0344,car_rental,car_rental,4.7,124,,The driver is friendly and helpful. The car also quite clean and no unnecessary odour. Overall a nice experience.,"Generally was good, will be repeate order","Good Car and Good Service

* Komang",Over charge because of delayed flight 🥲,Good place to rent your car
ChIJd_D5Yj9B0i0RlKg_myfty5c,taman purnama,-8.7070802,115.1924126,"Gg. Karna Mawar No.3, Pemogan, Denpasar Selatan, Kota Denpasar, Bali 80221, Indonesia",https://maps.google.com/?cid=10938096874363529364,OPERATIONAL,,hostel,"hostel, lodging",4.8,8,,,,,,
ChIJbT9WsBdB0i0RGeP8_NbsUtM,Warung Hadsan,-8.704799099999999,115.19006270000001,"Jl. Glogor Carik, Pemogan, Denpasar Selatan, Kota Denpasar, Bali 80227, Indonesia",https://maps.google.com/?cid=15227493698204656409,OPERATIONAL,+62 878-8800-4488,cafe,"cafe, food",4.9,68,,We stayed in Seminyak a few weeks ago and found this little Warung down an alley. Lovely food and lovely staff. A definite must if your in the area.,"Best simple venue in South Denpasar so far! Vast selection of yummy food n drinks (I had chicken satay & Bintangs) and they have live acoustic performance on Fridays and Saturdays also.

Will come again for sure","Lovely food friendly staff, all volunteers, great service and atmosphere","Fantastic food, totally amazing atmosphere.

Live music was a brilliant bonus","Good atmosphere, good price, good people, good food.
Very friendly owner and staff.
Foods are delicious.
Recommended warung 👍"
ChIJyTGuMMtG0i0RwFjUmWI3wXY,Graha sandhi Kost Full Fasilitas,-8.7091772,115.18823559999998,"Jl. Pura Mertasari IV No.54, Pemogan, Denpasar Selatan, Kota Denpasar, Bali 80221, Indonesia",https://maps.google.com/?cid=8557181663607806144,OPERATIONAL,+62 819-9993-0457,,"hostel, hotel, lodging",4.2,56,,poor service,,,,
ChIJRfWctTRB0i0R8aBsMYfrpvk,Kos Komplit Glogor Carik,-8.708599699999999,115.18936780000001,"Jl. Glogor Carik No.704, Pemogan, Denpasar Selatan, Kota Denpasar, Bali 80119, Indonesia",https://maps.google.com/?cid=17989324727460339953,OPERATIONAL,+62 812-3600-5451,hotel,"hotel, lodging",4.1,17,,,,,,
ChIJk01HdXZB0i0RvFYgmUBBmKY,Juragan Seblak RD,-8.7058872,115.189539,"Jl. Glogor Carik No.91, Pemogan, Denpasar Selatan, Kota Denpasar, Bali 80221, Indonesia",https://maps.google.com/?cid=12004416552458802876,OPERATIONAL,+62 821-1787-9096,indonesian_restaurant,"indonesian_restaurant, restaurant, food",4.8,52,,The best Seblak in town!😍,thank you everything was delicious,,,
ChIJ-UgmozRB0i0RsI8D4NR6hAQ,Kost Griya Ayu,-8.70842,115.19034800000001,"Jl. Glogor Carik No.11 A, Pemogan, Denpasar Selatan, Kota Denpasar, Bali 80221, Indonesia",https://maps.google.com/?cid=325520127787503536,OPERATIONAL,,extended_stay_hotel,"extended_stay_hotel, hotel, lodging",4.6,14,,,,,,
ChIJW9vWvDNB0i0RZUuidg4myF4,Sri Tanjung,-8.705832599999999,115.19266060000001,"75VV+M37, Jl. Tukad Baru Timur, Pemogan, Denpasar Selatan, Kota Denpasar, Bali 80221, Indonesia",https://maps.google.com/?cid=6829750678469102437,OPERATIONAL,+62 821-4464-5917,extended_stay_hotel,"extended_stay_hotel, hotel, lodging",4.6,14,,,,,,
ChIJVYzslGFB0i0Rn4nH18PfCS0,Putri Bali Rental,-8.7042649,115.1906446,"Jl. Glogor Carik Gg. Nagamas No.8, Pemogan, Denpasar Selatan, Kota Denpasar, Bali 80221, Indonesia",https://maps.google.com/?cid=3245371038728948127,OPERATIONAL,+62 819-9953-3488,car_rental,car_rental,4.6,84,,"Had a really great experience renting with Putri Bali. Rented twice with them.

The cars were in great condition. There were existing scratches, just need to take note during the handover and they won’t charge you for it. The price is still in acceptable range.

The admin replied kindly and promptly. The delivery & pickup staff was very friendly and punctual.","I am a repeating paying customer. This trip they changed my vehicle 3 times in 4 days. Last day without notice and the car was infested with roaches. Disgusting and they did not want to take accountability at all, blaming previous user that left it in that condition. I guess the cars were never regularly cleaned. The owner even said that I used the car and did not want to pay. Rude and idiotic. Of course I wouldn’t pay for a car full of roaches. Mind you that it was only less than 30 mins into the trip and I went out of the car and called a grab.  I still graciously paid them half day fee because the driver is friendly and apologized, but the guy on the phone is just full of nonsense and I would definitely never use this company again.",The best rentcar in bali👍👍👍,It was from A-Z a great desicion to rent the car here. Really friendly and great prices! Thank you very much!,"Good choice,  the car is clean and well maintened,  very suitable to be a choice"
ChIJ8diZvzJB0i0R55B0F8DPSi4,Jaya Rasa Chinese Food Muslim,-8.7036025,115.190256,"Jl. Glogor Carik No.109, Pemogan, Denpasar Selatan, Kota Denpasar, Bali 80221, Indonesia",https://maps.google.com/?cid=3335706897955459303,OPERATIONAL,+62 857-3735-0951,chinese_restaurant,"chinese_restaurant, restaurant, food",4.7,61,PRICE_LEVEL_INEXPENSIVE,"the place could use a little bit of renovating. but the food, muahh *chef kiss*","Stumbled on this great little local warung on our way home from Carrefour on the road behind it.

We noticed it was quite active for a small local shop, and we were very hungry.

Now we can't stop going back, because of the combination of delicious food, low prices and friendly staff.

Everything we've tried has been good...

Our favorites so far are Ayam Lada Bawang and Ayam Garlick.

Whatever you order goes great with a couple ice teas - Es Teh Manis.

We'll miss these guys when we leave Bali.",Many many times visited this place and the foods here never failed! I like it!,alhamdulillah halal Chinese food,Hauce
ChIJG7ORLntB0i0RnusnAq1gVUo,Loft 99,-8.707663300000002,115.19079690000001,"Jl. Gelogor Indah IA No.99, Pemogan, Denpasar Selatan, Kota Denpasar, Bali 80221, Indonesia",https://maps.google.com/?cid=5356293628008852382,OPERATIONAL,+62 878-6206-3394,hotel,"hotel, lodging",4.1,21,,"Beautiful place to visit from the nails to the hair. We had a pleasant stay and we enjoyed our vacations a lot. Food was great hotel was great i loved the way peoples act there. There are several close destinations to ride and amazing nature to spend time in.
Finally i was lucky enough to find a lot of crazy moments there thank you for everything hope will see you again all.
I cant forget also how much more i have to write so i complete 200 letters letter.
Thank you for giving me the opportunity, much love",,,,
