id,name,latitude,longitude,address,url,status,phone,primary-type,types,rating,rating-count,price-level,review 1,review 2,review 3,review 4,review 5
ChIJ6wg0wEc90i0RjYSSL4MaWPA,The Ning Resort Ubud,-8.5006436,115.28166039999999,"Jl. Subak Banjar Sala, Pejeng Kawan, Kecamatan Ubud, Kabupaten Gianyar, Bali 80552, Indonesia",https://maps.google.com/?cid=17318621517794411661,OPERATIONAL,+62 361 4792200,resort_hotel,"resort_hotel, hotel, lodging",4.5,95,,The rooms were clean. But the restaurant had bugs all over the tables and there were only one waiters. The location is remotely tucked away in quiet and beautiful area which some locals have used to there favor and made a check point at the cross roads on the way to the hotel. Calling it ( local taxi ) which is Taxi mafia in all seriousness. The hotel is aware and didn’t do nothing and is also helping these horrible people. Even if you book a driver through grab they won’t let your driver pass the checkpoint!,"The room is quite big, clean and the facilities in the room is perfect.
The staff very friendly and helpful, the staff at the bar and restaurant are very kind and awesome coffee, cocktails and food are made as my request. They are go above and beyond to serve great food.
Location is a bit far, but the resort offers to picked up us. It's very great service.
Once you arrived you will forget the busy traffic and road. Only feel the nice nature, good views and enjoyable place for holiday.",We booked the resort last minute for one night off season so we had no trouble getting a spot. The resort is quite new and a bit tucked away so it was a bit tricky to find. The staff was very helpful and eager to improve and cater to their guests needs. We left at dawn and they were kind enough to pack our breakfast. The only negative experience we had was that there was no hot water in any of the bathrooms while we were there.,"We stayed for 2 nights si we could reste before going back to our country. Our room was very clean and bright with two balconies.
The personnel was very friendly but not always available.
We got no one to speak too when we needed a towel for the swimming pool. My partner asked several times if they could organise an romantic dinner like proposed in the services but although they said they were going to keep him informed, nothing happened.

Room service is easy to follow with an app, you receive a code but nothing shows you if the ordre is being prepared or not (see picture). I think there should be more information such as how long it normally takes or what to do with this code ? I waited one hour for one meal and drink (cold).

Breakfast is a menu where you can choose from several dishes, Sweet or salty. Only the croissant was industrial and very dry but all the rest was delicious. I ordered shakshuka egg, avo on toast, French toast, plâtrer of fruit.  You Can order as many dishes as you want but only at the restaurant. You Can not eat breakfast in your room.

They offer many other services but all are extra.","Exceptional service, amazing experience and the perfect place to cool down after a week of Canggu. Very welcoming staff, felt at home the minute we walked on the property.
Perfect for when you’re only interested in enjoying the hustle and bustle that Ubud can offer for a couple of hours and enjoy peace and quiet in the evening and morning. Would give 6 stars if the music playlist at the pool was more diverse.

Every single person of the staff was kind and caring, unreal experience!

Looking forward to coming back!"
ChIJV54BuWA90i0RRGlX3dS-ecc,Paon Bali Cooking Class,-8.5052468,115.2786786,"Jalan Raya Laplapan, Petulu, Ubud, Petulu, Kecamatan Ubud, Bali, 80552, Indonesia",https://maps.google.com/?cid=14373729507185486148,OPERATIONAL,+62 813-3793-9095,food,"tourist_attraction, food",4.9,1030,,"If you come to Ubud, I highly recommend taking a cooking class!!👍🏻👍🏻👍🏻

The course I participated in started with a visit to the local market at 8:30 in the morning, and then returned to the chef's home to learn how to prepare local cuisine and enjoy the  dishes we made for lunch. The whole process was incredibly fun. The chef and assistant were very humorous.
All processes are under control, and people who can’t cook can also participate.","What an amazing place.  Great driver, beautiful home, wonderful and kind people.  You cannot go wrong with this cooking class.  We had so much fun cooking together and meeting new friends from the UK and Germany.  The food we cooked was so delicious.  I love to cook and can’t wait to get back to the US and try some new dishes out.

The owner is a wonderful, kind woman with a contagious smile and energy.  If in Ubud it is a must do for a half day.","When you're in Ubud you must go to this cooking class. It's real traditional Balinese cooking in the home of this family. Very well organized, clean and spacious.
The chef is fantastic!!! She is 50% of the whole experience 😍
Amazing dishes and explained well.
Make sure you book this to have a lovely afternoon/evening.
Really recommend it.","We were picked up at 2.15 and arrived promptly at 3pm. We were joined by 10 other people all of varying nationalities, which made for an enjoyable dining experience.

My wife and I had such an fun experience learning and cooking some authentic dishes. Our host Puspa was so energetic and fun to cook with, she made it very simple to follow.

We were provided with a recipe book on exit and we are both looking forward to trying the dishes at home. If you're looking for a cooking class, this is the one you need to book!","The best experience ever! This cooking class is in a small village at the teachers home. Everyone is so welcoming and sweet. The teacher is a beautiful, kind, funny and helpful woman. We made different dishes which tasted amazing. Thank you so much for everything ❤️🙏"
ChIJKa7cHF490i0RaVY_lXvadvM,Angsoka Bungalow,-8.502243,115.277982,"Jl. Raya Laplapan Banjar Laplapan No.33, Petulu, Kecamatan Ubud, Kabupaten Gianyar, Bali 80571, Indonesia",https://maps.google.com/?cid=17543449622788134505,OPERATIONAL,+62 897-0870-745,resort_hotel,"resort_hotel, swimming_pool, sports_complex, hotel, lodging",4.9,145,,"A beautiful small place in the middle of the jungle. The deluxe double room has been extra ordinary great! The pool is amazing and has a fantastic view into the jungle!
The best was the staff with the superb service! I arrived with stomach problems and they took care of me and even provided medicine for me without asking - special thanks to Nina! 🙏
You just feel so welcome and comfortable, we highly recommend this place and we will come back when in Ubud.","This place is incredible. The room has a big floor to ceiling window /patio doors which faces directly into the jungle. They have a very nice infinity pool that gets sun most of the day, the apartments are spread out, so even though the place was fully booked it doesn’t feel like it’s busy. The place is family run and they are incredibly helpful and caring. The place is slightly outside Ubud centre, but you can get taxis in 5 minutes which take you into town very quickly. I am so happy I booked this place, and that I got to stay here. Thank you everyone at Angsoka Bungalow 🙏🙏🙏",Very nice and cozy space to be. It is so quiet and you have a beautiful view in to the nature. The stuff is soo kind and we enjoyed every day of our trip here. You can also rent a motorbike here.,We really enjoyed for our stay. The staffs are really kind and willing to help you. That's a very quiet hotel that you can enjoy and a great view from the pool. But always be aware of the insects in Bali if you will be here for the first time.,"What an experience !
We stayed 2 nights in the Angsoka Bungalow. Everything was absolutely amazing. If you are looking for a peaceful place in contact with nature that’s the place to be. The room was clean, really comfortable and we got an amazing view of the jungle from our balcony! We also loved to relax by the beautiful pool. The hotel is located outside the center of Ubud which is a good thing if you want a quiet place. You can reach it in 10min by taxi, grab, moto etc. It may be far by walking.
The staff was absolutely lovely and very professional, they could help us with everything we needed. We loved our stay and were so sad to leave. We will come back !"
ChIJixtUCV490i0R5Xu7H3Bk6tQ,Wijaya Guest House,-8.503440399999999,115.27840730000001,"Banjar Laplapan No.25, Petulu, Kecamatan Ubud, Kabupaten Gianyar, Bali 80552, Indonesia",https://maps.google.com/?cid=15342185513322511333,OPERATIONAL,+62 361 8987821,hotel,"hotel, lodging",4.5,189,,"Clean spacious room, very good breakfast, friendly staff, only few minutes on scooter from Ubud and very affordable prices.","The owner is building a new kitchen. I see bright future for this place. Staff are super polite and friendly.

Good privacy and clean rooms. You get what you pay for :)","Nice place! We had 1 night there, 3rd floor. Room is simple, comfortable, fresh. Good people, tasty breakfast. Excellent view! Thank you very much 👍❤️‍🔥✨","Cheap place to stay close to Ubud centre. Large complex that has seen better days, but priced accordingly.",Amazing place and super value for money! Great views from the balcony!  We stayed here both at the beginning and end of our trip to Bali. My only issue was the mattresses were covered in a synthetic leather covering which was not very comfy.
ChIJHZQMRF890i0RKPoDbDIqwHY,Sandat Glamping Tents,-8.4996566,115.28250119999998,"Jl. Subak Sala Banjar Sala Pejeng Kawan Ubud 80571, Pejeng Kawan, Kecamatan Ubud, Kabupaten Gianyar, Bali 80552, Indonesia",https://maps.google.com/?cid=8556885688052873768,OPERATIONAL,+62 821-4408-1998,hotel,"hotel, lodging",4.5,165,,"What a fantastic couple of days we spent at Sandat.  Everything was absolutely perfect.  The yoga studio, a terrace looking over the rice terraces, is incredible and Tengo, the instructor, was amazing.  If you want to practice yoga during your vacation this is absolutely the place.  Tengo teaches  every level and you will learn more with him in 1 hour than months in a studio.
The food is delicious and the staff warm and attentive.  The front desk helped us figuring out an itinerary that worked for our needs
We will definitely be back when in Ubud!","We really enjoyed our stay at luxury tent in the middle of jungle! We have never experienced something like this before, but we absolutely loved it! Our tent had stunning interior, beautiful bathroom and private pool with terrace 😍 Recommend floating breakfast - it’s amazing!","I had a delightful 2 nights weekend stay with my friend at Sandat Glamping resort in Ubud. Despite the rain, my experience there was enchanting. The diverse breakfast options, including delicious Balinese traditional food, added a flavorful touch to our mornings. Dinner at the resort's restaurant had a romantic atmosphere, illuminated by candles & the unique interior adorned with mirrors on the walls, created an beautiful setting.
My tent was adorned with a white tree, adorable purple sheets on the bed & thoughtfully designed details, which provided a cozy retreat. Highlight was a private pool just outside of our tent, accompanied by inviting sunbeds.
Surrounded by lush greenery, the resort truly felt like a jungle retreat, creating a serene backdrop for our stay. With a touch of luxury, Sandat Glamping is creating a perfect spot to unwind & soak up the serene ambiance. Whether relaxing in the private pool by the tent or enjoying a candlelit dinner, the presence of nature was a constant companion. With a touch of luxury, Sandat Glamping, nestled within this lush paradise is creating a perfect spot to unwind & soak up the serene ambiance.
A perfect blend of nature and comfort!","Definitely a beautiful Glamping tent. When visiting Ubud this is definitely a place you should stay. It's right outside the busyness so you have beautiful lush greens and peace and quiet. 5 minutes drive and you're on the main road of Ubud.

The restaurant is also stunning, and if you have a tast for Italian food it's the place to be.

Staff is also super friendly and helpful","The place is amazing.
From the location not far from the center, the interior design, the food, the service and the incredible vibes these Italians made out of a piece of forest

Met the owners, had quick chat with them. Really great experience in Ubud ❤️"
ChIJJSx63GA90i0Rq8urmKSDFbo,D'Tepi Ubud House,-8.5054844,115.2788392,"Jalan Raya Laplapan No. 60, F7WH+6CJ, Petulu, Ubud, Banjar Laplapan, Petulu, Kecamatan Ubud, Kabupaten Gianyar, Bali 80552, Indonesia",https://maps.google.com/?cid=13408768208524790699,OPERATIONAL,+62 821-4477-7298,,lodging,4.1,58,,"The view is great, and I enjoyed it every day! However, the place is old, and the bathroom isn’t very clean. On the positive side, the people are very nice. The photos are quite different from reality, which is disappointing. The place needs to be renovated, and the bathroom could be cleaned with special cleaning products. On the bright side, there wasn’t any bad smell, and the bedsheets were clean. However, the towels were old and in poor condition🥲","All very nice, good staff, good view, if you are looking take time with yourself and connect to nature this place is ideal for you, breakfast is so delicious","super nice view and quiet location. this is the one who sereve breakfast in traditional balinese style. room is tiny and cozy, furniture have pretty color matching with white wall.
family is so warm and friendly.
bottom hose in toilet is not available is unfortunate point for me.","Lovely homestay
Cheap price
The family owner was so welcoming and supportive
I rent a bike here for 80k per day
Breakfast included.
The view from balcony is amazing. Sleep and wake up in the sound of jungle and spring. Perfect.
Cant ask for more honestly.
15 minutes to downtown
Room 6 is definitely the best option there with the view.","The view here was by far the best among places I have ever stayed. And it was also the cheapest place I have stayed in Bali. It's really a place of power! Every time you see the river and the jungle from above, you hear all those sounds of water and wildlife and you get recharged immediately! Agung is a great host and she has a wonderful and very welcoming family. Just the view here is 100% worth staying. The value for money is unbeatable here. I don't remember 70% of the hotels I have stayed in, but this one and its view is in my heart for all my life."
ChIJhWn2An8X0i0REda3w3WE5Wc,The Namparan Villa,-8.4997329,115.28389849999999,"Sala, Jalan Subak Sala Banjar Laplapan, Pejeng Kawan, Kecamatan Ubud, Kabupaten Gianyar, Bali 80571, Indonesia",https://maps.google.com/?cid=7486535596902962705,OPERATIONAL,+62 877-6129-5761,,lodging,4.3,6,,"It's a beautiful villa in a nice place, I had the best night's sleep there in last 3 months. Unfortunately the owner is not very agreeable. He asked me to leave the villa within a day after I told him the shower has a strong sulphur smell. It's been one of the most unpleasant experiences and I'd advise staying somewhere else if you're looking for welcoming hosts.","Great place to stay in Ubud! Responsive and kind hosts will answer all your questions and solve any problem. Fantastic location overlooking the rice fields, quiet location, not noisy. I recommend)","The best place to stay in Ubud. Good and responsive hosts. If there are any problems, they are immediately corrected. They can recommend places to visit on the island and just chat. Definitely worth staying with them.",,
ChIJx2fzfxkX0i0RLo6Ela62e1E,Gold Cafe & Art Gallery,-8.5063762,115.28524850000001,"Banjar Tatiapi Kaja, F7VP+C3X, Pejeng Kawan, Tampaksiring, Gianyar Regency, Bali 80552, Indonesia",https://maps.google.com/?cid=5871487400156630574,OPERATIONAL,,lodging,lodging,4.7,11,,,,,,
ChIJXRvDazg90i0RVde49Yw2lQM,Pondok Bali Ubud,-8.5029531,115.27841749999999,"Jalan Darma Putra No.29, Ubud, Kecamatan Ubud, Kabupaten Gianyar, Bali 80571, Indonesia",https://maps.google.com/?cid=258172532689524565,OPERATIONAL,+62 852-3797-5866,,lodging,4.1,17,,"The room I booked have nice river view at second floor. And people were staying there also interesting.  hygiene level and inconvenience situation (I have to ask them tiny things like as tap water was not available, no bath towel, broken remote control or taps so on) wes not for me and I gave up staying there at the middle of itinerary. However, good family and wonderful location.",Came to here on February 2023. It was nice to have experience here with village view. Especially in the morning. Food was good and delicious. Good hospitality too 🙂,The staff is not available or reachable easily. Tried calling them so many times but no response. The roads to the hotel are also very crooked. And m sure a 4 wheelers would make it difficult to reach. Even their google location is incorrect and finding them at night is a lost cause. It almost spoiled my Bali trip when I was stuck in the middle of nowhere and I had to book another hotel at 5x cost as these people refuse to talk.,"Fun family, very helpful and friendly.
Breakfast is always very good, banana pancakes with fruit on the side",Value for money and Authentic and lovely people.
ChIJj8UXQ_U90i0RYpWPpNoQuus,Griya Private Villa,-8.5074415,115.28345999999999,"F7VM+29G, Pejeng Kawan, Tampaksiring, Gianyar Regency, Bali 80552, Indonesia",https://maps.google.com/?cid=16985907475831035234,OPERATIONAL,,lodging,lodging,4.5,11,,"We stayed in Griya villa for six weeks and had an amazing time. The owner and the staff, both named Putu, were very kind and helpful during our stay.

5mn drive to center Ubud. The villa has two nice and clean bedrooms with TV and AC. Outdoor kitchen and nice private pool.

Villa is right beside a rice field, so you can expect to meet lots of geckos and frogs. We will miss the two frogs, that we named Micheline and Jacqueline, that sleep under the kitchen bar every day.","Here is my sweet home. We live here 1,5 year. The owner of the villa is smart and caring, but not annoying. Everything is easy to solve. Tasty water. Quiet and beautiful. Friendly Spirits.",,,
ChIJV-NC6Uc90i0RC6YgaQ4ruEE,Pomelo Guesthouse,-8.5007009,115.27904759999998,"Jl. Cemp. Jl. Raya Laplapan, Petulu, Kecamatan Ubud, Kabupaten Gianyar, Bali 80552, Indonesia",https://maps.google.com/?cid=4735582349073360395,OPERATIONAL,+62 838-4698-1045,hotel,"hotel, guest_house, lodging",4.8,21,,"A very good place to stay!
I stayed here for 4 weeks and the family who run this guest house are so friendly, cheerful and will do everything well for you. Both the bathroom and the room are a good size, and you have what you need. My favorite place was the bench on the terrace with a view to the garden where there are many beautiful flowers. Here I was served breakfast every day, and there was a lot to choose from, and the pancakes were very good. Quiet and peaceful place, only a little noise between the rooms, which didn't bother me.
There is also a kitchen in the corner of the garden where you can cook your own food or store things in the fridge if you need it. Definitely a place I will stay at next time I come to Bali.","The place was a m a z i n g! More far from Ubud’s noise, but not too far so u reach everything by 15/20 min scooter drive.

The family (hosts) is just wonderful, fantastic and super, SUPER SUPER KIND and nice.

I will definately will try to come back exactly to this booking just because of the family and cozy room.

Rooms are very comfy, u have little patio, kitchen, ac, there is a little nice touch to design, so u rly feel like home there.

Recommend!","Amazing place, the place is hosted by a friendly family that go above and beyond to make sure you are having the best experience possible in Ubud, the location is also ecstatic with lots of rice fields around (unfortunately no free rice here), they serve an amazing breakfast on one hand there's the option to have banana pancakes with syrup or friend rice with some vegetables

Overall 10/10 experience and I would totally recommend

The only CON I would mention is the fact that if you are to speak to your family members on the other side of the planet and the time is very late you would have to take into considerations that other tourists next door will hear you, cause for some reason there's no isolation of the sound

Other than that, the place is stunning, spacious rooms, modern bathrooms, and the garden view is out of this world","We had only planned to stay a week, but the place was lovely and Kadek and his family are great hosts. We decided to stay for another 3 weeks.
We totally recommend this place, the breakfast is excellent, the best we've had in Bali hotels. Kadek and his family are very kind and helped us with anything we needed.
Cleaning is done every day, wifi is excellent. I work remotely and need a very strong connection and this was perfect.
We'll definitely be back.
Access to the city center is difficult on foot but they rent bikes for a reasonable price.
There's also a laundry nearby and a few restaurants within walking distance.","I really love here. I felt like this is my house because the family very lovely,friendly,helpful, take care of your stuff when you’re not at home.

This is my second time here
Room clean and nice big bathroom .
Nice breakfast.
Small lovely garden,also have kitchen if you want to cook.
have motorbike for rent too if you want.(from his neighbors.)

I recommend here is very nice place. I will come here again 🥰"
ChIJszcom8A90i0R0ptqa7q-ZeI,Bali Manggang Cooking Class,-8.502976799999999,115.27859839999999,"Banjar Laplapan No.29, Petulu, Kecamatan Ubud, Kabupaten Gianyar, Bali 80552, Indonesia",https://maps.google.com/?cid=16313654933094833106,OPERATIONAL,+62 812-3685-5050,food,"restaurant, food",4.9,525,,"Amazing experience 🤩 I recommend to everyone, we had very nice time, first we went to the market, see all the ingredients, then coffee plantation and then the cooking. Very personal approach, everything was explained and we cooked it. Nice location with beautiful jungle view, so you have not only cooking class but real Bali cultural experience 😍 Devi was a great teacher showed us everything ☺️. Also in the end we got all the receipts so we can cook at home?","It was a wonderful experience. Learning about a new cuisine was a delight, i enjoyed my time with the beautiful people i met there. The instructors were very nice and helpful. The food was delicious, and we got to take the recipes of what we cooked 😁. I highly recommend this place.","This was a WOW experience! We were picked up at our accommodation and driven to the class. The class was held by a lady and a man and both were so lovely! The dishes that we prepared were all delicious and we even had vegetarian options for me 😊
I would recommend this class to everyone, we simply had an experience that we will never forget! Hopefully we can recreate the dishes at home! Thank you for such an amazing day!","We really enjoyed our cooking class experience.
We were able to thoroughly go through all the ingredients and steps, and we made some really delicious dishes, our favourites being the chicken skewers with peanut satay sauce and banana dumplings.
I would recommend this activity to anyone who wants to know more about the local cuisine and to take some of that knowledge home with you.","we spent a lovely afternoon making a full meal together. Fried rice, fried egg noodles, curry, chicken satay, banana dumplings and more. The chef explained the ingredients, as well as substitutes we could use at home. We were guided through all the prep. Instructions were clear, and all the staff were friendly and helpful.

The final meal was delicious!

The location was also very interesting, in the back of a traditional Balian family compound. Not something you'd get to see otherwise."
