id,name,latitude,longitude,address,url,status,phone,primary-type,types,rating,rating-count,price-level,review 1,review 2,review 3,review 4,review 5
ChIJB8hh_ddB0i0RBmsB-UMsZfg,The District Eleven,-8.673938399999999,115.24397529999999,"Jl. Raya Puputan No.210, Sumerta Kelod, Kec. Denpasar Tim., Kota Denpasar, Bali 80239, Indonesia",https://maps.google.com/?cid=17898760964505955078,OPERATIONAL,+62 813-3728-0035,restaurant,"restaurant, food",4.7,359,,"Good Ambience and Hospitality,

The reason for me other than a good coffee was the hospitality that the servers gives to customers. Im feeling at home when im doing my work here.

Sometimes it get crowded at busy night, a recommended place for casual gathering woth your friends and family, because they also offers lunches and dinners.

For two people price will vary, you'll get charged for 70K - 100K IDR. Will come back, for sure.","best coffe shop in town, everything just perfect 💯💯","After immigration affairs nearby, we drop by this café for brunch/bfast. The outdoor seating is spacious but noisy from traffic. We sat inside, much more quiet and the aroma of coffee is simply heavenly. The barista are great, very enthusiastic and thoughtful. Food took a bit longer to arrive. At around 10:30am on weekdays, many young students and office workers drop by to rest and hang out. Must be local favorites too.","Chicken drumstick : crispy outside juicy inside
French fries : great
Hot tea no sugar : Love the minty taste.

Overall one of the best coffee to hang out. Just across  plaza renon.

Sleepy and chill during lunch, filled with youngster at night.","The food is delicious, coffee was great..been here more than once and found it better each time.. overall nice place with fair prices.."
ChIJXZKoxCRB0i0R4BYWsmNjv78,Sama Sama Yakiniku Japanese Restaurant Plaza Renon,-8.6732338,115.24378469999999,"Plaza Renon, Jl. Raya Puputan No.210, Renon, Denpasar Selatan, Kota Denpasar, Bali 80239, Indonesia",https://maps.google.com/?cid=13816871461636675296,OPERATIONAL,+62 812-3974-7019,japanese_restaurant,"japanese_restaurant, restaurant, food",4.8,1433,,Definitely worth the price even for awr 3. I chose set 3 since I thought I may not be able to eat but for a price they can offer both BBQ and shabu. Worth every cents.,"Tried a couple of dishes - miso ramen, spicy seafood ramen, katsudon, and California sushi. The food was okay, but I prefer the food at their other outlet in Nusa Dua. Seem more options. Staff were friendly.","Nestled within a shopping mall, this restaurant provided a genuine culinary experience and a delightful surprise.

We savored every bite. The dishes showcased exceptional quality, and the culinary expertise was evident in every preparation. We also indulged in cocktails and milkshakes, both of which were equally outstanding.

The service was remarkably efficient and attentive, swiftly catering to our every need.

In summary, a top-notch dining establishment offering excellent value for your money in the world of culinary delights.","Nusadua and Renon both had an amazing food & service
One of best place to celebrate a special occasion","Good meat, reasonable price, great service"
ChIJcYmK-1tA0i0RC7DQJz1tKM4,Puri Suranadi,-8.6738654,115.2435738,"Jl. Raya Puputan No.208, Renon, Denpasar Selatan, Kota Denpasar, Bali 80239, Indonesia",https://maps.google.com/?cid=14855243480310001675,OPERATIONAL,+62 851-0041-5117,indonesian_restaurant,"indonesian_restaurant, restaurant, food",4.4,391,PRICE_LEVEL_MODERATE,"Been here twice. The food is delicious at quite affordable prices. The place is comfortable with lots of plants. The service is also very good.  Sufficient parking space is available. I'll come again, no doubt.","Fantastic Taste! At a reasonable prices!

Go order ayam bakar taliwang madu if youre not a big fan of spicy food, my favorite!","Food is good. But a little bit smallish in portion. Service is a little bit slow, so please be prepare to wait a little bit. Seems to be popular amongst office workers from around the area. Meals for two was around close to 140k rups.","Resto, Locate inner city of Denpasar. Lombok cuisine. I love “ayam pelalah.” Almost most of food are spicy.",Lombok style wild chicken(spicy)
ChIJh3tzNABB0i0RqRCGlTfO5Io,Pesso Garden,-8.674032900000002,115.2495175,"Jl. Hang Tuah No.80X, Sanur Kaja, Denpasar Selatan, Kota Denpasar, Bali 80239, Indonesia",https://maps.google.com/?cid=10008351010051199145,OPERATIONAL,,restaurant,"restaurant, food",4.5,38,,"Food was ok. Staffs were acting like they were the coolest bunch of people. Seriously need to IMPROVE on their hospitality.

Those things were still pretty tolerable. But what disappoint me was during payment. THEY ROUND UP YOUR BILL WITHOUT PERMISSION. It’s really not about the money here, but it would be nice if the owners have some nice business ethics.

To round up your customer’s bill is definitely not a good gesture. Even mini marts asked their customers for permission when they want to round up the bill.",Nice place inside commercial garden. The food is OK but not that special and service too long for the kind of food they have. We're waiting for half an hour for a rice bowl and they're onky less than handful customer.,"Awesome services! Great place to have brunch, love the atmosphere with the garden also with their houseblend Coffee👍🏻",Thank You Pesso for a great dinner! The food was great and so the service🌟🌟🌟🌟🌟,"chill place, a suitable place to reflect"
ChIJTZ7ymU9A0i0REQnYHfGHYHA,Surya Guest House Sanur,-8.6789249,115.24887829999999,"Jalan Tukad Nyali Blok SMA6 No 8A Sanur, Sanur Kaja, Denpasar Selatan, Kota Denpasar, Bali 80227, Indonesia",https://maps.google.com/?cid=8097621599669717265,OPERATIONAL,+62 831-1448-6571,hotel,"hotel, lodging",4.8,54,,"Incredible accommodation with a beautiful design and a perfect pool.
The apartments are very spacious and well equipped.
We stayed for 3 and a half months and it was great.
The host is wonderful, very accommodating and there to help you.
The staff is adorable.
Don't hesitate if you're passing through Sanur.","Love this place, I keep coming back, very quite, clean, and friendly caretaker.","Awesome guest house, so far best quality in infonesia we have visited. Located in calmer part of Sanur, anyway lot of warungs and shops within walking distance. Rooms are spacious and super tidy. I have to mention awesome and confy beds with evennbetter pillows and bed linen! Staff is amazing. Great and clean pool as the whole area of the guest house. Highly recommended to stay here ;) Thanks to all the staff for a luxurious stay!","Because I am not looking for famous destination and more of enjoying my stay by going around town, eating local delicacies, my time is mostly on the street. This place offers a good, quiet, comfy place to rest. Being not in main street means you need to find your way in a little bit though.",Everything was basically great main reason I don't want to give this place a 5 star rating is it's location as it is positioned a fair way away from the beach. Besides that the place is well kept and the staff are nice!
ChIJAahqtNJB0i0RkSAOj0wAPWI,"ACK Fried Chicken Tukad Yeh Aya, Renon",-8.677285099999999,115.2441279,"Jl. Tukad Yeh Aya No.233, Renon, Denpasar Selatan, Kota Denpasar, Bali 80225, Indonesia",https://maps.google.com/?cid=7078814518113869969,OPERATIONAL,+62 877-7033-8401,fast_food_restaurant,"fast_food_restaurant, restaurant, food",3.7,45,,bad service ever,,,,
ChIJnQUhWOVB0i0R-0WwmnNNPos,Never Too Dizzy,-8.6724673,115.24463290000001,"Jl. Hayam Wuruk, Panjer, Kec. Denpasar Tim., Denpasar Timur, Bali 80235, Indonesia",https://maps.google.com/?cid=10033542178739865083,OPERATIONAL,+62 823-2288-2192,bar,"bar, restaurant, food",4.2,23,,"They have good arak infusions, delicious snacks, and a good ambiance. However, the cashier staff should stay at their station instead of frequently leaving, and they could curate better music for their event.","so sorry your place is not good for someone who coming alone.

i cant take alone those bottles all by myself.
ordered cocktail i thought ready but it does not.
okay another small bintang and then sold out.
and those large bintang and you cant even sell?

whats the point you do an event?

i just leave thanks",Nice,ALL GOOD🫶🏼,nice
