id,name,latitude,longitude,address,url,status,phone,primary-type,types,rating,rating-count,price-level,review 1,review 2,review 3,review 4,review 5
ChIJr5LUumBw0S0R39dh4p1rfW4,Buana Ecofarm Sanggalangit,-8.1760779,114.75582709999999,"RQF4+H88, Jalan Srikandi, Sanggalangit, Kec. Gerokgak, Kabupaten Buleleng, Bali 81155, Indonesia",https://maps.google.com/?cid=7961638042113005535,OPERATIONAL,+62 812-8009-1001,hotel,"hotel, lodging",4.4,25,,A true natural beauty in North Bali. Wonderful scenery and tasty foods. A quiet homestay is now available. Must try!,Hotel and farm in one location. Very quiet and nice. Nice staffs too,Nice place with beautiful scenery,,
ChIJKwDa-SNx0S0RoaTWQQg7zn4,Rumah carreba,-8.1750347,114.7523671,"RQF2+XWQ, Jl. Sekartaji, Sanggalangit, Kec. Gerokgak, Kabupaten Buleleng, Bali 81155, Indonesia",https://maps.google.com/?cid=9137305600631678113,OPERATIONAL,+62 822-3738-6125,lodging,lodging,4.3,3,,Good,Top,,,
ChIJjYlhNgBx0S0RrsJJTXmuqSQ,Kebun Andra,-8.1741494,114.75477859999998,"RQG3+8WR, Sanggalangit, Gerokgak, Buleleng Regency, Bali 81155, Indonesia",https://maps.google.com/?cid=2641834492440461998,OPERATIONAL,,park,park,5,1,,,,,,
ChIJ71VlKxhx0S0RfQNgdkYJYok,Aini home,-8.1773869,114.7530635,"RQF3+364, Jl. Sekartaji, Sanggalangit, Kec. Gerokgak, Kabupaten Buleleng, Bali 81155, Indonesia",https://maps.google.com/?cid=9899485129152136061,OPERATIONAL,,hotel,"hotel, lodging",,,,,,,,
ChIJkTMiCcZx0S0RVFkWGGdAFoE,Yous carrembo,-8.1729902,114.75162429999999,"RQG2+RJ5, Musi, Gerokgak, Buleleng Regency, Bali 81155, Indonesia",https://maps.google.com/?cid=9301692891910265172,OPERATIONAL,,,lodging,,,,,,,,
