id,name,latitude,longitude,address,url,status,phone,primary-type,types,rating,rating-count,price-level,review 1,review 2,review 3,review 4,review 5
ChIJl_KtuGQw0i0RHJQbTvXlPFg,The Sanyas Retreat,-8.532264699999999,115.0826139,"Br. Dukuh, Desa Baturiti, Baturiti, Kec. Kerambitan, Kabupaten Tabanan, Bali 80361, Indonesia",https://maps.google.com/?cid=6358209615680476188,OPERATIONAL,+62 361 3005800,hotel,"hotel, lodging",4.4,64,,"What a place to stay, beautiful,  so much bali creature,  magnificent gardens ❤️,  lovely views and amazing staff,  so friendly and always say hello, Ayu, the manager, always had a smile 😃 and nothing was ever a problem , very attentive.
Have booked for our next adventure in December, can't wait. AAA.","Beautiful place, peaceful and quiet. The view is wonderful. The air is fresh and clean. The people are friendly and helpful.",This is a complete villa for retreat. They have a unique set of balinese style of home. In the center of paddy make a fresh air in the morning.,The location was great and food waa great too. Villas were spacious and good also. Staff were friendly and helpful. All around great experience,Hiden hotel in Tabanan regency west Denpasar Bali with a marveilleus rice paddy view
ChIJVVVVlWQw0i0RT9xAqiwibj8,Warung Babi Guling Biang Sayu,-8.5316578,115.0807624,"F39J+88J Br, Desa, Baturiti, Kec. Kerambitan, Kabupaten Tabanan, Bali 82161, Indonesia",https://maps.google.com/?cid=4570628247057914959,OPERATIONAL,+62 878-6288-9844,indonesian_restaurant,"indonesian_restaurant, restaurant, food",5,2,,,,,,
ChIJecA815Mx0i0RraysDur9DKA,Tegal project,-8.5372968,115.0854352,"F37P+35M, Baturiti, Kerambitan, Tabanan Regency, Bali 82181, Indonesia",https://maps.google.com/?cid=11532871927499369645,OPERATIONAL,+62 819-9949-8535,hostel,"hostel, lodging",5,14,,"We stayed here for 1 week as a couple and it was amazing. There are tents just at the lap of the nature. There are many coconut trees around and we have met many other foreigners.

Kadek & his girlfriend are really a very good host. Highly recommended if you are going Bali, must stay it visit this place.
You will also learn about organic farming and a lot about Balinese culture.","Stayed at Tegal project in the first week of June...Enjoyed a lot with Kadek & his family..if you like nature and countryside then you will fall in love with this place. We did yoga, played games, went to waterfalls, and explored the real Bali.

I wish all the best for organic farming project. Recommended for backpackers & nature seekers.","Great people who are giving a lot for the future of the children in the small villages.
The new Must-see place in Bali when u enjoy staying away from tourists!
If you are lucky you get the chance to see west Bali with its beautiful temples and beaches :) if you are not lucky with that you are still lucky because this place Is amazing to chill, to learn about the Balinese culture and how to cook :D",What an incredible place to visit! Kadek and his family were very welcoming and showed me many amazing places that I wouldn't have ever known about. I would recommend this to anyone who would like to experience the true beauty of Bali and learn about Balinese culture!,"The best things what happened to me, it's happened in Tegal Project! I spend almost 1 month with this amazing family and enjoy with the every moment 🤗 cause i always feels like i'm in my own house❣️words are not enough to explain my experience and feelings, but actually the most important thing that i learn in Tegal Project words, colors and languages are meaningless. I miss you guys every minute and pretty sure i will back to my home again🙏 Loves and kisses 😘"
ChIJ6YePgJIx0i0R4uSbeXWca48,Wedding Agus & Kharisma,-8.537557699999999,115.085595,"Br.Dinas Kukuh Kangin, Kukuh, Kec. Kerambitan, Kabupaten Tabanan, Bali 82181, Indonesia",https://maps.google.com/?cid=10334525798297101538,OPERATIONAL,,,lodging,,,,,,,,
ChIJ82XWGH0w0i0RSpWPslqPmoQ,Warung Viko,-8.5356426,115.08384329999998,"F37M+PGW, Baturiti, Kerambitan, Tabanan Regency, Bali 82181, Indonesia",https://maps.google.com/?cid=9555107179125511498,OPERATIONAL,,restaurant,"restaurant, food",5,1,,,,,,
ChIJkUz1qQIx0i0RHq-aJI-eXJ8,Vally of love,-8.531729499999999,115.08070149999998,"Banjar mundukcatu, F39J+874, Baturiti, Kec. Kerambitan, Kabupaten Tabanan, Bali, Indonesia",https://maps.google.com/?cid=11483227487519551262,OPERATIONAL,,park,park,,,,,,,,
