id,name,latitude,longitude,address,url,status,phone,primary-type,types,rating,rating-count,price-level,review 1,review 2,review 3,review 4,review 5
ChIJC_3cKLdz0i0RzwvBAt81wz8,Māua Nusa Penida,-8.702555199999999,115.47528179999999,"Sakti, Nusa Penida, Klungkung Regency, Bali 80771, Indonesia",https://maps.google.com/?cid=4594575276788222927,OPERATIONAL,+62 361 6208999,resort_hotel,"resort_hotel, hotel, lodging",4.8,367,,"We had a lovely experience at Maua this past week where we spent a portion of our honeymoon. The rooms are exceptional- beds were so comfortable and when they say private pool they mean it, this place boasts tranquility and privacy and it does not disappoint. The staff were so attentive and kind. The plants were perfectly manicured. We even saw monkeys from our private pool. The shower and sink placement outside were amazing. Beware that it is a journey to get to the resort from the harbor, so plan to come here as a retreat and don’t plan to walk to other restaurants and you can only scooter if you are pretty experienced. It’s truly a luxury retreat resort.

One recommendation I would make is to offer more options on the restaurant menu. They did offer some buffets which were a good touch.

I have celiac and I was kind of relying on the hotel restaurant to cater to gluten free options, which they did for the most part. However, there was a great deal of confusion in how the menu was labeled gluten free and I’m lucky the staff knew to advise otherwise so I wouldn’t get sick. I would expect the menu to be labeled correctly and for the food to be a little better for a five star resort. But I must say all of the staff were incredible and so so helpful.","The staff were amazing, and all the food I had was excellent. Honestly, I'm not a fan of hotels that serve buffet-style breakfast because I don't eat much, and I prefer higher-quality food. That's why I loved that this resort served better quality main meals. Additionally, each room having its own pool was a fantastic feature, so I didn't have to go to the main pool. During my stay, I was there to celebrate my birthday, and many staff members surprised me without prior notice, which made me extremely happy. I thoroughly enjoyed my time there, so if you ever have the chance to visit or stay overnight in Nusa Penida, I highly recommend staying there.",I had an amazing stay!! Everything was perfect. My wonderful guide Janta made sure my friend and I had the best day and showed us all the beautiful places on the island! Would love to come back soon.,"Place was gorgeous. What was advertised was different to the villa we got, wasn’t the view we saw advertised. But everything was great. Peaceful and quiet. Villas seems close but it’s actually very well built with tress surrounding it which makes it peaceful and private. Air con is the best. But you would need to hire scooter whilst staying there because it’s up the top of mountain and walking is a bit hard. There’s hidden places to eat and shops but if you don’t know the area you would only eat at their restaurant with not much varieties on menu but don’t get me  wrong menu is good but like I said need a scooter to get around so you don’t get stuck just eating at Villa. Other I wise I would certainly recommend this place to anyone. Everything was great. The front reception workers were so friendly and helpful. Even restaurant workers were great. I would definitely stay again but would definitely hire a scooter for my whole stay.","Had a wonderful experience at this place. Unfortunately, my wife was sick for all our time at Nusa Penida, but the hotel staff made just everything to make her stay as comfortable as possible. We were really impressed by the support that everyone gave us, and other hotel facilities were same as nice. The villas are nice and comfortable, the breakfast is also great. Definitely recommend and will return in case we visit Nusa Penida once again!"
ChIJT0RN5PFz0i0R6I_ocPQqmkc,Sundi hill cottage,-8.696869399999999,115.4775913,"Unnamed Road, 8F3H+724, Sakti, Kec. Nusa Penida, Kabupaten Klungkung, Bali 80771, Indonesia",https://maps.google.com/?cid=5159483552461000680,OPERATIONAL,+62 813-3887-2024,lodging,lodging,4.4,99,,"Lovely cottages with friendly staff. Clean rooms, super comfortable bed. Good size and clean pool. We enjoyed a nice peaceful 2 night stay. I wish we could've stayed longer. 10min away from the harbor. Only 5min away from Amarta Penida restaurant. Mini marts 7min away. Hotel offers bike rental and taxi service.","Beautiful location, a little out of the way, but honestly so relaxing and quiet.
AC works great. Only thing we didn’t love was the pillows being rock solid (I’m a soft pillow girl). The road here is pretty rough, but still accessible. The pool is beautiful and staff are lovely & welcoming & give good recommendations!","We had great days there ! Calm place and personal here for you if you need anything, I recommend 100% !","Beautiful rooms, nice pool and calm area!","We had a pleasent stay during low season. With low season discount via Booking it was a very good offer. Nice pool, nice Cottage, friendly staff.
Road or better gravel road is to the cottage is very challenging with the scooter."
ChIJ0a1geeZz0i0RKC4O3luiIxw,Tunjung Kuning Cottage,-8.6961529,115.4775511,"8F3H+G2M, Sakti, Nusa Penida, Klungkung Regency, Bali 80771, Indonesia",https://maps.google.com/?cid=2027642772698050088,OPERATIONAL,,,lodging,4.8,58,,Had a wonderful stay. Very clean and spacious rooms. There are only a few bungalows so it was very quiet and calm. Alan is the best host and made me feel at home. Staying in this cottage and discovering Nusa Penida was definitely the highlight of my Bali trip.,"Nice place with four detached rooms with double bed, bedside tables and lamps, dresser, and semi-outdoor bathroom area. Clean with a nice clean pool and breakfast service. Staff are very friendly. Is located in the middle of nowhere so needs an expensive taxi or car hire to reach, not much around it, so if you like secluded that's good but if you're a tourist it's hard to reach. I don't mind house geckos but there are a lot here and they poop on the floor a lot which is annoying. Found three scorpions in the room which was very cool but I'd rather they were outside 😂 Also found a brahminy blind snake in the room which was awesome! Don't know how he got in through, so put him outside in the flowerbed.","Stayed here oktober 2023. Allan was a great host and helped our group out with everything. Scooterrental, ride back to the harbour, local tips etc.
We had 3 out of the 4 houses, and everything in all houses where great. Clean, big, good airco, good matrass and safe.
Can only recommand!","Rooms are amazingly spacious, very cool with the AC and the bathroom is huge. Shower is good. They help with a taxi from the port also. Laundry and motorbike rental is offered here (we used both and were pleased with what we received). The pool is very clean and is just generally nice. This place is a bit out of the way from things and the initial road to get here is very dodgy, if you are not confident on a bike then this place probably is not for you. However, the staff are so helpful and friendly and the place is just amazing.","This place has our heart. We stayed at some beautiful properties on our trip to Bali but this small cottage has our heart. The cottage is smal, precise and has everything you need on this wonderful island. Allan was amazing, very helpful, very hospitable and always keen to help. I would totally recommend this place."
ChIJ03eVxw9z0i0RWlFGgKPIJdQ,KŌWHAI Restaurant - Nusa Penida,-8.7025508,115.4752531,"Sakti, Nusa Penida, Klungkung Regency, Bali, Indonesia",https://maps.google.com/?cid=15286845114736333146,OPERATIONAL,+62 811-3800-8999,restaurant,"restaurant, breakfast_restaurant, food",4.7,60,,"5 out of 5, nothing to criticize here. Please don‘t change anything, it‘s perfect as it it.
Food was delicious, atmosphere and view is beautiful, service is on point. Better than 95% of the restaurants in my homeland Switzerland.
We had appetizers, drinks, main dishes, dessert and coffee/tea","This was the main restaurant that we ate in. They had a three different buffets the week we were there and we enjoyed them all. The breakfast was my favorite meal there. The detox smoothie bowl was amazing and so was the French toast.
We did lunch in our room one day and that was great as well.
The staff is absolutely the BEST service ever. They are always on top of everything and remember what you like when you have been there couple days. Excellent service.","Great place for breakfast, we haven’t stayed here but have found ourselves back for breakfast each morning. Stunning views and great staff:) would recommend.","The place is lovely, the staff is really friendly and caring. The manager also took time to welcome us and talk a little bit with us. The food was really good and for great prices. We would think since it’s a 5 stars hotel that the restaurant would be more on the high end but it’s really affordable! Thanks for having us☺️","Amazing Restaurant, Management and chef’s Adli is wonderful

The view is incredible

A must visit restaurant 🤤"
ChIJLeR2wr9z0i0RFk2zuojbYFo,Abian selumbung bugalow,-8.702619799999999,115.47496950000001,"7FWG+V5V, Jl. Banjar Pangi, Sakti, Kec. Nusa Penida, Kabupaten Klungkung, Bali 80771, Indonesia",https://maps.google.com/?cid=6512446441472085270,OPERATIONAL,,bed_and_breakfast,"bed_and_breakfast, lodging",5,23,,"Exceptional stay, great views and a humble host. This stay made our Nusa Penida trip really memorable. Do not miss Gamat Bay nearby.","We stayed for 3 nights, great laid back vibe. Very clean & comfortable. Scooter is highly recommended just take care on the last few roads which are dirt & a little bumpy. Nice views across the banana plantations.

Great value for money & nice location close to Crystal Bay, plenty of food options within a 5-10 min scooter ride 🛵","Perfect stay 👌 helpful and friendly host, clean room, good air-conditioned, good bed, awesome view. Early breakfast before snorkeling tour was no problem. The nearest beach is minutes away on a scooter. The host can tell you where to go. Definitely check the beach out, it's awesome.","We stayed here for 3 nights and the bungalows are very nice. Everything was clean, and the view was beautiful. The owner was very welcoming and helped whenever we had questions. The only downside is that there is not much around, and you need a scooter, car, or taxi.","As an really experienced traveler who has stayed at +200 places I can say: Best place in Nusa Penida for a great price. Besides the price, something which is priceless is the host - Wayan is such a helpful and nice person. Beautiful oceanview & super quiet location. So welcoming and kind! Looking forward coming back to this place :)"
ChIJTU53AQVz0i0Rc7BPsWFL8tY,"Puri Penida Hostel, Nusa Penida",-8.695763699999999,115.4756521,"Jalan Cedok Gede, Banjar Anyar, Dusun Sebunibus, Sakti, Kec. Nusa Penida, Kabupaten Klungkung, Bali 80771, Indonesia",https://maps.google.com/?cid=15488524951439257715,OPERATIONAL,+62 823-4057-8151,hostel,"hostel, lodging",5,2,,,,,,
ChIJj91NVh9z0i0RZbhtRhIztY4,Sundi hill restaurant bar & grill,-8.6969712,115.47755780000001,"Unnamed Road, 8F3H+627, Sakti, Kec. Nusa Penida, Kabupaten Klungkung, Bali 80771, Indonesia",https://maps.google.com/?cid=10283181477754419301,OPERATIONAL,,restaurant,"restaurant, food",5,11,,Fried Noodles with tempeh were really good! And served very fast.,"Nice food,lets join here for get some food and drink
The staff hospitality","Great food, i love eggnivora muachhhh😘",,
ChIJy0W3FItz0i0RtTugg5mmXYM,Aroha Bar - Nusa Penida,-8.7025119,115.4752652,"Sakti, Nusa Penida, Klungkung Regency, Bali, Indonesia",https://maps.google.com/?cid=9465905170071174069,OPERATIONAL,+62 811-3800-8999,bar,"bar, cafe, food",5,28,,"Just found this place on the island of penida..good drinks..and the place was perfect for just chill to spent your day..
The snack and view was great..you guys can just lay down on the sunbed then chilling yourself in the pool with magnificent landscape view of Mount agung...",The best cocktail ever. The pool was so great and it open for public.,"The ambience was outstanding, we really amazed of the staff service and quality of product 👍🏻👍🏻 Definitely back!",Stunning view over the huge pool with variety of drink,"totally amazing, the drinks, the service are superb."
ChIJ226HfaFz0i0RWmlVOAZOm20,Bukit Ipiel,-8.697467999999999,115.478245,"8F3H+2C, Sakti, Nusa Penida, Klungkung Regency, Bali 80771, Indonesia",https://maps.google.com/?cid=7897992160146188634,OPERATIONAL,,hiking_area,"hiking_area, park",,,,,,,,
ChIJTQUpqfZz0i0RvpzdKZY_SS4,Song Lawah Desa Sakti,-8.7012882,115.4817997,"Sakti, Nusa Penida, Klungkung Regency, Bali 80771, Indonesia",https://maps.google.com/?cid=3335266913224596670,OPERATIONAL,,hiking_area,"hiking_area, park",,,,,,,,
ChIJybkDbABx0i0RBgE0Dn4wUTE,Apsarri Private Villa,-8.6962649,115.4775571,"8F3H+F2V, Sakti, Nusa Penida, Klungkung Regency, Bali 80771, Indonesia",https://maps.google.com/?cid=3553674898934333702,OPERATIONAL,,hotel,"hotel, lodging",5,14,,"Cozy room with private pool, bathtub, balcony, mini kitchen & quiet location","Service n room so good 🌟🌟🌟🌟🌟
Will be back again",Nice villa,,
