id,name,latitude,longitude,address,url,status,phone,primary-type,types,rating,rating-count,price-level,review 1,review 2,review 3,review 4,review 5
ChIJl0flsL8w0i0RvFbxHusNAEY,Balae Banjar Penarukan Tengah Kaja,-8.5605107,115.07269139999998,"C3QF+Q3W, Penarukan, Kerambitan, Tabanan Regency, Bali 82161, Indonesia",https://maps.google.com/?cid=5044046886142564028,OPERATIONAL,,museum,museum,4.1,25,,"The village is quite clean, you can still see the dawah, even though the highway is typical of the streets in Bali in general.",My home town,,,
ChIJlQEzoIEx0i0RmzGnfpcVm0g,Karangsuheng homestay,-8.5563591,115.07156859999999,"C3VC+FJ4, Jl. Penarukan Kaja, Penarukan, Kec. Kerambitan, Kabupaten Tabanan, Bali 82161, Indonesia",https://maps.google.com/?cid=5231799132530094491,OPERATIONAL,,hostel,"hostel, lodging",5,1,,,,,,
ChIJB8pcr-Ax0i0RsdE5HRLWMCg,Rumah Desak Dwi,-8.560544499999999,115.07182689999999,"Banjar Penarukan Tengah Kaja, Penarukan, Kec. Kerambitan, Kabupaten Tabanan, Bali 82161, Indonesia",https://maps.google.com/?cid=2896049933687312817,OPERATIONAL,,,lodging,,,,,,,,
ChIJf39KNIYx0i0RVoRK05XJCUE,Bakso Ayam Raja Rasa,-8.5601361,115.0718538,"C3QC+WPX, Penarukan, Kerambitan, Tabanan Regency, Bali 66261, Indonesia",https://maps.google.com/?cid=4686498532587897942,OPERATIONAL,+62 881-0367-67567,indonesian_restaurant,"indonesian_restaurant, restaurant, food",,,,,,,,
ChIJMRfOHYwx0i0RnppRsLQJHGk,Wr.Grojog,-8.5602159,115.07089200000001,"C3QC+W96, Jl. Penarukan Kaja, Penarukan, Kec. Kerambitan, Kabupaten Tabanan, Bali 82161, Indonesia",https://maps.google.com/?cid=7573939344987232926,OPERATIONAL,,coffee_shop,"coffee_shop, cafe, store, food",,,,,,,,
ChIJZQoL0r8w0i0R3rpsAgdCyXQ,Warung Blokek Salty Spitoon,-8.5592074,115.07307259999999,"C3RF+868, Penarukan, Kerambitan, Tabanan Regency, Bali 82161, Indonesia",https://maps.google.com/?cid=8415329976591366878,OPERATIONAL,,cafe,"cafe, food",4.9,7,,Top,,,,
ChIJbyJzQaEx0i0R2xdUOwj8VQY,Warung Sawah Jopeng,-8.5591257,115.0718857,"C3RC+8QR, Penarukan, Kerambitan, Tabanan Regency, Bali 82161, Indonesia",https://maps.google.com/?cid=456548049533278171,OPERATIONAL,,coffee_shop,"coffee_shop, cafe, store, food",,,,,,,,
ChIJFbpo84Ix0i0RT0RWrwGuwp4,Warung Tu Aldi,-8.557535999999999,115.06472000000001,"Pondok Awanpadi, Banjar Belong, C3R7+XVQ, Belumbang, Kec. Kerambitan, Kabupaten Tabanan, Bali 82161, Indonesia",https://maps.google.com/?cid=11439897325734347855,OPERATIONAL,,coffee_shop,"coffee_shop, cafe, store, food",5,2,,,,,,
ChIJO22zXQAx0i0RKqGFbjWwFx4,Kandang sapi Dewa Giok,-8.5597385,115.06940099999998,"C3R9+4Q2, Penarukan, Kerambitan, Tabanan Regency, Bali 82161, Indonesia",https://maps.google.com/?cid=2168395489136189738,OPERATIONAL,,tourist_attraction,tourist_attraction,,,,,,,,
ChIJ64fjxxkx0i0R9jXWTgodnjI,Karang Suwung Bonsai,-8.5566356,115.07220860000001,"Jl Karang Suwung No : 8, Jl. Penarukan Kaja, Penarukan, Kerambitan, Tabanan Regency, Bali 82161, Indonesia",https://maps.google.com/?cid=3647384678326220278,OPERATIONAL,,park,park,5,1,,,,,,
ChIJs0dWC74x0i0R8Wg86foF0cY,Win Food Bali,-8.5610299,115.0721536,"C3QC+HVJ, Jl. Jurusan Kerambitan, Penarukan, Kec. Kerambitan, Kabupaten Tabanan, Bali 82161, Indonesia",https://maps.google.com/?cid=14326238464855271665,OPERATIONAL,+62 858-5803-4347,restaurant,"restaurant, food",5,1,,,,,,
ChIJdbOCwyox0i0RM292_nC-b4o,Jero Gede Penarukan,-8.5613162,115.0720218,"C3QC+GVV, Penarukan, Kerambitan, Tabanan Regency, Bali 82161, Indonesia",https://maps.google.com/?cid=9975401092163727155,OPERATIONAL,,historical_landmark,historical_landmark,5,2,,,,,,
ChIJVfvcEbYx0i0RU2GE15kNPXc,Warung Byang Laras,-8.560918299999999,115.0722402,"C3QC+JVQ, Jl. Penarukan Kaja, Penarukan, Kec. Kerambitan, Kabupaten Tabanan, Bali 82161, Indonesia",https://maps.google.com/?cid=8592038618489708883,OPERATIONAL,,breakfast_restaurant,"breakfast_restaurant, restaurant, food",,,,,,,,
ChIJ3RfEzb8w0i0RZ91yF15jsaM,Wr. Ibu Riko,-8.5595225,115.07296709999999,"Penarukan, Kerambitan, Tabanan Regency, Bali, Indonesia",https://maps.google.com/?cid=11795318154831519079,OPERATIONAL,,restaurant,"restaurant, food",,,,,,,,
ChIJ48ahpr8w0i0RKFSPlgOpz9I,Warung Solin,-8.5610886,115.07221799999998,"C3QC+HV8, Penarukan, Kerambitan, Tabanan Regency, Bali 82161, Indonesia",https://maps.google.com/?cid=15190545901019943976,OPERATIONAL,,cafe,"cafe, food",3,1,,,,,,
