id,name,latitude,longitude,address,url,status,phone,primary-type,types,rating,rating-count,price-level,review 1,review 2,review 3,review 4,review 5
ChIJ8ayYn95G0i0ROV-H8K5seM8,Hotel Restu Bali,-8.7143791,115.17387420000001,"Jl. Raya Legian No.113, Legian, Kec. Kuta, Kabupaten Badung, Bali 80361, Indonesia",https://maps.google.com/?cid=14949818461671874361,OPERATIONAL,+62 361 751251,hotel,"hotel, lodging",4.1,524,,"The most disgusting hotel I have experienced while in Asia in 9 months. I checked into a private and left immediately. Hair on the bed, very dirty floor, the bathroom was disgusting and there was (poop?) on the toilet roll holder. Mold in the walls, everything was sticky, absolutely disgusting fridge with hairs inside. They showed me two other rooms which were equally bad. One even still had old food in the fridge. Absolutely would not recommend, even if on a budget. This place is simply bad for your health.","Decent mid range hotel close to the essentials of Bali. Somewhat dated but clean and tidy. On a budget, a decent option.

I'd strongly advise against booking with Agoda. They use out of date 'newly added' photos as opposed to 'newly taken' photos, knowningly deceiving customers, as I have made recent photos of properties sold on Agoda, and sent them to Agoda. They sent me their legal guff 'we take no responsibility...' and continue misleading customers with their out of date 'newly added photos'  A deplorably dishonest company.

They have also left me stranded in KL at night with no room, no local SIM,  no local currency... then offered $60 for cancelling whilst I was actually in the air en route! Shockingly disgusting company. AVOID USING AGODA AT ALL COSTS!",I check in there on 13 May it was very bad Hotel Their front desk staff Putu and Security Komang made me wake up in night and do very bad mentally torchuers to me that's anyone will not be expecting to experience if you staying in foreign country Hotel and in night they drag me outside of room and i didn't get any refund and they behaved very rudely with me so i was very scared and in night i moved to another 5 star hotel,"A Relaxing Stay at Hotel Restu Bali in Kuta

Rating: ⭐️⭐️⭐️⭐️⭐️ (5/5)

I recently had the pleasure of staying at Hotel Restu Bali in Kuta, and my experience was truly remarkable. From the moment I walked in, I was impressed by the warm and welcoming atmosphere. The hotel's location, right in the heart of Kuta, made it incredibly convenient to explore the area's attractions.

The staff at Hotel Restu Bali went above and beyond to ensure my comfort during my stay. From the front desk to the housekeeping team, everyone was attentive and friendly, always ready to assist with a smile. The check-in process was smooth, and any questions or requests I had were promptly addressed.

The rooms were spacious, clean, and beautifully designed. I particularly enjoyed the comfortable bed and the stunning view from my window. The hotel's attention to detail in room amenities and decor truly enhanced the overall experience.

One of the highlights of my stay was the hotel's dining options. The on-site restaurant offered a diverse menu of local and international dishes, all prepared to perfection. The breakfast buffet was a delightful start to each day, featuring a variety of fresh and delicious options.

Hotel Restu Bali also boasts impressive facilities, including a relaxing pool area where I spent some leisurely afternoons. The spa services were a rejuvenating treat, and I left feeling completely relaxed and pampered.

The proximity of the hotel to Kuta's famous beach and vibrant nightlife added to the overall allure. Whether I wanted to spend a day on the sand or explore the local shops and markets, everything was just a short walk or drive away.

In conclusion, Hotel Restu Bali provided an exceptional experience during my time in Kuta. The combination of excellent service, comfortable accommodations, and prime location makes it an ideal choice for both leisure and business travelers. I can't wait to return for another memorable stay.","Shared room and bathrooms are very dirty, there were hairs on bed sheet, not hot water at shower. I don’t recommend at all. I didn’t have experience with private room."
ChIJxYyXy8lG0i0Rfd5StSoNt2U,Ayam Betutu Khas Gilimanuk (Central Park),-8.7121727,115.1802601,"75QJ+44J, Jl. Patih Jelantik, Komp. Istana Kuta Galeria, Kuta, Kec. Kuta, Kabupaten Badung, Bali 80361, Indonesia",https://maps.google.com/?cid=7329341395650666109,OPERATIONAL,+62 812-3903-3922,restaurant,"restaurant, food",4.4,1411,PRICE_LEVEL_MODERATE,"Ayam Goreng was not fried well - oil must not have been hot enough as the chicken was super oily and wasn't crispy. Ayam betutu tasted nice but the chicken itself was very tough, I'm not sure if it's the quality of the chicken or the way it's been prepared. Both dishes was also on the colder side.

Overall not the best experience, you can find better options elsewhere!","There is no staff stand by to see customer needs, the staff busy talking each other. We ordered Ayam Betutu, Food is ok little bit spicy, but Pelecing Kangkung not fresh. Its fast enough our food came. Too much flies around.","It doesn't feel the same as last year when I came. The broth is bland, even though it's warm and permeates the chicken. But not as good as before. I hope the taste can be consistent, cause every time I go to Bali I always stop to eat here.","The food came out fast and it was fresh! The portion was bigger than we remembered. Previously, we always went to the branch in Tuban but this branch in Central Parkir is more convenient. There is more parking and the place feels more relaxed here. Branch in Tuban feels overcrowded.","Best Bali Halal Food. This place is my ultimate culinary experience in Bali.
Since trying its menu from South Jakarta branches around 2012, Ayam Betutu Khas Gilimanuk has been my favourite Bali restaurant.
When visited Bali, we even book hotel in a walking distance from Ayam Betutu Gilimanuk branches in order to easily have a meal from.

The taste even better in this branch. The service is quite fast and the staff are friendly.  Located in Central Park, Kuta parking area, so car & bus parking is not an issue. There's also musholla in parking area."
