id,name,latitude,longitude,address,url,status,phone,primary-type,types,rating,rating-count,price-level,review 1,review 2,review 3,review 4,review 5
ChIJCfm-QB8_0i0RxkfmyITBS0w,Ekowisata Subak Sembung Peguyangan,-8.613720599999999,115.2140324,"96P7+GJ7, Jl. Ahmad Yani Utara, Peguyangan, Kec. Denpasar Utara, Kota Denpasar, Bali 80239, Indonesia",https://maps.google.com/?cid=5497700546186201030,OPERATIONAL,,park,"tourist_attraction, park",4.6,1301,,"I love the fresh air and fertile rice fields. There are some local seller of fruits and vegetables here, they're harvesting fresh from the garden and sell it in a cheap price.

This is a good place for you to strolling. The area is clean.

But this is not too huge place, bcs you only need about 25 minutes to get around rice fields and back to start.

Recommended to bring your pet here","Jogging with wonderful view, you can find vegie and also cafe here. The track also already good for us to jogging. Nice place","One of the most favorite jogging park among locals, it has really nice views along the way and quite moderate track about 30 minutes from starting point back to starting point again. There are some warung and café located at various spot. Definitely worth a try","a good and fresh place to see a greenery in the city.
there are lots of local vendors selling snacks, vegetables and fresh fruits they grow themselves, really a great place to hangout with only paying 2000 rupiahs for parking",Another jogging track with ricefield view in the heart of Denpasar. Relaxing ambience with the sound of waters flowing and birds chirping. No entry and parking fee. Less crowded than Prapat Beris Jogging Track in Sanur.
ChIJR7lX7RY_0i0RywzDIbhLDo0,Guling antik,-8.6092209,115.20822179999998,"Jl. Suradipa, Peguyangan Kaja, Kec. Denpasar Utara, Kota Denpasar, Bali 80115, Indonesia",https://maps.google.com/?cid=10164144663234284747,OPERATIONAL,+62 819-9928-7407,indonesian_restaurant,"indonesian_restaurant, restaurant, food",4.4,124,,This is really close my place and the lawar is really good and I ordered more for lawar only. The sambal is spicy and the Samsam is crunchy. Only the setting of the second floor is too near the road and we are bothered by the sound of cars and bikes even there was a local's karaoke.,"Had a grab delivery, 120,000 for 500gm samsam, no crispy, no fat and it have small meat, will never order again, 100% disappointed, small thin skin with nothing on",Recommended 👍😍,"Nasi lawar is good but i dont like soto balung...so little meat in the soto, no noodle, no vegetable...the worst..no lime to neutralized pork odor",New must-try-food in town. Great taste!!
ChIJKwGuaA4_0i0RMYURmnTC1m0,Strawberryku Resto & Coffee,-8.6112406,115.21139830000001,"Jl. Suradipa No.14, Peguyangan, Kec. Denpasar Utara, Kota Denpasar, Bali 80115, Indonesia",https://maps.google.com/?cid=7914727201207059761,OPERATIONAL,,indonesian_restaurant,"indonesian_restaurant, restaurant, food",4.8,89,,The strawberry 🍓 pancakes 🥞 here are phenomenal. Even up to this day I can still imagine how good it tasted. The other dishes are okay for my taste. But I like the idea of incorporating strawberries to different dishes. It’s quite unique. They have more local style but it’s good. The prices are affordable. Highly recommended and please try the pancakes 🥞,"I didn't expect that the combination of strawberry in the salad (and other foods) will be that good. Good foods, good place, good atmosphere. Recommended 👍🏻","We accidentally discovered this place when the roads were closes due to a ceremony. So glad we did!! My daughter and I love the strawberry pancakes, strawberry croissants, strawberry cheesecake and the strawberry juice and yakult. Very good price and great food. We'll be back!","If you're into strawberries, this place will fit you.

Their ice strawberry coffee was like a cozy hug for my taste buds, mixing strawberry goodness with my caffeine fix.

Pizza strawberry is a thing, and it's good! The classic pizza meets strawberries in a surprising unique flavors that worked.

Plus, the staff were so friendly, making the visit even better. If you're up for a unique and tasty experience, Strawberryku's strawberry-themed menu and awesome service are a must-try.

FYI, they also have a socket, so you are actually able to work from here :)","good for children, kinda hot with the glass windows but spacious enough for party.
strawberry is their specialty ... many kinds of drinks from strawberry and you can ask no sugar added ..."
ChIJ24alvuw_0i0R_GN67es-ZsA,Labakar (Sambal Bakar Cobek),-8.609591,115.20853079999998,"96R5+5C6, Jl. Suradipa, Peguyangan Kaja, Kec. Denpasar Utara, Kota Denpasar, Bali 80115, Indonesia",https://maps.google.com/?cid=13863837685929108476,OPERATIONAL,,indonesian_restaurant,"indonesian_restaurant, restaurant, food",4.6,29,,,,,,
ChIJdyL7ZTI_0i0RWT17H9BLoIg,PURI PEGUYANGAN,-8.6121768,115.21328679999998,"Jl. Astasura No.1, Peguyangan, Kec. Denpasar Utara, Kota Denpasar, Bali 80239, Indonesia",https://maps.google.com/?cid=9844952142685355353,OPERATIONAL,,historical_landmark,historical_landmark,4.5,20,,Great historical palaces 👍🏻,,,,
ChIJ9T3BtdU_0i0RTuzcQIUCqjs,E.A Bali Rent Car,-8.6100941,115.20952109999999,"Jl. Suradipa No.46, Peguyangan Kaja, Kec. Denpasar Utara, Kota Denpasar, Bali 80115, Indonesia",https://maps.google.com/?cid=4299251565620685902,OPERATIONAL,+62 812-3037-6054,car_rental,car_rental,3.9,27,,Gasss,,,,
ChIJvVE9Ey8_0i0Rtr-_Hn_xxqU,Bakmi Achai,-8.615690299999999,115.2123849,"Jl. Ahmad Yani Utara No.340, Peguyangan, Kec. Denpasar Utara, Kota Denpasar, Bali 80115, Indonesia",https://maps.google.com/?cid=11945500589925842870,OPERATIONAL,+62 813-1159-9113,restaurant,"restaurant, food",5,4,,,,,,
ChIJPeCLgR8_0i0RbcgBU7o03Ak,Warung Babi Guling Bu Arik,-8.6122116,115.2129811,"Jalan A.Yani Utara , Peguyangan Kaja, Denpasar Utara, 96Q7+459, Peguyangan, Kec. Denpasar Utara, Kota Denpasar, Bali 80115, Indonesia",https://maps.google.com/?cid=710500816078882925,OPERATIONAL,+62 857-9252-4499,restaurant,"restaurant, food",4.5,10,,"One of the best Babi Guling warung in Bali.  Nothing fancy, just pure culinary happiness",,,,
ChIJi6qYJMg_0i0RBRofsxNHs40,GANG ANGGREK,-8.611591700000002,115.21116509999999,"96Q6+9F7, Gg. Anggrek, Peguyangan, Kec. Denpasar Utara, Kota Denpasar, Bali 80115, Indonesia",https://maps.google.com/?cid=10210582930114157061,OPERATIONAL,,tourist_attraction,tourist_attraction,,,,,,,,
ChIJ4wB6wa8_0i0R9QaltMBZBA0,Warung Nongkrong,-8.6113532,115.2110174,"Jl. Suradipa No.19, Peguyangan, Kec. Denpasar Utara, Kota Denpasar, Bali 80115, Indonesia",https://maps.google.com/?cid=937973306599212789,OPERATIONAL,+62 857-3727-9868,restaurant,"restaurant, food",4.7,10,,"The food is really cheap and yummy
love the carbonara and fried rice 🤤",Good,,,
ChIJp5f0LSA_0i0Rb8y4ekEPelE,Warung Bu Wawan,-8.6122547,115.21182479999997,"Jl. Suradipa, Peguyangan, Denpasar Utara, Peguyangan, Kec. Denpasar Utara, Kota Denpasar, Bali 80115, Indonesia",https://maps.google.com/?cid=5871021838137085039,OPERATIONAL,+62 813-3783-5466,indonesian_restaurant,"indonesian_restaurant, restaurant, food",4.1,15,,Here is where you can choose so many javanese delicious meals with a fair price..,,,,
ChIJxxNgm_4_0i0ReiWO3mbz6ck,Umah D'labak,-8.6099254,115.20933079999999,"Jl. Suradipa No.46, Peguyangan Kaja, Kec. Denpasar Utara, Kota Denpasar, Bali 80115, Indonesia",https://maps.google.com/?cid=14549427694343169402,OPERATIONAL,,restaurant,"restaurant, food",4,6,,,,,,
ChIJmVJCpEs_0i0RafyrmvyDVb8,Atap Sunset Cafe,-8.6099737,115.20954300000001,"Jl. Patih Nambi Utara No.10X, Ubung Kaja, Kec. Denpasar Utara, Kota Denpasar, Bali 80115, Indonesia",https://maps.google.com/?cid=13787070955214601321,CLOSED_TEMPORARILY,+62 877-5092-8828,coffee_shop,"coffee_shop, cafe, store, food",5,35,,"Cool place with sunset view in the city, the situation in the night also great",Nice view with excellent coffee! 🤙,,,
ChIJa34mk3k_0i0Rjo_GgrefSPo,Griya Taman Harum,-8.610425,115.21000099999999,"96Q6+R2J, Peguyangan, Denpasar Utara, Denpasar City, Bali 80115, Indonesia",https://maps.google.com/?cid=18034840318327033742,OPERATIONAL,,restaurant,"restaurant, food",4.6,5,,,,,,
ChIJUf5lRiA_0i0RC5eDBlUgtf4,Nasi Bakar 419,-8.6162767,115.21217870000001,"Jl. Ahmad Yani Utara No.421, Peguyangan, Kec. Denpasar Utara, Kota Denpasar, Bali 80239, Indonesia",https://maps.google.com/?cid=18353611405971920651,OPERATIONAL,,cafe,"cafe, food",3.8,10,,Good,,,,
ChIJU-S6csY_0i0R__TW-O3nowM,ART BILIARD,-8.609730299999999,115.21015519999999,"96R6+432, Peguyangan, Denpasar Utara, Denpasar City, Bali 80115, Indonesia",https://maps.google.com/?cid=262308212585723135,OPERATIONAL,+62 857-9216-8462,bar,bar,5,3,,,,,,
ChIJmaw7cSI_0i0RrY7hyqUe-B8,Bakso Super Tenis,-8.616446,115.2122512,"Jl. Ahmad Yani Utara No.417, Peguyangan, Kec. Denpasar Utara, Kota Denpasar, Bali 80239, Indonesia",https://maps.google.com/?cid=2303624906822225581,OPERATIONAL,+62 813-3963-5115,indonesian_restaurant,"indonesian_restaurant, restaurant, food",4.4,34,,,,,,
ChIJFSpebbY_0i0R51Pn3BNB7aw,Angkringan Lintas Senja,-8.6115513,115.21093309999998,"Jl. Imam Bonjol No.577, Pemecutan Klod, Kec. Denpasar Bar., Kota Denpasar, Bali 80119, Indonesia",https://maps.google.com/?cid=12460687297570362343,OPERATIONAL,,restaurant,"restaurant, food",5,1,,,,,,
ChIJ9U79zHg_0i0RP9IWH52wTe4,kantor,-8.6100996,115.2112298,"Jl. Suradipa I No.50, Peguyangan, Kec. Denpasar Utara, Kota Denpasar, Bali 80115, Indonesia",https://maps.google.com/?cid=17171575143111512639,CLOSED_TEMPORARILY,,tourist_attraction,tourist_attraction,,,,,,,,
ChIJq82o3eM_0i0RpYwRiaJoPZ0,AYAM GEPREK BUNDA VELY,-8.6106651,115.21132339999998,"96Q6+PGP, Jl. Suradipa I, Peguyangan, Kec. Denpasar Utara, Kota Denpasar, Bali 80115, Indonesia",https://maps.google.com/?cid=11330327284827655333,OPERATIONAL,+62 878-5683-9555,indonesian_restaurant,"indonesian_restaurant, restaurant, food",5,2,,,,,,
