id,name,latitude,longitude,address,url,status,phone,primary-type,types,rating,rating-count,price-level,review 1,review 2,review 3,review 4,review 5
ChIJpU3Pr55z0i0RvOsZ4l7mnmo,J&J Guest House,-8.6763654,115.4924601,"Jl. Pendidikan Gg. Nyuh Bulan, Banjar Nyuh, Ped, Kec. Nusa Penida, Kabupaten Klungkung, Bali 80771, Indonesia",https://maps.google.com/?cid=7682831309535308732,OPERATIONAL,+62 823-3963-1478,,lodging,4.7,72,,"Not a review - but a question. As of March 27th, is the construction still going on? We have booked a couple of nights in the beginning/middle of April. We have cancellation though and would like to know if everything is good on site?","This would have been an amazing experience if WITHOUT THE UNDLESS NUISANCES OF THE NEW BUILDING RIGHT IN FRONT THE ROOMS!

They of course NOT HAVE INFORMED ME with NO REFUND POLICY.

I am currently fighting with booking to have my money back and leave the place. If you are out all the day and here only to sleep it's OK, if not it's just a torture you can't sleep properly.

I hate them for not having informed me for sure I would have go elsewhere.","Highly recommend this great guest house on Nusa Penida! The location is nice and close to the marina where you arrive with the boat/go out for snorkeling tours. The rooms are big, fresh and clean. Staff is super lovely and informative, they clean your room every day and when I had Bali belly they were very sweet and helpful. They even make you breakfast in the morning. We also rented scooters from them to ride around the island and the price is fair and the scooters are good.","The owners and staff were lovely and did everything they could to help us. Breakfast each morning was very pleasant. During our stay, half of the hotel was under construction, however it was never noisy and did not affect us. Great value for money.","Nice and clean accomodation conveniently located in Nusa Penida. The staff were great, helpful and easy to contact. We were able to hire at scooter at the place for 75K. Pool are is nice and comfortable.
Breakfast wasn’t varied, and the eggs were very dry all the time. I’d suggest to include pancakes or a smoothie bowl or bowl of fruits. The options were omelette, scramble eggs, fried noodles & toast with Jam. even adding fried eggs (sunny side up) would be great. Also adding the option of juice. There is a construction at the other side of the pool to build no rooms but it wasn’t very noisy when we stayed."
ChIJ5bU48lpz0i0R02_KIOiABfA,Penida Dream guest house,-8.6767246,115.49429789999999,"Jl. Pendidikan, Nusa, Penida, Kabupaten Klungkung, Bali 80771, Indonesia",https://maps.google.com/?cid=17295371678457163731,OPERATIONAL,+62 813-5331-0619,guest_house,"guest_house, lodging",4.6,54,,"Nice room, nothing special but has everything you need! Great host and helpful in any situation. Pool is small but cold and refreshing! For this great price the best hotel you can stay in Nusa Penida!","Room was so big that the Air conditioner took a few hours to cool the room.
We booked a family room (4 single beds) as shown on Agoda but owner claimed that description is not correct. He gave us a room with one king size bed. As we were three of us and were tired after the day when we checked in, we had to adjust.
For dropping at harbour, they quoted 2.5 times than the next best quote I received. So, zero points for service. Pool is only for namesake as it is very small.
Only good thing is, room was clean.","Really calm and peaceful place. The room is still little bit small but it works good for one night. Is also clean, you will share the room with 3 people (4 in total)
The breakfast you can try also with good price and super tasty bowl
Small pool but enough for getting fresh","We had a very comfortable stay in Penida Dream. The room was furnished with nightstands and shelves and the AC was working perfectly fine. A good plus for the tea, coffe, kettle and water for personal use.

We had the breakfast included, so every morning we would receive what we had ordered the day before right on time. It was the perfect way to wake up!

We couldn’t enjoy the pool that much but it was a nice treat after a hot day around the island. The hosts are very welcoming and friendly.
I would recommend this place to anyone!",Incredible value for money ! Very nice rooms and optional breakfast delivered directly at the room. Would highly recommend if staying on Nusa Penida! 10 minutes away by foot from the main restaurants of the island
ChIJ_TrvDslz0i0RfcOIMYjSVCY,Alily Penida Restaurant & Bar,-8.6793093,115.48956030000001,"Ped, Nusa Penida, Klungkung Regency, Bali, Indonesia",https://maps.google.com/?cid=2762063953873388413,OPERATIONAL,+62 821-4651-8412,restaurant,"restaurant, coffee_shop, cafe, event_venue, bar, store, food",4.6,680,,"lovely ambience and staff- i enjoy sitting upstairs just overlooking the road

food is good. carbonara portion came bigger than expected; love that it came with bread! fried calamari and chicken burger was good too. will likely come back again to try another pasta","This cute little restaurant served us great food, we had the breakfasts which were presented really nicely and was very good. The price was super cheap as well! We were served by Gilda and she was always smiling and very welcoming. The place was clean and pleasant to sit in, although a bit hot. Overall great breakfast!!","We absolutely love this place. Live music, amazing stuff (we like our waitress Surya) and delicious food. The place had a vibe, quick service, beautiful comfy place. Definitely worth of trying 🤩",I went here for breakfast and it was amazing! Cappuccino and smoothie bowl were delicious. I’ll probably come here the rest of the days i will be on Nusa Penida. Especially Gilda was very kind and came to check in so i didn’t have to wait if i wanted to ask for anything! You also have a beautiful view from upstairs!,"THIS PLACE IS INCREDIBLE!!! My husband and I found this little gem right off by the harbor. Food was amazing, service was 10/10. Dilla and Esa were both very welcoming, friendly, and recommended the traditional Indonesian coconut pancakes that were super tasty! Highly recommend checking this cozy cafe out :)"
ChIJlTgdjQ9z0i0RNnZfMooPbpw,Santen Beach Bungalows,-8.6734546,115.49132870000001,"Nusa Penida Indonesia Banjar Nyuh, Jl. Raya Toya Pakeh - Ped, Ped, Kec. Nusa Penida, Kabupaten Klungkung, Bali 80771, Indonesia",https://maps.google.com/?cid=11271964003579950646,OPERATIONAL,+62 823-3963-1478,hotel,"hotel, lodging",4.5,95,,Really loved the place. Beautifully located with some amazing sunset views. However bathroom needs some scope of improvement  but overall an amazing experience. We requested for pickup & drop service and they helped without any additional charges. I am really thankful for the help.,"The location of the place is exceptional, in front of the beach and is well protected from the sun by a nice tree. All day long you can enjoy the sound of the waves.

Be aware that you can only swim during high tide (twice a day).

It is easier to reach the Bungalow walking on the beach.

Unfortunately we had a mouse in the room, which ate a part of a bag and managed to open a bag of very good cacao beans. The staff checked the room for the mouse and instead found an old condom below a piece of furniture, which confirmed my feeling that the cleaning of the bungalow was not sufficient.
We didn’t get any compensation for these misadventures, only the statement from the manager on WhatsApp that they will improve.

The slide door to the toilet broke down during the second day.

The last night there was a big cockroach in the room.

They don’t have water refill. Very sad as you find many bottles on the beach. The first day you get two bottles and then you have to pay for the new ones.

For breakfast we had the first day banana pancake which were very bad. Unfortunately the breakfast choice is difficult if you want to avoid egg or caffeine.
The second day we had soup ans fried noodles, which were much better than the pancakes.

Communication before the trip was good to book the ferry tickets, but during the stay the staff doesn’t make an effort. There are very nice, but not proactive.

I found the place over expensive for the offered quality.","Cute place that I feel doesnt deserve some of the mixed reviews below. Its a beautiful place and the staff is very kind. It feels like a mini paradise on the beach, you hear the waves at night from your room.

Only 2 criticism would be a) indeed the bathroom could be nicer / cleaner / newer b) to get there you need to cross the big mess that the neighbours houses are which contrast with how cute the place is","•directly in front of a beach

•cool vibes

•chilling & sleeping with the sound of ocean waves

•spacious & clean room(wifi provided)","We went with this location due to some good reviews - boy did we regret it! We didn’t have any check-in, when we arrived 1hr after checkin started. Room stunk of mold, received yellow stained towels, no support what so ever, and the bathrooms were in the conditions where you wanted to shower/walk with shoes and avoid bare feet. After asking for check/in information (wifi, breakfast info, and info for tours) we received a paper with password and no further information. We had to ask around to get inaccurate info, as we were first told breakfast started at 11, then 8, when it really started at 7am. We were given a scooter to use with an empty gas tank, and the service was just absolutely terrible. The only good things were: the AC, the sound of the waves and the breakfast staff (a lady). We cancelled the rest of our reservation, and booked somewhere else - best decision we made! We found a place that was superb, cheaper, with excellent service and location. Avoid this place - don’t be fooled by good reviews!"
ChIJITuM9wFz0i0RXqOH7yi2dsQ,Santhi Guna Bungalow,-8.679862199999999,115.4915535,"Ped, Nusa Penida, Klungkung Regency, Bali 80771, Indonesia",https://maps.google.com/?cid=14156702765619323742,OPERATIONAL,+62 877-6530-1207,hotel,"hotel, lodging",4.6,76,,"We stayed here as a couple and had an amazing time.

The host was unbelievably helpful, offering reasonably priced scooters, helping plan our activities for the day (how long it takes to scoot to each beach ect) and was able to book our transport and snorkeling tours at a discount which were absolutely amazing.

The rooms are spacious, clean and amazing value with a comfy bed, good water pressure, balcony and AC.

The location is close to the main road, about a 5-minute walk down a dirt path that gets muddy when it rains and has no  lights. As with most of this island though renting a scooter was quite important to get around which made the dirt road not a problem.

Overall I highly recommend staying here, the host will really make sure you make the most of your time if you want to do activities. Definitely do the manta snorkeling tour and rent a scooter if you have prior experience on them!","I stayed in the bungalow for two nights.  My room was spacious and very clean, the AC and hot water worked great!
Kadek (hotel manager) took care of everything!  He made a great plan for my visit!
He recommended me places and times to visit all the viewpoints!  He even told me when I should put gas in my scooter!

I received better service than a 5 star hotel!  Highly recommend staying here!",You will feel like you’re part of the family as soon as you arrive! Kadek and his mom run a fabulous business together at an incredible price. The bungalows are clean and simple. You have everything you need available in your room to you. Breakfast is delicious and you’re in a perfect location…. Just a 5 minute walk to tons of restaurants and bars. Also about a 7 minute walk to the beach.,I really recommend staying in this place. The bungalows are pretty new and very confotable. The breakfast is delicious and the owner is just amazing. We decided to resign from snorkeling because of the weather but then in the morning changed our minds and he settle everything an hour before and gave  us a rider to the port for free. He also settle us a ticket to Gili and just gave js a rider for free. The best stay in Asia for 4 months.,"The host, Kadek,was so kind and friendly! He helped us with everything we needed. He booked a taxi from the harbour and he got us a great price for a private driver for when we visited Broken beach and Kelingking beach!

Kadek also helped us book our snorkelling trip in which we went to four different spots and saw mantas. He always looked out for us and went the extra mile to give us a great stay. Kadek’s mother and sister also helped and were super welcoming!
They drove us with scooter and the day we left Kadek’s mother served us breakfast before they opened so that we could eat before our travels.

If we come back to Nusa Penida we’ll definitely stay here again! Definitely great service for a great price! Thank you for having us!

Best regards,
Blenda and Sara"
ChIJleW7Jmdy0i0RFABN0VMAg_A,Nusa Penida Homestay,-8.6767165,115.49438860000001,"Jl. Pendidikan, Ped, Kec. Nusa Penida, Kabupaten Klungkung, Bali 80771, Indonesia",https://maps.google.com/?cid=17330696151045570580,OPERATIONAL,+62 823-8614-0544,hotel,"hotel, lodging",4.7,59,,Great place! Owner is super kind and helps a lot. Rented a scooter and snorkelling trip through him and all was good!,"We were looking for last minute accommodation in Nusa Penida and came across this homestay. We stayed for 4 nights in the end and absolutely loved it. The rooms were cleaned every day and we were given coffee and tea in the room. The beds were comfy and the bathroom had shower gel and shampoo. We were also able to hire a scooter for 75k a day and explore the island. There is also a hammock on the balcony outside and some bean bags if you want to relax.

There is a few restaurants and shops within walking distance and to the ATM as well.

We liked most of all that the staff were so helpful and friendly and were always available when we needed any advice! Thank you so so much and we would definitely recommend!","Convenient Location near Bajam nyuh Pier. Kadek is all smiles and very welcoming. Clean rooms, cold AC. Comfortable bed. Great accomodations for the price. You can also rent a bike from here.",very clean and beautifully. The staff are very kind and help us a lot. thank you so much,AMAZING stay here!!! Kedek was so so so kind to us! We booked the manta snorkeling tour through here and it was great! Rented scooters at a good price and when something was wrong with one of them he fixed it right away! Room was cleaned everyday! Best bed i’ve slept in during 2 months of travel!!! Duvet was soo comfortable!  10 minute walk to shops and restaurants.
ChIJ4VjDcQNz0i0RqYaSrJw02WU,Nusa Penida Scooter Rental,-8.678137999999999,115.49050459999998,"Banjar Nyuh, Ped, Kec. Nusa Penida, Kabupaten Klungkung, Bali 80771, Indonesia",https://maps.google.com/?cid=7338954915291760297,OPERATIONAL,+62 858-5894-9197,,car_rental,5,101,,"Definitely the best scooter rental on Nusa penida, the scooter was in good condition and I had no problems with it. The pricing was good and I rented the scooter smoothly without any issues. The owner, Kadek, is very kind and happy to help if any problems arise. His English is excellent and you can always contact him on WhatsApp if you need to.","If you need a bike on Nusa Penida, exceed the crowd after you arrived on this island, walk a little bit more and rent your bike from this trustable place.",Very good and new scooter! Good price! Left the scooter in different area than took it. Best man on Earth!!! We forgot to take our backpack from scooters seat and went to Bali. He sent the backpack to Sanur! We are veryyyyy grateful  🫶🏼🙏🏼💕,Best value for money. They gave me a very good scooter. The whole process went very  fast. They are reliable. I recommend them.,GD rented us a scooter and it was easy and hassle free. Fair price. The scooter was like brand new - great brakes and tires. Dropped it off in a different location than I rented it for a small fee. GD was such a chill dude as well. Recommended!
ChIJV3K9a2Fy0i0RoyRp6HCW6m8,La Nusa Penida Homestay,-8.6756045,115.49188649999998,"Jl. Raya Toya Pakeh - Ped, Banjar Nyuh, Ped, Kec. Nusa Penida, Kabupaten Klungkung, Bali 80771, Indonesia",https://maps.google.com/?cid=8064423494440002723,OPERATIONAL,+62 813-3795-6406,hotel,"hotel, lodging",4.4,124,,"Good location it is walkable from the port. And local market right next to many restaurants  The place is quiet and nice. The bed is too soft is like you are singing in the bed. The bathroom needs to be renovated the bathroom door was broken. however, it is good for the price.","Nice room. Nice staff. Clean. Good breakfast.
WiFi working well. Perfect for us","Very big room and comfy bed, for a very fair price.","Ended up having to cancel my stay because my ferry to Nusa Penida was cancelled due to bad weather. When I explained the situation over WhatsApp, the person I spoke with was very understanding and accommodative. I really appreciated this, especially while already being stressed about my plans being derailed. Will definitely be staying here once I do get to visit Nusa Penida!",A place with mosquito netting is my oasis. Its quiet if you take the rooms further inside. I didnt have hot water but it was so humid and warm so not a big deal. They serve yummy rice bowls and for the price i am very satisfied. Pillows have good support. Check with owner for # of power points if that's important to you.
