id,name,latitude,longitude,address,url,status,phone,primary-type,types,rating,rating-count,price-level,review 1,review 2,review 3,review 4,review 5
ChIJsyYVzA4V0i0Rh35ncUyLT8Y,Warung Lesehan Bu Mangku,-8.607619099999999,115.31532890000001,"Jl. Pantai Saba, Saba, Kec. Blahbatuh, Kabupaten Gianyar, Bali 80581, Indonesia",https://maps.google.com/?cid=14289793303106256519,OPERATIONAL,+62 812-3949-227,indonesian_restaurant,"indonesian_restaurant, restaurant, food",4.5,95,,"A very good value for money restaurant. It has a lot of packages with delicious dishes such as Sate Lilit, fish balls, fish soup. You can also choose to sit in one of their gazebos. Next time you passed Jl. Prof. Ida Bagus Mantra, give it a try!","There is many good reviews but I'm not sure why. Food was tastless especially the grilled fish, it waan't fresh and was supposed to be jumbo size but it was very small. Veges and sate sticks was cold I think from the fridge and not fresshly cooked. As for the ice tea all tasted artificial.
Not recommended.","We live nearby and we love what they do with fish and Balinese traditional dish. They also have fresh coconut for $1. It’s really good and won’t break your bank to eat lunch or dinner 😁 Also really close to Tegenungan waterfall, Saba beach, & Bali Safari.",Is goods,Really bad. The food had no Taste. Dont go there
ChIJnfcblw4V0i0R8YvucP4J8q0,Waroeng Billy's 69 Resto,-8.6061502,115.3185273,"98V9+GCJ, Jl. Prof. Dr. Ida Bagus Mantra, Saba, Kec. Blahbatuh, Kabupaten Gianyar, Bali 80581, Indonesia",https://maps.google.com/?cid=12534091701346536433,OPERATIONAL,+62 361 4796956,restaurant,"restaurant, food",4.2,157,,"Wow going here in the rainy day had not much expectation, but got super yummy fish - Bali cuisine (perfect combination of spices) with vegetables and very cozy nice atmosphere, good service - highly recommended 🌻","My favourite place to eat ayam / bebek betutu. We come here at least 3 times a month for it. The garden is well maintained, it is a pleasant place to unwind. The staff is always friendly and cheerful.","Ordered the Mee Soto, Gurame Bakar and Nasi Goreng Ayam. Price was good and food were fresh and tasted great too!!! Recommend for a stopover on the way to Sideman :)","The best driver in Bali save & priendly
New car experience Driver","The food was good. I order mujair bakar & mujair nyanyat, the taste was okay. The place pretty good with some photo spot."
ChIJL8fE4X8V0i0RQWY4jqC6qk4,Harum Manis Eatery & Lounge,-8.6050313,115.3139346,"Jl. Pantai Saba, Saba, Kec. Blahbatuh, Kabupaten Gianyar, Bali 80581, Indonesia",https://maps.google.com/?cid=5668548279742785089,OPERATIONAL,,restaurant,"restaurant, food",4.7,103,,"Beautifully designed place, great food and very reasonably priced.
Came here for brekkie and back again for dinner, left feeling happy each time.
Service was good, and the back dining area is gorgeous with rice field view and beautiful lighting😍
The babur ayam was our favourite dish with great flavours!
We’ll be back when in the area.","Developing into a great resto. A new and very nice garden joglo has just been built with rice and coconut tree views. Pleasant atmosphere and positioned just off the bypass plus opposite the hospital make it a great spot.
Menu is varied and quality matches price but at a middle level, not fancy.
Garden is very good just to stop off for a cold drink and rest a while.","We ordered take-aways, a grilled chicken and a spaghetti bolognese. The grilled chicken was okay, but I only managed to have one small bite of the spaghetti. It was way over-cooked and too sweet ( like sugar sweet) Tasted something like they put a bottle of cheap instant tomato sauce into it.

Anyway, I should have gone for just the indonesian food. Avoid the western food🥲","The food was okay. Bit expensive compared to other local restaurants in Bali. Mostly targeting tourists.  If you are going with a guide, their commissions will be indirectly added to customers. Taste was not bad. The ambiance was good. But it depends on the seat availability.","The first times we went there the food was good, but the last 2 times we ate there it was so bad, they not even know how to make Nasi Goreng with fried egg, we waited 25 Minutes and than was cold, no fried egg. Since the big lady in the kitchen cook the food quality so bad. Last time had Spaghetti Bolognese used to be so good, now make with hot sauce. Sorry never again eat at this place again, better order across at the restaurant at the hospital, great food.
How can a place from good change to so bad."
ChIJJRZmwA4V0i0RmJg_pydP-z4,warung muslim sederhana,-8.608827,115.31494749999999,"Jl. Prof. Dr. Ida Bagus Mantra No.231, Saba, Kec. Blahbatuh, Kabupaten Gianyar, Bali 80581, Indonesia",https://maps.google.com/?cid=4538308081234188440,OPERATIONAL,+62 812-3638-8169,indonesian_restaurant,"indonesian_restaurant, restaurant, food",4.5,197,PRICE_LEVEL_INEXPENSIVE,A small restaurant but served you with many variant of indonesia traditional food. The taste are all great and very cheap for me as a tourist. The portion of the food fits me . Not too much not less. If u drive from blah singa waterfall and find a cheap warung for lunch . I suggest you this place.,Nice food with large variety. 20k for multiple dishes with rice. Came at 4pm once and most food was sold out. Not a great atmosphere but food made up for it.,"Very good variety of food! Taste and cheap.

Also the people here are soo friendly!
They open until late every day!! 👀",The absolute best food I've tried in many many local Warungs throughout Bali. Also very cheap price,"Delicious, simple, good and cheap. Just a bit noisy, as it is on the main road. Still, I went there several times, cause it was delicious."
ChIJYeEPKgoV0i0RJa3F1c733Vc,Coffee Cafe Saba,-8.6050004,115.31334559999999,"Jl. Pantai Saba No.9, Saba, Kec. Blahbatuh, Kabupaten Gianyar, Bali 80581, Indonesia",https://maps.google.com/?cid=6331489118874610981,OPERATIONAL,+62 877-6100-0739,,"cafe, restaurant, food",4.5,137,,"Coffee Cafe Saba is amazing! The staff are so friendly and provide great service, plus the food and drinks are delicious 😍",You will get a variety of dishes for fair prices. Some of them are convince products for catering and servered as on the menu card. Agreeable Ambiente.j,awesome value,"Great food selection at ridiculously low prices. We have come to eat here many times now, even when we didn't need a visit to the Hospital.","For a hospital cafe, it’s very nice."
ChIJZ_FWyhMV0i0R1uf0uLgXBck,JFC Saba,-8.605936699999999,115.31431839999999,"Saba, Blahbatuh, Gianyar Regency, Bali 80581, Indonesia",https://maps.google.com/?cid=14485009858651547606,OPERATIONAL,+62 817-9264-552,restaurant,"restaurant, food",4.2,132,PRICE_LEVEL_INEXPENSIVE,"Very popular in Bali. An option if you are looking for fast fried chicken.  That time i was there, many things in the menu were not available. I asked for silver ware but they told they didn't have any. Well, hands was the call. Food flavor acceptable.","Eat at a real Warung.
If you want chicken. This is a mediocre choice anything else on the menu is just bad. The sandwiches are empty and greasy. Just go to a locally owned warung. I can suggest a few for you if you like.",Super cheap tasty geprek! The sambal is not pure spicy like others’ commercialized geprek/penyet joint.,"Great place..near main road...
Great food and taste ...

Near kasih ibu Hospital","Good and cheap food near a Hospital, it's like KFC, but the cheapest Version)"
ChIJ8z85St0V0i0RtRgGqY9NZcA,RUMAH LARASATI,-8.609193699999999,115.31678280000001,"Jl. Pantai Saba, Saba, Kec. Blahbatuh, Kabupaten Gianyar, Bali, Indonesia",https://maps.google.com/?cid=13863572307341351093,OPERATIONAL,+62 821-4635-7687,,"hotel, lodging",4.7,21,,Nice place,The cozy places ever stayed,"Good ambience, clean, comfortable",comfortable place and atmosphere,Nice place 😍
ChIJBXUXNwkV0i0RQsmq1DlDoto,Restoran Padi,-8.607155299999999,115.31513799999999,"Jl.Raya Pantai Saba,Bypass 1 B Mantra, Blahbatuh, Saba, Kec. Blahbatuh, Kabupaten Gianyar, Bali 80581, Indonesia",https://maps.google.com/?cid=15754228362155575618,OPERATIONAL,+62 361 9111699,restaurant,"restaurant, food",4.1,46,PRICE_LEVEL_MODERATE,Good,Great owner with great food.  Value for money,"I never come to inside, but alot of people using this restaurant for meeting",Good lah,It was fantastic
ChIJxyNgLAkV0i0RhxvqOnmCVlQ,Lalapan Madurasa,-8.6065921,115.31788180000001,"98V9+956, Jl. Prof. Dr. Ida Bagus Mantra, Saba, Kec. Blahbatuh, Kabupaten Gianyar, Bali 80581, Indonesia",https://maps.google.com/?cid=6077188204374137735,OPERATIONAL,+62 853-3848-7843,restaurant,"restaurant, food",3.9,16,,Good and clean,,,,
ChIJNx6Lj6QV0i0RAFrMuZhGszo,Warung RICCO,-8.6085148,115.315682,"BYPASS, Jl. Prof. Dr. Ida Bagus Mantra Jl. Pantai Saba No.PEREMPATAN, Saba, Kec. Blahbatuh, Kabupaten Gianyar, Bali 80581, Indonesia",https://maps.google.com/?cid=4229802096797178368,CLOSED_TEMPORARILY,+62 361 4791133,restaurant,"restaurant, food",4.7,19,,"Located right next to the main street,which is very busy..the rice fields next to the warung gives you different,yet nice feeling and atmosphere,as if you are away from the business of the street..the price is very reasonable and the food is delicious..the staff is very friendly and helpful..there is also a sweet dog guarding the warung..this place is a nice stop when you are on the way through the sanur bypass street..",Good price  and  good food,"Good food, good prices",Chicken Steak BBQ 👍🏻,Lovely foof
ChIJYbjOVIkV0i0RDuZf6-psnUs,Obaya Rice Bowl,-8.6046847,115.31370179999999,"Obaya Rice Bowl, Seberang RS Kasih Ibu, Jl. Pantai Saba, Saba, Kec. Blahbatuh, Bali, 80581, Indonesia",https://maps.google.com/?cid=5448630880415245838,OPERATIONAL,+62 877-7810-3025,restaurant,"restaurant, food",4.7,14,,"Oposite to the GH it is a very nice warung with a small garden place you can sit having a nice view on fields. The meals are very tasty, fresh made everything. The service is really well organized and people can speak english quite well, too. Hygienic conditions are good and all is cleaned. For me top!","We were in the Hospital nearby and it was an amazing discovery because the food was so delicious and the place very nice.
Highly recommended!!!","Amazing experience! The food is really delicious and tasty!
The sambal (spicy sauce) exceptional. If you are looking for the best Japanese restaurant in Bali, this is it!","Quality Noodle and good coffee and tea, never expect to eat this kind of food great taste in the middle of my journey to Gianyar... Good Job Pak 👍👍👍👍","comfortable place, calm atmosphere, good service, good taste of food. highly recommended restaurant to go with friends or family👍💞"
ChIJuX9MNwkV0i0R-8UzxuQykdM,Bali Decoration,-8.607010400000002,115.315095,"98V8+52X, Jl. Pantai Saba, Saba, Kec. Blahbatuh, Kabupaten Gianyar, Bali 80581, Indonesia",https://maps.google.com/?cid=15245022171785053691,OPERATIONAL,+62 819-9957-4353,indonesian_restaurant,"indonesian_restaurant, restaurant, food",4.6,5,,,,,,
ChIJIUbG8kEV0i0RafDVD-V7X4c,Warung Teras Saba,-8.6098114,115.31310990000001,"98R7+36H, Jl. Prof. Dr. Ida Bagus Mantra, Saba, Kec. Blahbatuh, Kabupaten Gianyar, Bali, Indonesia",https://maps.google.com/?cid=9754651541651189865,CLOSED_TEMPORARILY,+62 853-4562-3134,restaurant,"restaurant, food",5,9,,cool,,,,
ChIJn3szIQwV0i0RIfEU7ut2ggk,Warung Wisma Legi,-8.6093234,115.3131392,"Jl. Prof. Dr. Ida Bagus Mantra, Saba, Kec. Blahbatuh, Kabupaten Gianyar, Bali 80581, Indonesia",https://maps.google.com/?cid=685240848997478689,OPERATIONAL,+62 851-0302-0323,restaurant,"restaurant, food",4.3,15,,Traditional test of Balinese foot.. still origins.. it's so yummy specialy sate lilit ikan tuna..,Good,Nice,,
ChIJK7kl360V0i0ROZWkpRkYiCk,Warung Sate Languan Sumerti,-8.6062909,115.31455090000001,"98V7+FRM, Saba, Blahbatuh, Gianyar Regency, Bali 80581, Indonesia",https://maps.google.com/?cid=2992668450819970361,OPERATIONAL,,indonesian_restaurant,"indonesian_restaurant, restaurant, food",4.4,44,,Delicious,Good place,,,
ChIJp2cVuAgV0i0R58gvVpNP6Q8,CAK GONDRONG LALAPAN,-8.6068873,115.31733549999998,"98V8+6WW, Jl. Prof. Dr. Ida Bagus Mantra, Saba, Kec. Blahbatuh, Kabupaten Gianyar, Bali 80581, Indonesia",https://maps.google.com/?cid=1146535074367260903,OPERATIONAL,+62 831-1554-7585,restaurant,"restaurant, food",4,3,,,,,,
ChIJ87eW558V0i0R5CGvgSHWUyo,Puri Eka Santi II,-8.6047283,115.313443,"Jl. Pantai Saba No.88, Saba, Kec. Blahbatuh, Kabupaten Gianyar, Bali 80581, Indonesia",https://maps.google.com/?cid=3050016812057960932,CLOSED_TEMPORARILY,,lodging,lodging,,,,,,,,
ChIJebNgl_MV0i0RClwJS1-TJ9E,Dapoer Ratna,-8.6037474,115.3181901,"Taman Nuansa Tjampuhan Jl. Tjampuhan Selatan I No.3, Pering, Kec. Blahbatuh, Kabupaten Gianyar, Bali 80581, Indonesia",https://maps.google.com/?cid=15071176715508734986,OPERATIONAL,,indonesian_restaurant,"indonesian_restaurant, restaurant, food",5,2,,The food was so good and the service was extraordinary while the atmosphere was good,,,,
ChIJt12ipAgV0i0REhYg8AlL74I,Warung Jawa Banyuwangi,-8.608806,115.31490829999998,"Jl. Prof. Dr. Ida Bagus Mantra No.231, Saba, Kec. Blahbatuh, Kabupaten Gianyar, Bali 50582, Indonesia",https://maps.google.com/?cid=9434842250419901970,OPERATIONAL,+62 852-3604-6839,indonesian_restaurant,"indonesian_restaurant, restaurant, food",4,5,,,,,,
ChIJ72XdTucV0i0RTuZ7uO7JIJk,The Silitonga’s,-8.6026229,115.31479459999998,"Jl. Tjampuhan Utama Barat II No.27, Pering, Kec. Blahbatuh, Kabupaten Gianyar, Bali 80581, Indonesia",https://maps.google.com/?cid=11034041114192242254,OPERATIONAL,,lodging,lodging,4.8,6,,,,,,
