id,name,latitude,longitude,address,url,status,phone,primary-type,types,rating,rating-count,price-level,review 1,review 2,review 3,review 4,review 5
ChIJHcVJyNhd0i0Rtif8ZHzZBr0,Gunung Payung Beach,-8.840776500000002,115.19983629999999,"Pantai Gunung Payung, Kutuh, Kec. Kuta Sel., Kabupaten Badung, Bali, Indonesia",https://maps.google.com/?cid=13620813251322062774,OPERATIONAL,+62 811-3834-388,tourist_attraction,tourist_attraction,4.8,745,,The stairs are manageable or you can pay about 25k for the shuttle. There’s not much crowd here and the tide is very far from the beach so you can just swim or rent the canoe. I super recommend this one. It feels like the Melasti Beach before there is beach club there.,"One of the best beaches in Uluwatu area. It’s a bit secluded, but it’s worth the visit..
you can come to this place anytime of the week.","You have two options for getting to the beach.
You take the small bus (for a fee), which is a nice experience, or you walk down the many stairs,which is also a nice experience although you will break a sweat.
It's very scenic walking through the tunnel in the cliffs.
At the beach is a warung woth an okay selection of food for reasonable prices and with amazing views.
On the beach itself you can rent a kayak or swim in the clean water.
Tends to get quit crowded during the sunset hour, but it's definitely worth the visit even though you both pay for entrance and parking.
Don't forget to support the warungs around the parking lot after your trip.
Highly recommended.","Private beach with access through Gunung Payung cultural park, which is a plus because you get to walk through the park too. (20k)
Few stairs (as almost every beach in Uluwatu).
Clear water, no waves and quiet.",Goes there at around 3PM and it looks so good when the sun is still shining thru the waters. Would recommend taking a swim and play canoe there or just chill. Great place.
ChIJQ_u4aFhd0i0RcsyvWJ9Sk50,Timbis Beach Club,-8.8423515,115.1932483,"Jl. Pantai Pandawa, area Pantai, Timbis, Kec. Kuta Sel., Kabupaten Badung, Bali 80361, Indonesia",https://maps.google.com/?cid=11354509929872346226,OPERATIONAL,+62 812-4643-0068,restaurant,"restaurant, food",4.7,90,,"We stumbled upon this hidden gem while looking for a chill, laid-back beach club with a pool and access to a clean beach, but also with a reasonable minimum spend. Seemingly impossible, but we found it in Timbis Beach Club. We arrived around noon on a weekday and only a few other people were there, so we got the perfect spot on lounge chairs near the pool. While it got a little bit busier later in the day, you can book beforehand as well to reserve your spot! The beach club is small, but has beautiful views and very clean facilities. The infinity pool was clean and the perfect temperature and had a great view of beach! The service was impeccable - the staff were so sweet and helpful! The food and cocktails we had were delicious, and I thought were reasonably priced for a beach club - we had two meals and some drinks and met the 250k minimum spend person person for the lounge beds. This beach club is perfect for those who just want to relax with great views and service, and are looking to avoid a party-focused beach club.","Paradise Found at Timbis Beach Club!

Tucked away on the stunning Pandawa Beach, Timbis Beach Club is a hidden gem that exceeded our expectations in every way. From the moment we arrived, we were treated to exceptional service, warm smiles, and breathtaking views of the Indian Ocean.

The beach club's laid-back vibe and stylish decor made us feel like we were in a tropical paradise. We spent our days lounging on comfortable sunbeds, snorkeling in the crystal-clear waters, and indulging in delicious cocktails and fresh seafood at the beachfront restaurant.

Timbis Beach Club is a must-visit destination for anyone seeking a relaxing and unforgettable Bali experience. We can't wait to return and do it all again!

*Highlights:*

- Stunning beachfront location
- Exceptional service and staff
- Delicious food and drinks
- Comfortable and stylish amenities
- Romantic and relaxing atmosphere

Unlike single fin and uluwatu beach, it's a hidden beach. Not so crowded.","Finally, I stumbled upon a beach club in Bali that isn't overly crowded and has a clean beach. Timbis is a lovely beach club with stunning views of Pandawa Beach.

I tried their chicken wings and potato wedges, and they tasted delicious. The cocktails were also great.

The best part about this place is that it's not too big or fancy like others that are full of tourists taking endless pictures. The vibe is very chill, and the staff are incredibly friendly.

This place has definitely become my favorite spot","We had an amazing time at the Timbis Beach Club!
We loved every moment. The stuff is great, the food delicious, restrooms and shower clean and the pool amazing.
Definitely coming back😊","beautiful place, delicious food, the atmosphere is comfortable, if you want to eat while enjoying the view of the blue sea and sunset you can visit this place. very recommend👍👍👍"
ChIJ4eKpUnZd0i0RXW61ezVVTkA,Hidden Cave - Gunung Payung Beach,-8.8411466,115.19881359999998,"555X+GG, Kutuh, South Kuta, Badung Regency, Bali, Indonesia",https://maps.google.com/?cid=4633734754807934557,OPERATIONAL,,tourist_attraction,tourist_attraction,5,6,,Beatiful scenery and good for relaxing,"When you come to Gunung Payung Beach, make sure that you walk across the shore to the west and you will find this hidden cave behind the cliff.",,,
ChIJc3pjJQhd0i0RKlrhI_dcN2k,Charming Beach,-8.8405468,115.2003236,"5652+Q4P, Kutuh, South Kuta, Badung Regency, Bali, Indonesia",https://maps.google.com/?cid=7581630714230168106,OPERATIONAL,,restaurant,"restaurant, food",4.7,23,,"The establishment is open until 6 pm; our order was not accepted at 5:10 pm. the waiter looked at us like we were dirt, as if we had personally done something to her in her life (we came to the cafe where she works, ahaha) terrible...","Good resto with Excellent view to white sands beach and blue sea water.
It's very nice place 👍🏾

My fav food were fish grill with sambal matah","Small menu, but absolutely delicious and fresh food for very low prices. Beer available too. Beach-facing seating available offering amazing views while you eat. Highly recommended, 10/10 for me in every respect. If visiting Gunung Payung beach (which I also highly recommend), plan to have your meals here during your stay; you won't be disappointed!",lovely place with sea view - we really enjoyed the grilled fish,Grilled fish - excellent!
ChIJIdQ-SZVd0i0R2L__d2o1S8o,Pantai Kaurawa,-8.8421553,115.1949049,"555V+4X, Kutuh, Badung Regency, Bali, Indonesia",https://maps.google.com/?cid=14576803350310797272,OPERATIONAL,,tourist_attraction,tourist_attraction,4.7,7,,Best spot in Pandawa beach…,great,,,
ChIJ60MpF5xc0i0RQy6TV_OGuik,"Mandarin Oriental, Luxury Villas",-8.8397692,115.1937172,"Unnamed Road,Kutuh, Sel., 556V+3FW, Kutuh, Kuta, Kabupaten Badung, Bali, Indonesia",https://maps.google.com/?cid=3006864080927665731,CLOSED_TEMPORARILY,,hotel,"hotel, lodging",4.9,11,,"I’ve worked here AND visited and stayed as a non-employee. It is an amazing and friendly and opulent place. Amazing service, amazing food, and clean. Pricey, but you definitely get what you pay for. You might also catch a celebrity at the bar. Highly recommended.",verry good,,,
ChIJt3fWArxd0i0Repf2s8zPWmk,Pantai pandawa,-8.842245499999999,115.19393529999999,"Timbis beach, Kutuh, Kec. Kuta Sel., Kabupaten Badung, Bali, Indonesia",https://maps.google.com/?cid=7591608599985952634,OPERATIONAL,,tourist_attraction,tourist_attraction,4.7,6,,excellent,,,,
ChIJjTqvDABd0i0RZwiGu8yQPTo,Goa Pandawa,-8.842676299999999,115.19276409999999,"555R+7P5, Kutuh, South Kuta, Badung Regency, Bali, Indonesia",https://maps.google.com/?cid=4196669636773021799,OPERATIONAL,,tourist_attraction,tourist_attraction,5,1,,,,,,
ChIJ8W5vz8Jd0i0RoARBqUpgriM,GUARAPANIS Bali Resort,-8.840793099999999,115.19996710000001,"Kutuh, South Kuta, Badung Regency, Bali 80361, Indonesia",https://maps.google.com/?cid=2571098311058588832,OPERATIONAL,+62 822-3723-7430,resort_hotel,"resort_hotel, hotel, lodging",,,,,,,,
