id,name,latitude,longitude,address,url,status,phone,primary-type,types,rating,rating-count,price-level,review 1,review 2,review 3,review 4,review 5
ChIJxVgj4UpF0i0ReDqP_3x9v1g,Naturela Cafe and Homestay,-8.8177431,115.11514450000001,"54J8+V39, Jl. Uluwatu, Pecatu, Kec. Kuta Sel., Kabupaten Badung, Bali 80361, Indonesia",https://maps.google.com/?cid=6394967971706387064,OPERATIONAL,+62 812-7002-2939,hotel,"hotel, lodging",4,300,,"We started in a twin room and switched to one of the bungalows by the pool. Such a big difference in quality. The bungalow does get quite bright in the morning due to lack of curtains. Rooms were cleaned everyday, but once they took our towels without leaving new ones. We went to the reception, but they wouldn’t give us new ones without returning the old ones. Renting a scooter here was easy. The first one we had wasn’t to good, but we just switched to another one without problem. It is a good location close to a lot of restaurants.","It’s a good simple place with a great location. I enjoyed a lot my days there cause just crossing the road you have the most beautiful cafe, good Mexican food, a Pilates studio and massages. I had a pasta in the restaurant and it was also very good. Recommend.","The room doesn’t look like the photos at all, the bathroom was old, the towels and sheets were old/stained. The room was very very humid. The only good thing was the pool and the location. The staff was very nice.","A good budget homestay close to lots of good restaurants and bars. The room was ok - comfy bed but the bathroom did smell.

Had a nice breakfast & pizza from the restaurant!!",Lovely staff. Pretty good location if you hire a bike it’s perfect for the price. Bit basic but nothing to complain about
ChIJMbcIgEpF0i0RVSFlLBF8Cbg,WIRA Homestay,-8.8166013,115.11782289999998,"Jl. Ancak Sari No.4, Pecatu, Kec. Kuta Sel., Kabupaten Badung, Bali 80361, Indonesia",https://maps.google.com/?cid=13261266990970249557,OPERATIONAL,+62 852-3706-5413,hotel,"hotel, lodging",4.8,248,,Cannot fault this lovely place. We stayed for a week and felt so at home. The staff will do anything to make you comfortable and are constantly working so hard to make the place beautiful. The rooms are immaculately clean and the pool area is beautiful. We found that it was always quiet as it’s a small Homestay villa and we felt relaxed and comfortable. We didn’t want to leave!,"We love this place so much, it feels like home! Rooms are extremely clean, staff is very gentle. Food is delicious and budget friendly. Wira homestay stole my heart ","Great budget hotel, staff are a highlight, rooms are super clean and the food is so good and reasonably priced. You can also hire scooters from them. You will need scooter as it's a bit of a walk to anywhere and the roads are dodgy to walk as in narrow and winding","2nd time staying here, love the location, service, massages on site. It's a great place for the price. The pool could have been cooler...the whole time we were there I only swam once as the water was so hot it was hotter than outside. Apart from that I'd go back","WIRA Homestay left a very pleasant impression.  We went to Bukit before our departure from Bali and stopped at this place.  they have a very well maintained garden, clean rooms (this is important for me) comfortable beds, we slept well, quiet place and friendly staff, always ready to help!
Thank you 🙏"
ChIJD1maS0pF0i0RnIUDJYbxMc8,Bingin Lodge Uluwatu,-8.815652499999999,115.11502420000001,"Jl. Buana Sari, Pecatu, Kec. Kuta Sel., Kabupaten Badung, Bali 80361, Indonesia",https://maps.google.com/?cid=14929979798158804380,OPERATIONAL,+62 361 4467080,resort_hotel,"resort_hotel, hotel, lodging",4.4,157,,"The rooms were nice and clean and the staff was friendly. There was some noise coming through the walls of the rooms, such as the chatter of the people living next door and a rooster singing in the mornings. The pool area was small but peaceful, although the pool could do with a little cleaning. The breakfast was quite small and modest and could be improved. Otherwise we liked the accommodation and it was walkable to the shops and nice cafes and restaurants nearby. The beach was also a short taxi ride away.","Perfect place to stay in Uluwatu if you want to stay close to the beach, nice restaurants, yoga and Pilates places and still feel the local vibe.
Breakfast is not worthy, coffee is not good.
The pool is amazing and the rooms are clean and wild (as we want it to be in Bali) 😊
Get ready to hear the hens on the neighbors backyard and probably you’ll find these cute cats around the pool asking for cuddles!","very nice and cozy hotel with separate small villas. Comfortable area, well-groomed and clean nice pool. The concept of the hotel is relaxation and privacy in a soft, comfortable environment. The rooms are nice, but for the price they obviously require improvements and a little more comfort. The air conditioner does not work, the owners refuse to charge it and, as a result, it blows slightly cool air. The rooms are cleaned rather mediocrely but every day. They often forget to put in tea, coffee, toilet paper and other necessary things! If I rate the hotel from 1 to 5, I’ll give it a solid 4, mostly due to the location, clean pleasant area and smiling staff","I would highlight the location of this hotel, close to lots of nice restaurants and shops. However, it is very noisy that we couldn't sleep at all (the cabinets' walls are so thin that you can even hear your neighbors talking). The breakfast also disappointed me. In general, I expected more, taking into account the pictures shown in the media.",Good location. Breakfast was 2/5 stars (chips with a set breakfast is not ok..). The lodge is right next to a farm yard so you cannot sleep in past 7am otherwise the chickens will wake you up! Nice pool though :)
ChIJKwD-VsRa0i0Rniovwt8fSnI,Hidden Hills Villas,-8.820433,115.11927100000001,"Jl. Labuansait Jl. Puncak Sekapa II, Pecatu, Kec. Kuta Sel., Kabupaten Badung, Bali 80361, Indonesia",https://maps.google.com/?cid=8235429914496412318,OPERATIONAL,+62 361 8957574,hotel,"hotel, lodging",4.7,227,,"Hidden Hills Villas is really a Hidden gem! Up in the hills you find a quiet place - close to everything- just 10min to the beach. It has stunning view with an amazing sunset. You can feel the vision and the founders love that created the Hotel in every room that has its own expressions. The staff is very kind and service minded. The pool and lounge area are very nice and feels small and private. The restaurant has the best wines on the island and the food is great. It’s not worth leaving the hotel to have food at any other restaurant. Stay and enjoy the sunset, a glass  of wine and the great food. We are definitely coming back to Hidden Hills Villas next year!","Just got back from our third stay at Hidden Hills Villas in Bali, and wow, it still blows me away. That ocean view you wake up to? Unreal. It's Bali's best-kept secret. Our villa was ultra luxurious yet still great for the kids- they've really nailed the whole luxury-living vibe.

The butler service is something else. They just get it. Always there when you need them, but never in the way. And they really know their stuff about Bali, pointing us to some gems we wouldn’t have found on our own.

Oh, and the food? The grilled lobster is a must-try, dining under the stars here is unbeatable.

The whole experience from start to finish is just perfect . It’s the personalized touches that make it for us.

I would give 6 stars if I could","We stayed here for New Year's eve last year and it was the perfect getaway to experience Bali's magical day of silence. Cozy, comfy, stylish, amazing food and service, sophisticated and it was simply a dream to stay at this boutique hotel. We decided to come back a few weeks ago and it was even better. The restaurant has really become a big highlight. Their new spa therapists hands are magical and the team overall just seems to have grown. Everyone of their staff has a wine diploma which is so impressive for Bali standards. But the best part for us is the comfort of the villas (they actually look like in the pictures) as well as the beds, like sleeping on clouds. Heavenly. We will be back soon in what we know to be the best boutique hotel in Bali.","We stayed at the Hidden Hills Villas for 2 nights in early May and thoroughly enjoyed our short stay. We had the Santorini Villa which is a 1 bedroom and 1 bath villa with a private pool. The villa was beautiful and very spacious. There are separate AC units for the bedroom and living room area and both units worked very well. The living room area had a fairly large fridge which contained mini bar items (not free) but there is enough room in it to keep a few of your items as well. This villa has a large outdoor bathroom with a separate shower and bathtub. Since it is outdoors, you are subjected to the weather i.e. it can be quite warm when you are using the bathroom. The staff at Hidden Hills was incredibly helpful and friendly. They use a WhatsApp while you are staying and you can text them with questions, requests, etc. Our head butler, Tusan was very friendly, responsive, and accomodating. He helped us with laundry, room service, local food delivery, and scheduling massages. We also scheduled picked up from Ubud and airport transportation through the resort and Putu was always on time and very friendly. The resort has a small gym with an elliptical, free weights, and cable machine. The gym is open 24 hours but the AC unit in it is quite small and isn't kept running so the gym can be quite warm. During our stay (May 2024) the neighboring property and Hidden Hills were both doing construction. The construction can be disruptive depending on when you wake up. I think construction would start around 7-8 am and we could hear it because it was right next to our villa. Hidden Hills is currently converting a villa into a dedicated spa so if you want a massage, they use one of the empty villas. We did a 90 min Balinese massage and it was wonderful and affordable. Overall, if you are visiting Uluwatu, I would highly recommend staying at the Hidden Hills Villas. The villas are beautiful, the staff is very friendly and helpful, and getting around with Grab from this location was pretty easy. If I visit the area again, I would definitely stay at Hidden Hills.","We stayed a while back at this hotel, which we found through Small Luxury Hotels of the World, and wow, did it live up to the hype! We splurged on their biggest villa - 5 bedrooms just for us four. Sounds excessive, but the deal was too good to pass up.

The place was a dream. Huge infinity pool, an awesome lounge area where we hung out most of the time, a home cinema, and a gym. And the view? Absolutely the best I've seen on Bali, especially the sunsets. Every room was so detailed, from the massive walk-in closets to the fancy bathrooms (mine again had a killer view!). The kitchen was ginormous.

The staff were all stars, especially Imene, the guest relations girl, who made sure we were always happy. And the food? Incredible. Honestly, this place made us feel like celebrities without being stuffy. So worth it!"
ChIJ_xsIbzRF0i0RUyH7u7Ne0Qo,Jepun Sari Uluwatu Bali,-8.8153787,115.1228343,"Jl. Labuansait Jl. Pantai Cemongkak, Pecatu, Kec. Kuta Sel., Kabupaten Badung, Bali 80361, Indonesia",https://maps.google.com/?cid=779508336557760851,OPERATIONAL,+62 811-2942-555,motel,"motel, lodging",4.5,143,,"Loved our stay here. The staff really make the place, so friendly & kind. Rooms very clean and good size. Lovely pool. Sadly not enough sun loungers but there is bean bags. And no food at the hotel, only poolside drinks, just to keep in mind!! But very easy to order food delivery on apps. Not walking distance from any shops or restaurants but again very easy to order taxi / moped.","Such a beautiful villa, and located in very quiet area (if you're looking for peace) which you need transportation to go out but that doesn't matter if you have your own. Bear in mind the villa doesn't have any restaurant but you may order beverages beside the pool bar. Overall I'm kinda love it and staffs are very friendly and attentive",I loved this hotel!! The staff is so friendly and helpful. Beds were comfy. I loved that the bathrooms weren't open so there weren't bugs/animals in the bathroom. It is also a little outside downtown ulu so it was very quiet which was nice.,"Jepun Sari was such a lucky, rare find that I wished we were staying longer when we got there! It's a pretty hotel with great attention to detail in the rooms/bathrooms, a warm energy about it, and smart and helpful staff. I also appreciated the focus on sustainability and their super comfy beds. One thing to note is that they don't serve food, but that's not a challenge since the location is perfect (5-10 mins by scooter to the best coffee shops and restaurants - definitely check out Chela, 15mins to Savaya and Sundays). Overall great value. Recommending it to all my friends. Thanks for a lovely stay!","Beautiful.  Clean with very little bugs. Bathroom is enclosed and clean. Pool is beautiful with a sit down bar in the pool.  Coffee, latte, beer etc are for sale.   Not much walking distance so gojecks car Gojek is a necessity.   But worth it cause it’s so quiet and relaxing.  It’s so easy with a scooter or gojek. The only thing I would suggest for an improvement is a tea kettle in the kitchen for people to be able to make their own tea?   But.   What a small request after such an amazing atmosphere.  I would stay again definitely.  Not the place for parties unless you party elsewhere and come back to sleep   Great!!"
ChIJKQD-VsRa0i0RMjeFaLw_beU,Uluwatu Lumbung Cottages,-8.8173379,115.12197870000001,"54MC+3Q9, Jl. Pantai Cemongkak, Pecatu, Kec. Kuta Sel., Kabupaten Badung, Bali 80361, Indonesia",https://maps.google.com/?cid=16531939885586921266,OPERATIONAL,+62 821-4647-4151,hotel,"hotel, lodging",4.8,130,,"What a place… it was very nice and friendly staff. They were very helpful and nice! The accommodation is very clean but especially cute! Tip: rent a scooter and visit the amazing beaches, they are incredible!","We stayed for 7 nights here. The cottages are clean, spacious and comfortable. The bed is very large and has a mosquito net. AC works great and they will clean the room daily.

The room has a little fridge which will be restocked daily.

The bathroom is comfortable, spacious and clean. Like most places it's semi outside.

The cottages have a little patio where you can hang out.

The options for breakfast are limited but it is delicious.

The pool is small but clean and a really nice place to refresh and sit in the sun or shade.

Like most places in uluwatu you need transportation to get around (gojek or grab), but you can also rent a motorbike from the hotel. Most beaches to the west or south are no more than 10 min by motorbike. Plenty of restaurants can be found within 10 mins.

The service is great, the staff is very friendly and helpful.

All in all, we honestly had a perfect stay!","My favorite place I’ve stayed in Indo the last 3 weeks! The bungalows are so beautiful with canopy beds, rain showers, lovely Air-con, and sliding glass doors open to the plants. The rain and thunderstorm was an extra plus to experience! The staff were always there to help with a smile on their face. Breakfast is simple but delicious and moped rentals are quick and easy. Thank you, I will definitely recommend and come back on my next trip to Ulu!",The cottage was super cozy! It was very nice to be there! We also enjoyed very much the pool and the breakfast. The staff was super friendly and we had everything what we needed! We totally recommend this accommodation!,"Ideally located, not that far from the south and west beach cost. You can rent a scooter for 24 hours at 100 baths.
The personnel doesn't speak well English but they are very kind and always here to help.
The room was quite hot but we had AC so it was fine.

I rate 4/5 because we had one day without water so they gave us bottle of water for shower and toilet which was not very convenient .."
ChIJQ1PbrCZF0i0RkMv-smHTn7k,Shaka Riki,-8.817885,115.115028,"Jl. Labuansait, Pecatu, Kec. Kuta Sel., Kabupaten Badung, Bali 80361, Indonesia",https://maps.google.com/?cid=13375641834881993616,OPERATIONAL,+62 877-4335-9142,restaurant,"restaurant, japanese_restaurant, food",4.6,330,,"We were here two times. Food is delicious, fresh and nicely served, stuff members  are very kind and well trained. The restaurant has authentic atmosphere, we really recommend it and will come back again.",The presentation is the food is superb! Both sushi and the hot plate dish were delicious! The staff is really friendly and polite.,"EXCEPTIONAL restaurant. In Bali less than a week and came twice because we loved it so much. Coming from Seattle, we take our sushi/seafood pretty seriously— these guys are doing great work. Everything was presented beautifully— the fish quality was simply outstanding. Nigiri, MAHI, rolls, tartare, the specials— everything was delicious and at a very very reasonable price point. The best part, though— the team/the service. Simply outstanding. The MOST LOVELY PEOPLE greeted us, took care of us, and wished us goodbye— it was truly the most perfect place. Will recommend to friends visiting Bali with GREAT enthusiasm. 🙏🏼 thank y’all for two equally excellent meals. Please open up a branch in my neighborhood in the USA 😂 ❤️ thank yall again.","Service was great here, the food was also very nice. Ordered lots of different dishes to try","The most attentive smiling staff and incredible sushi at a very affordable price! We arrived in the rain and the staff greeted us with an umbrella to escort us inside, take our helmets and ponchos so we could dry off before being seated. Huge props for excellent hospitality 👏They offer a great variety of sushi rolls, sashimi/nigiri, vegan and vegetarian options as well as noodles, curries and salads. You will not be disappointed."
ChIJO8ET-ERb0i0Rc6p9cZn1wBI,Hidden Gem Uluwatu - Restaurant & Wine Lounge,-8.820437499999999,115.11885649999998,"Jl. Labuansait Jl. Puncak Sekapa II No.Gang, Pecatu, Kec. Kuta Sel., Kabupaten Badung, Bali 80361, Indonesia",https://maps.google.com/?cid=1351349927594011251,OPERATIONAL,+62 819-9009-5665,restaurant,"restaurant, swimming_pool, sports_complex, bar, food",4.8,67,,"Upon first glance of the wine list, one is already mesmerized by the extremely fine selection available both by the glass and the bottle. They do not disappoint. Max the owner is meticulous when it comes to quality as is his entire team. ""Hidden Gem"" located at Uluwatu, Bali has one of the largest, if not the largest wine by the glass selections in Bali. The attention and service of their team is quite magical and only surpassed by the sunsets that one can view right from the wine lounge! It's a home away from home.
Add into this equation, the tantalizing food carefully selected to pair with the wine, the ambience is the most befitting match, and you will discover as I did, ""Hidden Gem"" is truly a ""treasure"" that is polished, unblemished and possesses that bright sparkle that gleams brilliantly.  Well done to both Management and the entire team, a supreme effort, well done.","I’m so glad I found this literal - hidden gem. I had the most delightful afternoon enjoying a bottle of Whispering Angel, oysters and a  charcuterie board. Everything was delicious. The venue is just stunning - incredible views and perfect for sunset. It’s just the right balance between relaxed and glam - I will certainly be back and would urge others to visit. I also had the pleasure of meeting the owner Max and his beautiful family who were visiting and made such an effort to make me feel welcome and looked after. Thanks so much for an amazing day ❤️","I have been on Bali for three weeks and have been at several of the famous restaurants. Hidden Gem is one of the best restaurants in Bali. I would also say that it has the best wines  on the island - the owner is a wine enthusiast and Sommelier. Combined with the amazing food, atmosphere and view - Hidden Gem is a must visit!","Found this chill place in Uluwatu during the rainy season when it's super quiet everywhere and what a find it was. It's got an amazing view of the sunset, with a few other guests just the chilled-out dinner scene we were craving.

The Tom Yum Soup was spicy and tangy, really hit the spot. And the Mongolian Beef that I had with chicken (I know I know) so tender and tasty.

The cocktails, though! Bartender really knew his stuff. It was the perfect spot for a laid-back evening with great food and drinks.

Try to come on the earlier side to catch the sunset.","So excited to have decided to come here. My wife and I tried their wine and food pairing menu and it was delicious! The sunset is unreal, the setting is extremely romantic and the pricing on the wines is the best we've encountered in Indonesia.  A must!"
ChIJKRPl4EpF0i0RmCaTHSv8IGQ,Gatsby Hotel Hostel,-8.8182423,115.1155764,"Uluwatu, Jl. Labuansait No.32, Pecatu, South Kuta, Badung Regency, Bali 80361, Indonesia",https://maps.google.com/?cid=7215043865157510808,OPERATIONAL,,hotel,"hotel, lodging",4.4,47,,"Had an amazing time at the Gatsby Hotel.
It's next to nice restaurants and the beach.
Very friendly staff they did go above and beyond to ensure that I have a nice time there!
Thank you Gatsby Team!","I really don’t know how this hotel got all these good reviews. The first room we got smelled like mold as soon as we opened the door. When we requested another room, someone used room spray as soon as we left the room, just to cover up the mold smell, instead of working on the real problem: mold! The second room seemed a tiny bit better at first, however there was still mold in the room.
What’s even worse: one staff member hit and kicked a dog and locked him into a room. There is no excuse in the world to treat an animal like that. Shame on you!","The staff was absolutely amazing. Very friendly and helpful. Even when I had an incident with my scooter, which I got from another rental company, all the staff helped me, although they actually had nothing to do with it. Very much appreciated! Can't recommend this homestay more!","Room is basic, but comfortable, clean and has everything you need. The location is close to everything, but since the rooms are away from the street it's nice and quiet at night. The staff is helpful and friendly and easy to communicate with through WhatsApp, although there isn't necessarily someone available 24/7 at the property. No breakfast at the hotel, but ""Road Trip Eatery"" is right across the street and has amazing breakfast. Similarly no laundry service, but you can bring it next door to ""Naturela Cafe"". Cleaning your room is only done on a request basis. Overall I would highly recommend this property in this area.

Points to note:
The WiFi would often come and go and was overall not very fast. It's fine for basic browsing, but if you need a stable fast connection it would be lacking.

They accepted CASH ONLY for the room payment. I only found out the day I left and didn't have enough cash. Jerry (staff) was extremely friendly about it and send me their bank details over WhatsApp and allowed me to pay after leaving. Still, be aware of this and double confirm when you check-in.","We absolutely loved our time in Gatsby! We stayed there for a couple of months as the vibes, the people and place itself were so good. Josh, Kassie and Gatsby staff did everything to make our time there special. We met most of our best friends while traveling in this place and It really did feel like our home away from home!  I really recommend it - really close to all of Uluwatu’s special places, warungs, restaurants and beaches! ❤️❤️ Can’t wait to go back some day ☀️"
