id,name,latitude,longitude,address,url,status,phone,primary-type,types,rating,rating-count,price-level,review 1,review 2,review 3,review 4,review 5
ChIJFyslSKyR0S0RN6flXKL-1BM,Arjuna pancake durian Singaraja,-8.1471662,115.1164563,"Jln No.2, Nagasepaha, Kec. Sukasada, Kabupaten Buleleng, Bali 81161, Indonesia",https://maps.google.com/?cid=1429046955080001335,OPERATIONAL,+62 813-3818-8775,restaurant,"restaurant, food",4.6,8,,,,,,
ChIJx5iN9XGR0S0ROmfz1V3paUE,Warung bakso mercon pk kopang,-8.1437353,115.11613549999998,"V448+GF2, Jl. Sari Mekar, Sari Mekar, Kec. Buleleng, Kabupaten Buleleng, Bali 81161, Indonesia",https://maps.google.com/?cid=4713555074250663738,OPERATIONAL,+62 877-3538-7545,restaurant,"restaurant, food",5,2,,,,,,
ChIJ8febnNeR0S0RPVV8XPMrgFA,PT.UME MERTA LESTARI,-8.1413251,115.11599129999998,"V458+F99, Sari Mekar, Buleleng, Buleleng Regency, Bali 81161, Indonesia",https://maps.google.com/?cid=5800684644281898301,OPERATIONAL,+62 857-3807-0273,tourist_attraction,tourist_attraction,5,1,,,,,,
ChIJocRTWGyR0S0RPNOY10H-9LA,WARUNG LUH MAHENI,-8.143608,115.11605479999999,"V448+HC3, Jl. Sari Mekar, Sari Mekar, Kec. Buleleng, Kabupaten Buleleng, Bali 81161, Indonesia",https://maps.google.com/?cid=12751096003736163132,OPERATIONAL,+62 856-3703-416,restaurant,"restaurant, food",2,1,,,,,,
ChIJiXw-vVCR0S0Rq0VEbROd2j8,Depot pangsit singaraja,-8.1400698,115.11581249999999,"V458+X8G, Sari Mekar, Buleleng, Buleleng Regency, Bali 81161, Indonesia",https://maps.google.com/?cid=4601162676075513259,OPERATIONAL,,cafe,"cafe, food",,,,,,,,
