id,name,latitude,longitude,address,url,status,phone,primary-type,types,rating,rating-count,price-level,review 1,review 2,review 3,review 4,review 5
ChIJga4C_fQi0i0R7TAZucivrWM,Thani Villa,-8.4512377,115.25575249999999,"G7X4+G82, Jl. Keliki Kawan, Kelusa, Kec. Payangan, Kabupaten Gianyar, Bali 80561, Indonesia",https://maps.google.com/?cid=7182590257359565037,OPERATIONAL,+62 813-2001-0180,hotel,"hotel, lodging",5,15,,"Property was absolutely gorgeous and in a great location just north of Ubud. Easy access to attractions just outside of town. Quiet spot with amazing host Sentana who was very accommodating. Food was delicious and fresh from the owners farm, as well as the coffee. Cannot recommend this place more!","We had 7 nights at Thani villa as the first part of our honeymoon vacation in Bali. The villa is very beautiful and charming, it is located around 20 min away from Ubud and the villa is isolated from the city noise. It is a perfect place to relax, enjoy the nature and why not to meditate. Sentana is very kind, polite, helpful and tactful person. The breakfast and dinners made by his wife were just amazing. It was just perfect stay for us and we say thanks to Sentana and his family again. 🙏","Perfect for peace and quiet. Large, clean and comfortable villa with all essentials provided. Private pool and gardens are great. Santana is a fabulous host, he is most helpful. Breakfast, lunch and dinners are tasty home cooked meals delivered to the villa. My husband and I thoroughly enjoyed our stay here and definitely highly recommend it and we will return to it.","The best to rest in bali!!! Santana,  the owner is special, friendly, kindness and if you need all the time you will count with him . Thank you  so much our days in bali have been incredible.we can no be more greatful.breakfast delicious!!! Yummy","Beautiful tranquil villa overlooking the sunset. There is a road to walk in the fields starting just from the house. Really cared of, nice lights under trees in the garden. But a ride from Ubud takes 20+ minutes."
ChIJOUUIO8Yj0i0R24HjwEPGRso,MONGKOOG Coffee & Eatery,-8.4502962,115.25576689999998,"Jl. Keliki Kawan Babakan Street No.2A, Keliki, Kecamatan Ubud, Kabupaten Gianyar, Bali 80572, Indonesia",https://maps.google.com/?cid=14575555238332432859,OPERATIONAL,+62 822-3625-7115,restaurant,"restaurant, coffee_shop, cafe, bakery, store, food",4.9,21,,"For me, this is the best place to enjoy breakfast in Ubud. The route is a little difficult to find, but you can enjoy breakfast quietly with the morning sun. The presentation is beautiful and the taste is good! The staff are friendly and the food is delicious. The perfect place to start my day.","Loved this cozy cafe vibe, Surrounded by green and so peaceful, one of the hidden gem cafe in the north of ubud. Out from hustle & bustle of city.
Nice working space with highly speed internet. Coffee taste absolut 10/10 delicious with tasty food and Great price.
And Amazing service from the employee, they are keeping smile and so friendly, make it so comfy☺️
Parking area on premises.
Highly recommed to visit Mongkoog cafe while enjoying the day in Ubud😊😍",I stopped at this cozy spot for a quick coffee break. Unfortunately I didn't had the time to try their food. It looked great so hopefully next time I can try it.,We absolutely loved our visit at Mongkoog. Very friendly staff and tasty food.  Nestled amidst picturesque rice fields while drinking your coffee. Great location just north of Ubud. Definitely  Recommend! Thanks!,So good! Cozy quite spot nestled in between some rice fields. Coffee was delicious and the breakfast hit the spot! If your looking for a nice start to your day I’d highly Recommend!
ChIJLYj6Am8j0i0RU0GNkfzs51w,ACK Fried Chiken KELIKI,-8.446741399999999,115.2630397,"Jl. Raya Keliki No.42, Keliki, Kec. Tegallalang, Kabupaten Gianyar, Bali 80561, Indonesia",https://maps.google.com/?cid=6694579940627398995,OPERATIONAL,+62 812-4606-469,meal_takeaway,"meal_takeaway, restaurant, food",4.3,47,,Food is ok like any big franchise. I just want to thank the friendly and helpful staff who take care of my injuries,"Really cheap local fried chicken, the taste is so good",Good service.👍,,
ChIJpwZ_rTIj0i0R6uv-DaViqSg,Villa Passion,-8.450535,115.2552228,"G7X4+Q3Q, Jl. Keliki Kawan, Kelusa, Kec. Payangan, Kabupaten Gianyar, Bali 80561, Indonesia",https://maps.google.com/?cid=2929981493625154538,OPERATIONAL,,lodging,lodging,5,2,,A charming villa in the middle of the rice field. Ming will take care of everything and let you rest and enjoy the surroundings villa is just awesome!,,,,
ChIJt9B3ziMj0i0R12uYRWr-xTo,Maitri House,-8.446175499999999,115.2585824,"Jl. Keliki Kawan, Kelusa, Kec. Payangan, Kabupaten Gianyar, Bali 80572, Indonesia",https://maps.google.com/?cid=4235070756999424983,OPERATIONAL,+62 831-4288-2775,guest_house,"guest_house, lodging",5,5,,,,,,
ChIJp8x14x8j0i0R46OD55WGY_0,Teba Griya House,-8.4503336,115.2584811,"banjar keliki, kawan, kelusa, Kec. Payangan, Kabupaten Gianyar, Bali 80572, Indonesia",https://maps.google.com/?cid=18258585292682535907,OPERATIONAL,+62 812-3948-3313,,lodging,5,1,,,,,,
ChIJb66d0SYj0i0RqE_rIElQzpU,"Lemon Grass Villa, Br.keliki kawan, Ds.Kelusa, Kec.Payangan",-8.447125699999999,115.25590109999997,"Jl. Keliki Kawan, Keliki, Kec. Tegallalang, Kabupaten Gianyar, Bali 80572, Indonesia",https://maps.google.com/?cid=10794653631868784552,OPERATIONAL,+62 821-4500-1909,private_guest_room,"private_guest_room, lodging",5,4,,Beautiful place in the middle of lush jungle. Beautiful surrounding give you peace and tranquility.,Hidden gems in Ubud for sure ❤️,,,
ChIJNwfwTBcj0i0R7w9e6KrKtvI,Villa Umah Bamboo,-8.452719799999999,115.2573588,"G7W4+WW9, Jl. Keliki Kawan, Kelusa, Kec. Payangan, Kabupaten Gianyar, Bali 80561, Indonesia",https://maps.google.com/?cid=17489389038331629551,OPERATIONAL,+62 813-3766-7166,hotel,"hotel, lodging",4.8,5,,Very great villa with the super comfort and cozyness...,,,,
ChIJMWeOPnAj0i0RRml8T8JJl1I,Nini Warung,-8.4470876,115.2563868,"Jl. Keliki Kawan No.Desa, Kelusa, Kec. Payangan, Kabupaten Gianyar, Bali 80572, Indonesia",https://maps.google.com/?cid=5951306531499436358,OPERATIONAL,+62 823-3919-2281,restaurant,"restaurant, food",5,73,,"The food is amazing! I eat it frequently. Also, sometimes I don’t want rice and I ask for vegetables instead and they are great at understanding my needs and replacing things in my plate correctly. They are fast, the food is tasty and good price. I’ve ordered the noodles, wings, chicken with veggies and rice and they are all great. The noodles are my favorite but they are greasy, as any other Balinese food. I ask for scrambled egg instead of fried egg, but the noodles usually include the fried egg.","An authentic Balinese food, made by local chef. This is the way how you taste real bali flavor, it is located in the middle of Balinese compound house.
If you would like to try the true Balinese experience, come and try and you will know how beautiful it is !

Western food also available something like pasta",EAT HERE! The atmosphere is clean and happy. The staff is kind and clearly puts a lot of effort into the food and presentation! And the food is super delicious!! 🥰🙏🏼,"I have eaten here several times over the last week and will certainly continue to do so. The food is fresh, delicious and cooked/served to perfection. The menu presents traditional Balinese dishes with some western additions to suit most tastes at prices that will please everyone. Cold beer and a range of fresh drinks are also available.
The restaurant is located towards the rear of the family compound, don't be afraid to come straight in at the entrance near the street sign.
Highly recommended!","I was staying at a villa nearby and wanted some authentic Balinese food. Nini Warung had exactly what I wanted. I ordered the nasi campur and I loved the variety it offered. The dish allowed me to taste some of the most delicious Balinese dishes on one plate. By the end of my meal, I was fully satisfied.

In addition to the delicious food, the family that run the restaurant are very kind and friendly."
ChIJSSQsCaAj0i0RaD11gN5wZIA,Rumah Makan Jero Nini,-8.4505386,115.2634116,"G7X7+Q9M, Jl. Arjuna, Keliki, Kec. Tegallalang, Kabupaten Gianyar, Bali 80561, Indonesia",https://maps.google.com/?cid=9251643635466059112,OPERATIONAL,+62 361 8989140,restaurant,"restaurant, food",4.8,4,,Excellent private cooking experience with a lot of information about traditional Balinese way of living. Mr Dewa shares his knowledge & beliefs with great enthusiasm.,Enjoyed the traditional cuisine.,,,
