id,name,latitude,longitude,address,url,status,phone,primary-type,types,rating,rating-count,price-level,review 1,review 2,review 3,review 4,review 5
ChIJyznwU4cJ0i0R40oe-dXVhYs,Pondok Diana,-8.4896946,115.6038932,"Jl. Pantai Perasi, Perasi, Pertima, Kec. Manggis, Kabupaten Karangasem, Bali 80811, Indonesia",https://maps.google.com/?cid=10053676858158762723,OPERATIONAL,+62 821-4438-6780,,lodging,4.6,58,,"This place is an amazing rural stay, if you wanna get some peace and quietness.
15mn walk from Virgin Beach.
Diana was an excellent host, he took me on an amazing tour and we had a lot of fun!
I highly recommend.","Location is good, 26 min walking to the virgin beach. The young adult girl is nice and responsive and her mother is sweet as the staff around. The rooms need a little improvement for the beds as there are bed bugs and the bathrooms need better structure. The only serious masked issue is the man who runs the place can be disrespectful and invasive, does not know about boundaries and can disrespect solo women, and the place seems to host more men. Not so friendly for female solo travelers as it can be intimidating.

Update after reply: it's interesting to observe how people react so badly when consciousness is not clear... They rather attack, diminish others and create stories... Really hope someday this good consciousness lands in you and you can honor the people around you and respect all. Such a beautiful family and nice people working there deserve a better leader.","Very Simple and Quiet Place but also a good location. Just few Minutes from a Tempel and the Beach away. Very good Breakfeast. The Family is very open and friendly, if you have any questions about what to Visit or the Culture in general, you can ask them anything. Would also recommand to visit the Water Temple in the next bigger village.","We had a room with a big veranda on the second floor. We were going to stay for 3 days and ended up staying a week. The room itself was big, about 30 sqm probably and felt really spacious with a king size bed. It took about 10 minutes to walk to the beach and the road there is mostly shaded by trees, it's a perfect walk. There are also some small shops close by. It's just perfect if you want a quiet place to stay but still close to the beach.
Best of all is the family running the place. Always helpful and caring. Diana, the owner,  always asked us if there was something we needed and gave us rides to money exchange/shop/restaurant. The daughter fixed us breakfast and was also very helpful and caring. It feels a little like visiting distant relatives but you only get the good parts 😀","Located in a remote and calm place,
The owners are really kind and helpful, keen for a chat and interested in your whereabouts. Happy to give good suggestions and directions.
Would come back 💜"
ChIJPTijHZIJ0i0Rjb29rkmSh8U,Wantilan Desa Adat Perasi,-8.4848074,115.60257759999999,"GJ83+32G, Jl. Raya Perasi, Pertima, Kec. Karangasem, Kabupaten Karangasem, Bali 80813, Indonesia",https://maps.google.com/?cid=14233505992489680269,OPERATIONAL,,historical_landmark,historical_landmark,4.8,8,,,,,,
ChIJLyyfUukI0i0RCFCge5U1AjE,Jaya Fried Chicken,-8.4876881,115.5976091,"GH6X+W2H, Jl. Raya Bugbug, Sengkidu, Kec. Manggis, Kabupaten Karangasem, Bali 80811, Indonesia",https://maps.google.com/?cid=3531443973952393224,OPERATIONAL,,meal_takeaway,"meal_takeaway, restaurant, food",4.2,52,,The only thing good about the food is that it's cheap.,Quick service,Nice,Recommended,k u r a n g r a m a h
ChIJR1jrPUYJ0i0R7fgDywHRWTk,Warung Olahan Gus Kembar,-8.485714100000001,115.6002585,"GJ72+P46, Jl. Raya Perasi Jl. Raya Timbrah, Pertima, Kec. Karangasem, Kabupaten Karangasem, Bali 80811, Indonesia",https://maps.google.com/?cid=4132563938720348397,CLOSED_TEMPORARILY,+62 857-3702-3470,restaurant,"restaurant, food",4.3,13,,The place was permanently closed when visited.,,,,
ChIJRS_jNEkJ0i0R_j2XxiKEMFs,Umeduran Cottages & Resto,-8.4845283,115.6016105,"GJ82+5JQ Ds Klungah , Desa Wismakertha, jl Wangsean Sidemen, Pertima, Kec. Karangasem, Kabupaten Karangasem, Bali 80813, Indonesia",https://maps.google.com/?cid=6570897141229108734,OPERATIONAL,,restaurant,"restaurant, food",,,,,,,,
ChIJK-VrlAEJ0i0RK4QIfx3qLDo,Warung yang rain,-8.485735199999999,115.6002467,"GJ72+P35, Jl. Raya Perasi Jl. Raya Timbrah, Pertima, Kec. Karangasem, Kabupaten Karangasem, Bali, Indonesia",https://maps.google.com/?cid=4191982765581304875,CLOSED_TEMPORARILY,,night_club,night_club,,,,,,,,
ChIJidlIKu4J0i0Rdy_g5_EtpT8,Bakso Babi Giri Artha,-8.4881046,115.59718299999999,"GH6W+QV3, Jl. Raya Bugbug, Sengkidu, Kec. Karangasem, Kabupaten Karangasem, Bali 80871, Indonesia",https://maps.google.com/?cid=4586122312547315575,OPERATIONAL,+62 813-3820-8211,indonesian_restaurant,"indonesian_restaurant, restaurant, food",4,2,,,,,,
ChIJ4SxKwXYJ0i0R9cmv0n1KSJw,Warung Lalapan Bu Eny,-8.4850721,115.60245230000001,"Jl. Raya Perasi, Pertima, Kec. Karangasem, Kabupaten Karangasem, Bali 80811, Indonesia",https://maps.google.com/?cid=11261332772506028533,OPERATIONAL,,restaurant,"restaurant, food",,,,,,,,
ChIJodploEUJ0i0ROIU7twcg40M,Pondok Dlod Poh,-8.4881431,115.59701259999999,"GH6W+PRR, Jl. Raya Bugbug, Sengkidu, Kec. Manggis, Kabupaten Karangasem, Bali 80811, Indonesia",https://maps.google.com/?cid=4891788837765481784,OPERATIONAL,,private_guest_room,"private_guest_room, lodging",5,1,,,,,,
ChIJpWDM_zYJ0i0RHZIPpWCA3hE,juna homestay,-8.4862111,115.59825620000001,"GH7X+G86, Sengkidu, Manggis, Karangasem Regency, Bali 80811, Indonesia",https://maps.google.com/?cid=1287607696049017373,OPERATIONAL,,private_guest_room,"private_guest_room, lodging",,,,,,,,
ChIJvREzJewI0i0RIWBq5BUlCSM,WARUNG SATE IMPIAN,-8.4863081,115.5998092,"Pertima, Karangasem, Karangasem Regency, Bali, Indonesia",https://maps.google.com/?cid=2524589842074591265,OPERATIONAL,,restaurant,"restaurant, food",,,,,,,,
ChIJG46kx7UJ0i0RyOqnrr8t04Y,IKETUT MERTA,-8.486227399999999,115.5982635,"GH7X+G82, Sengkidu, Manggis, Karangasem Regency, Bali 80811, Indonesia",https://maps.google.com/?cid=9715159122460535496,OPERATIONAL,+62 815-4767-8293,private_guest_room,"private_guest_room, lodging",,,,,,,,
ChIJ2S_DTukI0i0RhbAHL_qdsD0,Warung Kesyana Jaya,-8.4880357,115.59722219999999,"GH6W+QVQ, Jl. Raya Bugbug, Sengkidu, Kec. Manggis, Kabupaten Karangasem, Bali 80811, Indonesia",https://maps.google.com/?cid=4445226530071097477,CLOSED_TEMPORARILY,,restaurant,"restaurant, food",,,,,,,,
ChIJETeg8GQJ0i0ROgQ5H-NbVEM,Warung Topeng,-8.4849845,115.60267429999999,"GJ83+233, Pertima, Karangasem, Karangasem Regency, Bali 80813, Indonesia",https://maps.google.com/?cid=4851603729624400954,OPERATIONAL,,restaurant,"restaurant, food",3.7,7,,,,,,
ChIJn4RaENgJ0i0RBlA8SlRcB5s,WARUNG IBU ENI,-8.4849902,115.6026808,"GJ83+233, Pertima, Karangasem, Karangasem Regency, Bali 80813, Indonesia",https://maps.google.com/?cid=11170998917808279558,CLOSED_TEMPORARILY,,indonesian_restaurant,"indonesian_restaurant, restaurant, food",,,,,,,,
ChIJbbeVeD4J0i0RITpjI-AHyaw,Taman Tirta Funaga,-8.488166999999999,115.60446280000001,"jalan raya pasir putih No.1, Pertima, Kec. Karangasem, Kabupaten Karangasem, Bali 80851, Indonesia",https://maps.google.com/?cid=12450491304090221089,OPERATIONAL,+62 813-3722-3216,private_guest_room,"private_guest_room, lodging",,,,,,,,
