id,name,latitude,longitude,address,url,status,phone,primary-type,types,rating,rating-count,price-level,review 1,review 2,review 3,review 4,review 5
ChIJf6_Hf-Lz0S0RCOZ-hS5qiTo,Pinggan Sunrise View Pohon Cinta,-8.210235599999999,115.3648534,"Q9Q7+WW5, Pinggan, Kintamani, Bangli Regency, Bali 80652, Indonesia",https://maps.google.com/?cid=4218019274049906184,OPERATIONAL,+62 819-9903-2529,tourist_attraction,tourist_attraction,4.7,131,,"One of the best spots to see the sunrise in Pinggan Village, Kintamani, is with Mount Batur in the background. The best time to visit is before sunrise when the landscape is stunning. The stunning views and serene atmosphere make it worth the early wake-up call. Parking facilities are available, and the entrance fee is IDR 10,000 per person, which is quite reasonable. This place is highly recommended for photography enthusiasts looking to capture breathtaking sunrise shots. It's better to check the weather forecast before visiting to ensure clear skies and the best possible experience","I visited during sunrise, and I can assure you that it was worth waking up early for. As the sun gradually emerged from behind the mountains, the entire landscape bathed in warm hues of orange and gold. The interplay of light and shadows added a touch of drama, creating a scene that seemed straight out of a painting.

Note: It's always a good idea to check the current weather conditions and visibility before planning a visit to Kintamani's mountain overlook to ensure the best experience.","Great sunset photoshot point, amazing misty view on the Songan Village, great Batur Volcano view with perfect sun rises spot. Be ready to pay the parking fee, and personal fee. 10K Rupiah/person will be charged on the spot 😃🙏🏼","Leaving bitter after taste, when local people stop us from driving out, demanding for $$$.

Don't mind paying if stated clearly with signage. many other tourist spots are chargeable, with clear signage, and giving a chance to proceed or back out.",Amazing view!! Better be here before 5.30am
ChIJGz23-mjz0S0RM9Cb4nHmUTY,Pinggan Panorama,-8.2100713,115.36479209999999,"Pinggan, Kintamani, Bangli Regency, Bali 80652, Indonesia",https://maps.google.com/?cid=3914162927969226803,OPERATIONAL,+62 859-6064-3365,hotel,"hotel, bed_and_breakfast, private_guest_room, lodging",4.7,9,,"Newly open
And this place is the best to enjoy the  sunrise view",Stuning sunrise view,,,
ChIJL6P-PQDz0S0R0Iqez_wTXZI,sukawana,-8.210223,115.36485270000001,"Q9Q7+WW9, Sukawana, Kintamani, Bangli Regency, Bali 80652, Indonesia",https://maps.google.com/?cid=10546607878907529936,OPERATIONAL,,tourist_attraction,tourist_attraction,,,,,,,,
