id,name,latitude,longitude,address,url,status,phone,primary-type,types,rating,rating-count,price-level,review 1,review 2,review 3,review 4,review 5
ChIJE_JDSnM-0i0RcByORq0nW1g,"Sthala, a Tribute Portfolio Hotel, Ubud Bali",-8.5724771,115.25964809999999,"Jalan A.A Gede Rai, Jl. Raya Mawang Kelod, Lodtunduh, Ubud, Gianyar Regency, Bali 80571, Indonesia",https://maps.google.com/?cid=6366726123384872048,OPERATIONAL,+62 361 3018700,hotel,"hotel, wedding_venue, event_venue, lodging",4.7,2141,,"What an incredible place. My friends & family & I are so thankful we ended up here after having to leave our previous hotel. I can’t say enough good things - the rooms are great, the pools are great, and the food is great. The breakfast buffet has thousands of options, and the dinner menu is great. The rooms aren’t anything crazy, but they are clean, spacious, and have a nice balcony. What really sets this hotel apart is the staff. Every single employee, from the check in staff to the cleaners to the cooks are so pleasant. We were a party of 6, and they knew us all by name, knew our coffee orders and knew our room numbers. They are incredibly polite and go above and beyond to help with anything. The shuttle to Ubud is a great touch, as is the complimentary water. We were due to leave this hotel to head further north, but decided to extend our stay by two nights due to the amazing experience. After hundreds of hotel stays, this is for sure a top-10 worldwide. Special thanks to Gayatri at the breakfast buffet for her kindness and attention.","I had a fantastic 4 night stay here. Beautiful location and property. The breakfast is 10/10. The restaurant and bar foods are also very good. The rooms clean and great size, loved having a balcony.
The level of hospitality offered by staff is incredible. They were all so personable and remembered my name, how I liked my coffee, my room was restocked with extra coffee and towel animals with cute little messages. The staff really did make my experience here.

The hotel itself isn’t in walking distance to center of Ubud but the shuttle service is so nice. You get dropped off and picked up at the same location which has a very nice supermarket, it’s perfect for grabbing anything you may need for back at the hotel.
However; the pools, restaurant, and bar are really nice at Sthala, perfect if you don't feel like going anywhere a day. There are also two cafes, one across the street I didn’t get to try but I did walk to SCENT coffee down the street and got a beautiful cocktail and a snack one evening.
Thank you for the wonderful stay!","I had the pleasure of staying that hotel  for two nights, The hotel provided a stunning ambiance and the breakfast was absolutely good. What made the experience even more exceptional was the incredibly friendly and helpful staff. They went above and beyond to ensure my stay was perfect. Overall, it was an unforgettable experience that exceeded all my expectations.
sasha","Stayed here for three nights. I had no issue other than the towels are too smelly of bleach, pillows are rather hard (if your preference is soft) and breakfast is rather dull despite a range of choices. The machined coffee is strong so watch out. Staffs were great; they are very welcoming.","I wish this hotel was my home. We stayed here for a too short time of 2 nights and we had a great time. We especially loved the staff, everyone was so kind to us and helpful. We also loved the pools, the food, the decor, the room and the mocktails. We loved it all and would 100% come back. Ubud as a town is also a nice and interesting place to discover. 10/10"
ChIJybGHQXM-0i0RXqpo9LCOYfo,Avalon Castle and Spa,-8.571007999999999,115.258977,"Jl. Carmazzi Br. Mawang Kelod No.1, Lodtunduh, Kecamatan Ubud, Kabupaten Gianyar, Bali 80571, Indonesia",https://maps.google.com/?cid=18041858472888805982,OPERATIONAL,+62 812-3984-7685,resort_hotel,"resort_hotel, hotel, lodging",4.4,230,,"We stayed four nights here and we couldn’t be happier with our experience. The hospitality was outstanding; before we had even been taken to our room a friendly staff member brought us complementary limeade! The location was stunning and the whole place had so many interesting pockets to explore: multiple pools overlooking a river, beautiful carvings and extra touches like a pool table and small gym setup. Our room was very clean and the staff were never intrusive. Bad reviews mentioning lots of bugs are overblown and seem to miss the fact that the villa is situated over a river; just bring some bug spray and you’ll be fine. Everyone who worked there went above and beyond. I could go on and on! Would highly recommend this place to anyone staying in Ubud.","Theme Park Castle Gone Wrong…

A lovely swimming pool and river view. I enjoyed the  outdoor lounge as the veranda chairs were interesting (in the castle theme park aesthetic) but not comfortable to sit on. I thought the mermaid shower with the stone used as a tap was charming. My daughter enjoyed two of what she described as ""best in Asia"" massages at the pool however the poor massage therapist kept getting interrupted by guests dining at the pool asking for cutlery or water which then ruined the experience. A very strange set up. This venue which is run by a family that might of travelled but have zero experience in running an establishment.
The effort was put into the original ""design"" and
then stopped right there. A strong impression that they have lost interest in being in the hospitality industry.

88 stairs at uneven levels to get up and down to your unit - so this is not ideal for persons suffering with any knee issues. The property is very rundown - when we first arrived we thought we had the wrong venue. Weeds, plastic bottles, smelly hot dogs (my heart broke) that belong in Alaska chained with no water bowls, a strange smell and junk lying around the entrance floor.

The area seemed dodgy - a building site with windy, dangerous pothole roads. We then arrived at the ""theme park"" library area where we ""met"" the owner for a two second glance. He had been pontificating in an American accent about how hated a guest speaker had been at some convention. We then noticed the odd Al screen that replicated what looked like the owner - the creepiest thing we have ever seen!

The young girl working at reception was friendly and took us on the grand tour of a property that has seen better days. Such a huge pity, the river view gives this venue an edge and some serious design work was put into the creation of the ""castle"" however it is now sadly very run down. Our unit was tiny, no space to open our suitcase. Bed linen torn and run down. The bathroom at first looked beautiful but turned out to be a very strange experience. The bath plug leaks so you need to keep water running. No hot water - it was a lukewarm to cold experience. The window looking into the bathroom we later discovered to our disgust allowed the staff standing outside to see the shape of your naked body. The skylight roof
was covered in green mould. The complimentary toothbrush bristles break free into your mouth and the boxes were covered in a thick layer of dust.

You hear the person sneeze in adjacent rooms and our balcony was in arm length to the next unit. No privacy at all. The “gym” is in reception - looks more like it has been put in place for family use when nobody is at the “resort”.

The food app that runs the venue is clever however the food itself was a huge disapointment. Even the fruit salad disappointed - warm fruit served in bowls with hairline cracks, that are chipped. Our 4 day stay left me feeling unsettled - the energy is seriously off and the property is very neglected.",We had a good time here. Rooms are a little dated but served us well. Definitely a very quirky place. Aircon worked well and was definitely needed in the heat. A lot of steps so wouldn’t suit anyone not very mobile,"We stayed hardly there 2 nights. When we arriaved to hotel, they gave us a room made by wooden which was very narrow and dirty and full of insects. Bed was upstairs. Not userfriendly. So we did not want to stay there and talked with them, they changed our room with the better one. But still there were lots of problems, bathroom was open window so there was no clean towels (very bad shampoo together with dush gel), also bedlinens were very dirty, no hairdrier. Surroundings of hotel was terrible, dark and nothing. Like middle of nowhere. Very far away to city center. We even could not reach easily to the market. So I never suggest you this place. You should look for central hotels not Avalon.","Avalon castle was the best stay I ever had. Staff and managers were so polite and humble even  I was given upgraded room as complimentary. Stay was impeccable. It makes you feel you’re living in a real castle. Highly recommended, if you wanted to make your vacations more intriguing and terrific in bali this is the best property you can stay in."
ChIJ78IK93I-0i0Rlh0Wr79GZvc,Negari Luwak Coffee,-8.5745203,115.257161,"C7G4+5VV, Jl. Raya Singapadu, Singapadu Tengah, Kec. Sukawati, Kabupaten Gianyar, Bali 80582, Indonesia",https://maps.google.com/?cid=17827013964082847126,OPERATIONAL,+62 812-3830-8282,cafe,"cafe, food",4.3,651,,Amazing tour with very good information about the Balinese culture as well as the process of the Luwak coffee. Free entry. Very friendly and knowledgeable guide. The free tasting boards of tea and coffee were so good we bought many of them afterwards in the shop. The Luwak coffee is the smoothest coffee I have ever tasted and I am not the biggest coffee fan but I bought some to take home. You can buy a cup of the Luwak coffee for 50k rp and it is worth it! This place was recommended from our driver and we are so glad we went. I would consider this a must do in Ubud!,"Beautiful place! Actually we went to the kintamani plantation the day before, but we decided to try this place out.

The coffee was really good! They had many pets and there was also a tour of their family home, as this seems to be a family business. I highly recommend this if you want to try luwak but don't want to travel to kintamani. This is well within Ubud area. The coffee testing is free, but luwak is 50k per person. We also like the variety of teas as they offer sugar free options.

Do prepare mosquito repellents!","Negari Luwak Coffee offers a fantastic English tour that's well-explained. The variety of options to try makes the experience enjoyable, and the overall tour is genuinely interesting. Highly recommended for coffee enthusiasts!","The main focus is on Kopi luwak coffee, but it does have a variety of coffee, tea, and cocoa. They have a very interesting tour that shows the process of making the luwak coffee. Well worth a visit!","Rahayu was a brilliant guide from start to finish! She was very friendly and spoke excellent English, we thought she was from the U.K. at one point. The coffee and tea was very good and we were happy with the experience.

The civet cats weren’t under good conditions, with most of them locked in tiny cages. So this is an improvement they should definitely make. However the experience was a nice one and I would recommend."
ChIJJboaZQw_0i0RjDq0U0Fgybg,Dia Coffee ubud,-8.5730382,115.2601176,"Jl. Raya Mawang, Lodtunduh, Kelod, Kabupaten Gianyar, Bali 80582, Indonesia",https://maps.google.com/?cid=13315279606991043212,OPERATIONAL,+62 877-6196-5160,coffee_shop,"coffee_shop, cafe, store, food",4.7,145,,"This is definitely a top place. Prices, quality of ingredients, taste, variety - everything is super! Cappuccino, matcha latte, bowls and burger are perfect!!
The service and the tableware in which everything is served are also excellent. Thank you for this experience :)",Great place near Sthala Ubud for yummy coffee and food. Reasonable prices and nice place to hangout. Would recommend the place in ubud for coffee and a quick meal. The restaurant plays awesome music and has good Wi-Fi. Aesthetically decorated and nice service.,"Fast service 👍 good coffee
Love their rice bowl menu, inexpensive and  quite big portion for me, great for lunch",Nice cafe conveniently located near our hotel. Does decent lattes as well as cold drinks.,"Good coffee, good croissants, good place to work but the music is so loud, wish they would turn it down a little.
Price is very reasonable."
ChIJP2JZ8AA_0i0R57CKA_KKflg,SCENT Coffee Ubud,-8.5708035,115.26082609999999,"Lodtunduh, Ubud, Gianyar Regency, Bali, Indonesia",https://maps.google.com/?cid=6376686894449340647,OPERATIONAL,+62 811-3941-4388,coffee_shop,"coffee_shop, cafe, store, food",4.9,100,,The closest place to where I’m staying happens to be REALLY REALLY GOOD. I think I have been here 5 times at least. The teas are amazing. I also really liked the teriyaki bowl as well as the chicken burger. Food is great service is fantastic. Give them a try you will be very happy you did.,"Found this place while we were visiting bali zoo, and come back before we left bali 😂

I am in love with the coffee, unfortunately i didn’t stay near scent so i didn’t have the chance to try the whole menu.

Price wise, it’s such a steal.

The ambiance is great. Not crowded, but rather calm and quiet (at least while my visit).

You should try it for yourself. ✨✨",Ate here several Times during our stay in Ubud. Totally recommended it. Good quality and prices.,"This cafe was great, I forgot to take my glasses with me and the staff kindly set them aside safely for me to pick up.
Quite vibe to this place which I loved, service was fantastic and the staffs were exceptional.
I’ll be very happy to come back to Scent again.","Nice place, I wood say it’s a hidden gem ) the drinks is awesome 🔥
also during the weekends they have a great live music 👍 definitely recommend"
ChIJ69FqSnM-0i0Rtg1p1_QXs30,Naga Rooftop Bar and Lounge,-8.5724559,115.25942080000002,"Jalan A.A. Gede Rai, Lodtunduh, Kecamatan Ubud, Kabupaten Gianyar, Bali 80571, Indonesia",https://maps.google.com/?cid=9057609615925644726,OPERATIONAL,+62 811-3805-897,bar,"bar, night_club",4.4,20,,"Best spot to enjoy sunset with jungle and river views. The best rooftop bar and lounge in Ubud Bali. Currently no minimum charge or cover charge apply and open for public. It’s value of money. Recommended to visit during happy hour time, buy one get one free. My favourite place in Ubud Bali🥳💕❤️🎉🎊🍻🍸🥂🍹",Good place to enjoy sunset glimpse. They have happy hour from 4 to 7 pm.,"Great view, hospitality, and nice happy hour. Hot, though.","The mezzanine terrace offers amazing views, the food and snacks are exceptional. However the alcoholic beverages can be quite strong for some people's taste.",Great view and ambiance accompanied by good music. Nice cocktail and crunchy complimentary cassava chips. Will surely come back for more.
ChIJwxIeHsU_0i0Rb9fj0i2WB_M,River View House,-8.5740224,115.2583901,"Banjar Negari, Jl. Sadewa, Singapadu Tengah, Kec. Sukawati, Kabupaten Gianyar, Bali 80582, Indonesia",https://maps.google.com/?cid=17512130799609304943,OPERATIONAL,+62 812-3830-8282,guest_house,"guest_house, hotel, lodging",4.3,43,,"We booked for a month through AirBnB and the reviews on there were quite positive.  I later found out because Mr Wayan does not post a review of you so they are not published.  So we stuck it out for about 3 weeks so as to not lose all the 'non refundable' payment.  Now I know why it is non refundable,

As others have said, the place is noisy and poorly maintained and the pandemic excuse has expired.  Thinking it would be a popular place, I booked early but we did not see many people.  Some turned up and left after a few hours- -- yes - it was not like the photos at all.

Swing: broken, heart thing: overgrown with weeds: net over river: unusable,  Pagoda: roof gone, bathroom: dirty and smelly. Many amenities on airbnb: BBQ, laundry, iron, oven, the list goes on are nowhere to be found.

There really is nowhere decent to eat in the area - street warungs only. But riding for 15 - 20 minutes we found some nice places: Joglo Krasan and Warung Wasan were a couple of favourites.  Cooking in the kitchen was a challenge unless you choose to pack your own utensils and saucepans.

Breakfast was OK and the girls who served us were very nice but they just work there and they work at another location so you are pretty much on your own.  Another guy seemed to sweep the path and make the beds of departed  and (no doubt) disgruntled guests.  Things did get done - but only after asking.  Gas bottle ran out, water bottle (no dispenser - broken) empty.  And do ask to get the sheets and towels changed when required as that is not done.  Additionally, the pool was so green a couple of weeks in that I asked and it did get some chemicals thrown in but *staff*, please open your eyes.

Any positive reviews on google seem to be from the previous owner.  I even found a dusty drinks menu in the filthy store room.  A memory from yesteryear.","A nice place to stay but it looks very abandoned. Plenty of insects that include big spiders that look frightening. The shower is accessible by the insects as the trunks behind each bungalow grew under the roof so they easily get inside. The beds have little insects also that like to bite humans.
This place is in a deep need to be disinsected before accepting people.
Overall we got one night free out of the four nights we stayed which was lovely, but couldn't cover the discomfort due to the insects.","The place is hidden. Access road is small but you can come by car. It's literally by the river, so the view is amazing. The room itself is tiny but comfy. They have swing too, but during the pandemic it's not operating. When I came, the room was kind of dirty. The staff' response was quick- She cleaned immediately. They only have 4 rooms, so you don't have to worry about the noises next door. However, across the river, there's a bridge road, so it's still noisy (we can see and hear from the room, even when the door is closed). Just like any other tropical places in rainy season, there's a lot of mosquitos. So you need to get ready with your own insect repellent spray or lotion. For what it's worth, this place offers great view, has comfy bed and also provides breakfast.","We arrived to a noise part of ubud(noise from the road and car horns), which was meant to be quiet. The room was nothing like the photos and was really run down. The room was invested with bugs and had ants everywhere. Careful of the door to the room because they lock but have a gap about 10cm wide. We decided to leave the hotel and not even stay for 1 night. I urge anyone not to come !","It's a jungle resort, in the midst of a jungle, when you are in harmony with the nature around you, you won't be affected by the natural beings around you
Book your travel during the stay with them, you will get great rates.

Even the AirBnB owner's restaurant is spectacular with huge portion sizes of food

If you behave like a decent human being, owner is very generous with discounts in rates, whether you get any reductions be nice to the staff.

There is alfamart nearby to buy things you need to make it yourself if you wish to

The VW day tour to coffee plantation, nearby areas are excellent too

When you check in,  check your rooms, eat outside the room in the pantry to avoid ants

They are great kind people with a fun jungle resort feel"
ChIJreD6GRI_0i0RxJKc5vfSnQc,Tegal Anyar Villa,-8.57165,115.26182580000001,"C7H6+8PP, Jl. Raya Mawang, Lodtunduh, Kecamatan Ubud, Kabupaten Gianyar, Bali 80582, Indonesia",https://maps.google.com/?cid=548826691776844484,OPERATIONAL,,lodging,lodging,5,7,,,,,,
ChIJAfBDHLQ_0i0RRVOBcfdFFWM,Sungai Restaurant,-8.5724737,115.2593228,"Jalan A.A. Gede Rai, Lodtunduh, Kecamatan Ubud, Kabupaten Gianyar, Bali 80571, Indonesia",https://maps.google.com/?cid=7139689713329328965,OPERATIONAL,+62 361 3018700,restaurant,"restaurant, food",4.6,32,,"An open air restaurant nestled in the ground floor of the Sthala Hotel.  We came here to eat after a very busy traveling and arriving at the Sthala.  The view from the restaurant looking out over the jungle is beautiful.  Staff were friendly and attentive, and food came out about 20 minutes after ordering.  Everything was delicious.  Particularly recommend the gado gado!","Food is great. We didn’t stay here just ate at the restaurant. The service was incredible from the security helping us cross the road to the reception staff taking us all the way to the restaurant, to the waiter and waitresses in the restaurant. Would recommend.",Amazing food and good service! Love it!!,"Great place to get a drink and a bite, prices are reasonable. Also you can go for a walk down by the river.","The food here was impeccable! The staff were so friendly and made us feel so happy, we weren’t staying in the hotel but this made us want to! Delicious, highly recommend if you’re staying nearby."
ChIJR4yqEWU_0i0RmkPBKmdokgA,The LOD House,-8.5773285,115.25715779999999,"Central Singapadu, Sukawati, Gianyar Regency, Bali 80582, Indonesia",https://maps.google.com/?cid=41210138907984794,OPERATIONAL,+62 878-6236-6717,,lodging,4.3,27,,"Overall, the price for 3 rooms is affordable. And it has picturesque view and pool to enjoy.
And CVS is near the property on walking street.
But, It's too far from central ubud. It takes about 40-60mins by a car.
There were terrible things I felt during staying here.
1. No answers even though I contacted the property manager and owner for several times a day. > I couldn't get any service such as additional towels as it was impossible to contact with the manager. He didn't get my call and messages. meanwhile, the owner came to her property and asked me whether I know where the manager is. At that time, I asked her additional towels, and she told me she will bring them to me soon. BUT, she didn't come again.
The owner and manager are terrible. I'm sure you will not get any service you need during stay.
2. There were 3 roaches in Room No.4. As you know, if you were to find 3 roaches in your room, it could have a huge amount of roaches in your room. From this happening, I couldn't sleep for even one minute.
3.I got infected by parasite while using the pool. I watched various black things that kept moving like larva in the pool. I threw up 5 times, had diarrhea over 5 times and felt cramping in stomach and tingling sense on both arm, leg and hand. I still have stomach cramps and also spent over 400 dollars to treat.
I know this accommodation is good for staying for over 5 family or friend members.
BUT, I'm sure your journey in bali must be happy. Do not ruin your travel. Reconsider staying here.",Calming . The pool is incredible. Close to the city centre.  Too much insects.. apart from that very good . Also you can take 8 people to stay there .,"Is a beautyfull and comfortable place to stay with small forest and rice field,is a closes to balizoo,bali bird park,also some waterfalls and atv adventure,if you need a tour to visit some place in bali you can book with staff👍","We booked for 5 nights, but after receiving confirmation and check in instructions we were told to meet owner / manager at Indomart supermarket parking to take us to an alternative property as Lod house was already fully occupied.
Owner / manager has several properties and moves people between them to maximize occupancy irrespectively of your booking choice.
Private pool is shared between the 4 rooms which is not what we call a private pool.",What a decent place for who looking homestay with best value for money
ChIJ4Xc3VBc_0i0RP5ma50TbhEw,Durian,-8.575672299999999,115.25744610000001,"Jl. Raya Singapadu No.10, Singapadu Kaler, Kec. Sukawati, Kabupaten Gianyar, Bali 80571, Indonesia",https://maps.google.com/?cid=5513772932798257471,OPERATIONAL,,restaurant,"restaurant, food",4.7,11,,The seller was hilarious got a free durian. Bought 3 from him. Love this guy. Very cheap. Less than 50k Balinese durian which was super sweet. Thailand was 40k but didn't taste as good even though it has brighter yellow orange color.,"We bought here 3 times. Overall, not bad. We, as foreigners (apparently) were sold for 60k - 1 kg. It's a bit expensive, as we found out later. 1 time there was delicious, juicy durian. 2 times it was more insipid, as if an unripe fruit. And 3 times there were worms in one piece.",We bought the best Durians at this point! Thank you so much! Sooo sweet 🤗,best place to eat durian in town,The best durian. You will not regret it.
ChIJG0tS0Qc90i0RJUaGhVqX2u0,Kost Pak Made Rustawan,-8.573342199999999,115.26044270000001,"Jl. Lod Tunduh No.3, Mawang Kelod, Kecamatan Ubud, Kabupaten Gianyar, Bali 80571, Indonesia",https://maps.google.com/?cid=17139177746954864165,OPERATIONAL,+62 853-3815-3883,,lodging,4.8,9,,Really a comfortable and nice place to stay in Ubud.,,,,
