id,name,latitude,longitude,address,url,status,phone,primary-type,types,rating,rating-count,price-level,review 1,review 2,review 3,review 4,review 5
ChIJ01rrJAVx0i0RjtRoyvkJOWA,Warung D'Dagan,-8.7639681,115.49610159999997,"Banjar Salak, Batumadeg Klod, 6FPW+CC9, Batumadeg, Kec. Nusa Penida, Kabupaten Klungkung, Bali 80771, Indonesia",https://maps.google.com/?cid=6933584069760963726,OPERATIONAL,,restaurant,"restaurant, food",4.5,10,,"Nice little Warung in the middle of nowhere.
Food is very good, portions big and prices very decent.
A good spot to fuel up you energy before further exploring.","Excellent point to rest after a long bike ride. We left the bike here and hiked for 15 minutes.

Prices ar super affordable and the family owning the Warung is very nice!

There’s also gas to buy :)","Food was fresh, only downside is we got a lot of ants in it... Like a whole bunch. The other people who ate there didnt notice, but both of us got loads of them.

Price was ok, but better to eat some where else. Can buy beer and cold water from here aswell before banah Cliff and beach🚶‍♂️🙏","Fresh Made food and juices   and good prices.
I recommend it.",Some small shop
ChIJ0b-K8O5x0i0RSTAow06qo2c,WARUNG SHIFA,-8.764017299999999,115.496405,"6FPW+CC9, Batumadeg, Nusa Penida, Klungkung Regency, Bali 80771, Indonesia",https://maps.google.com/?cid=7467999862368776265,OPERATIONAL,,coffee_shop,"coffee_shop, cafe, store, food",5,1,,,,,,
ChIJ-busfmxx0i0RRgMoOUK0xI0,Warung Mek Tini,-8.7638748,115.49635370000001,"6FPW+CC9, Batumadeg, Nusa Penida, Klungkung Regency, Bali 80771, Indonesia",https://maps.google.com/?cid=10215488051302892358,OPERATIONAL,,coffee_shop,"coffee_shop, cafe, store, food",,,,,,,,
ChIJHYjI-Ldx0i0RDtkui5gZtg0,Warung Kujer,-8.763969699999999,115.4973946,"Banjar Salak, Batumadeg Klod, 6FPW+CX6, Batumadeg, Kec. Nusa Penida, Kabupaten Klungkung, Bali 80771, Indonesia",https://maps.google.com/?cid=988005311215229198,CLOSED_TEMPORARILY,,restaurant,"restaurant, food",2,1,,,,,,
