id,name,latitude,longitude,address,url,status,phone,primary-type,types,rating,rating-count,price-level,review 1,review 2,review 3,review 4,review 5
ChIJo-QwoZIV0i0RWdMJ7KXnjmg,Hotel Oyo,-8.5922305,115.319317,"C859+4P4, Pering, Blahbatuh, Gianyar Regency, Bali 80581, Indonesia",https://maps.google.com/?cid=7534213926453105497,OPERATIONAL,,hotel,"hotel, lodging",4,4,,,,,,
ChIJPdaZyg8V0i0RuVPObWDeDHE,Pawon Jero Gria,-8.5886515,115.31900379999999,"Pawon Jero Gria. Perumahan Pering Cemara indah Hero 1 Blok B18, Pering, Kec. Blahbatuh, Kabupaten Gianyar, Bali 80581, Indonesia",https://maps.google.com/?cid=8146130331746849721,OPERATIONAL,+62 813-5303-9905,restaurant,"restaurant, food",4.6,9,,,,,,
ChIJdc4eB7EV0i0RM7EAkyJfk5c,abbeys villa pering,-8.5893274,115.32277339999999,"C86F+746, Keramas, Blahbatuh, Gianyar Regency, Bali 80581, Indonesia",https://maps.google.com/?cid=10922178123403407667,OPERATIONAL,+62 878-5202-5221,lodging,lodging,4.5,4,,,,,,
ChIJdeZ-exkV0i0RwaV9LkI4G9I,Angkringan Kita,-8.5878056,115.320188,"C86C+V3G, Pering, Blahbatuh, Gianyar Regency, Bali 80581, Indonesia",https://maps.google.com/?cid=15139756429235037633,OPERATIONAL,+62 881-0382-62926,cafe,"cafe, food",5,4,,,,,,
ChIJhYP0wbAV0i0ROkFhIeLSOdY,Warung Makan Lombok,-8.5883269,115.32115359999999,"C86C+MF6, Jl. Segara Willis, Keramas, Kec. Blahbatuh, Kabupaten Gianyar, Bali 80581, Indonesia",https://maps.google.com/?cid=15436601066453549370,OPERATIONAL,+62 877-6143-0658,indonesian_restaurant,"indonesian_restaurant, restaurant, food",,,,,,,,
ChIJ0yKun3wV0i0R38dVxucVayo,Sewa Garasi Mobil Pak Nyoman,-8.5868854,115.32175199999999,"C87C+6PR, Jl. Segara Willis, Pering, Kec. Blahbatuh, Kabupaten Gianyar, Bali 80581, Indonesia",https://maps.google.com/?cid=3056560857310152671,OPERATIONAL,+62 878-6852-9646,car_rental,car_rental,5,1,,,,,,
ChIJeRi6SLAV0i0R-yiArLZcZzs,Warung Makan Nasi Campur Buk Krisna,-8.5941144,115.3219263,"C84C+9Q3, Jl. Segara Willis, Pering, Kec. Blahbatuh, Kabupaten Gianyar, Bali 80581, Indonesia",https://maps.google.com/?cid=4280491910486829307,OPERATIONAL,+62 878-6182-9229,restaurant,"restaurant, food",4,7,,Balinese traditional food..,Great taste...,,,
ChIJ6ZyK7h4V0i0RgXvxZemHEB0,Mie ayam.bakso&soto lamongan(KALIMOSODO)),-8.5893667,115.3213686,"C86C+7G5, Jl. Segara Willis, penggaron, Kec. Blahbatuh, Kabupaten Gianyar, Bali 80581, Indonesia",https://maps.google.com/?cid=2094323263234734977,CLOSED_TEMPORARILY,,restaurant,"restaurant, food",,,,,,,,
ChIJnzHAKKMV0i0RRqMxk3zYB44,Sawah I Putu Jaya,-8.5922305,115.319317,"C859+4P4, Pering, Blahbatuh, Gianyar Regency, Bali 80581, Indonesia",https://maps.google.com/?cid=10234386707779789638,OPERATIONAL,,park,park,,,,,,,,
