id,name,latitude,longitude,address,url,status,phone,primary-type,types,rating,rating-count,price-level,review 1,review 2,review 3,review 4,review 5
ChIJm3Y6zOcv0i0RsKOs9wXPLbk,Warung Day-U,-8.466144,115.0231313,"Tiying Gading, Selemadeg Barat, Tabanan Regency, Bali 82162, Indonesia",https://maps.google.com/?cid=13343548895505720240,OPERATIONAL,+62 877-6286-6000,restaurant,"restaurant, food",4.8,76,,"The food is traditional and the place looks very nice with the view of the rice terrace and the ocean. The food was very good, we had the Banana fitters (6 pieces in total) and the Nasi Campur but with dry fish.
We will return for sure! 😊🙏🙏",A good place to spend the afternoon and enjoy its affordable menus. all food tastes good. I like the view of the vast rice field  and sea. You can even see Nusa Dua lights if you cone here in the late afternoon. The only annoying thing is the mosquitoes. Better bring the mosquito repellent next time.,"A nice local warung in the middle of beautiful rice paddies in Tabanan. We ordered mujair nyat-nyat, ikan goreng, ayam kecombrang and for dessert, banana fritters and everything was delicious.

Ibu Dayu herself served the food and spare her time to talk to us with her beautiful smile and a genuine Balinese hospitality.

After eating, we hang out at the warung just to enjoy the peaceful ambience that we couldn’t find anywhere else.",This is by far the best food I have had in Bali. Extremely good food and service plus breathtaking views. Just perfect !,The best restaurant …. And delicious food and friendly service every day anytime… and no less important is having a beautiful view 👌😍
ChIJgQd78l0u0i0RWFKd1cyqvOE,Ayam Bakar Tepi Jalan,-8.4670946,115.0235297,"G2MF+5C6, Jl. Antosari Pupuan, Tiying Gading, Kec. Selemadeg Bar., Kabupaten Tabanan, Bali 82162, Indonesia",https://maps.google.com/?cid=16266063750889296472,OPERATIONAL,+62 877-6160-1275,restaurant,"restaurant, cafe, food",4.3,46,,"...simple warung (also provide ""simple"" menu!) as a stop over if you travel from Bajera to Pupuan (or Singaraja) and vice-versa since it  is located at roadside, but it has nice view of paddy field terrace...","I love the atmosphere, near the street, and I can enjoy the view alone from the second floor (not recommended for children/family though). I tried chicken and mujair nyat-nyat. Food were fine due to hunger, not as tasty. Price normal. Various foods.",Good indonesian food and cheap,Good good and a nice view 👌,scape well. need food improvement.
ChIJKbQQMF4u0i0RVry9T1Wqx-o,Warung Keet,-8.4644846,115.0234073,"G2PF+693, Tiying Gading, Selemadeg Barat, Tabanan Regency, Bali 82162, Indonesia",https://maps.google.com/?cid=16917677808627334230,OPERATIONAL,,bar,bar,2,2,,Nice view,,,,
ChIJFe9S7c4v0i0RHH9dL4ZvnrU,Tami umo,-8.4627897,115.02132789999997,"JGHM+PMH, Banjar, Tiying Gading, Kec. Selemadeg Bar., Kabupaten Tabanan, Bali 82162, Indonesia",https://maps.google.com/?cid=13087020189296197404,OPERATIONAL,,park,park,,,,,,,,
ChIJtZZAmLAv0i0ROHuLWuLxKzY,Warung Mangku Jendul,-8.460659699999999,115.0242966,"G2QF+PPM, Tiying Gading, Selemadeg Barat, Tabanan Regency, Bali 82162, Indonesia",https://maps.google.com/?cid=3903479456530660152,OPERATIONAL,,coffee_shop,"coffee_shop, cafe, food, store",,,,,,,,
ChIJ_YFTcQAv0i0RZP_P_uhMJt0,DP 9,-8.4687321,115.0243369,"G2JF+GP, Tiying Gading, Selemadeg Barat, Tabanan Regency, Bali, Indonesia",https://maps.google.com/?cid=15935508895088246628,OPERATIONAL,,park,park,,,,,,,,
ChIJOTGq4bsv0i0RFzTBiBf85QQ,Zorgh Side Villa P&B,-8.460481999999999,115.021885,"G2QC+JW7, Tiying Gading, Selemadeg Barat, Tabanan Regency, Bali 82162, Indonesia",https://maps.google.com/?cid=352965323827262487,OPERATIONAL,+62 813-5351-1427,tourist_attraction,tourist_attraction,5,1,,,,,,
