id,name,latitude,longitude,address,url,status,phone,primary-type,types,rating,rating-count,price-level,review 1,review 2,review 3,review 4,review 5
ChIJz822LUk90i0RH2r-a5R5jM8,Villa Bunga Bintang,-8.5070443,115.22137339999999,"Jl. Raya Punggul No.13, Punggul, Kec. Abiansemal, Kabupaten Badung, Bali 80352, Indonesia",https://maps.google.com/?cid=14955462140964530719,OPERATIONAL,,lodging,lodging,4.7,6,,,,,,
ChIJT4F2Xrg90i0RNgMaEjr8zpE,"Puri Punggul, Abiansemal Badung",-8.5015976,115.21963489999999,"Punggul, Abiansemal, Badung Regency, Bali 80352, Indonesia",https://maps.google.com/?cid=10506612307043943222,OPERATIONAL,,tourist_attraction,tourist_attraction,4.5,17,,hometown,,,,
ChIJ8TZI9hc90i0RzsDQwAk3JIM,Jogging track,-8.5031657,115.218153,"F6W9+R8J, Punggul, Abiansemal, Badung Regency, Bali 80352, Indonesia",https://maps.google.com/?cid=9449738433159282894,OPERATIONAL,,hiking_area,"hiking_area, park",4,5,,"This is a scam to bring tourists. This is not a trek, it is a healing place. If you want to even see the waterfall is at least 200k per person and you cannot enter in the water, that costs extra. The space itself is very beautiful and if you come with the purpose of have a healing experience you will not regret. But this landmark is not a trek!!!",,,,
ChIJEc-ShsM80i0ReVJ-le14Zn8,"Puri Belangsinga Punggul - Abiansemal, Badung, Bali",-8.5033756,115.22090430000002,"Jl. Belangsinga No.7, Punggul, Kec. Abiansemal, Kabupaten Badung, Bali 80352, Indonesia",https://maps.google.com/?cid=9180157852252000889,OPERATIONAL,+62 812-4664-1065,tourist_attraction,"tourist_attraction, museum",4.6,23,,Good home,Hmmm,,,
ChIJeeBbiEY90i0RgxVRvCEa45I,Tuak Janger Punggul,-8.5064624,115.2219453,"Unnamed Road, F6VC+CQ8, Punggul, Kec. Abiansemal, Kabupaten Badung, Bali 80352, Indonesia",https://maps.google.com/?cid=10584332281446471043,OPERATIONAL,+62 857-3912-2642,bar,bar,4.5,23,PRICE_LEVEL_INEXPENSIVE,I'm not sure I was visited the place.,,,,
ChIJ3VKrLC890i0R-aeNeN_1BnY,Rumah Aji Rasna,-8.5047372,115.2214294,"F6WC+4H3, Punggul, Abiansemal, Badung Regency, Bali, Indonesia",https://maps.google.com/?cid=8504755286484822009,OPERATIONAL,,park,park,5,1,,,,,,
ChIJc0SozcM80i0Rz0EDZZ3SGxg,Warung Jawa,-8.505610500000001,115.21944459999999,"F6V9+QQ4, Jalan Raya, Punggul, Kec. Abiansemal, Kabupaten Badung, Bali 80352, Indonesia",https://maps.google.com/?cid=1737213654727868879,OPERATIONAL,+62 878-6040-2040,indonesian_restaurant,"indonesian_restaurant, restaurant, food",,,,,,,,
ChIJIcGoiAw90i0RG2zG1NrZi94,simplepicnic24,-8.5041278,115.2210391,"br kelodan, Jl. Belangsinga No.2, Punggul, Kec. Abiansemal, Kabupaten Badung, Bali 80352, Indonesia",https://maps.google.com/?cid=16036150432078654491,OPERATIONAL,+62 857-3867-8551,restaurant,"restaurant, food",5,3,,Good👌,,,,
ChIJJwq-UwA90i0RFVfidDfYdBY,Warung Babi Guling Ajik Madu,-8.503507899999999,115.2197445,"Jl. Raya Punggul No.28, Punggul, Kec. Abiansemal, Kabupaten Badung, Bali 80352, Indonesia",https://maps.google.com/?cid=1618155898828642069,OPERATIONAL,+62 821-4641-6720,restaurant,"restaurant, food",5,2,,,,,,
ChIJF4zds4o90i0RBEFbVtjf_yo,Wr.Laksmi,-8.5026453,115.21875800000001,"Br.tengah punggul Jl.mawar Beji, geriya waterfall, Punggul, Kec. Abiansemal, Kabupaten Badung, Bali 80352, Indonesia",https://maps.google.com/?cid=3098441188908941572,OPERATIONAL,+62 819-3615-9800,restaurant,"restaurant, food",5,2,,,,,,
ChIJY2l0AZs90i0R4FQd6AL1uAs,Waroeng Beji Griya Waterfall,-8.500852799999999,115.21866940000001,"F6X9+MF3, Jl. Mawar, Punggul, Kec. Abiansemal, Kabupaten Badung, Bali 80352, Indonesia",https://maps.google.com/?cid=844694322964944096,OPERATIONAL,,restaurant,"restaurant, food",,,,,,,,
ChIJJ5VnJvE90i0Rg1LMuXJjEXE,Kingdom Jr.,-8.5000561,115.2188399,"Jl. Pekandelan No.03, Banjar Tengah, Punggul, Kec. Abiansemal, Kabupaten Badung, Bali 80352, Indonesia",https://maps.google.com/?cid=8147402545284534915,OPERATIONAL,,lodging,lodging,5,1,,,,,,
ChIJHwaGAi090i0R6_RsFOegF2U,The Warung AJK,-8.499621000000001,115.21886209999998,"Jl. Pekandelan No.01, Banjar tengah, Punggul, Kec. Abiansemal, Kabupaten Badung, Bali, Indonesia",https://maps.google.com/?cid=7284467836635641067,OPERATIONAL,+62 831-1554-6254,cafe,"cafe, food",5,2,,,,,,
ChIJN6HgwcA80i0Ra-6FWHsHuRY,Warung Ananda,-8.5047027,115.2143897,"F6W7+4Q6, Jl. Pacung Selat, Blahkiuh, Kec. Abiansemal, Kabupaten Badung, Bali 80352, Indonesia",https://maps.google.com/?cid=1637348165873430123,OPERATIONAL,+62 815-2953-5404,restaurant,"restaurant, food",,,,,,,,
ChIJa7W89Jw90i0R-ijHiu00_Z4,PANG SING PALING,-8.5068728,115.22170609999998,"F6VC+7M4, Punggul, Abiansemal, Badung Regency, Bali, Indonesia",https://maps.google.com/?cid=11456371221940611322,OPERATIONAL,,private_guest_room,"private_guest_room, lodging",,,,,,,,
