id,name,latitude,longitude,address,url,status,phone,primary-type,types,rating,rating-count,price-level,review 1,review 2,review 3,review 4,review 5
ChIJYf6GOKCb0S0RUfIW0sO8ico,McDonald's Singaraja,-8.1151828,115.0914036,"Jl. Ngurah Rai No.52, Banjar Jawa, Kec. Buleleng, Kabupaten Buleleng, Bali 81113, Indonesia",https://maps.google.com/?cid=14594403616700166737,OPERATIONAL,+62 811-1310-5741,fast_food_restaurant,"fast_food_restaurant, restaurant, food",4.5,1318,PRICE_LEVEL_MODERATE,"The service is fast, the place is clean probably because it’s 10 AM.

However, the chickens are overcooked and dry. The scrambled eggs overcooked as well and looked sad.","My eat to go if I don't know nothing else to eat! The ambience, the food, the promo, are the greatest for student like me. The best recommendation from me are, Fish Fillet Burger, McSpicy Chicken, Apple Pie, McNuggets, and the newest menu is Panas Krispy Gulai this one time menu is really goooddd. Tips: when you order the drink make sure without ice because the drink itself is already cold.","I say Yes, bcs it’s 24hours. Plus it’s friendly to order via Grabfood.",Best service..  Place clean as well.,"the best.. thanks for the 24 hours services, definite great for people who arrive in the morning (2am in my case)"
ChIJAQAAwAqa0S0RRhKeGGDFjVQ,KFC,-8.112693,115.09133360000001,"Jl. Ngurah Rai No.78, Banjar Jawa, Kec. Buleleng, Kabupaten Buleleng, Bali 81113, Indonesia",https://maps.google.com/?cid=6092742887422693958,OPERATIONAL,+62 811-7157-540,fast_food_restaurant,"fast_food_restaurant, cafe, restaurant, food",4.1,1877,PRICE_LEVEL_MODERATE,Waiting too long (30 minutes) for only two crispy chickens,"Clean, strategies place, large parking with helped by security, only too long qeueu ..","I don't know what to say about this KFC here. Their customer service is so slow, like I have to wait so long to get my food. It's so hot there like there's no AC. The food was not very good. It's just, normal.","It's very busy by the time we come here around 7 pm. Parking lot is full so we park a bit further. Place is clean, and the ambience is fine. It's a good thing there is children's playground. Menu is usual KFC, great fried chicken comes with value package. Service is fast and nice.",Superb! I love this KFC foods. Absolutely delicious 😍👍🏼
ChIJ9alsDAya0S0RLpXwi49oao0,Hotel Sentral,-8.1105277,115.08753029999998,"Jl. A. Yani No.48, Kaliuntu, Kec. Buleleng, Kabupaten Buleleng, Bali 81114, Indonesia",https://maps.google.com/?cid=10190072072616580398,OPERATIONAL,+62 362 21896,hotel,"hotel, lodging",3.7,602,,very suitable for families with spacious rooms to get extraordinary service and the most comfortable place to relax,"It’s an old hotel, it could be clean though. We took one of the VIP rooms I believe. We got AC, shower, small bars of soap n towels but not hot water. Bathroom was dirty, the sink too.
It’s pandemic, no tourism, less staff probably. We just walked in, no reservation. Had we made one, they’d probably prep/clean the room. The twin beds were very comfy. N the staff were polite n helpful.","Worst hotel in Bali I have been to, I've chosen the viproom for 200.000. Man can i tell you that in this place VIP means go f yourself.

Bed sheets were not included, yes we were sleeping on a bed with no sheets at all!!! The room was dirty and the best thing is people were sitting in front of our room talking till 2 am. Requested the staff to say and do something about it but they were like ah what can i do about it.

Had almost no sleep, since at 6 am people started to talk again in front of the room.

So besides it being dirty expensive and managed by a baboon  you have a better change in sleeping in your car along the road then staying at this place.","This hotel is pretty nice and located strategically in the city of Singaraja. It takes around 15-20 minutes to reach Penimbangan or Lovina Beach. The price is reasonable 110k/nite on direct booking (I got 110.700 from Agoda) for room with fan (include breakfast). We found some bad points for their cleanliness, no blanket, no toiletries, even facility of wifi that we supposedly got from app booking, was not working. When I asked for wifi password to the front desk staff, she said the connection couldn't reach the backside (we got room at the back in this period). Hopefully, the property will improve their facilities for better convenience of the guests who are staying here. However, this place is still recommended to be your option  as overnight stay when you are visiting North Bali or as another option for having rest before leaving to Denpasar.","Good place for transit hotel , clean room , staff very helping"
ChIJj8Y3nd6b0S0REZSNR9ZO1H0,Richeese Factory Singaraja,-8.1123242,115.09336719999999,"Jl. Gajah Mada, Banjar Jawa, Kec. Buleleng, Kabupaten Buleleng, Bali 81113, Indonesia",https://maps.google.com/?cid=9066958632034079761,OPERATIONAL,,fast_food_restaurant,"fast_food_restaurant, restaurant, food",4.4,500,,"the place is comfortable and clean, if you want to eat chicken with spicy spices, you can come here",This place selling a lot of food with cheese sauce. I love fire chicken as a very spicy varian of fried chicken. Combined with cheese soup. There a lot of other things in menu and the place if you want to eat here is very cozy. There a lot of charger port too if you want to work or study here although the table and the chair less comfort.,Last day with my brother 31072019. Hope u success next day without me.,"When I'm not sure to buy food in new city, I just go straight up to richeese and pick flying chicken. The skin is crispy and spicy. Its around 100k for the whole chicken.",Good place to lunch n dinner with your special moment
ChIJaVoaaAya0S0R2cMDIs6h3GY,Duta Karya Hotel,-8.1113614,115.08672659999998,"Jl. A. Yani No.59, Kaliuntu, Kec. Buleleng, Kabupaten Buleleng, Bali 81116, Indonesia",https://maps.google.com/?cid=7411976993451000793,OPERATIONAL,+62 362 21467,hotel,"hotel, lodging",3.6,57,,"We came into our room and it was disgusting! They didn’t have a real toilet, there was filth everywhere. Luckily we hadn’t paid yet so we just cancelled and left. The lady seemed pretty used to that because she didn’t even bat an eye. I felt bad because they were very nice and probably didn’t get many guests, but for the price we were supposed to pay, it wasn’t acceptable.","near city, very easy to find shopping center from this hotel",Nice,"Old, tired hotel!",
ChIJ0bYEo1ib0S0Rydykvaew0PQ,Kost Anggrek Suwendra Singaraja,-8.1117141,115.08666850000002,"Jalan Anggrek I No 2, Kaliuntu, Kec. Buleleng, Kabupaten Buleleng, Bali 81114, Indonesia",https://maps.google.com/?cid=17640793974897958089,OPERATIONAL,+62 812-3944-758,,lodging,4.9,30,,Comfortable,,,,
ChIJIznvLgeb0S0Rai8C3nSNuYU,Temani Kopi,-8.1113064,115.0870695,"V3QP+FRG, Jl. Lely, Kaliuntu, Kec. Buleleng, Kabupaten Buleleng, Bali 81114, Indonesia",https://maps.google.com/?cid=9635888410816294762,OPERATIONAL,,coffee_shop,"coffee_shop, cafe, food, store",4.8,21,,"Nice food and good prices.
The staff don't speak much, but boy are they fast in making their tasty food and drinks.","the place is comfortable, beautiful, a good photo spot, and the foods are cheap",,,
ChIJAeaA7gua0S0RzmKxwL9zvaA,Rumah Makan Gandi,-8.1103712,115.0890348,"Jl. A. Yani No.25H, Kp. Anyar, Kec. Buleleng, Kabupaten Buleleng, Bali 81114, Indonesia",https://maps.google.com/?cid=11582541084075582158,OPERATIONAL,+62 362 21163,chinese_restaurant,"chinese_restaurant, restaurant, food",4.4,434,PRICE_LEVEL_MODERATE,"Great food by the 2 of us in our group. I got the fried pigeon, something new I wanted to try. It was good, even with the entire head still attached! Good food and service was good. They bring you a paper and you write your own order, kinda different idea but I liked it. The Soda Gambira (happy soda) they do there are the best I've had.","Gandi is one of legendary chinesse food restaurant in Singaraja, otherwisw they serve Indonesian food in the the whole Singaraja and Lovina area. All food is delicious and the service is swift and pleasant.  Chinese food and local Indonesian and Western food. The Wanton soup, the Japanese Tofu and vegetables, Their kwetaiw noodles and all of the freshly made fruit juices..","Location is slightly hidden from the street, check google map.
The place is a bit small with few tables, so can be rly crowded.
Specializing in chinese food, we ordered pork n vegi dishes ; imho, quite good, or even delicious for bali std.
Pricewise, I'd say quite cheap, with majority of meat dishes below idr50K.
We visited in apr 2021 and still quite crowded, so avoid lunch hour.","Old style chinese food, which is worth to try. Strategically located in town. Koloke, nasi goreng, the best 👌","Fantastic food in downtown of Singaraja.  Good taste , a lot of menu and choices ,  it's really good food even if you compare with Denpasar. The interior is 70' design and decoration. Located inside the Ruko complex.  Must visit restaurant when you are in Singaraja."
ChIJOTKzaceb0S0RTUhyQ_ECmo0,Kedai Radja Ketjil,-8.1118469,115.08732200000001,"Jl. Lely No.10, Singaraja, Kec. Buleleng, Kabupaten Buleleng, Bali 81116, Indonesia",https://maps.google.com/?cid=10203471141003216973,OPERATIONAL,+62 811-3770-911,restaurant,"restaurant, food",4.6,42,,"This place is ok, the food can be good, but the portions are very small for the prices. And this is how my pizza just arrived 😂 They should use string for pizza like everyone else does.","“Semua bisa jadi raja” as their tagline like this, then we expect some service. But unfortunatelly not, we don’t ask for five star service, at least smile or simple word like “hi, selamat datang” that is more than enough. Price range is quite cheap, we were having chicken kebab, potato wedges, nasi goreng karee, es teller, and to be honest taste of the food was really good, It just the food came after more than 20 minutes(it wasn’t too busy) and i need to come and check for my drink as it taking too long. Homey and clean but mosquitoes are so annoying. Please prepare some tissue on the table…thanks",,,
ChIJiVib28ab0S0R3EcpYdpBCtw,WARUNG SAMBAL METAL (WSM),-8.1163378,115.09055219999998,"Belakang Singaraja Futsal, Jl. Nakula No.24, Banjar Jawa, Kec. Buleleng, Kabupaten Buleleng, Bali 81113, Indonesia",https://maps.google.com/?cid=15855557844300023772,OPERATIONAL,+62 812-4608-0056,restaurant,"restaurant, food",4.5,231,PRICE_LEVEL_INEXPENSIVE,"Great Warang.

Located off the main road this out of the way food shop is really busy.
Their selection of food is made up from complete packets or combos

Prices range from 13000 Rp for the cheapest to 19000 Rp.👍

Combos come with iced tea included.
The food selection is only local food catering for local people. 👍

Portions are medium but this is reflected in the price 👍

Food is fresh and tasty 👍

Hosts are a family and their customer service is great 👍

Would I come back again 🤔

Most definitely.. (my wife has been here 4 times already 😂)","their sambal very recommended, spicy but I can't stop eating it",Salute,A popular local resto in Singaraja.,Ok
ChIJMdfrw8ab0S0RNLftGX7kG74,Gelato Corner Cafe,-8.1157795,115.08885269999999,"Jl. Udayana No.11A, Banjar Jawa, Kec. Buleleng, Kabupaten Buleleng, Bali 81114, Indonesia",https://maps.google.com/?cid=13698793921829517108,OPERATIONAL,+62 362 3303460,restaurant,"restaurant, ice_cream_shop, food, store",4.5,337,PRICE_LEVEL_MODERATE,"It's Thursday and very quiet. Likely won't be like this weekends.
Gelato is great, good selection and variety.
Reasonable price considering Bali is a tourist destination with tourists prices.","The only best gelato In Nort Bali.

love it. Many choice",BEST ICE CREAM/ GELATO IN TOWN/WHOLE BALI seriously. They staffs are friendly that one day we came too late they were closing but they let us order last minute. Price is acceptable. Thanks for the advancement of availability in north bali! Keep it up,"We stumbled upon this place by accident. Our hotel was in Ubud and we just visited Banyumala twin waterfall. We thought we drove down to Singaraja to get a coffee.

We weren't sure if there's any open since it is a new year day, Jan 1st. Our first choice coffee house was close so the next closest to our location was this place. We googled everything through Google maps. To our surprise this place was not only open but also serve good coffee, ice cream with many many interesting flavours and delicious.

Their banana chocolate ice was good. They also had black diamond, it is charcoal with vanilla.... It was delicious. Sadly I didn't get to take shot of the ice cream.

We also had our dinner there and everything was delicious. The staff was friendly and warm as well.

It was sure a long drive since we drove back through Kintamani to Ubud, it was late and the fog had come down. But it was one of the best road trip with many delicious surprises. We will definitely drive there again to enjoy their food.","Great new Place with home made italian Ice Cream. If you happen to Visit Singaraja, it's a must to come over and enjoy the ambiance with a great taste of Ice Cream. 2 thumbs up 👍👍"
ChIJn0zp7eeb0S0R0SVwp6znAmU,GoGo Fried Chicken Ngurah Rai,-8.1142561,115.0914273,"Jl. Ngurah Rai, Banjar Jawa, Kec. Buleleng, Kabupaten Buleleng, Bali 81113, Indonesia",https://maps.google.com/?cid=7278634676513678801,OPERATIONAL,+62 819-1001-9090,fast_food_restaurant,"fast_food_restaurant, restaurant, food",4.4,150,,Waiting order 15minutes cause they still cook. After 15 minutes i got nothing. They tell me to wait again cause they give my order to someone else,"Reasonable price, better than mcd's chicken",Free flow for rice and ice tea,The fried chicken at Gogo is delicious.maknyos,Nice
ChIJxX_fSjmb0S0RA_j4_mBSJU8,Point Coffee,-8.1130825,115.093778,"Jl. Gajah Mada, Banjar Jawa, Kec. Buleleng, Kabupaten Buleleng, Bali 81113, Indonesia",https://maps.google.com/?cid=5703055079682668547,OPERATIONAL,+62 21 1500280,coffee_shop,"coffee_shop, cafe, food, store",4.6,64,,"I always enjoy Point Coffee, good flavour and they can make it HOT the way I like it.
Many coffee shops make their coffee luke warm even when I ask for extra hot so when I'm on the road I always stop at a Point Coffee",My favourite place to have a cold coffee. Seating could be better organized and managed. Some more coffee snacks or pastries would be nice. And definetly too much plastic used. Cups could be from paper since straws already made of paper why not cups as well?,Always very helpful staff making great coffee.,My favo coffee shop,good coffee
ChIJ-_iuZ_6b0S0RRKn7XvYrCbs,Eiji Sushi,-8.1125642,115.0931531,"Jl. Gajah Mada No.97, Singaraja, Kec. Buleleng, Kabupaten Buleleng, Bali 81151, Indonesia",https://maps.google.com/?cid=13477351697038420292,OPERATIONAL,+62 819-7791-7390,sushi_restaurant,"sushi_restaurant, japanese_restaurant, restaurant, food",4,44,,"Very cute eatery runs by a family. The chef has long years of experience from cruise and other restaurants. The taste of sushi and ramen was hilarious. We choose mostly seared or fried fishes due to high temperatures in Bali.
We recommend Gyoza, Ebi tempura rolls, Dynamit rolls, grilled salmon rolls and spicy chicken ramen 👍","Excellent find in Singaraja very clean good staff and fabulous food, will be backcery soon",Recommend place so far to eat sushi and Japanese food.,"The food is not bad, but the service and overall atmosphere is really not welcoming, nice to try but I don't really want to come back.",Best Sushi in Singaraja ❤️
ChIJez0FNqub0S0R4thrjphRKWQ,Mess Tasbih,-8.1138953,115.0870822,"Jl. Tasbih No.18, Kaliuntu, Kec. Buleleng, Kabupaten Buleleng, Bali 81116, Indonesia",https://maps.google.com/?cid=7217389593504241890,OPERATIONAL,+62 813-3160-0909,hotel,"hotel, lodging",4.7,51,,Affordable place to rest,Releafe... very wide.,,,
ChIJ6zYjlnSa0S0RSvi9MnueFts,Warung Tomat Pizza and Pasta,-8.1157044,115.0891956,"Depan GOR Bhuana Patra, Jl. Udayana No.8, Banjar Jawa, Kec. Buleleng, Kabupaten Buleleng, Bali 81114, Indonesia",https://maps.google.com/?cid=15786979795763329098,OPERATIONAL,+62 362 3301455,italian_restaurant,"italian_restaurant, pizza_restaurant, wholesaler, restaurant, food, store",4.5,246,,"This is definetely the place to be if you crave a good plate of pasta as it should be whilst in Bali. They do the pasta fresh for every order. I watched them doing it whilst sneaking a peak (or two) behind the kitchen glass window. Then, it is cooked to perfection aldente and dressed with a lovely sauce of your choice. The fresh basil pesto tastes so good and homemade that we had to come back all the way from Lovina the next day for it! We also ordered a side salad and the ingredients were fresh and crispy dressed in a well seasoned, tasty dressing. The pizza crust is also thin and good. But the pasta is just superb. The service people are really kind and attentive. 🙏
The atmosphere is not that appealing as it is right on a busy road but we did not care for this as the food is so good and the servers did a lovely job.
Recommended pasta type: pasta rigatoni are the best.",A very good restaurant.  It is incredibly clean and they serve good quality Italian food for local prices.  Really recommended.,"FANTASTIC FOOD, FANTASTIC SERVICE. We went to this small restaurant for pizza and was surprised to find the best Italian food we have had anywhere let alone here in Bali. Everything is fresh and made on site you can taste the difference (I challange Gordon Ramsey to trying this food im certain he could not do better). If you are in the area check it out because the food, service  atmosphere and price are perfect.","Fettucine flavour is subtle, gentle and smooth, a perfect balance of spiciness from cracked pepper, aromatique from herbs and garlic. On the other hand, rigatoni flavour would be a gentle tangy and heat with nice smoky aroma from it’s smoked salmon that mixed into restaurant signature sauce. The quantity of both   Food will make you full to the brim for one person","One of best pizza and pasta.. the owner is Victor, a real Chef.... the pesto is perfect"
ChIJJ6MLwAya0S0RSRDZlG8hnZg,Food Court Tasbih 11 (Wr Pudak & Food Camp),-8.1130247,115.08644500000001,"Jl. Tasbih No.11, Kaliuntu, Kec. Buleleng, Kabupaten Buleleng, Bali 81116, Indonesia",https://maps.google.com/?cid=10996982628230959177,OPERATIONAL,+62 878-6116-2624,restaurant,"restaurant, food",4.3,344,PRICE_LEVEL_INEXPENSIVE,"Good local ayam betutu as part of a nasi campur in a garden setting. Great flavoured sambal, which was good and spicy.","Local food, tasty, price is standard and clean.",Local taste food and good ambience. You feel like at home.,"Nice place, good food and cheap","A reasonable, popular resto for locals."
ChIJT-0EwnSa0S0RSEasTVEsxeQ,Beatrix Patisserie And Gourmet,-8.115765399999999,115.08894629999999,"B, singaraja, Jl. Udayana No.5, Banjar Tegal, Kec. Buleleng, Kabupaten Buleleng, Bali 81116, Indonesia",https://maps.google.com/?cid=16484630738766677576,OPERATIONAL,+62 362 32375,restaurant,"restaurant, coffee_shop, cafe, breakfast_restaurant, food, store",4.5,258,PRICE_LEVEL_MODERATE,"Good place for family dinner with various menu.  Nice service. The food, price and ambience was good. Definitely will come back again. Thank you Beatrix!",Taste is quite ok. However the portion is small. I made an order by grab. And so surprised when I saw the portion. Expensive for me if I compare with the portion. A bit disappointed actually. I don't know the portion for dine in.,Cozy place to spend time with family or friends while enjoying combination of eastern & western foods. Live music is performed at the weekend.  They also have an outdoor table and provide a meeting room if you need to arrange a lunch meeting with your clients. But the price is a little bit premium for Singaraja's market,"Great place especially for a family.

Good parking outside👍
. Very clean inside.👍
Very helpful and friendly staff 👍
Huge range including meals, patisserie products 👍
Best ba pao in town.. You have to order these but they are sooo good 👍👍
We dined in.. The experience was good 👍
Menu items reasonably priced 👍
Service was prompt 👍
Quality of food is great 👍

Would I come back 🤔
Yes most definitely 👏👏",It's nice place for student hang out but the price I think not for local.. I ordered pizza for appetizer but they came same time with the main meal...lol...I went there with 5  other students...if you want to come to here just for prestige I think this place recomended for you...but if you want nice bite i think this place not suitable for you.. enjoy
ChIJF3vpzo6b0S0RNH-xd_tiE5g,Starbean Speciality Coffee,-8.110370699999999,115.0919023,"Jl. Gajah Mada No.935a, Banjar Jawa, Kec. Buleleng, Kabupaten Buleleng, Bali 81113, Indonesia",https://maps.google.com/?cid=10958211150506983220,OPERATIONAL,,coffee_shop,"coffee_shop, cafe, food, store",4.5,43,,Good food. Right portion. Nice beverage. Was going to be one of my fave places (regular) to eat until they marked up the price😑,"I come to this place to enjoying a cup a coffee and dinner. I remember this place as bangkit coffee in the past but today it changed as starbean. They provided a lot of type of coffee from many places in Indonesia like gayo, toraja, and many others. Provide dinner too with a very-well tested food like nasi goreng, mie goreng etc","Some of the menu taste really good and some just okay. But the vibe and atmosphere is really good, especially if you are looking for a place to do your job etc","Just had a full lunch here, I ordered Garlic Bread, Onion Ring, Katsu, Chicken Blackpepper. Every food was good. The place is so big and a yes it seems to be such a cool place to hang out with your friends. I actually ordered Penne with mushroom sauce but I guess the Waitress did not hear it, well nevermind. I am not mad since every thing was totally nice. Staffs are friendly too.  Definitely will come back again and bring my friends for another lunch n dinner too.",We came here on a very quiet night but the food choices were excellent for vegetarians like us. Staff were very attentive and helpful. Drinks were very good as was the food. Definitely recommend a visit.
ChIJv5PyxQua0S0R20WsmD3RZJk,Penginapan Lestari Singaraja Bali,-8.1102562,115.0901276,"Jl. Pramuka No.14, Banjar Bali, Kec. Buleleng, Kabupaten Buleleng, Bali 81156, Indonesia",https://maps.google.com/?cid=11053189447958676955,OPERATIONAL,+62 811-3960-5282,guest_house,"guest_house, lodging",3.8,38,,"Value for money inn
Vast parking lot
Clean
Affordable","Really good hostel, and not extensive compare to the other one close to the beach  (200.000 room for 2/3 people with AC or 150.000 with fan).","Easy to find, have a car park, but the room quite small",It's appropriate as the budget..,Nice
