id,name,latitude,longitude,address,url,status,phone,primary-type,types,rating,rating-count,price-level,review 1,review 2,review 3,review 4,review 5
ChIJ75YB74E50i0RR6Xi4slDNz4,Further Hotel,-8.6431643,115.12897050000001,"Jl. Pantai Pererenan No.84, Pererenan, Kec. Mengwi, Kabupaten Badung, Bali 80351, Indonesia",https://maps.google.com/?cid=4483126488444609863,OPERATIONAL,+62 821-4769-8770,hotel,"hotel, lodging",4.9,135,,Stayed here for a night and we loved it. Everything was perfect honestly. The suite is designed beautifully and the ambience delivers such a relaxing mood. We had a good fun and also a energizing rest here. But what ties everything together is the service! Everyone was so accomodating and helpful! Would definitely check this hotel out next time I’m in Bali.,"Everything about this hotel is pure art. From its architecture, interior details to small details to your room — everything is well curated. It’s like a storytelling, from paintings and coffee table books, it has something that will resonate to you.

Location wise is very good, Bar Vera is another experience. ✨","The hotel is super cool, the interior design and products they provided are amazingly harmony with the room. I love the photography art pieces they displayed, and the concept of whole hotel is artistically unique! Moreover, the service is super welcoming, Ingrid and Michelle is so kind and generous, especially offering me a lovely birthday cake while knowing the trip is during my birthday, so sweet!!!","Absolutely love this concept. The service was amazing, and they have really great recommendations on the food and coffee. I love that the surroundings are quaint, and not overly crowded. The buggy service and collaborations they have are really very helpful. Definitely worth staying here!","Further is a Magic space. The immediate peace that hits you once you step inside is something unique. The team is incredible as well! Most importantly the room light show just before sunset is one of the most magical moments possible!

It's honestly hard to leave the room and get over it."
ChIJOwB4D8E50i0RnmcWbm5B1jI,The Shady Fox,-8.6461875,115.1278125,"Jl. Tukad Pingai, Pererenan, Kec. Mengwi, Kabupaten Badung, Bali 80351, Indonesia",https://maps.google.com/?cid=3663187289461647262,OPERATIONAL,,bar,"bar, night_club",4.7,379,,"This bar is a great place to go for a drink with friends. The atmosphere is fun and lavish with reasonable price. The staff is friendly and attentive, and they are helpful to suggest recommendations. Would definitely recommend this speak easy bar to anyone who are looking for a fun and affordable night out!

Here are some specific details about the bar that I enjoyed:

• The location is convenient.
• The decor is modern and stylish.
• The drinks are well-made.
• The staff is friendly and welcoming.

Overall, I had a good time at this bar. I would definitely go back again.",Amazing cocktails (try the Tom yum gin one - especially good).. great service and an amazing live jazz quartet. This place is a great vibe.,"Speak easy bar. Very well the hospitality and nice creation of cocktails.
Very recommended. We'll back again soon!","The Shady Fox is an incredible hidden gem that pleasantly surprised us. Their cocktails were the best we've ever had, and despite it being our first visit, the atmosphere was fantastic. The karaoke added to the fun, and the staff were exceptionally friendly, making our experience even more enjoyable. We can't wait to return to this cozy and delightful place! Look for Tama when you’re here! :)",superb service here. great servers and drinks at reasonable prices. have a live band as well where you can vape/smoke. great atmosphere which reminds me of a bespoke bar. gud to spend a chill night in bali with quality drinks and ambience
ChIJAReSmvI50i0RKa0rUbSJ-WM,Roots,-8.6473817,115.1248433,"Jl. Pantai Pererenan No.121, Pererenan, Kec. Mengwi, Kabupaten Badung, Bali 80351, Indonesia",https://maps.google.com/?cid=7203940486504754473,OPERATIONAL,+62 813-3753-1570,restaurant,"restaurant, food",4.8,370,,"I love this place! Always fresh ingredients, the salads are incredibly delicious, my favourite is the Ancient bowl and I like building my own bowl here! Matcha latte is just as delicious! I definitely recommend this place for lunch or dinner! There is a nice atmosphere, good service and great food🤍","Highly recommended. One of the best, if not the best, vegan place I have eaten in Bali. The restaurant is beautiful, the staff is very friendly and attentive and the Food is sublime and very well presented. All fresh and tasty  10/10 I loved my experience with them and would repeat in fact I went for lunch and the next day for breakfast.","My plant power big breakfast was amazing! It is a bit more on the expensive side (215k for brekkie, tea and mineral water) but definitely worth it. Not only because the food is very high standard, the atmosphere is nice and the staff incredibly kind and hospitable. Def worth a detour if you are in the area!","So many vegan options! Super yummy. I went for dinner with my boyfriend. We had the curry with flatbread to share and then carrot as a side, the sandwich and rice cake. For dessert apple and coconut. Peaceful atmosphere, friendly service. Recommend it!",Perfect place to kick off our holiday. Food is delicious and fresh. I tried the watermelon “tuna” poke bowl and it didn’t disappoint. The flat bread and dips was also a hit. Staff were super friendly and attentive. The venue itself is striking. Would definitely return :)
ChIJzYEMoZQ50i0RNo-NowjCfVM,Pescado Bali,-8.645918499999999,115.12649110000001,"Jl. Pantai Pererenan No.112, Pererenan, Kec. Mengwi, Kabupaten Badung, Bali 80351, Indonesia",https://maps.google.com/?cid=6016178019596341046,OPERATIONAL,+62 821-4663-6846,spanish_restaurant,"spanish_restaurant, breakfast_restaurant, bar, restaurant, food",4.6,681,PRICE_LEVEL_MODERATE,"Pescado in Pererenan is a hidden gem! Their paella is delicious, but you can't go wrong with the garlic shrimp and bread - my personal favorite. Their 50k sangrias promo on Thursday are a steal. The interior is cozy making it a perfect spot for a chill dinner with loved ones. Will definitely come back ","Being a huge Spanish food fan, I was practically bouncing with excitement when I stumbled upon Pescado the other day.  Let me tell you, it did NOT disappoint! Each dish was a revelation! We ordered a selection of tapas to share, and every single one was bursting with flavor.

And to top it all off, they even surprised us with a free drink!  That little touch of generosity just added to the overall positive experience.

Lets fiestaaaa!","I like 🇪🇸 food now after a visit to Pescado. I was expecting to have more of the burnt crust in the paella but they served a perfectly amount of it. I like burnt rice in 🇮🇩 dishes too, I guess it’s universal haha.

The tuna tataki also great! Fish is fresh and the mashed potato is creamy. Will definitely visit again.","If you want to try paella and if you love seafood, you should visit Pescado in pererenan! I tried the croquettes, garlic prawns and cheesecake, which were all delicious.

They also have sangria promo on Thursdays for only 50k IDR.","The paella is the best at this Spanish restaurant in Bali. Every single tapas dish is also delicious. In addition, the staff are all incredibly friendly!"
ChIJ-5ak7nE40i0RNo9zkjZRj5g,Wasabi Hotel and Restaurant,-8.6471754,115.124667,"Jl. Pantai Pererenan, Pererenan, Kec. Mengwi, Kabupaten Badung, Bali 80351, Indonesia",https://maps.google.com/?cid=10993094510261800758,OPERATIONAL,+62 878-9953-5616,japanese_restaurant,"japanese_restaurant, hotel, sushi_restaurant, lodging, restaurant, food",4.5,409,,"PLUS:
The rooms are nice with a taste of ""Nature"" style with a spacious balcony.

The price is also affordable for everyone.

There is a nice ""Infinity Pool"" outside next to the bar.

MINUS:
The AC was very loud, at any speed and at night I had to turn it off because of that.

The location is not so ""wow"",so don't expect that everything is near you.","Amazing and friendly staff, comfortable rooms, the restaurant has the best fried rice, room service every day, little complimentary items when down by the pool provided by the wonderful staff, location is perfect and very close to delicious restaurants, fantastic shops and convenience stores.

The only small negative is it was very noisy at night, but this could have been the time of year we stayed (New Years Eve). Lots of other guests slamming their doors in the middle of the night - the front door to the rooms aren't soundproof.",Excellent hotel 5 min walk to beach and close to some amazing restaurants. Staff were incredibly friendly and helpful breakfast was nice and pool temperature just right. The rooms were cozy and clean.Having room on 2nd floor provided us with small fully shaded balcony with comfortable bed/sofa to relax in full privacy.,"We are very enjoyed.
We had all you can eat promotion with 125++ but is so yummy .
With a good japanese food, small pool but so clean.
Staff was wonderfull, i have 5 start for this place, will happy to be here .

Will come back for food promotion .","I spent 8 days in this friendly Hotel and my experience was simply perfect. The location is perfect and food, staff, cleaness, price were really amazing. I met families, surfers, couples and solo travellers like me and I got from them the same excellent opinion. I will come back for sure i my next visit. Thank you Wasabi! Love Wasabi!! Paolo"
ChIJge9C8Y050i0RdgIWtUzs-JI,HOME by Chef Wayan,-8.6440159,115.12826439999999,"Jl. Pantai Pererenan No.92, Pererenan, Kec. Mengwi, Kabupaten Badung, Bali 80361, Indonesia",https://maps.google.com/?cid=10590474337961509494,OPERATIONAL,+62 812-3759-3530,restaurant,"restaurant, food",4.7,228,,"Home by Chef Wayan serves meals that are as beautiful as they are delicious. My dish was an artful symphony of traditional Balinese flavors with a touch of modern innovation. The tender, perfectly cooked meat was complemented by a rich, savory sauce.  A vibrant salad brought freshness, while zesty lime added the perfect touch of brightness. Even the side vegetables were expertly prepared, showcasing their natural sweetness with a hint of enticing smokiness.  If you want to experience the essence of Balinese cuisine, a meal at Home by Chef Wayan is an absolute must.","What a gem! We found Home after finding that the chef was behind the food we had eaten on a live aboard boat. So for our last night in Bali we had to try it out.
It’s definitely off the main drag of Canggu and well worth jumping in a Grab to eat here.
Simply furnished with outdoor and indoor seating you could feel the love from the first step.
The food is a modern take on Indonesian whilst keeping with the delicious fresh tastes we love.
We enjoyed so many dishes it’s hard to choose a favourite but it must be said it’s the best rendang we have had! The duck breast was so so tender, the sates had been properly grilled with a house made sauce.
The sambals are all made freshly which really adds to the flavours.
There is an extensive cocktail list and they too are well made and delicious
Do yourself a favour and come here you won’t regret it! .","This restaurant wins my ‘Favourite Food’ Award in Bali during the last 6 weeks of travel! I tried the Tempe Bakar and Holy Moley it was OUTSTANDING (even came back to have it again haha) and on my second visit was lucky enough to meet Chef Wayan himself, what a lovely lovely human!

The Black Rice Pudding is an absolute MUST as well!

Don’t miss a visit to this absolute gem in Pererenan. 🙌","Had dinner her with my fiance and it didn't disappoint. The atmosphere is nice even though the place is outdoor the staff is very friendly and helpfull. All the mains here come with rice but we decided to not take the rice and they were kindly enough to offer us to change the rice with sautee vegetable.
The grilled octopus we had a little bit overcooked and the sambal can be too spicy for some people, the ledok nusa is out of this world. The creaminess of the potato and coconut milk balanced by the punch from the sambal and bawang goreng, this is my first time trying ledok nusa and what a introduction it is.","So cozy and delicious food! Thank you to the lovely staff who made me feel like HOME. Got to have dinner with a book full of photos of Bali, enjoyed a very tasty and warm meal. I almost end up having dinner at a very fancy restaurant nearby but I knew I wanted something that felt like it was made with love and intention. And it was! Thank you!!"
ChIJW10FA-U50i0RC1H4zEtB-Ck,LA RESERVE 1785 CANGGU BEACH,-8.6488319,115.12830329999998,"Jalan Munduk Kedungu No.19 Pererenan, Canggu, Kec. Mengwi, Kabupaten Badung, Bali 80361, Indonesia",https://maps.google.com/?cid=3024238943596466443,OPERATIONAL,+62 812-3998-9875,resort_hotel,"resort_hotel, wedding_venue, hotel, spa, lodging, event_venue, restaurant, food",5,160,,"This is an exceptional venue from end to end. A beautiful haven of tranquility and peace in the bustling Canggu area, that will make you feel at home. The staff’s kindness is only exceeded by their professionalism. The hotel and rooms are perfectly decorated, blending local architecture/design with tasteful, understated luxury, and the right touch of quirkiness. While the surroundings offer an incredible selection of restaurants and coffee shops, to which the staff will kindly drive you with their buggy, one could just stay at La Reserve, as the food and drinks are excellent. We cannot recommend La Reserve strongly enough and we will certainly be back!","Excellent boutique hotel,
The room is amazing. We had the villa with private pool, and filled with a lot of details, nice furniture, and well equipped, with its own personality. Access to the private pool from the room and shower area to give you full privacy and offers to have a dip whenever you feel like.
Staff are excellent, always helpful and doing all extra steps to make your stay as smooth and as amazing as possible. Arranging the spa booking, recommending restaurants around, and dropping us to the nearby beach.
Spa was really good and manage to go back few times during our stay.
Restaurant is amazing and the dish from the breakfast menu was beyond our expectation.  Nicely platted, and generous

With limited rooms, you won’t feel staying in a crowded place, and feel like on paradise

Overall it was an excellent experience, and the best place to relax. We would come back again","This is one of the great places to stay. The decor is stunning. The attention to detail flawless. The staff super-attentive without ever being over-bearing. And, when you do leave to go out locally, the golf cart whisks you anywhere you desire and picks you up. This really is what clever indulgence feels like.","Absolutely Fabulous on all levels.  The hotel is like a sanctuary with limited rooms, beautiful gardens, reception and dining spaces all exquisitely designed and decorated with unique and stunning furnishings.  The incredible staff go above and beyond to make your stay a standout and special experience.
The Rooms are amazing - we had the private pool pavilion rooms which was wonderful and so well appointed with everything you could need during your stay - soft fluffy towels and and soft comfy bed linens ....
The Food was delicious- the breakfasts are an occasion with many options to choose from, fresh fruits,  juices and pastries are all so beautifully presented and tasty.
We will definitely be back as we have only been home a week and I wish I was back there :).","We’ve been to Bali around 5 times, and this was definitely one of the best we’ve ever experienced. The staff is super friendly and helpful. They offer free buggy pick ups that take you to restaurants and places nearby, which is really convenient for tourists like us. The breakfast is French style and delicious. The villa has a retro-French vibe, which is very beautiful and stands out from the other resorts. We also love the small pool in the villa, it’s clean and private. Would highly recommend to couples or friends who are looking for an exquisite experience in Canggu."
ChIJD94dpPY50i0R96D3MPX7rrc,ST. ALi - Bali,-8.646774299999999,115.12540229999999,"Jl. Pantai Pererenan, Pererenan, Kec. Mengwi, Kabupaten Badung, Bali 80351, Indonesia",https://maps.google.com/?cid=13235793385395560695,OPERATIONAL,+62 811-3941-6656,cafe,"cafe, brunch_restaurant, coffee_shop, bar, restaurant, food, store",4.2,232,,"Tucked away in the burgeoning area of Pererenan, ST. ALi has landed all the way from Australia, bringing with it a blend of coffee culture and brunch delights. The surroundings are still deep in the throes of construction, so visitors should brace themselves for a bit of noise and dust from the ongoing developments on either side and across the street. Parking can also be a bit of a headache, so plan accordingly.

Upon arrival, the sleek and aesthetically pleasing exterior of ST. ALi is sure to catch your eye, although it may not immediately evoke the traditional Balinese vibe. Instead, it stands out with its modern charm and inviting facade.

Inside, the cafe was buzzing with activity, a testament to its newfound popularity. The design is a delightful fusion of Japanese minimalism and retro rustic elements, creating a cozy yet chic atmosphere perfect for a leisurely brunch or a quick coffee break.

Speaking of coffee, this is where expectations might need a slight adjustment. Despite the buzz surrounding its opening, the coffee here didn't quite hit the mark for me—it leaned a bit on the weaker side. However, the food more than made up for it. The Ali Smash has quickly become a favorite, offering a delectable mix of flavors that left a lasting impression.

The menu offers more than just coffee, with a range of cocktails and full brunch options that cater to different tastes. It's clear that ST. ALi is more than just a coffee shop; it's a vibrant spot for socializing and enjoying a hearty meal.

While it’s currently bustling with curious patrons and the atmosphere is lively, ST. ALi is a solid option for those in the neighborhood. Whether you’re in for a quick coffee or a full brunch experience, it’s a place worth checking out amidst the evolving landscape of Pererenan.","Here around 4PM and it was nice, no queue. Wanted a cup of coffee after meal, and got a cup of latte. The coffee is weaker compared to what I had in Oz, but it’s still smooth and okay. The staff was nice and accommodating. Pet friendly, so you can bring your dogs! 🐕 parking is available for bikes.","New kid on the block by the people behind further hotel, bringing the famous Australian cafe to Bali’s shore.

The same delicious coffee can be found here along with their merch, coffee capsules, beans and more.

Fries were absolutely delicious!!","I was so excited to visit here, but when I got my food that I ordered, I was disappointed.
The coffee was so weak, even though I ordered a size up.(So I thought I had only ordered one shot. Even though the price is same to the cafe in AU!!) But okay, that's fine.
But the food made me so disappointed. I don’t know how to cook the meat like this... I tried to eat it but I couldn’t. Even the pancakes were not good as well... that’s the first time I gave up on eating my pancakes.

Sorry to say that I was disappointed. Usually, I don’t write bad reviews for businesses, but I hope that my review will help your business improve.","It's one of Bali's most beautiful cafes in my opinion. The place is amazing, the architecture is totally trendy and instagram focused, and the branding is great. The drink and the food were really good as well. Glad to comeback here for next holiday."
ChIJIaxq7yk50i0RYz6j4ojlx_Q,Peels Records & Bar Bali,-8.641474600000002,115.1299649,"Jl. Pantai Pererenan No.70p, Pererenan, Kec. Mengwi, Kabupaten Badung, Bali 80351, Indonesia",https://maps.google.com/?cid=17638318841700499043,CLOSED_TEMPORARILY,+62 818-873-357,restaurant,"restaurant, food",4.7,56,,"love this place! super friendly crew, great soundsystem and djs playing. didn’t try the food (no vegan options sadly) but drinks were yum","The interior of this bar is beautiful - literally like from Clockwork Orange movie set. It’s more pricey than a normal cocktail bar in Canggu but drinks we got were very authentic and tasty. Definitely recommend trying some of their signatures. Great music, smoking friendly and they also have cool magazines, zines and publications.",It's a very nice intimate bar but I don't really enjoy staying long there... great cocktails and cute decor! Worth to try :),"The best listening bar/club in Bali! Perfect atmosphere, amazing cocktails and the grooviest tunes. Everything top notch as it is supposed to be! Let’s not forget the host Bintang who takes the best care as well! Greetings from Amsterdam🙌🏽","Great listening space and bar. Provide good cocktails, price slightly higher than average bar especially in Bali"
ChIJhfSXckw50i0RMxcsFO6sUwU,Canggu yoga centre,-8.6433689,115.12778899999999,"Banjar Pengembungan, Jl. Dalem Penataran No.8, Pererenan, Kec. Mengwi, Kabupaten Badung, Bali 80351, Indonesia",https://maps.google.com/?cid=383840531797251891,OPERATIONAL,+62 812-1020-389,fitness_center,"fitness_center, cafe, gym, sports_complex, food, health",4.6,61,,A nice yoga studio in Pererenan. They have many selection of yoga and exercise classes to choose. The studio is very clean and nice. The cafe on the ground floor has a beautiful design and relaxing ambience.,"Absolutely in love with the studio. It’s beautiful, green, and very very pleasant. Also offers hot yoga and Pilates which I’ve never seen in Bali. In love with the challenges, pushing my body and mind to the limit and finding myself stronger and better after each and every class. I cannot recommend the studio enough.

Also tried the Build-Your-Own Salad Bowl. Super fresh with awesome taste. Absolute bliss after a morning workout ♥️","Brand New, Modern design studio in Pererenan, outskirts of main section of Canggu. Because it's newly built it's Super clean including yoga mats and equipment.

Enjoyed the hot yoga(bikram), hot yoga sculpt and hot plates classes especially because I'm detoxing from city work life. Did a few back to back classes and then fueled up with green juices and salads for a few bucks

This is what Bali is meant to be.

Yoga pass can also be used at their sister studio Ubud Yoga Centre.","Not just an ordinary Yoga Centre!!!
If you guys in Bali and a Yoga Lovers or Beginners, you must visit this place!

Yoga classes are on the 2nd and 3rd floors. They have spacious classrooms and well-equipped facilities with beautiful views 🌄
The 1st floor is a cafe that sells healthy foods such as smoothies and juices. There's also coffee and other food.
The 2nd floor is Hot Yoga Class, like Bikram, HIIT Inferno, and others.
The 3rd floor is for Non Hot Yoga Class 🧘‍♀️, such as Kundalini and Pranayama Meditation, Intro to Ashtanga, Yin Yoga, etc.

The teachers are great and very experienced. The staffs also very welcoming. Here, you can enjoy yoga and beautiful views at the same time ^_^
Very recommended ⭐⭐⭐⭐⭐",I liked Ubud yoga center so I was really happy to see they set up another location in pererenan. The place is great. The yoga is great and only place that I know offers hot yoga.  But I’ve recently learned to really enjoy the high internist training in a hot room.  It’s intense and a great workout.  I originally came for bikrim hot yoga but found HIT to be addictive.  Also took vinyasa classes and found them to be outstanding.  So this is my new favorite yoga place in the canggu area. I will say it is outstanding and you will have discovered a gem if you came to try it.  Look for me the sweaty old dude!!!!
