id,name,latitude,longitude,address,url,status,phone,primary-type,types,rating,rating-count,price-level,review 1,review 2,review 3,review 4,review 5
ChIJPyOnitE80i0R84r_LTcvrvg,Warung Lalapan,-8.4932248,115.23072739999999,"G64J+P79, Jl. Delop Ps., Taman, Kec. Abiansemal, Kabupaten Badung, Bali 80352, Indonesia",https://maps.google.com/?cid=17919311881395210995,OPERATIONAL,+62 812-3981-4610,indonesian_restaurant,"indonesian_restaurant, restaurant, food",3.6,15,PRICE_LEVEL_MODERATE,Nice place,,,,
ChIJocqQ4AQ90i0Rc_rX-ooex7k,Meki house,-8.4985894,115.2335072,"Br pengembubungan , Abiansemal, Badung, Bongkasa, Kec. Abiansemal, Denpasar, Bali, Indonesia",https://maps.google.com/?cid=13386701999644867187,OPERATIONAL,,guest_house,"guest_house, lodging",,,,,,,,
ChIJmcV00b490i0RgpB0UrzV0tw,Kanara green coffee,-8.4996835,115.23411569999998,"G62M+4JH, Jl. Tanggayuda, Bongkasa, Kec. Abiansemal, Kabupaten Badung, Bali 80352, Indonesia",https://maps.google.com/?cid=15912015438267322498,OPERATIONAL,+62 887-3437-250,coffee_shop,"coffee_shop, cafe, food, store",,,,,,,,
ChIJu--0mgQ90i0RnfEJIr_--Hw,D' umah tenkelod,-8.4944338,115.23005289999999,"G64J+85M, Taman, Abiansemal, Badung Regency, Bali 80352, Indonesia",https://maps.google.com/?cid=9005227551790592413,OPERATIONAL,,private_guest_room,"private_guest_room, lodging",5,2,,,,,,
ChIJkRcQ49c80i0RIKx55228NLQ,Puri Bunga Village,-8.4962939,115.2360574,"G63P+FCM, Bongkasa, Abiansemal, Badung Regency, Bali 80352, Indonesia",https://maps.google.com/?cid=12985210805836950560,OPERATIONAL,+62 366 975488,hotel,"hotel, lodging",2.6,5,,,,,,
ChIJW_Zjdpw90i0RLammVc428Qg,Wr. Daging Babi Goreng,-8.4990861,115.2339394,"Bongkasa, Abiansemal, Badung Regency, Bali 80352, Indonesia",https://maps.google.com/?cid=644356481518840109,OPERATIONAL,+62 857-9257-8423,breakfast_restaurant,"breakfast_restaurant, restaurant, food",,,,,,,,
ChIJSTEv-9c80i0RwPkO6Lfn2hw,Bukit Pesona Bars,-8.496472599999999,115.23581399999999,"JL. Sanggingan Kedewatan, Ubud, Denpasar, 80571, Bongkasa, Abiansemal, Badung Regency, Bali 80352, Indonesia",https://maps.google.com/?cid=2079228955043232192,OPERATIONAL,+62 366 975371,restaurant,"restaurant, food",3,1,,,,,,
ChIJxe22KAA90i0Rww6PMEN_cAU,Pondok Svarga,-8.4984706,115.2339323,"Bongkasa, Abiansemal, Badung Regency, Bali, Indonesia",https://maps.google.com/?cid=391953094135451331,OPERATIONAL,,guest_house,"guest_house, lodging",5,1,,,,,,
ChIJ639APOY90i0Rl7Xjhu7ZnTI,Umah bayu,-8.4998462,115.23186589999999,"G62J+2JV, Bongkasa, Abiansemal, Badung Regency, Bali 80352, Indonesia",https://maps.google.com/?cid=3647310891728483735,OPERATIONAL,,park,park,,,,,,,,
