id,name,latitude,longitude,address,url,status,phone,primary-type,types,rating,rating-count,price-level,review 1,review 2,review 3,review 4,review 5
ChIJy5MIfkY_0i0ReQ_83j-ALQ0,Makadhiti,-8.609804,115.225899,"Jln. Cekomaria. gang Lestari no.3 Peguyangan, Jln. Cekomaria. Gg Lesri no.3, Peguyangan Kangin, Denpasar Utara, Denpasar City, Bali 80238, Indonesia",https://maps.google.com/?cid=949556108257398649,OPERATIONAL,,hostel,"hostel, lodging",4.4,28,,"Not recommended this place whene you planning fo holiday. quite alot of drama from the staff, Must go back before 12pm like students hostel and the staff playing game laugh shout with their friends at 1-2 am we feel very noisy and alot of nonsense lows. We already complain to the owners but no use and slow respon.","I paid 500k as per location nearby city
It's too far
And have to deduct 50%
Pls put the good map excatly to the public place and don't put incorrect one
Hope you enjoy my 250k",,,
ChIJm7342wQ_0i0RHgyygAUbrb4,BALI GOLDEN TOUR,-8.616212899999999,115.22550419999999,"Jalan Cekomaria Gang Taman IV, Banjar Ambengan No.1, Peguyangan Kangin, Kec. Denpasar Utara, Kota Denpasar, Bali 80115, Indonesia",https://maps.google.com/?cid=13739667748625189918,OPERATIONAL,+62 851-0096-6391,travel_agency,"travel_agency, car_rental",4.9,452,,"Thank you so much for arranging my tour.  All the places on the iterinary are all good and they can make special arrangement depends on the activity you want to to there. I had a great time in Bali and please extend my thank you to Heri Yakuza. He is good tour guide and with great photography skills. 🙂
As a solo female traveller, i felt safe even I am in the country where i dont know anyone! Till next time 😃","At first I was skeptical to use a local tour company but the tours and pricing Bali Golden Tour offered suited us. I contacted the company via WhatsApp and was able to speak to Wayan straight away. He was very prompt in responding and providing me with a detailed itinerary. He was very professional in every way.
I then received a message from Oka who was responsible in the allocation of drivers and is the main contact for any issues the day before my tour advising me the driver’s name and a photo of the driver.
We received a message on the morning of the tour to inform us that our driver has arrived at our hotel lobby.
Oka has been very attentive and helpful with our tour needs when I contacted him and I can’t thank him enough!
Febri our driver was super amazing!! He made our tour so enjoyable and he was also such a great photographer as he was with us during the whole trip/walk of the Waterfalls Tour. He was so helpful and very accommodating to all our requests.
I highly recommend Bali Golden Tours.","I done the wonderful thing in bali is booking my trip with Bali Golden tour. We are 4 family members travelled bali in December. Trip operator took care of us very well from  day one to last day of the tour. Each and every questions are clarified immediately and they flexible to customize the trip schedule. We got great Driver Gade Andika, he is so patience with us and provided lot of information about Bali and their lifestyle. I will much recommend this driver to everyone.","We selected Bali Golden tour as our tour partner in Bali by seeing good reviews and rating in Google. This was our first international trip and we were a  little apprehended about selecting a tour operator from Bali which is totally unknown to us. But from landing at Bali and till leaving, our driver Mr. Tyson was amazing. We booked Car charter. Mr. Tyson was extremely polite and punctual. He guided us to cover various tourist attractions in our limited time. Bali Golden Tour operators were  prompt in replying our queries through Whats app chat. We do strongly recommend Bali Golden tour for a safe and cost effective tour experience in Bali. Thank you Tyson and Bali Golden Tour for your wonderful service.","If you going to Bali...go with bali golden tours. They are reliable, efficient, professional, friendly....Arta is the best driver...I choose him and BGT every time I go to Bali...and this year will be no different. There tours are easy going, fun and value for money. Ĺove BGT 😊"
ChIJGyvZAZA_0i0RNUKr7pGFKAc,ACK Fried Chicken Cekomaria,-8.6149829,115.2265406,"96PG+2J3, Jl. Cekomaria, Peguyangan Kangin, Kec. Denpasar Utara, Kota Denpasar, Bali 80238, Indonesia",https://maps.google.com/?cid=515809019154874933,OPERATIONAL,,meal_takeaway,"meal_takeaway, restaurant, food",4,26,,nice quality food with cheap price,Love it,Bagoss,Recommended 👍,
ChIJUdCgKqw_0i0Rb1p3hjkE0lc,Kos Nyaman DNR,-8.6157527,115.22872339999999,"Gg. Raya No.20X, Peguyangan Kangin, Kec. Denpasar Utara, Kota Denpasar, Bali 80115, Indonesia",https://maps.google.com/?cid=6328125071524584047,OPERATIONAL,+62 898-5490-515,hostel,"hostel, lodging",5,2,,,,,,
ChIJvZHd4gM_0i0RHZG6J-IKmAI,Indekos Gutiswa V Landed Apartment Style,-8.612896899999999,115.2302587,"Jl. Gutiswa V D Nomor 3A,3B,3C, Peguyangan Kangin, Kec. Denpasar Utara, Kota Denpasar, Bali 80238, Indonesia",https://maps.google.com/?cid=186911350981300509,OPERATIONAL,+62 812-3805-0946,guest_house,"guest_house, lodging",4.1,38,,Whoever designed this place did a good job in maximizing the space. It's tiny but also enable you to have more. The road on the way to this place is pretty off putting and there are quite a lot of stray dogs around. Some improvements on the facility would be great too.,quiet and nice design,"complete, simple and unique design",Nice,good
ChIJszFOCUI_0i0R9NDKH4Ot_o8,Banteng Lestari 2B,-8.6168038,115.2272229,"Gg. Banteng No.2B, Peguyangan Kangin, Kec. Denpasar Utara, Kota Denpasar, Bali 80238, Indonesia",https://maps.google.com/?cid=10375921370193907956,OPERATIONAL,,,lodging,5,1,,,,,,
ChIJf7ZIhms_0i0RzYMeEmqTHns,Soto Betawi Kedai Rumah Bambu,-8.613580599999999,115.22700409999999,"Gg. Padi I, Peguyangan Kangin, Kec. Denpasar Utara, Kota Denpasar, Bali 80238, Indonesia",https://maps.google.com/?cid=8871690399746261965,OPERATIONAL,+62 838-7949-9727,restaurant,"restaurant, food",4.8,16,,"The best Indonesian food, comes from recipes passed down from tribes in the Indonesian capital. Named ""Soto Betawi"", you can try it here. You can get good taste and service at an affordable price.",Good,,,
ChIJDQmRaUI_0i0REzwRh1BPQ9g,Kost pak bayu,-8.6158992,115.2276678,"Gg. Raya, Peguyangan Kangin, Kec. Denpasar Utara, Kota Denpasar, Bali 80238, Indonesia",https://maps.google.com/?cid=15583386342914079763,OPERATIONAL,+62 858-2903-7092,lodging,lodging,3.7,3,,,,,,
ChIJeyPccks_0i0RlPjf4U489g4,Sekar Antasura Pension,-8.6143128,115.22371169999998,"Jalan Perum Antasura II, Peguyangan Kangin, Kec. Denpasar Utara, Kota Denpasar, Bali, Indonesia",https://maps.google.com/?cid=1078115470296479892,OPERATIONAL,,hostel,"hostel, lodging",3.5,2,,,,,,
ChIJ33Uwx_s_0i0RDqGNUiu03aM,Kost gustiwa x,-8.6156531,115.23068959999999,"Jl gustiwa x, Peguyangan Kangin, Kec. Denpasar Tim., Kota Denpasar, Bali, Indonesia",https://maps.google.com/?cid=11807791896196915470,OPERATIONAL,+62 857-3752-1987,,"hostel, lodging",,,,,,,,
ChIJv1UPIUs_0i0RKwmpBti2Ebk,Kedai Ayam Bu Kiky,-8.611906,115.2263091,"Jl. Cekomaria No.107, Peguyangan Kangin, Kec. Denpasar Utara, Kota Denpasar, Bali 80238, Indonesia",https://maps.google.com/?cid=13335641010561681707,OPERATIONAL,,restaurant,"restaurant, food",5,2,,,,,,
ChIJqfFQRU4_0i0RDUBx3TaXGI0,Sing nawang,-8.6133214,115.22672139999999,"96PG+MMH, Jl denpasar, Peguyangan Kangin, Kec. Denpasar Utara, Kota Denpasar, Bali 80234, Indonesia",https://maps.google.com/?cid=10167042420688109581,OPERATIONAL,+62 851-1122-2444,coffee_shop,"coffee_shop, cafe, store, food",5,3,,,,,,
ChIJy2SLZds_0i0RBNgI1W31hT0,Penatih house,-8.6160996,115.22982069999999,"Gg. Banteng V No.9, Peguyangan Kangin, Kec. Denpasar Utara, Kota Denpasar, Bali 80238, Indonesia",https://maps.google.com/?cid=4433219260290488324,OPERATIONAL,,lodging,lodging,3,2,,,,,,
ChIJJVVWZTA_0i0RA1zJyVzImS4,Pesraman Widya Graha Kepasekan Maha Gotra Pasek Sanak Sapta Rsi,-8.6130741,115.2261525,"96PG+QFC, Peguyangan Kangin, Denpasar Utara, Denpasar City, Bali 80238, Indonesia",https://maps.google.com/?cid=3357935298029378563,OPERATIONAL,,cultural_center,cultural_center,4.7,19,,,,,,
ChIJ_4Ic1PI_0i0RBMSiUqWZa50,Tumpeng bali,-8.614827,115.227513,"Jl. Gutiswa No.14, Peguyangan Kangin, Kec. Denpasar Utara, Kota Denpasar, Bali 80238, Indonesia",https://maps.google.com/?cid=11343329021797778436,OPERATIONAL,+62 822-3777-3911,indonesian_restaurant,"indonesian_restaurant, restaurant, food",5,52,,👍,👍🏻,🤩🤩,,
ChIJyQRljrI_0i0RSNF8gacAnWU,Tomatto Residence,-8.6155431,115.2277473,"Jl. Gutiswa No.12, Peguyangan Kangin, Kec. Denpasar Utara, Kota Denpasar, Bali 80238, Indonesia",https://maps.google.com/?cid=7322009288606273864,OPERATIONAL,,lodging,lodging,4.6,5,,,,,,
ChIJC_VyPhA_0i0R6bA3y1ABI4c,Warung sembako ibu rama,-8.6126431,115.2298488,"Jl. Gutiswa V, Peguyangan Kangin, Kec. Denpasar Utara, Kota Denpasar, Bali 80239, Indonesia",https://maps.google.com/?cid=9737628265823580393,OPERATIONAL,+62 819-9966-7225,indonesian_restaurant,"indonesian_restaurant, restaurant, food",5,2,,,,,,
ChIJrRv_cns_0i0RSnpamzWinNM,Kos Pak Nengah,-8.6137835,115.229064,"96PH+FJP, Jl. Gutiswa V, Peguyangan Kangin, Kec. Denpasar Utara, Kota Denpasar, Bali 80238, Indonesia",https://maps.google.com/?cid=15248240789493021258,OPERATIONAL,,motel,"motel, lodging",,,,,,,,
ChIJo9857PY_0i0RDFX-DbmNcBc,Rachel Kitchen,-8.6166264,115.22794329999998,"96MH+85W, Gg. Banteng, Peguyangan Kangin, Kec. Denpasar Utara, Kota Denpasar, Bali 80238, Indonesia",https://maps.google.com/?cid=1689005686207173900,OPERATIONAL,+62 812-3927-059,restaurant,"restaurant, food",4.5,13,,Delicious!,,,,
ChIJTVLoCLE_0i0RfK3bGDb3Ilo,Rumah Bimastra,-8.6141394,115.2278492,"Jl. Gutiswa I No.6, Peguyangan Kangin, Kec. Denpasar Utara, Kota Denpasar, Bali 80238, Indonesia",https://maps.google.com/?cid=6495025424339021180,OPERATIONAL,,restaurant,"restaurant, food",5,3,,,,,,
