id,name,latitude,longitude,address,url,status,phone,primary-type,types,rating,rating-count,price-level,review 1,review 2,review 3,review 4,review 5
ChIJm4T5A4OQ0S0Rs5y7y6XE6vM,Puri Agung Singaraja,-8.1260158,115.09692550000001,"Jl. Mayor Metra No.12, Paket Agung, Kec. Buleleng, Kabupaten Buleleng, Bali 81118, Indonesia",https://maps.google.com/?cid=17576076712133500083,OPERATIONAL,+62 362 22974,tourist_attraction,tourist_attraction,4.4,199,,"This place is very nice, the view is very beautiful, and the service is very friendly.",This is the old palace of the Singaraja Royal Family. The gardens are kept very well and some of the buildings have original furniture. It doesn't seem much from the street but when you're inside it is great!,Great historic place,"beautiful place makes me know more history
about puri agung","I was very happy after visiting Puri Agung Singaraja, which made my mood improve"
ChIJQWSvhZuR0S0RUA7ShknFWAo,YÁNG HEADQUARTERS,-8.1265497,115.09721859999999,"Jl. Mayor Metra No.14, Paket Agung, Kec. Buleleng, Kabupaten Buleleng, Bali 81117, Indonesia",https://maps.google.com/?cid=745562657915014736,OPERATIONAL,+62 819-3632-0188,coffee_shop,"coffee_shop, cafe, food, store",4.7,122,PRICE_LEVEL_INEXPENSIVE,"comfortable place to relax, good photo spot, and also a very affordable menu","The fact that this coffeeshop owner care to spend some time to educate you about coffee and brewing alone deserve a five-star rating. Complimented by a great taste in authentic coffee brewing, makes it even more worth it. Don't worry about the price though, as the coffee could easily worth double the price tag if not more.

If you are into something special, try their cold brew, a slowly dripped-with-ice product which takes about 10 hours to produce. It's a masterpiece. Will come back for more!!","Young vibe/atmosphere, a lot of choice of drinks. For me the lemonade was a bit too sweet. But friendly staff","Good Vibes, Good Food, Good Beverages.. Perfect!!",Cozy place to hangout with friends and have an authentic taste of coffee and food also.
ChIJFU_mJ4OQ0S0R9SOUJsOCMp0,Puri Kanginan Buleleng,-8.1244254,115.09717639999998,"V3GW+6WP, Jl. Gajah Mada, Kp. Singaraja, Kec. Buleleng, Kabupaten Buleleng, Bali 81118, Indonesia",https://maps.google.com/?cid=11327259787467695093,OPERATIONAL,+62 362 21342,historical_landmark,"historical_landmark, tourist_attraction, museum",4.5,82,,"""Exceptional experience! This museum truly offers a profound journey into the history of Hinduism. With a rich collection of historical artifacts, every corner radiates spiritual elegance. Interactive exhibits and knowledgeable guides make each visit more meaningful. The atmosphere is tranquil, as if transporting us back to a past full of wisdom. Truly an inspiring destination, deserving of 5 stars!""","Puri Kanginan Buleleng is a historic royal heritage place on the island of Bali precisely in Buleleng regency, this place is very comfortable to visit and of course we get a lot of historical knowledge about the origin of Puri Kanginan Buleleng.","The only preserved castle in Buleleng, still complete, is the residence of his descendants","This puri is very beautiful and unique, it has its own characteristics, which made me interested in visiting here","The best place in Buleleng because it has memories of past historical times, the buildings are still sturdy"
ChIJbSswsquR0S0Rd9VedtMmzSU,Buleleng Royal Palace,-8.1244034,115.09732549999998,"V3GW+6WP, Kampung Singaraja, Buleleng, Buleleng Regency, Bali, Indonesia",https://maps.google.com/?cid=2723876039294899575,OPERATIONAL,,,lodging,5,2,,,,,,
ChIJmcLjSoGQ0S0RA-btkUCIWpA,Sanggar Santhi Budaya,-8.1292414,115.0995535,"V3CX+8R3, Jl. Mayor Metra, Liligundi, Kec. Buleleng, Kabupaten Buleleng, Bali 81119, Indonesia",https://maps.google.com/?cid=10401776100273153539,OPERATIONAL,,cultural_center,cultural_center,4.7,87,,Nice place for bring your Kids learning about Balinese culture 😉,The best place for get an experience,Balinese dance studio,"Interesting , wondeefull , amazing",
ChIJuZQTCIuR0S0R7IDZwshNdjQ,Warung SIOBAK 57,-8.131715,115.09961409999998,"Jl. Mayor Metra No.57, Liligundi, Kec. Buleleng, Kabupaten Buleleng, Bali 81119, Indonesia",https://maps.google.com/?cid=3780294461881942252,OPERATIONAL,+62 877-6276-5234,restaurant,"restaurant, food",4.6,10,,Realy great...,,,,
ChIJ_7YsWbqR0S0Rd3tMY4IGmvw,satya darma house,-8.1257509,115.10014689999998,"V4F2+M3R, Jl. Gn. Batukaru, Liligundi, Kec. Buleleng, Kabupaten Buleleng, Bali 81118, Indonesia",https://maps.google.com/?cid=18201868001052752759,OPERATIONAL,+62 812-4652-2121,private_guest_room,"private_guest_room, lodging",5,7,,Nice place😎,nice place,,,
ChIJ7zap0ZCR0S0R4Oh3sl005Jk,Taman Gusti Ngurah Rai,-8.1244783,115.09692539999999,"V3GW+6Q3, Kampung Singaraja, Buleleng, Buleleng Regency, Bali 81118, Indonesia",https://maps.google.com/?cid=11089045759523809504,OPERATIONAL,,park,park,4.3,4,,,,,,
ChIJt_gyV36R0S0R5RlaKcpdZoQ,Griya Kemenuh Upapathi Singaraja,-8.1285685,115.098247,"Jl. Mayor Metra No.26, Liligundi, Kec. Buleleng, Kabupaten Buleleng, Bali 81119, Indonesia",https://maps.google.com/?cid=9540415983489522149,OPERATIONAL,,cultural_center,cultural_center,4.9,17,,One of the oldest geria in Singaraja.,,,,
ChIJRRo5vDmR0S0RUAiDuSLgTQ8,Gria Telaga Ngenjung Liligundi,-8.1250059,115.09837279999999,"Jl. Gn. Semeru No.55, Kp. Singaraja, Kec. Buleleng, Kabupaten Buleleng, Bali 81119, Indonesia",https://maps.google.com/?cid=1102783923521521744,OPERATIONAL,,,lodging,4.9,7,,,,,,
ChIJde3gIYOQ0S0RTrYuNORDVcY,Warung Lalapan Mbak Fifi,-8.125087599999999,115.0973003,"V3FW+XW7, Kampung Singaraja, Buleleng, Buleleng Regency, Bali 81118, Indonesia",https://maps.google.com/?cid=14291403639937218126,OPERATIONAL,+62 853-3360-0198,indonesian_restaurant,"indonesian_restaurant, restaurant, food",4.4,45,,Ok,,,,
ChIJcfxV_IKQ0S0RSMs1eBUbQec,Puri Gede Buleleng,-8.126597499999999,115.0977416,"Jl. Mayor Metra No.12, Paket Agung, Kec. Buleleng, Kabupaten Buleleng, Bali 81118, Indonesia",https://maps.google.com/?cid=16663629875272600392,OPERATIONAL,,,tourist_attraction,4.7,19,,"I don't know exactly the story about this place. But I am sure, you will enjoy around the place when you go there.",Best,,,
ChIJsSrGuIOQ0S0RzR1Nwlgc7wQ,Warung Bundari & Catering,-8.1274841,115.0980567,"Jl. Mayor Metra No.41X, Liligundi, Kec. Buleleng, Kabupaten Buleleng, Bali 81118, Indonesia",https://maps.google.com/?cid=355534063128092109,OPERATIONAL,+62 819-3642-0206,restaurant,"restaurant, food",4.6,33,PRICE_LEVEL_INEXPENSIVE,Nice place to having meal😁,Very nice food,Top,'''good food 👍👍,
ChIJT_IuEf-R0S0R1Q6rujDkOXs,"Warung blayag dan jajan bali, kasih ibu",-8.127755,115.0981428,"Jl. Mayor Metra No.45, Liligundi, Kec. Buleleng, Kabupaten Buleleng, Bali 81118, Indonesia",https://maps.google.com/?cid=8879379038278979285,OPERATIONAL,,meal_takeaway,"meal_takeaway, restaurant, food",4.4,9,,,,,,
ChIJGxi7syGR0S0Rw4vpwsCABHs,Kampung jawa/kampung singaraja 1,-8.1243629,115.09854109999999,"Jl. Gn. Semeru No.24, Kp. Singaraja, Kec. Buleleng, Kabupaten Buleleng, Bali 81118, Indonesia",https://maps.google.com/?cid=8864351531964140483,OPERATIONAL,,lodging,lodging,4,2,,,,,,
ChIJtYERsNCR0S0RAX0tvHtB2f8,Kantor lurah liligundi,-8.127431999999999,115.0977588,"Jl. Gn. Batukaru, Liligundi, Kec. Buleleng, Kabupaten Buleleng, Bali 81119, Indonesia",https://maps.google.com/?cid=18435838549311716609,OPERATIONAL,,park,park,4.7,3,,,,,,
ChIJnz2p4tuR0S0RB77KnPa6tyU,Warung Bu Desak,-8.1275864,115.09810709999998,"V3CX+X69, Jl. Mayor Metra, Liligundi, Kec. Buleleng, Kabupaten Buleleng, Bali 81119, Indonesia",https://maps.google.com/?cid=2717846468496637447,OPERATIONAL,,indonesian_restaurant,"indonesian_restaurant, restaurant, food",4.9,13,,,,,,
ChIJ-2f29vuR0S0R1ptX_Hz4hVk,Gado Gado Ketoprak Bu Desak,-8.1301274,115.0972551,"BTN Liligundi Permai, Jl. Tambora, V39W+WWR, Liligundi, Kec. Buleleng, Kabupaten Buleleng, Bali 81117, Indonesia",https://maps.google.com/?cid=6450835256971336662,OPERATIONAL,+62 819-3649-8353,brunch_restaurant,"brunch_restaurant, breakfast_restaurant, restaurant, food",5,5,,"We loved coming here, the owner is so lovely and sweet and cooks such amazing food!! She sells so much yummy snacks, drinks and her dogs are just the cutest!! You have to come here to shop! :)",,,,
ChIJYW_vBVmR0S0R_PdfFZggEZw,Griya Mas Abian,-8.129515999999999,115.09932900000001,"V3CX+8R3, Jl. Mayor Metra, Liligundi, Kec. Buleleng, Kabupaten Buleleng, Bali 81119, Indonesia",https://maps.google.com/?cid=11245805582086567932,OPERATIONAL,,historical_landmark,historical_landmark,5,4,,,,,,
ChIJ2aa8bzGR0S0RHB1TpqscOAI,Warung Be Genyol Singaraja,-8.1317419,115.09967999999999,"V39X+8V3, Jl. Mayor Metra, Beratan, Samayaji, Kabupaten Buleleng, Bali 81119, Indonesia",https://maps.google.com/?cid=159909310327102748,OPERATIONAL,,restaurant,"restaurant, food",4.9,8,,,,,,
