id,name,latitude,longitude,address,url,status,phone,primary-type,types,rating,rating-count,price-level,review 1,review 2,review 3,review 4,review 5
ChIJT9cXj6n10S0RmM3ldF7yoUo,Sate Babi Intemanis Rai,-8.244059499999999,115.32679580000001,"Q84G+9PF, Jalan Raya, Kintamani, Kec. Kintamani, Kabupaten Bangli, Bali 80652, Indonesia",https://maps.google.com/?cid=5377845917559147928,OPERATIONAL,,indonesian_restaurant,"indonesian_restaurant, restaurant, food",4.9,10,,"Being a tent on the side of the road doesnt really matter when the owner is so kind and cheerful, on top of having some of the most affordable and delicious pork and fish satay on the planet. Rp. 5000 and you get 3 of the stuff, and not just a skinny tiny ones you usually get with cheap satays. Here the meats are thickly cut and well seasoned. Definitely would go back again everytime we visit Bali",Unbelievable food and friendly staff. Don’t get put off by the fact it’s a tent by the side of the road it’s so good!,"Best satay out there, best sambal, super recommended. This place should have deserves more popularity",,
ChIJS1-gPcD10S0Rtw8NQXDPpHQ,Warung Tipat Dadong Cin,-8.243137599999999,115.32547199999999,"Q84G+P5X, Kintamani, Bangli Regency, Bali 80652, Indonesia",https://maps.google.com/?cid=8405070885614849975,OPERATIONAL,+62 821-4672-1226,restaurant,"restaurant, food",,,,,,,,
ChIJi4WPAKT10S0RWzjAbtRxd8U,Warung muslim PWJ Banyuwangi,-8.2436916,115.32645980000001,"Jl. Raya Kintamani, Kintamani, Kec. Kintamani, Kabupaten Bangli, Bali 80652, Indonesia",https://maps.google.com/?cid=14228966704905467995,OPERATIONAL,+62 813-8279-0700,restaurant,"restaurant, food",5,4,,,,,,
ChIJRXSvZ4H00S0RPIeY1eJjVM4,WARUNG MAKAN BOGA SARI,-8.242237,115.3256596,"Q85G+473, Jalan Raya, Kintamani, Kec. Kintamani, Kabupaten Bangli, Bali 80652, Indonesia",https://maps.google.com/?cid=14867618095754151740,OPERATIONAL,+62 831-1496-0169,restaurant,"restaurant, food",5,3,,Top,,,,
ChIJwzZbcpr10S0RtwScarfUuYU,Warong Mekcin market and coffe,-8.2430595,115.3254242,"Q84G+P6R, Kintamani, Bangli Regency, Bali 80652, Indonesia",https://maps.google.com/?cid=9635966761968600247,OPERATIONAL,+62 812-3802-0524,coffee_shop,"coffee_shop, cafe, food, store",,,,,,,,
