id,name,latitude,longitude,address,url,status,phone,primary-type,types,rating,rating-count,price-level,review 1,review 2,review 3,review 4,review 5
ChIJKUgDyJtB0i0R1yJLhS9mLAw,Babi Guling Pan Ana,-8.674780400000001,115.20637230000001,"Gg. 33 No.4, Dauh Puri Kauh, Kec. Denpasar Bar., Kota Denpasar, Bali 80113, Indonesia",https://maps.google.com/?cid=877188381716194007,OPERATIONAL,+62 899-9208-000,indonesian_restaurant,"indonesian_restaurant, restaurant, food",4.2,3752,PRICE_LEVEL_MODERATE,"This is Babi Guling what about..
The taste, the spice, the portion, the price and last but not least the Balung soup is the best. Yes the place is not to comfort, especially if you come for lunch maybe need to wait to seated. I recommend using a motorcycle because it is located in the middle of the aisle.
Still the best for me.","If you're searching for the best babi guling in town, look no further than Babi Guling Pan Ana. My recent visit left me thoroughly impressed with their delicious offerings. I ordered the ""paket daging babi plus kulit,"" and it was an absolute delight.

The meat was perfectly cooked, tender, and bursting with flavor. The crispy pork skin was a standout, offering a satisfying crunch that complemented the succulent meat beautifully. Each bite was a testament to the care and expertise that goes into preparing this traditional Balinese dish.

Babi Guling Pan Ana truly lives up to its reputation. The flavors are top of the line, and the quality is evident in every component of the meal. Whether you're a local or a visitor, this is a must-try for any food enthusiast. Highly recommended!","While it might not be the top babi guling spot in town, the portions are generous. There's a variety of meat choices and the soup is tasty. The standout feature is the service – during a crowded lunchtime visit, the staff went out of their way to find us a comfortable seat to wait. The price is reasonable, but due to its location in a small alley, parking can be a bit tricky. I'd suggest avoiding peak hours if you plan to visit.","My friend took me here as I'm not a local and it's kinda hidden from the main street so I wouldnt know about it if not for them. You can indeed never go wrong with pork, but it takes real skill of a cook to make the taste feel exceptional. This place is one of those. Just be careful if you decide to take away the ""lawar"" as it can be spoiled really quick","Tasty bigul with an affordable price. The soup is soooo good with a big chunk of meat inside. You must orded n pay first then give the note to the next counter, after that just find the seat. The food will be delivered to your table."
ChIJb6cQKBxB0i0RfbvsP65UYFk,KFC,-8.676245999999999,115.20646110000001,"Jl. Teuku Umar Gg. Pluto, Simpang 6 Bali, Kec. Denpasar Bar., Kota Denpasar, Bali 80113, Indonesia",https://maps.google.com/?cid=6440240574513331069,OPERATIONAL,+62 21 14022,fast_food_restaurant,"fast_food_restaurant, restaurant, food",4.2,1544,PRICE_LEVEL_MODERATE,"Located in Simpang Enam area, this KFC outlet was really easy to find. Their building was modern-designed with great interior inside. Overall was good, but I think there are something that should be improved. It was the water availibility, especially for washing hand (yeah you know Indonesians eat without cutlery). Cmon, you were located in strategic area. At least you must provide the best service and facilities for the customers, right?","Two stories building, has good internal decorations, wide parking space. It also has drive through. Nice employee, clean toilets. Indoor and outdoor tables.","Worst food and drink ever!!!
So untasty!!! I asked if coffe with no sugar, but it was over sweetened. Chicken balls on taste was like fish head🤢 and burger it’s just trash!!! Very unrecommended!!!!!","Chicken is always yummy here ♥️
This branch is nice and quiet on weeknights","KFC Denpasar Bali,. In umar road, opposite to the round about. Everything is ok n fine."
ChIJ5XYJ_sNA0i0RqvEudDv4uSQ,"Marugame Udon, Teuku Umar Bali",-8.6758084,115.207282,"Simpang 6, Jl. Teuku Umar No.141, Dauh Puri Klod, Kec. Denpasar Bar., Kota Denpasar, Bali 80114, Indonesia",https://maps.google.com/?cid=2646419190292869546,OPERATIONAL,+62 811-3453-327,japanese_restaurant,"japanese_restaurant, restaurant, food",4.6,4548,PRICE_LEVEL_MODERATE,"I've been here many times and I’ve finally taken a moment to share my thoughts. Last night, I had dinner at Marugame with friends, and what I like about Marugame is the friendly and kind staff. When it's crowded, it can be a bit confusing to find a seat, but luckily, there are plenty of tables and chairs available.

I usually order the Spicy Tori Paitan and dessert if they have it in stock. The prices are in the mid-range, not too cheap or expensive. You can also get free refills for your drinks, which is nice.

The restroom is basic; it's sometimes clean, and sometimes the floor can be a bit wet, depending on how frequently customers use it.

It's easy to access because it's located at the corner Simpang 6 Denpasar. The parking area is spacious for motorcycles, but not so much for cars, although the parking attendants are friendly.","Come there for lunch with my little family. Ordered Chicken Katsu Udon and Beef Udon. A bit long in queu to have the meals maybe because of Sunday, look like busy. Good taste meals. Laso have ice cream and pudding for dessert...","My wife miss udon since she come back from japan and when we visiting denpasar, we found this Marugame Udon in Teuku Umar Street. I never eat udon before and I little bit confuse about difference between Udon and Ramen. But the bigger size of noodle is Udon.

This place located in very good place and have a very big parking area. There are different place for non smoking, smoking, and indoor area. You can choose every menu in the kitchen bar or scan it before. My favourite one is unlimited Refill for Ocha if you order ocha. I love the place, very cozy.

We order 2 Udon and a Chicken Katsu and vegetable. I love the chicken katsu combined with tempura ketchup.","It does have a dedicated praying corner. I put 5 stars without hesitation for food, service and atmosphere because the foods are good, staffs are friendly, there is separated smoking area and sufficient parking.
if I may add its also easy to locate.","Really like the chicken katsu in this place, i recomended for udon menu. I suggest you to order ocha menu couse you can refill the drinks whenever you wanted to. Please come with empty stomach, because udon portion in this place was so big. I even can't make it heheh but overall good, not too bad"
ChIJqSpzqwZB0i0RBBY0m4hQTKo,Babi Guling Candra Teuku Umar,-8.675235299999999,115.20723269999999,"Jl. Teuku Umar No.140, Dauh Puri Kauh, Kec. Denpasar Bar., Kota Denpasar, Bali 80113, Indonesia",https://maps.google.com/?cid=12271271632327415300,OPERATIONAL,+62 878-1833-9779,indonesian_restaurant,"indonesian_restaurant, restaurant, food",4.1,110,,"This used to be my favorite Babi Guling restaurant for many many years. Today was a disappointment, the meat was tough, dry and very boney. I ordered 3 extra meat and they were all disappointing. They moved back to the old location but the place is still very unpresentable and has portable toilet. We will try a different bigul restaurant next time we visit Bali.","Wanted to eat some Babi Guling at night and came here after hearing some recommendations. Came here at about 8pm.

Honestly, I would like to come here again in the day because the pork has already been prepared, unlike the daytime ones where it is fresh out from the fire. The pork skin is not as crispy, and it's a little cold. Also, the pricing is a bit on the middle range.

I like how the dish is prepared as a small variety in a plate. There is an array of different ways the pork is prepared, and innards such as fried lung and intestine we're also given. Most of the items here are deep fried, or stir fried & grilled. My personal favourites on this plate were the pork cackling skin, pork skewers, and the sambal with the sweet potato leaves. The skewers were so good we ordered extra. I rate: 4/5 🌟

To pair with the dish, rice with another sambal is given, with a small piping small hot bowl of peppery pork soup.","The taste is not like before, pork skin is not crispy anymore at dinner time. Time to changed my preference of Bigul resto now","Little bit pricely compare with other place nearby.
Taste also almost the same with other.
Good to know....",Good enough.
ChIJf-MgisNA0i0R1daxPTNSWpI,Kober Mie Setan Pulau Kawe,-8.677367799999999,115.20677470000001,"Jl. Pulau Kawe No.7, Dauh Puri Klod, Kec. Denpasar Bar., Kota Denpasar, Bali 80114, Indonesia",https://maps.google.com/?cid=10545831857473312469,OPERATIONAL,,restaurant,"restaurant, food",4.1,4356,,"Very affordable lunch!!!
The drinks also really cheap and refreshing.. the outdoor table has nice vibes...
Nice for hangout and figure photography..
But during rush hour the place could get really crowded","Quite famous in Bali, their speciality is noodle. You can choose your spiciness level with no chili, or lot of chilies. The noodle is fried with two options, using sweet soy sauce or not. I ordered Mie Iblis, fried noodle with sweet soy sauce so it looks brown. The noodle was delicious, served with two fried dumplings. It costs me only 10k IDR before tax (10%). For the drink, I tried Es Genderuwo, tastes sweet with few mixed fruits. It costs 9.5k IDR before tax (10%). This place is large and has second floor, it’s quite comfortable for eating but not too clean. If crowded, you have to wait long for them to serve your food. Parking area limited if you are driving a car. Location is good, on a main street near simpang enam Denpasar.","Good taste of noodles, depends on the level of the spicy. I prefer to ""mie iblis level s"". Best beverages here according to me is ""es genderuwo"". The situation here every time is crowded. You better eat here for short meeting. The parking is good, there are parking security stand by and arrange the motorbike. Dont bring car here, there are no car park here.","Decent place, good food choice (with spicy noodles as it's main dishes) quite crowed, often full of teenager and online food delivery","Special menu is spicy noodle you can request how much spicy you want, also cheap price but just too long time waiting the menu order ready to serve..."
ChIJy8uCFMRA0i0R9foRwVDuIL4,Happy Puppy - Libbi Plaza Denpasar,-8.6772098,115.2055511,"86F4+467, Jl. Teuku Umar, Dauh Puri Kauh, Kec. Denpasar Bar., Kota Denpasar, Bali 80113, Indonesia",https://maps.google.com/?cid=13700212097065024245,OPERATIONAL,+62 361 247008,bar,"night_club, bar",4.4,2407,PRICE_LEVEL_MODERATE,"Liked: the room was clean and comfortable. Sound system was ok. Spacious parking available. There was some technical issue in our room and they let us to move to a better and bigger room. Price was reasonable.

Disliked: Staff wasn't really friendly and disorganized, they didn't even bother to guide us to our room and only showed us the room number. Microphone was off all the time and when we complained about it, the staff was really slow in responding. But they finally moved us to other room, so it was ok.","The place is nice but some songs are completely different from the originals. The place is good, the room is clean, the staff are nice, the toilet is quite clean. Overall this place are ok. But please update the songs & put the original music, maybe the clip no need to be the original one. But at least the music!","I had a good karaoke experience but was disappointed with the service. One of the mic is off. The staff helped to change the battery 3 times, still the mic couldn’t be fixed. We ended up changing room and the AC was hot. The price is reasonable. The app is running smooth. The toilet is clean","Here the room is small and there is a choice of packages with minimal spend... Example for a 3 hour room, we have to spend 350k... The microphone is still wired, Wi-Fi access is too complicated... I thought I would never come back to this place!!!","Good sound system
Well trained staff
Affordable prices
Food tastes good 👍"
ChIJqdj8FiVB0i0RRY87IxGh7fc,"Fore Coffee - Simpang Enam Teuku Umar, Bali",-8.6756691,115.20690119999999,"Jl. Teuku Umar No.147, Dauh Puri Kauh, Kec. Denpasar Bar., Kota Denpasar, Bali 80113, Indonesia",https://maps.google.com/?cid=17865112391826247493,OPERATIONAL,,coffee_shop,"coffee_shop, cafe, store, food",4.4,343,,Great place to hang out in the middle of denpasar city. The parking space is spacious and has quite a lot of seating. The menu is actually the same with the other stores. Service is pretty fast.,"It’s my first time visiting this chic café and loving it! The interior design is so welcoming with stark white wall and great lighting and comfortable indoor and outdoor area, the garden area adds the warmth and comfort for the customers.

Taste-wise they’re top notch quality for local brand, we tried Butterscotch Coffee Latte and Big Matcha, delicious taste combination, great packaging, and so yummy for coffee lover. Their staffs were helpful and informative

Price is reasonable and much affordable for local customers, definitely keen to come back soon!","i think this is the biggest fore in Bali. the coffee really good as always and they have quite a lot of bakery choices.
there is indoor and outdoor area. good for work and hangout with friend but for the music i think a little bit too much (loud)","Finally I came to Fore Teuku Umar, because it was always busy and parking the car was a bit difficult so I didn't stop by many times. The place is more spacious than other Fores, the facilities and quality of the coffee taste just as good.","Been here a few times. The staff is really friendly eventhough it's very busy especially in the afternoon. The atmosphere is too noisy, not an ideal place to work. Coffee is great, however it takes too long to wait for a cup of coffee. Might be faster if you order through the app"
ChIJz-IVbqZB0i0RiRq2B3BUL2o,Etu Coffee,-8.674341199999999,115.20700339999998,"Jl. Nusa Kambangan No.179, Dauh Puri Kauh, Kec. Denpasar Bar., Kota Denpasar, Bali 80113, Indonesia",https://maps.google.com/?cid=7651427132068207241,OPERATIONAL,+62 859-6638-8033,coffee_shop,"coffee_shop, cafe, store, food",4.8,151,,"Aku sudah beberapa kali kesini krn dekat dg rumah dan kopi nya masuklah kelidah,but today kecewa banget chicken skinnya tidak sesuai spt biasanya. Untuk set up kopi nya berbeda” krn beda staff beda set up. Kadang ada glass air nya,dan kadang tidak. So must be samelah ya. Maybe the owner bref your staff to be same set up and serve same quality of food. Aku duduk ngopi thats for my mood but today I’m unhappy. Thats why I giving 2 star. This is first time I’m complain but not much thats for your improvment. After my review I coming back and got compimentary but I’m not thinking of that. Then ordering big breakfast to try so well nice,but one think bacon is less crispy. I love that. Thanks to owner for fast respon and smart,thanks to staff also","Nestled within a quaint alley lies a hidden gem – a charming coffee shop that promises a unique experience.

Despite its tucked-away location, the aroma of freshly brewed coffee draws patrons in. The cozy ambiance invites guests to unwind and savor their beverages amidst the hustle and bustle of the city.

With friendly staff and artisanal brews, this little coffee haven offers a delightful escape from the ordinary.
Whether you're seeking a quiet spot for reflection or a vibrant atmosphere for conversation, this alleyway retreat has something to offer every coffee enthusiast.","1.If you are a foreigner and pay with cash, be aware that the waiter may give you less change.
2.Don't sit there for too long. The coffee shop has a cleaner who is always mopping the floor and cleaning the windows beside you. Customers really don't need such service.","love the atmosphere! very condusive to work, the wifi also stable. the coffe and croisant were best! recommend you to visit overall.","One of the best place for working and chill out. Plenty space, convenient atmosphere, and plenty of electric plug. Super friendly staff. That was awesome. The location is hidden behind an alley, so it increase the serenity of this place. I try one of their signature coffee, E.tu Shaker. It tastes great. The cinnamon in this coffee, make its tastes unique. Absolutely, will comeback again. Keep up the awesome work Etu's Team👍🏻 Bravo!"
ChIJ00meDMRA0i0RyzjHC80nTr8,Bubur Ayam Bang Yossi,-8.6772258,115.2062084,"no, Jl. Teuku Umar No.153, Dauh Puri Kauh, Kec. Denpasar Bar., Kota Denpasar, Bali 80113, Indonesia",https://maps.google.com/?cid=13784999271047051467,OPERATIONAL,+62 812-3456-789,restaurant,"breakfast_restaurant, restaurant, food",4.5,2240,PRICE_LEVEL_INEXPENSIVE,"Bubur Ayam Bang Yossi has been a staple in the community for many years, and it's easy to see why. I've been coming here regularly, and their bubur ayam is simply delicious. One bowl is never enough!

The flavors are rich and comforting, with the perfect blend of tender chicken, savory broth, and just the right amount of spices. The consistency of the porridge is always spot on, and the toppings are fresh and generous. It's the kind of meal that keeps you coming back for more.

The service is always friendly, and the atmosphere is welcoming, making it a great spot for both a quick bite or a leisurely meal. Bubur Ayam Bang Yossi truly stands the test of time, and I highly recommend it to anyone looking for a satisfying and flavorful bowl of bubur ayam.","Ordered :
1 Chicken Porridge + Chicken Intestine Satay

The taste of it so good, and the price is very affordable, also they sell additional crackers that fit perfectly with the porridge. Gofood and grab food are available here.

But their staff ruin my experience because they didn't process information well. I ordered 2 hot squeezed oranges, they accepted my order but my beverages didn't come. After a while, they serve it to people that ordered after me and tell me they ran out of the orange.

If you are about to order, make sure their staff hears you well.

Thanks","Delicious jakarta-style chicken porridge, comforting food to enjoy for breakfast or dinner. You can add spiced yellow broth, pepper, soy sauce, or chili sauce as you like. My favorite part is definitely an extra kerupuk crakers.",I always eat this one everytime I came to bali. It’s like a must for me. Two porridge with two sweet ice tea only 35k,"Budget food for breakfast lunch or even dinner
The “sate usus” is sooo delicious, one is never enough so I usually order three of it
The taste is worth the price
Sometimes this place can be very crowded, they don’t have a huge parking space so sometimes it can be full
If I’m not mistaken, they also have more branch located in jalan tukad pakerisan but I’m not sure about the rest"
ChIJYV7w18JA0i0RPR5vU-__3E0,Bali Yuai Mansion,-8.680266699999999,115.20968400000001,"8695+VVV Bali Yuai Mansion, Dauh Puri Klod, Kec. Denpasar Bar., Kota Denpasar, Bali 80114, Indonesia",https://maps.google.com/?cid=5610640639158853181,OPERATIONAL,,hotel,"hotel, lodging",4.1,138,,"Not a hotel, but a homestay. U rent a room and live there monthly. Staffs are nice, helpful and available 24/7, car parking available.","Water problem, and the room is very damp.
The pillow also stink. Used to be great need lots of improvement on the room

The enviroment was okay though",One of best place for living at Bali.  Its comfortamble and friendly service.,Nice place to stay so homey and very strategic distance,Comfort place.. 24 hours security..
ChIJdePZe8RA0i0RaerrsI4jCNo,Ayam Bakar Wo Ai Ni,-8.6779894,115.2063824,"Pertokoan Investama, Jl. Teuku Umar No.16C, Dauh Puri Kauh, Kec. Denpasar Bar., Kota Denpasar, Bali 80114, Indonesia",https://maps.google.com/?cid=15710846395842554473,OPERATIONAL,+62 813-3488-1096,restaurant,"restaurant, food",4.5,1894,PRICE_LEVEL_INEXPENSIVE,"Ayam Bakar is the least dish I want to have in anything - because most of the Ayam bakar I had was still so much juicy, and didn’t even had any burned skin or anything. But, Wo Ai Ni killed that expectations! This is by far the finest Ayam Bakar I had in town.","The best grilled chicken in Bali (so far!) 🙋🏾‍♀️
They’re keeping consistency of taste and quality. More further about prices is very cheap. For both of us could spend just over Rp 50.000 each time we eat there! 🤩✨

💰Please see my photo comments.
And also include my preferences.
🏆 9,0/10

⏰ Open from 11 am - 11 pm.",The best Ayam Bakar in Bali so far!,"Ayam Bakarnya JUARA!
I really love their Grilled Chicken. It's really flavourful, and tender. And they serve it with Hot Chili sauce. But you ccan order without chili sauce if you can't handle it. The combination of Grilled Chicken and Chili Sauce are Amazing! It's so tasty and Delicious. And it's cheap.","Parking:
Accessible both car and motorcycle
There’s a parker so they can help you find parking space
Usual parking fee is 1k for motorcycle and 2-5k for car

Food Delivery: Grabfood & Gofood
Payment: Cash
Operation Hours: They now open around 11:30 AM till 11:00 PM

Note: They don’t provide plastic bags for take outs so I suggest to bring your own bag

Location:
Within investama shopping complex. Close to hana bank and kasih ibu general hospital. This is their main store and have 2 branch located in teuku umar barat and achmad yani.

Menu:
1.	Fried / Grilled Chicken 14k per piece
2.	Fried / Grilled Duck
3.	Fried Tempe 6k per portion
4.	Fried Tofu 6k per portion
5.	Fried Fish
6.	Drinks; Bottled water, tea 4k

I ordered:
1.	Grilled Chicken 14k
2.	Fried Tempeh 6k
3.	Rice 4k
4.	Hot Tea 4k

Each sides include chili sauce (sambal) and veggies (kol, timun). The chili sauce was fresh and bit spicy. The layer cut of the tempeh and tofu is decent, not too thin and seasoned well.  For the grilled chicken, you can pick the thigh or breast cut (paha / dada). The texture of the chicken was soft, seasoned very well because you can still taste them in the white meat. For 50k or 3 USD for 2 pax portion is definitely worth it especially when you’re on a budget."
ChIJn8mOsj5B0i0R1gQnYTT20Xs,HANAKA COFFEE,-8.677296199999999,115.21037019999999,"Jl. Pulau Komodo No.24, Dauh Puri Klod, Kec. Denpasar Bar., Kota Denpasar, Bali 80114, Indonesia",https://maps.google.com/?cid=8922183041626342614,OPERATIONAL,+62 878-6096-5737,coffee_shop,"coffee_shop, cafe, store, food",4.5,391,,"Price is affordable and similar to other coffeeshops, but the portion is small. Vibes are nice and quiet, music wasn’t too loud, perfect for wfc hihi. It has got industrial design which is aesthetically pleasing for photos, but they could have added some cushion for the industrial sofa ehehe",A coffee spot option in the middle of hustle bustle Denpasar. This place has quite cozy ambience with minimal mood from the design. Their coffee was pretty decent along with the foods. But it would be better if they use stable table.,"The service was soo good, i really love how his effort to make me a swan latte art ❤️ almond croissant was good too. Strongly recommended.","I am not a big fan of coffee and their non-coffee selection is not bad. As a bonus, it’s price friendly too. The vibe is great especially their instagramable backyards. The one and only problem is the inattentive server. Too busy with phone and too cool to serve. Just saying. May be they would change. Who knows.",Small coffee shop at front but has spot for photo inside. Good taste of ice coffee here and i like it. But if you come at sunset it will be very hot because the cafe is face to west. Overall is ok price and taste. Parking space ok. They have shop for clothes.
ChIJS_Zyii5B0i0RWID81VADtp0,Grande Bistro Bali - Restoran & Cafe Terdekat di Denpasar,-8.678906999999999,115.2069906,"Jl. Pulau Kawe No.25, Dauh Puri Kauh, Kec. Denpasar Bar., Kota Denpasar, Bali 80113, Indonesia",https://maps.google.com/?cid=11364274355438387288,OPERATIONAL,+62 859-6033-3516,restaurant,"restaurant, coffee_shop, indonesian_restaurant, cafe, store, food",4.4,287,,"My new favorite place to work. I've actually been there for 3 times, for meeting and working.
Their foods and drinks are also recommended, and the price is reasonable. I've ordered so many foods and they never fail me.
I love the table arrangement, the room was spacious so it's like you have your own space to work.",The food and drinks are okay. Service is nice and location is well done. Nice atmosphere.,"Great place with good vibes. Attract many visitors, it also a good place to work.
They have live music every sat night at 8PM onwards.

Food just so so, small portion.","Grande is a nice place for chilling out. It offers various coffee and food as well. I had their jamu drink, tasted okay.

Place is very aesthetic, many good corners for photo-taking. Tables are also many, there are indoor with AC and outdoor for smoking area. Might serve a big group of 25 people.

Service and staff were nice, they gave recommendations for us to pick. Kitchen was clean. WiFi is available and fast. Parking area is very spacious.

Prices are reasonable, drinks started from IDR 18k - 25k.","I like the atmosphere, it's very comfortable to work here. you guys have to try the pizza, it's very delicious 🤩"
