id,name,latitude,longitude,address,url,status,phone,primary-type,types,rating,rating-count,price-level,review 1,review 2,review 3,review 4,review 5
ChIJRxYlS6WQ0S0RIg9dpIFUZj4,RedDoorz near Buleleng Harbour 2,-8.1045495,115.10528690000001,"Gg. Mangga, Penarukan, Kec. Buleleng, Kabupaten Buleleng, Bali 81119, Indonesia",https://maps.google.com/?cid=4496374193761095458,OPERATIONAL,+62 21 80629666,hotel,"hotel, lodging",4.3,44,,It was a good night's rest. Simple room. All we needed was a place to sleep and it was perfect 🙏🏽,"This is a promotion room,  so we dont have much expectations. But over all, it was affordable and we can sleep well at night. The bed and air conditioning is good, the minus was only in the morning we can hear neighbors speaking/singing, luckily we are morning person","A very honest review from me, this place is really comfy and worth the price!!! The room is clean and everything is perfect.",There was no sink in the restroom. The room wasn’t clean with many ants. There was so much traffic and noise. But it was affordable.,Personal room with affordable price
ChIJ8-WttPyR0S0RCQi17ul1Qqc,Penginapan Griya Anyar 2,-8.104525400000002,115.10533269999999,"Gg. Mangga, Banyuning, Kec. Buleleng, Kabupaten Buleleng, Bali 81119, Indonesia",https://maps.google.com/?cid=12052325200389539849,OPERATIONAL,,,lodging,4.1,14,,"Cukup bersih.
TV normal,
Water heater didn't working,
Some Wall need repair, need painting.
No welcome drink.",,,,
ChIJ7et8NU2R0S0RukT7KxSNlko,Dek ser Rujak kuah pindang bali,-8.105843,115.10295099999998,"Jl. Pulau Komodo No.82, Banyuning, Kec. Buleleng, Kabupaten Buleleng, Bali 81119, Indonesia",https://maps.google.com/?cid=5374638323090015418,OPERATIONAL,+62 878-5401-1548,restaurant,"restaurant, food",5,42,PRICE_LEVEL_INEXPENSIVE,Make sure to park your car before the eatery as the street is quite narrow. You better use your motorcycle or bike. The food itself is delicious and deserves the praise. The price itself is very cheap!,Good service,,,
ChIJW0DwotSR0S0RevggTb1HF_A,Penginapan WAYAN,-8.1069122,115.1056011,"V4V4+66Q, Jl. Pulau Obi, Penarukan, Kec. Buleleng, Kabupaten Buleleng, Bali 81119, Indonesia",https://maps.google.com/?cid=17300375371935447162,OPERATIONAL,,,lodging,4.3,8,,,,,,
ChIJbXQemPiR0S0R0HvIkNE4Epk,Penginapan Buana Mas,-8.104702,115.10704849999999,"V4W4+4R7, Jl. Pulau Obi, Penarukan, Kec. Buleleng, Kabupaten Buleleng, Bali 81119, Indonesia",https://maps.google.com/?cid=11029940910112144336,OPERATIONAL,+62 819-1577-9845,hotel,"hotel, lodging",3.8,6,,,,,,
ChIJWZp4Ci6R0S0RlfCxkZQATrw,Penginapan OBYS,-8.1076886,115.1050753,"V4R4+W2G, Jl. Pulau Obi, Penarukan, Kec. Buleleng, Kabupaten Buleleng, Bali 81119, Indonesia",https://maps.google.com/?cid=13568783365413400725,OPERATIONAL,,,lodging,4,6,,,,,,
ChIJobxCNiCR0S0R89AW7ofGoNo,ACK BANYUNING,-8.1061807,115.10234319999999,"V4V2+GX6, Jl. Pulau Komodo, Banyuning, Kec. Buleleng, Kabupaten Buleleng, Bali 81119, Indonesia",https://maps.google.com/?cid=15753809783659352307,OPERATIONAL,,fast_food_restaurant,"fast_food_restaurant, restaurant, food",5,1,,,,,,
ChIJQ5G8YMCR0S0RPQ0MTeOPUPg,Penginapan R4,-8.1024767,115.10582269999999,"V4X4+284, Jl. Pulau Obi, Banyuning, Kec. Buleleng, Kabupaten Buleleng, Bali 81119, Indonesia",https://maps.google.com/?cid=17892959525955964221,OPERATIONAL,,hostel,"hostel, lodging",3,2,,,,,,
ChIJFYZoIsWR0S0RiFXohgX5krE,Pizza 55,-8.1018806,115.10240739999999,"Gg. Mangga No.1a, Banyuning, Kec. Buleleng, Kabupaten Buleleng, Bali 81119, Indonesia",https://maps.google.com/?cid=12795563293446526344,OPERATIONAL,+62 819-3756-0555,pizza_restaurant,"pizza_restaurant, restaurant, food",4,4,,Doesn’t exist anymore? Tried to find it but no luck.,,,,
ChIJC4B-IheR0S0RrLljiLkZpvw,Kos Bu Metriani,-8.1080574,115.10290350000001,"V4R3+Q5C, Gg. Arjuna, Banyuning, Kec. Buleleng, Kabupaten Buleleng, Bali 81119, Indonesia",https://maps.google.com/?cid=18205266828339689900,OPERATIONAL,,,lodging,4,4,,,,,,
ChIJUb2VG9uR0S0RdyeCSd05Zvg,Kost Gang Jambu,-8.102946,115.10113090000002,"Gg. Jambu No.13, Banyuning, Kec. Buleleng, Kabupaten Buleleng, Bali 81114, Indonesia",https://maps.google.com/?cid=17899057391614437239,OPERATIONAL,,motel,"motel, lodging",,,,,,,,
ChIJOXID7CiR0S0RrPEVLcr16Tk,Warung sekarin,-8.100755399999999,115.1028009,"V4X3+M4V, Jl. Pulau Komodo, Banyuning, Kec. Buleleng, Kabupaten Buleleng, Bali 81119, Indonesia",https://maps.google.com/?cid=4173136778424086956,OPERATIONAL,,indonesian_restaurant,"indonesian_restaurant, restaurant, food",,,,,,,,
ChIJMfPu_a-Q0S0R2SBNnoRtGrc,KOST GANG LECI NOMOR 4,-8.1028053,115.10584550000002,"V4W4+V8H, Penarukan, Buleleng, Buleleng Regency, Bali 81119, Indonesia",https://maps.google.com/?cid=13193978474694254809,OPERATIONAL,+62 819-0708-5427,extended_stay_hotel,"extended_stay_hotel, hotel, lodging",4.8,12,,,,,,
ChIJl_2poZqR0S0RuNSPiW4ogdM,Kos Ari Anggara,-8.1078154,115.1027161,"V4R3+V34, Gg. Sri Kresna, Banyuning, Kec. Buleleng, Kabupaten Buleleng, Bali 81119, Indonesia",https://maps.google.com/?cid=15240507069217887416,OPERATIONAL,+62 821-4596-3664,hotel,"hotel, lodging",5,5,,,,,,
ChIJ5dIa6uuR0S0R7o3nSX-xt_M,Kost Artak,-8.107683999999999,115.1055582,"V4R4+X56, Jl. Pulau Obi, Banyuning, Kec. Buleleng, Kabupaten Buleleng, Bali 81119, Indonesia",https://maps.google.com/?cid=17561700432213413358,OPERATIONAL,,hostel,"hostel, lodging",5,3,,,,,,
ChIJ7Yn4CCOR0S0R92PYlXkiF_0,Warung tepi sawah,-8.1034659,115.1064499,"Gg. Durian, Penarukan, Kec. Buleleng, Kabupaten Buleleng, Bali 81119, Indonesia",https://maps.google.com/?cid=18237083121660486647,OPERATIONAL,+62 877-6235-1075,restaurant,"restaurant, food",4.7,12,,,,,,
ChIJ7-wWnBaR0S0Rk1qfVDc3V98,Dapoer Bali Artayu,-8.108492199999999,115.10342039999999,"Gg. Rama No.1, Banyuning, Kec. Buleleng, Kabupaten Buleleng, Bali 81115, Indonesia",https://maps.google.com/?cid=16093392504214215315,OPERATIONAL,+62 877-6298-6875,restaurant,"restaurant, health, food, store",4.9,11,,"Actually still house style restaurant,but foods and service they offer is excellent. Taste of food is great.and price also abrodable,,,",,,,
ChIJs2q02CeR0S0R-dFJ2hx98Do,Nasi Rawon Pangi Sapi,-8.100615699999999,115.10296959999998,"V4X3+Q55, Jl. Pulau Komodo, Banyuning, Kec. Buleleng, Kabupaten Buleleng, Bali 81119, Indonesia",https://maps.google.com/?cid=4247032011485204985,OPERATIONAL,+62 877-5034-9457,restaurant,"restaurant, food",,,,,,,,
ChIJI6owaHOR0S0RYX3KfWHLd4c,Rumah kost Ratnamala,-8.103865599999999,115.10243210000002,"Gg. Durian No.1 no 6, Banyuning, Kec. Buleleng, Kabupaten Buleleng, Bali 81119, Indonesia",https://maps.google.com/?cid=9761494336931528033,OPERATIONAL,,private_guest_room,"private_guest_room, lodging",,,,,,,,
ChIJ4y1SKsSR0S0RhkPWOkAag0I,Kebun Durian Musangking,-8.106120599999999,115.10687850000001,"V4V4+HQ2, Banyuning, Buleleng, Buleleng Regency, Bali 81119, Indonesia",https://maps.google.com/?cid=4792703291619689350,OPERATIONAL,,park,park,5,1,,,,,,
