id,name,latitude,longitude,address,url,status,phone,primary-type,types,rating,rating-count,price-level,review 1,review 2,review 3,review 4,review 5
ChIJt6gpetRE0i0RkXxJfSDCcI4,Renaissance Bali Uluwatu Resort & Spa,-8.812979,115.14485499999999,"Jl. Pantai Balangan I No.1, Ungasan, Kec. Kuta Sel., Kabupaten Badung, Bali 80361, Indonesia",https://maps.google.com/?cid=10263916995574070417,OPERATIONAL,+62 361 2003588,hotel,"hotel, wedding_venue, event_venue, lodging",4.7,3023,,"If I could give this six stars I most certainly will. The rooms are divine, as are their pools. The lobby lounge will take your breath away with its view. The staff are all so super nice and goes the extra mile. There are activities daily, from yoga and biking to pottery and batik. You’ll never be bored spending the whole day at the hotel!

The best best best part is the breakfast selection!!! Truly as good as a dinner buffet complete with options for all diets and tastes.

The hotel made the highlight of my trip and successfully made uluwatu my favourite part of Bali.","If I could rate this higher than five stars, I definitely would. The rooms and pools are outstanding. The view from the lobby lounge is breathtaking. The staff are incredibly friendly and always go above and beyond. There's a variety of daily activities, including yoga, biking, pottery, and batik, ensuring you'll always have something to do without ever leaving the hotel!

The absolute highlight is the breakfast selection. It's as extensive and varied as a dinner buffet, catering to all dietary needs and preferences.

This hotel was the highlight of my trip and made Uluwatu my favorite part of Bali.","Came here for our honeymoon and it was amazing. The staff were delightful and very accomodating. Always willing to help. The amenities were what brought us here in the first place. The best pool we have ever used, simply gorgeous. The breakfast buffet was a joy with options of Indonesian, western, Indian and an egg station. The resort itself is a bit far from everything but we quite enjoyed this as it provided us with peace and quiet. There were also many activities always being held such as sushi lunches, shuttle buses to their own beach club and fitness classes. Would definitely recommend staying here!","We had a perfect stay at Rennaissance Uluwatu. The hotel is splendid, with fantastic views of the sea, village and jungle. The infinity pool is absolutely amazing, the spa is of fantastic quality (the best massage we had in Bali, and I'd even say in my entire life). The staff everywhere was super friendly and they seemed genuine, as opposed to some other places in Bali where the smiles were a bit fake. The restaurant (we only had time to try 1 out of the 2) was super nice, the food was delicious and the menu - very diverse (we loved the many interesting cocktails) - although pricier than the rest of Bali, I'd dare say it has Italy prices. Then as for the room: our suite was perfect, spotlessly clean, with a tasteful style and decorations. They also have free shuttles to their beach club in the South of Bali, but we didn't have time to try that one. This is genuinely the best hotel experience of our lives.","Came here for our anniversary celebration - with the reviews expectation was a bit high. But my oh my, we were quite happy. The team at the resort was always friendly and eager to help. The view of the resort was wonderful, being perched on top of the hill, overlooking the sea.

The room that we booked, deluxe garden view was in no way small, but because the bathroom was huge, the room was a bit on the small side, however it was comfortable and we had everything we needed. And when they say garden view, the view is really of the jungle, not some parking lot.

The highlight was actually the food, breakfast in the morning was really great, with high quality ingredients, Double Ikat is also a must visit, we ate in that restaurant every night for 3 nights, the Indonesian food served there was fantastic.

They had the clay making class as well. It was chargeable but definitely worth it.

All in all, we had fun in that resort, and it's worth it to stay there."
ChIJOf7i6ytb0i0Rt-R9fX3TZGc,BGS Bali Surf Shop & Coffee Bar - Dreamland,-8.8212011,115.14612380000001,"Jl. Raya Uluwatu No.77, Ungasan, Kec. Kuta Sel., Kabupaten Badung, Bali 80361, Indonesia",https://maps.google.com/?cid=7450312219507418295,OPERATIONAL,+62 878-6181-3103,sporting_goods_store,"cafe, sporting_goods_store, store, food",4.9,551,,"I’ve been coming to BGS daily since 2017, this place has continued to provide quality coffee/smoothie/juice and pastry options. The staff is an absolute pleasure, their kindness and attention to detail make each experience special. I would name each staff member but there are too many to mention.  Don’t just come for coffee, they have an impressive selection of apparel, surfboards and accessories. I bought my first board here with the help of the owner, Komang, he took the time to explain which board would be best for a beginner and why. Real legend when it comes to surf knowledge and customer service. Don’t miss out on Punk Rock Bingo, one of the best parties in Bali!! Thank you BGS and staff, you guys always make my day a bit brighter.","BGS has the best coffee in Bali! The vibe in this shop is amazing and the staff is the best.

Stanley","Best coffee in town and amazing selection of surfboards! We always buy our boards here, Komang and his team are super competent and know what they’re talking about! So happy with my new Synergy!","I’ve always loved their Almond Iced Latte, and usually visited their Canggu outlet. Just because my boyfriend wants to check the waves at the Dreamland beach we visited to have some coffee and check the goods stuff at BGS Dreamland.
It was cool coffee and Surf shop, although I still prefer their Canggu and Uluwatu outlets. Also because the service there was so much better and friendly to all customers than here, I feel like the staff could be friendlier. We will be back, hopefully, to see some improvements. Parking for a few bikes, for cars maybe you can park at the mini market.
The menu has quite a few options. The shop is decorated with surf accessories and apparel.
Good luck BGS.","Love this BGS with all my heart!
Come here every morning to grab my fav cappuccino with its original almond milk, witch is amazing.
The staff is always super friendly and welcoming, love to talk to each of them.
The atmosphere is super surfish, feels good. Highly recommend!"
ChIJy75s7HI_0i0R0zmU_Cx9a8Y,Villa Ricca Eco Lodge,-8.818864,115.1446493,"Jl. Kahuripan No.21, Bukit Ungasan, Kec. Kuta Sel., Kabupaten Badung, Bali 80361, Indonesia",https://maps.google.com/?cid=14297659074187377107,OPERATIONAL,+62 812-3865-3326,private_guest_room,"private_guest_room, lodging",3.9,64,,"Overall, the accommodation is good. I liked the garden, the location and the dogs. The rooms are basic, but if you travel light like a backpacker or surfer, they serve their purpose. There's a shared kitchen where there's American coffee available all day, and you can prepare whatever you want and store things in the fridge. The staff is lovely. The breakfasts are very tasty. Above all, what I missed was a wardrobe, even a simple one, and air conditioning. But I know the owners are working hard to improve it. Would I repeat? YES","This establishment is far from satisfactory. The cleanliness and basic amenities were sorely lacking.

The bathrooms were filthy, a glaring oversight that made the entire stay uncomfortable. Adding insult to injury, roosters crowing incessantly throughout the night disrupted any hope of rest, starting as early as 2 AM.

To make matters worse, the sheets provided seemed to have been washed in a dirty laundry, some even falling onto the ground outside and accumulating dirt. The pillows emitted unpleasant odours, indicating a lack of proper hygiene and care.

As if these issues weren't enough, dogs freely roamed into the restaurant, creating an unsanitary environment for guests trying to dine. Additionally, the absence of air conditioning in the sweltering heat only added to the discomfort.

The outdoor kitchen was no exception to the general state of neglect, appearing dirty and uncared for.

Overall, my experience was deeply disappointing. I urge the management to address these concerns promptly if they wish to salvage their reputation and provide a minimally acceptable level of service to their guests.","Amazing place to stay in Uluwatu! Everything worked out wonderful and all the people are so nice there! Thank you!

Could extend our stay there easily and we could rent a nice scooter as well!

Breakfast was a life saver every morning","Overpriced. Room/bathroom/bed standard is very low. And its my second month in Bali so I know standards and pricing here.
Smell of mold is intense.
Breakfast is good but small.
Kitchen and garden are the only things that really were on good level.
We found high standard hotel with clean white bed linen and A/C for just 2.50$/day more.
Not reccomending.","I only stayed one night, arrived very late, and left early, but from what I could see, it is a very nice, relaxed place to stay for a few days in Uluwatu.
It is a very cute place. Each villa has its own terrace,  screened by greenery. They make your breakfast to order so it's very fresh. You can make yourself tea or coffee in the open-air kitchen anytime you want, and also get water.
It was very hard to find, but it was late and very dark, not a lot of street lights in the neighbourhood.  But I think it would be a good base to explore Uluwatu.
The room was very simple, with basic facilities, and the mattress was very comfortable, and a good-sized double bed. Everything was very clean. Wifi was strong. The only niggle was the ceiling fan would only come on if you switched the light on, which you don't want when you are going to sleep. May be better to have separate switches for the fan and the light. As I arrived late, the reception desk was closed, but they left my name on a board outside the office, with my room number, so I knew which room was mine. The room is left open for you so you can go straight to your room when you arrive. The room key is in the room.
Overall, it was a great stay."
ChIJ9aQF8itb0i0RG3YGj0qQ6Sw,El Merkat Bali,-8.8211462,115.1464498,"Jl. Raya Uluwatu No.Km, Ungasan, Kec. Kuta Sel., Kabupaten Badung, Bali 80361, Indonesia",https://maps.google.com/?cid=3236276457143957019,OPERATIONAL,+62 811-3976-300,restaurant,"mediterranean_restaurant, grocery_store, liquor_store, store, restaurant, food",4.5,1084,PRICE_LEVEL_MODERATE,"My family have breakfast here and choose the breakfast promo: one main dish with coffee/tea. Each combo costs around 100k. The food is great and instagramming. Without the promotion, it would be really expensive to dine here.
The restaurant is not crowded, so staff is attentive and food is served quickly.","I loved this restaurant 😍 the food was wonderful!!! And the incredible attention, very fast and friendly. The place is charming, it also has a store with organic products, wines and more! If you are in Uluwatu you have to come here🩷",Great food here. Aesthetically pleasing. I love my cappuccino. The black coffee was a little weak for my husband but he said it's still good. Staff are nice and attentive top. We will surely recommend.,"Few time we come to this restaurant , service good. but for me the foods before covid more better than now","Very good food, a very friendly and also profesional staff. Good price and very nice place. I recomand 100%."
ChIJtVzD2NJE0i0RaMDGN-vmt-4,Nagara Boutique Hotel and Coworking,-8.8164961,115.15055149999999,"Jl. Pantai Balangan No.16, Ungasan, Kec. Kuta Sel., Kabupaten Badung, Bali 80361, Indonesia",https://maps.google.com/?cid=17201471199692374120,OPERATIONAL,+62 889-9988-9898,hotel,"hotel, lodging, restaurant, food",4.3,60,,"This was our first stop when we landed in Bali. Traveling from Canada, we arrived at 7pm tired and hungry. Fortunately the restaurant was still open! The staff were friendly and inviting :) our room was clean and the bed was firm, yet comfortable. We had a very delicious dinner and a good rest! The rooms are sound proofed quite well, we could barely hear the roosters. After a hot shower we went for breakfast, which was included. Very tasty and filling! Later we went for a swim. The pool was clean and refreshing. We only stayed 1 night, I think if you stayed longer, you'd need a scooter or something because it's located rather remotely.","We stayed at this hotel a week ago booked 2 rooms, arrived at approx 12.30am gates closed, no security, no information on rooms , my driver was trying all the numbers no answer from anyone. 2am we decided to pick a room asked for twin beds nothing was ready, so we had to just pick a room. Staff didn't really care had to tell them about the beds. No communication, staff not really experienced, asked for the manager never came for 4 days, sent a message on whats app but didnt tell us anything, advertised pool bar, it isn't open , couple rang day before and they told them it was, only 2 sun beds, cushions for the pool not there, broken. A/c was leaking, no water on the first day. No fridge or coffee making facilities. Dog came and urinated on the mat and cushions whilst I was sitting there. Told the staff member she just said oh!! No numbers for the rooms. Building going on next door, lights not working up the driveway at night. Property is too far away from everything. You need transport to go anywhere. Still no response back from anyone. Very poor service and very disappointing.","I am writing this review while staying in this hotel as I can’t fall asleep knowing that there’s cockroaches running around me. Besides this, there are other problems with the hotel room that I’m staying in. I’m staying in Room 7. First problem, room stays warm after turning on aircon at high speed and lowest degree possible. Second problem, sewage water leaking from toilet bowl and the water flow out of the bathroom into the bedroom and ponded under the open wardrobe next to the bathroom door. In addition, the co-working space is also warm despite the aircon at max speed and lower degree with fans on as well. Anyways back to the room. Those earlier mentioned problems was highlighted to the housekeeping. Aircon problem was highlighted an hour after check in, was told that the maintenance guy will drop by the next day but seems like nothing was done as room continue to stay warm with aircon on. Sewage water leakage was highlighted to housekeeping on the next day morning before we left the hotel to enjoy the sights of Uluwatu as we only spotted the problem in the morning while we prepare to head out. Housekeeping mentioned that will send the maintenance guy to check it out but seems like it wasn’t done hence why the sewage water flow out to the bedroom. Have contacted the hotel manager, Maria via WhatsApp about the problems. Pending her response. This review will remain until we get a satisfactory response from the manager. All we wanted is to enjoy our time in Bali but unfortunately run into such an incident at the hotel which affected our mood. However, that being said, we are thankful to the hotel security and kitchen staff for assisting us with the leakage so that we can continue to stay in the room for one more night which is tonight before we check out tomorrow. Can’t wait to check out tomorrow! Thanks for reading. Hope we won’t end our trip on a bad note! 🙏🏼  May god bless those who are checking into this room after us as we suspect those issues mentioned is not new for this room.","Rating Nagara 3 stars coz while I don't particularly dislike the place, it definitely did not list as a favourite.
💰However... If you're considering a place to suit a fair budget, then this can be the place!
🚙 Location is a short drive to the beaches, inclusive of breakfast and for us we appreciate that it's slightly secluded from the main road where there's more foot traffic.
🌴📸 The place really looks nice in photos.
🚪 Room interior is rustic modern but cleanliness can be improved.
🏊 No pool maintenance which was sad.","Very stylish and nice place. I think it’s better to stay short term. When you stay long term you see that you have stylish rooms but a not functional one at all.
- No window in the bathroom. That was horrible in any kind of way.
- Rooms are all side by side you literally hear every word from the neighbours and we had all the time drinking ones and annoyingly disrespectful ones so the walls were not fun at all.
- Doors have gaps completely open if you close them.
- No mosquito net and to many mosquitoes and bugs around. Why does no one care about that?
- The hotel is nearly a year open but just like the bed is important and already there, so should be a fridge. We have 35 degrees and it was an absolute no go to not have a fridge. - Cleaning was average and I did not like the way some workers got treated in front of customers."
ChIJJ9gtACtb0i0RNG6FE3tbXFE,Mahagiri Villas & Spa Dreamland,-8.8192697,115.14491650000001,"Jalan Kahuripan, Br Bakungsari, Ungasan, Badung Regency, Bali 80361, Indonesia",https://maps.google.com/?cid=5862661399096159796,OPERATIONAL,+62 361 8481223,hotel,"hotel, lodging",4.4,177,,"This place is not okay. We stayed here one night to go to Savaya and yes it's in an ok location but no I will not be coming back. The rooms and villas are big however the cleanliness is not okay. When we arrived we had to have an air freshener put in the main communal area because it smelt rotten. Everything was damp and sticky. Our sheets needed to be changed as they had brown and black marks over the pillow and bedding. The day beds, pool and floors were all extremely dirty also, I left here feeling like I needed a big shower. And as for the noises during the night... I was woken several times from roosters, frogs and motorbikes from the road just outside. Inside the rooms we had geckos, mosquitoes and little flies everywhere. For $290 a night, do not waste your money. I’m saying this, the workers are very helpful and nice but this place is run down… Someone else has mentioned this in a review but I have to agree, I believe bad reviews are being removed because this place is not 4.4 stars. Don’t waste your time","Stayed 4 nights in villa 107, 1 bedroom with private pool. Absolutely loved the place. Our breakfast was included and we made sure to try a range of options. The Dragon Fruit smoothie bowl was a favourite.
Staff were super friendly and always ready to help when needed. We did note the area wasn't as commercialised, but a quick gojek allowed us to easily visit all of Uluwatu.
We didn't have any issues with noise, although you could hear animals and traffic around.
Overall, a fantastic experience. Will definitely recommend.","I recently had an incredible stay at Mahagiri Villas Dreamland. The luxurious accommodations, breathtaking views, and impeccable service truly exceeded my expectations. The staff went above and beyond to make my birthday unforgettable, surprising me with a delicious cake that added a personal touch to my already amazing experience. I highly recommend Mahagiri Villas Dreamland for anyone seeking a five-star getaway with exceptional hospitality.","I love the pool, the restaurant is located right next to it so one can easily order food and drinks.","We absolutely LOVED our stay at Mahagiri. The villa was stunning, the staff was super friendly, helpful and accomodating and the food was delicious! 😊 We’ll be back for sure ❤️"
ChIJ49phlOFG0i0RBBoCXZluULk,Like At Home ~ Authentic Italian Cuisine,-8.8209213,115.1474476,"Jl. Raya Uluwatu No.13C, Ungasan, Kec. Kuta Sel., Kabupaten Badung, Bali 80361, Indonesia",https://maps.google.com/?cid=13353294500122991108,OPERATIONAL,+62 859-5419-6727,italian_restaurant,"italian_restaurant, restaurant, food",4.6,331,,"This is a gem of a restaurant, I’ve eaten here 3 nights in a row. Not just authentic but really tastes like home cooking, the clams were delicious and my carbonara absolutely delicious. The  waitress was attentive and friendly.",Ambience and location are good. Don’t boost your expectations in terms of taste by Italian kitchen. Taste vs price is not there much.,"Mamma Giusy is keeping the Italian flavours alive in Bali! Hands down the most authentic Italian food you can find in Bali, on the menu you can also find some typical delicacies from Sardegna such as Fregola and Culurgiones. Pizzas are delicious too as well as fish and meat!",This small Italian restaurant is probably one of the very few best Italian kitchens in Bali. Get yourself a plate of delicious fregola (highly recommended!) and wash it down with their strong homemade limoncello and amazing espresso. Seriously. Do it.,"Stumbled across this place late one night (9.30pm) wanting some dinner and had a pizza. Ended up going back the next night for more, had pasta,pizza and dessert- all super tasty!

Great place if you’re feeling like authentic Italian! The restaurant is on a busy road so there is a bit of noice from traffic if that bothers you but it was fine for us."
ChIJ6ULSwStb0i0RKuJiOmIvtKo,Warung Makan MADE,-8.820972,115.145891,"54HW+J96, Jl. Raya Uluwatu, Ungasan, Kec. Kuta Sel., Kabupaten Badung, Bali 80361, Indonesia",https://maps.google.com/?cid=12300508581188526634,OPERATIONAL,+62 813-3839-8884,seafood_restaurant,"seafood_restaurant, indonesian_restaurant, restaurant, food",4.5,723,PRICE_LEVEL_INEXPENSIVE,Most amazing local food! Service minded and good price and fresh vegetables and fruit. Don’t miss this amazing place !,"By far, the best warung in Uluwatu!
Every time we visit Ulu, we come to warung made and it never ever failed! Plates are abundant and delicious, with great prices and the best service.
Even when with Bali Belli, they made a special plate for us with plain chicken and white rice- My fav dish is the Nasi Ayam Kakang Mente and the spring rolls👌🏽 On the picture, the classic mie goreng.
Have to come to this incredible warung !","Since the first day I have tried this place I felt in love with the way how they prepare fish and seafood but also typical Indonesian dishes!! The staff and the owner are so kind and friendly, and if you need help on choosing the food they will give you the best solution!! The prices are not expensive, I can say their prices are mid/low only few things are a bit expensive but only comparing with other prices that I have seen around Indonesia! I like to eat fish and seafood (big portions) so most of the time I spend around 125k and 200k depending on the restaurants but in local Warung I don’t go over 100k!! So giving you a short recap I can tell you I would say that this place is really great and I recommend it!! Must be tried!!",One of the best Warung that we’ve visited. Food was always delicious and waiter was always in good mood. I have nothing to blame everything was superb. I would recommend to everyone :),This place is awesome. If you're after great fresh local (and some western food) then this is the place. You can see just how clean everything is as the kitchen is right there. Very impressed
ChIJI_2SRrxb0i0RkNZ1YCzh9Kg,Hillstone Luxury Village,-8.818178399999999,115.14389329999997,"Jl. N.Kahuripan, Ungasan, Kec. Kuta Sel., Kabupaten Badung, Bali 80361, Indonesia",https://maps.google.com/?cid=12174603273402439312,OPERATIONAL,+62 813-3744-9355,hotel,"hotel, lodging",4.5,40,,"Outstanding experience! From check-in to check-out, every moment at Hillstone Luxury Village was delightful. The staff were incredibly friendly and attentive, the rooms were comfortable and well-equipped, and the location couldn't have been better. Would definitely return and recommend to others!","What an amazing stay! The rooms were very cozy, equipped with everything you need, the staff was SO nice! They helped us with everything and we are beyond thankful! Breakfast very good, location also - central and quiet. Oh and the view! You can see sunset and the ocean! Thank you, we will definetly be returning.","Hillstone village is a wonderful place. We stayed at villa 9 and loved it. Comfy beds, great ocean view, good service, delicious breakfast 🥞. We do recommend.","The villa was top notch - very comfortable beds, great AC in each room, and solid highspeed wifi connection throughout. Breakfast was delicious - would definitely recommend the pancakes! The staff were great and the property was very quiet and relaxing. One thing to note is that there are two properties listed in Google maps and my taxi accidently took me to the wrong one (which is closed and in some state of disrepair which caused a bit of stress) so I highly suggest verifying the location is correct by also referring to Cafe Taki Taki which is just up the road if you are getting dropped off.","Amazing villa in good location.

But it is time to think about maintenance: shower doesn't work in a normal way, leaking toilet, lights are broken partly.

Even after an anounce of the issues to maintenance services, nothing has been changed for the period of our staying."
