id,name,latitude,longitude,address,url,status,phone,primary-type,types,rating,rating-count,price-level,review 1,review 2,review 3,review 4,review 5
ChIJV-NBefFE0i0RfNUzYvmnR-c,Taman Wantilan,-8.7830879,115.159135,"Jl. Bukit Permai, Jimbaran, Kec. Kuta Sel., Kabupaten Badung, Bali 80361, Indonesia",https://maps.google.com/?cid=16665473635644069244,OPERATIONAL,+62 361 701010,restaurant,"restaurant, breakfast_restaurant, american_restaurant, food",4.7,46,,"A Culinary Journey to Remember: Taman Wantilan at Four Seasons Resort Bali

As we stepped into the exquisite ambiance of Taman Wantilan at the Four Seasons Resort Bali in Jimbaran Bay, we were instantly captivated by the blend of elegance and relaxation that the restaurant exuded. Celebrating the craftsmanship of the culinary team, Taman Wantilan proved to be an extraordinary dining experience that left an indelible mark on our hearts and taste buds.

From the moment we were seated, the open show kitchens welcomed us with their vibrant energy, where a brigade of specialty chefs masterfully prepared an impressive spread of Asian and Western cuisines. The interactive dining concept heightened our anticipation as we eagerly awaited the culinary delights that were about to be presented.

One of the highlights of our dining adventure was the Seafood Teppanyaki station. The sizzle and aroma of the fresh seafood being expertly grilled before our eyes added an element of theater to the meal. The succulent flavors of the perfectly cooked seafood left us craving for more, making it a true delight for seafood enthusiasts.

The Laksa and Noodle station, reminiscent of street food stalls, transported us to the bustling streets of Asia. The made-to-order dishes allowed us to customize our meals to our preferences. The aromatic broth of the Laksa was a revelation, rich with layers of flavor that perfectly balanced spice and comfort.

The culinary journey continued with the Lamb Rack, a masterpiece of culinary expertise. Cooked to perfection, the tender meat practically melted in our mouths, accompanied by exquisite sauces that elevated each bite to a symphony of flavors.

The Salad Shaker bar was a refreshing twist, empowering us to create personalized salads by selecting from an array of fresh ingredients. This unique approach to salad preparation made the experience not only delectable but also fun and engaging.

No meal is complete without dessert, and Taman Wantilan exceeded expectations with its Gelato and Crepe station. The variety of gelato flavors and the option to customize our crepes with an assortment of toppings left us feeling like kids in a candy store.

For those with a penchant for Japanese delicacies, the sashimi station showcased the finest cuts of fish, expertly sliced and presented. Each piece melted in our mouths, showcasing the highest quality and freshness.

Our dining experience at Taman Wantilan was made even more special by the presence of our lovely family. The restaurant's warm and welcoming atmosphere encouraged us to indulge in good conversations, creating lasting memories that we will cherish.

In conclusion, Taman Wantilan at Four Seasons Resort Bali is more than just a restaurant; it's an enchanting journey for the senses. The expertise of the culinary team, the interactive dining concept, and the wide array of delectable dishes come together to create an unforgettable experience. From the Seafood Teppanyaki to the Gelato and Crepe station, every moment was a delight. If you're seeking a culinary adventure that combines elegance, interactivity, and exceptional flavors, Taman Wantilan is an absolute must-visit.","I joined for breakfast with my girlfriend! Place is nice, food is delicious. However, I didn’t really feel satisfied the service. We didn’t see the hostess at the entrance, after waiting sometime and decided to enter then she approached us! I ordered fresh mint tea with ginger and lemon, after 5 mins they said fresh mint isn’t available. I agreed to change it with peppermint tea with ginger and lemon. I got peppermint tea with nothing after 15 mins. I asked them ginger and lemon and waited 10 more minutes. Finally, I got my tea without teaspoons! If you wanna drink tea, just order 30 mins early so you’ll get it on time!","Had breakfast here for 2 days. Best food with ocean view! The staff here are also helpful and friendly!

Will come back here again in the future if nearby!","Excellent food , amazing staff , great view and amenities , serene view of the sea , the landscape is well down and excellent.","Nice place to have dinner, whole lot of food variety during buffet."
ChIJjzFYMxpF0i0Raf6nWM0vIV8,OYO 3200 Anza Hotel,-8.7896997,115.15648610000001,"Pat Mase, Jl. Karang Mas 361, Jimbaran, Kec. Kuta Sel., Kabupaten Badung, Bali 80361, Indonesia",https://maps.google.com/?cid=6854812666836811369,OPERATIONAL,+62 21 29707601,hotel,"hotel, lodging",3.9,12,,"Worst management worst place worst owners i  don't recommend this place to anyone, the only positive thing was here it was Putu and Ketut, we don't have electricity, even water sometimes, wall leakage from the rain, on top of that we had electrical shock and we lost all our electric chargers so we had to buy brand new chargers and no one gave a damn about this !!! They remember only to ask for money but never cared about our comfort and experience","- electricity keep shutting down.
- hot water not functioning.
- sometime, toilet doesn't flush properly.",Clean and homey,,
ChIJ5X5k7EpF0i0ROIQU2OHHbe8,TELU Bar at Four Seasons Resort Bali at Jimbaran Bay,-8.7839954,115.1593422,"Jl. Bukit Permai, Jimbaran, Kec. Kuta Sel., Kabupaten Badung, Bali 80361, Indonesia",https://maps.google.com/?cid=17252665520333030456,OPERATIONAL,+62 361 708333,bar,"bar, night_club, restaurant, food",4.9,15,,"We visited this unique bar twice while enjoying our stay at the Four Seasons. It was an experience unlike any other! The manager's focus on sustainability truly make this space a story to be discovered. Everything in sight is carefully crafted to emphasize recycling and reusing. From the art, to the glassware, to the drink ingredients, everything has been considered. The arak tasting room was a fun and informative experience, as was the story behind each element of barware. Anyone who appreciates eco friendliness will appreciate the effort that has gone into the design of this one of a kind place. Each drink is an experience of its own, offering a different glass and unique ingredients. The snacks are so good and satisfied our hankering for something small and flavorful. The garden within Telu offers a family size table that could make for an intimate and comfortable group experience. We cannot wait to visit again!",The best place in Bali. The Complexity and the balance of the coctails is like no other place in Bali. If you come to Bali is a between top 5 place to visit. Beside the dirnk the staff introducing you the concept and the story behind each coctail. Supper nice chill environment I will come back everynight during my stay.,first of the drinks are just unearthy really amazing job. The staff Rama and Bayu were amazing deep knowledge of the concept and the coctails they serve. I only can recommend it of you are in Bali you must try.,Well i am supprised that this place is not packed  when i was visiting because i just had the best drinks in bali. The manager Jan supper cool and friendly guy who might just be the best mixologist i meat in my life. The attention and the complexity of his coctails is admirable. Thank you for the great experience i will be back and i will spread the word. 🙏🙏,"Hidden gem of Four Seasons at Jimbaran. Amazing drinks, service and vibe"
ChIJ_xhmK6BF0i0Rmqp-09SzItU,Karv Jimbaran Project by WKC,-8.7822792,115.15503090000001,"6594+32J, Jimbaran, South Kuta, Badung Regency, Bali 80361, Indonesia",https://maps.google.com/?cid=15358035405949545114,OPERATIONAL,,hotel,"hotel, lodging",5,3,,,,,,
