id,name,latitude,longitude,address,url,status,phone,primary-type,types,rating,rating-count,price-level,review 1,review 2,review 3,review 4,review 5
ChIJi4FhTj-H0S0RwZgBnD4LXO8,Vihara Dharma Giri,-8.3195409,115.01762749999999,"M2J9+53J, Jl. Raya Pupuan, Pupuan, Kec. Pupuan, Kabupaten Tabanan, Bali 82163, Indonesia",https://maps.google.com/?cid=17247673036455385281,OPERATIONAL,+62 362 71029,place_of_worship,"tourist_attraction, place_of_worship",4.7,943,,"The place is easy to find, clean and neatly arranged. A place of worship for Buddhists, not as large as I imagined but it is very beautiful",The entrance is free but you can donate. They lend you a sarong. It’s the biggest Buddha in Bali. Little far but great to do a bike ride through Bali’s west side.,Peaceful and beautiful place to visit. No crowd at all. Lots of time to enjoy blissful time in presence of Lord Buddha.,"A wonderful out of the way Temple definitely worth a stop.  The caretakers are incredibly kind and gentle.  As expected, knees showing is forbidden however they will gladly lend you a sarong.   A donation is encouraged.   Washrooms, vendors, etc nearby to meet needs.   Parking free.   The giant white laying Buddha reminds me of the giant golden and giant green Buddha’s in Vietnam.","The place is very quiet, no need to pay a ticket, just donate, sarongs are provided, footwear must be removed when entering the Buddhist area♥️"
ChIJc06nWj-H0S0RNbuVqBYTsaY,Sleeping Buddha statue Pupuan Tabanan,-8.3196905,115.01768669999998,"Jl. Pekutatan - Pupuan No.1, Pupuan, Kec. Pupuan, Kabupaten Tabanan, Bali 82163, Indonesia",https://maps.google.com/?cid=12011402669212416821,OPERATIONAL,,,tourist_attraction,4.6,776,,"A nice spot to visit if you're already in the area.   Not many Buddhist places in Bali.  Not much to see....just the laying Buddha and a few other smaller shrines and gardens.  Donations are expected to enter.  I gave 20,000 which I think is the norm.",The monastery is very spectacular and amazing. I know it's quite far away. But totally very recommended if you visit to the north. No ticket entrance but you can give donation on the contrary. When I arrive at there I just feel peaceful and calm. Wear proper clothes when you visit there. There is two dogs also they are nice. Brown one Rocky and Juju.,"Check out this vihara, it's amazing! Super chill vibes 🌟🍃 and a giant sleeping Buddha statue. A perfect place to unwind and find inner peace! 🙏🛐",Super quite place. The best view for meditate and calm down your busy mind and crowd soul. Must visited place when you are in north Bali,Well worth a visit beautiful tranquil place
ChIJj9ncRj-H0S0RumoA604u0VY,Warung Makan Bali Dapurku,-8.319084,115.01790140000001,"No, M2J9+956, Jl. Raya Pupuan, Pupuan, Kec. Pupuan, Kabupaten Tabanan, Bali 82163, Indonesia",https://maps.google.com/?cid=6255832273879329466,OPERATIONAL,+62 878-5305-4293,indonesian_restaurant,"indonesian_restaurant, restaurant, food",5,14,,Simple 'Warung' but delicious! The soup was amazing.,Amazing pork waring. Nasi cmapur style,Im not even joking. This place has one of the tastiest nasi campur babi on Bali,,
ChIJwa2XXx2H0S0ReXp_zol2Bz0,Warung Bakso,-8.319098499999999,115.0177148,"M2J9+938, Pupuan, Tabanan Regency, Bali 82163, Indonesia",https://maps.google.com/?cid=4397613895397636729,OPERATIONAL,,indonesian_restaurant,"indonesian_restaurant, restaurant, food",5,1,,,,,,
ChIJLYeoSD-H0S0RTAa9rsnA7lg,Warung Makan Depot Suramadu,-8.319087099999999,115.01783520000001,"M2J9+948, Depan Vihara Dharma Giri Jl. Pekutatan - Pupuan, Pupuan, Kec. Pupuan, Kabupaten Tabanan, Bali 82163, Indonesia",https://maps.google.com/?cid=6408271292247377484,OPERATIONAL,+62 819-3604-4545,restaurant,"restaurant, food",,,,,,,,
ChIJ69n6YACH0S0RjZHXLANPREg,Rainbow Glamping,-8.319179799999999,115.0213839,"M2JC+8J2, Pupuan, Tabanan Regency, Bali 82163, Indonesia",https://maps.google.com/?cid=5207373944202957197,OPERATIONAL,,camping_cabin,"camping_cabin, lodging",5,5,,Very unique place. Very beautiful. Definitely you should have a fire outside. It does get quite hot inside the room during the actual daytime so I would not recommend planning to stay inside.,,,,
ChIJIQ0ARwCH0S0RFV4XmTRVghU,Syobak khelok chinese food,-8.319213,115.01707069999999,"Jl. Raya Pupuan No.23, Pupuan, Kec. Pupuan, Kabupaten Tabanan, Bali 82163, Indonesia",https://maps.google.com/?cid=1549894906163977749,OPERATIONAL,,chinese_restaurant,"chinese_restaurant, restaurant, food",5,1,,,,,,
