id,name,latitude,longitude,address,url,status,phone,primary-type,types,rating,rating-count,price-level,review 1,review 2,review 3,review 4,review 5
ChIJTa1TEiAX0i0RKQxZQcYUxtQ,"Nasi Lawar Pork Belly ""Mek Sunadi""",-8.5169782,115.3764767,"Getakan, Banjarangkan, Klungkung Regency, Bali 80752, Indonesia",https://maps.google.com/?cid=15331964823161867305,OPERATIONAL,+62 821-4752-0932,restaurant,"restaurant, food",4.7,15,,Nice food you has to try this one,,,,
ChIJIQxidh4X0i0RQ9SAL9XlOF0,Langse Avocado: Pool & Restaurant,-8.5177902,115.36953249999999,"Jalan Raya No.mor 1, Getakan, Kec. Banjarangkan, Kabupaten Klungkung, Bali 80752, Indonesia",https://maps.google.com/?cid=6717371548010861635,OPERATIONAL,+62 858-2929-5230,restaurant,"restaurant, food",4,4,,cozy place to chill and play pool...great food for modest restaurant in the middle of nowhere,,,,
ChIJO0kH0mIX0i0RFdvqlO521Bc,Paon Bintang Mesari,-8.5183428,115.3750662,"Pasar, Getakan, Kec. Banjarangkan, Kabupaten Klungkung, Bali 80752, Indonesia",https://maps.google.com/?cid=1717128125007715093,OPERATIONAL,+62 851-5643-9613,indonesian_restaurant,"indonesian_restaurant, restaurant, food",4.5,2,,,,,,
ChIJC1j-wmoX0i0R106N6TOlja0,Pondok Pengangon Bakas,-8.5210516,115.36932829999998,"F9H9+HPG, Bakas, Banjarangkan, Klungkung Regency, Bali 80752, Indonesia",https://maps.google.com/?cid=12505833382658002647,OPERATIONAL,,tourist_attraction,tourist_attraction,5,5,,,,,,
ChIJe05D7KQX0i0RtkfE_nXz6Q0,Warung Gusti Biang,-8.5175301,115.37184999999998,"F9JC+XPQ, Getakan, Banjarangkan, Klungkung Regency, Bali 80752, Indonesia",https://maps.google.com/?cid=1002600080177645494,OPERATIONAL,+62 877-6133-9012,coffee_shop,"coffee_shop, cafe, store, food",5,4,,,,,,
ChIJpxIrGtQW0i0RPwKpKwbsSrk,Sinar Dunia. UD,-8.521946999999999,115.373211,"Br. Tihingan, Banjarangkan, F9HF+67G, Getakan, Kec. Klungkung, Kabupaten Klungkung, Bali 80752, Indonesia",https://maps.google.com/?cid=13351743556539712063,OPERATIONAL,+62 819-3623-8424,coffee_shop,"coffee_shop, cafe, store, food",,,,,,,,
ChIJ-U7g0b8X0i0R2_HhADN0ibU,Katakan ayu virda,-8.5162895,115.37479199999999,"F9MF+FWM, Getakan, Banjarangkan, Klungkung Regency, Bali 80752, Indonesia",https://maps.google.com/?cid=13081114355081277915,OPERATIONAL,,hostel,"hostel, lodging",5,1,,,,,,
ChIJ45crACgX0i0RZOJEG5DIAF8,Griya Lebah Getakan,-8.5218501,115.37667829999998,"Unnamed Road, F9HG+7M3, Getakan, Banjarangkan, Klungkung Regency, Bali 80752, Indonesia",https://maps.google.com/?cid=6845691954861498980,OPERATIONAL,+62 822-3516-6532,hotel,"hotel, lodging",4.8,4,,☕,,,,
ChIJEy8ujw8X0i0Rx7bdf2n9oq0,Jero Aseman,-8.5168792,115.37535480000001,"F9MG+64W, Getakan, Banjarangkan, Klungkung Regency, Bali 80752, Indonesia",https://maps.google.com/?cid=12511841344347289287,CLOSED_TEMPORARILY,,historical_landmark,historical_landmark,,,,,,,,
ChIJXbHd31AX0i0RVLK4hmntfaA,Katakan house anggan wiguna,-8.516192400000001,115.3747441,"F9MF+GVH, Getakan, Banjarangkan, Klungkung Regency, Bali 80752, Indonesia",https://maps.google.com/?cid=11564660455644901972,OPERATIONAL,,private_guest_room,"private_guest_room, lodging",1,1,,,,,,
