id,name,latitude,longitude,address,url,status,phone,primary-type,types,rating,rating-count,price-level,review 1,review 2,review 3,review 4,review 5
ChIJGVkDVbEZ0i0RxvT3WMj3Pnk,Goa Raja Waterfall,-8.4417744,115.3760372,"Jehem, Tembuku, Bangli Regency, Bali, Indonesia",https://maps.google.com/?cid=8736692767003505862,OPERATIONAL,+62 857-3911-6677,tourist_attraction,tourist_attraction,4.8,585,,"this place is amazing💯!! you will not regret it. i have visited several waterfall before but sometimes the path was difficult with many steep stairs or need to make many up and downhill long walks until we could arrive to the waterfall, and sometimes after exhausting walks, only to find that the waterfall is below our expectation. here we didn't walk for too long, although there were several bridges, three i think, and several sets of steep stairs but most of it have railing, and many flat paths. just be careful if you come after rain, then it will be a bit slippery, just be careful. there were several toilets, and they even provide changing room 👍🏻.  at the end of the path you will see beautiful natural water pool, and then you will spot the big waterfall at the corner. it is quite tall and wide, and the water is clear. loved it😍😍","This was our Favourite Waterfall ❤️
It's not a long walk to the Waterfall and wading pools. Nothing like a cool plunge during a warm day.
There are three steep flights of steps, but all have railings to hold onto, then a short flat walk over seven sturdy footbridges, then you'll be at a picturesque sight.
On your way down, there are clean toilets. There was a small stall at the car park selling drinks and snacks.
A restaurant further down on your way to the Waterfall entrance.
Maybe another one soon, as there was some nice looking construction next-door.
I can imagine this place could get busy, but it wasn't that busy when we were there.
This one is well worth the visit.
You'll see, compare them yourself.","Wonderful waterfalls with a decent pool, change rooms, toilets and shaded areas. Buy your tickets near the car park and it's a short and beautiful walk to the waterfall. Some steep stairs and you criss cross the stream over multiple bridges to get to the falls. Well maintained. I got there on a rainy day, and it was empty.","A beutiful waterfall that is still not very popular among tourists. Easy hike and route, big accesible parking. Have to pay entry fees just like any other tourist spots in bali. Still untouched, and the waterfall is uniquely hidden inside a cave that truly defines top notch beauty. Worth a visit. Not too far from ubud area.","A very beautiful waterfall, if you visit Bali, it is definitely a highly recommended place to visit. There is also a beautiful pool where you can comfortably swim. The entrance fee is 25000 rupees. Beautiful tropical environment, I can only recommend it."
ChIJFcLJGXsZ0i0RjpOr0OVxAr4,Objek Ekowisata Bukit Cemeng,-8.439199499999999,115.36936009999998,"H969+8PH, Cempaga, Bangli, Bangli Regency, Bali 80613, Indonesia",https://maps.google.com/?cid=13691631049022083982,OPERATIONAL,,tourist_attraction,tourist_attraction,4.4,45,,If you want to discover waterfall with great place for swimming you're 8n the best place...,Nice water fall good staff,This place is closed. Don't waste your time trying to get there,Closed and abandoned,nice tourist place
ChIJYcpxmGMd0i0Rqcrjkd4UsGk,INFINITY RIVER club & resto,-8.4407065,115.3743286,"Goa Raja Waterfall, Jehem, Kec. Tembuku, Kabupaten Bangli, Bali 80671, Indonesia",https://maps.google.com/?cid=7615609916046428841,OPERATIONAL,,restaurant,"restaurant, food",4.9,27,,"It's a good resto, the foods and beverages are so affordable great service and the ambience is comfortable. Will be back again👍🏼",Good place after the waterfall ! The workers are really nice !,,,
ChIJjdaOWNIZ0i0RYYb34ezHo0w,Blessing Restaurant,-8.440559200000001,115.3744186,"Goa Raja Waterfall, Jehem, Kec. Tembuku, Kabupaten Bangli, Bali 80671, Indonesia",https://maps.google.com/?cid=5522477388303664737,OPERATIONAL,+62 813-2787-5558,restaurant,"restaurant, food",4.3,6,,After visiting the Gao Rajo waterfall we had lunch at this restaurant. The restaurant newly opened in 2024 and offers great food and very friendly service.,"Another restaurant that charges higher prices than they write on the menu. To the manager: add the 15% you're adding at the end already on the menu items. I don't care that everybody else does it like that as well. There's no benefit to the customer. I'm going to a restaurant in my free time, I don't want to calculate percentages in my head in my free time.","Nice place,, peaceful atmosfer surrounding bamboo trees. The food was excellent 👍👍",Good,
ChIJEd0SO88Z0i0RMaVgRgJbwjY,Warung Bu Ari,-8.441788299999999,115.37623210000001,"H95G+7FQ, Jehem, Tembuku, Bangli Regency, Bali 80671, Indonesia",https://maps.google.com/?cid=3945816288858776881,OPERATIONAL,,restaurant,"restaurant, food",5,1,,available meet balls( bakso) here.,,,,
ChIJ3x6e_5IZ0i0R_OCsAysn_OU,JEHEM INTEGRITED FARMING,-8.4414,115.3763912,"H95G+9CR, Jehem, Tembuku, Bangli Regency, Bali 80671, Indonesia",https://maps.google.com/?cid=16572163794515321084,OPERATIONAL,,park,park,,,,,,,,
ChIJZd37jv8Z0i0R6nZRgfDAvBk,Rumah,-8.4406073,115.3701519,"H95C+Q32 Br.sidembunut, Jl. Taman Sari, Cempaga, Kec. Bangli, Kabupaten Bangli, Bali 80613, Indonesia",https://maps.google.com/?cid=1854569285764085482,CLOSED_TEMPORARILY,,tourist_attraction,tourist_attraction,,,,,,,,
ChIJ1e6R9TEZ0i0RCZ2jobTj5yM,BALA DEWA MARKAS,-8.4383991,115.3759061,"Unnamed Road, Jehem, Kec. Tembuku, Kabupaten Bangli, Bali 80671, Indonesia",https://maps.google.com/?cid=2587286875893112073,OPERATIONAL,,night_club,night_club,5,5,,,,,,
ChIJj2W1ZAAZ0i0RgKBsUJK9Wqo,Rumah Pan Martin Sisu,-8.4408098,115.3703815,"sari, Jl. Pura Pucak, Cempaga, Kec. Bangli, Kabupaten Bangli, Bali 80613, Indonesia",https://maps.google.com/?cid=12275332170463879296,OPERATIONAL,,private_guest_room,"private_guest_room, lodging",,,,,,,,
ChIJKSDP338Z0i0R5LwMvKafKcw,Home Bangli,-8.4405437,115.370134,"H95C+Q3J, Cempaga, Tembuku, Bangli Regency, Bali 80613, Indonesia",https://maps.google.com/?cid=14711465196250774756,OPERATIONAL,,park,park,5,1,,,,,,
ChIJ28JbPi0Z0i0Rt-cA4PVPc2c,Ardika,-8.4390201,115.3758263,"H96G+98W, Unnamed Road, Jehem, Kec. Tembuku, Kabupaten Bangli, Bali 80671, Indonesia",https://maps.google.com/?cid=7454389725672040375,OPERATIONAL,,night_club,night_club,5,1,,,,,,
ChIJZfyh2vQZ0i0R9-rCvX7t804,BBBalitravel,-8.4448536,115.3716491,"lingkungan Sidembunut, Cempaga, Kec. Bangli, Kabupaten Bangli, Bali 80613, Indonesia",https://maps.google.com/?cid=5689151882904398583,OPERATIONAL,+62 877-4334-4488,tourist_attraction,tourist_attraction,,,,,,,,
ChIJBSZ2XxgZ0i0RxE_roJ--WD8,AWA GUEST HOUSE,-8.4425307,115.3690113,"Cempaga, Bangli, Bangli Regency, Bali, Indonesia",https://maps.google.com/?cid=4564607815148851140,OPERATIONAL,,private_guest_room,"private_guest_room, lodging",,,,,,,,
ChIJV6Dt_U4Z0i0RW0XnpYwjtG4,warung kopi,-8.4439344,115.3694982,"Jl. Abian Tiying No.18, Cempaga, Kec. Bangli, Kabupaten Bangli, Bali 80613, Indonesia",https://maps.google.com/?cid=7977039926965781851,OPERATIONAL,,coffee_shop,"coffee_shop, cafe, store, food",,,,,,,,
