id,name,latitude,longitude,address,url,status,phone,primary-type,types,rating,rating-count,price-level
ChIJGWgeIKwp0i0R7RU5rR-TeMA,Talasi Estate at Batukaru Bali,-8.3881646,115.0783432,"Banjar Biyahan, Wanagiri, Kec. Selemadeg, Kabupaten Tabanan, Bali 82152, Indonesia",https://maps.google.com/?cid=13868996816746911213,OPERATIONAL,+62 811-3889-904,,"cafe, food",4.9,353,
ChIJ1ebNE5Eo0i0RCpXR2K_IzEk,Alassari Plantation,-8.389980999999999,115.07821849999998,"Biyahan, Wanagiri, Selemadeg, Wanagiri, Kec. Selemadeg, Kabupaten Tabanan, Bali 82162, Indonesia",https://maps.google.com/?cid=5317845917600158986,OPERATIONAL,+61 409 555 060,hotel,"hotel, lodging",4.4,84,
ChIJ89HTNvEp0i0RHIA_iqoxn5c,Batukaru Mountain Farmstay,-8.389263999999999,115.0804309,"Banjar Anyar, Penebel, Tabanan Regency, Bali 82152, Indonesia",https://maps.google.com/?cid=10925505829557731356,OPERATIONAL,+62 821-4409-0603,farmstay,"farmstay, lodging",4.9,28,
ChIJu-nqnZUp0i0RJv65o1jWKcw,Faraway Jungle Bamboo Treehouse,-8.3856667,115.08133329999998,"J37J+PG, Dalang, Selemadeg Timur, Tabanan Regency, Bali, Indonesia",https://maps.google.com/?cid=14711525333974777382,OPERATIONAL,,,lodging,,,
ChIJh-vVircp0i0REiUInNBAoxA,garden kitchen project,-8.3894614,115.07806889999999,"J36H+76G, Wanagiri, Selemadeg, Tabanan Regency, Bali 82152, Indonesia",https://maps.google.com/?cid=1198873190525838610,OPERATIONAL,+62 812-9612-0707,park,park,,,
ChIJGWMKvnMp0i0RrCAegjDWXGY,Farmcoffe homestay,-8.3886225,115.081085,"J36J+HC4, Dalang, Selemadeg Timur, Tabanan Regency, Bali 82152, Indonesia",https://maps.google.com/?cid=7376005793555816620,OPERATIONAL,+62 857-9292-9432,lodging,lodging,4.8,6,
ChIJ7y3eagAn0i0RBwvpAFGIQvg,Bali Gems Cabin,-8.3892546,115.08051619999999,"Br Anyar, Sangketan, Kec. Penebel, Kabupaten Tabanan, Bali 82181, Indonesia",https://maps.google.com/?cid=17889010551358032647,OPERATIONAL,+62 812-3979-7874,,"camping_cabin, lodging",,,
ChIJS3GhWSsp0i0R_p3okrVUm0I,ASTUNGKARA PROYEK,-8.389308399999999,115.0780886,"J36H+76G, Wanagiri, Selemadeg, Tabanan Regency, Bali 82152, Indonesia",https://maps.google.com/?cid=4799522966723927550,OPERATIONAL,,private_guest_room,"private_guest_room, lodging",,,
ChIJx5W_SIcp0i0Roa9YyCHnbPU,Abiankopi Private Garden,-8.3906525,115.0781004,"Jalan Raya Puncaksari No. 58 Banjar Biyahan, Wanagiri, Sarinbuana, Tabanan Regency, Bali 82162, Indonesia",https://maps.google.com/?cid=17684763969058287521,OPERATIONAL,,park,park,,,
