id,name,latitude,longitude,address,url,status,phone,primary-type,types,rating,rating-count,price-level
ChIJC7MEr4cl0i0RWfjSPA7o_as,Cacab Durian Bali,-8.4262936,115.1666167,"H5F8+FJQ, Jl. Legung, Payangan, Kec. Marga, Kabupaten Tabanan, Bali 82181, Indonesia",https://maps.google.com/?cid=12393316897441118297,OPERATIONAL,+62 878-6228-0623,park,park,3.7,3,
ChIJ4UGq6cUl0i0RE-tj9sdoEcM,Warung buk jero,-8.426891,115.16580849999998,"H5F8+68V, Payangan, Marga, Tabanan Regency, Bali 82181, Indonesia",https://maps.google.com/?cid=14056131120041552659,OPERATIONAL,,coffee_shop,"coffee_shop, cafe, store, food",4.3,3,
ChIJMc1wNacl0i0R37VhbbuPuUw,Pondok nang andre,-8.4236132,115.16273819999999,"H5G7+H35, Jl. Merpati, Biaung, Kec. Penebel, Kabupaten Tabanan, Bali 82181, Indonesia",https://maps.google.com/?cid=5528608052730770911,OPERATIONAL,,cafe,"cafe, food",,,
ChIJS5jYse4l0i0RdqRQODiyJbU,KOLAM PANCING MINA GIRI ASRAMA,-8.4220401,115.16397439999999,"Br, H5H7+5HQ, Cacab, Biaung, Kec. Penebel, Kabupaten Tabanan, Bali 82181, Indonesia",https://maps.google.com/?cid=13053035049535972470,OPERATIONAL,,park,park,,,
ChIJoxhu_g0l0i0RaptTOsDbUMM,Murahan Lanang Dauh,-8.4242879,115.16240359999999,"H5G6+7XJ, Biaung, Penebel, Tabanan Regency, Bali 82181, Indonesia",https://maps.google.com/?cid=14073990454191561578,OPERATIONAL,,motel,"motel, lodging",,,
