id,name,latitude,longitude,address,url,status,phone,primary-type,types,rating,rating-count,price-level
ChIJEyP4Zg_U0y0RZ_qqHbmkLOs,Kelapa Retreat & Spa,-8.434465399999999,114.8304443,"Jl. Ngurah Rai, Pekutatan, Kec. Pekutatan, Kabupaten Jembrana, Bali 82262, Indonesia",https://maps.google.com/?cid=16946100612861983335,OPERATIONAL,+62 811-3991-2000,hotel,"hotel, resort_hotel, lodging, health",4.7,240,
ChIJoYMg-KbT0y0Re1JGxlEjtK0,Tides Restaurant and Bar,-8.434459,114.830446,"Hotel Kelapa Retreat and Spa, Pekutatan, Kec. Pekutatan, Kabupaten Jembrana, Bali 82262, Indonesia",https://maps.google.com/?cid=12516668098495271547,OPERATIONAL,+62 811-3961-6111,restaurant,"restaurant, food",4.7,21,
ChIJc-yHvIfT0y0R7v4yY7iJ5NE,Kelapa Beach,-8.4351945,114.8308136,"HR7J+W8G, Jl. Ngurah Rai, Kec. Pekutatan, Kabupaten Jembrana, Bali, Indonesia",https://maps.google.com/?cid=15124364873648242414,OPERATIONAL,,tourist_attraction,tourist_attraction,5,6,
ChIJpTJ98TPV0y0R9JNTxVVYhk8,Pantai Galuh,-8.4315642,114.83106900000001,"HR9J+9CG, Jl. Galuh, Pekutatan, Kec. Pekutatan, Kabupaten Jembrana, Bali 82262, Indonesia",https://maps.google.com/?cid=5730364701281588212,OPERATIONAL,,restaurant,"restaurant, food",4.7,12,
ChIJR95wbxrV0y0RDF7_JgoY9hY,Twin Hostel / Rumah Kos,-8.4317663,114.8306882,"Pekutatan, Jembrana Regency, Bali, Indonesia",https://maps.google.com/?cid=1654536344988245516,OPERATIONAL,+62 819-3641-4120,hostel,"hostel, lodging",3.7,3,
ChIJ6XEqPqHV0y0R7MCO1z2NV9Q,Warung karaoke pekutatan,-8.431478199999999,114.83579290000002,"Unnamed Road, HR9P+C83, Pekutatan, Kec. Pekutatan, Kabupaten Jembrana, Bali 82262, Indonesia",https://maps.google.com/?cid=15300853555763527916,OPERATIONAL,+62 823-4121-2105,cafe,"cafe, food",4.8,9,
ChIJPzw4RqXV0y0R2CBRU8ZXgVU,JJ INDEKOS,-8.4320259,114.83048670000001,"Jl. Galuh Banjar Dauh Pangkung, Pekutatan, Kec. Pekutatan, Kabupaten Jembrana, Bali 82262, Indonesia",https://maps.google.com/?cid=6161302274532516056,OPERATIONAL,+62 812-3632-9654,hostel,"hostel, lodging",,,
