id,name,latitude,longitude,address,url,status,phone,primary-type,types,rating,rating-count,price-level
ChIJv3V6SeOP0S0RG7B6Grphjcw,"Blue Lagoon (Secret Garden of Sambangan & Sliding, Jumping Attraction)",-8.177354,115.10622800000002,"Sambangan, Sukasada, Buleleng Regency, Bali 81161, Indonesia",https://maps.google.com/?cid=14739544607389560859,OPERATIONAL,+62 812-4632-0871,travel_agency,"tourist_attraction, travel_agency",4.6,240,
ChIJkQk_QP2P0S0RdUzLGszBsp4,Krisna Adventure,-8.1747511,115.1045081,"Sambangan, Sukasada, Buleleng Regency, Bali 81161, Indonesia",https://maps.google.com/?cid=11435415486214130805,OPERATIONAL,+62 878-6062-9174,indonesian_restaurant,"indonesian_restaurant, restaurant, food",4.5,264,PRICE_LEVEL_MODERATE
ChIJKVH-Vf2P0S0Rq26J7IFSKYw,Pondok Kunang Kunang,-8.1736512,115.106026,"Air Terjun, Jl. Raya Desa Sambangan No.Daerah, Sambangan, Kec. Sukasada, Kabupaten Buleleng, Bali 81161, Indonesia",https://maps.google.com/?cid=10099694357327736491,OPERATIONAL,+62 852-3735-0144,,"campground, park, lodging, restaurant, food",4.4,34,
ChIJp4ykxtGP0S0RjTNeMWTKMIo,Warung D'jurang,-8.1772375,115.10676559999999,"R4F4+4P2 dinas pebantenan, Banjar, Ambengan, Kec. Sukasada, Kabupaten Buleleng, Bali 81161, Indonesia",https://maps.google.com/?cid=9957681307789964173,OPERATIONAL,+62 878-4960-8060,restaurant,"restaurant, food",4.2,9,
ChIJLXnH9y2P0S0R2Yy_jJGzk8k,Blue lagoon iconic singaraja,-8.177344999999999,115.10616,"Banjar Pebantenan, R4F4+3F7, Ambengan, Sukasada, Buleleng Regency, Bali 81161, Indonesia",https://maps.google.com/?cid=14525150660912975065,OPERATIONAL,+62 821-4576-4267,lodging,lodging,5,6,
ChIJi8UHoOKP0S0R21FmpNHXD_k,North Bali Explore,-8.1734036,115.1073455,"Dusun Pebantenan, R4G4+JWQ, Desa Ambengan, Singaraja, Sambangan, Kec. Sukasada, Kabupaten Buleleng, Bali 81161, Indonesia",https://maps.google.com/?cid=17946800335501021659,OPERATIONAL,+62 877-6254-8444,campground,"campground, park, lodging",5,5,
ChIJ0-7ocg-Q0S0RgI39Wgnjqg4,Canyoning Aling2 Waterfall,-8.1767187,115.1061741,"Sambangan, Sukasada, Buleleng Regency, Bali 81161, Indonesia",https://maps.google.com/?cid=1056906691892579712,OPERATIONAL,+62 812-3695-1889,tourist_attraction,tourist_attraction,5,7,
ChIJK1ruWgSR0S0RZn-R9DpQNWA,Wisata lesung kembar waterfall,-8.1730741,115.10716459999999,"Bd,dinas pebantenan,desa ambengan,kec.sukssada kab buleleng, Sambangan, Kec. Sukasada, Singaraja, Bali 81161, Indonesia",https://maps.google.com/?cid=6932535415548247910,OPERATIONAL,+62 878-6300-8855,tourist_attraction,tourist_attraction,,,
ChIJMUiCRLeR0S0RMh1JfMl_cAk,Lesung Permai Waterfall,-8.1722102,115.1092504,"Dusun Pebantenan, Ambengan, Kec. Sukasada, Kabupaten Buleleng, Bali 81161, Indonesia",https://maps.google.com/?cid=680184047083265330,OPERATIONAL,+62 812-3711-1036,tourist_attraction,tourist_attraction,4.5,11,
ChIJVWfvqaKP0S0R9BFNnHOnhhQ,Warung Setapak - Pizza and Japanese Bento,-8.1736529,115.1060394,"R4G4+GCM, Jalan I Gusti Ketut Jejer, Sambangan, Kec. Sukasada, Kabupaten Buleleng, Bali 81161, Indonesia",https://maps.google.com/?cid=1479053642623160820,OPERATIONAL,+62 813-3820-8134,pizza_restaurant,"pizza_restaurant, restaurant, food",5,10,
ChIJL-q_2OKP0S0RMtd8HJK3AHc,Yin Yang Hill Resort,-8.175855199999999,115.10676450000001,"R4F4+MP2 Aling Water Fall, Jalan Aling, Ambengan, Kec. Sukasada, Kabupaten Buleleng, Bali 81161, Indonesia",https://maps.google.com/?cid=8575055528684476210,OPERATIONAL,+62 878-6138-2333,resort_hotel,"resort_hotel, hotel, lodging",4,9,
ChIJY1ITL8GR0S0RW874AP6JFEI,"Lobster air tawar ,& pengelola obyek wisata desa ambengan",-8.172730999999999,115.10760289999997,"Singaraja, Ambengan, Kec. Sukasada, Kabupaten Buleleng, Bali 81161, Indonesia",https://maps.google.com/?cid=4761582430068461147,OPERATIONAL,+62 878-6300-8855,tourist_attraction,tourist_attraction,5,3,
ChIJexG2z9SP0S0Rn6OrdwJKAkg,Deery home,-8.1752121,115.107421,"R4F4+WX7, Sambangan, Sukasada, Buleleng Regency, Bali 81161, Indonesia",https://maps.google.com/?cid=5188791095142359967,OPERATIONAL,+62 878-4434-3063,tourist_attraction,tourist_attraction,,,
ChIJD5ACaf2P0S0RMEEPuq3toxw,Rawon Cundang,-8.1748157,115.10484859999998,"R4G3+3WH, Jl. Banjar Anyar, Sambangan, Kec. Sukasada, Kabupaten Buleleng, Bali 81161, Indonesia",https://maps.google.com/?cid=2063754384672506160,OPERATIONAL,+62 857-3712-2049,restaurant,"restaurant, food",5,2,
ChIJJbbRAtCP0S0RFe6o2v9qnac,Sambangan Village,-8.1737147,115.10482839999999,"R4G3+CQW Wisata Palowan Hidroponik, Jl. Raya Desa Sambangan, Sambangan, Kec. Sukasada, Kabupaten Buleleng, Bali 81161, Indonesia",https://maps.google.com/?cid=12077927422795247125,OPERATIONAL,,hiking_area,"hiking_area, park",,,
ChIJ84L_iGKP0S0RUcG9xYqvQnM,Wr Dewantara,-8.178368599999999,115.11027360000001,"Banjar Dinas Pebantenan, R4C6+M42, Ambengan, Kec. Sukasada, Kabupaten Buleleng, Bali 81161, Indonesia",https://maps.google.com/?cid=8305393673382510929,OPERATIONAL,+62 822-3756-1757,coffee_shop,"coffee_shop, cafe, food, store",5,5,
ChIJKykBVeiP0S0RS6BTeHklfnk,SetiaMurni house,-8.1775282,115.11090949999999,"Ambengan, Dusun pebantenan, Buleleng Regency, Bali 81161, Indonesia",https://maps.google.com/?cid=8754475929294839883,OPERATIONAL,,,lodging,5,1,
ChIJJ6zJ_BeP0S0R95OPsbN3HFU,WR MANIK,-8.1783954,115.11046200000001,"Desa Ambengan dusun pebantenan, Ambengan, Kec. Sukasada, Kabupaten Buleleng, Bali 81112, Indonesia",https://maps.google.com/?cid=6132908406233601015,OPERATIONAL,+62 877-6180-7101,coffee_shop,"coffee_shop, cafe, food, store",,,
ChIJbezJPQCR0S0RNfYmQEhslJY,Kroya Cafe,-8.173162000000001,115.10570939999998,"Kroya Cafe, Air Terjun, Jl. Raya Desa Sambangan No.Daerah, Sambangan, Kec. Sukasada, Kabupaten Buleleng, Bali 81161, Indonesia",https://maps.google.com/?cid=10850416459812107829,OPERATIONAL,+62 878-6326-0321,restaurant,"restaurant, food",5,1,
ChIJwX5pVgCR0S0RjXzFSnFFpCw,WaVi Middle Cottage,-8.1722112,115.10537549999998,"R4H4+456, Jl. Raya Desa Sambangan, Sambangan, Kec. Sukasada, Kabupaten Buleleng, Bali 81161, Indonesia",https://maps.google.com/?cid=3216772386737454221,OPERATIONAL,,camping_cabin,"camping_cabin, lodging",,,
