id,name,latitude,longitude,address,url,status,phone,primary-type,types,rating,rating-count,price-level
ChIJVX20yPV30i0RxY6hV8Psjvc,BINTANG FOOD AND DRINK,-8.7615336,115.5925594,"Jln. Pantai Atuh,Dsn. Pendem, 6HQV+92M, Pejukutan, Nusa Penida, Klungkung Regency, Bali 80771, Indonesia",https://maps.google.com/?cid=17838455497794096837,OPERATIONAL,+62 821-4424-8442,restaurant,"restaurant, food",5,2,
ChIJZ16oi8F30i0RdQzQhr-Cfjo,Cubang kori Resto,-8.7593366,115.59771229999998,"Jalan Raya Pelilit, Pejukutan, Kec. Nusa Penida, Kabupaten Klungkung, Bali 82222, Indonesia",https://maps.google.com/?cid=4214950060377508981,OPERATIONAL,+62 823-4149-2088,restaurant,"restaurant, food",,,
ChIJlfayfgB30i0RXdjPkZZTZh0,Pejukutan,-8.7593366,115.59771229999998,"Jl raya No.55, Pejukutan, Kec. Nusa Penida, Kabupaten Klungkung, Bali 80771, Indonesia",https://maps.google.com/?cid=2118472580880914525,OPERATIONAL,,fast_food_restaurant,"fast_food_restaurant, restaurant, food",,,
ChIJo9q91mx30i0RRUqR9lQpWp4,Resto Kinan Molenteng,-8.7593366,115.59771229999998,"6HRX+738, Pejukutan, Nusa Penida, Klungkung Regency, Bali, Indonesia",https://maps.google.com/?cid=11410478050787281477,CLOSED_TEMPORARILY,,coffee_shop,"coffee_shop, cafe, food, store",,,
ChIJ5WIfFQB30i0RHsN_iK0cVvM,Wester house,-8.760857699999999,115.59755770000001,"6HQX+M2, Pejukutan, Nusa Penida, Klungkung Regency, Bali, Indonesia",https://maps.google.com/?cid=17534233730858599198,OPERATIONAL,,private_guest_room,"private_guest_room, lodging",5,1,
ChIJSUb51JJ30i0RCVPN72wQgew,Weca Huts,-8.761275099999999,115.59561240000001,"6HQW+F6Q, Br. pendem desa, Pejukutan, Kec. Nusa Penida, Kabupaten Klungkung, Bali 80771, Indonesia",https://maps.google.com/?cid=17041920525012390665,OPERATIONAL,+62 852-3846-0866,lodging,lodging,5,2,
