id,name,latitude,longitude,address,url,status,phone,primary-type,types,rating,rating-count,price-level
ChIJkzprz3Rf0S0RYbhrwpulQSU,Warung Muslim Berliana,-8.3021172,114.51600909999999,"Jl. Raya Denpasar - Gilimanuk No.822, Candikusuma, Kec. Melaya, Kabupaten Jembrana, Bali 82252, Indonesia",https://maps.google.com/?cid=2684608941289879649,OPERATIONAL,+62 812-4643-3839,restaurant,"restaurant, food",4.3,4,
ChIJzc2jmoFf0S0RpaaBUMlwEHE,ayam bali,-8.2979254,114.51925569999999,"PG29+RPC, Candikusuma, Melaya, Jembrana Regency, Bali 82252, Indonesia",https://maps.google.com/?cid=8147135735854638757,OPERATIONAL,+62 878-6435-5745,lodging,lodging,,,
ChIJSS24YKtf0S0RFH7lNLFEFIQ,Warung Lalapam Sari Laut,-8.3021224,114.516014,"MGX8+5C2, Jl. Raya Denpasar - Gilimanuk, Candikusuma, Kec. Melaya, Kabupaten Jembrana, Bali 82252, Indonesia",https://maps.google.com/?cid=9517307440428056084,OPERATIONAL,+62 819-3307-6760,seafood_restaurant,"seafood_restaurant, restaurant, food",,,
ChIJ9990P55f0S0R8OxtoEJAKnY,Warung Muslim Bu Is,-8.303452199999999,114.5167015,"Jl. Raya Denpasar - Gilimanuk, Candikusuma, Melaya, Kabupaten Jembrana, Bali 822, Candikusuma, Kec. Melaya, Kabupaten Jembrana, Bali 82252, Indonesia",https://maps.google.com/?cid=8514688700400921840,OPERATIONAL,+62 852-3823-3875,restaurant,"restaurant, food",,,
ChIJGV6f5IBf0S0RL9Uf4LLkRtI,Kebun pak sama,-8.2987463,114.5204048,"PG2C+G52, Candikusuma, Melaya, Jembrana Regency, Bali, Indonesia",https://maps.google.com/?cid=15152049453250106671,OPERATIONAL,+62 877-6273-3745,park,park,,,
ChIJG8bGFL9f0S0RzvQW0z4-UQY,Bali 617,-8.3020547,114.51610149999999,"MGX8+5CH, Jl. Raya Denpasar - Gilimanuk, Candikusuma, Kec. Melaya, Kabupaten Jembrana, Bali 82252, Indonesia",https://maps.google.com/?cid=455213476891522254,OPERATIONAL,,restaurant,"restaurant, food",,,
ChIJ91A_7-pf0S0RkLZq4oDDmio,BagusAlit,-8.299109999999999,114.52062169999999,"Unnamed Road, PG2C+965, Candikusuma, Kec. Melaya, Kabupaten Jembrana, Bali 82252, Indonesia",https://maps.google.com/?cid=3069981054328288912,OPERATIONAL,,coffee_shop,"coffee_shop, cafe, store, food",,,
ChIJk4ua6v1f0S0RM3LygvuERjQ,Warung Muslim Bakso Sapi,-8.303448699999999,114.5167328,"MGW8+JMH, Jl. Raya Denpasar - Gilimanuk, Tuwed, Kec. Melaya, Kabupaten Jembrana, Bali 82218, Indonesia",https://maps.google.com/?cid=3766844354110583347,OPERATIONAL,+62 852-3823-3875,indonesian_restaurant,"indonesian_restaurant, restaurant, food",2.3,3,
