id,name,latitude,longitude,address,url,status,phone,primary-type,types,rating,rating-count,price-level
ChIJGVOTLmKG0S0RRhvWYL-IZqc,Lesong Hotel and Restaurant,-8.272427,115.04918800000002,"Gesing, Banjar, Buleleng Regency, Bali 81161, Indonesia",https://maps.google.com/?cid=12062479007503227718,OPERATIONAL,+62 859-6594-4522,hotel,"hotel, lodging",4.4,196,
ChIJS7NJYNiH0S0RHtSSyupmcCM,Ayam Geprek Angkringan 21,-8.2735393,115.05095179999999,"P3G2+H9P, Jl. Gesing, Gesing, Kec. Banjar, Kabupaten Buleleng, Bali 81161, Indonesia",https://maps.google.com/?cid=2553654147326071838,OPERATIONAL,+62 857-3743-0284,indonesian_restaurant,"indonesian_restaurant, restaurant, food",5,3,
ChIJvaDHmTyH0S0R4iW3AF4MZiQ,Warung Putu Armawati,-8.2779531,115.0517992,"P3C2+RP7, Gesing, Banjar, Buleleng Regency, Bali 81161, Indonesia",https://maps.google.com/?cid=2622797430868354530,OPERATIONAL,+62 813-3800-1492,restaurant,"restaurant, food",5,3,
ChIJ9ROodIeH0S0R4X7ElEF6EL0,Route66 cafe,-8.277795,115.05169860000001,"P3C2+VMP, Gesing, Banjar, Buleleng Regency, Bali, Indonesia",https://maps.google.com/?cid=13623523294883118817,OPERATIONAL,+62 881-0376-80661,coffee_shop,"coffee_shop, cafe, food, store",5,1,
ChIJI2Nm0TWH0S0RR_6Kq84vrE8,Local guide,-8.275781199999999,115.04906380000001,"Gesing, Banjar, Buleleng Regency, Bali, Indonesia",https://maps.google.com/?cid=5741016189678321223,OPERATIONAL,,hotel,"hotel, lodging",,,
ChIJH1lSiOKH0S0RhPDiZZwpbCg,Swadi Homestay,-8.2764759,115.0465389,"P2FW+CJ3, Gesing, Banjar, Buleleng Regency, Bali, Indonesia",https://maps.google.com/?cid=2912748810702876804,OPERATIONAL,,bed_and_breakfast,"bed_and_breakfast, lodging",,,
ChIJgRX5twuH0S0RS2WOE3x0l4c,Oming Vitri,-8.2799731,115.0531241,"Jl. Gesing No.1 1, Gesing, Kec. Banjar, Kabupaten Buleleng, Bali 81161, Indonesia",https://maps.google.com/?cid=9770405992856446283,OPERATIONAL,,private_guest_room,"private_guest_room, lodging",,,
