id,name,latitude,longitude,address,url,status,phone,primary-type,types,rating,rating-count,price-level
ChIJTXLHqhIl0i0RPFF0yPVUdLg,Sirya farm house with rice field view,-8.4857496,115.10266190000002,"Banjar, Jl. Sambian Undagi, Timpag, Kec. Kerambitan, Kabupaten Tabanan, Bali 82152, Indonesia",https://maps.google.com/?cid=13291341814883963196,OPERATIONAL,+62 812-3944-847,farm,"farm, private_guest_room, lodging",5,50,
ChIJ7bV57lAl0i0RzeJp0uYcoHo,Undagi Farmers Village,-8.4866276,115.10322479999999,"Br. Sambian Undagi, Kesiut, Kec. Kerambitan, Kabupaten Tabanan, Bali 82161, Indonesia",https://maps.google.com/?cid=8836094246599123661,OPERATIONAL,+62 878-6167-9518,,"event_venue, farmstay, lodging",4.9,31,
ChIJqUAO_qAl0i0RMfWQlQ5NQ8c,Benny's,-8.490814600000002,115.0985301,"Unnamed Road, G35X+MCC, Timpag, Kec. Kerambitan, Kabupaten Tabanan, Bali 82161, Indonesia",https://maps.google.com/?cid=14358404762021459249,OPERATIONAL,+62 877-6508-1935,restaurant,"restaurant, food",5,2,
ChIJETH2z0ol0i0Rbgwn7KHbc2w,Kedai Kohaku,-8.4888666,115.1016562,"G462+FM2, Timpag, Kerambitan, Tabanan Regency, Bali 82152, Indonesia",https://maps.google.com/?cid=7814831266916142190,OPERATIONAL,,cafe,"cafe, food",5,1,
ChIJ4af1uwEl0i0ROVzt6LAXBOk,Sambian Eco Lodge,-8.4858751,115.10298709999999,"Unnamed Road, G473+J5X, Timpag, Kec. Kerambitan, Kabupaten Tabanan, Bali 82152, Indonesia",https://maps.google.com/?cid=16790571359333604409,OPERATIONAL,,hotel,"hotel, lodging",5,3,
ChIJ_RtR1L4l0i0RuoIdxyjCa9w,Sambian Undagi Restoran dan Yoga place,-8.4859828,115.10293859999999,"G473+J54, Jl. Sambian Undagi, Timpag, Kec. Kerambitan, Kabupaten Tabanan, Bali 82152, Indonesia",https://maps.google.com/?cid=15883001991247266490,OPERATIONAL,,restaurant,"restaurant, food",3.8,4,
ChIJ_QdU2JQl0i0RrXeydjNqldI,Rice_Jinggo'House,-8.4893723,115.0994525,"G36X+7Q4, Gg. Mawar V, Timpag, Kec. Kerambitan, Kabupaten Tabanan, Bali 82161, Indonesia",https://maps.google.com/?cid=15174151288762038189,OPERATIONAL,,indonesian_restaurant,"indonesian_restaurant, restaurant, food",5,4,
ChIJjUrMQ3wl0i0RIMGUGF3w9aU,Pura Puseh Sambian Undagi,-8.4870371,115.102429,"Unnamed Road, G472+5XM, Timpag, Kerambitan, Tabanan Regency, Bali 82152, Indonesia",https://maps.google.com/?cid=11958728668187246880,OPERATIONAL,,restaurant,"restaurant, food",5,1,
ChIJe_5hzIUl0i0R3CxyqVIAS0w,Krisna gubug's,-8.489009099999999,115.1001499,"Dusun Sambian tengah, G462+93R, Timpag, Kec. Kerambitan, Kabupaten Tabanan, Bali 82161, Indonesia",https://maps.google.com/?cid=5497488125165972700,CLOSED_TEMPORARILY,,lodging,lodging,,,
ChIJLRktRsol0i0RrXXm9Ao4Gf4,Rumah kedunk,-8.4911102,115.10382949999997,"G453+HG4, Jl. Sarasidi, Sembung Gede, Kec. Kerambitan, Kabupaten Tabanan, Bali 82152, Indonesia",https://maps.google.com/?cid=18309727379761034669,OPERATIONAL,,coffee_shop,"coffee_shop, cafe, store, food",5,1,
ChIJu9JtOb8l0i0RvVZaIqPAIzo,Sawah undagi,-8.484742599999999,115.103095,"Unnamed Road, G483+465, Timpag, Kerambitan, Tabanan Regency, Bali 82152, Indonesia",https://maps.google.com/?cid=4189403885273241277,OPERATIONAL,,park,park,,,
ChIJEwG-HL0l0i0Rg2miTKSwQqk,Pura Sambiyan Tengah,-8.4909713,115.09728039999999,"Unnamed Road, G35W+JW6, Timpag, Kerambitan, Tabanan Regency, Bali 82161, Indonesia",https://maps.google.com/?cid=12196504960579561859,CLOSED_TEMPORARILY,,restaurant,"restaurant, food",,,
