id,name,latitude,longitude,address,url,status,phone,primary-type,types,rating,rating-count,price-level
ChIJC2QgAB8g0i0ReCXXUtGXV28,Munduk asri,-8.3399086,115.2799045,"Jl. Raya Payangan, Kerta, Kec. Payangan, Kabupaten Gianyar, Bali 80572, Indonesia",https://maps.google.com/?cid=8023048186477618552,CLOSED_TEMPORARILY,+62 878-6169-8889,tourist_attraction,tourist_attraction,4.2,440,
ChIJkTlYHmEh0i0RYc9_EoyMHYo,Kerta,-8.3402658,115.28157449999999,"M75J+VJW, Jalan Raya, Kerta, Kec. Payangan, Kabupaten Gianyar, Bali 80572, Indonesia",https://maps.google.com/?cid=9952265284792340321,OPERATIONAL,+62 857-3742-0140,restaurant,"restaurant, food",4.9,8,
ChIJwypJ_h4g0i0ROzEDhdnmecM,Munduk Asri,-8.340241400000002,115.2805757,"M75J+W64, Kerta, Payangan, Gianyar Regency, Bali 80572, Indonesia",https://maps.google.com/?cid=14085543131491807547,OPERATIONAL,+62 853-3307-0205,park,park,4.4,22,
ChIJcbFHHg8h0i0RjQZTgoqSahw,pondok kumis,-8.341118,115.28134209999999,"M75J+HG4, Kerta, Payangan, Gianyar Regency, Bali 80572, Indonesia",https://maps.google.com/?cid=2047610104182933133,OPERATIONAL,,hotel,"hotel, lodging",,,
ChIJ80MTAL0h0i0ROJE0GPyVy-Y,Alam Sari Waroeng,-8.3382264,115.280797,"M76J+P83, Kerta, Payangan, Gianyar Regency, Bali 80572, Indonesia",https://maps.google.com/?cid=16630550958966083896,OPERATIONAL,+62 831-1421-8242,restaurant,"restaurant, food",5,2,
ChIJa_A06Vsh0i0RKJzoX01zOwg,Nyemil.Basreng,-8.3380093,115.2778317,"Br, Margatengah, Kerta, Kec. Payangan, Kabupaten Gianyar, Bali 80572, Indonesia",https://maps.google.com/?cid=593194552088108072,OPERATIONAL,+62 831-4277-8935,restaurant,"restaurant, food",,,
ChIJf53oWkwh0i0RUzyDO2qF8bo,Kumara house,-8.3380093,115.2778317,"M76H+Q4W, Saren, Kerta, Kec. Payangan, Kabupaten Gianyar, Bali, Indonesia",https://maps.google.com/?cid=13470694651753348179,CLOSED_TEMPORARILY,,night_club,night_club,,,
