id,name,latitude,longitude,address,url,status,phone,primary-type,types,rating,rating-count,price-level
ChIJ51blEoYF0i0RArhtCfYXo28,JL G LEMPUYANG,-8.4261169,115.4778367,"HFFH+P67, North Duda, Selat, Karangasem Regency, Bali 80862, Indonesia",https://maps.google.com/?cid=8044299704901416962,OPERATIONAL,,hiking_area,"hiking_area, park",,,
ChIJCdmaLAEF0i0RUuiYL6a2AWU,Warung Kondra,-8.4264721,115.4795637,"Unnamed Road, HFFH+CR8, Amerta Bhuana, Kec. Selat, Kabupaten Karangasem, Bali 80862, Indonesia",https://maps.google.com/?cid=7278299297686808658,OPERATIONAL,,bar,bar,3.7,3,
ChIJEwyA4JkF0i0R0bNIEaE9beM,Rumah komang serina,-8.428170399999999,115.482292,"HFFJ+5WC, Jl. Gn. Lempuyang, Amerta Bhuana, Kec. Selat, Kabupaten Karangasem, Bali 80862, Indonesia",https://maps.google.com/?cid=16387822381060109265,OPERATIONAL,,private_guest_room,"private_guest_room, lodging",,,
ChIJh5XHtPoF0i0R6LwSmL_K0N0,Pondok Wayah Jati,-8.4272833,115.48239079999999,"North Duda, Selat, Karangasem Regency, Bali, Indonesia",https://maps.google.com/?cid=15983498001776819432,OPERATIONAL,,,lodging,,,
ChIJNfGNJQAF0i0RJntNIpqlP6Y,PONDOK SUSILA ARTA,-8.4246811,115.4824942,"HFGM+C4, North Duda, Selat, Karangasem Regency, Bali 80862, Indonesia",https://maps.google.com/?cid=11979475615247858470,OPERATIONAL,+62 852-3846-4978,,lodging,5,3,
ChIJ8yjN8NAE0i0Rt2ki1ckaaTg,Pondok I Nengah Puspa,-8.4223813,115.4831097,"HFHM+26X, Jl. Gn. Lempuyang, dusun abiantiing, Amerta Bhuana, Kec. Selat, Kabupaten Karangasem, Bali 80862, Indonesia",https://maps.google.com/?cid=4064809592845134263,OPERATIONAL,+62 858-1139-7419,,lodging,5,1,
