id,name,latitude,longitude,address,url,status,phone,primary-type,types,rating,rating-count,price-level
ChIJj18lLOIV0i0RoVR4rq5nuJ4,PURI AGENG BLAHBATUH,-8.5654957,115.3009142,"Jl. Wisma Udayana No.2X, Blahbatuh, Kec. Blahbatuh, Kabupaten Gianyar, Bali 80581, Indonesia",https://maps.google.com/?cid=11437005253656466593,OPERATIONAL,+62 877-6180-2845,cultural_center,"cultural_center, historical_landmark, performing_arts_theater, travel_agency, event_venue, museum",4.7,166,
ChIJr311kU4V0i0Rzcx4lrUVbA4,Mrs. Juwik's PorkRoll,-8.5659947,115.29749100000001,"C7MW+GWP, Blahbatuh, Gianyar Regency, Bali 80581, Indonesia",https://maps.google.com/?cid=1039229483673504973,OPERATIONAL,+62 819-9904-4921,brunch_restaurant,"brunch_restaurant, restaurant, food",4.1,44,
ChIJofw_2-AV0i0Rm5yYlwPVX9o,Pondok Wisata Istana Impian,-8.5672841,115.30476189999997,"Jl. Raya Tojan, C8M3+3WJ, Tojan, Blahabatu, Blahbatuh, Kec. Blahbatuh, Kabupaten Gianyar, Bali 80581, Indonesia",https://maps.google.com/?cid=15735529834460781723,OPERATIONAL,+62 878-6039-1747,hotel,"hotel, lodging",3.8,54,
ChIJ7WNBfeEV0i0RRADRbB_AsHI,Warung Pak Warka,-8.566280899999999,115.301588,"Jl. Kebo Iwa No.10, Blahbatuh, Kec. Blahbatuh, Kabupaten Gianyar, Bali 80581, Indonesia",https://maps.google.com/?cid=8264316557427015748,OPERATIONAL,,indonesian_restaurant,"indonesian_restaurant, restaurant, food",4.7,41,
ChIJT7dzZxUV0i0Rrft5PNjlGMU,Blahbatuh Royal Palace,-8.56537,115.30094869999999,"Jl. Wisma Udayana No.2X, Blahbatuh, Kec. Blahbatuh, Kabupaten Gianyar, Bali 80581, Indonesia",https://maps.google.com/?cid=14202354141803183021,OPERATIONAL,,,lodging,3,3,
ChIJ8aEIOeEV0i0RRtLQut6wTac,Leo Bale Pasti Villa,-8.5672976,115.3033272,"C8M3+38P, Blahbatuh, Gianyar Regency, Bali 80581, Indonesia",https://maps.google.com/?cid=12055486248204161606,OPERATIONAL,+62 822-3538-6896,private_guest_room,"private_guest_room, lodging",4,8,
ChIJkYcNG4AV0i0R2sCIzJECaWg,Kost murah,-8.5676366,115.30282679999999,"C8J3+W4W, Blahbatuh, Gianyar Regency, Bali 80581, Indonesia",https://maps.google.com/?cid=7523547477724152026,OPERATIONAL,,private_guest_room,"private_guest_room, lodging",5,1,
ChIJ-TIVruMV0i0R0cXetrwYB9s,Masakan Padang Sari Bundo Khas Pariaman,-8.5660775,115.29922029999999,"Jl. Wisma Gajah Mada No.27, Blahbatuh, Kec. Blahbatuh, Kabupaten Gianyar, Bali 80581, Indonesia",https://maps.google.com/?cid=15782610617944163793,OPERATIONAL,,indonesian_restaurant,"indonesian_restaurant, restaurant, food",4.5,40,
ChIJZyk1WKYV0i0Ra2pLIw_Qblw,ACK Blahbatuh,-8.566261299999999,115.301957,"Jl. Kebo Iwa No.14, Blahbatuh, Kec. Blahbatuh, Kabupaten Gianyar, Bali 80581, Indonesia",https://maps.google.com/?cid=6660489662362774123,OPERATIONAL,,restaurant,"restaurant, food",3.7,43,PRICE_LEVEL_INEXPENSIVE
ChIJw_kWaswV0i0REXklME1sa_E,MANIK SATE,-8.567232299999999,115.303127,"C8M3+472, Jl. Kapten Sujana, Blahbatuh, Kec. Blahbatuh, Kabupaten Gianyar, Bali 80581, Indonesia",https://maps.google.com/?cid=17396117064424716561,OPERATIONAL,+62 813-3772-0423,restaurant,"restaurant, food",4.7,7,
ChIJrZD-GOMV0i0RK9blOLEbepc,Warung Bakso Ayam & Babi Tiga Dewi,-8.5664267,115.29720059999998,"C7MW+CVG, Jl. Pantai Saba, Blahbatuh, Kec. Blahbatuh, Kabupaten Gianyar, Bali 80581, Indonesia",https://maps.google.com/?cid=10915067094863566379,OPERATIONAL,+62 821-4490-7550,cafe,"cafe, store, food",4.8,53,PRICE_LEVEL_INEXPENSIVE
ChIJGTW9NAoW0i0R9XrVzllp-KU,Puri Kanginan Jelantik Blahbatuh,-8.5655948,115.30244669999999,"Jl. Bisma No.4, Blahbatuh, Kec. Blahbatuh, Kabupaten Gianyar, Bali 80581, Indonesia",https://maps.google.com/?cid=11959424644925455093,OPERATIONAL,+62 822-3681-4379,historical_landmark,historical_landmark,4.9,10,
ChIJQZNcMF8V0i0RYam8ic-MOLw,Home krisna,-8.5674343,115.3017073,"Gg. Patih Jelantik No.6, Blahbatuh, Kec. Blahbatuh, Kabupaten Gianyar, Bali 80581, Indonesia",https://maps.google.com/?cid=13562745100823210337,OPERATIONAL,,hotel,"hotel, lodging",,,
ChIJw3uVbqoV0i0RIoEIHekol_s,Warung Restu Ibu,-8.5634964,115.30092379999999,"Jl. Wisma Udayana No.31, Blahbatuh, Kec. Blahbatuh, Kabupaten Gianyar, Bali 80581, Indonesia",https://maps.google.com/?cid=18129003806682808610,OPERATIONAL,,restaurant,"restaurant, food",4.8,5,
ChIJzbH0_hoV0i0RPKPYdIOs7Mk,AKY di Camantra,-8.5669039,115.30183459999999,"C8M2+6PP, Blahbatuh, Gianyar Regency, Bali 80581, Indonesia",https://maps.google.com/?cid=14550194176728277820,OPERATIONAL,+62 878-6971-0797,lodging,lodging,4.4,5,
ChIJzadB_mcV0i0Ro19_HAwDSG4,RUMAH MAKAN TALIWANG BLAHBATUH,-8.5660286,115.3045551,"Blahbatuh, Gianyar Regency, Bali 80815, Indonesia",https://maps.google.com/?cid=7946604893047840675,OPERATIONAL,+62 819-9902-0006,restaurant,"restaurant, food",,,
ChIJbS6HgdcV0i0RWrPcSFYG97o,Sate Babi Pak Doble,-8.564582399999999,115.30053470000001,"Jl. Pulau Bali No.42, Blahbatuh, Kec. Blahbatuh, Kabupaten Gianyar, Bali 80581, Indonesia",https://maps.google.com/?cid=13472243777961505626,OPERATIONAL,+62 823-3961-2226,restaurant,"restaurant, food",5,1,
ChIJlVI8dMoV0i0RyF_6VIS-QEU,Sate Wayan,-8.567730899999999,115.3023827,"Gg. Patih Jelantik No.6, Blahbatuh, Kec. Blahbatuh, Kabupaten Gianyar, Bali 80581, Indonesia",https://maps.google.com/?cid=4990197862697164744,OPERATIONAL,+62 821-4643-8304,restaurant,"restaurant, food",5,1,
ChIJldbjceEV0i0Rt2V89LD7RMM,Warung Segara Lebih,-8.566249899999999,115.30252379999999,"C8M3+G22, Jl. Kebo Iwa, Blahbatuh, Kec. Blahbatuh, Kabupaten Gianyar, Bali 80581, Indonesia",https://maps.google.com/?cid=14070647873246881207,OPERATIONAL,+62 819-1662-3572,indonesian_restaurant,"indonesian_restaurant, restaurant, food",4.3,6,
ChIJ7XCOv2MV0i0RuU6xlw3OiBw,Lawar sapi,-8.5682335,115.29900269999999,"Jl. Kapten Japa No.20, Blahbatuh, Kec. Blahbatuh, Kabupaten Gianyar, Bali 80581, Indonesia",https://maps.google.com/?cid=2056119787669507769,OPERATIONAL,,indonesian_restaurant,"indonesian_restaurant, restaurant, food",5,1,
