id,name,latitude,longitude,address,url,status,phone,primary-type,types,rating,rating-count,price-level
ChIJAYOC0MQR0i0RxREOJG27Ytg,Sunset/-Sunrise Spot,-8.4997496,115.37982849999999,"G92H+4W, Aan, Banjarangkan, Klungkung Regency, Bali 80716, Indonesia",https://maps.google.com/?cid=15592230937340809669,OPERATIONAL,,tourist_attraction,tourist_attraction,3.7,3,
ChIJ0eJEZEoX0i0Rb8t71-yE1UA,Sukanta Wahyu Sculpture Park,-8.4973087,115.3744888,"G93F+3QH, Banjar Sengkiding, Aan, Kec. Banjarangkan, Kabupaten Klungkung, Bali 80752, Indonesia",https://maps.google.com/?cid=4671786341229120367,OPERATIONAL,+62 812-3809-775,museum,museum,5,25,
ChIJqxil9IoR0i0Rxsc37ztZWek,Gebyug Waterfall,-8.496990499999999,115.3790801,"Banjar Adat Sengkiding, Aan, Kec. Banjarangkan, Kabupaten Klungkung, Bali 80716, Indonesia",https://maps.google.com/?cid=16814568797715810246,OPERATIONAL,,amusement_park,amusement_park,,,
ChIJ4SUIq0sX0i0Rale0EoYF8j0,Warung Makan Sederhana,-8.494844500000001,115.3753696,"G94G+349, Jl. Raya Timuhun, Nyanglan, Kec. Banjarangkan, Kabupaten Klungkung, Bali 80752, Indonesia",https://maps.google.com/?cid=4463636254075148138,OPERATIONAL,+62 877-6161-5848,indonesian_restaurant,"indonesian_restaurant, restaurant, food",4,2,
ChIJh6xcjJYX0i0RTW65GSNwdWE,Warung Buk Made,-8.492797,115.3759688,"G94G+V9Q, Aan, Banjarangkan, Klungkung Regency, Bali 80752, Indonesia",https://maps.google.com/?cid=7022642490011905613,OPERATIONAL,,restaurant,"restaurant, food",5,1,
