id,name,latitude,longitude,address,url,status,phone,primary-type,types,rating,rating-count,price-level
ChIJhbOSby_w0S0RhkjvdllYsz8,Gede's Homestay,-8.1583355,115.43702420000001,"Tembok, Tejakula, Buleleng Regency, Bali 81173, Indonesia",https://maps.google.com/?cid=4590109586491394182,OPERATIONAL,+62 813-3760-2658,hotel,"hotel, lodging",4.8,41,
ChIJn1b_uSjx0S0Rn1ZB9PZkcv0,Kelapa Resort,-8.1593924,115.43863530000002,"RCRQ+6FR, Jl. Tejakula - Tianyar, Les, Kec. Tejakula, Kabupaten Buleleng, Bali 81173, Indonesia",https://maps.google.com/?cid=18262770450763437727,OPERATIONAL,,hotel,"hotel, lodging",5,5,
ChIJ_cV92KPx0S0RDdC5HblL2B4,Demplot Sayur Desa Tembok,-8.1601771,115.4359885,"RCQP+W9H, Jl. Bukit Sangsane, Tembok, Kec. Tejakula, Kabupaten Buleleng, Bali 81173, Indonesia",https://maps.google.com/?cid=2222609674547089421,OPERATIONAL,+62 878-8184-9632,park,park,5,5,
ChIJrx67w3bx0S0RxN7vxmmXxJs,Coconut Resort,-8.159358899999999,115.4386031,"RCRQ+7C5, Jl. Tejakula - Tianyar, Les, Kec. Tejakula, Kabupaten Buleleng, Bali 81173, Indonesia",https://maps.google.com/?cid=11224262651879087812,OPERATIONAL,+62 812-3847-123,hotel,"hotel, lodging",5,1,
ChIJgYfxd-Lx0S0RBbhpUFAInJM,PONDOK KUVUKILAND,-8.1582204,115.43540779999998,"RCRP+P57, Jl. Bukit Sangsane, Tembok, Kec. Tejakula, Kabupaten Buleleng, Bali 81173, Indonesia",https://maps.google.com/?cid=10636385560981780485,OPERATIONAL,+62 812-3711-0005,hotel,"hotel, lodging",,,
