id,name,latitude,longitude,address,url,status,phone,primary-type,types,rating,rating-count,price-level
ChIJA5ASpj0T0i0RQWO2Wdc8_hQ,Kost SanDita,-8.5678451,115.39734510000001,"C9JW+VW9, Satra, Klungkung, Klungkung Regency, Bali 80716, Indonesia",https://maps.google.com/?cid=1512713420463825729,OPERATIONAL,+62 812-4678-0909,extended_stay_hotel,"extended_stay_hotel, hotel, lodging",4.3,17,
ChIJX1SCcXkT0i0RoanT6_A5_f4,Bali 283,-8.5686784,115.39936549999999,"C9JX+GPH, Jl. Prof. Dr. Ida Bagus Mantra, Tojan, Kec. Klungkung, Kabupaten Klungkung, Bali, Indonesia",https://maps.google.com/?cid=18373905761652943265,OPERATIONAL,+62 821-4415-5239,restaurant,"restaurant, food",5,2,
ChIJj66xeMIT0i0RJcpfwbi6tQA,Warung Lawar Godel Buk Peng,-8.5691046,115.4023264,"Jl.Bay Pass Prof.Ida Bagus Mantra, CCJ2+9W4, Jumpai, Kec. Klungkung, Kabupaten Klungkung, Bali 80716, Indonesia",https://maps.google.com/?cid=51152273465657893,OPERATIONAL,+62 878-6156-5168,restaurant,"restaurant, food",3.9,16,
ChIJY2DallwT0i0RiZjKymfYQMM,Warung makan lawar pak tut Muncrut,-8.5692364,115.40054060000001,"CCJ2+863, Jl. Prof. Dr. Ida Bagus Mantra, Gelgel, Kec. Klungkung, Kabupaten Klungkung, Bali, Indonesia",https://maps.google.com/?cid=14069483176200935561,OPERATIONAL,,restaurant,"restaurant, food",,,
ChIJDxttzekT0i0RPPwEqe5R-wY,Warung Jawa Jember Mbak Laila,-8.5689329,115.4014456,"CCJ2+CHG, Jl. Prof. Dr. Ida Bagus Mantra, Gelgel, Kec. Klungkung, Kabupaten Klungkung, Bali, Indonesia",https://maps.google.com/?cid=503085868861684796,OPERATIONAL,,indonesian_restaurant,"indonesian_restaurant, restaurant, food",5,1,
ChIJyzZlNWET0i0RCH4vMWmn6_k,Warung Lalapan Mbak Daa,-8.5688216,115.40107189999999,"Jl. Prof. Dr. Ida Bagus Mantra, Tojan, Kec. Klungkung, Kabupaten Klungkung, Bali, Indonesia",https://maps.google.com/?cid=18008671605209660936,OPERATIONAL,,indonesian_restaurant,"indonesian_restaurant, restaurant, food",5,1,
ChIJX_H2lxwT0i0RI7KPEUhj-Vg,WAROENG WANTAYAS,-8.568160899999999,115.3980668,"C9JX+P68, Satra, Klungkung, Klungkung Regency, Bali 80716, Indonesia",https://maps.google.com/?cid=6411264705722036771,OPERATIONAL,+62 812-5345-8809,coffee_shop,"coffee_shop, cafe, store, food",,,
ChIJ8YmM-OgT0i0RK3747z6YBVg,Lalapan Bali,-8.568495100000002,115.3992342,"C9JX+JM5, Jl. Prof. Dr. Ida Bagus Mantra, Tojan, Kec. Klungkung, Kabupaten Klungkung, Bali 80716, Indonesia",https://maps.google.com/?cid=6342643046302645803,OPERATIONAL,,restaurant,"restaurant, food",,,
