id,name,latitude,longitude,address,url,status,phone,primary-type,types,rating,rating-count,price-level
ChIJZ7s1gUIj0i0RpJe0WNaJmLw,Pengempu Waterfall,-8.469335,115.20346649999999,"G6J3+798, Jl. Seribupati, Cau Belayu, Kec. Marga, Kabupaten Tabanan, Bali 82181, Indonesia",https://maps.google.com/?cid=13589763429294708644,OPERATIONAL,,tourist_attraction,tourist_attraction,4.2,650,
ChIJPUKsp0Qj0i0RE4iepXlf5TQ,100% Sukla Balinese Meatball,-8.4744615,115.2018737,"G6G2+6P9, Jl. Abimanyu, Sembung, Kec. Mengwi, Kabupaten Badung, Bali 80351, Indonesia",https://maps.google.com/?cid=3811557635713304595,OPERATIONAL,+62 853-3911-6154,indonesian_restaurant,"indonesian_restaurant, restaurant, food",4.5,725,PRICE_LEVEL_INEXPENSIVE
ChIJeZR3QFwj0i0RwqQOXMmx75Y,Babi Guling Men War Sembung,-8.473238199999999,115.199179,"G5GX+PM3, Jl. Abimanyu, Sembung, Kec. Mengwi, Kabupaten Badung, Bali 80351, Indonesia",https://maps.google.com/?cid=10876107103514043586,OPERATIONAL,+62 821-8805-4096,indonesian_restaurant,"indonesian_restaurant, restaurant, food",4.2,11,
ChIJSzHIF80j0i0RiNoM3HbzfgA,Angkringanku 7172,-8.4747258,115.2023791,"Jl. Abimanyu, Cau Belayu, Kec. Marga, Kabupaten Tabanan, Bali 82181, Indonesia",https://maps.google.com/?cid=35733538889063048,OPERATIONAL,,indonesian_restaurant,"indonesian_restaurant, restaurant, food",5,1,
ChIJSU85CcIj0i0RvGGdEcDyZ00,Warung Bu Nanik,-8.4740362,115.2010713,"G6G2+9CP, Jl. Abimanyu, Sembung, Kec. Mengwi, Kabupaten Badung, Bali 82181, Indonesia",https://maps.google.com/?cid=5577693570264818108,OPERATIONAL,+62 857-3848-2808,indonesian_restaurant,"indonesian_restaurant, restaurant, food",,,
ChIJw9je1tAj0i0Ro1CQMyevaXM,Warung Bu Nyole,-8.4744373,115.20246270000001,"Jl. Abimanyu No.551, Sembung, Kec. Mengwi, Kabupaten Badung, Bali 82181, Indonesia",https://maps.google.com/?cid=8316370769820012707,OPERATIONAL,,indonesian_restaurant,"indonesian_restaurant, restaurant, food",5,1,
ChIJj-sZTI8j0i0Rilmfc2zJNMs,Warung Sate De' Pope,-8.4748627,115.20239099999999,"G6G2+3X2, Jl. Abimanyu, Cau Belayu, Kec. Marga, Kabupaten Tabanan, Bali 82181, Indonesia",https://maps.google.com/?cid=14642549756121799050,OPERATIONAL,+62 812-3738-6473,indonesian_restaurant,"indonesian_restaurant, restaurant, food",5,4,
ChIJra_sn14j0i0RaGA0dIsJwC8,Warung Makan Bu Dewa Sembung,-8.473652,115.1990983,"G5GX+GJQ, Jl. Abimanyu, Sembung, Kec. Mengwi, Kabupaten Badung, Bali 80351, Indonesia",https://maps.google.com/?cid=3440760609865752680,OPERATIONAL,+62 812-4607-6541,restaurant,"indonesian_restaurant, restaurant, food",,,
ChIJHUhzmUQj0i0R04wuxhUALCE,Warung Buk Geper,-8.4745891,115.2025355,"G6G3+527, Jl. Abimanyu, Mengwi, Kec. Mengwi, Kabupaten Tabanan, Bali 80351, Indonesia",https://maps.google.com/?cid=2390285595746143443,OPERATIONAL,+62 812-3996-6186,restaurant,"restaurant, food",5,1,
ChIJwUk0Ygkj0i0Rvn761hiXsno,Warung Bu Bintang,-8.474349499999999,115.2015619,"G6G2+7J7, Jl. Abimanyu, Sembung, Kec. Mengwi, Kabupaten Badung, Bali 82181, Indonesia",https://maps.google.com/?cid=8841295151423454910,CLOSED_TEMPORARILY,,restaurant,"restaurant, food",,,
ChIJ8aOoKsUj0i0RWYJoeJhUklc,Kedai 777,-8.4748202,115.20240179999999,"Jl. Raya Sangeh, Cau Belayu, Kec. Marga, Kabupaten Badung, Bali 80361, Indonesia",https://maps.google.com/?cid=6310199041731363417,OPERATIONAL,+62 812-4636-7358,indonesian_restaurant,"indonesian_restaurant, restaurant, food",5,2,
ChIJoRn60aoj0i0R60c3ZnBWra0,Berut Pigeon Racing,-8.4767987,115.2000278,"Cau Belayu, Marga, Tabanan Regency, Bali 82181, Indonesia",https://maps.google.com/?cid=12514753980283701227,OPERATIONAL,+62 812-3766-2155,tourist_attraction,tourist_attraction,5,1,
