id,name,latitude,longitude,address,url,status,phone,primary-type,types,rating,rating-count,price-level
ChIJVbhtMjUn0i0RUj3B9w6iPYA,Hidden Garden Agriculture,-8.3507449,115.1888769,"Jl. Baturiti - Mekarsari, Mekarsari, Kec. Baturiti, Kabupaten Tabanan, Bali 82191, Indonesia",https://maps.google.com/?cid=9240720195604004178,OPERATIONAL,+62 821-4653-9557,tourist_attraction,"tourist_attraction, coffee_shop, cafe, store, food, wholesaler",4.3,646,
ChIJd99LpEwn0i0Rp57cL6TC-w8,Pure Luwak Coffee Bali,-8.345128599999999,115.187692,"M53Q+W3W, Baturiti, Tabanan Regency, Bali 82191, Indonesia",https://maps.google.com/?cid=1151728140156706471,OPERATIONAL,+62 877-6009-0683,coffee_shop,"coffee_shop, cafe, store, food",4.3,204,
ChIJZYLnZ7Mn0i0RVXPeDD5FmQ4,Betutu Bu Jero Gilimanuk,-8.3473316,115.18740329999999,"M53P+3X6, Jl. Mekarsari - Baturiti Bedugul Jl. Raya Bedugul, Baturiti, Kec. Baturiti, Kabupaten Tabanan, Bali 82191, Indonesia",https://maps.google.com/?cid=1051948120773915477,OPERATIONAL,,restaurant,"restaurant, food",3.7,9,
ChIJjWMacWAn0i0REnvNXq5eOGA,KEDAI AKP,-8.3477301,115.18780679999999,"Jl. Mekarsari - Baturiti Bedugul, Baturiti, Kec. Baturiti, Kabupaten Tabanan, Bali 82191, Indonesia",https://maps.google.com/?cid=6933395729344723730,OPERATIONAL,,coffee_shop,"coffee_shop, cafe, store, food",5,2,
ChIJw-m6BIwn0i0RFTpU0ZjyY2Y,AJK,-8.3476024,115.18769700000001,"M52Q+X32, Baturiti, Tabanan Regency, Bali 82191, Indonesia",https://maps.google.com/?cid=7378007352723913237,OPERATIONAL,,indonesian_restaurant,"indonesian_restaurant, restaurant, food",4.5,4,
ChIJidki5Q8n0i0RkKQPdEFiRNs,Rm Sambal Granat Super Pedas,-8.3450896,115.1876879,"M53Q+X38, Jl. Baturiti - Mekarsari, Mekarsari, Kec. Baturiti, Kabupaten Tabanan, Bali 82191, Indonesia",https://maps.google.com/?cid=15799861425982121104,OPERATIONAL,+62 858-5761-9099,restaurant,"restaurant, food",,,
ChIJlfXmQM0g0i0R1ZKDgqEKMic,Warung Men Gede,-8.3451112,115.18769589999998,"M53Q+X34, Jl. Baturiti - Mekarsari, Baturiti, Kec. Baturiti, Kabupaten Tabanan, Bali 82191, Indonesia",https://maps.google.com/?cid=2824331605110395605,CLOSED_TEMPORARILY,+62 858-5761-9099,restaurant,"restaurant, food",,,
ChIJdWVqQUsn0i0RHwryYvVCLbw,Warung Arjuna,-8.3451021,115.1876873,"Baturiti, Tabanan Regency, Bali, Indonesia",https://maps.google.com/?cid=13559567674776881695,OPERATIONAL,,restaurant,"restaurant, food",,,
