id,name,latitude,longitude,address,url,status,phone,primary-type,types,rating,rating-count,price-level
ChIJc2-OyK8Z0i0RNm7pmYEYK6k,Bubble Hotel Bali Ubud,-8.4416736,115.3014041,"Jl. Raya Uma, Tampaksiring, Kec. Tampaksiring, Kabupaten Gianyar, Bali 80552, Indonesia",https://maps.google.com/?cid=12189863761320439350,OPERATIONAL,+380 50 103 2478,hotel,"hotel, lodging",4.1,116,
ChIJSUHmGGEZ0i0RZY2rhclUqOU,Umatreehouse,-8.4412453,115.3042909,"Banjar eha, Tampaksiring, Kec. Tampaksiring, Kabupaten Gianyar, Bali 80552, Indonesia",https://maps.google.com/?cid=16548570055280659813,OPERATIONAL,,,lodging,4.9,26,
ChIJwTkpfooY0i0RMxVg3HX3mOA,Kumba One,-8.4416522,115.30447129999999,"Jl. Raya Uma Gg. Kumba Ayu No.10, Tampaksiring, Kec. Tampaksiring, Kabupaten Gianyar, Bali 80552, Indonesia",https://maps.google.com/?cid=16183957346536396083,OPERATIONAL,+62 813-3716-6884,lodging,lodging,4.9,12,
ChIJcycJqvIZ0i0R3oO3aR66S2k,Griya EHA TAMPAKSIRING,-8.4416842,115.3028166,"H853+84G, Jl. Raya Uma, Tampaksiring, Kec. Tampaksiring, Kabupaten Gianyar, Bali 80552, Indonesia",https://maps.google.com/?cid=7587362637021152222,OPERATIONAL,,private_guest_room,"private_guest_room, lodging",4.8,4,
ChIJJx0CIPUZ0i0RYP4pSqOmXDk,Subak Kulu,-8.4439669,115.30351160000001,"H843+CC6, Tampaksiring, Gianyar Regency, Bali, Indonesia",https://maps.google.com/?cid=4133361778273418848,OPERATIONAL,,tourist_attraction,tourist_attraction,5,7,
ChIJuWaGRgAZ0i0RTP4XLEHOvrY,Uma Bali,-8.439125599999999,115.3014872,"H862+8H, Tampaksiring, Gianyar Regency, Bali, Indonesia",https://maps.google.com/?cid=13168189139785875020,OPERATIONAL,+62 812-1610-178,private_guest_room,"private_guest_room, lodging",5,1,
ChIJL9dQCYoY0i0RxCsZoljC2ew,Cucu I Pekak Lan I Dadong,-8.4417733,115.3026593,"H853+73V, Jl. Raya Uma, Tampaksiring, Kec. Tampaksiring, Kabupaten Gianyar, Bali 80552, Indonesia",https://maps.google.com/?cid=17066885948829674436,OPERATIONAL,+62 82144046,restaurant,"restaurant, food",3.4,5,
ChIJzdQMfEAZ0i0Rz9tIBhy8LuU,MERANGGI FARM,-8.4382021,115.29890119999997,"H76X+PH6, Jl. Raya Uma, Tampaksiring, Kec. Tampaksiring, Kabupaten Gianyar, Bali 80552, Indonesia",https://maps.google.com/?cid=16514343712164731855,OPERATIONAL,+62 819-9943-6379,farmstay,"farmstay, lodging",1,1,
