id,name,latitude,longitude,address,url,status,phone,primary-type,types,rating,rating-count,price-level
ChIJwVYCt3WG0S0RiTCymlWHzi0,Red Coral Munduk Waterfall,-8.2580905,115.0698271,"Munduk, Banjar, Buleleng Regency, Bali 81152, Indonesia",https://maps.google.com/?cid=3300724378646491273,OPERATIONAL,,tourist_attraction,tourist_attraction,4.5,264,
ChIJO3QBdHSG0S0RVg_gj6X6xJE,Adila Warung and homestay,-8.2615298,115.06631850000001,"Munduk, Banjar, Buleleng Regency, Bali 81152, Indonesia",https://maps.google.com/?cid=10503795819925213014,OPERATIONAL,+62 819-3655-1226,hotel,"hotel, lodging, restaurant, food",4.8,306,
ChIJe0F_LXSG0S0RM1H_F7u2LmA,Labuhan Kebo Waterfalls,-8.259333900000001,115.06511519999998,"Banyuatis, Banjar, Buleleng Regency, Bali 81152, Indonesia",https://maps.google.com/?cid=6930677791247520051,OPERATIONAL,,park,park,4.8,120,
ChIJ3xkhO3uG0S0R9IFMQYKHaFw,Warung Made's Munduk,-8.261662200000002,115.06893830000001,"Munduk, Banjar, Buleleng Regency, Bali 81161, Indonesia",https://maps.google.com/?cid=6658721042578309620,OPERATIONAL,+62 852-3745-7641,indonesian_restaurant,"indonesian_restaurant, restaurant, food",4.9,424,PRICE_LEVEL_INEXPENSIVE
ChIJrQZa5BCG0S0RpxYvhN2X5dE,Melanting Cottages,-8.261608100000002,115.06551680000001,"Buleleng Desa No.Kel, P3Q8+962, Munduk, Kec. Banjar, Kabupaten Buleleng, Bali 81152, Indonesia",https://maps.google.com/?cid=15124661901254923943,OPERATIONAL,+62 851-0000-5266,hotel,"hotel, lodging",4.2,38,
ChIJ5U7DSXKG0S0RK7Iimtmv0io,Villa Dua Bintang,-8.264569999999999,115.0659232,"P3P8+59F, Jl. Batu Galih, Munduk, Kec. Banjar, Kabupaten Buleleng, Bali 81152, Indonesia",https://maps.google.com/?cid=3085722043830940203,OPERATIONAL,+62 813-3950-1575,lodging,lodging,4.7,121,
ChIJfft1mW2H0S0RlY2k4JUYaAc,munduk clove,-8.2626285,115.06465229999998,"Jl. Kayu Putih - Munduk, Munduk, Kec. Banjar, Kabupaten Buleleng, Bali 81152, Indonesia",https://maps.google.com/?cid=533703587841478037,OPERATIONAL,+62 818-0567-8672,campground,"campground, lodging, park",4.9,67,
ChIJoWJxZHyG0S0RsZhEzrBrpUo,"Bali Jegeg Munduk, Hotel, Bar and Restaurant",-8.2607546,115.0689636,"Jl. Kayu Putih - Munduk, Munduk, Kec. Banjar, Kabupaten Buleleng, Bali 81152, Indonesia",https://maps.google.com/?cid=5378823737082943665,OPERATIONAL,+62 812-3672-9999,hotel,"hotel, bar, lodging, restaurant, food",4,121,
ChIJrwdnNguG0S0RJrphp-v-Dcc,Arya Utama Garden Villa,-8.2599334,115.07081349999999,"P3RC+28G, Jln raya Mnduk, Munduk, Kec. Banjar, Kabupaten Buleleng, Bali 81152, Indonesia",https://maps.google.com/?cid=14343400676323867174,OPERATIONAL,+62 857-3925-7566,guest_house,"guest_house, lodging",4.4,96,
ChIJXRTgPguG0S0RBZOlnq6g0uw,Puri Sunset Homestay,-8.259789399999999,115.07158659999999,"Jl. Raya, Munduk, Kec. Banjar, Kabupaten Buleleng, Bali 81152, Indonesia",https://maps.google.com/?cid=17064878609906635525,OPERATIONAL,+62 813-3832-5575,lodging,"lodging, bed_and_breakfast",4.5,84,
ChIJe4BdbI6H0S0RQ0Lm-3yV4so,"Clove House, Munduk",-8.2593848,115.07060899999998,"P3RC+66X, Munduk, Banjar, Buleleng Regency, Bali 81152, Indonesia",https://maps.google.com/?cid=14619411704432706115,OPERATIONAL,+62 819-1602-0825,hotel,"hotel, lodging",4.7,20,
ChIJGbOB5XOG0S0R99DKUTImVw4,Warung Kadirasa,-8.2625758,115.0651513,"Jl. Kayu Putih - Munduk, Munduk, Kec. Banjar, Kabupaten Buleleng, Bali 81152, Indonesia",https://maps.google.com/?cid=1033336637067284727,OPERATIONAL,+62 813-5355-1498,indonesian_restaurant,"indonesian_restaurant, restaurant, food",4.8,146,PRICE_LEVEL_INEXPENSIVE
ChIJMZyrEm-H0S0RE2NQn0mhxbs,Munduk Sena,-8.2628921,115.065787,"Batugalih, Jln Raya, Munduk, Kec. Banjar, Kabupaten Buleleng, Bali 81152, Indonesia",https://maps.google.com/?cid=13530397993082053395,OPERATIONAL,+62 857-3819-0052,hotel,"hotel, lodging",5,15,
ChIJVy1eDLaH0S0Rz8Nx__p6oK8,Warung TEDUH MUNDUK,-8.2617633,115.0686211,"Warung teduh, Jl. Kayu Putih - Munduk, Munduk, Kec. Banjar, Kabupaten Buleleng, Bali 81152, Indonesia",https://maps.google.com/?cid=12655250171357152207,OPERATIONAL,+62 822-1327-1510,restaurant,"restaurant, food",4.9,73,PRICE_LEVEL_INEXPENSIVE
ChIJNfausgmH0S0RkRviIP101MU,Red land warung munduk,-8.2606498,115.06844919999999,"P3Q9+P9, Munduk, Banjar, Buleleng Regency, Bali, Indonesia",https://maps.google.com/?cid=14255147351061699473,OPERATIONAL,+62 813-3777-1563,brunch_restaurant,"brunch_restaurant, restaurant, food",4.5,33,
ChIJOWN922OH0S0RR6Yj8YsZKgQ,R&R Coffee Corner,-8.2589275,115.06668289999999,"Gobleg, Kec. Banjar, Kabupaten Buleleng, Bali 81152, Indonesia",https://maps.google.com/?cid=300080414010353223,OPERATIONAL,+62 877-6284-5111,cafe,"cafe, food",5,64,
ChIJwQMnm7SH0S0R2lYrJKhjbW4,Munduk V View House Arrival,-8.2607444,115.0718834,"P3RC+3JP, Jl. Raya, Munduk, Kec. Banjar, Kabupaten Buleleng, Bali 81152, Indonesia",https://maps.google.com/?cid=7957125690446010074,OPERATIONAL,,private_guest_room,"private_guest_room, lodging",,,
ChIJkytzC3SG0S0RSw3utccQwxE,Melanting Resort,-8.261342299999999,115.06605770000002,"Desa Munduk, Kec. Banjar, Kab. Buleleng Singaraja 81152, Munduk, Kabupaten Buleleng, Bali 81152, Indonesia",https://maps.google.com/?cid=1279885169040166219,OPERATIONAL,,resort_hotel,"resort_hotel, hotel, lodging, spa",4.1,15,
ChIJ22kXpRaH0S0RMo9-D0lxH6E,"Warung Amerta Sari, Desa Gobleg",-8.2585093,115.0662097,"Jl. Air Terjun Melanting, Gobleg, Kec. Banjar, Kabupaten Buleleng, Bali 81152, Indonesia",https://maps.google.com/?cid=11610122922990931762,OPERATIONAL,+62 822-3740-2686,restaurant,"restaurant, food",5,37,
ChIJ7SbrbiOH0S0REJ1tP2AZwPk,THE MELANTING Food Drink & View,-8.2588782,115.06524979999999,"P3R8+C3X, Jl. Air Terjun Melanting, Gobleg, Kec. Banjar, Kabupaten Buleleng, Bali 81152, Indonesia",https://maps.google.com/?cid=17996412012144205072,OPERATIONAL,+62 852-8007-3836,coffee_shop,"coffee_shop, cafe, store, food",5,198,
