id,name,latitude,longitude,address,url,status,phone,primary-type,types,rating,rating-count,price-level
ChIJizVIrbPx0S0RgdZf-n3N9x8,Kintamani ATV,-8.2163565,115.3821766,"Jl. Tabu, Songan A, Kec. Kintamani, Kabupaten Bangli, Bali 80652, Indonesia",https://maps.google.com/?cid=2303535675378488961,OPERATIONAL,+62 818-1876-5548,tourist_attraction,tourist_attraction,4.8,19,
ChIJfwcxbkXx0S0RvQDlKlcof3k,Warung Bu Rani,-8.216143299999999,115.384169,"Jl. Tabu, Songan A, Kec. Kintamani, Kabupaten Bangli, Bali 80652, Indonesia",https://maps.google.com/?cid=8754760555478450365,OPERATIONAL,,brunch_restaurant,"brunch_restaurant, restaurant, food",5,1,
ChIJkUTm_djx0S0Rgh5rKhvkfJw,Pupuan Panorama,-8.2102678,115.3881567,"Unnamed Road, Q9QQ+V7V, Pinggan, Kec. Kintamani, Kabupaten Bangli, Bali 80652, Indonesia",https://maps.google.com/?cid=11276138372355792514,OPERATIONAL,+62 831-1561-9335,campground,"campground, park, lodging",5,8,
ChIJNZvySCDz0S0R1Kpqw9pwc7U,Bali Bagus Trekking,-8.216198,115.38329820000001,"Jl. Tabu No.Br, Songan A, Kec. Kintamani, Kabupaten Bangli, Bali 80625, Indonesia",https://maps.google.com/?cid=13074918228070410964,OPERATIONAL,+62 812-3918-9832,hiking_area,"hiking_area, park",5,5,
ChIJuTi6xL_x0S0RToCBNvMA14c,Home jero mang de,-8.214350699999999,115.3880167,"Q9PQ+76, Songan A, Kintamani, Bangli Regency, Bali, Indonesia",https://maps.google.com/?cid=9788293359704571982,OPERATIONAL,,,lodging,1,1,
ChIJNxkaSkbx0S0RK6me3NbVjbY,Mount Batur Sunrise And Breakfat on the top,-8.2164313,115.38215450000001,"Jl. Tabu, Songan A, Kec. Kintamani, Kabupaten Bangli, Bali 80652, Indonesia",https://maps.google.com/?cid=13154405205420189995,OPERATIONAL,+62 821-1770-4335,hiking_area,"hiking_area, park",5,2,
ChIJXXbXVtrx0S0RD8_tG4wzDLU,Jero gedearda,-8.2162273,115.3821846,"Q9MR+3WQ, Jl. Tabu, songan b, Kec. Kintamani, Kabupaten Bangli, Bali 80652, Indonesia",https://maps.google.com/?cid=13045858897442492175,OPERATIONAL,,hiking_area,"hiking_area, park",,,
