id,name,latitude,longitude,address,url,status,phone,primary-type,types,rating,rating-count,price-level
ChIJbRJYJ1050i0Rh1Ju3SI8fts,BAKSO BALUNG SLINGSING,-8.6064848,115.14671429999999,"Cepaka, Kediri, Tabanan Regency, Bali, Indonesia",https://maps.google.com/?cid=15816145061813310087,OPERATIONAL,+62 813-5355-3868,restaurant,"restaurant, food",4.4,135,PRICE_LEVEL_INEXPENSIVE
ChIJgRHTxiU90i0RLQKYKnnR9Ak,Skyspace Villas Bali,-8.60623,115.15277180000001,"Jl. Penganyutan, Banjar pasekan, Buduk, Kec. Mengwi, Kabupaten Badung, Bali 80361, Indonesia",https://maps.google.com/?cid=717428558994604589,OPERATIONAL,+62 819-9900-6738,hotel,"hotel, lodging",4.7,31,
ChIJE7WL0x850i0RF5flo85lIXs,Wintara Homestay,-8.6054747,115.14992300000002,"Jl. Raya Munggu-Kapal Gg. D. Sawah No.7, Cepaka, Kec. Kediri, Kabupaten Tabanan, Bali 80351, Indonesia",https://maps.google.com/?cid=8872484679083988759,OPERATIONAL,+62 813-5319-5422,guest_house,"guest_house, lodging",4.7,23,
ChIJlQ9TXiQ50i0RHqmyDovf_NY,Morgy’s Castle,-8.604051799999999,115.1493864,"Cepaka, Kediri, Tabanan Regency, Bali 80351, Indonesia",https://maps.google.com/?cid=15491502606587701534,OPERATIONAL,,,lodging,5,2,
ChIJjTFKipU50i0RMiZ2b7I0494,Tante Memey’s,-8.6032462,115.14739290000001,"94WW+PX2, Cepaka, Kediri, Tabanan Regency, Bali, Indonesia",https://maps.google.com/?cid=16060738637112157746,OPERATIONAL,,park,park,3.7,3,
ChIJPW8QnBk50i0RUJkvqeb4UrU,Soto Ayam Surabaya,-8.607039,115.15094499999998,"Jl. Raya Munggu No.168, Buduk, Kec. Mengwi, Kabupaten Badung, Bali 80351, Indonesia",https://maps.google.com/?cid=13065779138519865680,OPERATIONAL,,indonesian_restaurant,"indonesian_restaurant, restaurant, food",5,1,
ChIJ1zycsgU50i0RMLJD9xHyVqI,Selamat Datang Di Bakso Dami,-8.6063966,115.149463,"Jl. Raya Munggu No.234A, Cepaka, Kec. Kediri, Kabupaten Tabanan, Bali 80351, Indonesia",https://maps.google.com/?cid=11697803241118216752,OPERATIONAL,+62 822-4712-7700,indonesian_restaurant,"indonesian_restaurant, restaurant, food",4.7,22,
ChIJo_pp46450i0RLe_XQnqrrW4,Casa Cepaka,-8.6052868,115.14995739999999,"Jl. Raya Munggu Gg. D. Sawah, Cepaka, Kec. Kediri, Kabupaten Tabanan, Bali 80351, Indonesia",https://maps.google.com/?cid=7975219056738823981,CLOSED_TEMPORARILY,+62 877-2210-2202,private_guest_room,"private_guest_room, lodging",1.7,3,
ChIJ79T2aK450i0RHEXscrZbZe4,ACK Selingsing,-8.606357299999999,115.14735569999999,"94VX+C3M, Jl. Raya Munggu-Kapal, Munggu, Kec. Mengwi, Kabupaten Badung, Bali 80351, Indonesia",https://maps.google.com/?cid=17178237192844887324,OPERATIONAL,+62 822-6651-5749,fast_food_restaurant,"fast_food_restaurant, restaurant, food",4.1,13,
ChIJMeJ1ssM50i0RRsre-4H3E1Q,Lingkungan Taman,-8.603398199999999,115.14692760000001,"94WW+JQV, Cepaka, Kediri, Tabanan Regency, Bali 80351, Indonesia",https://maps.google.com/?cid=6058458061391972934,OPERATIONAL,,park,park,5,4,
ChIJhZ6a4wU50i0RafAK7cTOoQQ,BaksoGong Selingsing,-8.606208300000002,115.14743759999999,"Jl. Raya Munggu-Kapal, Cepaka, Kec. Kediri, Kabupaten Tabanan, Bali 80351, Indonesia",https://maps.google.com/?cid=333775192587956329,OPERATIONAL,+62 821-4698-1485,indonesian_restaurant,"indonesian_restaurant, restaurant, food",4.5,28,
ChIJf3AA1lA50i0RPAvWl5uSQwA,KURNIA MARKET BALI (UD KURNIA Frozen Food & Ayam Potong),-8.6064341,115.15260370000001,"Jl. Raya Munggu-Kapal, Buduk, Kec. Mengwi, Kabupaten Badung, Bali 80351, Indonesia",https://maps.google.com/?cid=19020020404587324,OPERATIONAL,+62 813-3871-3316,supermarket,"supermarket, grocery_store, farm, store, restaurant, food",5,1,
ChIJgT3nG3850i0RP8qMa0Vnzdg,Rumah Guzel,-8.6042226,115.14928619999998,"Jl. Raya Munggu-Kapal Gg. Umasari No.99, Cepaka, Kec. Kediri, Kabupaten Tabanan, Bali 80351, Indonesia",https://maps.google.com/?cid=15622256230272911935,OPERATIONAL,,,lodging,4,1,
ChIJfwwoMyA50i0RCDmbe0VwwEE,NAKANA EATERY,-8.6063513,115.1476018,"94VX+F25, Jl. Raya Munggu-Kapal, Munggu, Kec. Mengwi, Kabupaten Badung, Bali 80351, Indonesia",https://maps.google.com/?cid=4737910251722586376,OPERATIONAL,+62 812-1258-7134,restaurant,"restaurant, food",4.9,7,
ChIJ1VXrXfY50i0RofhdiH9nVRI,Alfaro pot garden,-8.604964,115.15389429999999,"95W3+2H6, Buduk, Mengwi, Badung Regency, Bali, Indonesia",https://maps.google.com/?cid=1321075863149476001,OPERATIONAL,,park,park,4,1,
ChIJjdmlpnQ50i0RA9bACWSxBEU,Warung Pak Bayu,-8.6035396,115.14656649999999,"Gang taman utama No.3, Cepaka, Kec. Kediri, Kabupaten Tabanan, Bali 80351, Indonesia",https://maps.google.com/?cid=4973294931742348803,OPERATIONAL,+62 823-3978-4379,restaurant,"restaurant, food",3,2,
ChIJy-6HbQY50i0RrrT1sJBfW50,Warung Bucun Carik,-8.6060787,115.15295619999999,"95V3+H58, Jl. Penganyutan, Buduk, Kec. Mengwi, Kabupaten Badung, Bali 80351, Indonesia",https://maps.google.com/?cid=11338761561884177582,OPERATIONAL,+62 881-4688-740,brunch_restaurant,"brunch_restaurant, restaurant, food",,,
ChIJY5V3arw50i0RtDXlYMyTUag,Angkringan Padi Padi,-8.6060377,115.1480285,"Jl. Raya Munggu-Kapal No.27, Cepaka, Kec. Kediri, Kabupaten Tabanan, Bali 80351, Indonesia",https://maps.google.com/?cid=12128637777493702068,OPERATIONAL,,restaurant,"restaurant, food",,,
ChIJWwB2ZQQ50i0R8qWrzTSMja0,Wr. Buk Juna,-8.6082968,115.1496845,"94RX+MVM, Jl. Raya Tumbakbayuh - Pererenan, Tumbak Bayuh, Kec. Mengwi, Kabupaten Badung, Bali 80351, Indonesia",https://maps.google.com/?cid=12505805898694501874,OPERATIONAL,,restaurant,"restaurant, food",5,3,
ChIJSeEzxts50i0RVEnwn38MdHs,Depot toska,-8.606433899999999,115.1495571,"Jl. Raya Munggu-Kapal, Cepaka, Kec. Kediri, Kabupaten Badung, Bali 80351, Indonesia",https://maps.google.com/?cid=8895748906247276884,OPERATIONAL,+62 853-3369-3020,restaurant,"restaurant, food",5,5,
